56107621,Cozy room in South Williamsburg BK,16365272656,unconfirmed,D M,Brooklyn,Williamsburg,40.708090000000006,-73.9519,United States,US,True,moderate,Private room,2003,$783 ,$157 ,2,117.0,6/18/2019,3.71,5.0,2.0,35,"The building is very quiet, so please be respectful to my neighbors.  Please do not leave dishes in the sink or dishwasher. Please leave the apartment as you found it. No parties, pets or smoking please. :)",
56108173,Cozy studio in Chelsea for one or two travellers,18940717161,verified,Harry,Manhattan,Chelsea,40.741240000000005,-74.00025,United States,US,True,moderate,Entire home/apt,2013,$555 ,$111 ,6,1.0,11/21/2016,0.03,2.0,1.0,0,,
56108725,Summer 2019 Modern 2 Bedroom Flat New York City,20331224224,unconfirmed,Will & Kim,Brooklyn,Sheepshead Bay,40.60396,-73.95761,United States,US,False,flexible,Entire home/apt,2003,$284 ,$57 ,3,98.0,7/1/2019,3.11,5.0,1.0,79,NO Smoking.,
56109278,Lovely Bright Upper East Side,2656123209,verified,Dorothy,Manhattan,East Harlem,40.786970000000004,-73.94469000000001,United States,US,True,strict,Private room,2005,"$1,000 ",$200 ,2,90.0,5/12/2019,2.79,5.0,3.0,92,,
56109830,"beautiful artistic 1 bdrm in Park Slope, Brooklyn",47149867608,verified,Misha,Brooklyn,Park Slope,40.67358,-73.97171,United States,US,False,moderate,Entire home/apt,2006,"$1,128 ",$226 ,7,1.0,1/4/2017,0.03,4.0,1.0,0,,
56110382,Private modern suite in tree lined Windsor Terrace,62738908382,verified,Elizabeth,Brooklyn,Windsor Terrace,40.651309999999995,-73.97865999999999,United States,US,False,strict,Private room,2004,$149 ,$30 ,2,89.0,6/23/2019,2.78,3.0,1.0,310,,
56110935,"Spacious, Great Location, Garden, 1 stop to City.",32598459732,unconfirmed,Timothy,Brooklyn,Boerum Hill,40.68326,-73.98004,United States,US,False,moderate,Entire home/apt,2015,$862 ,$172 ,4,83.0,6/23/2019,2.82,3.0,1.0,254,No Smoking.  No Pets.,
56111487,Room in charming new apartment,54509605454,verified,Gabriela,Brooklyn,Bedford-Stuyvesant,40.67989,-73.94298,United States,US,False,strict,Private room,2020,$731 ,$146 ,2,16.0,1/1/2019,0.52,3.0,1.0,311,,
56112039,Beautiful Brownstone in Boerum Hill,7183902442,unconfirmed,Thomas,Brooklyn,Boerum Hill,40.68501,-73.98581,United States,US,False,flexible,Entire home/apt,2021,"$1,165 ",$233 ,3,16.0,6/9/2019,0.52,1.0,1.0,33,"No smoking, no pets. Otherwise, nothing in particular, please treat the other occupants and the apartment with respect.",
56112592,"NYMT21-6 LUXURY! 1 bedroom,Cozy,Gym,doorman Ap-2",49319810498,verified,Laura,Manhattan,Hell's Kitchen,40.76383,-73.98947,United States,US,False,flexible,Entire home/apt,2005,"$1,162 ",$232 ,45,17.0,5/9/2019,0.54,4.0,12.0,281,"Please, no alcohol on the premises. Also please don't be too loud at night.",
56113144,"NYMT03-1 Luxury! 1 bedroom apt,Cozy,Gym,Rooftop 3",1642509799,unconfirmed,Laura,Manhattan,Hell's Kitchen,40.76399,-73.98971,United States,US,True,flexible,Entire home/apt,2007,"$1,028 ",$206 ,45,16.0,5/10/2019,0.52,4.0,12.0,345,"House rules: Guests agree to the following terms and conditions 1.Guest(s) agree to NO PARTIES anywhere on the property. Legal action will be taken for parties that cause damages to the unit, property, reputation, or relationship with building staff or other residents.  2.Smoking of any kind is not permitted in the unit or on the premises.  3.Guests agree to abide by maximum occupancy of unit, and observe quiet hours between 9pm and 9am 4.Guests are responsible for action of ALL GUESTS occupying their unit at all times.  5.Guests agree to return all keys, remotes, and parking passes. Replacement fees may apply for unreturned items 6.Guests understand that onsite building staff (maintenance and concierge) are not affiliated with Jordan or AIRBNB. Please contact me directly for any needed items. 7.Guests understand that no pets are to be in the unit.  8.Guests agree to pay replacement cost for any unreturned items, and $125 per hour fee for unauthorized early checkin or late checkout.  14",
56113696,Large Cozy Bedroom in Manhattan,90967658980,unconfirmed,Lindsay,Manhattan,Washington Heights,40.83837,-73.94224,United States,US,True,moderate,Private room,2016,$75 ,$15 ,1,2.0,5/23/2018,0.06,1.0,1.0,0,"NO SMOKING, the building is a smoke free building. There is a separated area in front of the building for smokers. No use of flames in the apartment. Microwave only use in the kitchen  No outside guests at any time.",
56114248,Inviting One Bedroom Apt in Prospect Heights,924780449,verified,Catherine,Brooklyn,Prospect Heights,40.67821,-73.96588,United States,US,True,moderate,Entire home/apt,2006,$208 ,$42 ,30,6.0,1/31/2019,0.23,2.0,3.0,55,No Smoking,
56114801,Private Room in a 3 Bedroom Apartment!,4574618317,unconfirmed,Rohan,Brooklyn,Bedford-Stuyvesant,40.68697,-73.92271,United States,US,True,moderate,Private room,2022,$784 ,$157 ,2,0.0,,,3.0,1.0,0,"House rules: Guests agree to the following terms and conditions 1.Guest(s) agree to NO PARTIES anywhere on the property. Legal action will be taken for parties that cause damages to the unit, property, reputation, or relationship with building staff or other residents.  2.Smoking of any kind is not permitted in the unit or on the premises.  3.Guests agree to abide by maximum occupancy of unit, and observe quiet hours between 9pm and 9am 4.Guests are responsible for action of ALL GUESTS occupying their unit at all times.  5.Guests agree to return all keys, remotes, and parking passes. Replacement fees may apply for unreturned items 6.Guests understand that onsite building staff (maintenance and concierge) are not affiliated with Jordan or AIRBNB. Please contact me directly for any needed items. 7.Guests understand that no pets are to be in the unit.  8.Guests agree to pay replacement cost for any unreturned items, and $125 per hour fee for unauthorized early checkin or late checkout.  9",
56115353,Bedstuy Brooklyn Huge Bed Room with Two Windows,34348543194,verified,Juan Carlos,Brooklyn,Bedford-Stuyvesant,40.68541,-73.95224,United States,US,True,strict,Private room,2011,$509 ,$102 ,1,1.0,6/30/2019,1.0,3.0,1.0,350,"House rules: Guests agree to the following terms and conditions 1.Guest(s) agree to NO PARTIES anywhere on the property. Legal action will be taken for parties that cause damages to the unit, property, reputation, or relationship with building staff or other residents.  2.Smoking of any kind is not permitted in the unit or on the premises.  3.Guests agree to abide by maximum occupancy of unit, and observe quiet hours between 9pm and 9am 4.Guests are responsible for action of ALL GUESTS occupying their unit at all times.  5.Guests agree to return all keys, remotes, and parking passes. Replacement fees may apply for unreturned items 6.Guests understand that onsite building staff (maintenance and concierge) are not affiliated with Jordan or AIRBNB. Please contact me directly for any needed items. 7.Guests understand that no pets are to be in the unit.  8.Guests agree to pay replacement cost for any unreturned items, and $125 per hour fee for unauthorized early checkin or late checkout.  9",
56115905,Two BDRM Perfect CHTWN Manhattan!,8081392771,verified,Karline,Manhattan,Two Bridges,40.71165,-73.9993,United States,US,True,moderate,Entire home/apt,2003,$351 ,$70 ,1,59.0,4/20/2019,1.82,5.0,1.0,88,#NAME?,
56116458,Dream Room in Modern Apartment,22197472550,verified,Gabriela,Brooklyn,Bedford-Stuyvesant,40.694,-73.94675,United States,US,True,strict,Private room,2010,$440 ,$88 ,1,166.0,6/22/2019,5.09,5.0,2.0,0,No Smoking,
56117010,1889 Brooklyn Firehouse Apt. Clinton Hill-BedStuy,9380941914,verified,Luke,Brooklyn,Bedford-Stuyvesant,40.69395,-73.95934,United States,US,True,flexible,Entire home/apt,2010,$977 ,$195 ,2,149.0,6/28/2019,4.6,3.0,1.0,1,"No Smoking, Pets are allowed with additional pet fee.",
56117562,Classic NYC House - Large 3-Bed 2-Bath Apartment,6188123513,unconfirmed,Alexandra,Queens,Sunnyside,40.74075,-73.92619,United States,US,True,strict,Entire home/apt,2017,$264 ,$53 ,3,143.0,6/23/2019,4.43,2.0,1.0,3,,
56118115,Private Room in Bright Roomy 3br Brooklyn Apart.,20662901130,verified,Eric,Brooklyn,Kensington,40.6378,-73.9696,United States,US,True,flexible,Private room,2004,$626 ,$125 ,4,7.0,5/27/2019,0.22,4.0,1.0,0,"Smoke free building. Please, never ever smoke inside the apartment. No guests Allowed, no exception. Microwave use in the kitchen.",
56118667,Cozy easy village apartment in central location,97005740500,verified,Isabel,Manhattan,East Village,40.72868,-73.99036,United States,US,False,moderate,Private room,2005,"$1,047 ",$209 ,4,1.0,11/28/2016,0.03,2.0,1.0,0,"Please remember that this is a residential building. The building rules, apartment occupancy restrictions and the year-round tenants must be respected.",
56119219,"Sun-drenched apartment, 20 mins to Manhattan",43342618531,verified,George,Brooklyn,Bedford-Stuyvesant,40.688990000000004,-73.95555,United States,US,True,flexible,Private room,2014,$401 ,$80 ,28,0.0,,,2.0,1.0,0,#NAME?,
56119771,"Sixth Ave Chelsea, 1bd Serviced Apartment*",9014628848,unconfirmed,Ken,Manhattan,Chelsea,40.74584,-73.99103000000001,United States,US,False,flexible,Entire home/apt,2013,$880 ,$176 ,30,3.0,3/8/2019,0.12,4.0,87.0,364,,
56120324,Sleeps 6! 2 beds/2 ba Manhattan  1300 sq feet huge,43174099392,verified,Lee,Manhattan,Financial District,40.70966,-74.00761999999999,United States,US,True,flexible,Entire home/apt,2015,"$1,084 ",$217 ,29,0.0,,,5.0,1.0,283,"Please remember that this is a residential building. The building rules, apartment occupancy restrictions and the year-round tenants must be respected.  Parties, pets and smoking are not allowed under any circumstances and incur significant fees. ",
56120876,"Spacious 2 BR Clinton Hill Apartment-Brooklyn, NY",38626206351,unconfirmed,Edna + Isaiah,Brooklyn,Crown Heights,40.67923,-73.96285999999999,United States,US,False,strict,Entire home/apt,2003,$823 ,$165 ,1,216.0,6/30/2019,6.64,2.0,1.0,257,"Please remember that this is a residential building. The building rules, apartment occupancy restrictions and the year-round tenants must be respected.",
56121428,Harrigan Luxury Townhouse Suite,97142017882,verified,Marie,Brooklyn,East New York,40.6724,-73.88839,United States,US,False,strict,Private room,2007,$306 ,$61 ,3,8.0,5/6/2019,0.26,5.0,2.0,80,,
56121981,Entire Floor in Great Location & beautiful Garden,69526789706,verified,Iwona,Brooklyn,South Slope,40.66132,-73.98678000000001,United States,US,True,moderate,Entire home/apt,2008,$831 ,$166 ,5,5.0,1/3/2019,0.16,3.0,1.0,0,,
56122533,Huge room near Manhattan w/ balcony & free pickup!,84705645132,verified,Jared,Queens,Sunnyside,40.74481,-73.91671,United States,US,True,moderate,Private room,2019,$363 ,$73 ,1,3.0,7/20/2018,0.12,5.0,4.0,365,,
56123085,"Cozy 1 Bedroom in Brooklyn, near park and shops",31647612533,verified,Maureen,Brooklyn,Crown Heights,40.67143,-73.92971,United States,US,False,strict,Entire home/apt,2006,$462 ,$92 ,30,7.0,1/6/2019,0.22,5.0,1.0,311,,
56123638,1 bedroom and office room or 2 beds,63705549019,verified,Heather,Brooklyn,Bushwick,40.70165,-73.92938000000001,United States,US,True,moderate,Private room,2016,$440 ,$88 ,7,0.0,,,1.0,2.0,89,,
56124190,Beautiful Room in Modern Apartment,68259063943,verified,Gabriela,Brooklyn,Bedford-Stuyvesant,40.69413,-73.94481,United States,US,True,strict,Private room,2020,$98 ,$20 ,1,153.0,6/23/2019,4.72,3.0,2.0,0,,
56124742,Bright 1 bedroom apartment in the Village,41456997883,unconfirmed,Pierre,Manhattan,East Village,40.72891,-73.98796999999999,United States,US,True,flexible,Entire home/apt,2021,$687 ,$137 ,6,46.0,7/6/2019,1.75,4.0,1.0,40,,
56125294,"Subway, Subway, Subway - AAA+ Location!!!",90390181478,unconfirmed,The Wrights,Brooklyn,Williamsburg,40.70006,-73.95388,United States,US,False,moderate,Private room,2014,$808 ,$162 ,2,167.0,6/14/2019,5.14,2.0,3.0,21,,
56125847,Stay in a Private Room Close to Manhattan :),24860235932,unconfirmed,Agnes,Queens,Astoria,40.76982,-73.93500999999999,United States,US,False,flexible,Private room,2017,$596 ,$119 ,4,6.0,6/6/2019,0.28,4.0,1.0,96,,
56126399,Private NYC spot,36878747219,verified,Chris,Manhattan,Stuyvesant Town,40.73167,-73.98146,United States,US,True,moderate,Private room,2016,$945 ,$189 ,1,6.0,5/22/2017,0.19,5.0,1.0,180,,
56126951,Bedroom available in Chic & Modern loft-like apt.,83090186725,verified,Rodney,Manhattan,Lower East Side,40.7208,-73.9819,United States,US,False,moderate,Private room,2004,$561 ,$112 ,5,1.0,12/19/2017,0.05,2.0,1.0,157,,
56127504,Elegant spacious private room,92649423069,unconfirmed,Mike,Queens,Ridgewood,40.70639,-73.90058,United States,US,True,flexible,Private room,2018,$158 ,$32 ,2,13.0,6/13/2017,0.4,1.0,1.0,0,,
56128056,Large 1 Bedroom Three Blocks from Central Park,27278799043,verified,Nathan,Manhattan,Upper West Side,40.793859999999995,-73.97223000000001,United States,US,False,moderate,Private room,2009,$778 ,$156 ,1,111.0,7/1/2019,3.51,1.0,1.0,42,,
56128608,Lovely room,220451294,unconfirmed,Ji,Manhattan,Upper West Side,40.80237,-73.96601,United States,US,True,strict,Private room,2018,$485 ,$97 ,7,1.0,1/5/2017,0.03,2.0,1.0,87,,
56129161,Beautiful Room in Clinton Hill,59091032134,unconfirmed,Laura,Brooklyn,Bedford-Stuyvesant,40.68978,-73.95339,United States,US,True,strict,Private room,2022,$81 ,$16 ,3,0.0,,,2.0,1.0,0,,
56129713,Clean + Private Bedroom in NYC's Lower East Side,26003754648,unconfirmed,Christopher,Manhattan,East Village,40.72025,-73.97901,United States,US,False,strict,Private room,2021,"$1,161 ",$232 ,10,14.0,7/4/2018,0.49,4.0,1.0,7,,
56130265,"Modern, Ambient 1-Bedroom Apartment",14530522613,unconfirmed,Michella,Staten Island,Eltingville,40.541059999999995,-74.14666,United States,US,True,moderate,Entire home/apt,2010,$808 ,$162 ,5,83.0,7/1/2019,2.56,4.0,1.0,291,,
56130817,"Private, Comfortable and Big Room89",47959868620,unconfirmed,Luz Dary,Queens,Jackson Heights,40.75523,-73.88418,United States,US,True,strict,Private room,2016,$908 ,$182 ,1,52.0,7/22/2018,1.61,3.0,1.0,0,,
56131370,"Own Floor in Brooklyn Home, 20 min to Manhattan",77886416675,unconfirmed,Jen And Lev,Brooklyn,Flatbush,40.6459,-73.9642,United States,US,True,flexible,Entire home/apt,2014,$151 ,$30 ,3,64.0,6/24/2019,2.07,1.0,1.0,277,,
56131922,Beautiful Duplex in Historic Park Slope Brownstone,32688748332,verified,Joanna,Brooklyn,Park Slope,40.67427,-73.97652,United States,US,True,moderate,Entire home/apt,2008,$692 ,$138 ,2,22.0,10/21/2018,0.69,2.0,1.0,21,No smoking. Treat it as you would want your apartment to be treated.,
56132474,Noisy room next to Prospect Park,96083142957,verified,Thalith,Brooklyn,Prospect-Lefferts Gardens,40.65762,-73.96129,United States,US,True,strict,Private room,2003,"$1,108 ",$222 ,1,0.0,,,4.0,1.0,89,"Please remember that this is a residential building. The building rules, apartment occupancy restrictions and the year-round tenants must be respected.  Parties, pets and smoking are not allowed under any circumstances and incur significant fees. ",
56133027,Quiet Homestead,27696163789,unconfirmed,Cesar,Brooklyn,Carroll Gardens,40.67844,-74.00028,United States,US,False,flexible,Entire home/apt,2017,$468 ,$94 ,7,1.0,5/12/2018,0.07,4.0,3.0,50,,
56133579,Spacious and peaceful apt in East Village,2540173895,verified,Guisela,Manhattan,East Village,40.73016,-73.98170999999999,United States,US,True,flexible,Entire home/apt,2004,$415 ,$83 ,9,22.0,3/22/2018,0.71,5.0,1.0,0,I expect my guests To make themselves feel at home and at the same time to respect my property and care for it as if it was there own.  Be mindful of neighbors.  Most of the residents have a full time job and is very quiet here.,
56134131,"Cute,comfortable room near Columbia University",68911859473,unconfirmed,Lu,Manhattan,Upper West Side,40.800959999999996,-73.96758,United States,US,True,moderate,Private room,2011,$268 ,$54 ,1,0.0,,,4.0,1.0,0,"Please remember that this is a residential building. The building rules, apartment occupancy restrictions and the year-round tenants must be respected.  Parties, pets and smoking are not allowed under any circumstances and incur significant fees. ",
56134684,Living excellence- deluxe 2 bedroom apt. in NYC!,55402944864,unconfirmed,Kara,Manhattan,Hell's Kitchen,40.766259999999996,-73.98338000000001,United States,US,True,moderate,Entire home/apt,2014,$538 ,$108 ,30,1.0,1/21/2018,0.06,2.0,121.0,345,"Thank you for your reservation. By placing your reservation online you indicated that you accepted the terms and conditions which have been printed below.  Please review your reservation summary as below - then print, sign and return the agreement to:  (EMAIL HIDDEN) or fax it to (PHONE NUMBER HIDDEN) or  mail it to: Spare Suite, Inc., 119 Braintree Street, Suite 510, Boston, MA 02134, USA Upon receipt, we will send you the welcome document with check in instructions and how to get your keys. ------------------------------------------------------------------------ ------------------------------------------------------------------------ Terms of the Agreement: BOOKING AND REFUND POLICY Once booked your reservation is guaranteed for the check in and check out times and dates specified. All reservations must be paid in advance, in full for the entire period of stay.  All reservations are final, and NON REFUNDABLE UNDER ANY CIRCUMSTANCES.  If you feel you may need to cancel once booked, yo",
56135236,Master bedroom/20min Manhattan/individual bathroom,62112994697,verified,Yuxi,Queens,Woodside,40.742459999999994,-73.90125,United States,US,False,moderate,Private room,2006,$937 ,$187 ,1,7.0,5/27/2017,0.23,2.0,1.0,0,"NO SMOKING, NO PETS Check-in after noon and before 7pm. $50 fee if check-in after 7pm. No check-ins after midnight. Check-out 11am $1000 refundable security deposit, $100 move-in fee charged by the building and $100 cleaning fee.",
56135788,Boerum Hill Charming Studio,38099444692,verified,Masoud,Brooklyn,Boerum Hill,40.68898,-73.98751,United States,US,True,flexible,Entire home/apt,2015,$785 ,$157 ,2,127.0,6/30/2019,3.9,5.0,1.0,270,No smoking (strict) Please don't place garbage outside Use righthand side of roof deck only,
56136340,Private Master BR/Bath - 15 Minutes to Manhattan,30233560779,verified,Ian,Brooklyn,Williamsburg,40.71805,-73.94088,United States,US,False,flexible,Private room,2019,$817 ,$163 ,4,0.0,,,3.0,1.0,0,No smoking in the apartment please.,
56136893,One Bedroom in Heart of LES,5080683749,verified,Stefany,Manhattan,Lower East Side,40.71853,-73.98911,United States,US,True,flexible,Private room,2009,$867 ,$173 ,5,0.0,,,1.0,1.0,0,"House Manual: - No smoking, drugs or drinking alcohol/wine in the apartment  - Fireplaces are decorative NEVER to be used - Clean up after yourselves - Do not leave your dirty dishes in the sink to be cleaned.  Rinse them and run the dishwasher and put them back where they belong.   - If you bring food into the house, do not leave it out or in the refrigerator when you leave.  Please throw it away before you leave. Take garbage out. - The decorative curtains in the living room and kitchen are not to be touched. They are there for decoration only.  You can not close them.  - The shade over the window to the right in the bedroom should never be touched as well.  The vines cover that window and no one can see in.   - Feed the cat wet cat food in the evening - Take out your garbage on the trash days (Monday and Friday) - If you break it, then you pay to replace it - No loud noises - Keep the apartment clean and leave it as nice as you found it with clean sheets, comforter and pillow cases.",
56137445,Spacious 1 Bedroom in Bushwick,82732858307,verified,Meg,Brooklyn,Bedford-Stuyvesant,40.68631,-73.92629000000001,United States,US,True,flexible,Private room,2005,$454 ,$91 ,2,0.0,,,5.0,1.0,0,,
56137997,Fantastic Master Bedroom,55783816997,verified,Ryan,Brooklyn,Prospect-Lefferts Gardens,40.65678,-73.95154000000001,United States,US,False,flexible,Private room,2011,$675 ,$135 ,2,5.0,3/24/2019,0.16,2.0,1.0,364,,
56138550,Cute and comfortable niece room with a balcony.,26768632623,unconfirmed,Alida,Queens,Maspeth,40.73529,-73.90219,United States,US,False,strict,Private room,2006,$790 ,$158 ,4,0.0,,,3.0,3.0,0,,
56139102,PRIVATE ROOM CLOSE TO THE CITY AND JFK  AIRPORT.,60439970412,unconfirmed,Maria,Queens,Woodhaven,40.688190000000006,-73.86079000000001,United States,US,False,flexible,Private room,2004,$906 ,$181 ,4,22.0,7/1/2019,0.68,5.0,2.0,266,,
56139654,LADIES ONLY! Privacy in a shared space :),15226263805,unconfirmed,J,Brooklyn,Bushwick,40.69382,-73.90925,United States,US,False,flexible,Shared room,2007,$933 ,$187 ,1,117.0,5/23/2019,4.56,2.0,4.0,118,,
56140207,Minimalistic 1 BR in little Italy/ China town,19595354475,verified,Sara,Manhattan,Chinatown,40.7152,-73.99947,United States,US,True,strict,Entire home/apt,2015,$500 ,$100 ,6,39.0,5/25/2019,1.31,3.0,1.0,351,"PLEASE READ ALL HOUSE RULES TRASH can only go out  BEFORE  8 AM or the night before trash days ONLY.  Trash days are Monday and Friday ONLY.  Trash must only be placed outside in a black or white trash bag.  Recycling can be placed outside on Fridays in a clear bag or in a box.  DO NOT PUT OUT TRASH ANY OTHER DAYS!  A $100 fine will occur if you put trash out early.  DO NOT have any mail or packages shipped to you while you are staying. Please realize that you are in an apartment and need to be very considerate of the people who live in the units around you.  Beacon Hill is a quiet, professional neighborhood with working people.  Please respect that they do not appreciate loud neighbors. Keep the noise level to a minimum. Do NOT play loud music.  Try not to make too much noise after 10pm, and please do not bring any other guests who are not on the reservation back to the apartment unless you truly trust them.  We realize we cannot stop people from bringing back a ""friend"" but remember ",
56140759,Luxury immaculate 2 BR apartment Prime Brooklyn,22180298249,unconfirmed,Kylie,Brooklyn,Gowanus,40.67876,-73.9904,United States,US,False,strict,Entire home/apt,2013,$575 ,$115 ,5,40.0,6/12/2019,1.32,3.0,1.0,70,,
56141311,Cute Two Bed - East Village,91740318527,verified,Rachel,Manhattan,East Village,40.72461,-73.98172,United States,US,False,strict,Private room,2020,$285 ,$57 ,2,37.0,5/26/2019,1.2,3.0,1.0,6,,
56141863,Ground Floor apt with Backyard @Lower East Side,2656449359,verified,Ha,Manhattan,Lower East Side,40.71248,-73.98662,United States,US,False,flexible,Entire home/apt,2010,$283 ,$57 ,1,73.0,6/16/2019,2.38,5.0,4.0,229,- Quiet neighborhood so remember to be respectful!,
56142416,big cozy room in Bed-Stuy with separate entrance,84775241637,unconfirmed,William,Brooklyn,Bedford-Stuyvesant,40.68186,-73.92173000000001,United States,US,False,moderate,Private room,2009,"$1,012 ",$202 ,2,0.0,,,1.0,1.0,0,"Please arrange arrival ahead, late arrival will be handled through our ""key service"" by cal(PHONE NUMBER HIDDEN), they will meet you at the door with room keys/instructions, the address is 29 Hancock Street, Beacon Hill 02114. We expect guests to come and go quietly, we require ID to be emailed prior to arrival to (EMAIL HIDDEN) the building is ""smoke free"", please refrain from smoking indoors.",
56142968,Spacious & Cozy Bushwick Walk-up 3mins from Train,85940039405,verified,Chérie,Brooklyn,Bushwick,40.68844,-73.90531,United States,US,False,moderate,Private room,2007,$823 ,$165 ,1,74.0,6/24/2019,2.42,5.0,3.0,53,,
56143520,Cozy Quiet Room in the Big Apple on Broadway!!!,11115700463,verified,Mark & Will,Manhattan,Harlem,40.82914,-73.94736,United States,US,False,strict,Private room,2012,$359 ,$72 ,4,153.0,7/1/2019,4.74,2.0,2.0,125,,
56144073,Massive Brooklyn Brick 2 Floor Oasis,11863620832,unconfirmed,Austin,Brooklyn,Fort Greene,40.68718,-73.97289,United States,US,True,flexible,Entire home/apt,2009,$552 ,$110 ,2,2.0,7/3/2019,2.0,2.0,1.0,15,,
56144625,Private room in Red Hook Artist House,70881466610,unconfirmed,Lynn,Brooklyn,Red Hook,40.67749,-74.00761,United States,US,True,moderate,Private room,2010,"$1,002 ",$200 ,5,6.0,11/1/2018,0.19,2.0,1.0,0,"1. Strict no smoking policy 2. No open flames 3. I am willing to negotiate pets, however, there will be an additional $25 fee",
56145177,Modern brand new apartment in NYC!,96108556649,unconfirmed,Haley,Manhattan,Murray Hill,40.74686,-73.97514,United States,US,True,moderate,Entire home/apt,2012,$307 ,$61 ,1,17.0,6/8/2019,0.54,5.0,2.0,364,,
56145730,Sunny and spacious  1-bedroom in Brooklyn,78340310462,verified,Jamie,Brooklyn,Fort Greene,40.6967,-73.97476999999999,United States,US,False,flexible,Private room,2008,$550 ,$110 ,1,53.0,6/1/2018,2.15,3.0,1.0,0,Please respect and take care of this lovely space. :),
56146282,"Beautiful Garden Townhouse Apt, Close to Parks.",76814190383,unconfirmed,Matthew,Queens,Kew Gardens Hills,40.72712,-73.8308,United States,US,True,flexible,Entire home/apt,2012,$377 ,$75 ,3,4.0,3/18/2018,0.12,3.0,1.0,1,,
56146834,Sweet two bedroom in Crown Heights Bk,51445119655,unconfirmed,Maura,Brooklyn,Crown Heights,40.67034,-73.93902,United States,US,False,moderate,Entire home/apt,2012,$271 ,$54 ,1,9.0,1/21/2019,0.3,4.0,3.0,0,"This is a very quiet building.  In addition to this studio there are several other apartments besides my living space.  We are all very quiet.  And of course, no smoking or burning of scented candles.",
56147386,Charming 2BR--20 min to Manhattan,95854274824,verified,Dorion,Brooklyn,Bushwick,40.68442,-73.9083,United States,US,False,flexible,Entire home/apt,2014,$453 ,$91 ,3,126.0,7/3/2019,3.93,2.0,1.0,46,,
