id,NAME,host id,host_identity_verified,host name,neighbourhood group,neighbourhood,lat,long,country,country code,instant_bookable,cancellation_policy,room type,Construction year,price,service fee,minimum nights,number of reviews,last review,reviews per month,review rate number,calculated host listings count,availability 365,house_rules,license
4812206,1 bd Artist Retreat in Brooklyn,79808798100,verified,Alanna,Brooklyn,Bedford-Stuyvesant,40.67917,-73.92565,United States,US,True,strict,Private room,2019,$124 ,$25 ,2,16.0,9/30/2017,0.37,2,1,14,"Quiet and clean Responsible person No bad habits Just don't steal or break anything and we are good. I would also advise not to play extremely loud music after 9pm because my roommate gets mad.  Moderately loud should be ok. -Please do not drink the alcohol and don't eat the food in the bedroom, although you are welcome to use all of the appliances including the Keurig. This is our home when we are not traveling, respect it as your own. -Strictly no smoking or parties.",
4812758,Mid Century Modern 2 Bedroom Apt,38882957404,unconfirmed,Jason,Queens,Astoria,40.75782,-73.92128000000001,United States,US,False,flexible,Entire home/apt,2009,$112 ,$22 ,30,15.0,12/4/2018,0.29,5,8,46,,
4813311,Nice studio in Midtown Manhattan,33210658354,verified,Zahid,Manhattan,Midtown,40.75462,-73.96869000000001,United States,US,True,flexible,Entire home/apt,2011,$247 ,$49 ,2,168.0,6/16/2019,3.1,5,1,-9,,
4813863,Big & bright 2 bedroom apartment! Lower East Side!,42520309004,unconfirmed,Dominik,Manhattan,Lower East Side,40.71763,-73.98359,United States,US,True,moderate,Entire home/apt,2009,$311 ,$62 ,1,17.0,7/7/2019,0.36,3,3,425,"House Rules 1. Check-in is 4 pm local time. If the unit is ready earlier, we’ll let you know. Check-out is normally 11 am local time, but we’d be happy to extend it as long as we don’t have a cleaning scheduled. Just let us know.  2. All bookings require a security deposit of at least $300, which will be refunded within 7 days of your check-out. 3. For security measures we require all guests to provide proof of identification through ID verification on our own website. In order to check in we'll need a photo of your ID.  4. Our cancellation policy is as shown on our ad and defined by the site you are booking through.  5. Don’t let $300 go up in smoke. There's no smoking allowed in any Flatbook and a $300 fine for breaking this rule.  6. Unfortunately we don’t allow pets in any of our apartments. 7. Unless you’re staying in one of our specialty apartments, we don’t allow parties or excessive noise. 8. If we find the place very messy, we have to charge an extra $40 for every extra hour o",
4814415,PenthousPrivate room & bath w roof,45653074650,unconfirmed,Gary,Brooklyn,Bedford-Stuyvesant,40.69147,-73.94113,United States,US,False,moderate,Private room,2020,$595 ,$119 ,4,180.0,6/17/2019,3.37,5,1,288,Keep the apartment clean,
4814968,Big & bright apt in Harlem!,84616856510,verified,Joel,Manhattan,Harlem,40.81831,-73.93833000000001,United States,US,False,flexible,Entire home/apt,2005,$285 ,$57 ,30,5.0,7/31/2017,0.11,2,1,374,,
4815520,Cozy Apt.Near Park/Museums & Subway,56665937739,unconfirmed,Christopher,Manhattan,Upper East Side,40.78096,-73.9475,United States,US,False,moderate,Entire home/apt,2011,$398 ,$80 ,4,9.0,10/27/2015,0.19,3,1,55,"House Rules 1. Check-in is 4 pm local time. If the unit is ready earlier, we’ll let you know. Check-out is normally 11 am local time, but we’d be happy to extend it as long as we don’t have a cleaning scheduled. Just let us know.  2. All bookings require a security deposit of at least $300, which will be refunded within 7 days of your check-out. 3. For security measures we require all guests to provide proof of identification through ID verification on our own website. In order to check in we'll need a photo of your ID.  4. Our cancellation policy is as shown on our ad and defined by the site you are booking through.  5. Don’t let $300 go up in smoke. There's no smoking allowed in any Flatbook and a $300 fine for breaking this rule.  6. Unfortunately we don’t allow pets in any of our apartments. 7. Unless you’re staying in one of our specialty apartments, we don’t allow parties or excessive noise. 8. If we find the place very messy, we have to charge an extra $40 for every extra hour o",
4816072,Perfectly Located Brooklyn Studio,73687854108,verified,Alexandra,Brooklyn,Prospect Heights,40.67273,-73.96361,United States,US,False,strict,Entire home/apt,2022,$505 ,$101 ,2,34.0,12/26/2017,0.64,5,1,250,"No Smoking No Loud Parties No Pets Please be respectful of noises especially at night Check-in Time: 4PM Check-out Time: 10AM Please review the guest booklet in the living room of the condo, during your arrive for detailed policy information.",
4816624,A lovely room in heart of NY,68788264825,unconfirmed,Umut&Deniz,Manhattan,Lower East Side,40.72007,-73.98775,United States,US,False,flexible,Private room,2020,$430 ,$86 ,3,36.0,6/18/2019,0.8,1,5,259,We except you to clean up after yourself and generally be respectful. Smoking should happen outside the house. Also please do not tap on the glass terrarium or play with the ball python. It is very timid and mostly wants to sleep.,
4817177,Huge Room  15 min to Grand Central,25553135392,unconfirmed,Michael,Queens,Sunnyside,40.73835,-73.92636,United States,US,True,flexible,Private room,2007,"$1,122 ",$224 ,7,56.0,1/1/2019,1.18,2,2,76,Please take off your shoes at the front door. Pick up your hair after your shower. The kitchen is not shared. You shall speak either English or Chinese.,
4817729,Quirky BrwnStone Studio in Harlem,58663423997,verified,Taylor,Manhattan,Harlem,40.80607,-73.94805,United States,US,False,moderate,Entire home/apt,2012,$633 ,$127 ,1,0.0,,,4,1,307,,
4818281,Beautiful full-service UWS studio,87403319983,verified,Jilly,Manhattan,Upper West Side,40.79432,-73.97636999999999,United States,US,False,moderate,Private room,2003,$755 ,$151 ,10,0.0,,,2,1,46,,
4818834,Stylish Apartment in post-war walk-up Building,41366479628,verified,Vivienne,Manhattan,Lower East Side,40.719590000000004,-73.9919,United States,US,False,strict,Entire home/apt,2006,$171 ,$34 ,2,14.0,9/9/2018,0.28,1,1,220,,
4819386,Open Room for 12 Days this February,3760624470,unconfirmed,Benjamin,Brooklyn,Crown Heights,40.66948,-73.93638,United States,US,True,flexible,Private room,2016,$469 ,$94 ,5,0.0,,,5,1,20,,
4819938,Your Home with View in Greenpoint!,22887511188,verified,Margrethe,Brooklyn,Greenpoint,40.732079999999996,-73.95653,United States,US,False,strict,Entire home/apt,2018,$320 ,$64 ,3,32.0,6/4/2019,0.6,1,1,118,"Thank you for your reservation. By placing your reservation online you indicated that you accepted the terms and conditions which have been printed below.  Please review your reservation summary as below - then print, sign and return the agreement to:  (EMAIL HIDDEN) or fax it to (PHONE NUMBER HIDDEN) or  mail it to: Spare Suite, Inc., 119 Braintree Street, Suite 510, Boston, MA 02134, USA Upon receipt, we will send you the welcome document with check in instructions and how to get your keys. Terms of the Agreement: BOOKING AND REFUND POLICY Once booked your reservation is guaranteed for the check in and check out times and dates specified. All reservations must be paid in advance, in full for the entire period of stay.  All reservations are final, and NON REFUNDABLE UNDER ANY CIRCUMSTANCES.  If you feel you may need to cancel once booked, you may consider trip insurance through AAA or other reputable provider like (URL HIDDEN) POLICY ON CHILDREN: This property is not ""KID FRIENDLY"" al",
4820491,HUGE 1 BED@TIMES SQUARE@BRAND NEW!!,16970628343,unconfirmed,Lior,Manhattan,Hell's Kitchen,40.765370000000004,-73.99438,United States,US,True,moderate,Entire home/apt,2018,$720 ,$144 ,20,5.0,1/17/2017,0.15,1,7,79,I am renting my apartment for the Marathon weekend and you will be a guest in my home. No smoking or pets please.,
4821043,Greenpoint apartment,134952296,verified,Amanda,Brooklyn,Greenpoint,40.720859999999995,-73.94609,United States,US,False,strict,Private room,2005,$362 ,$72 ,1,0.0,,,2,1,354,"When you arrive, my place will be clean, neat, organized & very cozy. All I ask is you leave it the same way upon departing.  Also check out time is 11am & check-in time is 4pm. For those arriving, you may check in early & leave your bags / luggage. I will just need to finish cleaning / setting the place up for you just so before handing the place to you. For those departing: 11am check-out time is strict although you may leave your bags / luggage in the apt if you are doing any last minute sight seeing / activities. Otherwise, enjoy the Allston / Boston area,  a great little neighborhood / city combination.",
4821595,"Quiet Room, Near Columbia University & Subway",30377772511,unconfirmed,James & Shaun,Manhattan,Harlem,40.81561,-73.95264,United States,US,False,moderate,Private room,2008,$430 ,$86 ,1,203.0,6/28/2019,3.89,3,2,248,,
4822147,Amazing Central Park view,88563963394,verified,Andreias,Manhattan,Upper West Side,40.797509999999996,-73.96168,United States,US,True,strict,Private room,2013,$308 ,$62 ,3,176.0,6/21/2019,3.39,5,3,98,"100% no smoking in the condo itself or in the building. This is a non-smoking building. No pets, no parties of more than four, and no additional overnight guests unless as agreed. Please be respectful of our neighbors and keep the noise low at night.",
4822700,Best Location on the UWS!!,10031704623,verified,Sasha,Manhattan,Upper West Side,40.789359999999995,-73.97502,United States,US,False,strict,Private room,2016,$692 ,$138 ,2,171.0,1/14/2018,3.43,3,2,28,"When you arrive, my place will be clean, neat, organized & very cozy. All I ask is you leave it the same way upon departing.  Also check out time is 11am & check-in time is 4pm. For those arriving, you may check in early & leave your bags / luggage. I will just need to finish cleaning / setting the place up for you just so before handing the place to you. For those departing: 11am check-out time is strict although you may leave your bags / luggage in the apt if you are doing any last minute sight seeing / activities. Otherwise, enjoy the Allston / Boston area,  a great little neighborhood / city combination.",
4823252,Sun-Filled Apartment 1 Minute From Subway,60327023206,unconfirmed,Rivka,Brooklyn,Crown Heights,40.66585,-73.94993000000001,United States,US,False,strict,Private room,2015,$346 ,$69 ,1,44.0,6/23/2019,1.26,1,1,340,,
4823804,South Slope Pied-A-Terre Studio,61533933890,verified,Nick,Brooklyn,South Slope,40.66599,-73.9869,United States,US,True,flexible,Entire home/apt,2022,$674 ,$135 ,2,149.0,6/14/2018,2.76,3,1,348,,
4824357,Contemporary & Clean 1 bdrm Apartment(Lower Level),33927537064,verified,Emmanuel,Queens,Bayside,40.7583,-73.77232,United States,US,False,flexible,Entire home/apt,2022,$330 ,$66 ,2,123.0,7/5/2019,4.69,2,1,261,You will see a piece of paper on my kitchen table about my house rules.  No parties please :),
4824909,"Modern, Bright, One Bedroom",68709571326,verified,Solomon,Manhattan,Lower East Side,40.713159999999995,-73.9916,United States,US,False,flexible,Entire home/apt,2011,$635 ,$127 ,3,38.0,6/7/2019,0.81,2,1,384,1) No Smoking in property!!!  2) Do not slam doors!!! Close lightly Please!!! 3) No Shoes in house (except slippers) 4) Quiet down AFTER 10PM.,
4825461,A Romantic Loft plus terrace  Heart of Brooklyn,4872208372,unconfirmed,Amy,Brooklyn,Bedford-Stuyvesant,40.68306,-73.93141,United States,US,True,strict,Entire home/apt,2013,"$1,096 ",$219 ,2,222.0,6/26/2019,4.15,2,4,384,,
4826014,Beautiful Central Park View,83812869854,verified,Andreias,Manhattan,Upper West Side,40.7962,-73.96155999999999,United States,US,True,moderate,Private room,2017,$627 ,$125 ,1,277.0,6/23/2019,5.44,2,3,205,,
4826566,Huge Bright 1BR+Office in Downtown Manhattan NYC!,28506802368,unconfirmed,Sameer,Manhattan,Lower East Side,40.720909999999996,-73.98475,United States,US,True,moderate,Entire home/apt,2013,$659 ,$132 ,3,57.0,6/23/2019,1.12,3,1,45,,
4827118,East Village Floor Thru plus Garden,12104928944,unconfirmed,Michael,Manhattan,East Village,40.72251,-73.97677,United States,US,False,strict,Entire home/apt,2021,$308 ,$62 ,100,5.0,1/2/2019,0.1,5,19,18,,
4827670,"DOMINIQUE'S  NYC  cosy,2 bedrm crashPad*Stay here*",58906940688,verified,Vie,Bronx,Eastchester,40.87829,-73.83471,United States,US,True,moderate,Entire home/apt,2022,$523 ,$105 ,2,11.0,5/19/2019,0.29,2,13,-5,,
4828223,Dominiq's NY cosy 3bedrm crashpad*metro*wifi*$$ale,40144453592,verified,Vie,Bronx,Eastchester,40.88017,-73.83484,United States,US,False,moderate,Entire home/apt,2006,$408 ,$82 ,1,15.0,6/2/2019,1.08,1,13,351,"- Non-smoker only - Cologne/perfumed sprays not allowed - Cat in the house - Do not share mailing address with anyone, and if you do it, you will pay $200 - Please take off street shoes and place them on the rack - Slippers can be provided but please bring your own if you can - Recycle all trash, we will help you to understand it - Food may not be left in your room - No eating in bed - No disturbance: please walk slowly when using stairs and very softly close all doors",
4828775,Stylish and cozy SOHO loft bedroom,83293931156,verified,Alix,Manhattan,SoHo,40.72101,-74.00189,United States,US,False,strict,Private room,2004,"$1,034 ",$207 ,1,9.0,12/16/2016,0.17,2,1,380,#NAME?,
4829327,cozy room 5 minutes to manhattan,29059723340,unconfirmed,Mizo,Queens,Long Island City,40.75202,-73.93588000000001,United States,US,False,strict,Shared room,2006,$964 ,$193 ,4,1.0,10/16/2018,0.11,4,2,384,No smoking and no party allowed. We don't want the neighbor to complain.,
4829880,Funky Union Square Apartment,57150788268,verified,Chris,Manhattan,Gramercy,40.73721,-73.98886999999999,United States,US,False,moderate,Entire home/apt,2016,$689 ,$138 ,3,4.0,1/3/2017,0.08,4,1,340,,
4830432,"Bronx, 1Bdrm in 3Bdrm Apt.",60946619479,verified,Cindy,Bronx,Morris Park,40.85465,-73.85669,United States,US,False,flexible,Private room,2010,$83 ,$17 ,1,2.0,2/23/2015,0.04,3,1,325,"No smoking inside the house.  No loud parties or disturbing the peace or public nuisance allowed. This is a strictly residential rental NOT commercial.  If holding parties you must first seek owner's permission before inviting anyone other than immediate family.   This is a peaceful family neighborhood and I like to keep it that way.  Clean after yourself, clean the stove and oven and all the appliances.  Leave everything exactly in the condition it is in when you first arrived.  Treat this house as if it is your own with the proper respect and courtesy.  No pets allowed.  Check in is 4PM, Check out 10AM.  On Check out date please leave all the dirty sheets, towels, linens by the washer for the maid.  Please leave the outside trash container for the garbage truck on the night before it arrives.",
4830984,Beautiful One Bedroom Apartment,69855434659,verified,Cindy,Manhattan,Hell's Kitchen,40.7666,-73.98475,United States,US,False,strict,Entire home/apt,2017,$375 ,$75 ,1,0.0,,,5,1,294,"Non-smoker, no smoking in/out of home No cologne/perfume/sprays. Scent-free house Microwave for light use (not cooking) Respect quiet environment No visitors at any time, one room per person Remove outdoor shoes by the entrance inside, slippers available if you need Ask permission before giving this address to anyone Mailing address may only be used only for personal post (family, friends) No bank, no school, no memberships of any kind, no subscriptions If you break this rule, first charge is $200, and after that,  Each commercial letter that arrives after you depart will be charged $5 life time",
4831537,private room avail in lovely BK apt,13863651703,verified,Fen,Brooklyn,Bushwick,40.70516,-73.91609,United States,US,False,flexible,Private room,2015,$960 ,$192 ,1,0.0,,,5,1,368,,
4832089,Private Cozy Bright Brooklyn Studio,34434709635,verified,Leecia,Brooklyn,Bedford-Stuyvesant,40.68045,-73.93796,United States,US,True,flexible,Entire home/apt,2011,$523 ,$105 ,3,51.0,7/2/2019,1.19,4,2,38,,
4832641,Room in Jackson Heights (Queens),27564029919,unconfirmed,Jorge,Queens,East Elmhurst,40.75703,-73.87666999999999,United States,US,False,strict,Private room,2013,$175 ,$35 ,7,30.0,4/14/2019,0.56,5,1,137,1) No Smoking in property!!!  2) Do not slam doors!!! Close lightly Please!!! 3) No Shoes in house (except slippers) 4) Quiet down AFTER 10PM.,
4833193,Hostal : FULL SIZE BUNK BED ( Bottom on floor),84152665277,unconfirmed,Fernando,Queens,Forest Hills,40.71543,-73.83564,United States,US,False,strict,Shared room,2007,$161 ,$32 ,4,45.0,4/12/2019,0.87,3,5,380,,
4833746,GREAT ROOM IN  HELL'SKITCHEN!!,54279085047,verified,Anthony,Manhattan,Hell's Kitchen,40.76543,-73.99154,United States,US,False,flexible,Private room,2022,$74 ,$15 ,4,117.0,6/28/2019,2.44,2,2,0,,
4834298,Canal Street bedroom,37137662528,verified,Jimmy,Manhattan,Chinatown,40.71652,-73.99801,United States,US,False,moderate,Private room,2019,$128 ,$26 ,1,0.0,,,5,1,297,#NAME?,
4834850,Sunny Room near Central Park,70959564456,verified,Marco,Manhattan,East Harlem,40.79399,-73.94255,United States,US,True,moderate,Private room,2007,$848 ,$170 ,4,99.0,6/28/2019,2.06,2,2,385,,
4835403,Charming private Studio,56550228899,verified,Tonia,Staten Island,West Brighton,40.631820000000005,-74.124,United States,US,False,flexible,Entire home/apt,2015,$528 ,$106 ,2,196.0,6/21/2019,3.63,5,1,201,,
4835955,a cozy room in manhattan!,60227398378,verified,Umut&Deniz,Manhattan,Lower East Side,40.71904,-73.98962,United States,US,False,flexible,Private room,2010,$590 ,$118 ,2,80.0,6/24/2019,1.49,4,5,286,,
4836507,"Huge artist loft, heart of W'Burg!",68837750462,verified,Leah,Brooklyn,Williamsburg,40.711890000000004,-73.94632,United States,US,False,strict,Private room,2003,$396 ,$79 ,30,3.0,9/29/2015,0.06,2,1,412,,
4837060,Lower East Side Gem,31583963333,verified,Brian,Manhattan,Lower East Side,40.72076,-73.98925,United States,US,True,moderate,Entire home/apt,2005,"$1,022 ",$204 ,1,1.0,1/18/2015,0.02,4,1,9,,
4837612,1bd in fantastic BK location,96635077518,unconfirmed,Justin,Brooklyn,Crown Heights,40.6729,-73.96003,United States,US,False,flexible,Entire home/apt,2015,$133 ,$27 ,2,4.0,4/29/2016,0.08,4,1,320,,
4838164,The Golden Room,77151885412,unconfirmed,Lawrence,Brooklyn,Canarsie,40.64027,-73.91751,United States,US,True,moderate,Private room,2013,$625 ,$125 ,4,33.0,6/11/2019,0.66,2,1,320,,
4838716,CHARMING GARDEN APT IN TOWNHOUSE,86126282064,unconfirmed,Richard,Manhattan,Harlem,40.81007,-73.94006999999999,United States,US,True,flexible,Entire home/apt,2005,$867 ,$173 ,3,52.0,6/24/2019,1.0,3,2,212,"Check in 3pm Check out 12pm (Flexible upon requests.) No smoking, No drug, No party in the house. I don't guarantee parking lot. Sorry",
4839269,Cute and Cozy UWS Studio,11726524379,verified,Lam,Manhattan,Upper West Side,40.781240000000004,-73.98475,United States,US,True,moderate,Entire home/apt,2010,$162 ,$32 ,7,10.0,10/8/2016,0.18,5,1,424,,
4839821,Two Bedroom Apartment,18295159229,unconfirmed,Linden,Queens,Ozone Park,40.67924,-73.84770999999999,United States,US,False,flexible,Entire home/apt,2005,"$1,062 ",$212 ,3,66.0,7/21/2018,1.29,5,1,106,Please do not smoke and be respectful of other guests.,
4840373,Beautiful room in Brooklyn,4704757392,verified,Helida,Brooklyn,Prospect-Lefferts Gardens,40.65833,-73.95196,United States,US,True,flexible,Private room,2017,$263 ,$53 ,1,0.0,,,3,1,48,,
4840926,Comfortable room steps from Central Park,71223899537,unconfirmed,Lucie,Manhattan,Harlem,40.79967,-73.95444,United States,US,True,moderate,Private room,2010,$389 ,$78 ,3,70.0,6/30/2019,1.38,4,1,132,,
4841478,Greenpoint is the place to be!,28782676297,verified,Citlali,Brooklyn,Greenpoint,40.72811,-73.94925,United States,US,True,strict,Private room,2021,$185 ,$37 ,4,1.0,10/28/2015,0.02,4,1,23,"Please treat my place as your own. Turn off the lights, AC, fan, etc when you leave the apartment, and wash any kitchenware and dishes that you've used. Put used towels on the floor, so that I now they've been used.",
4842030,Home Away From Home,84441353842,verified,James,Brooklyn,Crown Heights,40.6726,-73.95364000000001,United States,US,True,flexible,Private room,2015,$774 ,$155 ,1,37.0,5/27/2019,0.72,2,3,102,,
4842583,Amazing Loft/ Bed-Stuy/ Full Cleaning Service.,27201671878,verified,Marc-Antoine,Brooklyn,Bedford-Stuyvesant,40.683009999999996,-73.93738,United States,US,False,flexible,Entire home/apt,2012,$896 ,$179 ,30,2.0,12/21/2018,0.18,2,2,70,"- Non-smoker - No perfume/cologne use - Microwave for light use, not cooking - Very light and fast food prep - Mailing address not to be shared with anyone but family and friends - Take is seriously: If  any of yours not personal mail comes to this mail box, you will be charged $200 and $5 for each letter after that indefinitely - Guest agrees not to write reviews for areas not on amenities list",
4843135,Chic Downtown 1 Bedroom,77359401107,verified,Lora,Manhattan,Greenwich Village,40.73189,-73.9947,United States,US,True,flexible,Entire home/apt,2012,$76 ,$15 ,14,26.0,12/18/2018,0.59,5,1,140,No smoking. Please respect our neighbors.,
4843687,Great Spacious Appartment,8585050180,verified,Ely,Manhattan,East Harlem,40.7912,-73.94318,United States,US,True,moderate,Entire home/apt,2018,$339 ,$68 ,5,23.0,6/18/2019,1.25,2,1,241,#NAME?,
4844239,1 Bedroom in a Williamsburg Loft,8845749446,unconfirmed,Natsuki,Brooklyn,Williamsburg,40.7116,-73.96774,United States,US,True,flexible,Shared room,2012,$315 ,$63 ,1,0.0,,,5,1,54,,
4844792,Near Subway -15 min to Manhattan,7349447834,unconfirmed,Lilia,Queens,Astoria,40.76357,-73.92829,United States,US,True,flexible,Private room,2021,$945 ,$189 ,5,46.0,6/14/2019,0.91,5,1,289,Let's talk to get to know each other !,
4845344,Sun-Filled Room near Central Park,86279570036,verified,Marco,Manhattan,East Harlem,40.79492,-73.94086999999999,United States,US,True,moderate,Private room,2010,$170 ,$34 ,4,79.0,6/29/2019,2.06,1,2,157,Female first please. Please keep the space quiet and clean.,
4845896,Chelsea Oasis 1 Bedroom Brownstone,43394442891,verified,Lena,Manhattan,Chelsea,40.74481,-74.00148,United States,US,False,strict,Entire home/apt,2012,$152 ,$30 ,4,17.0,12/20/2017,0.33,4,3,33,"Non-smokers, no smoking in or out of home No perfume/cologne use, no other sprays  Deodorant/antiperspirant is OK but not sprays  Recycling, reusable shopping bags No mailing address sharing: first offense $200, and $5 per letter after that LIFE TIME Please don't use ""single use disposable"" plastic bags Mailing address MAY NOT be shared with anyone accept delivery. Reusable foldeable shopping bag (provided, and you may take it with you) Plates, cup, utensils are only in space between refrigerator and sink Please don't keep dirty dishes in your room, but if you must, tide them in plastic bag (green kind, find in bathroom basket) Please keep your room at least reasonably tidy Host may enter the room to collect the trash or fix things if needed All your things are safe in your room Take off street shoes when indoor Washed slippers provided if you don't have your own  Please be respectful, considered, and aware what is left behind you when you are in common areas, and how it will impact th",
4846449,"Huge, Beautiful Artist's 2 bedroom",36211726786,unconfirmed,Dan,Brooklyn,Prospect Heights,40.67347,-73.96544,United States,US,True,flexible,Entire home/apt,2018,$750 ,$150 ,7,12.0,12/26/2018,0.24,1,1,362,"This is an old house which was built in the 1900s, and may not be sparkingly clean and modern, but we appreciate it if you can clean after yourself, and put things back to where they belong. Garbage day is on Friday, you can simply put your trash into the dumpster and we'll take care of the rest. Please be respectful to other tenants on the second floor. Thank you.",
4847001,"Cozy, quiet 2-story place by subway",57829363377,unconfirmed,Margot,Brooklyn,Greenpoint,40.7313,-73.95340999999999,United States,US,True,strict,Private room,2017,"$1,058 ",$212 ,14,1.0,9/21/2015,0.02,2,1,132,,
4847553,"Bright & spacious room, 2 minutes to subway!",82570207479,unconfirmed,Jin,Brooklyn,Crown Heights,40.67067,-73.95693,United States,US,False,moderate,Private room,2008,$185 ,$37 ,1,49.0,7/2/2019,4.45,4,1,272,1) No Smoking in property!!!  2) Do not slam doors!!! Close lightly Please!!! 3) No Shoes in house (except slippers) 4) Quiet down AFTER 10PM.,
4848106,A Beautiful and Sunny Artist's Home,15903330727,verified,Sonia,Queens,Astoria,40.76958,-73.92223,United States,US,True,moderate,Entire home/apt,2019,"$1,080 ",$216 ,3,36.0,6/28/2019,0.71,1,1,414,House rules will be provided upon booking.,
4848658,MyModernCrib w/ Empire State Views,33291874395,verified,Ellen!,Manhattan,Kips Bay,40.74045,-73.98175,United States,US,True,flexible,Private room,2004,$695 ,$139 ,5,2.0,5/21/2016,0.05,3,1,312,Respectful of the apartment,
4849210,1 Bdrm in Luxury High Rise,44036745778,verified,Jimmy,Manhattan,Financial District,40.7076,-74.01366999999999,United States,US,True,flexible,Private room,2016,"$1,058 ",$212 ,3,0.0,,,4,1,112,"Please treat it like your own place and leave it the way you found it! Please clean up prior to leaving.  No smoking indoors, no late night parties.",
4849762,Midtown Launching Pad,77302934906,verified,Jack,Manhattan,Midtown,40.75765,-73.96466,United States,US,False,strict,Entire home/apt,2009,$805 ,$161 ,1,168.0,6/21/2019,3.21,3,1,233,#NAME?,
