1741970,Very close to Downtown Awesome Room,41250040282,unconfirmed,Jeffrey,Brooklyn,Gravesend,40.60399,-73.97091999999999,United States,US,True,moderate,Private room,2004.0,$147 ,$29 ,1,61,7/6/2019,0.81,2,2,348,,
1742523,Designer open space in TriBeCa Soho 1000sq ft,64917368127,unconfirmed,Tom & Jennifer,Manhattan,SoHo,40.72372,-74.00277,United States,US,True,strict,Entire home/apt,2003.0,$192 ,$38 ,60,11,6/21/2019,0.13,4,1,154,"No smoking in the apartment, in the building or outside of the building.  We ask that you be quiet and respectful of our neighbors.",
1743075,Great find- 2 bedroom apartment in Williamsburg!,83166089073,unconfirmed,Michael,Brooklyn,Williamsburg,40.70989,-73.95347,United States,US,True,strict,Entire home/apt,2005.0,$417 ,$83 ,30,1,8/10/2012,0.01,5,2,88,No smoking is a MUST. Fireplace is decorative only. No candles may be lit - I do have battery operated available.,
1743627,CLOSE TO CENTRAL PRK & EXPRESS TRAINS ABCD 2/3,71622918741,verified,Wowa,Manhattan,Harlem,40.807970000000005,-73.9489,United States,US,True,moderate,Private room,2003.0,$621 ,$124 ,5,46,5/5/2019,0.6,5,1,47,No smoking or parties allowed,
1744180,Awesome Place! Amazing Location!!!,49009439649,unconfirmed,T,Manhattan,SoHo,40.72466,-73.99632,United States,US,False,flexible,Private room,2010.0,"$1,155 ",$231 ,1,132,6/5/2019,1.75,4,1,411,"House Rules 1. Check-in is 4 pm local time. If the unit is ready earlier, we’ll let you know. Check-out is normally 11 am local time, but we’d be happy to extend it as long as we don’t have a cleaning scheduled. Just let us know.  2. All bookings require a security deposit of at least $300, which will be refunded within 7 days of your check-out. 3. For security measures we require all guests to provide proof of identification through ID verification on our own website. In order to check in we'll need a photo of your ID.  4. Our cancellation policy is as shown on our ad and defined by the site you are booking through.  5. Don’t let $300 go up in smoke. There's no smoking allowed in any Flatbook and a $300 fine for breaking this rule.  6. Unfortunately we don’t allow pets in any of our apartments. 7. Unless you’re staying in one of our specialty apartments, we don’t allow parties or excessive noise. 8. If we find the place very messy, we have to charge an extra $40 for every extra hour o",
1744732,Everyone who stays leaves happy!,25581400996,unconfirmed,Lisa,Manhattan,Tribeca,40.71552,-74.00749,United States,US,False,moderate,Private room,2006.0,$132 ,$26 ,1,62,4/27/2014,0.73,4,1,99,"Shoes off at entry. Please NO SMOKERS or smoking on premises.  No loud music or loud voices on deck out of concern for neighbors.  Dispose of trash in receptacles rear of building.  Max 2 guests to share guest bedroom, SOFA IS NOT AN EXTRA BED.  Please NO VISITORS in unit beyond approved Air BND guests.  No use of fire place.  No cleaning fee, please clean dishes and dispose of smelly trash.  Thank you!!! :-)",
1745284,Spacious one bedroom apartment in Brooklyn Heights,27079728522,verified,Theodore,Brooklyn,Brooklyn Heights,40.69464,-73.99885,United States,US,False,moderate,Entire home/apt,2005.0,$547 ,$109 ,10,8,8/24/2018,0.17,3,1,327,,
1745836,Adorable 1 Bedroom,27805546704,verified,Stephanie,Brooklyn,Bedford-Stuyvesant,40.6877,-73.95824,United States,US,False,flexible,Entire home/apt,2004.0,$358 ,$72 ,3,16,4/17/2017,0.27,2,1,125,Please no smoking in any of the inside premises or on the roof deck; no loud music; no moving or rearranging furniture; and no guests beyond those indicated at booking (without clearing with owner first).,
1746389,Beautiful Bedroom in Brooklyn,56014108629,verified,Chris,Brooklyn,Bedford-Stuyvesant,40.69079,-73.95809,United States,US,False,strict,Private room,2012.0,$619 ,$124 ,2,19,7/15/2016,0.23,1,1,5,,
1746941,A GEM IN THE CITY,33042727850,verified,Valerie,Queens,Ridgewood,40.70001,-73.90698,United States,US,False,moderate,Entire home/apt,2022.0,"$1,043 ",$209 ,2,17,1/1/2017,0.2,1,1,165,"Please no pets! Again, I ask that you not consume my wine or whiskey collection.",
1747493,Cozy 1BD Manhattan close Central Pk,49180814686,verified,Marie-Jeanne,Manhattan,Upper East Side,40.77247,-73.94665,United States,US,False,moderate,Entire home/apt,2008.0,$649 ,$130 ,7,12,11/18/2016,0.14,5,1,212,"- No smoking, no pets - No parties and please be quiet after 11pm - Fireplace is functional, but for safety reasons please do not use it - If you use the elevator, please close the inner door after you, otherwise other people won't be able to use it - Take your shoes off when you enter the apartment, you can place them into the closet next to the entrance door",
1748046,Penthouse Studio East 50s Terrace,29130668934,verified,Hillary,Manhattan,Murray Hill,40.75128,-73.97658,United States,US,True,strict,Entire home/apt,2011.0,$572 ,$114 ,1,321,6/15/2019,3.93,1,1,348,"Please do not try and fit more than 4 occupants in the apartment overnight. There is a queen bed in the bedroom and a full-sized pullout couch in the living room that can accommodate 1-2 people.  BUILDING RULES (As enforced by the property owners): - On Wednesday and Sunday night please leave your garbage in sealed garbage or grocery bags outside of the apartment door. It will be picked up early the next morning. - Please do not leave any garbage or personal items in the hallway or foyer, or you will be charged $100 by the building management.  - There are 3 bay windows in the living room, however only the far right one opens. The other two have been nailed shut by the property owners because of the safety risk that they pose when they're opened. Please do not try and open them, as it will damage the window frames. - The fire escape is strictly off-limits. - Please keep the noise level to a minimum and be be respectful of your neighbours.  - Drug possession and usage are prohibited in ",
1748598,In Manhattan+1 Small Block to train,48970860497,verified,Chris,Manhattan,Inwood,40.86345,-73.92039,United States,US,False,moderate,Private room,2010.0,$180 ,$36 ,4,160,6/12/2019,1.89,2,2,198,• Check-in time is 3PM.,
1749150,In_Manhattan+1 Small Block to train,1799553000,unconfirmed,Chris,Manhattan,Inwood,40.862840000000006,-73.91955,United States,US,True,moderate,Private room,2016.0,"$1,198 ",$240 ,4,142,6/3/2019,1.68,4,2,275,"Please remember that this is a residential building. The building rules, apartment occupancy restrictions and the year-round tenants must be respected.  Parties, pets and smoking are not allowed under any circumstances and incur significant fees.",
1749703,Spacious Greenwich Village Loft,31999294402,verified,Bill,Manhattan,West Village,40.73413,-74.00465,United States,US,True,moderate,Entire home/apt,2003.0,$332 ,$66 ,1,5,10/11/2015,0.06,3,1,367,,
1750255,NYC Chelsea very spacious 1-bedroom apartment,76434585890,verified,Markus,Manhattan,Chelsea,40.74026,-74.00079000000001,United States,US,False,flexible,Entire home/apt,2003.0,$693 ,$139 ,6,61,6/30/2019,0.73,1,1,234,With respect to the property and other tenants,
1750807,Greenwich Village Skylit 1BR +deck!,84524651713,verified,Chris,Manhattan,Greenwich Village,40.73474,-73.99526999999999,United States,US,False,flexible,Entire home/apt,2020.0,"$1,019 ",$204 ,7,0,,,4,1,197,"Professional, no smoking, no pets.  Please use seat inside door to remove shoes.",
1751359,Williamsburg Peace for the Solo Traveler,82726339676,verified,Kelly,Brooklyn,Williamsburg,40.713159999999995,-73.94532,United States,US,True,flexible,Private room,2019.0,$855 ,$171 ,3,5,10/21/2018,0.08,2,1,193,Please clean up after yourselves when leaving.  Minimal noise is appreciated given the close neighbors. Thanks!,
1751912,1 Bed Manhattan Apt. Minimum 7 DAYS,75580006392,verified,Ana,Manhattan,Washington Heights,40.8347,-73.94856999999999,United States,US,False,strict,Private room,2015.0,$302 ,$60 ,30,36,1/25/2017,0.44,3,1,232,No pets No parties. No smoking,
1752464,The Perfect Brooklyn Heights Apt,2388915141,unconfirmed,Angela,Brooklyn,Brooklyn Heights,40.69082,-73.99280999999999,United States,US,True,strict,Entire home/apt,2006.0,"$1,068 ",$214 ,1,109,6/14/2019,1.51,1,1,191,No Smoking.  Violators will be charged a $500 fine for each violation and may be charged for additional smoke removal following departure. Pets allowed with non-refundable pet fee.  Breed restrictions apply. This is a residential property.  Parties and/or loud music is not allowed after 9:00 p.m.,
1753016,Dream Room in Sunnyside New York,83390828660,unconfirmed,Nancy,Queens,Sunnyside,40.741240000000005,-73.92273,United States,US,True,flexible,Private room,2021.0,$383 ,$77 ,3,28,3/31/2019,0.38,2,1,348,,
1753569,Beautiful apartment in Park Slope,2286956591,unconfirmed,Onur,Brooklyn,Park Slope,40.67465,-73.97975,United States,US,True,moderate,Entire home/apt,2015.0,$383 ,$77 ,4,14,5/20/2019,0.16,2,1,213,,
1754121,Most breathtaking view of Manhattan,79904323515,verified,Fabio,Brooklyn,Williamsburg,40.72203,-73.95376,United States,US,False,strict,Entire home/apt,2017.0,$927 ,$185 ,2,250,6/26/2019,2.99,5,1,141,#NAME?,
1754673,BIG UWS APT-BLOCK FROM CENTRAL PARK,15527889450,verified,Amy,Manhattan,Upper West Side,40.7839,-73.97896999999999,United States,US,False,strict,Entire home/apt,2004.0,$756 ,$151 ,4,12,5/28/2018,0.25,5,1,1,,
1755226,Beautiful Ft. Greene Apartment-NEW!,72314908382,unconfirmed,Chris,Brooklyn,Clinton Hill,40.68533,-73.96808,United States,US,True,moderate,Entire home/apt,2005.0,$276 ,$55 ,2,20,12/30/2018,0.24,5,1,372,No smoking anywhere on the property- including the front steps.  No parties- please be considerate of the many neighbors around you.  Please take the trash out at the end of your stay.  The fireplace is not cleared for burning wood but you may use the candles provided. Please blow out candles when you leave.,
1755778,"lovely, spacious wmsbrg apt w deck",80561140992,unconfirmed,George,Brooklyn,Williamsburg,40.70397,-73.95536,United States,US,False,flexible,Entire home/apt,2019.0,$395 ,$79 ,14,27,5/13/2019,0.36,3,1,128,NO Smoking,
1756330,Sml Rm in pr. Brst in Pk Sl great for Med/students,56699495121,verified,Kathleen R.,Brooklyn,Prospect Heights,40.68084,-73.97429,United States,US,True,flexible,Private room,,$682 ,$136 ,2,73,6/27/2019,0.89,4,3,237,- Respect as if it were your own home is all we ask :),
1756882,Rare Loft Apt in Heart of Brooklyn,37431709184,unconfirmed,Kevin + Casey,Brooklyn,Boerum Hill,40.68379,-73.98313,United States,US,True,flexible,Entire home/apt,,$512 ,$102 ,3,2,12/29/2015,0.05,5,1,130,No smoking inside and no pets. Please be respectful of the hosts and the space.,
1757435,"Amazing Greenpoint/WBurg, BRKLN 1BR",60568545482,unconfirmed,Zach,Brooklyn,Greenpoint,40.72188,-73.94963,United States,US,False,flexible,Entire home/apt,,$683 ,$137 ,5,38,5/6/2019,0.45,1,1,367,"Treat the home as you would your own.  If staying through a trash day, please leave trash by curb.",
1757987,2B+Office Perfect 4 Young Family!!,18653619750,verified,Kyle,Brooklyn,Prospect Heights,40.679629999999996,-73.97237,United States,US,True,strict,Entire home/apt,,$315 ,$63 ,14,5,10/18/2014,0.07,5,1,26,This building is home to quiet professionals; please be respectful of neighbors and be mindful of noise.,
1758539,College Students see New York !,39606847608,unconfirmed,Miriam,Queens,Cambria Heights,40.69249,-73.73382,United States,US,True,flexible,Private room,,$462 ,$92 ,3,0,,,4,2,411,,
1759092,Cosy Large Bedroom Park Slope,47444544162,unconfirmed,Nat,Brooklyn,Park Slope,40.6686,-73.98342,United States,US,False,moderate,Private room,,"$1,098 ",$220 ,3,31,8/10/2018,0.5,2,1,297,,
1759644,Bright UES Gem Near Central Park,81871959566,unconfirmed,Lauren,Manhattan,Upper East Side,40.76985,-73.95815,United States,US,False,flexible,Entire home/apt,,$862 ,$172 ,2,17,12/7/2015,0.21,2,1,156,No Smoking,
1760196,Garden Oasis in the ♥️ of NYC | Steps to Times Sq!,14462200558,unconfirmed,Heather,Manhattan,Hell's Kitchen,40.762570000000004,-73.99303,United States,US,False,flexible,Entire home/apt,,$984 ,$197 ,3,35,5/27/2019,0.42,1,1,139,Please run dishwasher before checking out and respect noise levels for neighbors! :),
1760749,Brownstone Home - BEST BKLYN BLOCK!,8523855233,unconfirmed,Wendy,Brooklyn,Gowanus,40.68466,-73.98871,United States,US,True,moderate,Entire home/apt,,$106 ,$21 ,30,63,4/18/2019,0.77,3,3,242,NO Smoking,
1761301,"Convenient, Central, Comfortable",30915484322,verified,Eric,Manhattan,East Harlem,40.79183,-73.94743000000001,United States,US,True,moderate,Entire home/apt,,$875 ,$175 ,7,149,6/29/2019,1.78,1,1,186,"Access to kitchen appliances and cutlery, etc. Food and alcohol not included, we are close to a liquor store, Trader Joes and Whole Foods. No parties, no smoking, no pets, no more than 2 guests. Please treat the place as you would your own.",
1761853,Charming triplex in NYC brownstone!,73614997226,verified,Silvia,Manhattan,Upper West Side,40.77471,-73.98261,United States,US,True,strict,Private room,2004.0,$941 ,$188 ,20,107,6/5/2018,1.29,2,1,271,Please treat our home as if it were your own.,
1762405,"Cozy 1BR apart. in Prospect Hts, BK",28816780806,unconfirmed,Marta,Brooklyn,Prospect Heights,40.67293,-73.96399,United States,US,False,moderate,Entire home/apt,2013.0,"$1,000 ",$200 ,5,7,12/31/2015,0.08,2,1,271,"You are my guest - please behave as such!  This is where I live. - No neighbor-disturbance-level noise past 11:00PM - No pets of any kind - No smoking - Use the kitchen, not the food (it is ours) - Clean up spills and dishes - No illegal drugs or substances",
1762958,Queens Quality Convenient Apartment,10005433552,unconfirmed,Rafael,Queens,Elmhurst,40.73587,-73.88279,United States,US,True,strict,Entire home/apt,2017.0,$453 ,$91 ,3,48,6/23/2019,0.58,3,2,121,"We expect our guests to behave in a respectful manner and try to limit loud sounds and noises (such as music and/or shouting) in the evening. All animals must be well mannered and guests are expected alert us to any animals they may have with them, so that we can clean properly after departure. This apartment is non-smoking.",
1763510,Gorgeous 1 Bdrm Haven/Shared Ktchn,26601346795,verified,Jonathan,Brooklyn,Bushwick,40.69945,-73.92148,United States,US,True,strict,Entire home/apt,2005.0,$978 ,$196 ,3,54,6/19/2019,0.65,2,1,167,"No pets, no smoking inside.",
1764062,Hip Brooklyn Photo Studio Loft!,37271089679,unconfirmed,Andrew And Kat,Brooklyn,Bushwick,40.7072,-73.92245,United States,US,False,strict,Entire home/apt,2020.0,"$1,038 ",$208 ,31,17,10/18/2015,0.2,5,1,46,,
1764615,Chateau Gowanus,57538404994,verified,"Christopher, Samantha And Mason",Brooklyn,Gowanus,40.673759999999994,-73.99648,United States,US,True,flexible,Entire home/apt,2013.0,$624 ,$125 ,2,103,6/8/2019,1.62,1,1,31,"Parties, group events, having any number of guests above the number of people listed on the reservation either for a few minute visit or otherwise, or playing loud music is not allowed. Neighbors are quiet and respectable professionals and it is strictly necessary to respect their peace and to be discreet at any time. Thank you for your understanding. You can feel free to ask me for anything. Safe travels and see you soon! Sebastien",
1765167,HUGE East Village 2 Bd w/Priv Yard,70208587045,unconfirmed,Deborah,Manhattan,East Village,40.7256,-73.97856999999999,United States,US,False,moderate,Entire home/apt,2005.0,$67 ,$13 ,3,243,6/24/2019,2.95,4,1,326,This is a quiet residential street of owner occupied properties.  Guest are expected to be respectful of other quests. No late night loud noise making. No smoking.  Freshly laundered slippers are provided for guests to wear in the house.  We have a no shoes policy inside the house.,
1765719,Cozy Comfortable Friendly & Cheap!,37474455930,unconfirmed,Miriam,Queens,Cambria Heights,40.6916,-73.73323,United States,US,True,strict,Private room,2013.0,$806 ,$161 ,3,0,,,1,2,47,,
1766272,1 FLOOR OF A BROWNSTONE WITH GARDEN,27034471585,verified,Lori & John,Manhattan,Upper West Side,40.791959999999996,-73.97065,United States,US,False,strict,Private room,2010.0,$596 ,$119 ,3,93,6/18/2019,1.17,3,1,292,,
1766824,Full-Service Studio Apt in Brownstone/Townhouse,60250249288,unconfirmed,Historic Harlem,Manhattan,Harlem,40.81726,-73.94583,United States,US,False,moderate,Entire home/apt,2011.0,$483 ,$97 ,2,54,7/1/2019,0.74,4,2,158,,
1767376,"2 BED TriBeCa, Beautiful-Renovated!",61943536745,unconfirmed,Mike,Manhattan,Tribeca,40.71655,-74.01171,United States,US,True,strict,Entire home/apt,2006.0,$486 ,$97 ,30,2,10/31/2015,0.03,5,52,397,,
1767928,Small Private Room # 1 with Window,37823274747,unconfirmed,Masud,Brooklyn,Cypress Hills,40.68375,-73.87065,United States,US,True,flexible,Private room,2017.0,"$1,053 ",$211 ,28,88,5/22/2019,1.05,2,4,12,,
1768481,Full Apt! L Train On The Corner!!,9632494210,unconfirmed,Bradley,Brooklyn,Williamsburg,40.709579999999995,-73.93578000000001,United States,US,True,moderate,Entire home/apt,2012.0,$57 ,$11 ,30,15,7/29/2017,0.18,5,1,173,,
1769033,Great house in Williamsburg,25765987917,unconfirmed,Bob,Brooklyn,Williamsburg,40.720909999999996,-73.96133,United States,US,False,moderate,Entire home/apt,2014.0,$851 ,$170 ,3,25,11/21/2017,0.3,3,2,130,,
1769585,1 BR Apartment near Prospect Park!,96730185596,unconfirmed,Sarah,Brooklyn,Crown Heights,40.66959,-73.95718000000001,United States,US,True,flexible,Entire home/apt,2010.0,"$1,178 ",$236 ,3,0,,,5,1,232,,
1770138,Brooklyn Carriage House,54723404190,unconfirmed,Cath,Brooklyn,Prospect Heights,40.680659999999996,-73.96644,United States,US,True,strict,Entire home/apt,2022.0,$931 ,$186 ,4,11,4/28/2019,0.13,1,1,86,"- On a typical weeknight, I will be home from 10pm to 7:30am",
1770690,Big Sunny Williamsburg 14ft Ceilings w Half Bath,24362152494,verified,Zack,Brooklyn,Williamsburg,40.71447,-73.95237,United States,US,False,flexible,Private room,2008.0,"$1,151 ",$230 ,30,17,5/30/2019,0.26,2,2,30,No parties or extra guests! Sorry,
1771242,Historic Brownstone Parlor & Garden,78072392107,verified,Hayley,Brooklyn,Bedford-Stuyvesant,40.68372,-73.9406,United States,US,True,moderate,Private room,2011.0,$260 ,$52 ,3,5,8/31/2014,0.06,3,2,110,#NAME?,
1771795,NYC/Queens 1 Bedroom Apartment,80388721806,verified,David,Queens,Astoria,40.76408,-73.92461,United States,US,True,strict,Entire home/apt,2012.0,$364 ,$73 ,14,0,,,4,1,163,Please be respectful of noise levels after 10pm.,
1772347,Cozy bedroom in Hells Kitchen,34395836526,verified,Mauricio,Manhattan,Hell's Kitchen,40.76876,-73.99473,United States,US,False,flexible,Private room,2013.0,$428 ,$86 ,2,28,9/13/2018,0.34,1,1,117,Please remove your shoes when you enter the apartment.  There are trays out to place your shoes -- this is especially important in winter to not track salt and snow everywhere. We have nice hardwood floors that we'd like not to damage.  NO SMOKING -- THIS INCLUDES BEHIND OR IN FRONT OF THE BUILDING NO PETS  Do not bring anyone over who is not on the reservation -- you are the only people permitted to enter the building  Respect our neighbors and do not make noise,
1772899,"Great room in 2BR, Bright + Cozy!",6496999695,verified,Evelina,Brooklyn,Crown Heights,40.66839,-73.96001,United States,US,False,moderate,Private room,2020.0,"$1,144 ",$229 ,2,0,,,3,1,103,Enjoy the marathon,
1773451,ENTIRE LUXURY MADISON AVE STUDIO,28307278196,verified,Angela,Manhattan,Midtown,40.74519,-73.98338000000001,United States,US,False,moderate,Entire home/apt,2003.0,"$1,139 ",$228 ,30,0,,,3,1,373,,
1774004,Great deal! Manhattan 1-bedroom 1 month sublet,72461260873,unconfirmed,Laura And Bernard,Manhattan,Kips Bay,40.74285,-73.97986,United States,US,False,strict,Entire home/apt,2008.0,$927 ,$185 ,30,8,8/21/2018,0.11,2,1,318,,
1774556,"Spacious apt in South Harlem, steps to subways !",26380661039,unconfirmed,Aida,Manhattan,Harlem,40.80352,-73.95127,United States,US,False,flexible,Entire home/apt,2016.0,"$1,027 ",$205 ,2,15,4/27/2019,0.18,5,2,331,We live in close proximity to our neighbors so we are not able to allow parties or large gatherings or late night partying.,
1775108,"Williamsburg, Brooklyn Townhouse",83944535434,verified,Gina,Brooklyn,Williamsburg,40.71455,-73.93739000000001,United States,US,True,moderate,Entire home/apt,2021.0,$907 ,$181 ,3,2,10/22/2018,0.17,3,1,31,"No pets, no smoking, no parties.  No guests not on the reservation.  You are liable for any damage. We will give you access to Netflix.  Please respect the account. Please report anything broken at the beginning of your reservation to avoid the loss of your security deposit.  Clean all your dishes and clean up after yourself.  Please keep the noise down.",
1775661,"In the heart of Prospect Park, BK!",52984680679,unconfirmed,Zhenia,Brooklyn,Prospect-Lefferts Gardens,40.65826,-73.95951,United States,US,True,flexible,Entire home/apt,2005.0,$926 ,$185 ,4,40,1/1/2019,0.57,4,1,257,"We expect travelers to leave the apartment in the same condition that they left it in. We take great care of the apartment as we feel it is a truly special home, and hope that others will treat it the same way! We will provide fresh sheets and towels, which guests can put in a pile upon leaving. We do not allow pets unfortunately. Although we love them, the building does not!",
1776213,"In the Hub of Union Square, NYC",65249280909,unconfirmed,Carlita,Manhattan,East Village,40.7324,-73.98577,United States,US,True,flexible,Entire home/apt,2004.0,$742 ,$148 ,7,57,5/6/2019,0.68,2,1,227,No Smoking  No Pets,
1776765,COMFY-CUTE-N-CLEAN APT in WBURG,72758500899,verified,Armando,Brooklyn,Williamsburg,40.71402,-73.93989,United States,US,True,moderate,Entire home/apt,2013.0,$414 ,$83 ,3,0,,,3,1,396,#NAME?,
1777318,NYC Whole Apt.  Dec 26th- Feb 3rd,41752841312,unconfirmed,Dennis,Manhattan,Harlem,40.80338,-73.95594,United States,US,False,moderate,Entire home/apt,2009.0,"$1,069 ",$214 ,14,6,8/16/2018,0.07,1,1,143,"Please remember that this is a residential building. The building rules, apartment occupancy restrictions and the year-round tenants must be respected.  Parties and smoking are not allowed under any circumstances and incur significant fees. Pets may be considered with pre-approval and an additional pet fee.",
1777870,Ti me Square Stylish 1 Bedroom,2349576867,unconfirmed,Sag,Manhattan,Hell's Kitchen,40.7592,-73.99133,United States,US,True,flexible,Entire home/apt,2008.0,$94 ,$19 ,4,57,5/24/2019,0.69,1,1,340,,
1778422,1BD brownstone apt in Fort Greene!,19659117046,verified,Lauren,Brooklyn,Fort Greene,40.68935,-73.9695,United States,US,False,strict,Entire home/apt,2017.0,$157 ,$31 ,3,22,10/28/2015,0.27,2,1,409,No kitchen access. No wifi - I do have a hot spot. No key given to you. No extra guest allowed.,
1778974,Slick Studio with High Ceilings,62441226967,verified,Ian,Manhattan,Gramercy,40.733259999999994,-73.98245,United States,US,False,strict,Entire home/apt,2015.0,$670 ,$134 ,8,6,9/4/2013,0.07,2,1,197,"Please treat the interior of the unit, including all furniture with respect.   No smoking or pets allowed. Enjoy yourself but please keep noise to acceptable levels at night to avoid disturbing neighbors.  No parties please.",
1779527,East Village perch!,86638961160,unconfirmed,Zachary,Manhattan,East Village,40.73082,-73.98501999999999,United States,US,True,flexible,Entire home/apt,2004.0,"$1,177 ",$235 ,1,17,10/13/2015,0.2,1,1,224,No smoking. No pets. ,
1780079,Big Room in Williamsburg Loft,16871204273,unconfirmed,Niral,Brooklyn,Williamsburg,40.71382,-73.94164,United States,US,False,moderate,Private room,2013.0,$879 ,$176 ,2,14,10/28/2018,0.19,3,1,290,,
1780631,1 BR - Garden - Broadway?,31741001537,unconfirmed,Ken,Manhattan,Upper East Side,40.77975,-73.94977,United States,US,True,flexible,Private room,2016.0,$59 ,$12 ,1,160,6/27/2019,1.9,5,1,121,"Maintain cleanliness .  Please carry all the necessary items that is required for your stay , host cannot provide any of it . Also can accomodate females who are veg and eggatarians only",
1781184,Sal's bnb,13282252824,unconfirmed,Lascell,Brooklyn,Bedford-Stuyvesant,40.68517,-73.95563,United States,US,True,strict,Entire home/apt,2017.0,$631 ,$126 ,2,85,6/23/2019,1.02,4,1,86,,
1781736,"Jacuzzi Suite, Minutes to Times Sq.",61767468197,verified,Karl & Catherine,Queens,Long Island City,40.74609,-73.94691,United States,US,False,flexible,Private room,2018.0,$861 ,$172 ,1,165,6/22/2019,1.99,5,2,-5,"We expect our guests to behave in a respectful manner and try to limit loud sounds and noises (such as music and/or shouting) in the evening. All animals must be well mannered and guests are expected alert us to any animals they may have with them, so that we can clean properly after departure.",
1782288,1-Bd Apt in PRIME Soho - NYC- July,95559500175,unconfirmed,Paul,Manhattan,SoHo,40.72625,-74.0018,United States,US,False,moderate,Shared room,2018.0,"$1,166 ",$233 ,2,13,4/22/2014,0.16,2,1,212,"The three main lights of the apartment are on the right of the front entrance.  The far light is for the bed area, the middle one (the black tab you have to flick up and down) is for the main area, and the near switch is for the light right over you as you step in.  The light in the bathroom is by the storage unit.  The light in the kitchen is to your left right as you walk into it.",
1782841,Luxury 1Bed with Central Park Views,39274660199,unconfirmed,Henry,Manhattan,Upper West Side,40.77428,-73.98594,United States,US,False,flexible,Entire home/apt,2019.0,"$1,048 ",$210 ,30,44,9/28/2015,0.53,1,11,95,"No pets, no children, no smoking (landlord's rules, not ours - sorry!).  Also, it is a pretty quiet building and the owners feel strongly about keeping it this way, so please refrain from any loud music/shouting/partying. Finally, we are happy to take care of stripping/washing the sheets, but would appreciate it if you would clean up any dishes you use during your stay. Other than that, have fun!",
