47589498,"Family friendly, amazing garden in Cobble hill",94451271021,unconfirmed,Elizabeth,Brooklyn,Boerum Hill,40.68623,-73.98956,United States,US,False,flexible,Entire home/apt,2008,$588 ,$118 ,29,7,1/13/2019,0.19,3,2,244,There is no parking on my street for guests. You must park on the adjacent streets. No Smoking in the unit.  We have a dog named Daphne so no other pets allowed. We are an active family and might not be available during your stay. Lock the door when you come and go. Leave the room as you found it. Let me know if you have any issues or questions.,
47590050,Simple but spaced - Near to subway,40108489301,unconfirmed,Renata,Manhattan,Harlem,40.82195,-73.95508000000001,United States,US,True,strict,Private room,2006,$741 ,$148 ,4,64,6/16/2019,3.31,2,2,270,,
47590603,Cozy Groundfloor Apartment w/Garden,68198342476,verified,Laura,Brooklyn,Crown Heights,40.6758,-73.95578,United States,US,True,flexible,Entire home/apt,2017,$169 ,$34 ,4,6,8/27/2018,0.16,3,1,244,"Shoes off please Cat can go in or out as he desires, don't worry if you let him out No smoking No drugs or excessive alcohol No pets Please do not light candles We will provide a small basket for your toiletries to bring to and from the bathroom. Please discuss any guests you bring into the household beyond those on the reservation with Orion. No excessive noise and conversations, particularly in the stairwell.",
47591155,Prime Chelsea~roof deck~laundry...,40297377887,unconfirmed,Host,Manhattan,Chelsea,40.7437,-73.99476,United States,US,True,moderate,Entire home/apt,2003,$669 ,$134 ,30,7,6/14/2019,0.49,1,39,377,This is a non smoking house.  Quiet hours are from 10pm until 8am.  Cars must be parked within fence so as not to block neighbors driveway.  One parking spot only per room. Please don't use the kitchen for cooking as cleanliness becomes difficult to maintain with the velocity of guests that we host. We welcome you to have breakfast at your leisure.  Please place dirty dishes in the dishwasher unless it’s full of clean dishes!,
47591707,Space for Small Events /Gatherings/Dinner Parties,77621954280,verified,Shae,Brooklyn,Bushwick,40.693220000000004,-73.92378000000001,United States,US,False,moderate,Entire home/apt,2011,$641 ,$128 ,1,6,3/11/2018,0.15,1,4,266,"Please respect our neighbors and keep the noise level at a respectful level. While we hear very little from our downstairs neighbor, she hears our sounds easily.",
47592259,【完全個室】1BR､専用ﾊﾞｽﾄｲﾚ､ｷｯﾁﾝ付き(Queens),4175916709,verified,Hazuki,Queens,Elmhurst,40.73958,-73.87288000000001,United States,US,False,flexible,Private room,2017,$263 ,$53 ,1,0,,,1,1,361,THIS IS A NON-SMOKING RESIDENCE. NO Children under the age of 16  Smoking is permitted on your private deck only. Quiet hours are from 11:00 p.m. - 7:00 a.m. No pets allowed. Be respectful of your neighbors.,
47592812,"Brooklyn Love, Close to the City!!",83875284869,unconfirmed,Savannah,Brooklyn,Bedford-Stuyvesant,40.68647,-73.92849,United States,US,False,moderate,Entire home/apt,2016,$655 ,$131 ,2,168,6/21/2019,4.11,2,2,100,1. no pets 2. no smoking 3. no use of fireplace ,
47593364,"Luxury Midtown West Studio w/pool, wifi",28561586271,unconfirmed,Mike,Manhattan,Hell's Kitchen,40.75994,-73.99781,United States,US,True,flexible,Entire home/apt,2008,$718 ,$144 ,30,0,,,1,3,143,Just general respect for the place and my neighbors. Be aware about noise on the back deck in the evening.,
47593916,Designed By Stark!Basket Ball Gym 5150,93377091262,unconfirmed,Jeremy & Laura,Manhattan,Financial District,40.70563,-74.00658,United States,US,False,flexible,Entire home/apt,2012,$642 ,$128 ,30,3,4/22/2017,0.1,4,96,18,"Enjoy your stay, and please take care of the apartment like it's your own home. No parties and no smoking please.",
47594469,"NEW! Furnished, East Village Gem",75078324841,unconfirmed,Daniel,Manhattan,East Village,40.72526,-73.99031,United States,US,False,flexible,Private room,2014,$877 ,$175 ,2,14,6/17/2016,0.34,1,1,55,"SMOKING: Not allowed anywhere on the property! Violation of this rule WILL result in an added cleaning fee. DOORS: Doors to the condo and building are to remain CLOSED and LOCKED at all times. PARKING: If you need a space to park, please let me know immediately! I have one space available and it can accommodate 1-car only. The street is parking by permit only.  You will be ticketed if you try to park there during the day (MON - FRI). There is a pay lot at the end of my street if you are traveling with two cars. The cost is under $10 a day. NOISE: Please be respectful of the community and my neighbors and keep noise levels to a minimum at all times. KITCHEN:  Anything in the kitchen (spices, oils, things in the fridge, etc.) are yours to use. TOWELS & LINENS: The condo has plenty of towels and linens. Please be conscious of the environment and try to limit the amount of towels you use during your stay.",
47595021,Private Room Near  Times Square!,55602088676,unconfirmed,Eugene,Manhattan,Hell's Kitchen,40.760709999999996,-73.99188000000001,United States,US,True,strict,Private room,2019,$644 ,$129 ,3,0,,,1,3,167,,
47595573,Dooman GYM prime location!5178,15652317504,unconfirmed,Jeremy & Laura,Manhattan,Theater District,40.76279,-73.9854,United States,US,False,strict,Entire home/apt,2021,$343 ,$69 ,30,7,12/16/2018,0.19,1,96,387,This is our home and we want guests who respect our privacy and the fact that we are two working parents with kids. We can usually be flexible with check-in and check-out times so please let us know if you have any particular needs.,
47596126,"Luxury Midtown West 2BR w/pool, wifi",97584773414,unconfirmed,Mike,Manhattan,Hell's Kitchen,40.76144,-73.99826999999999,United States,US,True,moderate,Entire home/apt,2005,$142 ,$28 ,30,0,,,5,3,136,"This is a non-smoking, pet friendly house. Please don't let the cats out.",
47596678,LES sunny bedroom with roof access,17821526773,unconfirmed,Zack,Manhattan,Lower East Side,40.72132,-73.98369,United States,US,False,strict,Private room,2014,$831 ,$166 ,3,26,4/22/2019,0.64,4,1,418,No parties no loud music any issues please call,
47597230,Amazing spacious Loft in Williamsbu,58288120753,verified,Alberto,Brooklyn,Williamsburg,40.71213,-73.95654,United States,US,False,flexible,Entire home/apt,2011,$754 ,$151 ,1,91,6/23/2019,2.28,3,1,23,,
47597782,Harlem Gem,14321144524,unconfirmed,Lisa,Manhattan,Harlem,40.81575,-73.94913000000001,United States,US,False,flexible,Entire home/apt,2018,$724 ,$145 ,3,96,6/17/2019,2.51,2,1,410,"Check-in time can sometimes be flexible and we can provide advice for luggage storage if needed. No smokers please. Please do not spray perfumes, colognes or after-shaves as Nina has allergies.  Thanks for understanding. No eating in the bedroom.  Enjoy your stay!",
47598335,Spacious & Sunny Urban Treehouse,79330036565,unconfirmed,Allison,Brooklyn,Crown Heights,40.67677,-73.93783,United States,US,False,strict,Private room,2008,$362 ,$72 ,3,1,4/1/2016,0.03,3,1,21,"Earlier than 1pm check-in may be an option, will accommodate when possible.   Mutual civility and respect make life simple.  I tend to turn in by 10pm - so this not a great location for very  late night check-ins.  Not a good situation for coming and going into the small hours. Quiet after 10pm.",
47598887,Spacious Loft Greenpoint/Williamsbr,8510373030,verified,Eric,Brooklyn,Greenpoint,40.724740000000004,-73.95508000000001,United States,US,True,flexible,Private room,2016,$584 ,$117 ,2,28,10/12/2018,1.12,2,1,399,"People live downstairs, so please don't walk around wearing hard shoes, be quiet on the stairway, and quiet down after 11:00. No candles in the apartment. Please carefully make sure the front door clicks shut when you come or go! Thank you!",
47599439,Central Park - 2 Cozy Rooms (Max. 7 People),94887325371,verified,Lugao,Manhattan,Upper West Side,40.795759999999994,-73.96856,United States,US,True,moderate,Private room,2021,$326 ,$65 ,2,21,5/8/2019,0.53,5,3,116,,
47599992,Sweet and Cosy apartment,69638370111,verified,Shira,Manhattan,Upper West Side,40.7989,-73.96775,United States,US,True,moderate,Private room,2022,$832 ,$166 ,12,0,,,4,1,146,"Kid friendly if you bring your own pack n play or crib. IF YOU HAVE ALLERGIES PLEASE LET US KNOW. There is a dog who lives here, who will not be present for your stay, but who might have left behind some dander that could make you sad!",
47600544,Big Cozy Apartment in West Uptown,54113683235,unconfirmed,Gabriela,Manhattan,Harlem,40.801359999999995,-73.95476,United States,US,False,flexible,Entire home/apt,2008,$431 ,$86 ,4,0,,,3,1,151,"We would love to hear a bit about you and what brings you to Boston before accepting any reservations. Please make sure your profile is filled out (including a clear picture of you), and your online and offline verifications are complete before you submit a reservation request so we have an idea of who you are.  Please be respectful of my home and other guests - clean up after yourself, keep your toiletries neat and organized in the shared bathroom, no smoking indoors, and please remove your shoes upon entering.   I have coffee and tea for guests, and will leave out some basic breakfast items like snack bars and fresh fruit, however if you are planning on using the kitchen during your stay I ask that you provide your own food and drink.   Please do not bring additional guests home without express prior permission from the host.   Sorry, no pets allowed.",
47601096,1 Bedroom Apartment -Tompkins sq Park/East Village,94369599903,verified,Selim,Manhattan,East Village,40.72697,-73.98071999999999,United States,US,False,moderate,Entire home/apt,2014,$841 ,$168 ,4,19,6/11/2019,0.48,5,1,169,"-NO smoking inside. You are welcome to smoke outside, but please be respectful if the kids are in the yard or garden. -NO candles or incense please! The gas stove should be the only indoor flame.  -We ask guests to maintain quiet from 9pm-9am and be respectful of noise levels during the day. You are welcome to have a few friends over for dinner, and we love noisy kids, but loud music or loud parties do not work well in this space.  -The original house and foundation are over 150 years old, and although we strive to keep it very clean the occasional mouse or animal has found it's way in (mostly behind the walls, so you might hear scratching although we are trying to seal all the foundation holes), so please keep food mess put away. -Please clean up messes that could stain or damage our carpets, furniture or bathroom. Hair dyeing and hair cuts are not allowed in the apartment as the wood and claw foot tub can stain very easily. -Please remove muddy, snowy or shoes with anything on them t",
47601649,"Delightful, Cozy and Convenient Room in Brooklyn!!",67262444982,unconfirmed,Josh & Madeleine,Brooklyn,Bedford-Stuyvesant,40.69165,-73.943,United States,US,False,moderate,Private room,2010,$138 ,$28 ,1,210,5/28/2019,5.17,2,4,7,Please treat my home with the love and care you would give your own.,
47602201,Family-friendly 2 bed apt.near Manhattan,42693729820,verified,Denisse,Queens,Ozone Park,40.68165,-73.84558,United States,US,True,moderate,Entire home/apt,2017,$880 ,$176 ,4,70,6/5/2019,1.76,5,4,378,- Animaux sur place (lapins) - respect du voisinage - Acces à la chambre des autres locataires interdit ,
47602753,Huge Apt for Family Close to Trains,17398654000,verified,Christopher,Brooklyn,Clinton Hill,40.68701,-73.96174,United States,US,False,strict,Entire home/apt,2005,"$1,139 ",$228 ,3,4,8/7/2016,0.11,3,1,137,"No candles. Close and lock windows when you leave the house. Clean up after yourself in the bathroom and the kitchen. Mutual respect and have fun! If you want to have an event or party, let's check in about it first.",
47603305,Lovely Home in Prime Brooklyn,28035913450,verified,Dan,Brooklyn,Gowanus,40.67884,-73.99238000000001,United States,US,False,strict,Entire home/apt,2014,$728 ,$146 ,5,9,4/21/2019,0.23,1,1,380,Guests are liable for any damage to the unit or property. Guests assume all personal liability and risk for injury to themselves and others during their stay.,
47603858,"Lovely 3 Bedroom, 2 Bath Flatiron Area Loft",73513835257,unconfirmed,C.E.,Manhattan,Flatiron District,40.739940000000004,-73.99005,United States,US,False,flexible,Entire home/apt,2021,"$1,184 ",$237 ,5,28,5/26/2019,0.71,2,1,136,"Guests to be reasonable; don't make late-night and AM noise,  ASK about having pets-- dogs usually OK; cats (due to allergy) usually not OK Children welcome Shared bath has never been a problem No smoking inside. Washer and Line for drying available. Pls. use fridge/stove, etc.",
47604410,Fantastic 1 Bdrm | Entire Apartment,29818506051,unconfirmed,James,Manhattan,Harlem,40.81086,-73.94037,United States,US,False,flexible,Entire home/apt,2014,"$1,190 ",$238 ,14,2,9/3/2017,0.05,1,1,321,"-Remove shoes -be sure to lock the front door when entering or leaving the house -be reasonably quiet during sleeping hours - clean up after yourself in common areas like kitchen and bathroom -Good communication is key - There may be other guests staying and you will be sharing the bathroom with the host and one other guest. Please tell me a little bit about yourself and your purpose for the trip. Are you traveling for work, visiting friends in this area, or a tourist on vacation? This is a friendly household, reasonably quiet. -We expect guests to be reasonably quiet coming in and out before (9AM and after 10PM.  -No smoking -No pets - For safety reasons please do not invite other people to our place.  -Ask if you need anything, I will be providing you with towels, shampoo, conditioner, body wash, lotion, hair dryer. Self serve breakfast items will be provided as well, Coffee, tea, milk, half and half, yogurt, english muffins, with jam and butter, fresh fruits, instant oatmeal, and ce",
47604962,Brooklyn Bushwhick Private Room,2000589945,unconfirmed,Juno,Brooklyn,Bushwick,40.70017,-73.92081,United States,US,False,strict,Private room,2012,$276 ,$55 ,1,0,,,3,1,309,"No shoes in the house please - helps clean the house clean from dirt and germs. We don't charge a cleaning fee, so please leave the house in good shape.  Thank You!",
47605515,A slice of heaven on earth in NYC,35177938776,verified,Vidya,Manhattan,Midtown,40.753209999999996,-73.97215,United States,US,True,moderate,Shared room,2013,$988 ,$198 ,1,2,1/1/2018,0.1,3,1,7,No smoking inside or outside.  Please no food in the bedroom and keep the bedroom and bathroom neat.  Clean up after you are finished in the kitchen.,
47606067,Master Room in Downtown Queens NYC,64692337557,verified,Grace,Queens,Corona,40.73884,-73.8665,United States,US,False,strict,Private room,2009,$771 ,$154 ,16,34,5/11/2019,0.87,3,2,90,"No smoking, no extra guests and no parties.",
47606619,Brooklyn Style Apartment,81466768136,unconfirmed,Taniesha,Brooklyn,Clinton Hill,40.694829999999996,-73.96403000000001,United States,US,True,flexible,Private room,2014,$891 ,$178 ,2,30,6/5/2019,1.17,1,1,425,"Quiet house, respectful of other units in the building.",
47607172,Soho sanctuary in perfect location,25373002805,verified,Ash,Manhattan,Nolita,40.72225,-73.99473,United States,US,True,strict,Entire home/apt,2022,$654 ,$131 ,2,44,7/7/2019,1.1,3,1,406,Guest should bring own towels; sheets are provided.,
47607724,WEST 56TH COLUMBUS CIRCLE-LUXURY DOORMAN/GYM/DECK,59034822683,unconfirmed,Ruchi,Manhattan,Hell's Kitchen,40.765840000000004,-73.98422,United States,US,False,moderate,Entire home/apt,2005,$451 ,$90 ,30,0,,,3,49,88,- We have school age children and request that our guests do not come and go and after 11pm on weekdays.,
47608276,"Sunny Room, Hamilton Heights Section of Manhattan",56785385105,verified,Lendy,Manhattan,Harlem,40.8285,-73.94889,United States,US,True,strict,Private room,2014,$63 ,$13 ,1,2,11/30/2018,0.23,3,3,392,,
47608828,Beautiful Spacious Loft near subway and train,80617152150,verified,Luis And Oriana,Manhattan,Marble Hill,40.87665,-73.90855,United States,US,False,flexible,Entire home/apt,2016,$112 ,$22 ,3,43,6/15/2019,1.18,2,1,371,smoking outside no pets quiet friendly people preferred,
47609381,LUXURY DOORMAN STUDIO ON EAST 44th STREET,80806014590,verified,Ruchi,Manhattan,Midtown,40.750659999999996,-73.97036999999999,United States,US,True,flexible,Entire home/apt,2003,$456 ,$91 ,30,0,,,2,49,414,Quiet times are 9pm-8am. Please note that there are children in the house getting up for school at 6 am on Thursdays and Fridays. This is not the ideal place for late-sleepers! All overnight guests must be booked through Airbnb. If you plan to have visitors to your room please check with us beforehand. No smoking or drugs in the house. Moderate drinking ok. No candles or any open flames. ,
47609933,Gorgeous family friendly 3BR by Columbia campus,91763650241,unconfirmed,Shai,Manhattan,Morningside Heights,40.80792,-73.96728,United States,US,False,strict,Entire home/apt,2006,$821 ,$164 ,5,9,6/24/2019,0.33,2,1,19,"All overnight guests must be booked through Airbnb. If you plan to have visitors to your room please check with us beforehand. No candles or other open flames. No smoking, or drugs in the house.  Moderate drinking ok. ",
47610485,Beautiful Apartment in Historic Brooklyn Townhouse,3024697948,verified,Renata And Howard,Brooklyn,Prospect-Lefferts Gardens,40.65976,-73.95604,United States,US,True,strict,Entire home/apt,2020,"$1,027 ",$205 ,2,123,6/23/2019,3.32,2,2,47,"I'm a semi kosher vegetarian which means that I don't bring any pork or shelled fish into the house.  Chicken/Red meat is fine. Please confirm in your message that you're ok with this ""house rule.""",
47611038,NYC Studio Apartment,33430580969,unconfirmed,Adam,Manhattan,Murray Hill,40.74573,-73.97802,United States,US,False,strict,Entire home/apt,2018,$351 ,$70 ,1,1,4/1/2016,0.03,2,1,95,"Follow the Golden Rule of treating others (homes) as you'd like (your home) to be treated.  Jamaica Plain is a neighborhood with a lot of families, so please no parties and maintain noise levels after 11 pm and before 7 am.  Pets are okay, smoking is not.",
47611590,Studio apartment close to subway,87217939635,unconfirmed,Brooke,Manhattan,Upper West Side,40.78838,-73.97892,United States,US,True,strict,Entire home/apt,2022,"$1,117 ",$223 ,1,0,,,1,1,378,- has to be clean!,
47612142,Central Park / UWS,17107357397,verified,Ana,Manhattan,Upper West Side,40.77156,-73.98284,United States,US,True,moderate,Private room,2019,"$1,196 ",$239 ,2,60,6/18/2019,1.47,4,1,231,Be respectful of my roommates and my dogs.,
47612695,Full apartment available,38419380873,verified,Attika,Brooklyn,Bedford-Stuyvesant,40.68674,-73.93375,United States,US,False,flexible,Entire home/apt,2009,$396 ,$79 ,30,26,1/1/2017,0.64,3,1,360,"SUMMER SEASON: We have 2 A/C units in apartment, please do not move them, they must remain where they are for electrical reasons and they have to be on a certain angle as well. They are heavy too. Please turn them off when you are not in the condo. It’s an older home; don’t over charge electricity; the circuit breaker will pop if too much charged electricity... (Read utilities on the “house notes”) We ask our guests to be considerate of our neighbors and keep noise levels reasonable. This is a quiet neighborhood.",
47613247,Huge 1 bdrm apt; sublet March-Aug,88616195642,unconfirmed,Adela,Brooklyn,Crown Heights,40.663909999999994,-73.95179,United States,US,False,flexible,Entire home/apt,2019,$795 ,$159 ,120,0,,,3,1,101,"No candles. Close and lock windows when you leave the house. Clean up after yourself in the bathroom and the kitchen. Mutual respect and have fun! If you want to have an event or party, let's check in about it first.",
47613799,1br Suite - St Regis Residence Club,62565264551,verified,Bruce,Manhattan,Midtown,40.7604,-73.9741,United States,US,False,moderate,Entire home/apt,2003,$358 ,$72 ,2,20,5/16/2019,0.53,2,2,396,"Relax and enjoy. Kitchen fully equipped. Linens and towels supplied.  No smoking. No candles. And, sorry, but this is a place for one adult or a couple. Not suitable for kids.",
47614351,Sunny family-friendly 1 bed. apt near Manhattan,82190049036,verified,Denisse,Queens,Ozone Park,40.68084,-73.84765,United States,US,False,strict,Entire home/apt,2019,$97 ,$19 ,4,86,6/10/2019,2.13,3,4,283,"As mentioned, this is a quiet neighborhood with a mix of young people starting out and families, and we have neighbors living above us in the house and on either side of the house.  As such, loud, late night parties will not be hosted here. We would hope that this house would serve as your staging place to a great Boston experience, but that the bulk of that experience will occur while you are out exploring the area!",
47614904,Trendy 1 Bedroom Harlem Brownstone,29022121696,unconfirmed,Amal & Emad,Manhattan,Harlem,40.80187,-73.94705,United States,US,False,flexible,Entire home/apt,2004,"$1,041 ",$208 ,3,60,6/17/2019,1.49,1,1,115,"Please review the terms of this rental agreement. Enclosed is our rental contract and rules. Please read carefully. If you have any questions please don't hesitate to contact me before submitting your payment. By submitting your deposit you agree to these terms, and the fee and dates outlined in the booking email. Please make sure that you have provided us with a cell phone for the primary contact as well as the EXACT number of occupants. Our rates are based on 2 person occupancy. We charge $25 per person, per night for additional persons.  The unit is located at 256 Amory St. #1, Jamaica Plain, MA If you need directions don’t hesitate to call Christine at (PHONE NUMBER HIDDEN). Your confirmation is as follows: Check-in: after 3pm EST (No early check-in please)  Check-out: by 10 am EST (No late check-outs please) Pre-arrival info will be emailed to you before check in. By submitting my deposit, I agree to all terms and conditions of this agreement RENTAL RULES AND REGULATIONS  Arthouse",
47615456,1BD apartment with balcony on park,56107860522,unconfirmed,Rupert,Brooklyn,Fort Greene,40.69277,-73.97449,United States,US,False,flexible,Entire home/apt,2012,$870 ,$174 ,1,12,10/16/2016,0.3,1,1,147,,
47616008,"Cheap, clean, 15 min. to Manhattan",22397606945,verified,Matt,Queens,Jackson Heights,40.74852,-73.8889,United States,US,False,strict,Private room,2011,$402 ,$80 ,1,0,,,3,1,127,"Rules are detailed in the House Manual, which was emailed to you. There is also a printed copy of the house manual in the condo. Summary: - no guests other than those arranged with host. - no parties. - no smoking. - please be respectful of our neighbors. - please follow the check-out list provided. Failure to follow house rules will result in forfeiture of your security deposit.",
47616561,One Bedroom with kids room / office,12886009903,verified,John,Bronx,Spuyten Duyvil,40.88058,-73.91812,United States,US,True,moderate,Entire home/apt,2016,$215 ,$43 ,186,7,7/30/2016,0.18,1,1,322,#NAME?,
47617113,Small Room Double Bed and 25 x 15 ft livingroom,24070757150,verified,Andrea,Manhattan,Chelsea,40.745490000000004,-73.99473,United States,US,True,moderate,Private room,2014,$188 ,$38 ,1,13,8/27/2018,0.36,4,2,188,,
47617665,Riverside park and Columbia Univ,66491159452,verified,Neil,Manhattan,Morningside Heights,40.807520000000004,-73.96713000000001,United States,US,False,flexible,Entire home/apt,2011,$267 ,$53 ,7,5,9/6/2016,0.14,4,1,393,,
47618218,Sunny Manhattan Studio - perfect for couples,62122462994,verified,Katy,Manhattan,Upper East Side,40.78222,-73.94725,United States,US,True,moderate,Entire home/apt,2018,"$1,020 ",$204 ,2,31,1/3/2018,0.83,5,1,104,"No rules per say. I just ask that you respect my friendly ""building mates"" with noise levels. Oh, and no smoking or pets please!",
47618770,Private Room & Bathroom with Sauna,93801011952,unconfirmed,Daniel,Brooklyn,South Slope,40.66397,-73.98538,United States,US,False,moderate,Private room,2011,$326 ,$65 ,1,7,10/19/2017,0.17,4,2,366,"ANDREA’S HOUSE RULES:  ** The PINK ROOM is a room in a no-shoes house. Please [BRING] wear slippers or inside-only shoes.  ** All overnight guests must be booked through Airbnb. If you plan to have visitors during your stay, please check with us beforehand.  ** Please help us avoid any staining and damage to the furniture & linens by keeping food and beverages out of the bed. [**For MAKEUP REMOVAL please use the wipes provided and/or the dark washcloth.]  ** Enjoy our PINK ROOM, our BEVERAGE AREA in the living room, the bathroom, and please ** leave these spaces clean & tidy as you found  them **  ** As it states in the “Amenities” section on my listing, I do not provide breakfast (unless you have made a specific arrangement for meals with me). I do offer a few things to get you started. However, there are always several options for coffee in the freezer and other beverage materials in the beverage section.  ** Please hang coats and LEAVE shoes/boots in the hall  ** Please leave towels",
47619322,HUGE LIGHTENED ROOM / APARTMENT BROOKLYN,90068680486,unconfirmed,Joseph,Brooklyn,Bedford-Stuyvesant,40.68962,-73.95169,United States,US,False,strict,Private room,2022,$840 ,$168 ,1,16,6/19/2019,0.41,5,1,149,No loud noise.  Calm pets ok.  Friendly welcome!,
47619874,Historic Upper West Side Townhouse 1 or 2 Bdrms,95531313030,unconfirmed,Ray,Manhattan,Harlem,40.82334,-73.94811,United States,US,True,strict,Entire home/apt,2013,"$1,093 ",$219 ,2,90,7/7/2019,2.58,2,1,178,"No smoking, no loud parties. I would consider a pet, for an extra fee.",
