53103661,For all classical lover's 4,17050526562,verified,Glory,Brooklyn,Sheepshead Bay,40.60791,-73.96011999999999,United States,US,False,strict,Private room,2009,$816 ,$163 ,2,4,6/29/2019,0.29,2,2,358,"No smoking or drug use.  No parties.  No guests other than those specified in your booking. No moving of furniture without asking Turn lights off when not in use No food in rooms, food can be stored in kitchen area Front door stays unlocked until 9pm, after ring doorbell or call host ((PHONE NUMBER HIDDEN) or (PHONE NUMBER HIDDEN)) Kitchen is not for use Check-out time no later than 11am Host's food is off limits only what is serve and put out for breakfast!",
53104213,Penthouse duplex on Bowery with huge terrace.,97574299982,verified,Justin,Manhattan,East Village,40.727090000000004,-73.99074,United States,US,False,flexible,Entire home/apt,2016,$889 ,$178 ,2,1,6/23/2019,1.0,2,1,177,"No smoking or drug use.  No parties.  No guests other than those specified in your booking. No moving of furniture without asking Turn lights off when not in use No food in rooms, food can be stored in kitchen area Front door stays unlocked until 9pm, after ring doorbell or call host ((PHONE NUMBER HIDDEN) or (PHONE NUMBER HIDDEN)) Kitchen not for use Check-out time no later than 11am Host's food is off limits only what is serve and put out for breakfast!",
53104766,Spacious Apartment in Brooklyn,47676191685,verified,Olie,Brooklyn,Flatlands,40.62392,-73.93554,United States,US,True,strict,Entire home/apt,2015,"$1,105 ",$221 ,1,28,7/7/2019,2.02,3,1,265,"No smoking or drug use.  No parties.  No drinking of alcohol in room""p No guests other than those specified in your booking. No moving of furniture without asking Turn lights off when not in use No food in rooms, food can be stored in kitchen area Kitchen not in use Check-out time no later than 11am Host's food is off limits only what is serve and put out for breakfast!",
53105318,Enormous Duplex in Park Slope (2-3 month sublet),72470469047,unconfirmed,Peter,Brooklyn,Park Slope,40.6757,-73.97473000000001,United States,US,True,moderate,Entire home/apt,2015,$528 ,$106 ,60,0,,,2,1,0,,
53105870,Cozy feel at home studio,93184295917,verified,Maureen,Manhattan,Kips Bay,40.74408,-73.97803,United States,US,False,strict,Private room,2022,$232 ,$46 ,5,42,6/30/2019,2.87,5,1,2,,
53106423,Cozy SI den with multiple and easy access to NYC,12779012629,verified,Lisa,Staten Island,Port Richmond,40.63275,-74.13681,United States,US,True,moderate,Private room,2013,$843 ,$169 ,2,13,5/30/2019,0.96,3,1,283,,
53106975,Modern Super Clean Midtown Apt in the Heart of NYC,22463044046,unconfirmed,Tom,Manhattan,Upper East Side,40.76129,-73.9652,United States,US,False,moderate,Entire home/apt,2003,$428 ,$86 ,2,54,3/27/2019,3.72,2,1,0,,
53107527,Peaceful place 10min. from Center of New York City,64456229145,unconfirmed,Zamira,Queens,Long Island City,40.75558,-73.93643,United States,US,False,strict,Private room,2007,$880 ,$176 ,2,67,7/1/2019,4.93,2,1,11,,
53108080,Clean,58404237231,verified,John,Brooklyn,East New York,40.662440000000004,-73.88904000000001,United States,US,False,strict,Private room,2017,$720 ,$144 ,3,15,6/3/2019,1.05,2,13,365,Please no smoking or drugs. No parties.,
53108632,401 east 60th,19210120472,verified,Honey,Manhattan,Upper East Side,40.75972,-73.96021,United States,US,True,flexible,Entire home/apt,2004,$636 ,$127 ,30,1,5/24/2018,0.07,3,7,364,Please be respectful and courteous of other house guests.   Please keep all common areas clean after each use i.e. kitchen and bathroom. No smoking  No pets No parties No back yard access,
53109184,Private Clean Room near Yankee Stadium.,27483669956,verified,Lois,Bronx,Morrisania,40.83139,-73.90165999999999,United States,US,False,flexible,Private room,2014,$75 ,$15 ,2,18,7/2/2019,1.25,5,1,36,Absolutely NO smoking NOR use of drugs.  And NO shoes in the house! You will be requested to take off your shoes at the entrance.   Please Bring a positive attitude and fun spirit!,
53109736,"Next to Strawberry Fields, Central Park Manhattan",38320656407,unconfirmed,Juan Carlos,Manhattan,Upper West Side,40.778290000000005,-73.97794,United States,US,False,strict,Private room,2003,$829 ,$166 ,6,11,6/30/2019,0.76,4,1,219,,
53110289,◈Hidden Midtown Gem◈ Perfect 5-Star Stay!,60560413122,unconfirmed,Steven,Manhattan,Murray Hill,40.74519,-73.97676,United States,US,False,flexible,Entire home/apt,2020,$206 ,$41 ,2,65,7/1/2019,4.95,2,1,92,"We don't allow smoking, drug use, excessive parties, or loud music out of respect for our neighbors.  Please treat our home like your own! ",
53110841,Central Harlem Modern Oasis,78010186539,verified,Brittany,Manhattan,Harlem,40.814479999999996,-73.93714,United States,US,False,flexible,Entire home/apt,2008,$738 ,$148 ,6,2,6/19/2018,0.14,4,1,0,#NAME?,
53111393,Gem Of A Hideout With  Private Deck/Garden,15215764354,unconfirmed,Kelsey,Brooklyn,Williamsburg,40.71975,-73.96136,United States,US,True,moderate,Entire home/apt,2022,$923 ,$185 ,2,10,1/2/2019,0.69,4,1,0,"Quiet hours are 10 PM to 6 AM.  No smoking, even outside.  No pets.  We already have one.",
53111946,Sweet Home Away From Home,84290592292,unconfirmed,Natasha,Brooklyn,Sheepshead Bay,40.591429999999995,-73.95548000000001,United States,US,False,flexible,Private room,2021,$493 ,$99 ,2,52,6/24/2019,3.57,5,2,340,,
53112498,Quiet and Sunny room in the best part of Brooklyn,4585255838,unconfirmed,Yumiko,Brooklyn,Greenpoint,40.73276,-73.95304,United States,US,False,moderate,Private room,2019,$736 ,$147 ,3,39,7/5/2019,2.83,5,1,43,"No smoking or drug use.  No parties.  No guests other than those specified in your booking. No moving of furniture without asking Turn lights off when not in use No food in rooms, food can be stored in kitchen area Front door stays unlocked until 9pm, after ring doorbell or call host (phone number hidden) or (phone number hidden)) Kitchen not for use Check-out time no later than 11am Host's food is off limits only what is serve and put out for breakfast!",
53113050,Modern & Spacious Apartment in Central Harlem,58003140309,unconfirmed,Diane & Brice,Manhattan,Harlem,40.81716,-73.94279,United States,US,False,moderate,Entire home/apt,2018,"$1,059 ",$212 ,3,33,6/3/2019,2.3,3,1,192,"Please be respectful, Thank you !",
53113603,"HOTEL ROOM LIKE!!   WITH AFFORDABLE RATE!!  ""O""",74414287952,unconfirmed,Viviana,Queens,Woodhaven,40.68614,-73.86681999999999,United States,US,False,moderate,Private room,2010,$242 ,$48 ,3,31,6/22/2019,2.16,5,9,348,"Please be respectful, Thank you !",
53114155,Spacious bedroom in Beautiful Prospect Lefferts,2404106512,verified,James,Brooklyn,Prospect-Lefferts Gardens,40.659259999999996,-73.96252,United States,US,True,flexible,Private room,2012,"$1,175 ",$235 ,3,14,6/23/2019,0.98,3,1,364,,
53114707,Bedroom Casa Alvarez,93531861371,unconfirmed,Maria,Brooklyn,Williamsburg,40.7118,-73.96344,United States,US,True,strict,Private room,2014,$585 ,$117 ,2,23,6/30/2019,2.0,4,1,103,,
53115259,"A cozy private room, close to Columbia!",17556464785,verified,Minami,Manhattan,Morningside Heights,40.808679999999995,-73.95801,United States,US,False,strict,Private room,2006,$792 ,$158 ,4,2,8/17/2018,0.16,5,1,0,,
53115812,две кровати в комнате,89087038437,unconfirmed,Ivan,Brooklyn,Sheepshead Bay,40.58765,-73.94881,United States,US,False,flexible,Shared room,2009,$318 ,$64 ,30,0,,,3,3,84,No Smoking No Pets,
53116364,Beautiful large room in quiet  in Astoria,94184201541,verified,Edwin,Queens,Astoria,40.76031,-73.91702,United States,US,False,moderate,Private room,2021,"$1,155 ",$231 ,7,0,,,5,1,0,,
53116916,"Private bathroom with balcony,15mins to Manhattan",71717050661,verified,Kaka,Queens,Sunnyside,40.7467,-73.92076,United States,US,True,flexible,Private room,2016,"$1,124 ",$225 ,1,34,6/19/2019,2.49,2,5,262,,
53117469,"Front Big Private Room # 2, size 13x17, 3 Windows",10751641667,verified,Masud,Brooklyn,Cypress Hills,40.685990000000004,-73.87734,United States,US,True,strict,Private room,2018,$78 ,$16 ,28,6,6/15/2019,0.43,4,3,356,"respecfull, consideret.and loving",
53118021,New nice bedrooms in 2 bedroom apt. 1R,15908745426,unconfirmed,Gf,Brooklyn,East Flatbush,40.655,-73.92764,United States,US,False,strict,Private room,2005,$116 ,$23 ,30,3,6/21/2019,0.23,5,3,288,,
53118573,Private Bedroom NYC 10 mins to Williamsburg,47283756544,unconfirmed,Oscar,Queens,Ridgewood,40.70197,-73.90377,United States,US,True,flexible,Private room,2018,$844 ,$169 ,1,7,1/2/2019,0.48,4,2,85,,
53119126,Chic one Bedroom apartment NYC,9018989582,unconfirmed,Oscar,Queens,Ridgewood,40.70142,-73.90515,United States,US,False,flexible,Entire home/apt,2008,$974 ,$195 ,1,22,6/30/2019,1.64,5,2,5,,
53119678,"East 12th street, Lux 1bd in Greenwich Village",50606612190,verified,Ken,Manhattan,East Village,40.733990000000006,-73.99002,United States,US,False,strict,Entire home/apt,2022,$378 ,$76 ,30,1,11/5/2018,0.12,2,87,357,I would appreciate quest to show respect to the house,
53120230,"Private basement suite on Striver's Row, Harlem",83466629372,unconfirmed,Jake,Manhattan,Harlem,40.81667,-73.94225,United States,US,False,moderate,Entire home/apt,2013,$479 ,$96 ,5,39,7/5/2019,2.68,2,1,90,"- - NO PETS!  NO SMOKING ON PREMISES!  NO PARTY! No ""DRUGS""! - Keep the Place Clean at All Times! - Do Not Ask the ""Neighbors"" for anything.  Ask Me!-  - No Neighbors Interaction! - No ""Drugs"" Please!!! - No Noise! A printed house rule will be provided. Please be respectful to others when all rooms are booked.  10 AM Check-out and Check-in is between 12 PM (noon) - 3 PM.   Late check in after 8 pm is $50, lock out is $50. Respect yourself, Respect others, clean up after yourself.  No Smoking/drinking in apt.  Thank You! Location Rules: The ""Exact Address Location Is Not Stockton St.  It Is 2 Streets Away.  It Is Not Disclosed For Security Reasons"" And Is Given Out 24 Hours Prior to Check-in.  If This Is a Problem for You, Please STOP Here And Contact Other Hosts for Your Stay.   This Is a Part Of My House Rules.",
53120782,Speakeasy Inn Bushwick Three,10771354600,unconfirmed,Cristiano,Brooklyn,Bushwick,40.70064,-73.91828000000001,United States,US,False,moderate,Private room,2015,$627 ,$125 ,1,27,6/3/2019,1.94,5,4,55,"Nothing out of the ordinary...the basic considerations...being reasonably neat and tidy.   Please leave shoes in the entranceway.   NO SMOKING in apartment or deck. Kitchen is available for breakfast only;   I stock the breakfast essentials...coffee, tea, milk, cream, juice, cereal, bread, jelly, and often other items as well.  You may use the fridge for beverages and light snacks all day, but no cooking, frying baking of any meal, and no dinner in the house.   You may store items in the fridge. I'm insensitive to noise, so there is no need to tip-toe.  Plus we are 2 floors apart, you likely won't be hearing me either. I do request that guest be tidy and clean, i.e. dishes not left overnight, etc.  I do have a housekeeper a couple of times a month to handle the big stuff.",
53121335,Cozy Comfort in the Heart of Greenpoint Brooklyn,27806311421,verified,Edyta,Brooklyn,Greenpoint,40.72198,-73.94911,United States,US,True,strict,Entire home/apt,2005,$611 ,$122 ,30,2,6/3/2019,0.13,4,4,354,"For non-smokers only, quiet, respectful, persons.",
53121887,Shoot. Film. Sleep. Unique Loft Space in Brooklyn.,78621117638,verified,Home Studios,Brooklyn,Bedford-Stuyvesant,40.692679999999996,-73.93848,United States,US,False,strict,Entire home/apt,2020,$769 ,$154 ,1,12,4/21/2019,0.86,2,1,89,,
53122439,Room in Hamilton Heights Apr 20-May 20 (flexible),69861165927,unconfirmed,Kelly,Manhattan,Harlem,40.82502,-73.95155,United States,US,False,moderate,Private room,2022,$116 ,$23 ,7,1,5/23/2018,0.07,2,1,0,The Perfect home stay for clean and responsible person. Home is keep neat and clean at all times. Guest wipe up after themselves after using the kitchen. There is no smoking in home and no pets allowed in home. No overnight guest to keep the stay peaceful and quiet.,
53122992,fifth ave,57248837870,verified,Amit,Manhattan,Midtown,40.75775,-73.97955999999999,United States,US,False,flexible,Entire home/apt,2022,$955 ,$191 ,7,14,6/14/2019,0.98,3,1,85,"No drinking, no smoking, no parties, no pets, no drugs, no girlfriends or boyfriends moving in. Looking for a quiet, studious, clean person who is looking for a comfortable and affordable place to stay during the school year.  House is open to both sexes. No children please.",
53123544,Light-filled apartment in heart of Crown Heights,86903506357,verified,Luis,Brooklyn,Crown Heights,40.6752,-73.95231,United States,US,True,strict,Entire home/apt,2004,$62 ,$12 ,3,6,7/29/2018,0.45,4,2,0,,
53124096,Cozy Brooklyn Studio with lots of light,45863865759,unconfirmed,Armine,Brooklyn,Boerum Hill,40.689440000000005,-73.98904,United States,US,True,strict,Entire home/apt,2008,$268 ,$54 ,3,3,1/2/2019,0.21,2,1,0,"Check-in is 2:00 pm, and checkout 11:00 am. You may bring bags in before check in time or leave it to pick up later. Let me know to arrange it. After reservation please send me your arrival and departure time for logistics Help yourself coffee or tea anytime NO shoes to the second floor  Keep the volume low before 8am and after 10pm Close the doors gently No shower after  11:30pm No laundry after  before 9am and after 8pm Keep the kitchen in a decent condition after your use Close the shower curtain well, no hair in the tub, no water around the sink on the sink there is a sponge you can use it to dry Turn off the light when you leave the room Trash out from the room  BLUE BOX recycling  Please respect this rules. Full refunded of security deposit in this case",
53124649,Williamsburg Apartment with Panoramic View/Rooftop,37274150590,unconfirmed,Ulker,Brooklyn,Williamsburg,40.71692,-73.94131999999999,United States,US,True,flexible,Entire home/apt,2007,$978 ,$196 ,3,25,6/29/2019,1.8,5,1,157,"- I like to keep a quiet house. Please keep all noise low, especially in the morning and late at night. - Please take your shoes off before entering the apartment. - Always bolt the apartment door when entering or exiting. - If I am away when you check out, please put the keys in the lockbox and remember to set the code to 0000. - I don't charge for cleaning or extra people. Kindly return the favor by keeping the place clean. - No smoking indoors. - You may make use of food and beverages only if they are explicitly shared. If you have any questions, please ask.",
53125201,Walter’s place,13655434571,unconfirmed,Mia,Queens,Flushing,40.75499,-73.78902,United States,US,False,flexible,Private room,2003,$91 ,$18 ,1,68,6/21/2019,4.55,3,1,299,I except guest to be respectful of my home and follow my house rules.,
53125753,Cozy shared apartment close to Midtown!,58950404792,verified,Rebecca,Queens,Astoria,40.76343,-73.92248000000001,United States,US,False,flexible,Shared room,2006,$65 ,$13 ,4,3,9/1/2018,0.22,2,1,0,,
53126305,Chic & Cozy Brooklyn Apartment,78634833163,verified,Nichole,Brooklyn,Bushwick,40.68994,-73.90526,United States,US,True,strict,Private room,2021,$259 ,$52 ,1,8,7/6/2019,3.08,5,1,106,No smoking No Loud Music No Bad Word,
53126858,The Cozy Apartment; limited time offer 10 off.,21181881335,verified,Rhonda,Brooklyn,Cypress Hills,40.67765,-73.89327,United States,US,False,strict,Entire home/apt,2017,$798 ,$160 ,3,48,6/4/2019,3.36,4,2,294,,
53127410,Spacious private bedroom with high ceilings,20278308155,verified,Dier,Brooklyn,Bedford-Stuyvesant,40.68869,-73.93449,United States,US,False,moderate,Private room,2003,"$1,183 ",$237 ,20,1,7/16/2018,0.08,4,1,0,"NO PETS.  NO SMOKING.  NO PARTIES.  No recreational drugs.  No open flames.  No excess noise after 10:00 pm.  Avoid disturbing neighbors.   NO PETS.  If a pet is found on the premise, a pet surcharge of $300 will be applied. You will be asked to leave immediately and will forfeit your security deposit if an animal is on the property without permission of owner. NO SMOKING PLEASE.  A $500 cleaning fee will be deducted from your deposit if smoking occurs in the unit. This is a NO PARTY house. Parties, loud get-togethers, or gatherings are not allowed because of neighbor issues, and possible damage to property. If a party, loud gathering, or loud disturbance does occur, or if neighbors or other guests call for a loud disturbance, you will forfeit your security deposit and will be evicted immediately. Please Note:  Guests must provide their own toiletries/cleaning supplies/paper products.  We will have a starter kit of toiletries and cleaning supplies at the house, but you will need to rep",
53127962,New Cozy Quite Studio with Huge Secluded Yard,7160028903,unconfirmed,Allie,Manhattan,Upper East Side,40.78028,-73.94769000000001,United States,US,True,moderate,Entire home/apt,2012,$615 ,$123 ,3,26,5/24/2019,1.91,3,2,340,Please be respectful of the neighbors after 9 pm. Treat the home as you would your own.,
53128515,Large Bedroom Apartment with a Private Bathroom,19404275709,verified,Paul,Manhattan,Upper East Side,40.77515,-73.95299,United States,US,True,flexible,Entire home/apt,2009,$990 ,$198 ,4,1,1/2/2019,0.16,3,2,0,"Check-in is 2:00 pm, and checkout 11:00 am. You may bring bags in before check in time or leave it to pick up later. Let me know to arrange it. After reservation please send me your arrival and departure time for logistics Help yourself coffee or tea anytime NO shoes to the second floor  Keep the volume low before 8am and after 10pm Close the doors gently No shower after  11:30pm No laundry after  before 9am and after 8pm Keep the kitchen in a decent condition after your use Close the shower curtain well, no hair in the tub, no water around the sink on the sink there is a sponge you can use it to dry Turn off the light when you leave the room Trash out from the room  BLUE BOX recycling  Please respect this rules. Full refunded of security despoit in this case",
53129067,Beautiful brownstone room,18278873716,unconfirmed,Andrea,Brooklyn,Crown Heights,40.67716,-73.93885,United States,US,True,moderate,Private room,2012,$62 ,$12 ,7,0,,,3,1,0,There are no towels included,
53129619,Sunny Apt/Park Slope Brooklyn 25 min. ride to city,28070630802,verified,Chandtisse,Brooklyn,Gowanus,40.66623,-73.99266999999999,United States,US,True,moderate,Private room,2011,$495 ,$99 ,2,49,6/24/2019,3.3,4,3,74,"Check-in is 2:00 pm, and checkout 11:00 am. You may bring bags in before check in time or leave it to pick up later. Let me know to arrange it. After reservation please send me your arrival and departure time for logistics Help yourself coffee or tea anytime NO shoes to the second floor  Keep the volume low before 8am and after 10pm Close the doors gently No shower after  11:30pm No laundry after  before 9am and after 8pm Keep the kitchen in a decent condition after your use Close the shower curtain well, no hair in the tub, no water around the sink on the sink there is a sponge you can use it to dry Turn off the light when you leave the room Trash out from the room  BLUE BOX recycling  Please respect this rules. Full refunded of security deposit in this case",
53130172,"Perfect home by Prospect Park ,Brooklyn",39531179552,unconfirmed,Dana,Brooklyn,Flatbush,40.65291,-73.95285,United States,US,True,flexible,Private room,2006,$187 ,$37 ,2,36,6/5/2019,2.48,4,1,17,"I'm pretty easy going, but I expect my guests to be considerate of, me, my space, and my neighbors.  This is a non smoking/ drug free space.  No excessive noise. please keep place clean. clean any dishes you might use.  I prefer that my guests not bring any extra guests that are not on the reservation into the house unless otherwise discussed with me before hand.  Thank you. My dog Wonder is very friendly and gets along well with people and other animals.  Unfortunately though, I can not accommodate other pets at the moment.",
53130724,Beautifully designed + renovated 3 bedroom home,4399732459,unconfirmed,Shannon,Brooklyn,Kensington,40.64655,-73.97251999999999,United States,US,False,moderate,Entire home/apt,2005,$917 ,$183 ,2,31,7/2/2019,2.88,4,1,58,"NO PETS!  NO SMOKING ON PREMISES! NO PARTY! A printed house rule will be provided. Please be respectful to others when all rooms are booked. 10 AM Check-out and Check-in is between 12 PM (noon) - 3 PM.   Late check in after 8 pm is $50, lock out is $50. Respect yourself, Respect others, clean up after yourself.  No Smoking/drinking in apt.  Thank You! Location Rules: The ""Exact Address Location Is Not Disclosed For Security Reasons"" And Is Given Out 24 Hours Prior to Check-in.  If This Is a Problem for You, Please STOP Here And Contact Other Hosts for Your Stay.   This Is a Part Of My House Rules.",
53131276,Perfect Sunny 1BR in the Treetops,89126498090,verified,Joe,Manhattan,NoHo,40.72547,-73.99284,United States,US,True,moderate,Entire home/apt,2020,$214 ,$43 ,10,1,5/23/2019,0.64,5,1,57,,
53131828,25 min to midtown  Manhattan with 7 train.,89185056805,verified,Serdar,Queens,Woodside,40.74579,-73.8997,United States,US,True,flexible,Private room,2016,$91 ,$18 ,2,6,6/2/2019,0.43,5,1,0,,
53132381,Wall Street Luxuriuos apartment Financial District,22644451660,unconfirmed,Tina,Manhattan,Financial District,40.705870000000004,-74.0118,United States,US,True,strict,Private room,2004,$644 ,$129 ,3,15,7/7/2019,1.01,5,1,338,"- - NO PETS!  NO SMOKING ON PREMISES! NO PARTY! A printed house rule will be provided. Please be respectful to others when all rooms are booked. 10 AM Check-out and Check-in is between 12 PM (noon) - 3 PM.   Late check in after 8 pm is $50, lock out is $50. Respect yourself, Respect others, clean up after yourself.  No Smoking/drinking in apt.  Thank You!  Location Rules: The ""Exact Address Location Is Not Disclosed For Security Reasons"" And Is Given Out 24 Hours Prior to Check-in.  If This Is a Problem for You, Please STOP Here And Contact Other Hosts for Your Stay.   This Is a Part Of My House Rules.",
53132933,New condo-City view-Balcony&elevator,24637972349,verified,Ha,Manhattan,Chinatown,40.71585,-73.99492,United States,US,False,moderate,Private room,2007,$951 ,$190 ,1,14,6/30/2019,0.96,4,4,234,,
53133485,Inexpensive Private Room with NYC / SIUH Access #2,14473099042,unconfirmed,Amarjit S,Staten Island,Arrochar,40.597609999999996,-74.08346999999999,United States,US,False,moderate,Private room,2003,$370 ,$74 ,4,6,3/26/2019,0.41,2,8,285,,
53134038,Large Private Room in a Magnificent Penthouse NYC2,75476152834,unconfirmed,Tomás,Manhattan,East Village,40.722,-73.98396,United States,US,False,moderate,Private room,2017,$654 ,$131 ,5,11,6/27/2019,0.84,4,2,76,"Nothing out of the ordinary...the basic considerations...being reasonably neat and tidy.   Please leave shoes in the entranceway.   NO SMOKING in apartment or deck. Kitchen is available for breakfast only;   I stock the breakfast essentials...coffee, tea, milk, cream, juice, cereal, bread, jelly, and often other items as well.  You may use the fridge for beverages and light snacks all day, but no cooking, frying baking of any meal, and no dinner in the house.   You may store items in the fridge. I'm insensitive to noise, so there is no need to tip-toe.  Plus we are 2 floors apart, you likely won't be hearing me either. I do request that guest be tidy and clean, i.e. dishes not left overnight, etc.  I do have a housekeeper a couple of times a month to handle the big stuff.",
53134590,"HOTEL ROOM LIKE!!!  WITH AFFORDABLE RATE!!!    ""A""",97515867532,verified,Viviana,Queens,Woodhaven,40.68783,-73.86679000000001,United States,US,False,strict,Private room,2013,$559 ,$112 ,3,28,6/24/2019,1.95,5,9,359,"•Parties or Gatherings are not permitted. •Please be courteous to the neighbors and keep noise levels low, especially between the hours of 10pm-10am. •Absolutely no smoking in the apartment. Smoking only on the back porch •Overnight guests are not permitted unless included on the initial reservation. •Please help us conserve energy by turning off lights, small appliances, lamps, etc. when not being used.  •Please store recyclables separately. •Pets are not permitted at any time. •If you need flexibility around the specified check in or check out times, let us know in advance.",
53135142,"Comfortable,Spacious,clean Private Room",52603905899,verified,June,Manhattan,East Harlem,40.79578,-73.94523000000001,United States,US,False,moderate,Private room,2021,$405 ,$81 ,2,31,6/23/2019,2.1,2,1,265,,
53135695,SoHo 1 Bedroom,7321145900,verified,John,Manhattan,SoHo,40.72503,-74.0013,United States,US,False,flexible,Entire home/apt,2017,$509 ,$102 ,3,26,6/21/2019,1.81,3,1,42,NO SMOKING ON PREMISES! NO PARTY! A printed house rule will be provided. Please be respectful to others when both rooms are booked. Non-registered guest may not stay overnight  11AM check-out (FIRM) and check-in time is between 3-9PM. No check-in later than 9PM.,
53136247,Greenpoint Delight,79316798147,unconfirmed,Caroline,Brooklyn,Greenpoint,40.72152,-73.94945,United States,US,True,strict,Entire home/apt,2016,$224 ,$45 ,4,12,6/23/2019,0.92,3,1,0,,
53136799,"43rd Street=TIME SQUARE
PRIVATE BEDROOM",4378394271,verified,Taz,Manhattan,Hell's Kitchen,40.7578,-73.99211,United States,US,True,strict,Private room,2015,$767 ,$153 ,1,95,7/4/2019,6.42,5,6,280,"•Smoking is allowed outside the house.  •Sorry, not pets - my Boston Terrier prefers 2 legged visitors.  •Please take shoes off in the living room. •Do not flush anything down toilet except toilet paper •Please maintain a reasonable volume •Please respect the property •Do not purchase anything on cable Check out is at 11am on the last day of your reservation unless discussed during the booking process.  Thank you!",
