10840561,Charming 1BR at Columbus Circle,20474459548,unconfirmed,Oliver,Manhattan,Hell's Kitchen,40.76686,-73.98393,United States,US,False,strict,Private room,2020,$948 ,$190 ,2,3,10/23/2016,0.09,3,3,0,"No smoking inside the house.  No loud parties or disturbing the peace or public nuisance allowed. This is a strictly residential rental NOT commercial.  If holding parties you must first seek owner's permission before inviting anyone other than immediate family.   This is a peaceful family neighborhood and I like to keep it that way.  Clean after yourself, clean the stove and oven and all the appliances.  Leave everything exactly in the condition it is in when you first arrived.  Treat this house as if it is your own with the proper respect and courtesy.  No pets allowed.  Check in is 4PM, Check out 10AM.  On Check out date please leave all the dirty sheets, towels, linens by the washer for the maid.  Please leave the outside trash container for the garbage truck on the night before it arrives.",
10841113,Modern 2 BR Duplex apartment in Sutton Place - 42,17928961678,unconfirmed,Gordon,Manhattan,Midtown,40.76036,-73.96462,United States,US,True,flexible,Entire home/apt,2006,$744 ,$149 ,30,7,3/14/2019,0.22,2,5,321,"Ali's House Rules When you stay in an Airbnb, you're staying in someone's home. Here are some guidelines Joe asks all guests to follow.  Quiet down AFTER 10PM specially in week days",
10841665,Cosy and Bright Bedroom *CENTRAL HARLEM*,55222378943,verified,Sonia,Manhattan,Harlem,40.80914,-73.94363,United States,US,True,strict,Private room,2013,$968 ,$194 ,1,79,6/19/2019,2.24,4,3,0,,
10842217,"Huge, private bedroom with bathroom",90396735474,verified,Claudia,Queens,Maspeth,40.73425,-73.89553000000001,United States,US,False,flexible,Private room,2018,$489 ,$98 ,2,24,8/21/2018,0.69,2,1,281,No pets and No smoking. Guests need to be respectful and considerate of others.,
10842770,Nice Room in Charming Apartment,40646972841,unconfirmed,Victor,Manhattan,Nolita,40.72363,-73.99546,United States,US,True,flexible,Shared room,2005,$656 ,$131 ,1,228,6/21/2019,6.36,2,4,103,,
10843322,#MANHATTAN - Upper West BIG ROOM w/tv,43852040150,unconfirmed,G. Matthew,Manhattan,Harlem,40.8197,-73.95326,United States,US,True,strict,Private room,2012,$510 ,$102 ,2,72,6/8/2019,2.09,5,3,72,"Please do not smoke, and be respectful of others in the house.",
10843874,Location!! Welcome to my Lovely Home.,83116955633,verified,Diane,Manhattan,Greenwich Village,40.72738,-74.00018,United States,US,False,strict,Private room,2018,$678 ,$136 ,1,161,6/22/2019,4.43,3,1,125,"House Rules 1. Check-in is 4 pm local time. If the unit is ready earlier, we’ll let you know. Check-out is normally 11 am local time, but we’d be happy to extend it as long as we don’t have a cleaning scheduled. Just let us know.  2. All bookings require a security deposit of at least $300, which will be refunded within 7 days of your check-out. 3. For security measures we require all guests to provide proof of identification through ID verification on our own website. In order to check in we'll need a photo of your ID.  4. Our cancellation policy is as shown on our ad and defined by the site you are booking through.  5. Don’t let $300 go up in smoke. There's no smoking allowed in any Flatbook and a $300 fine for breaking this rule.  6. Unfortunately we don’t allow pets in any of our apartments. 7. Unless you’re staying in one of our specialty apartments, we don’t allow parties or excessive noise. 8. If we find the place very messy, we have to charge an extra $40 for every extra hour o",
10844427,Simple room in the heart of Bed Stuy,12677788260,unconfirmed,Lydia,Brooklyn,Bedford-Stuyvesant,40.685829999999996,-73.94112,United States,US,False,strict,Entire home/apt,2017,$272 ,$54 ,1,7,5/20/2019,0.43,1,1,37,No pets.  No smoking inside.,
10844979,Bright and Comfy near Prospect Park,27312438878,verified,Adam,Brooklyn,Crown Heights,40.66427,-73.95770999999999,United States,US,True,flexible,Private room,2005,$726 ,$145 ,2,1,8/30/2016,0.03,3,1,0,No pets. No smoking. Guests need to be respectful and gentle.,
10845531,"Sunny, Pre-War Brooklyn Share",42468535493,unconfirmed,Stacey Rae,Brooklyn,Flatbush,40.65126,-73.96388,United States,US,False,flexible,Shared room,2018,$742 ,$148 ,1,5,10/1/2017,0.15,5,2,0,"We are a relaxed household, but expect guests to use common sense and to respect our home.  Smoking is not permitted in any part of the property, including common living spaces, the porch, bedroom and bedroom window. Anyone found to have smoked will be asked to leave immediately. When using the kitchen, guests agree to: - Wash up all dishes, cutlery, pots and pans after use - Clean work surfaces and table - Return all utensils to their origin place - Put all rubbish in the trash Shower & Toilet: - Please leave the shower and toilet in a clean, hygienic and fresh state.  Bedroom: - Please refrain from playing music prior to 9am and after 8pm. Bikes: - There are two bikes available to use at your own risk. Guests outside of AirBnB are not permitted to stay in the apartment.",
10846084,Private Bedroom in 2-floor Bushwick Apartment,30040886760,unconfirmed,Cheno,Brooklyn,Bushwick,40.68758,-73.91320999999999,United States,US,False,strict,Private room,2011,$527 ,$105 ,1,2,8/6/2016,0.06,1,1,0,"Guest should do there dishes and clean after themselves. No alcohol, No drugs, No party's and most important Don't Disturb other guests!",
10846636,# TIMES SQUARE - 19 MinutesBIG ROOM,80082041537,unconfirmed,G. Matthew,Manhattan,Harlem,40.82097,-73.95473,United States,US,False,flexible,Private room,2016,$470 ,$94 ,2,97,6/22/2019,2.79,2,3,101,"Please treat my place as your own. Turn off the lights, AC, fan, etc when you leave the apartment, and wash any kitchenware and dishes that you've used. Put used towels on the floor, so that I now they've been used.",
10847188,"Sunny, peaceful home in fantastic location",67430211679,verified,Irene,Brooklyn,Gowanus,40.68203,-73.98427,United States,US,False,flexible,Private room,2008,"$1,185 ",$237 ,1,1,8/9/2016,0.03,4,1,0,"Share our house as a guest, don't worry about cost of snacks or an occasional beer. No smoking. Please consult first if you will be traveling with small children. We try to keep the space clean and ask everyone to remove their shoes in the appartment and be respectful to everyone.",
10847740,2 BDR in Bushwick Brooklyn!,25886843662,unconfirmed,Andrew,Brooklyn,Bushwick,40.69647,-73.92474,United States,US,False,moderate,Entire home/apt,2019,$627 ,$125 ,3,102,6/29/2019,2.82,1,1,31,,
10848293,Massive Beautiful Room!,93362416074,unconfirmed,Anthony,Brooklyn,Crown Heights,40.67023,-73.94078,United States,US,False,moderate,Private room,2007,$133 ,$27 ,1,82,7/5/2019,2.28,1,5,356,"Guest should do there dishes and clean after themselves. No alcohol, No drugs, No party's and most important Don't Disturb other guests!",
10848845,Airy Bright 1 Bedroom in Heart of Greenpoint BK,47447362510,unconfirmed,Lauren,Brooklyn,Greenpoint,40.72914,-73.9567,United States,US,True,flexible,Entire home/apt,2014,$143 ,$29 ,1,0,,,2,1,0,"Please be respectul of other occupants of the apartment. This means: no smoking indoors, no parties, and cleaning up after yourself.",
10849397,"Heart of Williamsburg, Very Large Bedroom!",16545662959,unconfirmed,Jeffrey,Brooklyn,Williamsburg,40.7086,-73.94555,United States,US,True,flexible,Private room,2005,"$1,096 ",$219 ,2,6,11/6/2016,0.17,1,1,0,,
10849950,Cozy comfortable room near LGA&JFK#2,13447716326,verified,John,Queens,Richmond Hill,40.690540000000006,-73.82185,United States,US,True,moderate,Private room,2012,$556 ,$111 ,3,19,6/17/2019,0.55,2,5,278,,
10850502,Well Connected & Beautiful Sanctuary!,45065621125,unconfirmed,Severino,Brooklyn,Clinton Hill,40.68477,-73.96757,United States,US,True,moderate,Entire home/apt,2003,"$1,136 ",$227 ,10,0,,,4,1,0,,
10851054,Cozy sunlit 2bed w PRIVATE ROOFTOP in Brooklyn,85033465604,unconfirmed,Christine,Brooklyn,Bedford-Stuyvesant,40.68679,-73.957,United States,US,True,strict,Entire home/apt,2016,$344 ,$69 ,1,2,8/27/2016,0.06,5,1,0,"Please try to make less noise when talking, moving suitcases in your room as the house has very little sound barrier. The stairs makes a lot of noise when people walk fast, please be considered. The guest must be a non-smoker and his/her clothes should not smell of smoke. No smoking inside/outside.  Use of cologne/perfume/other product with noticeable scent/ sprays are not allowed in or out of the house. Trash has to be separated from recycle. No trash may be put in any containers outside of the house. If you unable to separate the trash, at least, please be considered and don't mix recycles with food or personal product waist. Single use plastic bags should not be taking from the store: you will get your personal fordable reusable bag and may keep it. Please use other resources conservatively and be conscience about the impact on the environment. We all share this planet. Don't give this mailing address to anyone before confirming by email First offense address sharing $200, and every",
10851607,LoraLisa's Flats,9944836174,unconfirmed,Lorna,Brooklyn,Prospect-Lefferts Gardens,40.660109999999996,-73.95965,United States,US,True,moderate,Entire home/apt,2007,$439 ,$88 ,3,15,6/26/2019,1.46,3,2,154,1. guest should do the dishes by themselves. 2. late check out will be charged $30 from your deposit.,
10852159,"Modern 3 BR home, 4 blocks from Public Transport!",1829746864,verified,Ann,Brooklyn,East Flatbush,40.65565,-73.93573,United States,US,False,flexible,Entire home/apt,2007,$597 ,$119 ,3,3,12/9/2018,0.33,2,1,0,"House Rules 1. Check-in is 4 pm local time. If the unit is ready earlier, we’ll let you know. Check-out is normally 11 am local time, but we’d be happy to extend it as long as we don’t have a cleaning scheduled. Just let us know.  2. All bookings require a security deposit of at least $300, which will be refunded within 7 days of your check-out. 3. For security measures we require all guests to provide proof of identification through ID verification on our own website. In order to check in we'll need a photo of your ID.  4. Our cancellation policy is as shown on our ad and defined by the site you are booking through.  5. Don’t let $300 go up in smoke. There's no smoking allowed in any Flatbook and a $300 fine for breaking this rule.  6. Unfortunately we don’t allow pets in any of our apartments. 7. Unless you’re staying in one of our specialty apartments, we don’t allow parties or excessive noise. 8. If we find the place very messy, we have to charge an extra $40 for every extra hour o",
10852711,Newly renovated studio in heart of downtown NYC,84390708131,verified,Joe,Manhattan,East Village,40.72441,-73.98683,United States,US,True,moderate,Entire home/apt,2016,$164 ,$33 ,5,5,3/21/2019,0.14,2,1,0,"House Rules 1. All bookings made at least a week before check in are fully refundable if cancelled within 24 hours of booking. After this, you will receive a 50% refund if you cancel at least 7 days before the start of your trip. 2. Check-in time is any time after 4 pm local time. If the unit is ready earlier, we’ll let you know. Check-out is normally 11 am local time, but we’d be happy to extend it as long as we don’t have a cleaning scheduled. Just let us know.  3. All bookings require a security deposit of at least $300. 4. For security measures we require all guests to provide proof of identification through ID verification on our own website. In order to check in, we'll need a photo of your ID.  5. Don’t let $300 go up in smoke. There's no smoking allowed in any Flatbook and a $300 fine for breaking this rule.  6. Unfortunately we don’t allow pets in most of our apartments. 7. Unless you’re staying in one of our specialty apartments, we don’t allow parties or excessive noise. 8. I",
10853263,纽约之家(Sunny Home4),16984542064,verified,Amy,Queens,Flushing,40.74447,-73.83185999999999,United States,US,False,strict,Private room,2010,"$1,062 ",$212 ,1,60,6/23/2019,1.68,1,8,53,,
10853816,"Quaint, Private Sunset Park Brownstone Experience",97358951554,unconfirmed,Debra,Brooklyn,Sunset Park,40.646370000000005,-74.00558000000001,United States,US,True,moderate,Private room,2017,$285 ,$57 ,21,0,,,4,1,0,Please take off your shoes outside of house. Keep clean in the kitchen and bathroom. This room is only for one person. ,
10854368,Bedroom in industrial huge loft in Greenpoint,72619640163,verified,Nikki,Brooklyn,Greenpoint,40.72828,-73.94225,United States,US,True,moderate,Private room,2012,"$1,136 ",$227 ,5,0,,,1,3,0,"Please expect to share the apartment with guests having various backgrounds. Be respectful and decent, also enjoy interacting with each other. Please dress descent in the house especially in and out of the shower.",
10854920,"Cozy, two bedrooms in a shared apartment.",52380167778,verified,Carmen,Manhattan,Harlem,40.83065,-73.94708,United States,US,False,flexible,Private room,2019,$279 ,$56 ,1,1,8/21/2016,0.03,1,1,87,"House Rules 1. Check-in is 4 pm local time. If the unit is ready earlier, we’ll let you know. Check-out is normally 11 am local time, but we’d be happy to extend it as long as we don’t have a cleaning scheduled. Just let us know.  2. All bookings require a security deposit of at least $300, which will be refunded within 7 days of your check-out. 3. For security measures we require all guests to provide proof of identification through ID verification on our own website. In order to check in we'll need a photo of your ID.  4. Our cancellation policy is as shown on our ad and defined by the site you are booking through.  5. Don’t let $300 go up in smoke. There's no smoking allowed in any Flatbook and a $300 fine for breaking this rule.  6. Unfortunately we don’t allow pets in any of our apartments. 7. Unless you’re staying in one of our specialty apartments, we don’t allow parties or excessive noise. 8. If we find the place very messy, we have to charge an extra $40 for every extra hour o",
10855473,Large Studio Apartment Located Near Times Square,83503384760,unconfirmed,S,Manhattan,Hell's Kitchen,40.76488,-73.98597,United States,US,False,moderate,Entire home/apt,2014,$992 ,$198 ,14,75,6/24/2019,2.18,2,1,34,"You are free to help yourself to the cereal, milk, granola, and juice on the top shelf.  We won't be home to make breakfast but you are welcome to enjoy the pre-made items.  Everything should be on the top shelf.",
10856025,Spacious Room in Central Location,84196430498,verified,Matthew,Manhattan,East Village,40.73395,-73.98899,United States,US,False,flexible,Private room,2010,$223 ,$45 ,5,25,6/21/2019,0.72,2,1,2,Shoes off when in the house. No smoking inside. Try to keep it quiet.,
10856577,"Cozy, Bright 1 Bedroom Fully Furnished Apartment",89695091764,unconfirmed,Mileaka,Brooklyn,Greenpoint,40.73773,-73.95489,United States,US,True,strict,Entire home/apt,2019,$534 ,$107 ,1,12,4/22/2017,0.39,2,1,0,,
10857130,"Best Location, 2bdr Park Slope, Bk",8051049641,unconfirmed,Jim,Brooklyn,Park Slope,40.67928,-73.97791,United States,US,True,flexible,Entire home/apt,2013,"$1,103 ",$221 ,3,103,6/21/2019,2.94,1,2,101,"Do not break anything, leave it the way you found it (or better), do not steal anything. Have fun, have guests and have a good time.",
10857682,Well appointment apartment in doorman building,78213435762,unconfirmed,M,Manhattan,Midtown,40.76543,-73.97929,United States,US,False,moderate,Entire home/apt,2010,$520 ,$104 ,2,2,4/9/2017,0.06,5,1,0,,
10858234,Brooklyn Apartment,87140112505,verified,Thomas,Brooklyn,Greenpoint,40.7205,-73.94125,United States,US,True,moderate,Entire home/apt,2009,$570 ,$114 ,1,1,1/1/2018,0.05,5,1,0,,
10858786,Large Sunny Bedroom in Prospect Heights,74495465257,verified,Lucien,Brooklyn,Prospect Heights,40.67921,-73.97241,United States,US,False,strict,Private room,2018,$153 ,$31 ,4,0,,,1,1,0,,
10859339,Comfortable 1-bedroom in South Slope,87574552327,unconfirmed,Kelly,Brooklyn,Sunset Park,40.66206,-73.99767,United States,US,True,moderate,Private room,2016,$196 ,$39 ,1,0,,,1,1,0,#NAME?,
10859891,Cozy Studio in the Heart of Soho,49318495796,verified,Ezgi,Manhattan,NoHo,40.72618,-73.99523,United States,US,True,moderate,Entire home/apt,2011,$296 ,$59 ,3,2,9/17/2016,0.06,5,1,0,,
10860443,Roomy and Comftable Room,95730080720,verified,Juan,Manhattan,Washington Heights,40.848440000000004,-73.93611,United States,US,False,moderate,Private room,2004,$548 ,$110 ,10,2,10/1/2016,0.06,5,1,0,"No smoking or drugs. We try to keep the house clean, so we take off our shoes when we come in. We all work or go to grad school, so we like to keep the house clean and quiet.",
10860996,SUNNY Spacious Oasis near Prospect Park!,77264609132,unconfirmed,Nancy,Brooklyn,Flatbush,40.638729999999995,-73.95305,United States,US,False,flexible,Private room,2021,$687 ,$137 ,2,1,9/1/2016,0.03,3,1,0,"I love meeting guests, and expect you to be clean and respectful of our shared space.",
10861548,Private Room and Bathroom in Bright Apartment,16596029091,unconfirmed,Kristen,Brooklyn,Bedford-Stuyvesant,40.68466,-73.92727,United States,US,True,moderate,Private room,2006,"$1,081 ",$216 ,2,4,10/1/2016,0.11,1,2,0,#NAME?,
10862100,Awesome Chinatown Apartment,71561906545,verified,Tommy,Manhattan,Little Italy,40.71855,-73.99718,United States,US,False,strict,Shared room,2011,$745 ,$149 ,1,0,,,2,1,0,"We are a non-smoking apartment.  Thank you! Please inquire about pets and kids - we don't have any, but it's OK if you do as long as you know what you need to bring to accommodate! :)",
10862653,Spacious & quiet room w/ Balcony,38142228177,verified,Jorge,Brooklyn,Bedford-Stuyvesant,40.68571,-73.95708,United States,US,False,flexible,Private room,2018,$119 ,$24 ,4,4,9/21/2017,0.12,1,1,0,"House Rules 1. Check-in is 4 pm local time. If the unit is ready earlier, we’ll let you know. Check-out is normally 11 am local time, but we’d be happy to extend it as long as we don’t have a cleaning scheduled. Just let us know.  2. All bookings require a security deposit of at least $300, which will be refunded within 7 days of your check-out. 3. For security measures we require all guests to provide proof of identification through ID verification on our own website. In order to check in we'll need a photo of your ID.  4. Our cancellation policy is as shown on our ad and defined by the site you are booking through.  5. Don’t let $300 go up in smoke. There's no smoking allowed in any Flatbook and a $300 fine for breaking this rule.  6. Unfortunately we don’t allow pets in any of our apartments. 7. Unless you’re staying in one of our specialty apartments, we don’t allow parties or excessive noise. 8. If we find the place very messy, we have to charge an extra $40 for every extra hour o",
10863205,East Village Cozy Single Bed - Female Only,36395059263,unconfirmed,Shunan,Manhattan,East Village,40.726079999999996,-73.98798000000001,United States,US,False,strict,Shared room,2018,$333 ,$67 ,1,1,9/18/2016,0.03,5,2,0,the female is better(最好是女性房客),
10863757,Peaceful bedroom in Crown Heights Duplex,92663859478,unconfirmed,J.,Brooklyn,Crown Heights,40.67151,-73.91733,United States,US,True,strict,Private room,2013,$612 ,$122 ,2,167,6/28/2019,4.73,3,2,162,I prefer those person Who would rent my room over 15 days once(Price will be lower) No smoking inside Cleaning my room at least one time in 3 days No other inappropriate actions on bed Thank you so much,
10864309,"Quiet bedroom in a bright loft, Heart of Manhattan",48669215962,unconfirmed,Pl,Manhattan,Midtown,40.74205,-73.98382,United States,US,False,strict,Private room,2015,$231 ,$46 ,2,0,,,3,1,0,"No cologne/perfumed aftershaves/any sprays/candles/anything burning Non-smoker, no smoking in and out of home No guests/visitors Please be considered to other and make less noise NO street shoes indoor Light use of microwave/toaster oven, not for cooking Pick up after yourself No eating in bed Shower is not to be used 5.45 am-10 am to prevent long wait for bathroom",
10864862,Pre War Park Slope on Prospect Park Bedroom 2,536497979,unconfirmed,Louisa,Brooklyn,South Slope,40.664320000000004,-73.97954,United States,US,False,flexible,Private room,2012,$64 ,$13 ,4,28,12/13/2018,0.8,1,2,99,1) No Smoking in property!!!  2) Do not slam doors!!! Close lightly Please!!! 3) No Shoes in house (except slippers) 4) Quiet down AFTER 10PM.,
10865414,Townhouse for rent,47506766349,unconfirmed,Inji,Brooklyn,Greenpoint,40.72704,-73.94587,United States,US,False,strict,Entire home/apt,2016,"$1,080 ",$216 ,14,0,,,4,1,0,"Quiet, clean, respectable, no smoking  Yes you can practice violin etc (*extra credit if you're a music student/musician, duh~)",
10865966,Cool Urban Brooklyn,6991529389,unconfirmed,Jordy,Brooklyn,Flatbush,40.65263,-73.95734,United States,US,False,flexible,Private room,2014,"$1,124 ",$225 ,5,0,,,1,1,0,"No drugs/ No loud sex ( sound easily go through to my roomie's room next door ) / ID copy required for check in, and it need to match your credit card information/ Please try to be nice to my fellow roomies, they are all both from China, really organized and nice guys, we are all go to Boston University, we tried really hard to keep this house clean and in the order./ Lost keys charge: $10.04",
10866519,"Best South Williamsburg Room, Sunny & Serene",40519192538,unconfirmed,Sarah,Brooklyn,Williamsburg,40.71026,-73.95165,United States,US,True,strict,Private room,2007,$338 ,$68 ,3,1,8/16/2016,0.03,4,1,0,This is a non-smoking unit.,
10867071,"Steps to the Metro, Minutes to Manhattan!",54310803006,unconfirmed,Virgilio,Brooklyn,Bushwick,40.699740000000006,-73.9338,United States,US,False,flexible,Entire home/apt,2009,$145 ,$29 ,2,169,6/30/2019,4.77,4,1,26,"Clean, tidy & respectful. However PLEASE make yourself at home!",
10867623,Cozy Garden Apartment Heart of BK!,47608370595,unconfirmed,Sarah,Brooklyn,Fort Greene,40.69191,-73.97151,United States,US,True,moderate,Entire home/apt,2007,$993 ,$199 ,7,2,4/17/2017,0.06,3,1,0,,
10868176,Modern 2-bedroom apartment near subway and parks,16280769123,verified,Negra,Queens,Astoria,40.75687,-73.91597,United States,US,False,moderate,Entire home/apt,2022,$593 ,$119 ,2,135,7/6/2019,3.8,2,1,168,No smoking,
10868728,1 bedroom full apartment completely private!,13139407257,unconfirmed,Horacio,Queens,Corona,40.745979999999996,-73.85683,United States,US,True,moderate,Entire home/apt,2017,$518 ,$104 ,7,60,6/30/2019,1.65,2,1,284,#NAME?,
10869280,Cozy Studio blocks from Time Square & the Hudson.,38977051253,verified,Steven,Manhattan,Hell's Kitchen,40.7621,-73.99424,United States,US,False,moderate,Entire home/apt,2016,$145 ,$29 ,1,2,1/5/2017,0.06,5,1,0,"Please remember that this is a residential building. The building rules, apartment occupancy restrictions and the year-round tenants must be respected.  Parties, pets and smoking are not allowed under any circumstances and incur significant fees. ",
10869832,Beautiful Studio with Back Patio,32215113856,unconfirmed,Eric,Brooklyn,Brooklyn Heights,40.69455,-73.99339,United States,US,True,flexible,Entire home/apt,2015,"$1,199 ",$240 ,2,3,10/10/2016,0.08,2,1,0,"Please remember that this is a residential building. The building rules, apartment occupancy restrictions and the year-round tenants must be respected.  Parties, pets and smoking are not allowed under any circumstances and incur significant fees.",
10870385,The People's Brownstone,66685373337,unconfirmed,Carol Ann,Manhattan,Harlem,40.81217,-73.94691999999999,United States,US,False,flexible,Entire home/apt,2012,$221 ,$44 ,3,86,7/1/2019,2.43,4,1,226,"It is very quiet neighborhood,  -No party is allowed in the apt. And  -please keep quiet at late time,after 10:00pm.  - Please take off shoes in the apt.  - Please turn off the central air when leave. You can leave the key and parking permit on table and lock the door. Thanks. Please feel free to let me know you have any question. Thanks.",
10870937,Sunny Designers Home w/Terrace - Heart of Downtown,8772766116,unconfirmed,Alexandria,Manhattan,East Village,40.72191,-73.9813,United States,US,False,strict,Entire home/apt,2018,"$1,128 ",$226 ,5,2,10/3/2016,0.06,5,1,0,,
10871489,An Apartment to Call Home w/ Free Airport Pickup!,26987080991,verified,Jared,Queens,Sunnyside,40.74671,-73.91636,United States,US,True,flexible,Entire home/apt,2011,$188 ,$38 ,1,7,12/30/2018,0.2,4,4,365,,
10872042,Sunny Cute Studio (15 Mins to Manhattan),90947713980,verified,Sheng,Queens,Woodside,40.74389,-73.89325,United States,US,False,flexible,Entire home/apt,2015,$330 ,$66 ,1,0,,,2,1,0,,
10872594,Amazing Private room in LIC minutes to Manhattan,60561781635,verified,Joelle,Queens,Long Island City,40.74612,-73.94247,United States,US,False,moderate,Private room,2005,$97 ,$19 ,1,11,8/25/2016,0.3,4,2,0,Shoes off preferred.,
10873146,Spacious Studio/Pvt Bath 2 blks to Central Park N,59851279681,verified,Chapman,Manhattan,Harlem,40.802640000000004,-73.9554,United States,US,True,strict,Private room,2006,$138 ,$28 ,3,62,7/14/2017,1.74,2,1,0,,
10873699,Cozy private bedroom in West Harlem,22542793506,unconfirmed,Brandi,Manhattan,Harlem,40.80431,-73.95245,United States,US,False,flexible,Private room,2018,$829 ,$166 ,2,3,8/25/2016,0.08,4,2,0,"1. No damage to the house or furniture 2. No Smoking, No Pets, No Drugs 3. No more sleepover people then you booked 4. Keep quiet after 11:00 PM 5. Be respectful to neighbors 6. Keep the kitchen clean after used 7. Keep the bathroom clean after used 8. Return “Parking Permit"" before check out 9. Check-in: 3PM, Check-out: 11:00AM",
10874251,Great Studio near Time Square,4254979971,unconfirmed,Jeniffer,Manhattan,Hell's Kitchen,40.76469,-73.99394000000001,United States,US,False,strict,Entire home/apt,2021,$54 ,$11 ,30,8,5/4/2019,0.24,2,31,332,- Please clean tools after you use kitchen - Please keep quite after 11pm,
