3920794,SoHo/Village Studio,75108240316,unconfirmed,Russell,Manhattan,Greenwich Village,40.727740000000004,-74.00004,United States,US,False,strict,Entire home/apt,2010,$669 ,$134 ,2,2,6/26/2015,0.04,4.0,1,157,"•Please do not have pets in the house •Please do not smoke anywhere on the premises •Please lock and shutter living room windows when leaving the house for safety reasons •Please check out at the time I asked you by email •Please do not access the office on the top floor or the basement •Please leave the house as tidy as you found it •Turn off A/C, grill, oven, appliances when not using them •Keep the gate in front closed (so next door dog does not escape) •Please do not have large parties or extra people to sleep over •Please do not open the windows in the dining room and be careful of the windows in the baby’s room and the yellow room on the top floor (old windows that can fall down or delicate set up for A/C) •Refrain from eating or drinking dark liquids/foods on the white couches",
3921346,5107-Studio Doorman GYM LuX,91984706823,unconfirmed,Jeremy & Laura,Manhattan,Upper West Side,40.790820000000004,-73.97452,United States,US,True,flexible,Entire home/apt,2008,$769 ,$154 ,30,4,9/4/2017,0.09,5.0,96,309,,
3921898,Great cozy in Brooklyn,3144816077,verified,Fabeye & Nabou,Brooklyn,Bedford-Stuyvesant,40.69634,-73.9441,United States,US,True,flexible,Private room,2007,$651 ,$130 ,1,52,4/8/2019,0.87,3.0,2,156,"No smoking! Please let me know as soon as you make reservation about your time of arrival.  Late arrival after 10:00 P.M. there will be $150 extra charge.  $50/more than one person during the holidays..  The use of the washer and dryer between 8:00 A.M.-9:00 P.M.  No refund if cancelled in less than two weeks.   Please take time to read all the house rule details on this site. Yes, I am very close to public transportation. Yes, you can walk every where from my place. Yes, I charge $50 for WiFi",
3922451,Lower East Side Artist's Sanctuary,46481542677,unconfirmed,Elyse,Manhattan,Lower East Side,40.71962,-73.98434,United States,US,False,moderate,Entire home/apt,2019,$179 ,$36 ,4,7,1/3/2016,0.14,5.0,1,299,,
3923003,Colorful 2 Bedroom in Brooklyn,94271188010,unconfirmed,Alison,Brooklyn,Williamsburg,40.71863,-73.94416,United States,US,True,flexible,Entire home/apt,2013,"$1,018 ",$204 ,24,0,,,1.0,1,284,#NAME?,
3923555,Trendy East Village Penthouse Apt,30501077927,verified,Maha,Manhattan,Gramercy,40.732929999999996,-73.9836,United States,US,False,moderate,Entire home/apt,2014,"$1,062 ",$212 ,5,5,1/2/2016,0.08,2.0,1,266,Please be respectful of the space:  -No Smoking Inside (smoking on patio permitted),
3924108,Location Little Lapa ( only female ),16842068978,unconfirmed,Petya,Queens,Astoria,40.76577,-73.91471,United States,US,False,flexible,Private room,2015,$104 ,$21 ,30,9,7/26/2018,0.19,4.0,18,97,It's the golden rule of Airbnb; this is my home so I wish and expect that people treat it as they would if someone was staying in their house.  Above all I hope there is mutual respect and that my guests enjoy themselves!,
3924660,Brooklyn 2 bedroom Apartment,6484061807,unconfirmed,Marcus,Brooklyn,Bedford-Stuyvesant,40.682520000000004,-73.94443000000001,United States,US,True,flexible,Entire home/apt,2005,$906 ,$181 ,4,138,6/24/2019,2.66,2.0,2,295,"Pets not allowed, no exceptions. Check in typically 5-6pm but flexible. No extra guests beyond those who have signed up please. Smoking is not permitted. Mainly just leave the place as you found it!",
3925212,"Home, Sweet Home!",39179213375,unconfirmed,Haim,Queens,Long Island City,40.74622,-73.94277,United States,US,True,strict,Private room,2003,$558 ,$112 ,1,39,7/6/2019,0.83,1.0,1,150,"- This apartment is a place for self-sufficient guests and travellers who require minimal host attention and checking-in except in the case of emergencies. - keys are picked up off-site at our company's offices in the Noth End.  Very close to Charlestown and on the way from the airport to the apartment. - No loud music after 10pm - No overnight guests - No smoking - Non-service animals not permitted - No live flames of any kind (i.e. candles, incense, etc.)",
3925765,Cozy & Sunny Hamilton Heights Apt,92420020603,unconfirmed,Maia,Manhattan,Harlem,40.82654,-73.9462,United States,US,True,strict,Entire home/apt,2004,"$1,153 ",$231 ,1,10,6/12/2019,0.17,2.0,1,101,No smoking. No hosting visitors in-house.,
3926317,"Large, Luxurious 1 bdrm  W. Village",74429245977,unconfirmed,Matthew,Manhattan,West Village,40.73016,-74.00259,United States,US,False,strict,Entire home/apt,2010,$480 ,$96 ,4,10,9/5/2016,0.17,3.0,1,129,,
3926869,Prime Williamsburg Brooklyn Apartment for Holidays,19007886179,unconfirmed,Jared,Brooklyn,Williamsburg,40.71328,-73.95787,United States,US,False,moderate,Private room,2013,$996 ,$199 ,1,0,,,4.0,1,106,,
3927421,Beautiful Terrace Room,85429365875,unconfirmed,Larry,Brooklyn,Canarsie,40.63881,-73.91751,United States,US,True,strict,Private room,2007,$683 ,$137 ,3,41,5/3/2019,0.7,5.0,3,399,"This is our primary residence and we open it up to guests when we are going to be out of town.  We ask that guests respect our home as they would their own.  We do have a dog that lives with us, Mavis, who will also be away, but if someone has severe allergies, you may want to bring meds.   This is a great condo in an amazing area with extremely nice neighbors, that being said, please be courteous to them during your stay. ",
3927974,Brooklyn's finest. Renovated apt!,31756128932,unconfirmed,Fernando,Brooklyn,Crown Heights,40.67767,-73.95161999999999,United States,US,True,strict,Entire home/apt,2006,"$1,069 ",$214 ,5,14,4/11/2019,0.28,1.0,1,247,"Please be considerate of the other people residing in the house. This is a home not a frat house. Any bad behavior  will result in you being asked to leave.  No smoking at all in the house! .  Please do not sit on door stoop in front of the house and smoke. The smoke flows into the next door neighbors window. They have small children. Please do not toss ciggarrette butts into the neighbors stairwell. If you need to smoke -please take a walk ..thanks.. Sorry no pets. Check in time is  3 P.M.- Check out  is 11 A.M. These times may be flexible. Please let me know if your plans warrant different check in/check out times. I'm flexible. Only registered guests allowed to stay overnight in space.   'DO NOT PARK IN FRONT OF THE HYDRANT""  $100.00 FINE..",
3928526,Lg Quiet Artist Home -Ditmas Park -,10230636958,verified,Liz,Brooklyn,Flatbush,40.64699,-73.96307,United States,US,False,strict,Entire home/apt,2017,$561 ,$112 ,24,0,,,2.0,1,270,"Check in time is 3pm. Check out is 11am. . Please call or text me if you are delayed in traffic..if you're travelling from the south towards  Boston, expecially Friday afternoon. prepare for delays. *No smoking. Also, please do not smoke on door stoop in front of the house. The smoke makes its way into neighbors window. Also do not throw ciggarette butts into neighbors stairwell. If you need to have a smoke please take a walk.. thanks...  *Please keep noise to minimum after 10 in the evening. *Please refrain from taking showers after 11pm. Please be considerate of those residing below you. *Apartment space is to be used by registered guests only. *No yelling out windows to people in street or in cars. This is a home not a frat house. *Please be considerate of others residing in the home during your stay. No pets Thank you...Joe",
3929078,Bushwick schoolhouse,5483641421,verified,Kurt,Brooklyn,Bushwick,40.70098,-73.93959,United States,US,False,flexible,Private room,2018,$510 ,$102 ,30,25,3/28/2019,0.53,4.0,1,281,,
3929631,"Sunny, charming 1 bedroom apartment",8285581851,verified,Todd,Brooklyn,Bedford-Stuyvesant,40.68655,-73.93796999999999,United States,US,True,moderate,Entire home/apt,2005,$713 ,$143 ,3,2,8/15/2016,0.06,1.0,1,118,"Feedback is welcome--please let us know how we can improve your experience! Check in is 4-8 p.m. Early and late check-ins are possible, but must be requested in advance and are subject to availability.  Check out time is 11 a.m. Late check-out is possible upon request in advance subject to availability. Regretfully, the suite is not appropriate for children and we cannot accommodate them. Regretfully, for health and safety reasons, there is no smoking on the property. Regretfully, we cannot accommodate guest pets  14 days' cancellation notice or full charge for stay.  If you check out before the end of your reserved stay, the full amount of your stay will be charged.",
3930183,1 Bedroom w/ huge Deck in West Village/SOHO,47771973021,unconfirmed,Wendy,Manhattan,West Village,40.72912,-74.00298000000001,United States,US,True,flexible,Entire home/apt,2005,$67 ,$13 ,4,21,3/30/2019,0.36,4.0,1,393,"NO smoking, no parties, no large dogs. I expect that the house will be the way I left it for you :) (small dogs ok) ",
3930735,Beautiful Sunset Park,12939987142,verified,Kaykay,Brooklyn,Sunset Park,40.64752,-74.0059,United States,US,True,flexible,Shared room,2005,$843 ,$169 ,2,7,5/13/2017,0.12,2.0,1,258,"All guests must agree to the following:   1. The hallway going up to the penthouse is narrow. Take care not to make marks or scratches from suitcases on the walls. 2. No smoking anywhere on the premises or around the building.  3. The guest must keep the room clean. Please dispose of the garbage can bag upon checkout and leave the used towels and sheets in the white hamper at the foot of the bed.  4. Guests may use the washer and dryer in the basement, but clothes must be immediately removed from machines when done. Make sure to clean the lint tray on the dryer to avoid a risk of fire.  5. No additional guests are allowed to stay past 11:00 PM or sleep over. The room is designed for a single-person use only.  6. When using the bathroom, male guests are asked to sit or keep seats down and to clean the seat after each use. Guests must tidy the shower when done.  7. Guests may NOT place hot pans or cooking items on the marble counters without a trivet. There are two silicone trivets and a",
3931288,Classic Brownstone 1 Bed. Apt.,93346635567,verified,Polly,Brooklyn,Bedford-Stuyvesant,40.68127,-73.94865,United States,US,True,flexible,Entire home/apt,2008,$284 ,$57 ,3,2,9/11/2016,0.05,1.0,1,388,"Information for Your Stay at 46 Monument Avenue Charlestown, MA 02129 First, welcome and thank you for choosing my home for your stay in Boston. Please let me know if I can be of assistance in making your visit enjoyable and comfortable. Please be advised that there is absolutely no smoking in the house! Thank you for your cooperation.  If you are smoker and been caught smoking in the house you will be asked to leave and no refund.  Please do not smoke in front of the house or around the house. Arrival and Departure ·	Kindly remember to check out before 10:00 A.M. and check in after 4:00 P.M. ·	Most likely, I will say good-bye to you when you leave however should our schedules not match, please shut and lock all windows and doors when leaving nd make sure all lights are off. ·	After going out the black door, leave the keys in the mail slot. Internet and Cable 	For internet access, you will get this number when you arrive. Public Transportation and Getting Around ·	To use the subway (un",
3931840,"Sunny, Charming Boho Apt Near all in the Village!",41269144814,verified,Jana,Manhattan,Greenwich Village,40.72917,-73.99974,United States,US,True,strict,Private room,2009,$548 ,$110 ,25,70,8/26/2018,1.27,2.0,1,38,"No pets and no smoking, please. No group parties and we kindly ask that you limit the number of people on the roof deck to a maximum of 4. Please be respectful of our neighbors below us and next to us and try to limit any noise after 10PM. Trash should be left in the unit, tied up and next to the barrel in the kitchen. The front door to the building can be tricky, so please double check and pull it shut so that it locks completely.",
3932392,UWS one br near Central Park,66446882392,unconfirmed,Joaquin,Manhattan,Upper West Side,40.79998,-73.96404,United States,US,True,strict,Entire home/apt,2013,$291 ,$58 ,15,0,,,4.0,1,112,,
3932944,The Emerald Room,13992757420,verified,Larry,Brooklyn,Canarsie,40.63888,-73.91729000000001,United States,US,True,strict,Private room,2013,"$1,139 ",$228 ,3,23,6/23/2019,0.39,1.0,3,17,"- cleaning, quiet, friendly, no drug, no smoking,",
3933497,"Great location, new lower rates!!!",23235560591,unconfirmed,Angelo,Queens,Ditmars Steinway,40.77478,-73.91913000000001,United States,US,True,strict,Private room,2013,$367 ,$73 ,1,164,6/20/2019,2.78,4.0,4,252,,
3934049,Cozy & Comfy in Bedstuy,48078781123,verified,Seun And Marie,Brooklyn,Bedford-Stuyvesant,40.68769,-73.93074,United States,US,True,flexible,Private room,2004,$515 ,$103 ,2,36,6/29/2019,0.61,1.0,7,367,,
3934601,...New lower rates for low season!!,71564524586,verified,Angelo,Queens,Ditmars Steinway,40.773759999999996,-73.91855,United States,US,True,flexible,Private room,2007,$252 ,$50 ,1,207,6/21/2019,3.48,5.0,4,256,"- We live in a rowhouse that contains three units.  Please be respectful to our neighbors and keep the noise down - Past 11pm, please very quiet if you're still on the deck to respect our neighbors",
3935154,Oasis in a Brownstone,34917322658,unconfirmed,Seun And Marie,Brooklyn,Bedford-Stuyvesant,40.68565,-73.93249,United States,US,False,strict,Private room,2019,$998 ,$200 ,2,43,5/26/2019,0.72,3.0,7,22,,
3935706,Beautiful West Village 1 BR Gem!,73941558304,verified,Adriana,Manhattan,West Village,40.73648,-74.00173000000001,United States,US,True,moderate,Entire home/apt,2018,"$1,021 ",$204 ,3,5,6/19/2016,0.08,1.0,1,343,,
3936258,"Amazing, Spacious Bedroom in BK",5828023378,verified,Naeem,Brooklyn,Bedford-Stuyvesant,40.69291,-73.95142,United States,US,True,moderate,Private room,2015,$489 ,$98 ,1,0,,,4.0,1,248,"All guests must observe the following house rules: The hallways are narrow. Take care not to make marks or scratches from suitcases on the walls. Towels for the Rainbow Room are gray and can be found in the small night white nightstand next to the desk. Towels for the Marble Room are white and can be found in the closet. Beach, hand, and face towels are in the hallway mirrored dresser. Each bathroom has a hairdryer. No smoking anywhere on the premises or around the building.  The guest must keep the room clean. Please dispose of the garbage can bag upon checkout and leave the used towels and sheets in the hamper. Food is not allowed in rooms. Do not leave any food items or personal belongings in the  Guests may NOT place hot pans or cooking items on the marble counters without a trivet. Hot items may damage the counters and will be deducted from the security deposit.  Please ensure when you leave the property to place all dirty towels in the hampers provided in your closet. When using ",
3936811,"2 bedroom with yard, 4 mins to LGA",54582282932,unconfirmed,Telmo,Queens,East Elmhurst,40.76287,-73.88367,United States,US,False,strict,Entire home/apt,2013,$170 ,$34 ,3,102,6/4/2019,1.73,3.0,1,248,"Enjoy our home and your visit to this wonderful city! We ask that you respect our home and neighbors as you would your own.   Please no smoking in the house, no pets, no large social gatherings.",
3937363,Unique stylish garden apartment,38015244123,unconfirmed,Ila,Brooklyn,Williamsburg,40.71241,-73.9653,United States,US,True,flexible,Entire home/apt,2015,$463 ,$93 ,4,0,,,2.0,1,105,,
3937915,"Cheerful, Comfortable & Convenient",70358321585,verified,Lisa,Manhattan,Upper West Side,40.79903,-73.96451,United States,US,True,moderate,Entire home/apt,2009,$340 ,$68 ,2,80,7/6/2019,1.35,2.0,1,206,"Relaxed environment, but keeping it clean is a priority. Smoking and alcohol are not allowed in the room. Smoking is not allowed anywhere in the building. No loud music or noise is allowed after 10pm.",
3938467,Large Sunny Nicely Furnished Studio,34288083864,unconfirmed,Kim,Manhattan,Washington Heights,40.83818,-73.94303000000001,United States,US,True,strict,Entire home/apt,2003,$498 ,$100 ,1,0,,,4.0,1,-8,"No smoking or pets, please.",
3939020,Beautiful Huge 2Br House w/Backyard,57926195518,verified,Eric,Brooklyn,Prospect-Lefferts Gardens,40.65806,-73.95815,United States,US,True,flexible,Entire home/apt,2010,"$1,178 ",$236 ,4,3,10/19/2014,0.05,4.0,1,319,#NAME?,
3939572,"Fabulous Large 1 Bed in Riverdale, Bronx NYC",20888704163,unconfirmed,Karen,Bronx,Fieldston,40.89022,-73.9039,United States,US,True,strict,Entire home/apt,2003,$246 ,$49 ,14,3,7/5/2019,0.13,1.0,1,255,"This is our primary residence, so please treat it like you would your own house!",
3940124,4 ROOM RAILROAD - WILLIAMSBURG,6931872712,verified,Ryan,Brooklyn,Williamsburg,40.70955,-73.95085,United States,US,False,strict,Entire home/apt,2019,$648 ,$130 ,4,17,1/24/2019,0.29,3.0,1,284,"- cleaning, quiet, friendly, no drug, no smoking,",
3940677,Cozy yet spacious apt in Brooklyn,94226513489,unconfirmed,Geeta,Brooklyn,Bedford-Stuyvesant,40.68056,-73.9151,United States,US,True,flexible,Entire home/apt,2019,$489 ,$98 ,10,16,5/27/2018,0.29,3.0,1,32,"No smoking anywhere on the property is allowed including hallway, back porch, and driveway. Please take your shoes once you enter the apartment.",
3941229,"Modern, sunny two bedroom",35661460169,unconfirmed,Allison,Brooklyn,Williamsburg,40.71159,-73.94043,United States,US,False,strict,Entire home/apt,2010,"$1,168 ",$234 ,2,25,3/31/2019,0.54,4.0,2,-8,,
3941781,Williamsburg + private patio garden,92344100278,unconfirmed,Matt,Brooklyn,Williamsburg,40.70859,-73.94639000000001,United States,US,False,flexible,Entire home/apt,2011,$968 ,$194 ,5,18,2/26/2019,0.32,3.0,1,368,,
3942334,Spacious Modern Loft in Cobble Hill,25357620552,verified,Gary,Brooklyn,Downtown Brooklyn,40.690540000000006,-73.99039,United States,US,True,strict,Entire home/apt,2010,$984 ,$197 ,3,68,6/13/2019,1.35,2.0,1,-3,,
3942886,"Bright, clean studio by subway",40003072011,unconfirmed,Anaïs,Brooklyn,Bay Ridge,40.63592,-74.02704,United States,US,True,strict,Entire home/apt,2005,$488 ,$98 ,1,1,1/9/2016,0.02,3.0,1,266,"*** It is a residential building with very nice and quiet atmosphere and we'll appreciate our guests considering it *** Pets are allowed - an extra cleaning fee may apply - please consult with us prior to booking. *** Smoking is absolutely prohibited in the apartment, the building public areas and outside-near the main entry doors - however lots of open gardens right near...",
3943438,"2BR, Heart of Lower East Side",60608313191,verified,Ryan,Manhattan,Lower East Side,40.721740000000004,-73.98501,United States,US,False,moderate,Entire home/apt,2019,$51 ,$10 ,1,8,6/19/2015,0.13,3.0,1,294,"All guests must observe the following house rules: The hallways are narrow. Take care not to make marks or scratches from suitcases on the walls. Towels for the Rainbow Room are gray and can be found in the small night white nightstand next to the desk. Towels for the Marble Room are white and can be found in the closet. Beach, hand, and face towels are in the hallway mirrored dresser. Each bathroom has a hairdryer. No smoking anywhere on the premises or around the building.  The guest must keep the room clean. Please dispose of the garbage can bag upon checkout and leave the used towels and sheets in the hamper. Food is not allowed in rooms. Do not leave any food items or personal belongings in the  Guests may NOT place hot pans or cooking items on the marble counters without a trivet. Hot items may damage the counters and will be deducted from the security deposit.  Please ensure when you leave the property to place all dirty towels in the hampers provided in your closet. When using ",
3943990,Cozy private room in UES,67005826119,verified,Valerie,Manhattan,Upper East Side,40.77993,-73.94939000000001,United States,US,False,strict,Private room,2004,$617 ,$123 ,5,18,11/18/2017,0.3,1.0,2,243,"There is no smoking allowed anywhere on the property including back stairs or front driveway. Please take your shoes off once you enter the apartment. Also, disconnect toaster, coffee maker, and tea kettle after use. Thank you.",
3944543,Spacious Home by the Bay,7935894687,verified,Sanda,Brooklyn,Sheepshead Bay,40.585809999999995,-73.9383,United States,US,True,strict,Entire home/apt,2017,$736 ,$147 ,2,13,10/25/2016,0.27,3.0,1,218,No smoking. No Pets. Please be mindful of noise levels while enjoying the outdoor space. No parties.,
3945095,"Sunny Apt in Bed Stuy, A/C/E Trains",10924044651,verified,Kate,Brooklyn,Bedford-Stuyvesant,40.680820000000004,-73.93599,United States,US,True,flexible,Private room,2016,$961 ,$192 ,3,39,5/23/2015,0.67,2.0,1,379,Please be respectful of the space and the other tenants in the building.  Please treat the space as it were your own.,
3945647,West Village apt - 2 Bedroom,67074632390,verified,(Email hidden by Airbnb),Manhattan,West Village,40.73123,-74.00428000000001,United States,US,False,strict,Entire home/apt,2005,$843 ,$169 ,5,1,8/30/2014,0.02,5.0,1,251,"- First off, Thanks for choosing my home!  No pets, Sorry.  The house is not childproof space. There is NO smoking IN the home. (You can outside but please remove cigarette butts). If smoking is detected inside there will be a $250 charge for odor removal services.  Stairs leading to the apartment are NOT handicap accessible! Condo cannot accommodate any parties and so the house is available for the guests that have booked the house only. Please let me know if you would like guests. But, again, it is not available and cannot accommodate parties or events. Thank you for your understanding.",
3946200,Apt in Harlem 1 month minimun stay,66083704666,verified,Dolores,Manhattan,Harlem,40.820190000000004,-73.95448,United States,US,True,moderate,Entire home/apt,2016,$301 ,$60 ,25,6,1/23/2019,0.11,4.0,1,0,"No smoking, no parties or very loud music - we are in a quaint neighborhood near the Bunker Hill Monument.",
3946752,Gorgeous Room in Heart of Soho,25744406881,unconfirmed,Leighann,Manhattan,SoHo,40.72569,-74.00331,United States,US,False,moderate,Private room,2010,"$1,160 ",$232 ,1,55,5/22/2019,0.94,5.0,1,40,No smoking. No pets.,
3947304,Beautiful 1b Bloomingdales location,4228046194,verified,Mike,Manhattan,Upper East Side,40.76236,-73.96642,United States,US,True,moderate,Entire home/apt,2021,$358 ,$72 ,30,2,7/16/2016,0.04,5.0,52,418,This is a quiet residential neighborhood. No partying or loudness please. No smoking in or around the premises. Please avoid wearing shoes in the carpeted parts of the house. Thank you!,
3947857,"Private Room in Bushwick, fully furnished",34004740619,verified,Holly,Brooklyn,Bushwick,40.6998,-73.93265,United States,US,True,flexible,Private room,2008,$745 ,$149 ,10,20,2/1/2018,0.34,5.0,1,19,This is a quiet neighborhood where everyone lives in close proximity.  It is not an area for partying or loudness.  Please enjoy the outside patio but remember that there are neighbors close by. There should not be any smoking on or around the premises.,
3948409,JOE'S PARADISE 5019,35746879234,unconfirmed,Joseph,Brooklyn,Flatlands,40.6225,-73.92578,United States,US,False,flexible,Entire home/apt,2013,$74 ,$15 ,3,108,7/6/2019,1.83,5.0,1,221,,
3948961,"A bright, beautiful treehouse",52750531158,verified,Kristina,Brooklyn,Crown Heights,40.6692,-73.94739,United States,US,True,flexible,Entire home/apt,2016,$361 ,$72 ,2,11,8/8/2016,0.24,5.0,1,362,Owners live in the building so please be respectful - no parties.  No smoking is permitted in the building.,
3949513,L,47902812673,unconfirmed,Nancy,Manhattan,Upper West Side,40.78802,-73.97509000000001,United States,US,False,flexible,Private room,2009,"$1,055 ",$211 ,30,12,9/30/2017,0.21,5.0,1,199,,
3950066,"Convenient, Greenwich/West Village Apartment",70090639596,unconfirmed,Pam,Manhattan,Greenwich Village,40.7338,-73.99498,United States,US,False,moderate,Entire home/apt,2020,$782 ,$156 ,5,7,1/5/2019,0.18,2.0,1,320,Please treat my home as you would your own.,
3950618,Amazing 1brm in the Best Location,34889694662,unconfirmed,Theodora,Manhattan,Gramercy,40.73608,-73.9857,United States,US,False,strict,Entire home/apt,2021,$434 ,$87 ,4,26,4/27/2017,0.49,5.0,1,318,,
3951170,large sunny pre war studio,48369599810,unconfirmed,Velma,Brooklyn,Bedford-Stuyvesant,40.6847,-73.94523000000001,United States,US,False,strict,Entire home/apt,2005,$408 ,$82 ,2,59,6/8/2019,1.02,3.0,5,266,,
3951723,SUNNY ROOM FOR TWO @ ELEGANT HOME NEAR JFK,51834645452,unconfirmed,Natasha,Queens,Arverne,40.58835,-73.79565,United States,US,False,strict,Private room,2022,$638 ,$128 ,1,91,7/1/2019,1.53,5.0,5,211,,
3952275,"Lovely, modern townhouse",54656634573,verified,Kate,Brooklyn,Sunset Park,40.65957,-73.99253,United States,US,False,flexible,Entire home/apt,2013,"$1,125 ",$225 ,3,15,7/7/2019,0.32,3.0,1,358,"I have 2 very friendly pet rabbits. Those with allergies to rabbits (and often cats) are not recommended to stay here. No recreational drug use allowed. No smoking in or around the unit, or it's entry/exit ways, including the deck.  Check-out / check-in will be discussed once accepted as a guest. Guest will have their own alarm code.",
3952827,Parkside Brooklyn Artist Apartment!,82579962604,verified,Stefanie,Brooklyn,Prospect-Lefferts Gardens,40.65575,-73.9609,United States,US,False,flexible,Private room,2009,$965 ,$193 ,5,11,10/31/2016,0.23,3.0,2,282,,
3953380,Studio In Townhouse,98298598940,unconfirmed,John & Catherine,Manhattan,Washington Heights,40.83602,-73.94294000000001,United States,US,False,moderate,Private room,2013,$744 ,$149 ,3,104,6/24/2019,1.79,5.0,1,411,#NAME?,
