id,NAME,host id,host_identity_verified,host name,neighbourhood group,neighbourhood,lat,long,country,country code,instant_bookable,cancellation_policy,room type,Construction year,price,service fee,minimum nights,number of reviews,last review,reviews per month,review rate number,calculated host listings count,availability 365,house_rules,license
10777046,Light-filled apt offering private bedroom & bath,17492815258,verified,Colin,Manhattan,Upper East Side,40.78245,-73.94686,United States,US,True,flexible,Private room,2009,$245 ,$49 ,1,1,7/31/2016,0.03,2,1,0,,
10777598,LUXURY HUGE 2BR DUPLEX NEAR TRAIN - PATIO OASIS!!,88677409181,unconfirmed,Vikas,Brooklyn,Bedford-Stuyvesant,40.68861,-73.94109,United States,US,True,strict,Entire home/apt,2005,$356 ,$71 ,1,350,6/26/2019,9.61,3,2,137,"- Non-smoker - No perfume/cologne use - Microwave for light use, not cooking - Very light and fast food prep - Mailing address not to be shared with anyone but family and friends - Take is seriously: If  any of yours not personal mail comes to this mail box, you will be charged $200 and $5 for each letter after that indefinitely - Guest agrees not to write reviews for areas not on amenities list",
10778151,Private Room in Fun Neighborhood,33516679197,verified,David,Queens,Ridgewood,40.71164,-73.91879,United States,US,True,moderate,Private room,2003,$530 ,$106 ,15,0,,,5,1,0,No smoking. Please respect our neighbors.,
10778703,Homey 1BR close to US Open,51133665144,verified,J.A.,Queens,Jackson Heights,40.75145,-73.88946,United States,US,True,strict,Entire home/apt,2008,"$1,070 ",$214 ,3,4,9/15/2017,0.12,2,1,0,#NAME?,
10779255,Cozy comfortable room near JFK&LGA#3,15470523825,unconfirmed,John,Queens,Richmond Hill,40.691959999999995,-73.82029,United States,US,True,flexible,Private room,2003,$387 ,$77 ,3,32,6/4/2019,0.89,1,5,212,,
10779808,Comfy 1 Bedroom in commercial East Flatbush,19248125734,unconfirmed,Daniel And Christianne,Brooklyn,East Flatbush,40.65214,-73.93126,United States,US,False,flexible,Entire home/apt,2020,$179 ,$36 ,2,85,6/15/2019,2.36,5,1,33,Let's talk to get to know each other !,
10780360,Peaceful and Spacious Master Bedroom,37333829221,verified,Janet,Manhattan,Gramercy,40.735170000000004,-73.98176,United States,US,False,moderate,Private room,2015,$848 ,$170 ,2,3,11/25/2017,0.14,5,1,0,Female first please. Please keep the space quiet and clean.,
10780912,Cozy and Cool East Williamsburg 1 BR in 2 BR,80853836746,unconfirmed,Arash,Brooklyn,Williamsburg,40.71281,-73.94603000000001,United States,US,True,strict,Private room,2022,$672 ,$134 ,6,2,1/5/2017,0.06,5,2,0,"Non-smokers, no smoking in or out of home No perfume/cologne use, no other sprays  Deodorant/antiperspirant is OK but not sprays  Recycling, reusable shopping bags No mailing address sharing: first offense $200, and $5 per letter after that LIFE TIME Please don't use ""single use disposable"" plastic bags Mailing address MAY NOT be shared with anyone accept delivery. Reusable foldeable shopping bag (provided, and you may take it with you) Plates, cup, utensils are only in space between refrigerator and sink Please don't keep dirty dishes in your room, but if you must, tide them in plastic bag (green kind, find in bathroom basket) Please keep your room at least reasonably tidy Host may enter the room to collect the trash or fix things if needed All your things are safe in your room Take off street shoes when indoor Washed slippers provided if you don't have your own  Please be respectful, considered, and aware what is left behind you when you are in common areas, and how it will impact th",
10781464,There's a reason this room has a 5-star rating.,18213018529,unconfirmed,Leigh,Manhattan,Hell's Kitchen,40.75913,-73.98991,United States,US,False,strict,Private room,2006,$557 ,$111 ,1,41,5/23/2019,1.19,5,1,170,"This is an old house which was built in the 1900s, and may not be sparkingly clean and modern, but we appreciate it if you can clean after yourself, and put things back to where they belong. Garbage day is on Friday, you can simply put your trash into the dumpster and we'll take care of the rest. Please be respectful to other tenants on the second floor. Thank you.",
10782017,"Stunning, Unique, w/ Private Workspace",39312079127,verified,Justin,Manhattan,Harlem,40.81142,-73.95134,United States,US,True,moderate,Private room,2021,$72 ,$14 ,15,19,6/15/2019,0.54,3,3,106,,
10782569,1 BDR PRIME HELLS KITCHEN LOCATION,55746349595,unconfirmed,Gilbert,Manhattan,Hell's Kitchen,40.7672,-73.98456999999999,United States,US,True,flexible,Entire home/apt,2019,$612 ,$122 ,3,0,,,2,1,0,1) No Smoking in property!!!  2) Do not slam doors!!! Close lightly Please!!! 3) No Shoes in house (except slippers) 4) Quiet down AFTER 10PM.,
10783121,Bedstuy Brownstone Gem,22757477942,unconfirmed,Fanny,Brooklyn,Bedford-Stuyvesant,40.68535,-73.94959,United States,US,False,strict,Entire home/apt,2007,$959 ,$192 ,3,95,7/5/2019,2.74,4,1,71,House rules will be provided upon booking.,
10783674,Beautiful Beach Home,22156081365,verified,Sonya,Queens,Rockaway Beach,40.58633,-73.80603,United States,US,True,moderate,Private room,2012,$963 ,$193 ,1,0,,,2,1,0,Respectful of the apartment,
10784226,Amazing One Bedroom apartment with private patio,15690951596,unconfirmed,Julien,Brooklyn,Williamsburg,40.708420000000004,-73.95437,United States,US,True,flexible,Entire home/apt,2011,$129 ,$26 ,1,21,10/10/2017,0.58,5,1,0,"Please treat it like your own place and leave it the way you found it! Please clean up prior to leaving.  No smoking indoors, no late night parties.",
10784778,Beautiful room on Brownstone in Bushwick,80852727695,unconfirmed,Jose,Brooklyn,Bushwick,40.69283,-73.90961,United States,US,True,flexible,Private room,2013,$759 ,$152 ,2,42,1/2/2019,1.16,2,1,0,#NAME?,
10785331,Room,83092033051,verified,James,Queens,Jamaica,40.67088,-73.76671999999999,United States,US,True,moderate,Private room,2022,$955 ,$191 ,1,0,,,2,2,363,"-Our one golden rule is: Please treat our space with respect (i.e. Clean up after yourself, be sure to lock the door when you leave, etc.)  -Absolutely NO SMOKING!!!! -We are fun-loving people, so we dont mind you having some friends over, but the above rule applies twofold in that scenario. -You're welcome to use dishes, appliances, etc in the kitchen, but we ask that you buy your own food/drinks rather than use ours. -No pets allowed (not our rule, our landlord's) -Upon checkout, please turn A/C units and lights off before leaving. -Feel free to ask us about the area-- we know it well and love to recommend!",
10785883,1 bedroom in 3 bedroom/2bath Bushwick Apt.,89363014904,unconfirmed,Hattie,Brooklyn,Bushwick,40.68987,-73.91548,United States,US,True,strict,Private room,2004,"$1,129 ",$226 ,1,1,8/10/2016,0.03,3,1,0,"Please note that we are a no smoking environment, and pets are only accepted in certain room types that have direct access to the outside. Please call ahead to make arrangements.",
10786435,Bright apartment across from Riverside Park,21637280508,unconfirmed,Tal,Manhattan,Morningside Heights,40.80734,-73.9673,United States,US,False,moderate,Entire home/apt,2008,$926 ,$185 ,3,1,8/15/2016,0.03,5,1,0,"Please note that we are a no smoking environment, and pets are only accepted in certain room types that have direct access to the outside. Please call ahead to make arrangements. ",
10786987,Peaceful Retreat with Garden in Brooklyn Heights,40768845558,unconfirmed,Andy,Brooklyn,Brooklyn Heights,40.69389,-73.99586,United States,US,True,strict,Entire home/apt,2012,$147 ,$29 ,3,4,5/19/2019,0.31,4,1,0,"1.  No loud music. 2. No parties. 3. No removal of items from the apartment unless expressly allowed by the host. 4.  Security deposit shall be claimed in the event of the following:   a. Damaged or soiled sheets, to the extent that they require replacement     b. Theft of items kept on and about the premises.    c. Unreturned keys.    d. Damage to the apartment or any part or item within and without the premises.    e. The presence of pets in the apartment, due to intent or negligence on the part of the guest and their party.    d. The presence of illicit or illegal substances, or illicit or illegal activities, on or about the premises",
10787540,Peaceful Private Space in Astoria,94925482660,verified,Rob,Queens,Astoria,40.76963,-73.93041,United States,US,False,flexible,Entire home/apt,2017,$395 ,$79 ,2,64,7/1/2019,1.77,4,1,89,,
10788092,⚜ Sun-Filled 1BR in Upper East Side ⚜,70887085354,verified,Joanna,Manhattan,Upper East Side,40.76858,-73.95345999999999,United States,US,False,flexible,Entire home/apt,2022,$207 ,$41 ,2,0,,,3,1,0,,
10788644,SUNNY & QUIET STUDIO NEAR CENTRAL PARK UPPER EAST,52100933365,unconfirmed,Inna,Manhattan,Upper East Side,40.76911,-73.95694,United States,US,False,flexible,Entire home/apt,2019,$816 ,$163 ,30,10,4/15/2019,0.35,3,16,299,"Please note that we are a no smoking environment, and pets are only accepted in certain room types that have direct access to the outside. Please call ahead to make arrangements. ",
10789197,Master bedroom with a California king size bed,36256270465,verified,PeiYoung,Queens,Astoria,40.756840000000004,-73.92518000000001,United States,US,True,moderate,Private room,2012,$549 ,$110 ,1,0,,,5,1,0,,
10789749,Whole apartment in Forest Hills,17473703905,verified,Constanza,Queens,Forest Hills,40.71642,-73.8357,United States,US,False,moderate,Entire home/apt,2016,$881 ,$176 ,5,1,8/29/2016,0.03,3,1,0,"- Please keep the house exactly like you found it. Please don't leave a mess. Please don't leave things dirty. - If you use the bathroom, clean or wipe things down (there will be a cloth to wipe off excess water, etc.) - If you use the kitchen, please clean dishes and wipe things down as well - No guest allowed - you can meet friends at other venues - Shoes off in the apartment - please leave by the door. If you would like please bring some slippers. - Please keep things quiet after 10pm - If you smoke, you must go outside! NO smoking inside! - If you cook, turn the fan on above the stove - If you watch TV, turn it off when you are done. - Please use your common sense, and if you are not sure, ask... - Remember, this is my house - so try to treat it with respect. - if the parking pass is not returned, you will be charged the full amount of the deposit",
10790301,Bedroom in Clinton Hill,9398468639,verified,Autumn,Brooklyn,Clinton Hill,40.695609999999995,-73.96269000000001,United States,US,True,flexible,Private room,2011,$266 ,$53 ,3,26,5/30/2019,0.75,1,3,362,"Please treat my place as your own. Turn off the lights, AC, fan, etc when you leave the apartment, and wash any kitchenware and dishes that you've used. Put used towels on the floor, so that I now they've been used.",
10790854,❤️Gorgeous Townhouse Apt - 2 blocks from subway,872198008,verified,Lisa,Manhattan,Harlem,40.80403,-73.95125,United States,US,True,strict,Entire home/apt,2003,$730 ,$146 ,30,122,5/26/2019,3.52,2,1,179,- Please be respectful and polite to neighbors. There are downstairs tenants so please don't be noisy after 11pm. - Please turn off any lights and adjust down the thermostat to 55 before you depart or please turn off the AC window units/fans - Return keys to lockbox at end of stay. (There is a fee of $50 for each set of lost keys) - No animals - No smoking in the house (there is a backyard area) - Check in is at 4:00 pm (message for special requests) - Check out is at 12 noon,
10791406,Classic brownstone drenched with light,11827132407,unconfirmed,Claudia,Brooklyn,Clinton Hill,40.692440000000005,-73.96500999999999,United States,US,False,moderate,Entire home/apt,2010,$709 ,$142 ,7,1,8/4/2016,0.03,1,1,0,,
10791958,Apt in Heart of NYC with AC !,77897125091,unconfirmed,Dashiell,Manhattan,Upper West Side,40.781729999999996,-73.98601,United States,US,False,flexible,Entire home/apt,2021,$654 ,$131 ,2,7,1/3/2017,0.19,3,1,0,"House Rules 1. Check-in is 4 pm local time. If the unit is ready earlier, we’ll let you know. Check-out is normally 11 am local time, but we’d be happy to extend it as long as we don’t have a cleaning scheduled. Just let us know.  2. All bookings require a security deposit of at least $300, which will be refunded within 7 days of your check-out. 3. For security measures we require all guests to provide proof of identification through ID verification on our own website. In order to check in we'll need a photo of your ID.  4. Our cancellation policy is as shown on our ad and defined by the site you are booking through.  5. Don’t let $300 go up in smoke. There's no smoking allowed in any Flatbook and a $300 fine for breaking this rule.  6. Unfortunately we don’t allow pets in any of our apartments. 7. Unless you’re staying in one of our specialty apartments, we don’t allow parties or excessive noise. 8. If we find the place very messy, we have to charge an extra $40 for every extra hour o",
10792510,Small Cozy comfortable room nearJFK#5,56992753378,verified,John,Queens,Richmond Hill,40.69018,-73.82141,United States,US,False,flexible,Private room,2007,$125 ,$25 ,2,10,8/19/2018,0.32,1,5,342,,
10793063,Beautiful bedroom / in Beach home,61739020649,verified,Josephine,Queens,Arverne,40.59005,-73.79449,United States,US,True,moderate,Private room,2017,$817 ,$163 ,1,114,6/4/2019,3.18,5,2,305,"Please expect to share the apartment with guests having various backgrounds. Be respectful and decent, also enjoy interacting with each other. Please dress descent in the house especially in and out of the shower.",
10793615,Cozy Bushwick Brooklyn Room -20 mins to Manhattan!,13268260440,verified,Sinida,Brooklyn,Bushwick,40.7017,-73.93715999999999,United States,US,False,strict,Private room,2017,$460 ,$92 ,1,88,7/7/2019,2.43,5,2,102,,
10794167,"Sunlit, spacious NY apartment",43663011346,verified,Dani,Manhattan,Harlem,40.8038,-73.95569,United States,US,False,moderate,Entire home/apt,2016,$465 ,$93 ,3,10,1/1/2019,0.28,4,1,0,,
10794720,Good Deal! Large Clean and Stylish 1Bedroom!,59002081779,unconfirmed,Alison,Brooklyn,Midwood,40.628029999999995,-73.9675,United States,US,False,strict,Entire home/apt,2019,$883 ,$177 ,3,6,12/31/2018,0.17,5,1,0,,
10795272,Cozy room in the best neighborhood in town,15694013319,unconfirmed,Natalia,Manhattan,Greenwich Village,40.72869,-74.00157,United States,US,False,strict,Private room,2012,$368 ,$74 ,6,0,,,5,1,0,,
10795824,Private Room in a Great Brooklyn Loft,18762901844,verified,Emine Gozde,Brooklyn,Williamsburg,40.70778,-73.9464,United States,US,True,flexible,Private room,2019,$893 ,$179 ,15,1,7/27/2016,0.03,2,1,0,,
10796377,,74332007402,unconfirmed,Alex And Maya,Manhattan,Harlem,40.82611,-73.94407,United States,US,False,strict,Entire home/apt,2004,$439 ,$88 ,2,138,6/23/2019,3.79,4,1,232,#NAME?,
10796929,Vida Local,76422032388,unconfirmed,Lou,Bronx,Highbridge,40.83736,-73.92318,United States,US,False,strict,Private room,2010,$986 ,$197 ,3,14,10/10/2017,0.39,4,1,42,,
10797481,Brownstone apt in Bklyn w/ gorgeous natural light,87652617466,unconfirmed,Whitney,Brooklyn,Bedford-Stuyvesant,40.6837,-73.93325,United States,US,True,moderate,Entire home/apt,2005,$84 ,$17 ,2,4,1/2/2017,0.12,5,1,0,1) No Smoking in property!!!  2) Do not slam doors!!! Close lightly Please!!! 3) No Shoes in house (except slippers) 4) Quiet down AFTER 10PM.,
10798033,Beautiful 2 bedroom private suite,62272685101,verified,Razia,Manhattan,Harlem,40.80297,-73.9505,United States,US,True,strict,Entire home/apt,2010,$289 ,$58 ,28,76,3/4/2019,2.16,1,2,296,"We are looking for quiet and respectful guests given that we have neighbors with young children. As a result, I would ask to please keep noise levels in the house at a minimum between 9pm and 8am (you can still cook and watch TV, etc. just don't go around moving furniture :)",
10798586,Sunny and spacious apartment in Brooklyn,1114598643,unconfirmed,Aris,Brooklyn,Greenpoint,40.73273,-73.95764,United States,US,True,moderate,Private room,2009,$666 ,$133 ,4,30,6/25/2018,0.83,1,2,0,Please do not smoke. Be respectful of the other guests.,
10799138,"Convenient,Clean,Roomy Apt in WaHi",91736413326,unconfirmed,Joanna,Manhattan,Washington Heights,40.84156,-73.93884,United States,US,True,strict,Private room,2006,$284 ,$57 ,2,3,7/31/2016,0.08,4,1,0,,
10799690,,94293379269,unconfirmed,Oliver,Manhattan,Hell's Kitchen,40.76806,-73.9847,United States,US,True,flexible,Private room,2016,$386 ,$77 ,3,6,11/6/2017,0.17,1,3,0,,
10800243,Cozy Private Bedroom in Uptown Manhattan,62591625926,unconfirmed,Abbey,Manhattan,Washington Heights,40.84198,-73.93816,United States,US,False,strict,Private room,2007,$610 ,$122 ,2,1,7/26/2016,0.03,3,1,0,,
10800795,Private Bedroom A in Heart of LES,98570821466,unconfirmed,Cody,Manhattan,Lower East Side,40.72102,-73.98891,United States,US,True,strict,Private room,2015,$304 ,$61 ,2,16,6/10/2019,0.45,5,2,0,"I respectfull ask that you treat my home as you would a friend's home.  My house rules are just common sense and courtesy. 1.  No loud music. 2. No parties. 3. No removal of items from the apartment unless expressly allowed by the host. 5.  Apartment door must be kept locked at all times.  4.  Security deposit shall be claimed in full in the event of any of the following:   a. Damaged or soiled sheets, to the extent that they require replacement.    b. Theft of items kept on and about the premises.    c. Unreturned keys.    d. Damage to the apartment or any part or item within and without the premises.    e. The presence of pets in the apartment, due to intent or negligence on the part of the guest and their party.    d. The presence of illicit or illegal substances, or illicit or illegal activities, on or about the premises     f.  Failure to vacate the premises by the agreed check-out time",
10801347,Private Room in Kelly&Joes Loft Apt,39375252635,unconfirmed,Johannes,Queens,Astoria,40.75951,-73.91963,United States,US,False,moderate,Private room,2008,$769 ,$154 ,1,0,,,2,1,0,,
10801900,SOUTH SLOPE Brooklyn - Bright and Spacious Bedroom,84801277564,unconfirmed,Dhwani,Brooklyn,Sunset Park,40.65976,-73.99191,United States,US,False,flexible,Private room,2019,$522 ,$104 ,2,0,,,5,1,0,"House Rules 1. Check-in is 4 pm local time. If the unit is ready earlier, we’ll let you know. Check-out is normally 11 am local time, but we’d be happy to extend it as long as we don’t have a cleaning scheduled. Just let us know.  2. All bookings require a security deposit of at least $300, which will be refunded within 7 days of your check-out. 3. For security measures we require all guests to provide proof of identification through ID verification on our own website. In order to check in we'll need a photo of your ID.  4. Our cancellation policy is as shown on our ad and defined by the site you are booking through.  5. Don’t let $300 go up in smoke. There's no smoking allowed in any Flatbook and a $300 fine for breaking this rule.  6. Unfortunately we don’t allow pets in any of our apartments. 7. Unless you’re staying in one of our specialty apartments, we don’t allow parties or excessive noise. 8. If we find the place very messy, we have to charge an extra $40 for every extra hour o",
10802452,Gorgeous 1bdr in Lower East Side,16039241042,verified,Anais,Manhattan,Lower East Side,40.7194,-73.992,United States,US,False,flexible,Entire home/apt,2017,$762 ,$152 ,7,1,9/14/2016,0.03,4,1,0,- No smoking inside the apartment - Checkout time is 11:00 am (a later time can be accommodated if it is available - but please ask ahead of time) - No Loud Music or Loitering outside the entrance after 10:00pm,
10803004,Stylish Private Room 3 subway stops to Manhattan,43927120164,unconfirmed,Priscila,Queens,Long Island City,40.753820000000005,-73.91968,United States,US,False,strict,Private room,2010,"$1,054 ",$211 ,3,90,7/4/2019,2.6,2,1,24,We except you to clean up after yourself and generally be respectful. Smoking should happen outside the house. Also please do not tap on the glass terrarium or play with the ball python. It is very timid and mostly wants to sleep.,
10803556,,92136324282,unconfirmed,Adam,Manhattan,Upper West Side,40.782959999999996,-73.97743,United States,US,True,flexible,Entire home/apt,2012,$719 ,$144 ,1,1,8/14/2016,0.03,1,1,0,Clean and no party,
10804109,Interfaith Retreat Guest Rooms (Śakti),84651465002,verified,Alex And Zeena,Manhattan,Chelsea,40.74779,-73.9966,United States,US,False,flexible,Private room,2022,"$1,042 ",$208 ,1,51,6/23/2019,1.6,3,12,355,,
10804661,Interfaith Retreat Guest Rooms (Seva),38668585132,unconfirmed,Alex And Zeena,Manhattan,Chelsea,40.74798,-73.99531999999999,United States,US,False,strict,Private room,2018,$894 ,$179 ,1,78,5/27/2019,2.26,1,12,360,,
10805213,Peaceful 1 Bedroom/1 Bathroom on Upper West Side,73404750630,verified,George Steven,Manhattan,Upper West Side,40.783409999999996,-73.97713,United States,US,True,strict,Entire home/apt,2020,$893 ,$179 ,30,14,6/10/2019,0.41,1,6,242,Please remove the shoes in the house.,
10805766,Gorgeous and Cosy Studio in Astoria!,25231406091,verified,Vanessa,Queens,Ditmars Steinway,40.78028,-73.91476999999999,United States,US,True,moderate,Entire home/apt,2006,$747 ,$149 ,3,5,9/18/2016,0.14,2,1,0,,
10806318,Charming Manhattan-Midtown Studio,60925097212,verified,Roman,Manhattan,Midtown,40.752590000000005,-73.97061,United States,US,False,strict,Entire home/apt,2005,"$1,023 ",$205 ,1,159,6/12/2019,4.39,1,1,193,"House Rules 1. Check-in is 4 pm local time. If the unit is ready earlier, we’ll let you know. Check-out is normally 11 am local time, but we’d be happy to extend it as long as we don’t have a cleaning scheduled. Just let us know.  2. All bookings require a security deposit of at least $300, which will be refunded within 7 days of your check-out. 3. For security measures we require all guests to provide proof of identification through ID verification on our own website. In order to check in we'll need a photo of your ID.  4. Our cancellation policy is as shown on our ad and defined by the site you are booking through.  5. Don’t let $300 go up in smoke. There's no smoking allowed in any Flatbook and a $300 fine for breaking this rule.  6. Unfortunately we don’t allow pets in any of our apartments. 7. Unless you’re staying in one of our specialty apartments, we don’t allow parties or excessive noise. 8. If we find the place very messy, we have to charge an extra $40 for every extra hour o",
10806870,Charismatic Flat in Astoria,73258845326,verified,Stephanie,Queens,Astoria,40.76482,-73.91996,United States,US,True,strict,Private room,2007,"$1,098 ",$220 ,3,11,1/1/2019,0.32,2,1,0,We except you to clean up after yourself and generally be respectful. Smoking should happen outside the house.,
10807423,Romantic Art-Filled Apartment with Large Backyard,66796357453,verified,Natalie,Brooklyn,Crown Heights,40.66957,-73.94804,United States,US,False,flexible,Entire home/apt,2009,$583 ,$117 ,3,0,,,1,2,0,,
10807975,Spacious room in huge loft in Tribeca,71311351960,verified,Robert,Manhattan,Tribeca,40.71474,-74.00596,United States,US,False,moderate,Private room,2006,"$1,120 ",$224 ,30,0,,,4,1,0,"House Rules 1. Check-in is 4 pm local time. If the unit is ready earlier, we’ll let you know. Check-out is normally 11 am local time, but we’d be happy to extend it as long as we don’t have a cleaning scheduled. Just let us know.  2. All bookings require a security deposit of at least $300, which will be refunded within 7 days of your check-out. 3. For security measures we require all guests to provide proof of identification through ID verification on our own website. In order to check in we'll need a photo of your ID.  4. Our cancellation policy is as shown on our ad and defined by the site you are booking through.  5. Don’t let $300 go up in smoke. There's no smoking allowed in any Flatbook and a $300 fine for breaking this rule.  6. Unfortunately we don’t allow pets in any of our apartments. 7. Unless you’re staying in one of our specialty apartments, we don’t allow parties or excessive noise. 8. If we find the place very messy, we have to charge an extra $40 for every extra hour o",
10808527,Bright & Sunny 2-Bedroom in Hamilton Heights,40758678875,verified,Shelley,Manhattan,Harlem,40.83136,-73.94843,United States,US,True,strict,Entire home/apt,2016,$995 ,$199 ,4,4,8/5/2017,0.11,5,1,0,Please be respectful to the other roommate and clean after yourselves. We love this place and we want guests to have the same experience you have when they arrive.,
10809079,Great Appartment with cool roomates in Bushwick,49766764859,verified,Geraldine,Brooklyn,Williamsburg,40.70282,-73.94287,United States,US,True,strict,Private room,2005,$815 ,$163 ,1,0,,,5,1,0,1) No Smoking in property!!!  2) Do not slam doors!!! Close lightly Please!!! 3) No Shoes in house (except slippers) 4) Quiet down AFTER 10PM.,
10809632,Beautiful one bedroom apartment in Williamsburg,72970412779,verified,Naief,Brooklyn,Williamsburg,40.71822,-73.94454,United States,US,True,flexible,Entire home/apt,2010,$698 ,$140 ,4,53,6/30/2019,1.46,4,1,15,,
10810184,Spacious master bedroom in Forest Hills,39810885029,unconfirmed,Shlomit,Queens,Forest Hills,40.730959999999996,-73.84924000000001,United States,US,False,flexible,Private room,2004,$151 ,$30 ,2,16,1/1/2019,0.61,1,1,157,- No excess noise after 11pm. - No recreational drugs. - No open flames.,
10810736,Entire Spacious Artist Apartment,72962377580,verified,Marco,Manhattan,Washington Heights,40.83625,-73.93915,United States,US,True,strict,Entire home/apt,2014,$455 ,$91 ,2,10,8/3/2017,0.28,2,1,0,,
