55415589,"Astoria, NY 1-bedroom apartment",8533217813,verified,Fernando,Queens,Astoria,40.76616,-73.91332,United States,US,True,flexible,Entire home/apt,2016,$860 ,$172 ,2,8,1/18/2019,0.82,3,1,0,"Non-smoker, no smoking in/out of home No cologne/perfume/sprays. Scent-free house Microwave for light use (not cooking) Respect quiet environment No visitors at any time, one room per person Remove outdoor shoes by the entrance inside, slippers available if you need Ask permission before giving this address to anyone Mailing address may only be used only for personal post (family, friends) No bank, no school, no memberships of any kind, no subscriptions If you break this rule, first charge is $200, and after that,  Each commercial letter that arrives after you depart will be charged $5 life time",
55416141,Room in Astoria - 20min to  Manhattan,22484371886,unconfirmed,Olivier & Priscilla,Queens,Ditmars Steinway,40.77033,-73.91008000000001,United States,US,True,moderate,Private room,2016,$998 ,$200 ,2,5,5/31/2019,0.53,5,1,0,,
55416694,"Beautiful, brand new Prospect/Crown Heights home",36577911363,verified,Noah And Jordan,Brooklyn,Crown Heights,40.67604,-73.95775,United States,US,False,strict,Entire home/apt,2008,$495 ,$99 ,2,14,7/6/2019,1.45,4,1,13,,
55417246,"Gorgeous,stylish 1bd apt Near everything !",14290019631,unconfirmed,Brandywine,Manhattan,East Harlem,40.797059999999995,-73.93473,United States,US,False,strict,Entire home/apt,2009,$821 ,$164 ,1,8,5/5/2019,0.8,5,1,37,1) No Smoking in property!!!  2) Do not slam doors!!! Close lightly Please!!! 3) No Shoes in house (except slippers) 4) Quiet down AFTER 10PM.,
55417798,Downtown BK luxury apartment,13772610390,verified,David,Brooklyn,Downtown Brooklyn,40.68978,-73.98598,United States,US,True,strict,Private room,2005,$636 ,$127 ,21,0,,,3,1,0,,
55418350,Esther Home,16946745870,verified,Allison,Brooklyn,Bedford-Stuyvesant,40.6902,-73.95277,United States,US,True,flexible,Entire home/apt,2003,$522 ,$104 ,2,15,6/23/2019,1.53,4,1,319,,
55418903,Cozy Private Bedroom 5mins to NYC,80696932344,verified,Nma,Queens,Long Island City,40.76245,-73.93285999999999,United States,US,True,strict,Private room,2006,$152 ,$30 ,3,9,4/11/2019,0.94,2,1,0,#NAME?,
55419455,D&G Chateau,55409206851,verified,Darian,Manhattan,Harlem,40.82761,-73.94192,United States,US,False,moderate,Private room,2019,$483 ,$97 ,1,9,5/4/2019,0.9,3,1,364,,
55420007,"Clean , Quite and Comfortable Queen size bed",9112640571,unconfirmed,Blan,Manhattan,Washington Heights,40.8453,-73.93795,United States,US,True,moderate,Private room,2015,$108 ,$22 ,5,11,12/19/2018,1.1,5,2,310,,
55420560,Cozy apartment 15 minutes from midtown!,36637854886,unconfirmed,Julia,Queens,Sunnyside,40.743140000000004,-73.92389,United States,US,False,strict,Entire home/apt,2017,$593 ,$119 ,2,4,12/2/2018,0.44,4,1,0,,
55421112,Cute Room in Bushwick!,89935629517,verified,Oliver,Brooklyn,Bushwick,40.6951,-73.92981,United States,US,False,moderate,Private room,2020,$288 ,$58 ,3,5,9/17/2018,0.49,4,1,0,,
55421664,REGO PARK HOUSE NEXT TO ALL,44508998574,verified,Lucky,Queens,Rego Park,40.73095,-73.85706,United States,US,True,moderate,Entire home/apt,2021,$939 ,$188 ,2,2,5/20/2019,0.76,5,3,5,,
55422217,"Charming, bright and brand new Bed-Stuy home",6644367213,unconfirmed,Caterina,Brooklyn,Bedford-Stuyvesant,40.69508,-73.95164,United States,US,True,strict,Entire home/apt,2015,$640 ,$128 ,3,5,7/2/2019,0.51,4,1,0,,
55422769,Queens  BLVD House NEXT TO ALL,81807302627,verified,Lucky,Queens,Rego Park,40.73005,-73.8576,United States,US,True,moderate,Entire home/apt,2010,$709 ,$142 ,3,1,6/24/2019,1.0,3,3,173,,
55423321,Private 2 room apartment in the East village,12402028159,unconfirmed,Rory,Manhattan,East Village,40.72445,-73.97683,United States,US,True,flexible,Private room,2017,$905 ,$181 ,3,36,6/23/2019,3.94,5,1,109,"Check in 3pm Check out 12pm (Flexible upon requests.) No smoking, No drug, No party in the house. I don't guarantee parking lot. Sorry",
55423873,Sunlit Bedroom in prime neighbourhood + Rooftop,48718710601,unconfirmed,Meenakshi,Manhattan,Chinatown,40.717890000000004,-73.99580999999999,United States,US,False,moderate,Private room,2005,$874 ,$175 ,2,3,1/16/2019,0.3,4,1,0,,
55424426,"Bright, Spacious BK Gem",71288649670,unconfirmed,Sam,Brooklyn,Bedford-Stuyvesant,40.67987,-73.91931,United States,US,False,moderate,Entire home/apt,2017,$859 ,$172 ,2,2,9/23/2018,0.2,3,1,0,Please do not smoke and be respectful of other guests.,
55424978,Luxury Loft - Home away from Home,76789650199,unconfirmed,Ryan,Queens,Ridgewood,40.701229999999995,-73.90685,United States,US,True,flexible,Private room,2022,$570 ,$114 ,2,2,10/7/2018,0.2,2,1,341,,
55425530,Beautiful Williambsurg apartment above the L,16981943482,verified,Daniel,Brooklyn,Williamsburg,40.71709,-73.95631999999999,United States,US,True,flexible,Private room,2004,"$1,078 ",$216 ,21,1,10/6/2018,0.11,5,1,0,,
55426083,Humble One Bedroom Brooklyn Apt 15mins to the City,70139522027,unconfirmed,Jivani,Brooklyn,Bedford-Stuyvesant,40.6823,-73.94958000000001,United States,US,True,strict,Entire home/apt,2008,$373 ,$75 ,2,4,4/30/2019,0.48,4,1,70,"Please treat my place as your own. Turn off the lights, AC, fan, etc when you leave the apartment, and wash any kitchenware and dishes that you've used. Put used towels on the floor, so that I now they've been used.",
55426635,"A Comfortable private room+Near # 2, 4 & 6 trains",89892404721,verified,Livinus,Bronx,Mott Haven,40.811609999999995,-73.90513,United States,US,True,moderate,Private room,2017,$268 ,$54 ,1,24,6/30/2019,2.38,5,1,150,,
55427187,"Huge Room in Grammercy, terrace access",65400201264,verified,Alyona,Manhattan,Kips Bay,40.73865,-73.9788,United States,US,True,strict,Private room,2015,$939 ,$188 ,1,11,4/18/2019,1.13,5,2,147,"- Non-smoker - No perfume/cologne use - Microwave for light use, not cooking - Very light and fast food prep - Mailing address not to be shared with anyone but family and friends - Take is seriously: If  any of yours not personal mail comes to this mail box, you will be charged $200 and $5 for each letter after that indefinitely - Guest agrees not to write reviews for areas not on amenities list",
55427740,"Clean, cozy and private room in midtown Manhattan",27211120958,unconfirmed,Ivy,Manhattan,Murray Hill,40.7483,-73.9736,United States,US,True,moderate,Private room,2015,$127 ,$25 ,1,43,6/21/2019,4.24,4,2,176,No smoking. Please respect our neighbors.,
55428292,Cozy Comfortable Studio Suite,71214133558,verified,Shama,Brooklyn,Canarsie,40.63814,-73.90002,United States,US,True,strict,Entire home/apt,2021,$860 ,$172 ,1,68,7/5/2019,7.58,5,1,258,#NAME?,
55428844,Elegant 4 Bedroom 2.5 Bath with Contemporary Charm,84677735179,unconfirmed,Charmine,Brooklyn,Crown Heights,40.67222,-73.93486999999999,United States,US,False,flexible,Entire home/apt,2016,$198 ,$40 ,3,15,6/24/2019,1.56,3,3,124,,
55429396,Industrial-Chic Room Available in Artist Loft,95823967021,unconfirmed,Amanda,Brooklyn,Bushwick,40.68992,-73.90435,United States,US,False,moderate,Private room,2011,"$1,059 ",$212 ,3,8,2/14/2019,0.82,2,1,0,Let's talk to get to know each other !,
55429949,Spanish Harlem urban hang Suite,48577912501,unconfirmed,Najah,Manhattan,East Harlem,40.79916,-73.93959,United States,US,False,flexible,Entire home/apt,2004,$675 ,$135 ,7,5,1/2/2019,0.52,5,2,0,Female first please. Please keep the space quiet and clean.,
55430501,Caribbean Home,25760397950,verified,Jennifer,Brooklyn,East New York,40.666309999999996,-73.86278,United States,US,True,strict,Private room,2006,$292 ,$58 ,2,17,6/23/2019,1.68,4,1,334,"Non-smokers, no smoking in or out of home No perfume/cologne use, no other sprays  Deodorant/antiperspirant is OK but not sprays  Recycling, reusable shopping bags No mailing address sharing: first offense $200, and $5 per letter after that LIFE TIME Please don't use ""single use disposable"" plastic bags Mailing address MAY NOT be shared with anyone accept delivery. Reusable foldeable shopping bag (provided, and you may take it with you) Plates, cup, utensils are only in space between refrigerator and sink Please don't keep dirty dishes in your room, but if you must, tide them in plastic bag (green kind, find in bathroom basket) Please keep your room at least reasonably tidy Host may enter the room to collect the trash or fix things if needed All your things are safe in your room Take off street shoes when indoor Washed slippers provided if you don't have your own  Please be respectful, considered, and aware what is left behind you when you are in common areas, and how it will impact th",
55431053,New 3BR 2Full bath Apartment with Dryer & Washer,2614231223,verified,Lucy,Brooklyn,Crown Heights,40.670609999999996,-73.95023,United States,US,True,flexible,Entire home/apt,2009,$794 ,$159 ,3,11,6/16/2019,1.11,3,5,280,"This is an old house which was built in the 1900s, and may not be sparkingly clean and modern, but we appreciate it if you can clean after yourself, and put things back to where they belong. Garbage day is on Friday, you can simply put your trash into the dumpster and we'll take care of the rest. Please be respectful to other tenants on the second floor. Thank you.",
55431606,New york Multi-unit building,853709489,unconfirmed,Doreen,Brooklyn,Bushwick,40.68705,-73.91456,United States,US,True,flexible,Private room,2021,$746 ,$149 ,2,85,7/5/2019,8.31,5,2,309,,
55432158,Small Crash Pad in the heart of Williamsburg!,82600214915,unconfirmed,Sean,Brooklyn,Williamsburg,40.71281,-73.95226,United States,US,False,moderate,Private room,2012,"$1,012 ",$202 ,3,17,6/16/2019,2.8,4,1,0,1) No Smoking in property!!!  2) Do not slam doors!!! Close lightly Please!!! 3) No Shoes in house (except slippers) 4) Quiet down AFTER 10PM.,
55432710,Very Accomodating,42715841986,unconfirmed,Roberta,Queens,Laurelton,40.68104,-73.74821,United States,US,False,flexible,Entire home/apt,2013,$169 ,$34 ,1,14,6/24/2019,1.53,4,1,356,House rules will be provided upon booking.,
55433263,"Sunny studio, minutes from Columbia",73755502805,verified,Sahar,Manhattan,Harlem,40.80579,-73.95606,United States,US,True,flexible,Entire home/apt,2015,$866 ,$173 ,6,5,6/8/2019,0.53,3,1,192,Respectful of the apartment,
55433815,New York City Finest,19085710567,verified,Maryam,Brooklyn,Bedford-Stuyvesant,40.68871,-73.92732,United States,US,False,moderate,Entire home/apt,2004,$859 ,$172 ,2,48,7/5/2019,4.86,5,1,104,"Please treat it like your own place and leave it the way you found it! Please clean up prior to leaving.  No smoking indoors, no late night parties.",
55434367,Grand Suite Floor Thru in Artist's Duplex loft,22065922979,verified,Sabina,Brooklyn,Bedford-Stuyvesant,40.68804,-73.94575999999999,United States,US,True,strict,Private room,2013,$407 ,$81 ,2,0,,,5,1,88,#NAME?,
55434919,*** Hell's kitchen quiet private room ***,46559280644,unconfirmed,Maria,Manhattan,Hell's Kitchen,40.765609999999995,-73.98387,United States,US,True,moderate,Private room,2014,$980 ,$196 ,1,62,6/30/2019,6.55,4,5,351,"-Our one golden rule is: Please treat our space with respect (i.e. Clean up after yourself, be sure to lock the door when you leave, etc.)  -Absolutely NO SMOKING!!!! -We are fun-loving people, so we dont mind you having some friends over, but the above rule applies twofold in that scenario. -You're welcome to use dishes, appliances, etc in the kitchen, but we ask that you buy your own food/drinks rather than use ours. -No pets allowed (not our rule, our landlord's) -Upon checkout, please turn A/C units and lights off before leaving. -Feel free to ask us about the area-- we know it well and love to recommend!",
55435472,Sun-drenched 3BD apt in Harlem,67816286443,verified,Willy,Manhattan,Harlem,40.82302,-73.94259,United States,US,False,strict,Entire home/apt,2004,$329 ,$66 ,3,12,7/3/2019,1.29,3,4,230,"Please note that we are a no smoking environment, and pets are only accepted in certain room types that have direct access to the outside. Please call ahead to make arrangements.",
55436024,Manhattan Private X-Small Bedroom- Good Location,91346699670,unconfirmed,Julian,Manhattan,Hell's Kitchen,40.766709999999996,-73.98413000000001,United States,US,False,moderate,Private room,2012,$287 ,$57 ,4,27,5/19/2019,2.83,5,1,0,"Please note that we are a no smoking environment, and pets are only accepted in certain room types that have direct access to the outside. Please call ahead to make arrangements. ",
55436576,Charming downtown New York Serviced Apartment,16148914548,unconfirmed,Katy,Manhattan,Civic Center,40.71167,-74.00749,United States,US,False,flexible,Entire home/apt,2018,$603 ,$121 ,13,4,2/21/2019,0.44,3,1,0,"1.  No loud music. 2. No parties. 3. No removal of items from the apartment unless expressly allowed by the host. 4.  Security deposit shall be claimed in the event of the following:   a. Damaged or soiled sheets, to the extent that they require replacement     b. Theft of items kept on and about the premises.    c. Unreturned keys.    d. Damage to the apartment or any part or item within and without the premises.    e. The presence of pets in the apartment, due to intent or negligence on the part of the guest and their party.    d. The presence of illicit or illegal substances, or illicit or illegal activities, on or about the premises",
55437129,"Apr - Jun, Entire apt, UWS near park and subway!",52556603498,unconfirmed,Robert & Nira,Manhattan,Upper West Side,40.78883,-73.96848,United States,US,True,moderate,Entire home/apt,2016,$73 ,$15 ,8,2,11/19/2018,0.22,4,1,8,,
55437681,"""THE MANHATTAN OASIS"" Penthouse & Private Terrace",6944785260,unconfirmed,Jen,Manhattan,East Village,40.72936,-73.98093,United States,US,True,strict,Entire home/apt,2018,"$1,151 ",$230 ,2,35,6/3/2019,3.44,3,1,262,,
55438233,Hunters Point 2500sf 3-story Garden Home,73280350202,verified,Freda,Queens,Long Island City,40.74613,-73.95343000000001,United States,US,True,moderate,Entire home/apt,2018,$197 ,$39 ,2,2,7/5/2019,0.25,5,2,272,"Please note that we are a no smoking environment, and pets are only accepted in certain room types that have direct access to the outside. Please call ahead to make arrangements. ",
55438786,Beatuful Harlem Urban Penthouse,13850959007,unconfirmed,Elvis,Manhattan,East Harlem,40.79824,-73.94014,United States,US,True,strict,Entire home/apt,2005,$113 ,$23 ,2,53,6/11/2019,5.96,2,1,14,,
55439338,Ft. Green/ Clinton Hill Downtown Brooklyn,88429983225,unconfirmed,Arkell,Brooklyn,Fort Greene,40.68528,-73.97126999999999,United States,US,False,flexible,Entire home/apt,2018,$992 ,$198 ,2,13,2/18/2019,1.3,4,1,0,"- Please keep the house exactly like you found it. Please don't leave a mess. Please don't leave things dirty. - If you use the bathroom, clean or wipe things down (there will be a cloth to wipe off excess water, etc.) - If you use the kitchen, please clean dishes and wipe things down as well - No guest allowed - you can meet friends at other venues - Shoes off in the apartment - please leave by the door. If you would like please bring some slippers. - Please keep things quiet after 10pm - If you smoke, you must go outside! NO smoking inside! - If you cook, turn the fan on above the stove - If you watch TV, turn it off when you are done. - Please use your common sense, and if you are not sure, ask... - Remember, this is my house - so try to treat it with respect. - if the parking pass is not returned, you will be charged the full amount of the deposit",
55439890,NewPlace 4,70513096070,verified,Jimmy,Queens,Flushing,40.75778,-73.83353000000001,United States,US,True,strict,Private room,2022,"$1,070 ",$214 ,1,7,5/4/2019,0.7,5,4,347,"Please treat my place as your own. Turn off the lights, AC, fan, etc when you leave the apartment, and wash any kitchenware and dishes that you've used. Put used towels on the floor, so that I now they've been used.",
55440442,Entire fully furnished 1 Bed/1 Bath w/French Doors,88254637282,verified,Joshua,Manhattan,Harlem,40.8072,-73.94383,United States,US,False,moderate,Entire home/apt,2009,$722 ,$144 ,5,17,4/25/2019,1.95,5,1,3,- Please be respectful and polite to neighbors. There are downstairs tenants so please don't be noisy after 11pm. - Please turn off any lights and adjust down the thermostat to 55 before you depart or please turn off the AC window units/fans - Return keys to lockbox at end of stay. (There is a fee of $50 for each set of lost keys) - No animals - No smoking in the house (there is a backyard area) - Check in is at 4:00 pm (message for special requests) - Check out is at 12 noon,
55440995,Mott Haven Dorm-Bed A,14934231804,unconfirmed,Rem,Bronx,Port Morris,40.8102,-73.93146999999999,United States,US,True,flexible,Shared room,2011,$265 ,$53 ,1,18,6/20/2019,1.93,3,7,60,,
55441547,Home away from home,50763891800,verified,Jamie,Queens,Long Island City,40.75472,-73.91891,United States,US,False,moderate,Entire home/apt,2011,$323 ,$65 ,2,27,6/9/2019,2.74,3,1,0,"House Rules 1. Check-in is 4 pm local time. If the unit is ready earlier, we’ll let you know. Check-out is normally 11 am local time, but we’d be happy to extend it as long as we don’t have a cleaning scheduled. Just let us know.  2. All bookings require a security deposit of at least $300, which will be refunded within 7 days of your check-out. 3. For security measures we require all guests to provide proof of identification through ID verification on our own website. In order to check in we'll need a photo of your ID.  4. Our cancellation policy is as shown on our ad and defined by the site you are booking through.  5. Don’t let $300 go up in smoke. There's no smoking allowed in any Flatbook and a $300 fine for breaking this rule.  6. Unfortunately we don’t allow pets in any of our apartments. 7. Unless you’re staying in one of our specialty apartments, we don’t allow parties or excessive noise. 8. If we find the place very messy, we have to charge an extra $40 for every extra hour o",
55442099,Great room in Bushwick!,83641125354,verified,Brian,Brooklyn,Bushwick,40.69297,-73.90427,United States,US,True,strict,Private room,2021,"$1,041 ",$208 ,2,23,5/5/2019,2.35,3,5,339,,
55442652,Grande chambre lumineuse à bushwick,16454699473,verified,Marie,Brooklyn,Bushwick,40.69469,-73.90786,United States,US,True,strict,Private room,2016,$468 ,$94 ,2,10,3/11/2019,1.05,4,1,0,"Please expect to share the apartment with guests having various backgrounds. Be respectful and decent, also enjoy interacting with each other. Please dress descent in the house especially in and out of the shower.",
55443204,Cozy and Bright Private Bedroom,60610434238,verified,Jayden & Minea,Brooklyn,Bedford-Stuyvesant,40.69657,-73.93661,United States,US,True,moderate,Private room,2008,$676 ,$135 ,1,39,6/23/2019,3.98,3,1,15,,
55443756,Luxe 2 Bedroom Sunrise Brooklyn Loft Condo,11051825930,verified,Fay,Brooklyn,Canarsie,40.63933,-73.88221,United States,US,True,moderate,Entire home/apt,2014,$880 ,$176 ,3,0,,,4,2,270,,
55444309,Comfortable Brooklyn Oasis,88889933897,verified,Suzi,Brooklyn,Crown Heights,40.67085,-73.93866,United States,US,False,strict,Private room,2016,$869 ,$174 ,20,3,3/18/2019,0.39,4,1,0,,
55444861,1 private bedroom in Bushwick!,622323352,verified,Nicole,Brooklyn,Bushwick,40.69549,-73.925,United States,US,True,moderate,Private room,2013,$906 ,$181 ,2,1,9/21/2018,0.1,3,2,0,,
55445413,Large Room In 3Bed Home w/ Washer/Dryer,57674412125,unconfirmed,Peter,Brooklyn,East Flatbush,40.65059,-73.94506,United States,US,False,strict,Private room,2004,$410 ,$82 ,3,1,10/8/2018,0.11,4,1,179,,
55445965,Small private room for single ones comfy and clean,85481948576,verified,Tiba,Manhattan,Hell's Kitchen,40.764379999999996,-73.98955,United States,US,False,strict,Private room,2012,$753 ,$151 ,2,29,6/21/2019,2.87,3,5,0,#NAME?,
55446518,The Greek Goddess House.,7811807574,verified,Sofia,Queens,Middle Village,40.71246,-73.88784,United States,US,False,moderate,Private room,2015,$557 ,$111 ,2,6,10/7/2018,0.62,3,1,156,,
55447070,Queens Palace,29177091004,unconfirmed,George & Kevin,Queens,Ditmars Steinway,40.776579999999996,-73.90344,United States,US,False,moderate,Entire home/apt,2012,$201 ,$40 ,3,12,12/30/2018,1.21,5,1,0,1) No Smoking in property!!!  2) Do not slam doors!!! Close lightly Please!!! 3) No Shoes in house (except slippers) 4) Quiet down AFTER 10PM.,
55447622,"Spacious, Bright, Cozy, BROOKLYN APT",55400911756,verified,Elsa,Brooklyn,Prospect Heights,40.67881,-73.97166,United States,US,True,moderate,Entire home/apt,2003,$598 ,$120 ,5,15,6/24/2019,1.75,4,1,0,"We are looking for quiet and respectful guests given that we have neighbors with young children. As a result, I would ask to please keep noise levels in the house at a minimum between 9pm and 8am (you can still cook and watch TV, etc. just don't go around moving furniture :)",
55448175,Artistic + peaceful studio in Greenpoint Brooklyn,75983846889,verified,Michael,Brooklyn,Greenpoint,40.73449,-73.95716,United States,US,False,moderate,Private room,2020,$712 ,$142 ,3,2,10/8/2018,0.21,3,1,0,Please do not smoke. Be respectful of the other guests.,
55448727,Ultra Luxury TriBeCa LOFT!,47410130546,verified,Valerie,Manhattan,Civic Center,40.71317,-74.00654,United States,US,False,moderate,Entire home/apt,2006,$987 ,$197 ,2,42,6/1/2019,4.33,3,1,42,,
55449279,Oasis in the heart of Williamsburg,6068050730,unconfirmed,Andrew,Brooklyn,Williamsburg,40.71525,-73.96486999999999,United States,US,False,flexible,Entire home/apt,2013,$866 ,$173 ,5,1,1/2/2019,0.16,2,1,78,,
55449832,"Live, Work, Play In Williamsburg!",83365228082,unconfirmed,Aliu,Brooklyn,Williamsburg,40.70904,-73.95198,United States,US,False,moderate,Private room,2020,$551 ,$110 ,3,5,1/5/2019,0.53,4,1,85,,
55450384,Your Cozy Room,80348025328,verified,Anting,Brooklyn,Greenpoint,40.732859999999995,-73.95085999999999,United States,US,True,flexible,Private room,2022,$837 ,$167 ,1,5,4/21/2019,0.51,4,33,365,"I respectfull ask that you treat my home as you would a friend's home.  My house rules are just common sense and courtesy. 1.  No loud music. 2. No parties. 3. No removal of items from the apartment unless expressly allowed by the host. 5.  Apartment door must be kept locked at all times.  4.  Security deposit shall be claimed in full in the event of any of the following:   a. Damaged or soiled sheets, to the extent that they require replacement.    b. Theft of items kept on and about the premises.    c. Unreturned keys.    d. Damage to the apartment or any part or item within and without the premises.    e. The presence of pets in the apartment, due to intent or negligence on the part of the guest and their party.    d. The presence of illicit or illegal substances, or illicit or illegal activities, on or about the premises     f.  Failure to vacate the premises by the agreed check-out time",
55450936,BnB & Spa,9521852260,verified,Lilly Rose,Bronx,Westchester Square,40.841840000000005,-73.84966999999999,United States,US,False,moderate,Private room,2015,$681 ,$136 ,1,26,6/21/2019,2.65,2,2,123,,
55451488,Nice room near Manhattan in a safe neighborhood,43273106191,unconfirmed,Robertina,Queens,Jackson Heights,40.75176,-73.88374,United States,US,True,moderate,Private room,2005,$381 ,$76 ,4,23,7/7/2019,2.28,4,4,112,"House Rules 1. Check-in is 4 pm local time. If the unit is ready earlier, we’ll let you know. Check-out is normally 11 am local time, but we’d be happy to extend it as long as we don’t have a cleaning scheduled. Just let us know.  2. All bookings require a security deposit of at least $300, which will be refunded within 7 days of your check-out. 3. For security measures we require all guests to provide proof of identification through ID verification on our own website. In order to check in we'll need a photo of your ID.  4. Our cancellation policy is as shown on our ad and defined by the site you are booking through.  5. Don’t let $300 go up in smoke. There's no smoking allowed in any Flatbook and a $300 fine for breaking this rule.  6. Unfortunately we don’t allow pets in any of our apartments. 7. Unless you’re staying in one of our specialty apartments, we don’t allow parties or excessive noise. 8. If we find the place very messy, we have to charge an extra $40 for every extra hour o",
55452041,BEAUTIFUL 2 BEDROOM APARTMENT,56949766140,unconfirmed,Ramon,Manhattan,Hell's Kitchen,40.76125,-73.99389000000001,United States,US,False,moderate,Entire home/apt,2020,$282 ,$56 ,3,41,7/1/2019,4.29,4,1,74,- No smoking inside the apartment - Checkout time is 11:00 am (a later time can be accommodated if it is available - but please ask ahead of time) - No Loud Music or Loitering outside the entrance after 10:00pm,
55452593,"Spacious, Bright, and Convienent in East Harlem",10831878587,verified,Dawn,Manhattan,East Harlem,40.7984,-73.9427,United States,US,True,moderate,Entire home/apt,2012,$603 ,$121 ,14,1,10/25/2018,0.12,2,1,0,We except you to clean up after yourself and generally be respectful. Smoking should happen outside the house. Also please do not tap on the glass terrarium or play with the ball python. It is very timid and mostly wants to sleep.,
55453145,Private En-suite in an Beautiful Brownstone,49372042206,unconfirmed,Naftaly,Brooklyn,Crown Heights,40.666270000000004,-73.94164,United States,US,True,flexible,Entire home/apt,2015,$54 ,$11 ,1,12,5/31/2019,1.31,5,1,109,Clean and no party,
55453698,"Suite 18 - Mini Apartment, ALL YOURS!",6968596166,unconfirmed,Daisy,Brooklyn,Brighton Beach,40.57973,-73.95799,United States,US,True,flexible,Private room,2018,$847 ,$169 ,1,23,6/25/2019,2.34,4,5,204,,
55454250,Brand New 1BDR Apartment within 5 min walk to SOHO,43049150022,verified,Waise Omid,Manhattan,Lower East Side,40.71768,-73.99068,United States,US,True,strict,Entire home/apt,2003,$620 ,$124 ,2,15,5/23/2019,1.51,4,1,129,,
55454802,Little paradise,87271137688,unconfirmed,David,Queens,Forest Hills,40.71962,-73.85,United States,US,False,moderate,Private room,2015,$313 ,$63 ,1,47,6/26/2019,4.64,4,2,196,Please remove the shoes in the house.,
