id,NAME,host id,host_identity_verified,host name,neighbourhood group,neighbourhood,lat,long,country,country code,instant_bookable,cancellation_policy,room type,Construction year,price,service fee,minimum nights,number of reviews,last review,reviews per month,review rate number,calculated host listings count,availability 365,house_rules,license
50045576,Cozy Room in Historic BedStuy,12739697491,unconfirmed,Daniel,Brooklyn,Bedford-Stuyvesant,40.692640000000004,-73.94266999999999,United States,US,False,flexible,Private room,2022,$287 ,$57 ,3,0.0,,,2,1,0,"No smoking allowed in property or on roof deck. No pets allowed.  Please be respectful of other neighbors who live in close proximity, especially when enjoying the roof deck.",
50046128,Sunlight + Space on Eastern Parkway,67148192050,verified,Yosef And Chava,Brooklyn,Crown Heights,40.67046,-73.94156,United States,US,True,strict,Entire home/apt,2009,$346 ,$69 ,2,4.0,12/5/2016,0.12,2,1,0,No Smoking No Pets,
50046681,Lovely West Village Apt. Avail: May 25 - June 26,89314028135,verified,Liam,Manhattan,West Village,40.729890000000005,-74.00541,United States,US,False,flexible,Entire home/apt,2008,$572 ,$114 ,30,16.0,5/16/2017,0.48,3,2,0,,
50047233,"Home 4 Medical Professionals - The ""Trigeminal""",78569914944,unconfirmed,Stat,Brooklyn,Bedford-Stuyvesant,40.68943,-73.95186,United States,US,True,flexible,Private room,2011,"$1,119 ",$224 ,30,0.0,,,1,43,328,"We require a signed lease as soon as we accept your request. No smoking, no pets, no parties. We strive to maintain a quiet, professional community. Two week minimum stay. Two occupants maximum per apartment. No Sunday checkins and no check in after 6:30 pm",
50047785,Quiet Clean and Charming! Entire Apt Fri-Sun!,86200658037,verified,Jeanie,Manhattan,Inwood,40.86582,-73.92582,United States,US,True,moderate,Private room,2011,"$1,073 ",$215 ,4,26.0,5/24/2019,0.78,3,1,238,"House Rules The house rules are an important part of staying in this condo.  You will be sharing a living space with other guests and a high level of consideration, respect, communication and tolerance is expected from you.  They are meant to make your stay more pleasant, to prevent conflicts and to protect the property of any damage.  If you feel there is something that needs to be addressed and that is not covered in these rules, please make sure you communicate that to the host. 1.  Toilet · The toilettes can only be used with toilet paper provided.  Any other material disposed of will cause the plumbing system to back up and create drainage problems.  No tissues, cotton balls, tampons, Q-tips cotton swabs or any kind of sanitary products are allowed down the toilets.  · Any plumbing work due to clogged toilets will be charged to the guests. 2. Noise and Quiet Hours · Quiet hours are from 10pm until 7am.  During quiet hours radios and stereos may be played at a level not to be heard",
50048338,Stay in Solar Powered Apartment in NYC!!!,42615964883,verified,Tamara,Queens,Long Island City,40.759570000000004,-73.92863,United States,US,False,moderate,Entire home/apt,2004,$202 ,$40 ,2,95.0,6/19/2019,2.86,5,1,309,"For Your CarYup! IT'S JUST THE PARKING SPACE.  And it's reasonable but not FREE, and not even a bed is included.  No Queen No Real Bed, No Beds at all, but I don't care how few or how many people use the car you park in the space.   I'm writing to AIRBNB's Help Desk, to get them to add OTHER to their ""Room Type"" menu, and to add a choice of 0 beds to the pull down menus.     Parking in Boston's South End is more scarce than Penthouses or Hen's Teeth.  And parking per square foot rents for more than a square foot of air-mattress-for-a-night!  Go To https://www.airbnb.com/rooms/",
50048890,"Huge Brownstone,Private Garden- Pet chicks & eggs.",35012689625,verified,Kimberly,Brooklyn,Bedford-Stuyvesant,40.69059,-73.95602,United States,US,True,moderate,Private room,2010,$130 ,$26 ,3,20.0,2/12/2019,0.61,1,4,90,NO SMOKING IN OR OUT THE APARTMENT. please be aware of the Neighbors and respect their space and privacy as well. No free parking,
50049442,"Home 4 Medical Professionals- The ""Tamponade""",81735543457,verified,Stat,Brooklyn,Bedford-Stuyvesant,40.68979,-73.95048,United States,US,False,flexible,Private room,2018,$661 ,$132 ,30,1.0,10/7/2017,0.05,3,43,216,#NAME?,
50049994,Cozy room in Times Square .,84617168621,unconfirmed,Felipe,Manhattan,Hell's Kitchen,40.76276,-73.98942,United States,US,False,strict,Private room,2018,$202 ,$40 ,2,105.0,12/15/2018,3.09,2,1,0,Please no smoking and no parties! Hope you don't mind if we let you know if you are too loud.,
50050547,Eco  private room for 4 best location to Mahanttan,73139400987,verified,Eddie & Lois,Staten Island,West Brighton,40.63215,-74.11403,United States,US,True,flexible,Private room,2007,"$1,036 ",$207 ,2,56.0,1/4/2019,1.8,2,5,355,We just ask that you respect the other guests and residents in the building.,
50051099,"Large beautiful studio loft, high floor, views!",94255480979,unconfirmed,Jesse,Manhattan,Hell's Kitchen,40.767140000000005,-73.98777,United States,US,False,strict,Entire home/apt,2003,"$1,166 ",$233 ,14,0.0,,,5,1,0,"House handbook sent prior to arrival but please be considerate with noise, smoking on roofdeck only and parties are not allowed...thank you!",
50051651,"Williamsburg Private Room, Outdoor Space w/grill",97821133358,verified,Joseph,Brooklyn,Williamsburg,40.71204,-73.9656,United States,US,True,moderate,Private room,2004,$564 ,$113 ,3,29.0,7/8/2019,0.85,1,1,0,,
50052204,"Beautiful, quiet, light-filled 1-bdrm apt",70548364960,verified,Elias,Brooklyn,Williamsburg,40.71111,-73.96299,United States,US,True,strict,Entire home/apt,2008,$277 ,$55 ,4,12.0,11/30/2018,0.37,4,1,5,**Complimentary breakfast is available only by request.,
50052756,Bedroom in the heart of NYC,41605059589,unconfirmed,Greg,Manhattan,Chelsea,40.745870000000004,-73.99149,United States,US,False,strict,Private room,2020,$318 ,$64 ,1,200.0,6/19/2019,5.87,3,4,60,No Smoking No Pets,
50053308,"Spacious 2 bdrm Apt. in the center of  NYC, Apt 4C",31206196875,verified,Nina,Manhattan,Midtown,40.74949,-73.98277,United States,US,True,strict,Entire home/apt,2022,"$1,009 ",$202 ,30,5.0,8/10/2018,0.16,3,14,326,,
50053861,Artists rustic 2 Room studio  in Red Hook,29238472829,verified,Risha,Brooklyn,Red Hook,40.677479999999996,-74.00989,United States,US,True,flexible,Entire home/apt,2007,$309 ,$62 ,2,132.0,7/3/2019,3.91,4,1,244,No Smoking No Pets,
50054413,Bright 1 Bedroom Apt Near Attractions and Transit,95979509519,verified,Panthea,Bronx,Bronxdale,40.854009999999995,-73.86594000000001,United States,US,False,moderate,Entire home/apt,2011,$674 ,$135 ,7,24.0,8/24/2018,0.71,4,1,0,No Smoking. No Pets.,
50054965,Brand New 1 Bedroom NYC Apartment & Outside Space,66856647190,unconfirmed,Bryan,Manhattan,Harlem,40.80466,-73.95581999999999,United States,US,True,flexible,Entire home/apt,2022,$159 ,$32 ,3,1.0,1/22/2017,0.03,1,1,364,"Common sense rules. No smoking indoors. Be courteous to the neighbors.  Please respect the property, this is our home. If you intend to entertain more than 5 people at any point during your stay, please seek approval from me in advance of booking your stay. Please make sure the door is locked each time you leave the apartment. ",
50055517,$89.00 Queen Size Bed,74744161068,unconfirmed,Lynne,Queens,Jamaica,40.67537,-73.77355,United States,US,False,strict,Private room,2012,$818 ,$164 ,1,5.0,9/7/2018,0.16,1,2,179,"Iconic Boston Brownstone with amazing views, but no elevator. 3 flights of stairs up to the apartment, another set once in the unit up to the private roof deck. No smoking, no pets. My apartment is in a building with 2 other units, people who live there full time. Please be respectful of my neighbors and their privacy, no late night parties.  This is a quiet building.",
50056070,Beautiful sunlight room in the heart of Bushwick!,51428662985,verified,Alina,Brooklyn,Bushwick,40.69935,-73.91332,United States,US,False,moderate,Private room,2009,$150 ,$30 ,4,4.0,1/2/2018,0.16,1,1,189,"Please smoke outside in the front of the building, no additional guests.",
50056622,Comfy Room in East Flatbush,27773500081,unconfirmed,Andre,Brooklyn,Flatlands,40.62979,-73.94431,United States,US,True,flexible,Private room,2015,"$1,154 ",$231 ,1,2.0,9/17/2017,0.09,4,8,189,"House Rules The house rules are an important part of staying in this condo.  You will be sharing a living space with other guests and a high level of consideration, respect, communication and tolerance is expected from you.  They are meant to make your stay more pleasant, to prevent conflicts and to protect the property of any damage.  If you feel there is something that needs to be addressed and that is not covered in these rules, please make sure you communicate that to the host. 1.  Toilet · The toilettes can only be used with toilet paper provided.  Any other material disposed of will cause the plumbing system to back up and create drainage problems.  No tissues, cotton balls, tampons, Q-tips cotton swabs or any kind of sanitary products are allowed down the toilets.  · Any plumbing work due to clogged toilets will be charged to the guests. 2. Noise and Quiet Hours · Quiet hours are from 10pm until 7am.  During quiet hours radios and stereos may be played at a level not to be heard",
50057174,Big Suite in Crown Heights,2914010521,unconfirmed,Andre,Brooklyn,Crown Heights,40.66684,-73.94753,United States,US,True,flexible,Private room,2014,"$1,144 ",$229 ,30,8.0,1/1/2019,0.23,3,8,340,,
50057727,Private Bedroom in Queen -JFK 8mins,22131898160,unconfirmed,Nickesha,Queens,St. Albans,40.68461,-73.76899,United States,US,True,strict,Private room,2005,$564 ,$113 ,1,98.0,6/23/2019,2.87,1,5,180,We expect our guests to treat this condo as their home and to be respectful of our wonderful neighbors.   This property is entirely non-smoking (including outside on the patio or front stoop).  Pets are not allowed.  No guests or parties.,
50058279,Cozy Private Room for Eager Travelers! :D,78891122017,verified,Russell,Brooklyn,Prospect-Lefferts Gardens,40.65916,-73.95074,United States,US,True,flexible,Private room,2010,$420 ,$84 ,3,169.0,7/2/2019,4.98,5,1,136,"*Please share with other guests in your reservation. Thanks!* [Security]  Unless otherwise specified, building and apartment access is for reserved guests only. Lock doors when coming and going; keep keys and windows secure.  [Courtesy]  Be mindful of neighbors. No smoking in/around the property. No shoes in the apartment. Pick up after yourself. [Be Green]  Turn off lights, electronics and faucets when not in use. Recycling bin (paper, plastic, glass, aluminum) and reusable shopping bags are in the pantry.  [Communicate]  Please tell me right away if you feel you're having less than a 5-star experience. So many of my trips were made better by caring, thoughtful hosts; it would make me happy to do the same for you.",
50058831,"CLASSIC BRICK BROOKLYN. Rooftop, plants, books...",1695397490,verified,Rebecca,Brooklyn,Crown Heights,40.67415,-73.95626999999999,United States,US,False,flexible,Private room,2017,$325 ,$65 ,4,2.0,8/28/2018,0.06,1,1,14,,
50059384,The comfy spot away from home,16419937269,verified,Christine,Brooklyn,Cypress Hills,40.680040000000005,-73.88709,United States,US,False,flexible,Private room,2007,$599 ,$120 ,3,0.0,,,2,1,317,"A residential, quiet, small building. Non- smoking. No heavy drinking. No pets",
50059936,Spacious Sun Light Studio in Heart of Williamburg.,1775666509,unconfirmed,Susan,Brooklyn,Williamsburg,40.7176,-73.96148000000001,United States,US,True,flexible,Entire home/apt,2013,$457 ,$91 ,3,19.0,10/1/2018,0.57,3,1,7,New luxury furnishings provided.  Please be respectful.  If an accident happens please report and it will be resolved.  ,
50060488,"Charming, Cozy & Convenient 1 Bd Apartment",5292239744,verified,Pavle,Brooklyn,Park Slope,40.67634,-73.98311,United States,US,True,moderate,Entire home/apt,2005,$605 ,$121 ,14,10.0,6/30/2018,0.3,1,1,20,NO Smoking,
50061040,One bedroom in luxury FiDi building,87834300268,unconfirmed,Rishab,Manhattan,Financial District,40.7083,-74.01406,United States,US,True,flexible,Private room,2019,$675 ,$135 ,5,1.0,1/1/2017,0.03,2,1,0,"No kids, no pets, no smoking.",
50061593,Comfortable Harlem NYC 1 Bedroom Near Trains,24508845110,unconfirmed,Toyce,Manhattan,Harlem,40.82367,-73.93762,United States,US,True,moderate,Entire home/apt,2005,$547 ,$109 ,2,3.0,8/13/2017,0.09,5,1,0,,
50062145,"Comfortable Room in Lovely Home, quick ride to NYC",40511560984,verified,Karen,Brooklyn,Sunset Park,40.65651,-74.0029,United States,US,True,moderate,Private room,2006,$814 ,$163 ,2,34.0,6/13/2019,1.0,3,2,181,,
50062697,Cozy Getaway Rental Home,15826504974,unconfirmed,Lourdes,Queens,Holliswood,40.72468,-73.76680999999999,United States,US,True,flexible,Private room,2014,$682 ,$136 ,3,11.0,6/30/2019,0.52,4,1,135,This is a residential property and quiet is maintained.   Absolutely zero smoking on or near the property.  Be respectful and kind.,
50063250,Huge apartment in a beautiful house in Greenpoint,21575194259,unconfirmed,Charles,Brooklyn,Greenpoint,40.72596,-73.94643,United States,US,True,strict,Entire home/apt,2016,$855 ,$171 ,3,8.0,12/7/2018,0.24,1,1,0,"House Rules 1. Check-in is 4 pm local time. If the unit is ready earlier, we’ll let you know. Check-out is normally 11 am local time, but we’d be happy to extend it as long as we don’t have a cleaning scheduled. Just let us know.  2. All bookings require a security deposit of at least $300, which will be refunded within 7 days of your check-out. 3. For security measures we require all guests to provide proof of identification through ID verification on our own website. In order to check in we'll need a photo of your ID.  4. Our cancellation policy is as shown on our ad and defined by the site you are booking through.  5. Don’t let $300 go up in smoke. There's no smoking allowed in any Flatbook and a $300 fine for breaking this rule.  6. Unfortunately we don’t allow pets in any of our apartments. 7. Unless you’re staying in one of our specialty apartments, we don’t allow parties or excessive noise. 8. If we find the place very messy, we have to charge an extra $40 for every extra hour o",
50063802,Fantastic view of the Hudson river -1 Bedroom,26704627396,verified,Sandrine,Manhattan,Hell's Kitchen,40.76133,-73.99744,United States,US,True,flexible,Entire home/apt,2006,"$1,073 ",$215 ,3,1.0,10/15/2016,0.03,2,1,158,Enjoy the space responsibly. It's a quiet family-owned building on a very busy street. Only Airbnb-vetted individuals allowed in the house - for our security as well as our neighbors - we want to keep our space safe! No smoking or pets (sorry!) Please return space as you found it.,
50064354,Cozy One Small Bedroom Soho House,18795845320,verified,Sarah,Manhattan,SoHo,40.72688,-74.0022,United States,US,True,moderate,Entire home/apt,2008,$687 ,$137 ,3,79.0,6/23/2019,2.33,3,1,28,"House Rules 1. Check-in is 4 pm local time. If the unit is ready earlier, we’ll let you know. Check-out is normally 11 am local time, but we’d be happy to extend it as long as we don’t have a cleaning scheduled. Just let us know.  2. All bookings require a security deposit of at least $300, which will be refunded within 7 days of your check-out. 3. For security measures we require all guests to provide proof of identification through ID verification on our own website. In order to check in we'll need a photo of your ID.  4. Our cancellation policy is as shown on our ad and defined by the site you are booking through.  5. Don’t let $300 go up in smoke. There's no smoking allowed in any Flatbook and a $300 fine for breaking this rule.  6. Unfortunately we don’t allow pets in any of our apartments. 7. Unless you’re staying in one of our specialty apartments, we don’t allow parties or excessive noise. 8. If we find the place very messy, we have to charge an extra $40 for every extra hour o",
50064907,Brooklyn Space with Balcony!,32469922503,unconfirmed,Theresa,Brooklyn,Sunset Park,40.66303,-73.99431,United States,US,True,strict,Private room,2003,$323 ,$65 ,10,13.0,6/23/2019,0.4,4,2,302,Enjoy!,
50065459,Lower East Side large 1 bedroom,49464447043,verified,Cory,Manhattan,Lower East Side,40.71975,-73.98608,United States,US,True,flexible,Entire home/apt,2015,$127 ,$25 ,1,2.0,10/20/2016,0.06,3,1,0,#NAME?,
50066011,Central Park Vacation,93706353364,verified,Shane,Manhattan,Upper West Side,40.78492,-73.97991999999999,United States,US,True,moderate,Private room,2011,$449 ,$90 ,2,41.0,5/20/2019,1.21,5,1,89,sorry: no smoking no pets no kids no parties ...,
50066563,Rockaway Beach House,63997026008,verified,Glenn,Queens,Arverne,40.587920000000004,-73.80062,United States,US,False,flexible,Private room,2009,$387 ,$77 ,2,8.0,5/18/2019,0.68,4,1,67,#NAME?,
50067116,New york Multi-unit building,12948916383,unconfirmed,Pablo,Bronx,Fordham,40.86533,-73.89713,United States,US,False,strict,Private room,2010,$449 ,$90 ,3,1.0,9/24/2018,0.1,4,1,179,,
50067668,"Beautiful New Studio, perfect for couples!",36084838921,unconfirmed,Joshua,Brooklyn,Fort Greene,40.69415,-73.97131,United States,US,True,flexible,Entire home/apt,2020,$529 ,$106 ,3,26.0,5/4/2018,0.76,3,1,0,"Keep the place in the same condition as upon arrival. Be yourself, but please no wild parties, thanks :)",
50068220,Large private bed/bath in 3BR close to transit,26603529204,verified,Ian,Brooklyn,Bedford-Stuyvesant,40.68678,-73.94467,United States,US,True,flexible,Private room,2008,$937 ,$187 ,2,3.0,10/29/2016,0.09,3,1,0,No smoking and no pets.  No parties without prior approval.  Names and ages of all guests is required for booking.,
50068773,Beautiful and Quiet Upper West Side Escape,48605738606,unconfirmed,Greg,Manhattan,Upper West Side,40.797779999999996,-73.97232,United States,US,False,strict,Entire home/apt,2006,$144 ,$29 ,2,1.0,10/23/2016,0.03,2,1,0,,
50069325,GAMBA Z's Artist Residency for Traveling Artists,78811918331,unconfirmed,Melissa,Brooklyn,Williamsburg,40.70547,-73.93746999999999,United States,US,True,strict,Private room,2008,$162 ,$32 ,20,0.0,,,3,2,363,"Enjoy your stay in our home, simply be respectful of our neighbors, no smoking and no pet allowed.",
50069877,"Cute, Sun filled Sudio Apartment in Manhattan",35450335388,unconfirmed,Karen,Manhattan,Midtown,40.74371,-73.98454,United States,US,True,strict,Entire home/apt,2017,$525 ,$105 ,3,57.0,4/28/2019,1.7,4,1,157,#NAME?,
50070430,Great Location! Brooklyn Heights One Bedroom,59421800160,verified,Philippe,Brooklyn,Brooklyn Heights,40.69293,-73.99113,United States,US,True,flexible,Entire home/apt,2018,$134 ,$27 ,2,25.0,6/27/2019,0.74,5,1,30,,
50070982,"Bright, Modern, Clean, Spacious, Brooklyn Home",32837810810,verified,Elaine,Brooklyn,Bedford-Stuyvesant,40.68408,-73.95411,United States,US,False,strict,Entire home/apt,2012,"$1,034 ",$207 ,3,62.0,6/26/2019,1.88,5,1,275,Yes please:  •  make yourself at home; •  ask questions. Please no: •  shoes inside; •  smoking; •  food in the bedroom; •  parties; •  pets.,
50071534,"Immaculate & Spacious Home - Astoria, Queens",14005871331,unconfirmed,Lydia,Queens,Long Island City,40.7579,-73.93052,United States,US,False,moderate,Entire home/apt,2016,$332 ,$66 ,2,5.0,10/9/2017,0.15,4,1,66,,
50072086,"PH Cozy, Clean, Close to Everything",79157491914,unconfirmed,Whit,Brooklyn,Crown Heights,40.67933,-73.96219,United States,US,True,strict,Entire home/apt,2022,"$1,197 ",$239 ,2,16.0,8/6/2017,0.48,1,1,35,"Please just don't be loud at night or in the morning, we are just one wall/ceiling away from neighbors.  Also, just respect our things, wash dishes, keep it clean - the usual! - and everything will be peachy keen.",
50072639,3BR/2 bath/Duplex+YARD/Near Columbia/City College,29287205165,verified,Migdalia,Manhattan,Harlem,40.82158,-73.95591999999999,United States,US,False,moderate,Entire home/apt,2015,$251 ,$50 ,4,69.0,6/16/2019,2.05,5,1,110,No Smoking ,
50073191,Spacious Room In Luxury NYC Apartment,43704172238,unconfirmed,Maya,Manhattan,Murray Hill,40.74968,-73.97665,United States,US,True,flexible,Private room,2005,$273 ,$55 ,4,10.0,7/5/2019,0.57,3,2,364,"This is a quiet building and expect not to be disturbed, or to create disturbances.  There is a shared washer and dryer and it is not used after 11pm.  There is absolutely no smoking allowed in the building, on the fire escape or on the front steps.  We prefer that guests be non-smokers.  Guests are not permitted to bring pets, or have visitors with pets.  Bicycles can not be brought into the building.  The City of Boston collects trash two times per week and Guests are expected to observe local trash and re-cycling schedules.  There is a more detailed description available once reservation is completed.",
50073743,"★ UES | Cozy bedroom near LGA, free coffee & tea!",93850878300,unconfirmed,Eric,Manhattan,East Harlem,40.787620000000004,-73.94303000000001,United States,US,False,flexible,Private room,2015,$647 ,$129 ,1,78.0,7/2/2019,2.33,4,2,74,,
50074296,Room In Gorgeous Gut Renovated NY Apartment,50412718034,unconfirmed,Maya,Manhattan,Murray Hill,40.74825,-73.97673,United States,US,True,strict,Private room,2007,$166 ,$33 ,5,3.0,1/14/2019,0.17,5,2,364,EACH ROOM HAS A FULL SIZED BED AND NORMALLY ROOMS ARE RENTED TO SINGLE GUESTS ONLY. OCCASIONALLY A COUPLE OF ADULTS WILL BE CONSIDERED BUT THERE IS AN ADDITIONAL CHARGE FOR MORE THAN ONE PERSON,
50074848,For all classical lover's 3@,23409039283,verified,Glory,Brooklyn,Sheepshead Bay,40.60892,-73.96221,United States,US,False,strict,Private room,2011,$771 ,$154 ,3,14.0,11/11/2018,0.41,1,2,156,"No smoking , The key located in front of the main door next to the railing   Inside of the locker , I will send the passcode to the guest prior check in , please remember to put the key back in the locker when check out .      With the key , please open with the passcode, take the key out , then close the locker , when you check out , please open the locker , place the key , then close the locker . Thank you  The Internet username : kenwang549 Password: columbus12345 The assigned parking in the behind of the building , you can follow the direction with the picture shown , and there is a sign for the parking space . Any questions or problems please contact me at (PHONE NUMBER HIDDEN) , or e mail me . Thank you",
50075400,"Spacious, Clean and Comfy 2 Bedroom",72326113442,verified,Alex,Brooklyn,Bedford-Stuyvesant,40.68385,-73.9523,United States,US,True,flexible,Entire home/apt,2020,$151 ,$30 ,2,66.0,6/30/2019,2.01,2,2,55,"Be respectful of our neighbors - No loud music or parties, please.",
50075953,Room in Bushwick Loft,56311682287,unconfirmed,Juliet,Brooklyn,Williamsburg,40.70623,-73.92808000000001,United States,US,False,strict,Private room,2016,$113 ,$23 ,4,12.0,3/15/2018,0.42,1,1,0,No smoking please. No pets.,
50076505,Beautiful apt up in the heights,33218751512,unconfirmed,Shachar,Manhattan,Washington Heights,40.838390000000004,-73.93819,United States,US,False,strict,Private room,2007,$696 ,$139 ,2,12.0,9/2/2018,0.36,5,1,124,"Please no parties,  and no loud noise past 11p, out of respect for the neighbors.  Please no smoking inside the building.  If you cook or otherwise eat in the apartment, please reasonably clean up after yourself.",
50077057,46st Cozy Flat Midtown/Tms Squr/Javits Ctr/Pier 97,1732785165,verified,Clark,Manhattan,Hell's Kitchen,40.76338,-73.99552,United States,US,False,moderate,Entire home/apt,2022,$683 ,$137 ,3,170.0,7/2/2019,4.99,4,1,82,No Pet. No Smoking. ,
50077609,Private Guestroom in Landmark Bklyn Brownstone,25707898248,verified,Mark Winston,Brooklyn,Crown Heights,40.676190000000005,-73.94936,United States,US,False,moderate,Entire home/apt,2016,"$1,005 ",$201 ,1,222.0,6/25/2019,6.61,2,1,32,smoke-free campus.,
50078162,Cozy Duplex Studio in Manhattan,77844026045,verified,Dalibel,Manhattan,Kips Bay,40.7401,-73.98123000000001,United States,US,True,strict,Entire home/apt,2014,$972 ,$194 ,2,9.0,1/1/2019,0.27,1,1,0,Please respect our privacy on 1st and 2nd floors.  We do appreciate you being quiet when coming in very late at night.  If you need anything we are happy to help in any way.,
50078714,Greyhound Manor - 2 fullbd beds and private bathrm,78634933094,unconfirmed,Carol,Brooklyn,Bedford-Stuyvesant,40.68237,-73.92258000000001,United States,US,True,strict,Private room,2017,$936 ,$187 ,2,92.0,7/2/2019,3.17,5,2,139,,
50079266,Sweet 2 Bedroom In South BK,29469163070,verified,Steven,Brooklyn,Bensonhurst,40.61238,-73.99805,United States,US,True,flexible,Entire home/apt,2022,$995 ,$199 ,3,54.0,6/13/2019,1.72,5,1,61,No Smoking No Pets,
50079819,Beautiful One Bedroom Apartment Near Central Park,54723432706,verified,Kyle,Manhattan,Theater District,40.760999999999996,-73.98522,United States,US,True,strict,Entire home/apt,2004,$662 ,$132 ,30,5.0,6/25/2017,0.15,3,23,365,,
50080371,Cozy studio,9776872719,unconfirmed,Emre,Manhattan,Upper East Side,40.77336,-73.95054,United States,US,True,flexible,Entire home/apt,2011,$252 ,$50 ,3,0.0,,,5,1,0,"Be yourself, but please no wild parties, thanks :)",
50080923,"Live Like a NYer - small space, dope neighborhood",60660505531,unconfirmed,Joi,Manhattan,Midtown,40.75645,-73.97828,United States,US,True,moderate,Entire home/apt,2021,$743 ,$149 ,1,0.0,,,1,1,364,,
50081476,Kitschy Corner Bedroom on a Friendly Astoria Block,20303629288,verified,Bridget,Queens,Ditmars Steinway,40.77021,-73.90947,United States,US,True,strict,Private room,2017,$183 ,$37 ,2,59.0,5/27/2019,1.77,5,2,232,please be quiet and respectful of the other renters,
50082028,Guest bedroom off of 30th ave,32815403009,verified,Melissa,Queens,Astoria,40.7656,-73.92293000000001,United States,US,True,flexible,Private room,2013,$551 ,$110 ,1,43.0,5/26/2019,1.28,5,2,331,,
