55455355,Cozy Ground Floor Garden Apt. Across from Park,33104472385,unconfirmed,Rosi,Brooklyn,Sunset Park,40.65064,-74.00595,United States,US,False,strict,Entire home/apt,2021,$548 ,$110 ,5,12,6/19/2019,1.2,3,1,106,,
55455907,Hello Brooklyn! Stylish home in the heart of BK,45106445140,verified,Genenne,Brooklyn,East Flatbush,40.6332,-73.94266999999999,United States,US,True,flexible,Entire home/apt,2003,$590 ,$118 ,2,8,12/17/2018,0.82,3,1,0,"House Rules 1. Check-in is 4 pm local time. If the unit is ready earlier, we’ll let you know. Check-out is normally 11 am local time, but we’d be happy to extend it as long as we don’t have a cleaning scheduled. Just let us know.  2. All bookings require a security deposit of at least $300, which will be refunded within 7 days of your check-out. 3. For security measures we require all guests to provide proof of identification through ID verification on our own website. In order to check in we'll need a photo of your ID.  4. Our cancellation policy is as shown on our ad and defined by the site you are booking through.  5. Don’t let $300 go up in smoke. There's no smoking allowed in any Flatbook and a $300 fine for breaking this rule.  6. Unfortunately we don’t allow pets in any of our apartments. 7. Unless you’re staying in one of our specialty apartments, we don’t allow parties or excessive noise. 8. If we find the place very messy, we have to charge an extra $40 for every extra hour o",
55456459,"Private room in Harlem, NY...",54137905663,unconfirmed,Willy,Manhattan,Harlem,40.82293,-73.94249,United States,US,False,moderate,Private room,2005,$452 ,$90 ,2,13,1/21/2019,1.29,4,4,238,We except you to clean up after yourself and generally be respectful. Smoking should happen outside the house.,
55457011,Spacious Studio Apt on Upper East side,23100822367,verified,Michelle,Manhattan,Upper East Side,40.78132,-73.95148,United States,US,False,flexible,Entire home/apt,2005,"$1,129 ",$226 ,1,4,6/30/2019,0.44,5,2,24,,
55457564,"Private bedroom in Harlem, NY ..",94661140031,unconfirmed,Willy,Manhattan,Harlem,40.8224,-73.94136,United States,US,False,moderate,Private room,2014,$412 ,$82 ,3,17,4/18/2019,1.71,2,4,230,"House Rules 1. Check-in is 4 pm local time. If the unit is ready earlier, we’ll let you know. Check-out is normally 11 am local time, but we’d be happy to extend it as long as we don’t have a cleaning scheduled. Just let us know.  2. All bookings require a security deposit of at least $300, which will be refunded within 7 days of your check-out. 3. For security measures we require all guests to provide proof of identification through ID verification on our own website. In order to check in we'll need a photo of your ID.  4. Our cancellation policy is as shown on our ad and defined by the site you are booking through.  5. Don’t let $300 go up in smoke. There's no smoking allowed in any Flatbook and a $300 fine for breaking this rule.  6. Unfortunately we don’t allow pets in any of our apartments. 7. Unless you’re staying in one of our specialty apartments, we don’t allow parties or excessive noise. 8. If we find the place very messy, we have to charge an extra $40 for every extra hour o",
55458116,Spacious room in vibrant area. 2 blocks from train,61596790908,unconfirmed,Chris,Brooklyn,Bushwick,40.6999,-73.93947,United States,US,True,moderate,Private room,2017,$227 ,$45 ,1,5,7/3/2019,0.52,2,2,88,Please be respectful to the other roommate and clean after yourselves. We love this place and we want guests to have the same experience you have when they arrive.,
55458668,"Private bedroom in historic Harlem, NY.",4029958497,unconfirmed,Willy,Manhattan,Harlem,40.8224,-73.94241,United States,US,True,moderate,Private room,2016,"$1,143 ",$229 ,2,14,5/15/2019,1.4,2,4,238,1) No Smoking in property!!!  2) Do not slam doors!!! Close lightly Please!!! 3) No Shoes in house (except slippers) 4) Quiet down AFTER 10PM.,
55459221,Private Room in Williamsburg Apartment,53239073518,verified,Oliver,Brooklyn,Williamsburg,40.71151,-73.94396,United States,US,True,flexible,Private room,2012,$628 ,$126 ,3,1,12/4/2018,0.14,4,1,0,,
55459773,Cozy room close to the city center 61F1,42951866419,verified,John,Manhattan,Hell's Kitchen,40.75545,-73.99651999999999,United States,US,True,moderate,Private room,2012,$632 ,$126 ,30,2,3/27/2019,0.21,4,47,351,- No excess noise after 11pm. - No recreational drugs. - No open flames.,
55460325,Luxury suite in the Heart of Hell's Kitchen,37406512816,verified,Alex,Manhattan,Hell's Kitchen,40.766459999999995,-73.99132,United States,US,False,strict,Entire home/apt,2022,$553 ,$111 ,4,26,7/3/2019,2.6,2,1,49,,
55460878,"Cozy room near subway , LGA airport n manhattan",54164665205,unconfirmed,Robertina,Queens,Jackson Heights,40.75164,-73.88506,United States,US,False,flexible,Private room,2003,$239 ,$48 ,2,29,6/20/2019,2.96,5,4,149,"Orderly house and we want to keep it this way Bathrooms don't have high traffic as we agree to take shower before bed and not in the morning Everyone picks up after themselves No disturbance of any kind greatly appreciated:) but ASK ME (not other guests) questions any time you need/want to know something or unsure about how to do things, etc. Emails is the best way to communicate. When talking on the phone, please do it in your room with door closed Please walk calm, don't run the stairs, as it reduce the noise Close all doors gently please Non-smoker only Guests will be liable for any damages they caused: inspect the room upon arrival and sign the report Only food items can be placed into the kitchen sink compost disposal No smoking anywhere in/out of the house No perfume/cologne, scented laundry detergent allowed Doing laundry in a sink/bath not allowed Guests/visitors are not permitted Rescued/injured animals can be brought in for further assistance",
55461430,"1 Br in Brooklyn, near Williamsburg/Manhattan",68251410020,verified,Rebeca,Brooklyn,Greenpoint,40.73482,-73.95399,United States,US,True,moderate,Private room,2018,$674 ,$135 ,1,4,12/31/2018,0.45,5,1,97,,
55461982,Brand New 3-Bedroom in Trendy L.E.S. #10296,28378431516,unconfirmed,Carol,Manhattan,Lower East Side,40.71935,-73.98361,United States,US,True,flexible,Entire home/apt,2014,$605 ,$121 ,2,33,7/5/2019,3.46,5,1,280,No guests/visitors Storage not provided Limited number of things allowed:one-two suitcases The house is quiet and we want to keep it this way.  Please pick up after yourself and please keep toilet bowl and shower clean Toilet must be closed when not in use It is requested to take shower and do shaving before bed and keep morning bathroom time to the minimum: others are waiting  Additional toilet/sink is on the first floor.  No disturbance: please walk slowly on the stairs Keep phone conversation inside your room without using computer speakers,
55462534,Queens Finest Luxury Place,42935448516,verified,Roland,Queens,Jamaica,40.69742,-73.78541,United States,US,False,moderate,Private room,2008,$274 ,$55 ,1,22,5/21/2019,2.16,5,3,363,"Please expect to share the apartment with guests having various backgrounds. Be respectful and decent, also enjoy interacting with each other. Please dress descent in the house especially in and out of the shower.",
55463087,Quiet Washington Heights Studio Apartment,45988448458,verified,John,Manhattan,Washington Heights,40.85035,-73.9325,United States,US,True,flexible,Entire home/apt,2008,$497 ,$99 ,2,28,6/30/2019,2.98,5,1,41,No pets. No smoking.,
55463639,An Art Director's Fort Green Studio,84931790349,verified,Madelyn,Brooklyn,Fort Greene,40.68616,-73.97206,United States,US,True,flexible,Entire home/apt,2016,$388 ,$78 ,2,4,7/1/2019,0.44,2,1,95,"There will be a small lockbox at the building entrance (on your left side if you are facing the door). The code for this lockbox will be send to you after you have confirmed your reservation. Inside the lockbox you will find 2 keys, one that works for both of the building doors ,and another for the apartment's door).  NO smoking. *We are not responsible for any accidents, injuries, or illness that occurs while on the premises; or for the loss of guests' personal belongings or valuables. By accepting this reservation, it is agreed that all guests are expressly assuming the risk of any harm to themselves arising from their use of the premises or to others whom they invite to use the premises.",
55464191,!AMAZING PRIVATE ROOM 2 MIN FROM TRAIN STATION!,13514184653,verified,MateusDaniela,Brooklyn,Bushwick,40.682359999999996,-73.90765,United States,US,False,strict,Private room,2015,$200 ,$40 ,1,30,7/5/2019,3.63,2,2,327,,
55464744,Williamsburg Cozy Room 10 minutes from Manhattan.,90163901321,unconfirmed,Isaura,Brooklyn,Williamsburg,40.70874,-73.95237,United States,US,True,strict,Private room,2007,$146 ,$29 ,5,24,6/17/2019,2.48,3,1,7,,
55465296,!PERFECT PRIVATE ROOM PLACE 2MIN FROM THE SUBWAY!,20017607179,unconfirmed,MateusDaniela,Brooklyn,Bushwick,40.68235,-73.90602,United States,US,False,strict,Private room,2004,$676 ,$135 ,2,30,7/7/2019,3.63,2,2,303,,
55465848,*ON SALE* West Village 2BR base to discover NYC,9704692491,verified,Catarina,Manhattan,West Village,40.73142,-74.00275,United States,US,False,strict,Entire home/apt,2005,$707 ,$141 ,2,2,6/23/2019,0.31,3,3,14,,
55466401,740 sqf large luxury apt w doorman midtown east,90602715269,unconfirmed,Sacha,Manhattan,Midtown,40.75278,-73.97107,United States,US,True,flexible,Entire home/apt,2007,$56 ,$11 ,30,5,5/13/2019,0.7,2,1,280,,
55466953,Modern private studio in rockaway,77763268507,verified,Ayodele,Queens,Far Rockaway,40.59752,-73.76337,United States,US,True,strict,Private room,2005,$461 ,$92 ,1,18,6/29/2019,1.79,2,1,71,"Nothing unusual, I expect that you clean after yourself (bathroom, kitchen...).  The building is calm, so no loud music or parties is allowed. Check-in time on week days will be limited to non-business hours (after 6pm).  Check-out time is whenever you want, unless I've other guest that are arriving.",
55467505,2BR Williamsburg home w/ PATIO! Baby Gear! L train,4553721949,unconfirmed,Elmie,Brooklyn,Williamsburg,40.71392,-73.94034,United States,US,False,strict,Private room,2012,$457 ,$91 ,3,3,6/17/2019,0.31,2,1,0,1) No Smoking in property!!!  2) Do not slam doors!!! Close lightly Please!!! 3) No Shoes in house (except slippers) 4) Quiet down AFTER 10PM.,
55468057,Brooklyn Bedstuy Trendy Apt,12184015824,verified,Nayira,Brooklyn,Bedford-Stuyvesant,40.68786,-73.93252,United States,US,False,strict,Entire home/apt,2004,$134 ,$27 ,1,20,6/23/2019,2.22,3,1,19,"House Rules 1. All bookings made at least a week before check in are fully refundable if cancelled within 24 hours of booking. After this, you will receive a 50% refund if you cancel at least 7 days before the start of your trip. 2. Check-in time is any time after 4 pm local time. If the unit is ready earlier, we’ll let you know. Check-out is normally 11 am local time, but we’d be happy to extend it as long as we don’t have a cleaning scheduled. Just let us know.  3. All bookings require a security deposit of at least $300. 4. For security measures we require all guests to provide proof of identification through ID verification on our own website. In order to check in, we'll need a photo of your ID.  5. Don’t let $300 go up in smoke. There's no smoking allowed in any Flatbook and a $300 fine for breaking this rule.  6. Unfortunately we don’t allow pets in most of our apartments. 7. Unless you’re staying in one of our specialty apartments, we don’t allow parties or excessive noise. 8. I",
55468610,"Attractive FiDi 1BR w/ Office nook + Gym, Doorman by Blueground",8331079407,unconfirmed,Blueground,Manhattan,Battery Park City,40.70438,-74.01708,United States,US,True,flexible,Entire home/apt,2016,$834 ,$167 ,30,1,10/23/2018,0.12,2,232,327,"The (URL HIDDEN) use of tobacco/smoking/substances of abuse (including alcohol) on the property...quiet during night (you can go in and out as you like, just of course be quiet when we might be sleeping, as we try to be if coming home late when you might be in bed)...tell us a bit about yourself if you like and pls ask us about anything we might be able to tell you about locally/perhaps assist with...contact us when you're here with any questions!  We particularly dislike jokes having to do with avocados.  :   )  Do sign our map of where you're from. Some more room/house use points: ->  If you need it before we actually meet and show you, the bathroom is upstairs; feel free to get water for your use from bathroom faucet (it's fine to drink here, and in most of the US.  Bottled water is rarely different than usual US tap water, with the bottling craze a big drain on resources, to be actively eschewed for the sake of our Mother Earth...). ->  If you need to borrow a towel, there should b",
55469162,Sunny Central Park Apt (2 blocks from park),13274337407,unconfirmed,Nicole,Manhattan,Harlem,40.799929999999996,-73.95485,United States,US,False,strict,Private room,2008,"$1,114 ",$223 ,14,4,5/27/2019,0.4,3,1,66,"• No smoking, pets, or unannounced guests. • Respect the check-out time of 11:00 AM. If you have special requests, discuss with us ahead of time! • Clean the kitchen/wash dishes after use. • Keep a reasonable volume after 11:00 PM & before 8 AM",
55469714,East village sanctuary,34250718053,verified,Matthew,Manhattan,East Village,40.727779999999996,-73.98747,United States,US,False,moderate,Entire home/apt,2008,$99 ,$20 ,31,1,10/7/2018,0.11,2,1,156,"Please try to be mindful/aware of your actions and their effect on others No disturbance is greatly appreciated:) When talking on the phone, please do so only in your room with door closed:) unless it's an emergency Please walk, don't run the stairs (the slower you walk the less noise there is) Close all doors gently please No smoking anywhere in or out of the house If you tell me you stayed with friends who smoked as a reason for the smell, it will not matter No perfume/cologne, scented laundry detergent allowed (suitable product provided, just ask if needed) Guests/visitors not permitted",
55470267,Private bedroom with bathroom in clean quiet space,58404711483,unconfirmed,Ms. Debra,Queens,Jamaica,40.67783,-73.76637,United States,US,True,flexible,Private room,2003,$535 ,$107 ,2,2,4/15/2019,0.26,2,3,26,1) No Smoking in property!!!  2) Do not slam doors!!! Close lightly Please!!! 3) No Shoes in house (except slippers) 4) Quiet down AFTER 10PM.,
55470819,"Lovely, sunny & quiet 1br Chelsea apt w/balcony",7184567354,verified,Jonathan,Manhattan,Chelsea,40.74299,-73.99776999999999,United States,US,False,strict,Entire home/apt,2005,$903 ,$181 ,2,11,6/6/2019,1.2,5,1,0,,
55471371,"Private, sun-filled, plant-filled bedroom",29303388398,unconfirmed,Alison,Brooklyn,Crown Heights,40.67597,-73.94856999999999,United States,US,False,moderate,Private room,2008,"$1,086 ",$217 ,4,3,1/1/2019,0.3,3,1,0,,
55471924,Astoria Apartment,73691713031,unconfirmed,Meghann,Queens,Astoria,40.766420000000004,-73.91637,United States,US,True,strict,Entire home/apt,2016,$682 ,$136 ,3,4,11/25/2018,0.42,2,1,0,"You will meet a clean apartment, please leave it clean  No Smoking please. Sorry, but NO PETS",
55472476,Boerum Hill Queen BR in a Classic NYC Brownstone,43765704759,verified,Allen,Brooklyn,Boerum Hill,40.68701,-73.98495,United States,US,False,flexible,Private room,2022,$257 ,$51 ,1,38,7/3/2019,3.83,4,3,47,,
55473028,Chic Studio in a Great Neighborhood,89723086812,verified,Michelle,Manhattan,Chelsea,40.73917,-73.99412,United States,US,True,strict,Entire home/apt,2003,$191 ,$38 ,4,7,5/14/2019,0.77,3,1,0,,
55473580,Mott Haven Dorm-Bed B,75079241702,verified,Rem,Bronx,Port Morris,40.80952,-73.93005,United States,US,True,strict,Shared room,2014,$284 ,$57 ,1,17,6/3/2019,1.79,4,7,83,"House Rules 1. Check-in is 4 pm local time. If the unit is ready earlier, we’ll let you know. Check-out is normally 11 am local time, but we’d be happy to extend it as long as we don’t have a cleaning scheduled. Just let us know.  2. All bookings require a security deposit of at least $300, which will be refunded within 7 days of your check-out. 3. For security measures we require all guests to provide proof of identification through ID verification on our own website. In order to check in we'll need a photo of your ID.  4. Our cancellation policy is as shown on our ad and defined by the site you are booking through.  5. Don’t let $300 go up in smoke. There's no smoking allowed in any Flatbook and a $300 fine for breaking this rule.  6. Unfortunately we don’t allow pets in any of our apartments. 7. Unless you’re staying in one of our specialty apartments, we don’t allow parties or excessive noise. 8. If we find the place very messy, we have to charge an extra $40 for every extra hour o",
55474133,West Village 5 BR Townhouse & Private Yard,21969589762,verified,Andrea,Manhattan,West Village,40.73151,-74.00528,United States,US,True,flexible,Entire home/apt,2022,$96 ,$19 ,4,17,6/27/2019,1.86,4,1,32,"House Rules 1. All bookings made at least a week before check in are fully refundable if cancelled within 24 hours of booking. After this, you will receive a 50% refund if you cancel at least 7 days before the start of your trip. 2. Check-in time is any time after 4 pm local time. If the unit is ready earlier, we’ll let you know. Check-out is normally 11 am local time, but we’d be happy to extend it as long as we don’t have a cleaning scheduled. Just let us know.  3. All bookings require a security deposit of at least $300. 4. For security measures we require all guests to provide proof of identification through ID verification on our own website. In order to check in, we'll need a photo of your ID.  5. Don’t let $300 go up in smoke. There's no smoking allowed in any Flatbook and a $300 fine for breaking this rule.  6. Unfortunately we don’t allow pets in most of our apartments. 7. Unless you’re staying in one of our specialty apartments, we don’t allow parties or excessive noise. 8. I",
55474685,Look down on Bedford Ave! Private room.,77685439007,unconfirmed,Drew,Brooklyn,Williamsburg,40.715509999999995,-73.96056999999999,United States,US,False,flexible,Private room,2015,$896 ,$179 ,1,9,1/16/2019,0.91,3,1,0,Please don't use the washer and dryer after 10pm or before 8am!,
55475237,Mott Haven Dorm-Bed D,35638450444,unconfirmed,Rem,Bronx,Port Morris,40.809940000000005,-73.93061,United States,US,False,strict,Shared room,2011,$647 ,$129 ,1,29,5/27/2019,3.09,3,7,89,,
55475790,Huge Western Room on the Top Floor of a Townhouse,7599703711,unconfirmed,Jon,Brooklyn,Bedford-Stuyvesant,40.6866,-73.9532,United States,US,True,moderate,Private room,2010,$215 ,$43 ,3,7,1/18/2019,0.72,3,1,0,Please be respectful of other guests No Pets and No Smoking No loud music or noise after 10 PM,
55476342,Mott Haven Dorm-Bed E,50721319191,verified,Rem,Bronx,Port Morris,40.80977,-73.93038,United States,US,True,moderate,Shared room,2017,$357 ,$71 ,1,16,6/22/2019,1.7,4,7,0,- Additional charge for extra guests - No Smoking! - No pets,
55476894,"Cute, book-filled, apartment in Williamsburg",67946775771,unconfirmed,Samridhi,Brooklyn,Williamsburg,40.710190000000004,-73.95684,United States,US,True,flexible,Entire home/apt,2013,$350 ,$70 ,5,2,1/4/2019,0.21,4,1,0,,
55477447,Queens house bedroom 2,62129362395,verified,Desmond,Queens,Springfield Gardens,40.66509,-73.75863000000001,United States,US,True,moderate,Private room,2021,$63 ,$13 ,1,0,,,3,4,179,"- Non-smoker - No cologne/perfumed spray use - Please take shower before bed to avoid morning rush - Take off street shoes and place on rack, - Please bring slippers or ask me for a pair - Recycling and reusable shopping bag use (provided) - Limit things to bring in: 1-2 suitcases OK - Mailing address not to be shared with anyone; you will be charged $200 if you do",
55477999,Queens house bedroom 3,17175636462,verified,Desmond,Queens,Laurelton,40.68013,-73.74734000000001,United States,US,True,flexible,Private room,2004,$295 ,$59 ,1,3,7/7/2019,0.33,3,4,180,,
55478551,Queens house bedroom 4,59897943593,unconfirmed,Desmond,Queens,Springfield Gardens,40.66556,-73.75735,United States,US,True,strict,Private room,2016,$781 ,$156 ,1,2,12/15/2018,0.22,3,4,179,We like quirt. So please dont hold party at night.,
55479103,Large Room with PRIVATE bathroom! Best NYC rooftop,95932072166,unconfirmed,Michael Dan,Manhattan,Financial District,40.705999999999996,-74.0077,United States,US,True,moderate,Private room,2014,$84 ,$17 ,4,6,4/20/2019,0.61,2,1,0,,
55479656,Sun and Serenity in SoHo with Private Bath,42253485615,unconfirmed,Samantha,Manhattan,SoHo,40.727740000000004,-74.00326,United States,US,True,flexible,Private room,2022,$209 ,$42 ,2,17,3/6/2019,1.73,4,1,0,"Please, No shoes allowed. There's a mat for them, just inside the door.",
55480208,Bushwick Rustic Loft,97986948670,unconfirmed,Al,Brooklyn,Bushwick,40.699870000000004,-73.91821,United States,US,True,strict,Private room,2008,$282 ,$56 ,1,28,7/7/2019,2.75,3,1,36,"House Rules 1. Check-in is 4 pm local time. If the unit is ready earlier, we’ll let you know. Check-out is normally 11 am local time, but we’d be happy to extend it as long as we don’t have a cleaning scheduled. Just let us know.  2. All bookings require a security deposit of at least $300, which will be refunded within 7 days of your check-out. 3. For security measures we require all guests to provide proof of identification through ID verification on our own website. In order to check in we'll need a photo of your ID.  4. Our cancellation policy is as shown on our ad and defined by the site you are booking through.  5. Don’t let $300 go up in smoke. There's no smoking allowed in any Flatbook and a $300 fine for breaking this rule.  6. Unfortunately we don’t allow pets in any of our apartments. 7. Unless you’re staying in one of our specialty apartments, we don’t allow parties or excessive noise. 8. If we find the place very messy, we have to charge an extra $40 for every extra hour o",
55480760,"Private Brand New 2 BR, Minutes from JFK & LGA",48119655354,verified,Mohd Tahmid,Queens,Jamaica,40.67695,-73.79045,United States,US,False,flexible,Entire home/apt,2011,$561 ,$112 ,1,96,7/4/2019,9.63,5,1,31,"House Rules 1. Check-in is 4 pm local time. If the unit is ready earlier, we’ll let you know. Check-out is normally 11 am local time, but we’d be happy to extend it as long as we don’t have a cleaning scheduled. Just let us know.  2. All bookings require a security deposit of at least $300, which will be refunded within 7 days of your check-out. 3. For security measures we require all guests to provide proof of identification through ID verification on our own website. In order to check in we'll need a photo of your ID.  4. Our cancellation policy is as shown on our ad and defined by the site you are booking through.  5. Don’t let $300 go up in smoke. There's no smoking allowed in any Flatbook and a $300 fine for breaking this rule.  6. Unfortunately we don’t allow pets in any of our apartments. 7. Unless you’re staying in one of our specialty apartments, we don’t allow parties or excessive noise. 8. If we find the place very messy, we have to charge an extra $40 for every extra hour o",
55481313,Ridgewood retreat,69071157217,unconfirmed,Sophie,Queens,Ridgewood,40.70602,-73.90485,United States,US,False,flexible,Entire home/apt,2009,$89 ,$18 ,5,2,9/30/2018,0.21,3,1,0,ALCOHOL IS STRICTLY NOT ALLOWED INSIDE THE HOUSE !,
55481865,"Sunny apartment in BK- Close to J,M,Z",10479860606,unconfirmed,Rebecca,Brooklyn,Williamsburg,40.70685,-73.94796,United States,US,False,strict,Entire home/apt,2015,$597 ,$119 ,10,1,10/5/2018,0.11,3,2,0,No smoking inside the house and make sure to think about the house as your own,
55482417,One Bedroom in Midtown East,64350390564,verified,Shirley,Manhattan,Midtown,40.76054,-73.96425,United States,US,True,strict,Private room,2014,"$1,172 ",$234 ,5,0,,,5,1,72,,
55482970,Serenity palace,38579712952,unconfirmed,Edlyne,Queens,St. Albans,40.69153,-73.77667,United States,US,True,moderate,Entire home/apt,2006,$800 ,$160 ,2,23,7/2/2019,2.34,4,1,175,,
55483522,20 steps to subway!!,67456369353,verified,Vik,Queens,Long Island City,40.75655,-73.93001,United States,US,True,moderate,Entire home/apt,2014,"$1,144 ",$229 ,2,9,6/22/2019,0.93,2,5,163,"Non smoker only Guest may not bring car to the area Perfumes, sprays, candles, not allowed Cat in the house Mailing address may not be given to anyone without written permission If we get correspondence on your name, you will be charged $200  Separate recycle from trash (I can help, just ask) Black bag for recycling is in your room, put all in one bag Guests are not allowed The house is quiet as others are studying Please pick up after yourself as a courtesy to others Please don't leave your clothes or towel in the bathroom Any shampoo without name can be used (they are inside the shower) Please take shower at night or afternoon to avoid morning traffic. Use reusable bag (provided)  Please don't take disposable plastic bags from stores Food left over must be placed inside kitchen sink for automatic disposal",
55484074,23 steps to subway!,93567075097,verified,Vik,Queens,Long Island City,40.7563,-73.92971,United States,US,False,flexible,Entire home/apt,2012,$325 ,$65 ,2,8,6/1/2019,1.1,4,5,144,Please do not smoke. Be respectful of other guests.,
55484626,"“Brownstone in Brooklyn”
Close to Manhattan!",66026231882,unconfirmed,Mollie,Brooklyn,Bedford-Stuyvesant,40.68757,-73.92923,United States,US,False,strict,Entire home/apt,2013,$94 ,$19 ,3,14,12/26/2018,1.45,2,1,0,,
