3888208,BKLYN BROWNSTONE: The Stuyvesant,79496668951,unconfirmed,Anthony/Joanne,Brooklyn,Bedford-Stuyvesant,40.6825,-73.92519,United States,US,False,flexible,Entire home/apt,2011,"$1,155 ",$231 ,3,135,5/28/2019,2.27,5.0,2,345,"Limitation of Liability Waiver: Owner makes no warranties to guest of any kind, whether express or implied, including any implied warranty of merchantability, fitness for a particular purpose or non-infringement. Owner does not warrant, and neither shall be liable, to guest or any third party for any unavailability or inoperability of the booking vendor's services, telecommunications systems or the internet, technical malfunction, computer error, corruption or loss of information, or other injury, damage or disruption of any kind to person or property arising from events beyond the reasonable control of owner. In no event shall owner be liable to guest for any indirect, incidental, consequential, special or exemplary damages, including, but not limited to, loss of profits, loss of savings or loss of business opportunity, even if such damages are foreseeable and whether or not such party has been advised of the possibility thereof. Owner's maximum aggregate liability hereunder shall not",
3888760,Studio apartment,82944997077,verified,Laurent,Manhattan,Harlem,40.80919,-73.94815,United States,US,True,strict,Entire home/apt,2014,$874 ,$175 ,3,80,6/29/2019,1.37,2.0,1,390,"Please respect my home. There are other long term tenants who reside in the building. THERE WILL BE NO PARTIES ALLOWED AT THIS PROPERTY. If guests host a party, they will be asked to leave immediately upon the first report of a disturbance and the security deposit forfeited.",
3889313,Perfect Brooklyn Studio Apartment,81455725274,unconfirmed,Madeline,Brooklyn,Bushwick,40.707159999999995,-73.92171,United States,US,True,strict,Entire home/apt,2003,$884 ,$177 ,1,40,1/16/2016,0.68,2.0,1,128,,
3889865,Akua's Bed-Stuy Study,48132951392,unconfirmed,Carlton,Brooklyn,Bedford-Stuyvesant,40.68358,-73.94838,United States,US,False,flexible,Private room,2007,$533 ,$107 ,2,82,6/21/2019,1.6,2.0,1,417,"Limitation of Liability Waiver: Owner makes no warranties to guest of any kind, whether express or implied, including any implied warranty of merchantability, fitness for a particular purpose or non-infringement. Owner does not warrant, and neither shall be liable, to guest or any third party for any unavailability or inoperability of the booking vendor's services, telecommunications systems or the internet, technical malfunction, computer error, corruption or loss of information, or other injury, damage or disruption of any kind to person or property arising from events beyond the reasonable control of owner. In no event shall owner be liable to guest for any indirect, incidental, consequential, special or exemplary damages, including, but not limited to, loss of profits, loss of savings or loss of business opportunity, even if such damages are foreseeable and whether or not such party has been advised of the possibility thereof. Owner's maximum aggregate liability hereunder shall not",
3890417,Charming Harlem apartment,8547353336,verified,Gina,Manhattan,Harlem,40.81022,-73.94266,United States,US,True,moderate,Shared room,2017,$303 ,$61 ,1,16,5/26/2019,0.27,,1,242,Keep clean; quiet; no parties or excessive drinking,
3890970,HUGE space at the heart of Meatpacking - Chelsea .,71649173041,unconfirmed,Eilon,Manhattan,Chelsea,40.73986,-74.00035,United States,US,False,moderate,Entire home/apt,2011,$566 ,$113 ,2,1,9/1/2014,0.02,,1,374,ABSOLUTELY NO SMOKING PLEASE. OWNER IS ALLERGIC AND SMOKE ALARM IS VERY SENSITIVE.   FIRE DEPARTMENT WILL BE NOTIFIED IF ALARM IS TRIGGERED.  (this also includes cooking at high heat),
3891522,cute convenient village suite,45916947898,verified,Ali,Manhattan,Greenwich Village,40.7311,-74.00014,United States,US,True,moderate,Private room,2016,$608 ,$122 ,1,20,5/2/2019,0.4,,1,382,"During your stay please abide by the following guidelines: -No smoking anywhere in the unit -No pets -No parties/extra guests than those originally notified -Food in refrigerator is open, however, anything in the freezer I ask you do not touch *Please keep in mind this is my home, I live here when it is not open to guests therefore many personal belongings will be throughout the home. Be respectful of those things.",
3892074,Cute apartment with Backyard,67374865219,unconfirmed,Andrew,Brooklyn,Williamsburg,40.70967,-73.94945,United States,US,False,flexible,Entire home/apt,2013,$508 ,$102 ,5,85,6/23/2019,1.45,,1,123,Please note I require a two night minimum Please note the houseboat is limited to 6 occupants including children at any time. No Smoking All occupants must be 25 or accompanied by a parent/ guardian Children under 12 must war a life vest on the docks.  We do not supply child size life vests.   All guests must be considerate of other boat occupants and obey the quiet times of the marina.,
3892627,Luxury Studio on (Email hidden by Airbnb),75650855696,unconfirmed,Ofer,Manhattan,Upper West Side,40.79253,-73.97378,United States,US,False,flexible,Entire home/apt,2016,"$1,113 ",$223 ,30,16,12/23/2018,0.28,,8,176,"Only keep all like you see it, Clean Kitchen and Bathroom. No parties or Events",
3893179,Entire Luxury Newly Renovated Studio,22271275653,unconfirmed,Ofer,Manhattan,Upper West Side,40.79203,-73.97299,United States,US,True,moderate,Entire home/apt,2007,$455 ,$91 ,30,14,6/19/2019,0.24,,8,349,"We just ask that you are clean. If you are here for multiple nights we always have fresh towels and extra toiletries, just ask.",
3893731,Quiet private room in luxury bldg facing park,65086441821,verified,Kaori,Manhattan,Harlem,40.82217,-73.94149,United States,US,True,flexible,Private room,2009,$777 ,$155 ,3,0,,,3.0,2,408,"At La Casita we expect our guests to be respectful of our space and the other people staying here. If you need anything or have any concerns, please communicate them with myself or my roommate Monica.  We love to host people from all over the world and look forward to sharing our space with you.",
3894283,Quiet Oasis in the Middle of it All,91481647236,verified,Benjamin,Brooklyn,Fort Greene,40.689609999999995,-73.97780999999999,United States,US,False,strict,Entire home/apt,2015,$73 ,$15 ,30,5,3/30/2019,0.1,3.0,21,205,Please try to be quite and keep house clean. Thank you very much!,
3894836,Lower East Side Luxury,16673586194,unconfirmed,Brooke,Manhattan,Lower East Side,40.720459999999996,-73.99237,United States,US,True,strict,Entire home/apt,2005,$273 ,$55 ,3,0,,,2.0,1,179,"Our Herbivorian House manual with detailed rules and helpful information is present in each apartment.  The apartment must be left as clean as it was found, (especially the kitchen and bathroom) cleaning supplies are present in the apartment. (we are responsible for washing sheets and towels)  If you would rather not clean up after yourself please include an extra $100.00 for the cleaning Help. No loud or late night noises or parties. No additional guests No smoking. No red meat or strong smelling meats shall be cooked (the smell disturbs our primarily vegetarian guests) Pleasant behavior to all other building residents. Any questions assistance needed?.. please contact us, we are happy to help.",
3895388,Lovely Walk Up in the Heights,9456823336,unconfirmed,Jennifer,Manhattan,Washington Heights,40.85672,-73.9302,United States,US,True,flexible,Shared room,2004,$198 ,$40 ,2,0,,,3.0,1,331,,
3895940,1 Bed Apt in Greenpoint Brooklyn,71928034164,verified,Tim,Brooklyn,Greenpoint,40.72793,-73.95011,United States,US,False,flexible,Entire home/apt,2004,$417 ,$83 ,1,2,6/18/2015,0.03,4.0,1,196,- Guests are expected to keep the house clean and maintain noise level relatively low after 10PM,
3896493,Metro-luxe Tuscan Suite Private Room,17733653624,unconfirmed,Anne,Bronx,Mott Haven,40.8105,-73.92506999999999,United States,US,False,flexible,Private room,2010,$803 ,$161 ,1,276,6/17/2019,4.63,4.0,2,176,"No unexpected house guests please, and no smoking in the house!",
3897045,Tidy Sweet Room in Sugar Hill/Hamilton Heights,86341966506,verified,Tamara,Manhattan,Harlem,40.826209999999996,-73.94596,United States,US,True,flexible,Private room,2006,$889 ,$178 ,3,154,6/22/2019,2.72,2.0,2,253,Pets may be allowed for short stays - please check with the hosts. Small/medium sized well-behaved dogs and cats are likely fine. Please clean/put away anything you use from the kitchen. **Check-in time is 2pm and check out time is by 11am. However we can likely make arrangements to leave your bags if you are arriving earlier or not leaving Boston until later in the day.,
3897597,west village 1BR!best value!,33698483580,unconfirmed,Host,Manhattan,West Village,40.73254,-74.00698,United States,US,False,moderate,Entire home/apt,2011,"$1,037 ",$207 ,30,12,8/12/2018,0.22,4.0,39,355,#NAME?,
3898150,1BR Clinton Hill Apt Beautiful Garden - Video,58283240835,verified,Vernon,Brooklyn,Clinton Hill,40.69352,-73.96556,United States,US,False,moderate,Entire home/apt,2012,"$1,019 ",$204 ,7,15,5/25/2019,0.27,5.0,1,383,"No unexpected night guests, please No smoke inside the house No drugs . No loud music after 10pm extra quiet  Keep your room and common area clean,No food and drink on the room Clean behind yourself in the bathroom, kitchen and rooms    All visitors of houseguest must leave by a decent hour  No violence No pets Check out please leave key on the kitchen table and close doors by manual lock",
3898702,Cosy Inwood apartment,21607175780,unconfirmed,Emilie,Manhattan,Inwood,40.85988,-73.92709,United States,US,True,moderate,Private room,2022,$413 ,$83 ,1,13,6/30/2019,1.18,4.0,2,10,"Guests are expected to keep the apartmemt clean and in good condition. Noise level should be kept at a reasonable level past 9:30 pm, as this a quiet neighborhood. Smoking in not allowed in the apartment but guests can smoke on the poarch. Small dogs and cats are allowed, but bigger pets will require prior approval.",
3899254,private bedroom in NYC apartment,97530987721,verified,Pamela,Queens,Ridgewood,40.7012,-73.90008,United States,US,False,moderate,Private room,2021,$354 ,$71 ,2,77,6/22/2019,1.53,4.0,1,228,"No pets and absolutely no smoking.  We expect guests to leave the place as they saw it when they first arrived and be clean, respectful, and responsible.",
3899806,location Vera,21941358205,unconfirmed,Petya,Queens,Woodside,40.75338,-73.90618,United States,US,True,moderate,Private room,2016,$90 ,$18 ,30,9,5/14/2019,0.16,5.0,18,35,"Guests are responsible to clean up after themselves in common areas including dishes (dishwasher), and countertops. No candles or open flames in the condominium.",
3900359,large 1 BR in heart of East Village,64022926805,verified,Marina,Manhattan,East Village,40.72695,-73.98617,United States,US,True,moderate,Entire home/apt,2005,$221 ,$44 ,3,78,5/12/2019,1.33,4.0,1,400,"Quiet hours are from midnight to 6 a.m.  We ask for guests to check in by 11 p.m. at the latest, however, we are flexible if there are transportation delays.",
3900911,Vintage Williamsburg 1BR near park!,27082982740,unconfirmed,Gage,Brooklyn,Williamsburg,40.71601,-73.95359,United States,US,True,moderate,Entire home/apt,2017,$913 ,$183 ,30,12,8/13/2018,0.2,4.0,1,0,,
3901463,Beautiful West Village 1 BR Apt--Best Location!,15330168696,verified,Leena,Manhattan,West Village,40.73223,-74.00355,United States,US,False,flexible,Entire home/apt,2010,"$1,015 ",$203 ,4,17,6/28/2019,0.29,5.0,1,369,"We will try to always treat you with loving kindness and respect, and we expect the same from our guests. We expect our guest to abstain from smoking and drinking  in the room (or house in general).",
3902016,Room in spacious Boerum Hill duplex,83138257943,unconfirmed,Emma,Brooklyn,Boerum Hill,40.68558,-73.9815,United States,US,True,strict,Private room,2011,$742 ,$148 ,3,1,8/19/2014,0.02,3.0,1,368,#NAME?,
3902568,Spacious Duplex Garden Apt Park Slope Brooklyn,30466623046,verified,Tracey,Brooklyn,Park Slope,40.68098,-73.97925,United States,US,True,strict,Entire home/apt,2021,$135 ,$27 ,3,4,9/17/2016,0.07,1.0,1,26,,
3903120,Williamsburg Penthouse Guestroom,1436511328,verified,Martin,Brooklyn,Williamsburg,40.712309999999995,-73.95313,United States,US,True,moderate,Private room,2015,$378 ,$76 ,1,372,6/21/2019,6.23,4.0,2,197,"(website hidden) intentional damage is done to the boat or its contents.  (website hidden) charges are incurred due to contraband, pets or collection of rents or services rendered during the stay. 3.All debris, rubbish and discards are placed in the properly bagged, and soiled dishes are placed cleaned. 4.All keys are left on the kitchen table and unit is left locked. (website hidden) linens are lost or damaged. (website hidden) Early check-in or late check-out, unless approved in advance. 5.PAYMENT - An advance payment equal to 50% of the total is required when the reservation is confirmed. The balance is due one month before your arrival date. Please make payments in the form of credit card (Mastercard or Visa). We do not accept payments in the form of traveler's checks, bank money orders, cashiers checks or personal checks. 6.CANCELLATIONS - A sixty (60) day advance notice is required for cancellation. Cancellations that are made more than sixty (60) days prior to the arrival date w",
3903673,★Unique two bedroom on 2nd Avenue★,237945273,unconfirmed,Zev,Manhattan,East Village,40.723279999999995,-73.98926,United States,US,True,strict,Entire home/apt,2015,"$1,127 ",$225 ,1,299,6/23/2019,5.04,2.0,2,86,No smoking and no pets allowed.,
3904225,South Williamsburg large parlor apt.,36461992774,unconfirmed,Scottie,Brooklyn,Williamsburg,40.71283,-73.96714,United States,US,False,strict,Entire home/apt,2021,$144 ,$29 ,25,4,4/8/2016,0.07,4.0,1,301,"The only thing we ask is that you respect our home and don't cause any damage to our personal belongings. If something breaks, please let us know is all we ask -- we don't like surprises! And, of course, be nice to our dog - that goes without saying :)",
3904777,PrivatePeaceful Pad near JFKairport,31478945789,verified,Marie Yves,Brooklyn,Canarsie,40.64287,-73.90228,United States,US,True,flexible,Entire home/apt,2010,$466 ,$93 ,3,96,6/24/2019,1.66,2.0,1,338,,
3905329,Williamsburg Studio,27020978546,unconfirmed,Jonathan,Brooklyn,Williamsburg,40.71694,-73.96016999999999,United States,US,False,strict,Entire home/apt,2013,$564 ,$113 ,21,1,4/30/2015,0.02,3.0,1,239,I am very laid back but I do expect you to respect my things and my space. No smoking inside the house!!!!,
3905882,Art Boutique Stateroom at JFK Airport,86090784918,unconfirmed,Jay,Queens,St. Albans,40.7012,-73.75041,United States,US,True,moderate,Entire home/apt,2006,"$1,075 ",$215 ,3,11,11/20/2018,0.45,5.0,2,235,No loud noises No parties,
3906434,Private Studio Near Union Square,97890345434,unconfirmed,Annie,Manhattan,Chelsea,40.739959999999996,-73.99919,United States,US,True,flexible,Entire home/apt,2014,$164 ,$33 ,2,31,12/9/2018,0.52,2.0,1,368,,
3906986,Cozy Private Bedroom,24318699298,unconfirmed,Chandra,Bronx,Mott Haven,40.80772,-73.91790999999999,United States,US,True,flexible,Private room,2004,$598 ,$120 ,1,321,6/12/2019,5.46,5.0,1,269,"1.CHECK-IN TIME IS AFTER 3 P.M. EST AND CHECK-OUT IS 11 A.M. EST. 2.This is a NON SMOKING boat. 3.We will not rent to vacationing students or singles under 25 years of age  unless accompanied by an adult guardian or parent. 4.DAMAGE WAIVER- A damage waiver of $39 is required. The waiver offers up to $1500 of insurance against accidental damage. You will not be held responsible for damage incurred provided the following provisions are met: (website hidden) intentional damage is done to the boat or its contents.  (website hidden) charges are incurred due to contraband, pets or collection of rents or services rendered during the stay. 3.All debris, rubbish and discards are placed in the properly bagged, and soiled dishes are placed cleaned. 4.All keys are left on the kitchen table and unit is left locked. (website hidden) linens are lost or damaged. (website hidden) Early check-in or late check-out, unless approved in advance. 5.PAYMENT - An advance payment equal to 50% of the total is re",
3907539,Best location in NYC,28749192141,unconfirmed,Jeevan,Manhattan,Hell's Kitchen,40.75882,-73.99168,United States,US,True,flexible,Private room,2022,$806 ,$161 ,1,147,5/19/2019,2.84,1.0,1,93,Be respectful. Please make sure the door is locked behind you when you leave. No shoes in the house. Slippers provided upon request. No drugs. No excessive alcohol use. No unauthorized guests.,
3908091,One bedroom in Inwood Apartment,27262349033,unconfirmed,Jen,Manhattan,Inwood,40.86711,-73.92742,United States,US,False,strict,Private room,2013,$352 ,$70 ,7,0,,,2.0,1,170,,
3908643,Statue of Liberty Views Downtown,16460919378,unconfirmed,Silvia,Manhattan,Battery Park City,40.710190000000004,-74.01705,United States,US,True,flexible,Entire home/apt,2011,$565 ,$113 ,60,4,5/7/2015,0.07,2.0,1,253,,
3909196,Amazing 1BR condo with water views,23085891888,unconfirmed,Brian,Manhattan,Battery Park City,40.71031,-74.01557,United States,US,True,flexible,Entire home/apt,2003,$263 ,$53 ,30,9,6/17/2015,0.16,5.0,1,50,"We suggest you use email or texting contact us if need, do not call us. We will not accept calling from AirBnB guests. We will back to you ASAP.",
3909748,"Charming, Airy 2 Bedroom Brownstone in Bed-Stuy",34864896296,verified,Cathy,Brooklyn,Bedford-Stuyvesant,40.68419,-73.92217,United States,US,False,moderate,Entire home/apt,2015,$289 ,$58 ,2,252,6/22/2019,4.37,3.0,1,246,,
3910300,Big Beautiful Bedroom w/Private Bathroom,40131089310,verified,Morgan,Brooklyn,Prospect Heights,40.67548,-73.96802,United States,US,True,strict,Private room,2017,$872 ,$174 ,2,206,6/18/2019,3.5,3.0,2,407,"Don't do anything you wouldn't want done at your place. Our home is your home when you stay here. Smoking is not allowed indoors, but we have a balcony you can smoke on.",
3910852,Large Private Rm in Historic Central Harlem Home,81078133814,verified,Atlantis & Carmen,Manhattan,Harlem,40.80384,-73.94691999999999,United States,US,True,moderate,Private room,2014,$816 ,$163 ,3,164,6/21/2019,2.85,3.0,1,421,,
3911405,Room 15. min from Midtown in Super Safe Area,55224114786,unconfirmed,Kay,Queens,Astoria,40.76315,-73.92709,United States,US,True,moderate,Private room,2014,$657 ,$131 ,14,1,8/16/2014,0.02,1.0,1,213,- Guests are expected to keep the house in good conditions and maintain noise level relatively low after 10PM,
3911957,Great Renovations. Columbus Circle,43025602952,verified,Mike,Manhattan,Hell's Kitchen,40.76867,-73.98541,United States,US,True,strict,Entire home/apt,2017,$577 ,$115 ,30,6,4/21/2019,0.11,2.0,52,309,,
3912509,Chandelier Room on Historic Brooklyn Block,61568491784,verified,Isa,Brooklyn,Prospect-Lefferts Gardens,40.66082,-73.95419,United States,US,True,strict,Private room,2022,"$1,030 ",$206 ,1,52,9/23/2018,1.44,3.0,1,300,"No smoking, parties, or additional guests. No pets without prior approval. Please clean up after yourself in the shared spaces, as this is my home.",
3913062,Beautiful sun-filled Loft BROOKLYN,94402604048,unconfirmed,Samantha,Brooklyn,Bushwick,40.707840000000004,-73.92224,United States,US,True,moderate,Entire home/apt,2004,$465 ,$93 ,3,203,6/22/2019,3.42,5.0,1,277,"No drugs ,No smoking No loud music after 10pm  Keep your room and common area clean  Clean behind yourself in the bathroom, kitchen and rooms  Please no food on the room   All visitors of houseguest must leave by a decent hour  No violence No pets Check out please leave key on the kitchen table and closed doors with manual lock",
3913614,Elegant Gramercy Park Studio,20018446741,verified,Andre,Manhattan,Flatiron District,40.73923,-73.98589,United States,US,False,moderate,Entire home/apt,2005,$684 ,$137 ,30,10,8/13/2016,0.17,2.0,1,343,,
3914166,"Sunny, Central, Quiet, UWS, 72&Bway",5594908059,unconfirmed,Gs,Manhattan,Upper West Side,40.77885,-73.98178,United States,US,False,strict,Entire home/apt,2009,"$1,180 ",$236 ,7,0,,,3.0,1,219,,
3914719,"Suite w/private bath, Forest Hills",51105226951,verified,Ruth,Queens,Forest Hills,40.72356,-73.83981999999999,United States,US,False,strict,Private room,2017,$783 ,$157 ,2,128,5/18/2019,2.17,3.0,3,352,"No loud music after 10pm. Absolutely no smoking or pets. If there is other evidence of smoking or pets in the property, you will forfeit your entire security deposit. Check in and check out time can be flexible depending upon the dates you are looking for and whether anyone else is staying. Unless we arrange otherwise, check in is after 4pm and check out is before noon. The cleaning fee covers two hours. If additional cleaning is required, you will be charged $50/hour, deducted from your deposit. No parties. If a neighbor complains about a party happening or loud music after 10pm, or if there is a big mess left at the place, you will forfeit your entire deposit. Your internet usage will be logged and monitored if you access a blacklisted site or ip range. Please don't abuse the connection speed by downloading illegal content while a guest. You agree to follow all of the rules of the building, which will be provided. Any issues with not following the building rules and you forfeit your ",
3915271,"Master Bedrm, Steam Shr/Jacuzzi, FH",20950034664,verified,Ruth,Queens,Forest Hills,40.727,-73.83924,United States,US,True,flexible,Private room,2022,$226 ,$45 ,2,75,5/19/2019,1.27,1.0,3,216,#NAME?,
3915823,3,84460435585,unconfirmed,Eugene,Brooklyn,Bushwick,40.70248,-73.93225,United States,US,True,flexible,Private room,2022,$643 ,$129 ,1,0,,,5.0,2,6,"No candles, no smoking, no food in room, no private kitchen use.",
3916375,2,13773966622,verified,Eugene,Brooklyn,Bushwick,40.70315,-73.93124,United States,US,False,moderate,Private room,2016,$860 ,$172 ,2,2,11/1/2015,0.04,1.0,2,13,,
3916928,Doorman nice 1bd/ United Nations!!,57123605620,verified,Mike,Manhattan,Murray Hill,40.74915,-73.97196,United States,US,True,flexible,Entire home/apt,2005,$366 ,$73 ,30,7,5/31/2019,0.12,2.0,52,115,"I kindly ask that you not smoke in the apartment, the public areas outside the main entry doors. Pets are not allowed.",
3917480,"Stay 30 min to Times Sq in quaint Sunnyside, Qns",30673877507,verified,Chad,Queens,Sunnyside,40.74219,-73.92585,United States,US,False,flexible,Private room,2011,$556 ,$111 ,5,6,6/24/2019,1.41,4.0,1,328,"No smoking, no parties, no pets. Four night minimum stay.  I need to have information about who will be staying at the house before a booking will be accepted.",
3918032,ColumbusCircle~W/D~new BLDG~Balcony,35377886532,unconfirmed,Host,Manhattan,Hell's Kitchen,40.7662,-73.98612,United States,US,False,strict,Entire home/apt,2005,$597 ,$119 ,30,11,3/23/2019,0.2,4.0,39,338,#NAME?,
3918585,Sunny Room in Shared Apartment,32115980537,unconfirmed,Corey,Manhattan,Upper West Side,40.79744,-73.97098000000001,United States,US,True,strict,Private room,2011,$684 ,$137 ,30,2,5/27/2016,0.04,1.0,1,2,"Hosted check in time is 4-8 p.m. Early and late check-ins are possible upon request in advance and subject to availability.  Check out time is 11 a.m.  Regretfully, for health and safety reasons, smoking is not permitted on the property. Regretfully, the space is not appropriate for young children, so we can't accommodate them. 48 hours cancellation notice or full charge. Regretfully, we cannot accommodate guest pets  Discounted rates for weekly and monthly stays.",
3919137,Reno1BR~RiverView~Luxury24D~Roof~,86709326428,verified,Host,Manhattan,Murray Hill,40.74445,-73.97180999999999,United States,US,False,moderate,Entire home/apt,2013,$275 ,$55 ,30,7,8/20/2018,0.14,5.0,39,365,,
3919689,Sunny 1bed Oasis in South Harlem/Upper West Side,35247331859,unconfirmed,Amanda,Manhattan,Harlem,40.802929999999996,-73.95586,United States,US,True,strict,Entire home/apt,2012,$684 ,$137 ,1,23,1/7/2019,0.45,5.0,1,237,Maximum number of Guests accepted is 4. No house parties or other social gatherings allowed while staying at our place.,
3920242,"UWS Charmer, Central Park/Lincoln Center",76774985934,unconfirmed,Tina,Manhattan,Upper West Side,40.776270000000004,-73.98080999999999,United States,US,False,moderate,Entire home/apt,2006,$153 ,$31 ,3,70,5/26/2019,1.19,3.0,1,53,"1. NO parties, no loud gatherings, no loud noises. 2.Please respect our neighbors by keeping noise levels low (we share an interior wall), parking only in the designated space and not overlaping spaces, and staying off their part of the property - their front patio, back deck outside the kitchen, and their section of the basement.   3. No guests not included in the booking are allowed in the house. The maximum number of people allowed at the property is 7 with special arrangement. The fourth bedroom should only be used for parties of 7 or guests who have paid an additional fee.  4. No smoking inside.  5. Antiques require an extra level of care. Use a coaster please! 6. If parking carefully read over all rules, and make sure to follow directions or you will be towed.  7. Read over your Welcome Guide prior to your stay.  We expect people to be very responsible with our house. We want people to have fun and that is why we have tried to provide the best, and we hope people take notice and ",
