45278675,Spacious bedroom in colorful apartment,59393074041,verified,John,Brooklyn,Kensington,40.64354,-73.97967,United States,US,True,moderate,Private room,2004,$328 ,$66 ,1,0.0,,,4,1,0,,
45279227,Bushwick Studio with Private Porch,97030171196,unconfirmed,Alex,Brooklyn,Bushwick,40.70382,-73.91745999999999,United States,US,True,moderate,Entire home/apt,2015,$480 ,$96 ,1,0.0,,,4,1,0,,
45279779,Charming Bohemian East Village Apartment,62972261337,verified,Chelsea,Manhattan,East Village,40.731590000000004,-73.98447,United States,US,False,moderate,Entire home/apt,2017,$618 ,$124 ,3,5.0,8/23/2017,0.19,2,1,0,"Please remember that this is a residential building. The building rules, apartment occupancy restrictions and the year-round tenants must be respected.  Parties, pets and smoking are not allowed under any circumstances and incur significant fees.",
45280332,Quiet Private Room in Scenic NYC Neighborhood,6288439467,verified,Caitlin,Manhattan,Washington Heights,40.85865,-73.93559,United States,US,False,strict,Private room,2003,$297 ,$59 ,2,13.0,9/16/2018,0.55,3,1,0,,
45280884,"Charming Carroll Gardens, Brooklyn Apartment",38577933755,verified,Triada,Brooklyn,Carroll Gardens,40.68057,-73.99395,United States,US,False,moderate,Entire home/apt,2021,"$1,115 ",$223 ,2,69.0,7/1/2019,2.66,5,1,275,,
45281436,Brooklyn Dream Home + Private Patio,26993669436,unconfirmed,Sabrina,Brooklyn,Brooklyn Heights,40.692840000000004,-73.99633,United States,US,True,moderate,Entire home/apt,2018,$520 ,$104 ,2,12.0,10/7/2018,0.46,5,1,39,,
45281989,Huge room in a clean brownstone in Brooklyn.,1316444070,unconfirmed,Max Prana,Brooklyn,Bedford-Stuyvesant,40.694179999999996,-73.94447,United States,US,True,moderate,Private room,2018,$701 ,$140 ,2,19.0,6/5/2019,0.76,5,1,4,No Smoking  No Pets,
45282541,Fantastic Sunny peaceful room in Riverdale,37228350049,verified,Vicdania,Bronx,North Riverdale,40.91169,-73.90564,United States,US,True,flexible,Private room,2020,$879 ,$176 ,365,0.0,,,1,1,363,Enjoy and be respectful,
45283093,Beautiful Studio Apartment on the E70th St,30143276591,verified,Maria,Manhattan,Upper East Side,40.7672,-73.95495,United States,US,True,strict,Entire home/apt,2008,$260 ,$52 ,1,89.0,6/22/2019,3.43,5,1,9,"Please remember that this is a residential building. The building rules, apartment occupancy restrictions and the year-round tenants must be respected.  Parties and smoking are not allowed under any circumstances and incur significant fees. Parties and smoking are not allowed under any circumstances and incur significant fees. Pets may be considered with pre-approval and an additional pet fee.",
45283645,"Cozy, private room in Morningside Heights",57879153611,verified,Mahnoor,Manhattan,Morningside Heights,40.81368,-73.95919,United States,US,False,flexible,Private room,2018,"$1,075 ",$215 ,1,0.0,,,3,1,0,"Respectful, quiet but enjoyable stay! Clean, or messy and then clean up before they leave! ;-)",
45284198,Quaint 1 Bedroom in Historic Home,26508360762,verified,Jeff,Queens,Sunnyside,40.747890000000005,-73.91428,United States,US,True,moderate,Entire home/apt,2008,$95 ,$19 ,30,3.0,12/2/2017,0.13,3,1,213,,
45284750,"Cute, spacious room in Crown Heights",33696951931,unconfirmed,Megan E,Brooklyn,Crown Heights,40.669540000000005,-73.93975,United States,US,False,moderate,Private room,2007,$511 ,$102 ,3,8.0,3/30/2019,0.31,3,2,0,,
45285302,Family-friendly Bright Studio in Our Brooklyn Home,97371700908,unconfirmed,Jody,Brooklyn,East Flatbush,40.65064,-73.95045,United States,US,False,flexible,Entire home/apt,2021,$708 ,$142 ,2,73.0,6/29/2019,3.09,1,1,66,,
45285855,Clean Comfy Private Room in Heart of Williamsburg,35471706098,verified,Caitlin,Brooklyn,Williamsburg,40.712270000000004,-73.96233000000001,United States,US,True,strict,Private room,2004,"$1,003 ",$201 ,5,2.0,6/11/2018,0.08,2,1,0,No Smoking or Pets,
45286407,Adorable room in Astoria - 20 mins to Manhattan!,46738836536,verified,Anushua,Queens,Astoria,40.76682,-73.90807,United States,US,False,strict,Private room,2020,$445 ,$89 ,2,27.0,6/15/2019,1.03,5,2,338,,
45286959,PRIME WILLIAMSBURG- Spacious 4BR Bohemian Oasis,3888601321,unconfirmed,Bethany,Brooklyn,Williamsburg,40.71353,-73.9578,United States,US,True,strict,Entire home/apt,2019,$497 ,$99 ,3,9.0,5/12/2019,0.4,5,3,11,"Please Note: This unit was just renovated in April 2016 and it comfortably accommodates one to three guests (two guests in the bedroom and 1 guest on the available queen air mattress).  Please request an air mattress (if needed) when making a reservation. No smoking, no pets, no parties, and must be 25 years old to book.   Please be mindful to our neighbors in the building; quiet hours after 10pm. Please be considerate of our next guests who will be staying after you, if something is broken or needs fixing, please let me know, as I have an arsenal of tools and enjoy fixing things. For check-out, please ensure: -  All plates and cups are left in the sink or dishwasher -  All trash is left in the kitchen trash can or bagged and left next to the trash can (additional bags are under the sink) -  All windows are closed and locked -  If used, the air mattresses are deflated and put away (please leave used linens for the air mattresses on the floor) -  If furniture was moved during your stay,",
45287512,Sunny & cozzy room in beautiful apartment,6229608290,unconfirmed,Michèle,Brooklyn,Crown Heights,40.67541,-73.93253,United States,US,False,strict,Private room,2011,$367 ,$73 ,7,0.0,,,4,1,59,,
45288064,A Chic Harlem stay,11141687958,verified,Devon,Manhattan,Harlem,40.82336,-73.94511999999999,United States,US,True,flexible,Private room,2006,"$1,171 ",$234 ,30,4.0,9/10/2018,0.17,3,8,67,,
45288616,Upper East Side 1 bedroom near Central park,86308977846,unconfirmed,Sean,Manhattan,Upper East Side,40.774809999999995,-73.95640999999999,United States,US,False,flexible,Entire home/apt,2006,"$1,053 ",$211 ,3,32.0,5/27/2019,1.22,2,1,4,,
45289168,Beautiful Dupl Brooklyn Apartment w/ a Big Terrace,93873292269,unconfirmed,Dee,Brooklyn,Bedford-Stuyvesant,40.69205,-73.95803000000001,United States,US,True,flexible,Entire home/apt,2017,$605 ,$121 ,3,1.0,5/22/2017,0.04,3,1,0,"Please treat this home as your own and respect the neighbors. No parties, smoking, or additional guests (other than the agreed upon).",
45289721,Cozy Contemporary Couch by Central Park,81773645084,unconfirmed,Shia,Manhattan,Morningside Heights,40.80387,-73.95853000000001,United States,US,False,flexible,Private room,2014,$172 ,$34 ,3,103.0,6/17/2019,3.93,3,2,18,,
45290273,East Village Studio Apartment,30810855850,verified,Patrick,Manhattan,East Village,40.7241,-73.98959,United States,US,False,flexible,Entire home/apt,2012,"$1,181 ",$236 ,7,9.0,11/5/2018,0.35,3,1,0,"No pets, no smoking, no parties.  No guests not on the reservation.  You are liable for any damage. Please do NOT move the furniture we've had damage in the past because of this.  If you need to move anything for a reason please ask. We will give you access to Netflix.  Please respect the account. Please report anything broken at the beginning of your reservation to avoid the loss of your security deposit.  Clean all your dishes and clean up after yourself.  Please keep the noise down.",
45290825,Contemporary Room Close to Columbia & Central Park,51186335609,unconfirmed,Shia,Manhattan,Harlem,40.8042,-73.95669000000001,United States,US,False,flexible,Private room,2003,$236 ,$47 ,2,41.0,4/1/2019,1.57,3,2,1,,
45291378,Modern Brooklyn brownstone in prime location,32455897671,unconfirmed,Margot,Brooklyn,Prospect Heights,40.67787,-73.97225,United States,US,False,strict,Entire home/apt,2022,$875 ,$175 ,3,3.0,7/16/2017,0.12,1,1,0,,
45291930,Crown Heights Air Bnb/Sublet,26730200637,unconfirmed,Noah,Brooklyn,Crown Heights,40.675709999999995,-73.94915999999999,United States,US,True,strict,Private room,2014,$298 ,$60 ,1,0.0,,,5,1,0,- - Please be courteous and quiet when coming in and out - Do not talk to neighbors - No smoking inside - No parties allowed - Clean up after yourself - Respect the property - Shoes off please  - No loud music or TV after 1:00 AM,
45292482,Large 1 Bedroom in Astoria/Long Island City!,80198229691,unconfirmed,Andrea,Queens,Astoria,40.76843,-73.93257,United States,US,True,flexible,Private room,2019,$466 ,$93 ,3,17.0,4/23/2019,0.65,5,2,334,,
45293035,"BEST LOCATION, ONLY 5 MIN TO MANHATAN.",39725275225,verified,Ana Y Victor,Brooklyn,Williamsburg,40.710390000000004,-73.96139000000001,United States,US,True,moderate,Private room,2017,$545 ,$109 ,1,44.0,5/8/2019,2.19,4,4,77,No smoking or parties and be respectful of upstairs guests and neighbors.,
45293587,Cozy 1 Bedroom with Queen bed,16104119633,unconfirmed,Andrea,Queens,Astoria,40.76848,-73.93213,United States,US,False,flexible,Private room,2014,"$1,049 ",$210 ,3,27.0,7/2/2019,1.03,3,2,154,No smoking or parties allowed,
45294139,Union Square Private Sunny Dream Home,8486949144,unconfirmed,Kseniya,Manhattan,Gramercy,40.7358,-73.9889,United States,US,True,strict,Entire home/apt,2008,$441 ,$88 ,1,68.0,7/2/2019,2.67,1,1,324,,
45294691,Red Flower,41423543992,unconfirmed,Paul,Manhattan,Harlem,40.8225,-73.94493,United States,US,True,strict,Entire home/apt,2012,$726 ,$145 ,1,78.0,7/7/2019,3.0,4,1,84,"Are we allowed to drive the boats? All of our boats are in-slip rentals, and can't be taken out. Many of our rental locations have charter services available in the same marina, and we can get you information regarding these services if you desire an excursion. How safe is the location? The boats are in very safe locations. There are gates for entrance, and a fully staffed office looking after the marina. Each boat can be secured while you are on board, or if you are away for the day. The parking is all in well lit and maintained lots. Do I need to bring my car, and where do I park? We recognize the hassle of traveling with a car within cities. We try to select marinas that are convenient for car-free exploring. Most of our locations are within walking distance to major tourist sites, and also have an abundance of public transportation options. If you do need to drive to the marina, we can provide you with information for finding a parking spot convenient to the marina and boat.  Do th",
45295244,A Home Base in Brooklyn,97793687722,verified,John,Brooklyn,Williamsburg,40.70545,-73.94714,United States,US,False,flexible,Private room,2019,$315 ,$63 ,1,96.0,6/15/2019,3.82,3,2,79,,
45295796,Williamsburg Sanctuary,71320447016,unconfirmed,Tiffany,Brooklyn,Williamsburg,40.7137,-73.95711,United States,US,False,moderate,Entire home/apt,2013,$143 ,$29 ,3,32.0,6/23/2019,1.25,3,1,33,"No smoking, no pets. Security deposit required.  Please no parties, though this is a totally separate apartment there is another apartment in the building. The tenant in this other apartment is quiet and respectful of our guests and he asks that our guests also be respectful of noise levels.",
45296348,Beautiful One bedroom in Midtown Manhattan,82724874083,verified,Stanley,Manhattan,Murray Hill,40.750170000000004,-73.97686999999999,United States,US,False,flexible,Entire home/apt,2015,"$1,030 ",$206 ,30,0.0,,,2,50,180,No smoking No pet allowed,
45296901,Luxury Studio Apartment in Downtown Brooklyn,98566217584,verified,Zexi,Brooklyn,Downtown Brooklyn,40.694590000000005,-73.98261,United States,US,False,moderate,Entire home/apt,2003,$456 ,$91 ,5,2.0,8/29/2017,0.08,5,1,0,,
45297453,"Spacious, sunny room in Upper West Side, Manhattan",98715156277,verified,Ben,Manhattan,Upper West Side,40.79939,-73.96752,United States,US,False,flexible,Private room,2004,$837 ,$167 ,7,1.0,8/24/2017,0.04,2,3,0,,
45298005,Spacious Bedroom in Duplex,3741693727,verified,Charlotte,Brooklyn,Bushwick,40.69804,-73.9182,United States,US,False,strict,Private room,2010,$124 ,$25 ,2,0.0,,,1,1,0,"Hello there! Please only enter the front door of the building if I have let you in or you have been given the key beforehand.  Please leave the apartment and its contents in the same condition you found it. Please no one in the building or apartment except the registered guests.  This is a strict one.  Thanks for understanding! Please no eating or drinking on the sofa. (Also, please hand wash any dishes used.) Please walk gently in the apartment and observe quiet hours of 8pm-10am. It is an old building and sound transfers easily.  Definitely no smoking and/or any other ""substances"" on the premises. Sorry, none of the alcohol in the apartment is for guest consumption. Thank you for respecting the property and also my furnishings. This helps me offer nice things for consequent guests! Sorry for the litany of rules, but adhering to these will make everyone happy. I like to keep a calm & clean place. Thank you! Paul",
45298558,Private Room in the Heart of Brooklyn!,35839695752,unconfirmed,Laura,Brooklyn,Gowanus,40.68432,-73.98867,United States,US,False,flexible,Private room,2022,$751 ,$150 ,1,0.0,,,2,2,0,"We like to keep things quiet and peaceful and expect that our guests will be respectful of our space and belongings. No smoking, no illegal substances.",
45299110,Comfy Wall Street Apartment,61274617601,unconfirmed,Allie,Manhattan,Financial District,40.705859999999994,-74.00875,United States,US,False,flexible,Private room,2016,$115 ,$23 ,1,3.0,6/4/2017,0.12,1,1,0,,
45299662,Private Bedroom in Artist's Apartment,13647497661,verified,Tami,Brooklyn,Midwood,40.61143,-73.9543,United States,US,False,moderate,Private room,2004,$106 ,$21 ,2,12.0,7/30/2017,0.46,2,1,0,- No Smoking In the House.  There is a back porch accessible through the kitchen where you can smoke. - We try to keep the house very clean and would like to ask you to please remove your shoes when entering the house so that dirt doesn't trek around the house.  There is a shoe cabinet right by the entrance where you can store your shoes.  Some slippers will also be provided and can be found inside the shoe cabinet. - Please clean after yourself after you use the bathroom. It is a shared bathroom. The same goes for the kitchen. ,
45300214,Private Room and Bath in the Lower East Side!,8259058422,unconfirmed,Lauren,Manhattan,East Village,40.722879999999996,-73.98342,United States,US,False,moderate,Private room,2021,$198 ,$40 ,1,3.0,8/27/2017,0.12,1,1,0,,
45300767,Renovated Modern Home Ideal for a FAMILY!,80874526869,unconfirmed,Richard,Brooklyn,Windsor Terrace,40.65766,-73.97614,United States,US,False,strict,Entire home/apt,2018,$476 ,$95 ,3,8.0,11/30/2018,0.32,1,1,0,"Kitchen, please:  - Do not leave perishable items in the fridge or on the counter for extended stays.  General, please:  - Treat our home as you would your own. - Clean up after yourself. We ask that you leave the common areas as you found them and do your dishes when you're finished with them.  - Feel free to use linens and towels as you need them. At the end of your stay, please leave them by the washer & dryer.  - We are smoke-free and pet-free.  - This rule is a must: Enjoy your stay!",
45301319,Spacious Private Room - Newly Renovated Harlem Apt,62914287501,unconfirmed,Trisha,Manhattan,Harlem,40.812709999999996,-73.94055,United States,US,True,moderate,Private room,2005,$830 ,$166 ,2,21.0,3/18/2018,0.81,5,1,0,"No loud music, No pets, No smoking, No additional guess allow; Room is  offered for one person only.",
45301871,Loft Studio in Clinton Hill/Bed-Stuy Brooklyn,35239832319,verified,Adriana,Brooklyn,Bedford-Stuyvesant,40.68626,-73.95918,United States,US,False,strict,Entire home/apt,2013,$193 ,$39 ,1,0.0,,,3,1,0,,
45302424,"Carroll Gardens Brooklyn, Sunny and Modern Triplex",54012316000,unconfirmed,Caroline,Brooklyn,Gowanus,40.68112,-73.98921,United States,US,True,moderate,Entire home/apt,2019,$467 ,$93 ,7,4.0,4/26/2019,0.17,4,1,72,No other pets allowed. No smoking. We expect general respect for our house and things. No access to private bedrooms.,
45302976,Cozy sleeping nook in the heart of Brooklyn!,419777407,unconfirmed,Ashkon,Brooklyn,Crown Heights,40.674040000000005,-73.95616,United States,US,False,strict,Private room,2015,$620 ,$124 ,7,0.0,,,4,1,0,#NAME?,
45303528,"PRIVATE, QUIET, Clean NY APT. 3mins to JFK Airport",29215898194,verified,Ada,Queens,Jamaica,40.6705,-73.77787,United States,US,False,strict,Entire home/apt,2012,$908 ,$182 ,1,22.0,6/2/2019,0.85,5,2,305,,
45304081,Easy trip to Manhattan!  Large Private Garden!,91149859893,verified,Mo,Brooklyn,Bedford-Stuyvesant,40.68391,-73.95783,United States,US,False,moderate,Entire home/apt,2008,$203 ,$41 ,3,4.0,5/6/2018,0.17,5,1,250,- No Smoking In the House. There is a back porch accessible through the kitchen where you can smoke. - We try to keep the house very clean and would like to ask you to please remove your shoes when entering the house so that dirt doesn't trek around the house. There is a shoe cabinet right by the entrance where you can store your shoes. Some slippers will also be provided and can be found inside the shoe cabinet. - Please clean after yourself after you use the bathroom. It is a shared bathroom. The same goes for the kitchen.,
45304633,Bushwick Chef's house,1239984480,verified,Heejun,Brooklyn,Bushwick,40.69445,-73.91161,United States,US,True,moderate,Private room,2006,"$1,095 ",$219 ,1,22.0,7/1/2019,0.85,5,1,331,- Enjoy Your self and have a pleasant stay!,
45305185,Private room in Harlem-Sublet or short term stay,36563166424,unconfirmed,Roberto,Manhattan,Harlem,40.83168,-73.94743000000001,United States,US,False,strict,Private room,2006,$319 ,$64 ,7,0.0,,,2,1,0,- No Smoking In the House. There is a back porch accessible through the kitchen where you can smoke. - We try to keep the house very clean and would like to ask you to please remove your shoes when entering the house so that dirt doesn't trek around the house. There is a shoe cabinet right by the entrance where you can store your shoes. Some slippers will also be provided and can be found inside the shoe cabinet. - Please clean after yourself after you use the bathroom. It is a shared bathroom. The same goes for the kitchen.,
45305737,Beautiful apt w/terrace Bushwick. 1block frm train,61019891295,verified,Bam,Brooklyn,Bushwick,40.695170000000005,-73.92541,United States,US,False,flexible,Entire home/apt,2016,$837 ,$167 ,2,15.0,6/23/2019,0.59,2,2,0,No parties. No smoking please,
45306290,Bed-Stuy Artists Retreat,8200208097,verified,Kelley,Brooklyn,Bedford-Stuyvesant,40.690870000000004,-73.946,United States,US,True,moderate,Private room,2010,$501 ,$100 ,3,0.0,,,2,1,0,Be respectful and no smoking in room,
45306842,"Entire Apt – 2 BR/1 BA – beautiful, block from L/M",25942619386,verified,Dan,Brooklyn,Bushwick,40.696940000000005,-73.91269,United States,US,False,moderate,Entire home/apt,2012,"$1,037 ",$207 ,7,0.0,,,1,1,0,#NAME?,
45307394,Med. sized bdrm in Historical house on Staten Isl.,30741828617,verified,Reuben,Staten Island,Stapleton,40.62981,-74.07998,United States,US,True,moderate,Private room,2007,$887 ,$177 ,1,25.0,7/6/2019,1.03,3,4,73,- No loud music after 9 pm please,
45307947,Huge Private Room in New York 10minute to Midtown,19814540886,verified,Meja Hilde,Queens,Long Island City,40.75172,-73.9379,United States,US,True,flexible,Private room,2004,$471 ,$94 ,1,3.0,5/30/2017,0.12,5,1,0,"- Be respectful, we are opening our home to you. - Clean up after yourself. - Be mindful of the neighbors and our busy work schedule. - If you have any questions, please ask, we are very friendly people. - Enjoy your stay!",
45308499,Sunny Art + Plant Brownstone Apartment,17847720703,verified,Alexandra,Brooklyn,Bedford-Stuyvesant,40.68988,-73.94136999999999,United States,US,False,moderate,Entire home/apt,2017,$473 ,$95 ,2,0.0,,,1,1,0,"For visitor who only need to sleep,take shower and rest from 10 pm to 8:00 am No smoking extra quiet please Check out please close doors by manual lock Walking slow and not noise please",
45309051,Private Room with Skyline View. Near LGA airport,27525626496,verified,Win,Queens,East Elmhurst,40.75885,-73.86959,United States,US,False,flexible,Private room,2009,$402 ,$80 ,1,141.0,7/5/2019,10.19,4,2,47,#NAME?,
45309604,Spacious yet Cozy Room in Manhattan,266098287,verified,Lexi,Manhattan,Washington Heights,40.84773,-73.93251,United States,US,True,strict,Private room,2014,$566 ,$113 ,3,2.0,6/12/2017,0.08,4,1,0,"We really only have one general requirement, and that is: please leave the apartment and its contents in the condition you found it. We do not have a maid service that cleans the apartment so please be respectful.",
45310156,Midtown West,22294509340,verified,Robert,Manhattan,Hell's Kitchen,40.75405,-73.99377,United States,US,False,moderate,Private room,2004,"$1,021 ",$204 ,1,7.0,3/11/2018,0.27,5,1,0,,
45310708,Charming East Village One Bedroom,15241935573,unconfirmed,Yinhang,Manhattan,East Village,40.723490000000005,-73.9841,United States,US,True,strict,Entire home/apt,2019,$282 ,$56 ,3,2.0,6/21/2017,0.08,3,1,0,,
45311260,Private Room in beautiful UWS - Great Location!,18571169044,unconfirmed,Shirley,Manhattan,Upper West Side,40.79978,-73.96797,United States,US,True,moderate,Private room,2003,$125 ,$25 ,7,5.0,7/4/2017,0.19,2,1,0,,
45311813,Lux apt,4955193503,unconfirmed,Michele,Manhattan,Kips Bay,40.74518,-73.97929,United States,US,False,flexible,Entire home/apt,2021,$298 ,$60 ,3,0.0,,,4,1,0,"We expect that you treat our home as you would yours.  If you smoke, you can do so on the back porch. There is absolutely no smoking in the apartment. If you have a pet you are traveling with, please contact us, we can discuss a nice pet.",
45312365,Modern Sunny Midtown Gem,72538234960,unconfirmed,Leah,Manhattan,Midtown,40.74452,-73.98163000000001,United States,US,True,flexible,Entire home/apt,2003,$270 ,$54 ,3,14.0,9/22/2018,0.58,2,1,0,"Hello there! Please only enter the front door of the building if I have let you in or you have been given the key beforehand.  Please leave the apartment and its contents in the same condition you found it. Please no one in the apartment except the registered guests.  This is a strict one.  Thanks for understanding! Please no eating or drinking on the sofa. (Also, please hand wash any dishes used.) Please walk gently in the apartment and observe quiet hours of 8pm-10am. It is an old building and sound transfers easily.  Definitely no smoking and/or any other ""substances"" on the premises. Sorry, none of the alcohol in the apartment is for guest consumption. Thank you for respecting the property and also my furnishings. This helps me offer nice things for consequent guests! Sorry for the litany of rules, but adhering to these will make everyone happy. I like to keep a calm & clean place. Thank you! Paul",
45312917,Large Place bushwick with furniture,50832471288,unconfirmed,Roodmy,Brooklyn,Bushwick,40.69416,-73.90816,United States,US,False,moderate,Private room,2004,$487 ,$97 ,7,11.0,9/20/2017,0.42,3,1,0,"There is a family that lives below us with a young child. Please be respectful and avoid making excessive noise, especially after 9pm. Also, the washer should only be used for small loads.",
45313470,"Private Room & Entrance, Two Blocks from Times Sq!",93517760366,verified,David,Manhattan,Hell's Kitchen,40.76,-73.98915,United States,US,True,flexible,Private room,2003,$671 ,$134 ,3,65.0,6/30/2019,2.92,5,1,25,Please respect my home. There are other long term tenants who reside in the building.,
45314022,1 bedroom apartment in Morningside Heights!,56866099700,unconfirmed,Mili,Manhattan,Morningside Heights,40.80546,-73.96547,United States,US,True,strict,Entire home/apt,2010,$637 ,$127 ,7,2.0,1/21/2018,0.08,1,1,0,,
45314574,Penthouse studio @ Manhathan,6188930381,verified,Crystal,Manhattan,Financial District,40.70738,-74.01281,United States,US,False,strict,Entire home/apt,2022,$198 ,$40 ,2,0.0,,,1,1,0,"We suggest you use email or texting contact us if need, do not call us. We will not accept calling from AirBnB guests. We will back to you ASAP.",
45315127,Spacious & Charming Apartment in Bedstuy,94954579182,verified,Jeffrey,Brooklyn,Bedford-Stuyvesant,40.69471,-73.94225,United States,US,False,strict,Entire home/apt,2005,$649 ,$130 ,2,0.0,,,1,1,0,"- No Smoking In the House.  There is a back porch accessible through the kitchen where you can smoke. -  There will be other travelers staying along with you, so please be respectful and abide by common sense rules.  - We try to keep the house very clean and would like to ask you to please remove your shoes when entering the house so that dirt doesn't trek around the house.  There is a shoe cabinet right by the entrance where you can store your shoes.  Some slippers will also be provided and can be found inside the shoe cabinet. - Please clean after yourself after you use the bathroom. It is a shared bathroom. The same goes for the kitchen. ",
45315679,"Private, artsy room steps from Prospect Park!!",54324090374,verified,Lauren,Brooklyn,Prospect-Lefferts Gardens,40.65475,-73.96186,United States,US,False,strict,Private room,2015,$865 ,$173 ,1,24.0,12/11/2017,0.92,5,1,0,"Please keep as clean as you can.  Please no shoes in the house.  Absolutely no smoking.  Also, the building association does not allow pets.",
45316231,Spacious studio in midtown Manhattan,8436800127,unconfirmed,Stanley,Manhattan,Murray Hill,40.74954,-73.97686999999999,United States,US,True,flexible,Entire home/apt,2021,$446 ,$89 ,30,3.0,2/2/2019,0.2,5,50,180,,
45316783,PEACE AND TRANQUILITY,94270231525,verified,Pauline,Bronx,Baychester,40.87192,-73.84676,United States,US,True,moderate,Private room,2022,$839 ,$168 ,1,0.0,,,5,2,0,,
45317336,Amazing duplex with garden,51320578854,unconfirmed,Fabrice,Brooklyn,Williamsburg,40.71255,-73.95745,United States,US,False,moderate,Private room,2014,$825 ,$165 ,6,0.0,,,1,1,0,,
