16317720,Amazing Studio at the Time Square Area/52D,91308145959,unconfirmed,Irina,Manhattan,Hell's Kitchen,40.76173,-73.99325,United States,US,False,flexible,Entire home/apt,2006,$612 ,$122 ,30,4,5/18/2019,0.43,5,20,268.0,,
16318272,Bohemian chic Brooklyn floor thru,75288362947,verified,Jenny,Brooklyn,Bedford-Stuyvesant,40.69395,-73.95232,United States,US,False,flexible,Entire home/apt,2011,$289 ,$58 ,3,46,6/30/2019,2.36,3,2,255.0,Quiet hours are 10PM to 8AM. No Smoking no pets,
16318824,"Light-filled, cozy apartment -convenient location!",38105411965,verified,Payal,Queens,Sunnyside,40.74543,-73.92399,United States,US,True,flexible,Entire home/apt,2017,$929 ,$186 ,3,35,6/30/2019,1.78,3,1,2.0,,
16319377,Private room w/ bathroom near Prospect Park,30390624387,unconfirmed,Sweden,Brooklyn,Prospect-Lefferts Gardens,40.656620000000004,-73.95344,United States,US,False,flexible,Private room,2017,"$1,056 ",$211 ,2,102,7/7/2019,5.2,2,2,347.0,Taking off shoes will be appreciated!,
16319929,Brooklyn Gem! Close to transportation!,82003177210,unconfirmed,Ezra,Brooklyn,Bedford-Stuyvesant,40.68882,-73.95194000000001,United States,US,False,flexible,Private room,2012,$627 ,$125 ,3,2,11/28/2017,0.1,4,1,364.0,"Come as you are (only request: no smoke, no pets).",
16320481,"Private Bedroom in Artsy Airbnb: Room ""L""",75729492626,unconfirmed,Sweden,Brooklyn,Prospect-Lefferts Gardens,40.65848,-73.952,United States,US,False,moderate,Private room,2006,"$1,157 ",$231 ,2,99,6/20/2019,5.03,5,2,334.0,"Please be respectful of other guests.  Keep the common areas clean and pick up after your self.  No loud music after 10:00PM.  It is a safe neighborhood but please, keep doors locked for safety No smoking in the house (smoking is allowed on the front or back decks).",
16321033,The Long House - Williamsburg!,20249932236,verified,David & Mallory,Brooklyn,Williamsburg,40.71425,-73.96276,United States,US,False,strict,Entire home/apt,2018,$836 ,$167 ,1,33,6/23/2019,1.96,2,1,0.0,"No pets, no smoking of any manner or tobacco products allowed.  This is my home and I expect guests to treat it with the same consideration and respect as they would show their own homes.",
16321586,Beautiful Brownstone 10 mins away from Manhattan,88389331398,unconfirmed,Julia,Brooklyn,Gowanus,40.678309999999996,-73.99324,United States,US,False,flexible,Entire home/apt,2020,$472 ,$94 ,4,18,6/17/2019,0.98,4,1,8.0,,
16322138,"Small apt in LIC, NY.",72213510864,verified,Carol & Darcy,Queens,Sunnyside,40.74048,-73.9273,United States,US,True,flexible,Entire home/apt,2021,$182 ,$36 ,1,1,8/6/2018,0.09,5,1,0.0,,
16322690,Shared Apartment,15965994997,verified,Brown,Queens,Corona,40.74223,-73.86408,United States,US,False,strict,Private room,2007,$403 ,$81 ,1,4,7/10/2018,0.2,4,1,95.0,,
16323243,Newly renovated bedroom apartment - 2 beds,37296339523,unconfirmed,Javier,Brooklyn,Crown Heights,40.6768,-73.93529000000001,United States,US,True,strict,Entire home/apt,2005,$972 ,$194 ,5,2,8/26/2018,0.11,5,1,0.0,Shoes must be removed after entering the house. The cats are strictly indoor. No smoking,
16323795,Park Slope it! Close to Manhattan! Renovated!,35140265699,unconfirmed,Michelle,Brooklyn,Sunset Park,40.66475,-73.99629,United States,US,False,flexible,Private room,2004,$441 ,$88 ,2,7,5/15/2018,0.36,5,1,0.0,"NO SMOKING AND PETS ANYWHERE ON THE PROPERTY 1. Be respectful of the other tenants 2. When walking up the back stairwell into the unit, please minimize the amount of talking, door closing, and foot noise (these stairs border bedrooms) 3. If you use the grill, be sure to turn off the gas 4. Notify the owner of any discrepancies or things not functioning properly immediately 5. Please treat carpet stains promptly (or notify the owner) 6. Kindly turn off lights, air conditioners, and other electrical items when they aren't needed",
16324347,Beautiful 5th avenue apartment with balcony,70340815676,verified,Boris,Manhattan,Chelsea,40.73649,-73.99237,United States,US,True,strict,Entire home/apt,2014,$710 ,$142 ,10,3,4/29/2018,0.16,4,1,0.0,,
16324900,Cozy Studio near all Attractions in NYC.,76517620630,unconfirmed,Juan Carlos,Brooklyn,Sheepshead Bay,40.58747,-73.9587,United States,US,True,moderate,Entire home/apt,2003,$702 ,$140 ,1,42,6/28/2019,2.11,2,1,28.0,"Absolutely not smoking in the house. I am looking for easy going people, not for party people. This is a quiet neighborhood. People who can take care of our stuff.",
16325452,Comfortable 1 Bedroom Apartment,96954131641,verified,Chris,Brooklyn,Bath Beach,40.60674,-74.00428000000001,United States,US,True,moderate,Entire home/apt,2018,$445 ,$89 ,3,39,7/1/2019,2.37,5,1,306.0,"No smoking, keep clean and respect property",
16326004,Beautiful Home in Park Slope!,50925123146,verified,Brittany,Brooklyn,Park Slope,40.67329,-73.98311,United States,US,False,moderate,Entire home/apt,2004,$139 ,$28 ,3,2,3/13/2018,0.1,5,1,0.0,,
16326556,Charming 1BD Apartment near Empire State building,22140769284,unconfirmed,Mike,Manhattan,Kips Bay,40.74295,-73.97391999999999,United States,US,True,strict,Entire home/apt,2013,$214 ,$43 ,3,2,7/1/2019,0.11,4,1,2.0,1.  No pets allowed. 2.  No smoking in the rooms. You may smoke in the yard but please don't leave the stubs in the grass etc.  3.No food in the bedroom.  4.Only water is allowed to drink in the bedroom. 5. Use slippers provided at the entrance or use your own slippers when you enter the house.  6. Please do not put your luggage on the top of the bed cover. 7. Living room and kitchen are closed at 10:00pm unless you need to get some water.,
16327109,Bohemian 2 Bedroom in the East Village,71422355208,unconfirmed,Megan,Manhattan,East Village,40.72833,-73.97926,United States,US,False,strict,Entire home/apt,2016,$999 ,$200 ,6,6,5/12/2019,0.31,2,2,12.0,#NAME?,
16327661,Romantic Getaway,65082392813,verified,W.,Bronx,Pelham Bay,40.846070000000005,-73.83842,United States,US,False,strict,Entire home/apt,2018,$420 ,$84 ,7,1,2/1/2018,0.06,5,2,349.0,* No smoking * No pets * No loud music,
16328213,Cozy bedroom in NYC great for your next vacation!,63718602371,verified,Leigha,Manhattan,Harlem,40.82738,-73.94559,United States,US,True,moderate,Private room,2012,"$1,124 ",$225 ,3,1,11/26/2017,0.05,2,1,0.0,"- Absolutely NO SMOKING, vape-ing, drugs, or alcohol in the house. - Please no children under 10. The  house isn't child proofed. - Quiet hours 10p-8a. - Please no showering after midnight.    (The bathroom is attached to our bedroom. Unfortunately, we've had very loud guests.) - Laundry available per request. Thank you!",
16328766,Elegant one bedroom in Prospect Heights,89781913864,unconfirmed,Sarah,Brooklyn,Prospect Heights,40.67665,-73.96985,United States,US,False,strict,Entire home/apt,2010,$581 ,$116 ,7,1,1/11/2018,0.06,4,1,0.0,#NAME?,
16329318,Bright room in East Williamsburg,64795174421,verified,Savanah,Brooklyn,Williamsburg,40.70782,-73.9403,United States,US,True,strict,Private room,2004,"$1,109 ",$222 ,2,1,5/15/2018,0.07,3,1,0.0,,
16329870,"Beautiful, Bright Apartment in Heart of Chelsea",19475181520,verified,Bridget,Manhattan,Chelsea,40.74328,-73.9991,United States,US,True,strict,Entire home/apt,2006,$889 ,$178 ,4,0,,,2,1,0.0,"1.     No pets allowed.  2.   No smoking inside the house, please.     3.   No wearing shoes inside the house. We will give you slippers (you could bring your own slippers) 4.  Quiet time starts at 10pm, and living room and kitchen are closed at that time.",
16330423,Beautiful Sunny Private Room #1 in Brooklyn,6663339215,verified,Elizabeth,Brooklyn,Bensonhurst,40.61497,-74.00531,United States,US,False,moderate,Private room,2005,$915 ,$183 ,2,30,6/25/2019,1.55,3,4,305.0,,
16330975,Private room (2 beds) close to Time Square,80356846422,unconfirmed,Christian,Manhattan,Hell's Kitchen,40.760259999999995,-73.98875,United States,US,False,flexible,Private room,2015,$352 ,$70 ,3,1,12/11/2017,0.05,3,1,0.0,,
16331527,Spacious Apt near UN Plaza 2 Queen size bed for 5,1887693853,unconfirmed,Cedar,Manhattan,Midtown,40.7548,-73.96966,United States,US,False,strict,Entire home/apt,2012,"$1,069 ",$214 ,2,75,6/28/2019,3.84,3,3,105.0,,
16332079,Garden Apartment in the Heart of Greenpoint,19008987200,verified,Michael,Brooklyn,Greenpoint,40.72513,-73.94829,United States,US,False,strict,Private room,2006,$332 ,$66 ,2,21,6/24/2019,1.37,5,1,336.0,"No parties, no smoking.",
16332632,3 Bedroom designer apartment with views,43835504813,unconfirmed,Raza,Brooklyn,South Slope,40.668209999999995,-73.98834000000001,United States,US,False,flexible,Entire home/apt,2014,$778 ,$156 ,3,0,,,3,1,0.0,No Smoking No Pets,
16333184,Mid-town West 5-min walk to Central Park,67424569861,verified,Jen,Manhattan,Upper West Side,40.76814,-73.98404000000001,United States,US,False,strict,Entire home/apt,2020,$396 ,$79 ,5,2,9/6/2018,0.1,2,1,0.0,"1. No wearing shoes inside the house. We will give you slippers (you could bring your own slippers) 2. Living room and kitchen are closed at 10 pm, and please be quiet after 10 pm",
16333736,Beautiful Sunny Private Room #2 in Brooklyn,98508049248,unconfirmed,Elizabeth,Brooklyn,Bensonhurst,40.61465,-74.00312,United States,US,False,strict,Private room,2014,$639 ,$128 ,2,15,7/1/2019,0.77,4,4,236.0,,
16334289,Brand New 2 Bedroom Apt in Bed Stuy with Garden,60185685354,verified,Andrea,Brooklyn,Bedford-Stuyvesant,40.68506,-73.94164,United States,US,False,moderate,Entire home/apt,2008,$514 ,$103 ,30,7,6/15/2019,0.5,4,1,0.0,Please no smoking.,
16334841,Beautiful Sunny Private Room #3 in Brooklyn,3002267077,verified,Elizabeth,Brooklyn,Bensonhurst,40.61466,-74.00504000000001,United States,US,True,strict,Private room,2018,$127 ,$25 ,2,24,6/2/2019,1.22,5,4,315.0,"The house is absolutely NO SMOKING & NO PETS of any kind or size.   Please remove shoes when going in & settling down. You will find the place clean & spotless on your arrival so please be respectful of efforts made to deliver it as such to every guest and every time.  Please be respectful of apartment and its amenities. The rented apartment shall be occupied by no more than the number of listed adults and/or children on the reservation.  Visiting friends are welcome, however the establishment of obvious residence by such persons is NOT permitted.  Parties, large gatherings, or group events are absolutely not allowed in or around the property.  Please remove all trash from unit and place in trash & recycle containers outside the unit at corner of house by back porch.  Please collect all of your personal belongings upon your departure (double check bathrooms for personal items of any kind!).  Please try & help us keep all aspects of managing the apartment within budgeted costs: do not t",
16335393,Separate 2 Bedroom Apartment located inside Loft.,42895769587,unconfirmed,Greg,Manhattan,NoHo,40.72909,-73.99125,United States,US,False,strict,Entire home/apt,2004,$806 ,$161 ,2,81,6/21/2019,4.24,4,2,194.0,Respectful and Responsible Keep room clean and tidy Clean up after using kitchen or bathroom,
16335946,Upper West Side Quiet and Private Studio,94780140504,unconfirmed,Rob,Manhattan,Upper West Side,40.78037,-73.98021,United States,US,True,flexible,Entire home/apt,2019,$642 ,$128 ,7,0,,,4,1,0.0,We love our home and enjoy sharing it with others. We hope you'll treat it as with as much care as we do. Our neighbors are friendly and quiet. We hope you'll fit right in.,
16336498,Cozy room at Columbia University,87158146906,verified,T,Manhattan,Morningside Heights,40.80369,-73.96238000000001,United States,US,False,flexible,Private room,2007,$650 ,$130 ,1,0,,,5,1,0.0,,
16337050,Park Slope Beauty For Your Winter Stay In NYC,41649088404,unconfirmed,Ty,Brooklyn,Park Slope,40.676809999999996,-73.97910999999999,United States,US,True,strict,Entire home/apt,2014,"$1,083 ",$217 ,2,9,4/15/2018,0.45,3,1,0.0,"1.     No pets allowed.  2.   No smoking inside the house, please.     3.   No wearing shoes inside the house. We will give you slippers (you could bring your own slippers) 4.  Living room and kitchen are closed at 10 pm, and please be quiet after 10 pm",
16337602,East Village Penthouse - Private Bedroom,7044928997,verified,Nicholas,Manhattan,East Village,40.7301,-73.98239000000001,United States,US,False,flexible,Private room,2019,$397 ,$79 ,3,32,6/19/2019,1.7,2,2,76.0,,
16338155,Classic Brooklyn room in brownstone neighborhood,60948754964,unconfirmed,Daniela,Brooklyn,Bedford-Stuyvesant,40.68884,-73.92949,United States,US,False,strict,Private room,2019,$420 ,$84 ,7,1,12/29/2017,0.05,2,1,0.0,This is a condominium with a resident below. Please be respectful of that.,
16338707,Cozy room in tranquil home in great neighborhood.,28092359216,verified,Mary,Brooklyn,Prospect Heights,40.67471,-73.96408000000001,United States,US,True,flexible,Private room,2018,$533 ,$107 ,3,62,6/9/2019,3.11,4,2,49.0,,
16339259,3.5 MLN usd 2 bedroom LOFT in TriBeCa  (2),72433453070,verified,Gipsy Properties,Manhattan,Tribeca,40.71953,-74.00386,United States,US,True,strict,Entire home/apt,2021,"$1,141 ",$228 ,14,10,2/25/2019,0.53,3,3,335.0,No smoking and illegal drug use. Please Minimize noise after 1030pm No guests,
16339812,Brooklyn Home with a Backyard!,66809903812,verified,Abigail,Brooklyn,Bedford-Stuyvesant,40.68739,-73.95405,United States,US,True,flexible,Entire home/apt,2008,$102 ,$20 ,2,2,10/27/2018,0.11,4,1,0.0,,
16340364,Hell’s Kitchen (52nd Street & 9th Avenue),49702567723,verified,Nick,Manhattan,Hell's Kitchen,40.76424,-73.98713000000001,United States,US,True,strict,Private room,2011,"$1,166 ",$233 ,1,0,,,2,1,0.0,No smoking  Ask about additional fee for pets,
16340916,Master Bedroom in Harlem - 20 min to Midtown!,40384332774,unconfirmed,Andrea,Manhattan,Harlem,40.827740000000006,-73.94609,United States,US,False,flexible,Private room,2022,$973 ,$195 ,1,1,1/1/2018,0.05,3,1,0.0,Respectful and with great attitudes,
16341469,Artful loft ★ NYC ★ Chelsea,13019057959,verified,,Manhattan,Chelsea,40.74245,-73.99348,United States,US,False,strict,Entire home/apt,2011,$689 ,$138 ,12,1,5/21/2019,0.61,5,1,332.0,We love our home and enjoy sharing it with others. We hope you'll treat it as with as much care as we do. Our neighbors are friendly and quiet. We hope you'll fit right in.,
16342021,Spacious Lower East Side with private balcony,91247072804,verified,,Manhattan,Lower East Side,40.72221,-73.99084,United States,US,False,moderate,Private room,2010,$545 ,$109 ,2,0,,,3,1,0.0,Shoes must be removed after entering the house. The cats are strictly indoor. No smoking,
16342573,Slice of Heaven @ 811,34026567402,unconfirmed,,Brooklyn,Crown Heights,40.6703,-73.94181999999999,United States,US,False,moderate,Entire home/apt,2010,$581 ,$116 ,3,44,7/4/2019,2.33,2,1,52.0,- $20 per extra person. Maximum 2 person for attic room.,
16343125,Spacious and Bright Midtown East Apartment,18326492214,unconfirmed,,Manhattan,Upper East Side,40.764359999999996,-73.96836,United States,US,False,flexible,Entire home/apt,2013,"$1,073 ",$215 ,1,0,,,3,1,0.0,- 1 floor,
16343678,Clean Cozy House less than 10 min from JFK :),43575990145,unconfirmed,,Queens,South Ozone Park,40.67078,-73.79164,United States,US,True,flexible,Entire home/apt,2018,$494 ,$99 ,1,154,6/22/2019,8.24,2,2,0.0,1. No pets allowed.  2. No Children under the age of 10 allowed.  3. No smoking inside the house. You may smoke outside.  4. No wearing shoes inside the house. We will give you slippers for you to wear.  5. Quiet time starts at 11pm,
16344230,Shared 2 Bedroom Loft in Soho,1129115501,verified,Nick,Manhattan,Lower East Side,40.71925,-73.99418,United States,US,False,strict,Private room,2011,$102 ,$20 ,5,3,12/12/2018,0.31,2,4,153.0,This listing is located in a residential area and so all the regular rules of living in a residential area apply.  Please be kind to the neighbors - we know and love them!  Please keep BBQs/outside activity to a minimum after 9 or 10PM.,
16344782,Historic Turret Retreat (Smart TV/Cable/Wifi),32774216768,unconfirmed,Louise,Brooklyn,Flatbush,40.6437,-73.96769,United States,US,False,flexible,Private room,2020,$281 ,$56 ,7,3,6/26/2018,0.18,4,3,0.0,"1. You must be 25 years of age to rent this home and provide proof of age, if requested. 2. This is a non-smoking home. Any evidence of smoking in and around the property will result in forfeiture of your security deposit. 3. The home has a maximum occupancy of six people. Renters who exceed the occupancy limit and or falsify information at the time of reservation are subject to eviction. 4. Well-behaved dogs are allowed with written owner permission at time of booking, additional fee and security deposit required 5. House parties are strictly prohibited and are grounds for immediate eviction. 6. Illegal substances are strictly prohibited and are grounds for immediate eviction. 7. When you arrive, the home will be clean and we request that you leave it in good order. We will provide you with a detailed check-in and check-out procedures, as well as the code for the keyless entry lock, several days prior to your arrival. 8. Any exception to the rules here must be approved in writing in a",
16345335,Beautiful large room in Morningside Heights,86131060152,verified,Finola,Manhattan,Morningside Heights,40.80423,-73.96515,United States,US,True,strict,Private room,2003,"$1,133 ",$227 ,10,0,,,2,1,2.0,We love our home and enjoy sharing it with others. We hope you'll treat it as with as much care as we do. Our neighbors are friendly and quiet. We hope you'll fit right in.,
16345887,Room in house with WiFi and Netflix,31918779625,unconfirmed,Devi,Bronx,Parkchester,40.83067,-73.88024,United States,US,False,flexible,Private room,2016,$284 ,$57 ,1,14,7/2/2019,0.7,4,2,1.0,"No parties, no smoking.",
16346439,@the heart Of Queens. 20Mins 2 Downtown.nearall.B,67491986447,unconfirmed,Kim,Queens,Elmhurst,40.73914,-73.87116,United States,US,False,moderate,Entire home/apt,2019,$572 ,$114 ,4,42,6/16/2019,2.17,4,2,64.0,Two guest maximum and no pets please. No smoking or candles.,
16346992,Colorful Bed Stuy studio apartment,37271381118,unconfirmed,Ben,Brooklyn,Bedford-Stuyvesant,40.69259,-73.92881,United States,US,True,strict,Entire home/apt,2009,$695 ,$139 ,3,2,12/11/2017,0.1,2,1,0.0,"I expect guest to respect that this is my personal home, I live here, and to fully respect the space and my belongings as you would your own.  This is not a hotel and the space does not feel like a hotel or rental that other guests are constantly moving in and out of. Please do not light candles in the house or anything that would be a fire hazard.  Please clean up after yourself.  No smoking in the house No pets please Please be respectful of my belongings and do not move anything around. When using the firepit, please use caution. If plants look like they could use a little water, feel free to give them a little!",
16347544,Exclusive  & Luxurious 4BR/4Bath Townhouse,33163168826,verified,Trish,Manhattan,Murray Hill,40.74866,-73.97846,United States,US,False,moderate,Entire home/apt,2016,$989 ,$198 ,3,10,6/3/2019,2.07,5,1,310.0,,
16348096,Beautiful one bedroom apartment centrally located,29703781196,unconfirmed,On,Brooklyn,Midwood,40.62914,-73.9575,United States,US,False,flexible,Entire home/apt,2007,$707 ,$141 ,2,2,5/19/2019,0.11,5,1,0.0,,
16348648,Beautiful private room in Greenpoint,14780343785,unconfirmed,Jimena,Brooklyn,Greenpoint,40.72391,-73.94214000000001,United States,US,False,flexible,Private room,2018,"$1,054 ",$211 ,3,2,4/1/2018,0.1,3,1,0.0,-We do not allow pets because we already have a small dog in the house but he is very friendly! -Please make sure to close the back door when you are coming in and out.,
16349201,Bayridge 2 bedroom furnished apartment.,80082729017,verified,Ebada,Brooklyn,Fort Hamilton,40.62231,-74.02885,United States,US,False,strict,Entire home/apt,2012,$305 ,$61 ,4,4,8/5/2018,0.22,4,3,324.0,"Please be aware, check in is NO earlier than 6pm on weekdays. We can make no exceptions. Weekends are more flexible.",
16349753,"Loft w/ brick&beam, deep soak tub, rainfall shower",52946131238,unconfirmed,Sam,Brooklyn,Williamsburg,40.71989,-73.95837,United States,US,True,strict,Entire home/apt,2020,$446 ,$89 ,175,5,4/30/2018,0.26,5,1,362.0,,
16350305,Charming Ditmas Park Air B&B,62008695511,unconfirmed,Paula,Brooklyn,Flatbush,40.63146,-73.96226999999999,United States,US,True,moderate,Entire home/apt,2004,$378 ,$76 ,3,24,6/6/2019,1.25,2,1,277.0,"Please no loud noise after 10pm as others do live here Check in after 3pm Check out at 11am Would appreciate it if you removed linens from bed post stay (not a requirement, just as a courtesy) NO SMOKING in room We do have an indoor porch if you're a smoker outside apartment",
16350858,Full mattress in the living room,16961051744,unconfirmed,Iris,Queens,Rego Park,40.72826,-73.87015,United States,US,False,flexible,Shared room,2009,"$1,198 ",$240 ,1,11,4/21/2018,0.55,2,4,0.0,"This apartment is located on a third floor, no elevator. Guest must be considered and respectful with the noise level. No stumping or running please.",
16351410,Prime Tribeca Loft,46209222791,unconfirmed,CRNY Monthly Rentals,Manhattan,Tribeca,40.72005,-74.00455,United States,US,True,moderate,Entire home/apt,2011,"$1,115 ",$223 ,30,0,,,5,31,179.0,"We ask that you are respectful of the space you are staying in. Please take off your shoes when you enter to help keep the space clean. Space heaters are available for use but should not be left on if you leave. The space is thickly insulated and sound proof so it retains heat very well. If you use the kitchen, please clean up after yourself. This is not a party house so please be respectful at late hours by not making tons of noise outside.",
16351962,Thanksgivings - Upper East 1 bedroom,15122681409,verified,Moises,Manhattan,East Harlem,40.786390000000004,-73.94869,United States,US,False,flexible,Entire home/apt,2005,$788 ,$158 ,3,1,11/26/2017,0.05,4,1,0.0,"Enjoy our home and please leave it clean & tidy like you found it :) Thank you for not smoking. Sorry, no pets even though we love them. We have nice respectful neighbors so no loud music or parties. Hanging out & music are fine just keep others in mind :)  Thank you!",
16352515,Private Studio in Queens Blvd /Min 2guest perstay,16967106259,verified,Franz,Queens,Briarwood,40.70593,-73.81468000000001,United States,US,True,moderate,Entire home/apt,2021,"$1,085 ",$217 ,1,47,6/1/2019,2.38,2,3,40.0,#NAME?,
16353067,Charming and snug 1 bd in West Village near soho,36488824927,unconfirmed,Isabella,Manhattan,West Village,40.73226,-74.00184,United States,US,False,moderate,Entire home/apt,2011,$477 ,$95 ,6,11,10/8/2018,0.62,2,1,0.0,No Smoking. No Pets. Enjoy a morning cup of coffee as you sit on the shady porch. Like use of the kitchen area.,
16353619,East Village Alcove Studio with Great Light & View,52101585468,verified,Max,Manhattan,East Village,40.72202,-73.97909,United States,US,True,moderate,Entire home/apt,2022,$657 ,$131 ,5,3,1/4/2019,0.16,2,1,0.0,be respectful Take off your shoes at the door,
16354171,"Beautiful, quiet room with ensuite bathroom",53029192531,verified,Anne-Katrin,Brooklyn,Bedford-Stuyvesant,40.68507,-73.93565,United States,US,True,moderate,Private room,2007,$931 ,$186 ,1,1,1/1/2018,0.05,3,2,0.0,,
16354724,Brooklyn Treehouse,98220116645,verified,Amelia,Brooklyn,Williamsburg,40.7115,-73.95746,United States,US,True,flexible,Entire home/apt,2005,$904 ,$181 ,3,1,11/26/2017,0.05,2,1,0.0,,
16355276,Gorgeous 2-Level East Village Apt (2 Bed/1.5 Bath),7417352718,unconfirmed,Erin,Manhattan,East Village,40.73103,-73.98233,United States,US,True,flexible,Entire home/apt,2009,$390 ,$78 ,2,21,6/11/2019,1.08,4,2,2.0,No smoking.  No guests without previous discussion with host.,
16355828,Queen Room in Prospect Lefferts Gardens Flatbush,74173994104,unconfirmed,Sydney,Brooklyn,Flatbush,40.65314,-73.95304,United States,US,False,moderate,Private room,2006,$999 ,$200 ,5,12,4/30/2019,0.7,2,5,67.0,No smoking  Respect to others,
16356381,Authentic Brklyn Experience - Room C,35455684590,unconfirmed,Tia,Brooklyn,Canarsie,40.64942,-73.89783,United States,US,True,strict,Private room,2004,$886 ,$177 ,4,4,9/10/2018,0.22,2,4,37.0,"Smoking allowed outside, on grounds, pets under 10 lb sitting available additional charge and events possibly  pre aproved by owners,",
16356933,Apartment in trendy Nolita,16934979198,verified,Kaaran,Manhattan,Nolita,40.72207,-73.99596,United States,US,False,strict,Entire home/apt,2017,$964 ,$193 ,7,0,,,3,1,0.0,"Smoking: Absolutely no smoking indoors. If you need to smoke please do it on the porch and dispose of cigarette butts in the ashtrays provided. Additional Guests: Please do not arrive with more guests than are booked to stay nor invite visitors at any time. Children: The apartment is not suitable for children under the age of 12. Pets: We will graciously host friendly, well mannered, house trained dogs that are 50 pounds or less. We cannot accommodate cats or other pets. Facilities: Guests are expected to leave spaces clean and tidy after each use. Kitchen use is restricted to light use only: Kettle/Coffee, Microwave, and Refrigerator. Please take this into consideration when planning your stay. Quiqet Time: Please be aware that this is also our home.  Quiet time is from 11pm to 6am.",
16357485,"Private, Cozy Manhattan Bedroom",12292141097,verified,Dina,Manhattan,Harlem,40.8217,-73.95336,United States,US,True,flexible,Private room,2014,$537 ,$107 ,1,1,12/1/2017,0.05,3,1,0.0,This bedroom is available for a female guest only.  As a guest you will not be able to bring any friends/acquaintance during your stay. Cannot make loud noises inside or outside the house.,
16358038,Charming loft-style apartment with private balcony,73462267240,unconfirmed,Nicole,Manhattan,Greenwich Village,40.73449,-73.99299,United States,US,True,strict,Entire home/apt,2020,$750 ,$150 ,1,29,6/22/2019,1.46,3,1,39.0,"Note #1: Just be a good neighbor and respect your space and others. Note #2: Unit is second floor of building, Senior Citizens & Disabled may find difficult going upstairs.",
