10647808,Your Home away from Home!,83236844726,verified,Fabian,Queens,Jamaica,40.6711,-73.76508000000001,United States,US,True,moderate,Private room,2008,$497 ,$99 ,1,58.0,4/29/2017,1.77,4,1,0,"Check In/ Check Out: Flexible regarding to check in time, but please give notice ahead of time to make sure your check in goes smoothly. Would like to be there to greet you, but often times are away. If so, will leave you the keys for self check in. Please refer to check out time as 12PM and inquire if you require a different check out time. Parking: There is a dedicated off-street parking spot for ONE car only. More than one car in parking area is strictly prohibited. Any extra vehicles will need to go in a nearby parking garage.  Shoes Off: Please kindly take your shoes off at the entrance. Smoking: There is strictly no smoking in or outside of the house. Bring Home guests: Please inform ahead of time if you would like to bring friends to the house. Kitchen Use: Please keep kitchen use to prepare snacks or coffee/tea. Party/Drinking: Please be responsible if you are to consume alcoholic beverages. Kindly clean up your messes and leave a clean space. Parties are strictly prohibited.",
10648360,Cheap! Couch to crash - Upper East Side (Safe&Fun),28317980152,unconfirmed,Kay,Manhattan,Upper East Side,40.78112,-73.95214,United States,US,False,flexible,Shared room,2020,$391 ,$78 ,1,50.0,7/2/2019,1.41,1,1,343,"Please, no smoking or parties in the home.",
10648912,"Bright, Spacious Home Near Beach & Subway",88064551796,unconfirmed,Anna,Queens,Arverne,40.590509999999995,-73.79151999999999,United States,US,True,strict,Private room,2013,$446 ,$89 ,1,51.0,6/11/2019,1.4,2,4,152,Be courteous to neighbors. No parties. No smoking. No pets. No hanging around on front porch.,
10649465,Two Bedroom on the Upper East Side,32413533739,verified,Theodore,Manhattan,Upper East Side,40.777879999999996,-73.95615,United States,US,True,moderate,Entire home/apt,2007,$192 ,$38 ,1,3.0,8/23/2016,0.08,3,1,0,"Please, no smoking and /or parties. This is my home, I would like my home to be treated with the utmost care and respect by all the wonderful individuals I host as a member of the Air BnB network. Thank you!",
10650017,2 Bedroom apartment in Prime Williamsburg!,44271691451,verified,Yana,Brooklyn,Williamsburg,40.709379999999996,-73.95435,United States,US,True,flexible,Entire home/apt,2012,$612 ,$122 ,1,174.0,6/27/2019,4.84,4,1,236,,
10650569,Charming Upper East Side 1BR,29244389742,verified,George,Manhattan,Upper East Side,40.769909999999996,-73.95189,United States,US,False,moderate,Entire home/apt,2013,$114 ,$23 ,4,26.0,5/25/2019,0.75,3,1,188,"This is our home, please be respectful, we only accept reservations of those which the profile requesting the room represents. Thank you for your cooperation and respect for our rule.",
10651122,Elegant Stu Suite in  Midtown East  -21,70156599505,unconfirmed,Gordon,Manhattan,Midtown,40.75965,-73.96543,United States,US,False,flexible,Entire home/apt,2007,$981 ,$196 ,30,14.0,5/31/2019,0.39,2,5,75,"Please Note: This unit was just gut-renovated in May 2015 and it comfortably accommodates 4 guests, but up to 5 guests are permitted if you so desire (two guests in each bedroom and 1 guest on the available air mattress). Please request an air mattress (if needed) when making a reservation. No smoking, no pets, no parties, and must be 25 years old to book.   For check-out, please ensure: -  All plates and cups are left in the sink or dishwasher -  All trash is left in the kitchen trash can or bagged and left next to the trash can (additional bags are under the sink) -  All windows are closed and locked -  If used, the air mattresses are deflated and put away (please leave used linens for the air mattresses on the floor) -  If furniture was moved during your stay, please return to its original location Please be mindful to our neighbors in the building; quiet hours after 10pm. Please be considerate of our next guests who will be staying after you, if something is broken or needs fixing,",
10651674,"PRIVATE LARGE STUDIO FOR YOU, PLUS!",76492100727,unconfirmed,Sha,Brooklyn,Bedford-Stuyvesant,40.68398,-73.94100999999999,United States,US,True,flexible,Entire home/apt,2016,$642 ,$128 ,2,113.0,6/22/2019,3.08,2,3,262,"This house is used year round, so please no smoking. Pets are unfortunately not allowed.",
10652226,Centrally Located One Bedroom Apt,61610025649,verified,Garron,Manhattan,Chelsea,40.73942,-74.00065,United States,US,False,strict,Entire home/apt,2003,$634 ,$127 ,2,1.0,9/16/2016,0.03,1,1,0,To keep the house and house items in the same condition they were when they arrived,
10652779,"Charming Bedroom, Incredible Location",41725546000,verified,Sarah,Manhattan,Nolita,40.72232,-73.99579,United States,US,False,flexible,Private room,2003,"$1,077 ",$215 ,3,2.0,8/13/2016,0.05,1,2,0,,
10653331,Private Micro Room 3,12707538367,verified,Han,Manhattan,Hell's Kitchen,40.76277,-73.99424,United States,US,True,moderate,Private room,2005,$125 ,$25 ,1,220.0,6/30/2019,6.0,5,6,180,"Please respect all personal property/possessions on the premises. The house is the primary residence of the owner and his wife: it is not a primary rental space, vacation home, etc.  Smoking: Absolutely NO SMOKING in the house, on the deck, or in the backyard. Any evidence of smoking on the premises will result in the loss of your security deposit. Pets: The house has 2 glass sliders leading out to the deck and private backyard. One of the sliders (it is fixed - do NOT try to slide it) has an installed doggy door, capable of accommodating a small dog (less than 25 pounds) or a cat. You are welcome to have your WELL-BEHAVED, HOUSE-BROKEN small dog or cat stay at the house for a small additional fee ($25/day); however, you must provide more details about your pet's needs PRIOR to renting the house.  Evidence of an unapproved pet stay will result in the loss of your security deposit.  Thank you for your respectful consideration!",
10653883,Flushing Private Room W/ bathroom W/2 Quee Bed/1FL,70866940943,verified,Shirley,Queens,Flushing,40.74988,-73.82884,United States,US,False,moderate,Private room,2014,"$1,090 ",$218 ,7,82.0,6/11/2019,2.34,3,12,152,"We expect guests to be mindful of the neighbors, especially during evening hours.",
10654435,Great room in a spacious apartment DT Manhattan,18873596208,unconfirmed,T,Manhattan,Lower East Side,40.72144,-73.98655,United States,US,False,strict,Private room,2016,$520 ,$104 ,1,10.0,12/18/2016,0.27,4,2,187,,
10654988,Modern bright spacious duplex apartment,15907805498,unconfirmed,Jonathan,Manhattan,Harlem,40.8235,-73.94332,United States,US,False,strict,Entire home/apt,2021,$490 ,$98 ,5,74.0,7/3/2019,2.03,1,1,216,"I expect guests to treat my home as if it were their own. Be neat and clean, considerate, and respectful of both my home and my neighbors. There is NO additional guests permitted! There is NO smoking in the home, NO pets, NO drugs!!! NO food in the bedroom!! Shoes are to be take off upon entry!!",
10655540,Private Micro Room  1,91947751168,verified,Han,Manhattan,Hell's Kitchen,40.76296,-73.99565,United States,US,False,flexible,Private room,2003,$490 ,$98 ,1,247.0,7/1/2019,6.74,2,6,161,,
10656092,Lovely 1BR on the Upper East Side,20666893822,verified,Marina,Manhattan,Upper East Side,40.7732,-73.95173,United States,US,False,moderate,Entire home/apt,2015,$727 ,$145 ,2,8.0,12/12/2016,0.23,4,1,0,,
10656645,"EAST VILLAGE, Tompkins Park, Private Rm + Bathroom",16087432272,verified,Deep,Manhattan,East Village,40.7294,-73.98021,United States,US,True,flexible,Private room,2007,"$1,177 ",$235 ,4,12.0,5/21/2017,0.33,1,1,0,"Mutual respect and low maintenance. If you need to do your own thing and just need a place to crash, I'm totally cool with that - I will not take up any of your time like I know some share-hosts like to do.",
10657197,Bedroom available  with closet space,74143091631,unconfirmed,Ryan,Queens,Astoria,40.76736,-73.91462,United States,US,True,moderate,Private room,2020,$152 ,$30 ,5,3.0,7/25/2017,0.08,2,1,0,No partying or guests who are not booked in the house. Respect my home and treat it with care. Please remove shoes inside the home. Thanks!,
10657749,Classic Exposed Brick Apartment in East Village,53040977965,verified,Jennifer,Manhattan,East Village,40.7282,-73.98001,United States,US,False,strict,Private room,2007,$746 ,$149 ,1,159.0,6/23/2019,4.34,1,1,84,"Please Note: This unit was just gut-renovated in May 2015 and it comfortably accommodates 8 guests (two guests in each bedroom and/or guest(s) on the available air mattresses). Please request an air mattress (if needed) when making a reservation. No smoking, no pets, no parties, and must be 25 years old to book.   For check-out, please ensure: -  All plates and cups are left in the sink or dishwasher -  All trash is left in the kitchen trash can or bagged and left next to the trash can (additional bags are under the sink) -  All windows are closed and locked -  If used, the air mattresses are deflated and put away (please leave used linens for the air mattresses on the floor) -  If furniture was moved during your stay, please return to its original location Please be mindful to our neighbors in the building; quiet hours after 10pm. Please be considerate of our next guests who will be staying after you, if something is broken or needs fixing, please let me know, as I have an arsenal of ",
10658302,Marabou,48981317818,unconfirmed,Christian,Brooklyn,Crown Heights,40.67431,-73.95399,United States,US,True,moderate,Private room,2015,$554 ,$111 ,30,19.0,8/11/2018,0.52,5,1,281,"Since this is our permanent residence and not just a house we own to rent out, we very much hope our guests will treat it as it were their own and be kind and respectful of the space and our personal property in the home.  Please no parties or events and be aware that the upstairs neighbors have access to the backyard as that is shared space.  Taking your shoes off in the house keeps the floors and carpets clean.  Small, quiet pets will be considered upon request.",
10658854,SPACE & LIGHT 3 Blocks from Union Square,16571168690,unconfirmed,Alexandre,Manhattan,Gramercy,40.73491,-73.984,United States,US,False,moderate,Private room,2017,"$1,125 ",$225 ,2,1.0,7/26/2016,0.03,1,1,0,,
10659406,1br in Beautiful 2br-Prime location (LIC/Astoria),97752422134,verified,Shaheen,Queens,Astoria,40.758179999999996,-73.92513000000001,United States,US,True,moderate,Private room,2006,$599 ,$120 ,6,0.0,,,1,1,0,We're flexible on check-in/checkout times,
10659958,Suburban Living in Brooklyn,77734671867,verified,Patricia,Brooklyn,Canarsie,40.6415,-73.88739,United States,US,False,strict,Entire home/apt,2015,$227 ,$45 ,2,54.0,7/22/2018,1.47,2,1,64,"• Check-in time is 5PM. • No parties or events • Not suitable for pets • No smoking •I'd ask guests to respect my privacy and not walk down to the lower level where I stay.  •No parties, this is a quiet building with all working professionals. •You ABSOLUTELY cannot just show up at my property without a reservation. •Please be respectful of noise levels at all times. Do not slam doors, play music loud, yell, etc.. •I also ask guests to pick up after themselves if they want to use the kitchen/dining areas.  •No smoking please.",
10660511,Private Room One Block North of Central Park,27575067545,verified,Jonathan,Manhattan,Harlem,40.80046,-73.95509,United States,US,True,strict,Private room,2014,$742 ,$148 ,1,8.0,8/1/2016,0.22,5,1,0,We are flexible on check-in/checkout times,
10661063,1 bedroom steps from Barclay center and 11 trains,85987533551,unconfirmed,Kyler,Brooklyn,Boerum Hill,40.68473,-73.97868000000001,United States,US,False,strict,Entire home/apt,2015,"$1,195 ",$239 ,2,5.0,8/27/2016,0.14,1,2,0,"House Rules: We are seeking responsible and respectful guests for our property, as this is our home when you are not staying.  Please do not smoke in the apartment, no pets and no parties. Please be mindful to our neighbors in the building; quiet hours after 10pm.  Check In/ Check Out:  We are flexible regarding to check in time, but please notice us ahead of time to make sure your check in goes smoothly.  We would like to be home to greet you, however we maybe away or at work. If so, we will leave you the keys for self check in. Please refer check out time as 11AM and kindly inquire if you require a different check out time. For check-out, please ensure: - All plates and cups are left in the sink or dishwasher - All trash is left in the kitchen trash can or bagged and left in the trash can on the back porch (additional bags are under the sink if needed) - All windows are closed - If furniture was moved during your stay, please return to its original location Strict cancellation polici",
10661615,Eclectic Artist's Apartment in PRIME East Village,81921954416,verified,Alyssa,Manhattan,East Village,40.7257,-73.98635,United States,US,True,moderate,Entire home/apt,2016,$797 ,$159 ,1,38.0,6/27/2019,3.41,3,1,123,No parties No smoking,
10662168,Cute sunny Upper East Side Studio,19020319331,unconfirmed,Opeyemi,Manhattan,Upper East Side,40.77316,-73.94998000000001,United States,US,True,flexible,Entire home/apt,2012,"$1,109 ",$222 ,2,29.0,12/30/2017,0.8,3,1,0,No smoking. Please respect our unit and our neighbors.,
10662720,Sunny room in Williamsburg with view of Manhattan,2952662792,verified,Andrew,Brooklyn,Williamsburg,40.70854,-73.96242,United States,US,True,flexible,Private room,2012,$836 ,$167 ,2,122.0,6/14/2019,3.35,5,1,258,• Check-in time is 3PM. Clean and respectable . No party animals,
10663272,Shady Listing - Authentic NY'r,1622616056,verified,Tmc,Bronx,Concourse,40.82948,-73.92364,United States,US,False,flexible,Private room,2017,$978 ,$196 ,4,0.0,,,1,2,0,Please be respectful of our home!,
10663825,"2 bedroom w/ private back yard, laundry in unit!",9615434873,unconfirmed,William,Manhattan,SoHo,40.72541,-74.001,United States,US,False,strict,Entire home/apt,2012,$520 ,$104 ,30,1.0,7/6/2016,0.03,4,1,0,,
10664377,Huge sunlit 1 bedroom next tosubway,87107889645,unconfirmed,Lyoka,Brooklyn,Sheepshead Bay,40.60733,-73.95322,United States,US,True,moderate,Entire home/apt,2012,$363 ,$73 ,2,1.0,7/8/2018,0.08,2,1,364,,
10664929,Sunny 1 bdrm w private outdoor deck in Greenpoint!,77065648498,verified,Gabriella,Brooklyn,Greenpoint,40.72748,-73.95272,United States,US,False,strict,Private room,2018,$643 ,$129 ,3,0.0,,,4,1,0,"Keep in mind that you are staying in our home with us, this is not a rental property. No smoking. Please be mindful of others in our building with noise and late-night entry. No outside guests aside from those you list as staying with us. ",
10665481,Cosy flat West Village,31957905284,unconfirmed,Xavier,Manhattan,West Village,40.73316,-74.00183,United States,US,True,strict,Entire home/apt,2004,$989 ,$198 ,2,9.0,5/12/2018,0.25,5,1,0,,
10666034,Spacious Bright Private Room in Bedstuy!,82974751096,verified,Ilham,Brooklyn,Bedford-Stuyvesant,40.6847,-73.91762,United States,US,False,flexible,Private room,2018,$145 ,$29 ,1,0.0,,,2,1,0,"Please be courteous of our neighbors!  We love them all and hope you do to! On requesting a reservation of the apartment please extend to us a description of your visit, with whom you will be traveling, and your arrival time.  Also, please make certain your picture is uploaded on to your profile.  We give preference for those who have verifications.  On confirmation of your booking, we will email to you the address, entry instructions, and other pertinent instructions.  Airbnb will collect the entire amount at the time of your reservation confirmation including the security deposit (which will be released 48 hours after your checkout date).  Our cancellation policy is strict and any cancellation outside of seven days in advance will allow for a 50 percent refund.   There will be a contract exchange for this property which will include keeping noise to respectful level, no more than six renters at a time (without express permission/acceptance from the hosts).   Guests must have a credit",
10666586,Cozy room in artsy Bushwick home,13009545154,verified,Lauren,Queens,Ridgewood,40.71118,-73.9151,United States,US,True,strict,Private room,2010,$623 ,$125 ,1,2.0,8/16/2016,0.06,3,1,0,,
10667138,Spacious Serene Room Located in Prime E. Flatbush,25059527871,verified,Andre,Brooklyn,East Flatbush,40.63348,-73.94736999999999,United States,US,True,moderate,Private room,2019,$176 ,$35 ,1,20.0,9/4/2018,0.58,3,8,189,- Please respect noise levels after 9pm,
10667691,Comfy bed in Cozy Home - GRAND ARMY PLAZA,85643304154,unconfirmed,Mary,Brooklyn,Prospect Heights,40.67403,-73.96798000000001,United States,US,False,strict,Private room,2022,$996 ,$199 ,2,131.0,6/1/2019,3.88,5,1,333,"1. Only the ORIGINAL OCCUPANTS at the time of booking are allowed to stay in the property overnight and secondly no additional guest will be brought in without prior authorization. 2. Excessive NOISE & DISTURBANCES, specifically on work nights (Sunday thru Thursday) are to be kept to a minimum after 10pm. On other nights of the week we ask that noise is kept to a controlled, restrained and respectable level do to the nature of this being a shared space. 3. SMOKING is not permitted in any of the inside premisses. You may smoke outside on the outdoor patio. 4. DAMAGES to the property and its contents (within the bedroom and the condo itself) will be subject to reinstitution in accordance to airbnb rules and regulations and may lead to the immediate dismissal from the property. 5. NO PETS allowed. 6. ENERGY: We are very energy-conscious, and ask that you turn off lights and other energy-using items when you leave the house for the day. 7. The CLEANING FEE covers the maintenance of the sha",
10668243,Private bedroom with great views,59783750066,unconfirmed,Sahul,Brooklyn,Greenpoint,40.72249,-73.94776,United States,US,False,strict,Private room,2020,$357 ,$71 ,5,3.0,3/8/2017,0.08,4,1,0,,
10668795,Cozy Private masterRoom 2 Blocks from Central Park,92038845868,verified,Yi,Manhattan,Upper West Side,40.79938,-73.96235,United States,US,False,strict,Private room,2006,$599 ,$120 ,1,4.0,8/25/2016,0.11,2,1,0,No pets or shoes at home,
10669348,Flushing Spacious Room w/ 2 Queen Beds (1FL),28377811837,verified,Shirley,Queens,Flushing,40.74879,-73.82958,United States,US,True,flexible,Private room,2006,$644 ,$129 ,3,47.0,4/21/2019,1.33,4,12,65,No pets. No smoking.,
10669900,Carroll Gardens 1 Bedroom Studio Apartment,93109700752,verified,Philip,Brooklyn,Carroll Gardens,40.67747,-73.99916999999999,United States,US,False,strict,Entire home/apt,2006,$642 ,$128 ,5,0.0,,,3,1,0,"This is not a house for parties! There are two other units in the town house so noise should be kept controlled at night and in the mornings (especially when out on the deck or entering/exiting the building). Furnishings and construction are only three years old, respect and cleanliness is asked for.",
10670452,Flushing Deluxe Room w/ 2 Bed (1FL),73618002778,unconfirmed,Shirley,Queens,Flushing,40.74875,-73.82775,United States,US,False,strict,Private room,2013,$922 ,$184 ,7,55.0,1/24/2019,1.57,5,12,160,,
10671004,Cozy Room w/ Queen Bed (1FL),44958548912,verified,Shirley,Queens,Flushing,40.75026,-73.82873000000001,United States,US,True,strict,Private room,2021,$70 ,$14 ,7,59.0,6/12/2019,1.67,1,12,120,#NAME?,
10671557,Super sunny and spacious! Privacy!,59349905469,unconfirmed,Maria,Queens,Ditmars Steinway,40.77697,-73.9082,United States,US,False,moderate,Private room,2016,$213 ,$43 ,2,10.0,9/27/2018,0.38,2,2,364,"No parties, no extra guests, no pets, no smoking. Please treat this space and our neighbors with respect.",
10672109,Comfortable Room w/ 1 Full Bed (1FL),21974638711,verified,Shirley,Queens,Flushing,40.74944,-73.82772,United States,US,False,flexible,Private room,2008,$682 ,$136 ,3,51.0,5/9/2019,1.45,5,12,96,"Check-in is after 3PM Some general information about the apartment. Please try to keep it relatively quite, especially at night. Strict no parties or entertainment policy. No additional guests are allowed outside of reservation. No smoking inside the apartment or hallway. No pets allowed in the apartment. Unfortunately no young children as the house is not equipped for children under 10.   When making a booking - please have a verified email address and phone number on your airbnb account. Respect and treat the apartment as your own and how you would expect others to treat yours. Please communicate with us as soon as possible, should something go wrong during your stay, so we can try to fix it as soon as possible. Once you've confirmed the booking, please respect the apartment and don't hesitate to make it your own. We want you to feel like you are at home, so to sum it all up.. don't do things you wouldn't do at your own place We look forward to welcoming you and have a great time in ",
10672661,Beautiful 2 BR Garden Dplx in BK (w/ opt nursery),10050148444,verified,Meriwether,Brooklyn,Bedford-Stuyvesant,40.687459999999994,-73.95810999999999,United States,US,False,strict,Entire home/apt,2005,"$1,048 ",$210 ,5,0.0,,,3,1,0,"I prefer guests who are in town for a reason (work or sight-seeing, etc) so they are out & about all day & in to the evening, not hanging around the condo all day.  I require my guests to leave for the day by 10AM & not return before 4PM. Please obey check-in (4PM) & check-out times (10AM). I need time to clean up after prior guest to get ready for your stay. No pets. No parties, this is a quiet building with all working professionals. When using the kitchen facilities, I ask that you tidy up after yourself (dishes in dishwasher, wipe counters down, trash in the trash barrel, etc...) and if you spill anything on the floor/furniture, please clean up after yourself.",
10673214,Sunny spacious apartment in Heart of NYC,8849008919,unconfirmed,Jan,Manhattan,Upper East Side,40.7777,-73.9535,United States,US,False,flexible,Entire home/apt,2005,$245 ,$49 ,3,32.0,4/7/2019,0.88,5,1,84,,
10673766,Friendly Upper West Side Apartment,66675973918,unconfirmed,Anna,Manhattan,Upper West Side,40.78176,-73.97822,United States,US,True,moderate,Entire home/apt,2004,$761 ,$152 ,1,2.0,7/29/2016,0.06,5,1,0,My unit is one of 3 in the building.  My place is penthouse level so please just be considerate of my neighbors downstairs.,
10674318,"Beautiful, Clean, Private & Chic furnished Apt.",46756007626,unconfirmed,Nichole,Manhattan,Harlem,40.826609999999995,-73.94165,United States,US,True,moderate,Entire home/apt,2008,$223 ,$45 ,4,6.0,7/1/2019,0.17,3,1,27,"Internet, cable and central air included in stay. No smoking allowed in the apartment - - may smoke on the deck if cigarettes are appropriately disposed (and not flicked over the deck). Please be considerate of neighbors.  Not a party house! There are 5 other units in the building so noise should be kept controlled at night and in the mornings (especially when out on the deck). All plates and cups should be left in the sink or dishwasher and all trash should be left in the trash can (additional bags are under the sink if you need more space). If furniture is moved during your stay, please return to its original location. Please be considerate of our next guests who will be staying after you, if something is broken or needs fixing, please let me know immediately so that I can replace it.",
10674871,Sweet room in Brooklyn,64344814819,verified,Marie And Alec,Brooklyn,Flatlands,40.629709999999996,-73.93336,United States,US,False,strict,Private room,2018,"$1,125 ",$225 ,1,9.0,11/22/2017,0.26,1,1,189,"Check in/out: We typically follow the standard check in and out times (4 p.m., 11 a.m. respectively) however I'm extremely flexible and can accommodate your needs as long as it doesn't impact another renter if you have special check-in or out times.  There is a keypad lock and each renter will receive their own passcode so you can come and go as you please and not worry about keys or timing.   Pets:  I don't have any pets living at the home but I am a dog lover and know it can be difficult to find accommodations for your 4-legged family members.  Pets are welcome but please be respectful of the furniture and floors and clean up after them. Smoking:  There is no cigarette smoking in the home or on the property as there have been concerns with cigarette butts creating a fire hazard on the deck.  Please contact me if you need to discuss for your specific situation. Lock doors/windows at all times:  While the area is safe, it is still an urban environment and doors/windows need to be locke",
10675423,Cozy and clean room in 2 bedrooms apartment,77528703927,verified,Miki,Manhattan,Washington Heights,40.85308,-73.92878,United States,US,False,moderate,Private room,2012,$531 ,$106 ,3,71.0,3/24/2018,1.93,5,2,0,"Guests will be in my personal residence. I take great pride in my home. I ask that guest treat my home with the highest of respect. Please, no strangers or parties will be allowed! Thank you",
