44351915,Cheap Family home with desk 10 mn to JFK+Mall,54857542861,verified,Guelma,Queens,Rosedale,40.65292,-73.73652,United States,US,True,flexible,Private room,2005,$955 ,$191 ,14,70.0,6/24/2019,2.38,3.0,5.0,281,"House Rules 1. Check-in is 4 pm local time. If the unit is ready earlier, we’ll let you know. Check-out is normally 11 am local time, but we’d be happy to extend it as long as we don’t have a cleaning scheduled. Just let us know.  2. All bookings require a security deposit of at least $300, which will be refunded within 7 days of your check-out. 3. For security measures we require all guests to provide proof of identification through ID verification on our own website. In order to check in we'll need a photo of your ID.  4. Our cancellation policy is as shown on our ad and defined by the site you are booking through.  5. Don’t let $300 go up in smoke. There's no smoking allowed in any Flatbook and a $300 fine for breaking this rule.  6. Unfortunately we don’t allow pets in any of our apartments. 7. Unless you’re staying in one of our specialty apartments, we don’t allow parties or excessive noise. 8. If we find the place very messy, we have to charge an extra $40 for every extra hour o",
44352468,Awesome Chelsea Manhattan Pad,51545048197,unconfirmed,Lisa,Manhattan,Chelsea,40.7429,-73.99344,United States,US,True,strict,Private room,2003,$938 ,$188 ,1,1.0,1/30/2017,0.03,2.0,1.0,0,- No smoking inside the apartment - Checkout time is 11:00 am (a later time can be accommodated if it is available - but please ask ahead of time) - No Loud Music or Loitering outside the entrance after 10:00pm,
44353020,Large Room in Queens,80697364733,unconfirmed,Berat,Queens,Rego Park,40.72804,-73.86147,United States,US,True,moderate,Private room,2003,"$1,186 ",$237 ,1,74.0,6/9/2019,2.53,2.0,3.0,358,We except you to clean up after yourself and generally be respectful. Smoking should happen outside the house. Also please do not tap on the glass terrarium or play with the ball python. It is very timid and mostly wants to sleep.,
44353572,Smart Studio,58281147387,unconfirmed,Alli,Manhattan,East Village,40.7251,-73.98914,United States,US,True,moderate,Entire home/apt,2005,$55 ,$11 ,2,0.0,,,5.0,1.0,0,Clean and no party,
44354125,Cozy Private Studio Close to JFK w kitchen & bath,41062117061,unconfirmed,Harry,Queens,Jamaica,40.69637,-73.81034,United States,US,False,strict,Private room,2016,$165 ,$33 ,3,29.0,5/20/2019,1.02,5.0,2.0,126,,
44354677,One bedroom apt in a luxury Building,6602692136,verified,Aurora,Brooklyn,Williamsburg,40.71819,-73.96531999999999,United States,US,False,flexible,Entire home/apt,2006,$79 ,$16 ,4,16.0,3/23/2018,0.54,2.0,2.0,86,,
44355229,"New, Luxury and Sunny Apartment",38401775339,unconfirmed,Maggie,Brooklyn,Clinton Hill,40.6944,-73.96606,United States,US,True,moderate,Entire home/apt,2012,$887 ,$177 ,1,1.0,5/6/2017,0.04,3.0,2.0,0,Please remove the shoes in the house.,
44355781,"private, large, sunny, calm big room",11569247440,unconfirmed,Isa,Manhattan,Washington Heights,40.85411,-73.93167,United States,US,True,moderate,Private room,2015,$225 ,$45 ,30,4.0,11/30/2018,0.15,1.0,1.0,275,,
44356334,Sunny LEGO’s Home,45768780066,unconfirmed,Maggie,Brooklyn,Clinton Hill,40.69259,-73.9665,United States,US,False,strict,Entire home/apt,2003,$399 ,$80 ,1,5.0,3/31/2019,0.19,1.0,2.0,0,"House Rules 1. Check-in is 4 pm local time. If the unit is ready earlier, we’ll let you know. Check-out is normally 11 am local time, but we’d be happy to extend it as long as we don’t have a cleaning scheduled. Just let us know.  2. All bookings require a security deposit of at least $300, which will be refunded within 7 days of your check-out. 3. For security measures we require all guests to provide proof of identification through ID verification on our own website. In order to check in we'll need a photo of your ID.  4. Our cancellation policy is as shown on our ad and defined by the site you are booking through.  5. Don’t let $300 go up in smoke. There's no smoking allowed in any Flatbook and a $300 fine for breaking this rule.  6. Unfortunately we don’t allow pets in any of our apartments. 7. Unless you’re staying in one of our specialty apartments, we don’t allow parties or excessive noise. 8. If we find the place very messy, we have to charge an extra $40 for every extra hour o",
44356886,Spectacular one bedroom Close to Park,23016291293,verified,Yaacov,Manhattan,Upper East Side,40.777429999999995,-73.94977,United States,US,False,strict,Entire home/apt,2008,$180 ,$36 ,31,4.0,4/12/2019,0.23,1.0,33.0,338,We except you to clean up after yourself and generally be respectful. Smoking should happen outside the house.,
44357438,90 Washington St. 1 BR furnished,29677300807,unconfirmed,Raymond,Manhattan,Financial District,40.708290000000005,-74.01405,United States,US,False,flexible,Entire home/apt,2022,$557 ,$111 ,30,1.0,8/13/2017,0.04,5.0,10.0,340,,
44357991,Luxury 2-bedroom apartment in Harlem,40033207199,unconfirmed,Nicole,Manhattan,Harlem,40.809259999999995,-73.95419,United States,US,False,moderate,Entire home/apt,2011,$165 ,$33 ,4,8.0,4/12/2019,0.74,5.0,1.0,42,"House Rules 1. Check-in is 4 pm local time. If the unit is ready earlier, we’ll let you know. Check-out is normally 11 am local time, but we’d be happy to extend it as long as we don’t have a cleaning scheduled. Just let us know.  2. All bookings require a security deposit of at least $300, which will be refunded within 7 days of your check-out. 3. For security measures we require all guests to provide proof of identification through ID verification on our own website. In order to check in we'll need a photo of your ID.  4. Our cancellation policy is as shown on our ad and defined by the site you are booking through.  5. Don’t let $300 go up in smoke. There's no smoking allowed in any Flatbook and a $300 fine for breaking this rule.  6. Unfortunately we don’t allow pets in any of our apartments. 7. Unless you’re staying in one of our specialty apartments, we don’t allow parties or excessive noise. 8. If we find the place very messy, we have to charge an extra $40 for every extra hour o",
44358543,Cozy private on Bedford Avenue,43577945283,verified,Will,Brooklyn,Williamsburg,40.714040000000004,-73.96119,United States,US,False,strict,Private room,2020,"$1,036 ",$207 ,1,2.0,2/13/2017,0.07,1.0,2.0,0,Please be respectful to the other roommate and clean after yourselves. We love this place and we want guests to have the same experience you have when they arrive.,
44359095,2 Bed 2 Bath Close to Park pool In Building,64155384064,verified,Yaacov,Manhattan,Upper East Side,40.7771,-73.94996,United States,US,False,flexible,Entire home/apt,2005,$54 ,$11 ,31,5.0,6/16/2019,0.34,1.0,33.0,289,1) No Smoking in property!!!  2) Do not slam doors!!! Close lightly Please!!! 3) No Shoes in house (except slippers) 4) Quiet down AFTER 10PM.,
44359648,2 Bed 1 Bath Close to Park,70401516115,unconfirmed,Yaacov,Manhattan,Upper East Side,40.77898,-73.94983,United States,US,False,flexible,Entire home/apt,2004,$926 ,$185 ,31,7.0,4/13/2019,0.26,5.0,33.0,331,,
44360200,2 Bed 2 Bath Close To Park Pool in building,66460629165,verified,Yaacov,Manhattan,Upper East Side,40.77832,-73.94991,United States,US,False,flexible,Entire home/apt,2003,$386 ,$77 ,31,10.0,6/12/2019,0.48,5.0,33.0,351,- No excess noise after 11pm. - No recreational drugs. - No open flames.,
44360752,Beautiful Large Private Apt in Amazing Neighbrhood,13548439041,unconfirmed,Sofia,Queens,Ditmars Steinway,40.771029999999996,-73.91409,United States,US,False,flexible,Entire home/apt,2017,"$1,086 ",$217 ,2,6.0,5/27/2019,0.21,3.0,1.0,176,,
44361304,"Spacious, Sunny Room right by the Subway",29261279889,verified,Natalie,Brooklyn,Prospect Heights,40.677620000000005,-73.97097,United States,US,False,moderate,Private room,2010,"$1,053 ",$211 ,2,0.0,,,5.0,1.0,0,"Orderly house and we want to keep it this way Bathrooms don't have high traffic as we agree to take shower before bed and not in the morning Everyone picks up after themselves No disturbance of any kind greatly appreciated:) but ASK ME (not other guests) questions any time you need/want to know something or unsure about how to do things, etc. Emails is the best way to communicate. When talking on the phone, please do it in your room with door closed Please walk calm, don't run the stairs, as it reduce the noise Close all doors gently please Non-smoker only Guests will be liable for any damages they caused: inspect the room upon arrival and sign the report Only food items can be placed into the kitchen sink compost disposal No smoking anywhere in/out of the house No perfume/cologne, scented laundry detergent allowed Doing laundry in a sink/bath not allowed Guests/visitors are not permitted Rescued/injured animals can be brought in for further assistance",
44361857,The Most Amazing Duplex Apt w/ Outdoor Space in BK,8575759104,unconfirmed,Ryan,Brooklyn,Sunset Park,40.66135,-73.98841,United States,US,False,flexible,Entire home/apt,2016,$546 ,$109 ,30,2.0,5/2/2017,0.07,4.0,1.0,337,,
44362409,Charming Brooklyn Heights Abode,82222254170,unconfirmed,Michi,Brooklyn,Brooklyn Heights,40.70081,-73.99503,United States,US,True,flexible,Entire home/apt,2020,"$1,017 ",$203 ,25,12.0,5/1/2019,0.42,4.0,1.0,1,No guests/visitors Storage not provided Limited number of things allowed:one-two suitcases The house is quiet and we want to keep it this way.  Please pick up after yourself and please keep toilet bowl and shower clean Toilet must be closed when not in use It is requested to take shower and do shaving before bed and keep morning bathroom time to the minimum: others are waiting  Additional toilet/sink is on the first floor.  No disturbance: please walk slowly on the stairs Keep phone conversation inside your room without using computer speakers,
44362961,Nice Room in Manhattan,52200050953,verified,Lyuda,Manhattan,East Harlem,40.78568,-73.94868000000001,United States,US,False,flexible,Private room,2005,$300 ,$60 ,1,18.0,6/15/2019,0.68,1.0,1.0,357,"Please expect to share the apartment with guests having various backgrounds. Be respectful and decent, also enjoy interacting with each other. Please dress descent in the house especially in and out of the shower.",
44363514,Wonderful 1BR in ideal Williamsburg location,27181849539,unconfirmed,Christie,Brooklyn,Williamsburg,40.7097,-73.95411,United States,US,False,moderate,Private room,2020,$589 ,$118 ,2,31.0,1/3/2019,1.05,2.0,1.0,40,No pets. No smoking.,
44364066,Beautiful Bright Apartment. 30 Mins to Manhattan.,13045110281,verified,Nikita,Brooklyn,Sunset Park,40.65729,-73.99916999999999,United States,US,False,flexible,Entire home/apt,2003,$874 ,$175 ,2,59.0,7/31/2018,2.03,1.0,1.0,0,"There will be a small lockbox at the building entrance (on your left side if you are facing the door). The code for this lockbox will be send to you after you have confirmed your reservation. Inside the lockbox you will find 2 keys, one that works for both of the building doors ,and another for the apartment's door).  NO smoking. *We are not responsible for any accidents, injuries, or illness that occurs while on the premises; or for the loss of guests' personal belongings or valuables. By accepting this reservation, it is agreed that all guests are expressly assuming the risk of any harm to themselves arising from their use of the premises or to others whom they invite to use the premises.",
44364618,Charming Ground Floor,13714290550,verified,Joe,Queens,Rego Park,40.72651,-73.86173000000001,United States,US,False,flexible,Entire home/apt,2016,"$1,199 ",$240 ,1,101.0,6/20/2019,3.47,4.0,2.0,74,,
44365171,1 Bedroom near Columbia University,91097103076,unconfirmed,Devin,Manhattan,Morningside Heights,40.81037,-73.95833,United States,US,True,moderate,Private room,2022,$617 ,$123 ,5,32.0,10/24/2018,1.2,1.0,1.0,0,,
44365723,Beauty Brooklyn 2BR close to trains 30+ days only,74744214456,verified,Sara Kate,Brooklyn,Bedford-Stuyvesant,40.683240000000005,-73.95174,United States,US,False,strict,Entire home/apt,2005,$902 ,$180 ,30,67.0,6/20/2019,2.43,4.0,1.0,360,,
44366275,Charming Light-Filled Apartment in Boerum Hill,19124260586,unconfirmed,Carly,Brooklyn,Boerum Hill,40.68482,-73.98302,United States,US,True,moderate,Entire home/apt,2013,$161 ,$32 ,3,19.0,7/1/2019,0.65,1.0,1.0,7,,
44366827,Williamsburg stylish home!,70739406788,verified,Ja,Brooklyn,Williamsburg,40.70881,-73.9468,United States,US,False,flexible,Entire home/apt,2012,$571 ,$114 ,3,53.0,7/6/2019,1.97,4.0,1.0,110,,
44367380,Cozy private bedroom in Bedford Stuyvesant,44996705677,verified,Clotilde & Nicolas,Brooklyn,Bedford-Stuyvesant,40.68533,-73.91941,United States,US,False,strict,Private room,2007,$910 ,$182 ,2,22.0,5/20/2019,0.83,2.0,1.0,51,"Nothing unusual, I expect that you clean after yourself (bathroom, kitchen...).  The building is calm, so no loud music or parties is allowed. Check-in time on week days will be limited to non-business hours (after 6pm).  Check-out time is whenever you want, unless I've other guest that are arriving.",
44367932,"Cute one bedroom apt. in Greenpoint, Brooklyn.",93074539884,verified,Greg,Brooklyn,Greenpoint,40.725559999999994,-73.94368,United States,US,True,strict,Private room,2004,$750 ,$150 ,3,64.0,6/10/2019,2.24,1.0,1.0,162,1) No Smoking in property!!!  2) Do not slam doors!!! Close lightly Please!!! 3) No Shoes in house (except slippers) 4) Quiet down AFTER 10PM.,
44368484,"Big bedroom in Astoria, 20 min from Central Park",79227901124,verified,Costas,Queens,Astoria,40.76882,-73.92793,United States,US,False,flexible,Private room,2004,$110 ,$22 ,3,23.0,12/31/2018,0.81,5.0,1.0,23,"House Rules 1. All bookings made at least a week before check in are fully refundable if cancelled within 24 hours of booking. After this, you will receive a 50% refund if you cancel at least 7 days before the start of your trip. 2. Check-in time is any time after 4 pm local time. If the unit is ready earlier, we’ll let you know. Check-out is normally 11 am local time, but we’d be happy to extend it as long as we don’t have a cleaning scheduled. Just let us know.  3. All bookings require a security deposit of at least $300. 4. For security measures we require all guests to provide proof of identification through ID verification on our own website. In order to check in, we'll need a photo of your ID.  5. Don’t let $300 go up in smoke. There's no smoking allowed in any Flatbook and a $300 fine for breaking this rule.  6. Unfortunately we don’t allow pets in most of our apartments. 7. Unless you’re staying in one of our specialty apartments, we don’t allow parties or excessive noise. 8. I",
44369037,Spacious Studio in E Flatbush,44155225647,unconfirmed,Vanessa,Brooklyn,East Flatbush,40.63844,-73.92868,United States,US,True,strict,Entire home/apt,2013,$827 ,$165 ,1,117.0,6/19/2019,3.99,3.0,1.0,60,"The (URL HIDDEN) use of tobacco/smoking/substances of abuse (including alcohol) on the property...quiet during night (you can go in and out as you like, just of course be quiet when we might be sleeping, as we try to be if coming home late when you might be in bed)...tell us a bit about yourself if you like and pls ask us about anything we might be able to tell you about locally/perhaps assist with...contact us when you're here with any questions!  We particularly dislike jokes having to do with avocados.  :   )  Do sign our map of where you're from. Some more room/house use points: ->  If you need it before we actually meet and show you, the bathroom is upstairs; feel free to get water for your use from bathroom faucet (it's fine to drink here, and in most of the US.  Bottled water is rarely different than usual US tap water, with the bottling craze a big drain on resources, to be actively eschewed for the sake of our Mother Earth...). ->  If you need to borrow a towel, there should b",
44369589,Victorian Sanctuary in a Historic Brownstone,32910788603,unconfirmed,Jacob,Manhattan,Harlem,40.80769,-73.95505,United States,US,False,strict,Private room,2016,"$1,142 ",$228 ,1,95.0,6/17/2019,3.93,5.0,5.0,224,"• No smoking, pets, or unannounced guests. • Respect the check-out time of 11:00 AM. If you have special requests, discuss with us ahead of time! • Clean the kitchen/wash dishes after use. • Keep a reasonable volume after 11:00 PM & before 8 AM",
44370141,Brooklyn Brownstone parlor living with full A/C,91385598331,unconfirmed,Jeremy,Brooklyn,Prospect Heights,40.68125,-73.97236,United States,US,True,moderate,Entire home/apt,2019,$854 ,$171 ,2,4.0,5/20/2019,0.15,2.0,1.0,179,"Please try to be mindful/aware of your actions and their effect on others No disturbance is greatly appreciated:) When talking on the phone, please do so only in your room with door closed:) unless it's an emergency Please walk, don't run the stairs (the slower you walk the less noise there is) Close all doors gently please No smoking anywhere in or out of the house If you tell me you stayed with friends who smoked as a reason for the smell, it will not matter No perfume/cologne, scented laundry detergent allowed (suitable product provided, just ask if needed) Guests/visitors not permitted",
44370694,Comfortable Space in Heart of Astoria,26902145578,verified,Cliff,Queens,Astoria,40.76625,-73.92447,United States,US,True,flexible,Shared room,2021,"$1,184 ",$237 ,30,3.0,3/20/2017,0.1,3.0,1.0,0,1) No Smoking in property!!!  2) Do not slam doors!!! Close lightly Please!!! 3) No Shoes in house (except slippers) 4) Quiet down AFTER 10PM.,
44371246,Warm and Cozy.,59984195089,unconfirmed,Christopher,Queens,Fresh Meadows,40.742020000000004,-73.78820999999999,United States,US,True,moderate,Private room,2015,$138 ,$28 ,1,18.0,9/1/2017,0.61,1.0,2.0,0,,
44371798,Nolita Bohemian Charmer,87781370676,verified,Anna,Manhattan,Nolita,40.72078,-73.99473,United States,US,False,moderate,Private room,2019,$890 ,$178 ,10,2.0,4/25/2018,0.09,1.0,1.0,35,,
44372350,Large 2Br on W71st & Columbus Feb 19-28,68853372749,unconfirmed,Julie,Manhattan,Upper West Side,40.77673,-73.98011,United States,US,True,strict,Entire home/apt,2007,$354 ,$71 ,5,0.0,,,3.0,1.0,0,"You will meet a clean apartment, please leave it clean  No Smoking please. Sorry, but NO PETS",
44372903,Cozy Bed-Stuy Getaway!,34524844226,verified,Hadass,Brooklyn,Bedford-Stuyvesant,40.69175,-73.94447,United States,US,False,flexible,Private room,2017,$261 ,$52 ,2,24.0,6/23/2019,0.83,2.0,3.0,99,,
44373455,"Artist room in the heart of Bushwick, Brooklyn NY",36155459736,verified,Prashant,Brooklyn,Bushwick,40.69482,-73.91165,United States,US,False,moderate,Private room,2003,$967 ,$193 ,1,1.0,2/9/2017,0.03,5.0,1.0,0,,
44374007,"Modern,Elegant,Private,with parking spot,safe area",52110974305,unconfirmed,Safa,Brooklyn,Fort Hamilton,40.62203,-74.0303,United States,US,False,strict,Entire home/apt,2015,$726 ,$145 ,1,116.0,6/27/2019,3.99,3.0,1.0,242,"House Rules 1. Check-in is 4 pm local time. If the unit is ready earlier, we’ll let you know. Check-out is normally 11 am local time, but we’d be happy to extend it as long as we don’t have a cleaning scheduled. Just let us know.  2. All bookings require a security deposit of at least $300, which will be refunded within 7 days of your check-out. 3. For security measures we require all guests to provide proof of identification through ID verification on our own website. In order to check in we'll need a photo of your ID.  4. Our cancellation policy is as shown on our ad and defined by the site you are booking through.  5. Don’t let $300 go up in smoke. There's no smoking allowed in any Flatbook and a $300 fine for breaking this rule.  6. Unfortunately we don’t allow pets in any of our apartments. 7. Unless you’re staying in one of our specialty apartments, we don’t allow parties or excessive noise. 8. If we find the place very messy, we have to charge an extra $40 for every extra hour o",
44374560,Very Spacious One Bedroom Apt in Private Townhouse,97370287445,verified,Demettre,Manhattan,West Village,40.73452,-74.00825,United States,US,True,flexible,Entire home/apt,2005,$613 ,$123 ,2,28.0,5/4/2018,1.0,2.0,1.0,0,"House Rules 1. All bookings made at least a week before check in are fully refundable if cancelled within 24 hours of booking. After this, you will receive a 50% refund if you cancel at least 7 days before the start of your trip. 2. Check-in time is any time after 4 pm local time. If the unit is ready earlier, we’ll let you know. Check-out is normally 11 am local time, but we’d be happy to extend it as long as we don’t have a cleaning scheduled. Just let us know.  3. All bookings require a security deposit of at least $300. 4. For security measures we require all guests to provide proof of identification through ID verification on our own website. In order to check in, we'll need a photo of your ID.  5. Don’t let $300 go up in smoke. There's no smoking allowed in any Flatbook and a $300 fine for breaking this rule.  6. Unfortunately we don’t allow pets in most of our apartments. 7. Unless you’re staying in one of our specialty apartments, we don’t allow parties or excessive noise. 8. I",
44375112,Midsize room in Queens.,44676162700,verified,Berat,Queens,Rego Park,40.727270000000004,-73.86223000000001,United States,US,False,strict,Private room,2013,"$1,146 ",$229 ,1,59.0,5/19/2019,2.01,2.0,3.0,89,Please don't use the washer and dryer after 10pm or before 8am!,
44375664,Cozy private room in Bedstuy,6412244411,unconfirmed,Stephen,Brooklyn,Bedford-Stuyvesant,40.6932,-73.95519,United States,US,False,flexible,Private room,2007,$794 ,$159 ,1,1.0,2/11/2017,0.03,3.0,1.0,89,,
44376217,Large private BR in East Harlem near Central Park,96939933803,unconfirmed,Ceilidh,Manhattan,East Harlem,40.79149,-73.94658000000001,United States,US,False,moderate,Private room,2005,"$1,107 ",$221 ,5,0.0,,,4.0,1.0,0,Please be respectful of other guests No Pets and No Smoking No loud music or noise after 10 PM,
44376769,Cozy East Village Room w/Bonus Cats,69610270173,unconfirmed,Lyra,Manhattan,East Village,40.7265,-73.98278,United States,US,False,moderate,Private room,2018,$359 ,$72 ,3,76.0,6/21/2019,2.59,5.0,1.0,25,- Additional charge for extra guests - No Smoking! - No pets,
44377321,Luxury building in Fort Greene.,40574689845,unconfirmed,Nathan,Brooklyn,Clinton Hill,40.69088,-73.96653,United States,US,True,flexible,Entire home/apt,2014,$886 ,$177 ,1,0.0,,,4.0,1.0,26,,
44377873,"Funky 3 Bedroom Duplex in hip Greenpoint, Brooklyn",68373826123,verified,Michael,Brooklyn,Greenpoint,40.728809999999996,-73.95817,United States,US,True,moderate,Entire home/apt,2008,$847 ,$169 ,2,35.0,9/15/2017,1.19,2.0,2.0,0,"- Non-smoker - No cologne/perfumed spray use - Please take shower before bed to avoid morning rush - Take off street shoes and place on rack, - Please bring slippers or ask me for a pair - Recycling and reusable shopping bag use (provided) - Limit things to bring in: 1-2 suitcases OK - Mailing address not to be shared with anyone; you will be charged $200 if you do",
44378426,"Classic Brownstone in Williamsburg, BK W/ Backyard",89962106956,verified,Joseph,Brooklyn,Williamsburg,40.71247,-73.96155,United States,US,True,moderate,Entire home/apt,2015,$835 ,$167 ,3,15.0,7/29/2018,0.55,1.0,1.0,0,,
44378978,Perfect 1 Bedroom in Heart of Lower East Side,24431815805,verified,Christopher,Manhattan,Lower East Side,40.72085,-73.98895,United States,US,False,strict,Entire home/apt,2005,$315 ,$63 ,3,67.0,6/19/2019,3.35,3.0,1.0,149,We like quirt. So please dont hold party at night.,
44379530,UES oasis,65327302600,verified,Karlyn,Manhattan,Upper East Side,40.77428,-73.95363,United States,US,True,strict,Private room,2012,$966 ,$193 ,4,0.0,,,5.0,1.0,0,,
44380083,Big exposed brick room in The East Village,84904250472,verified,Emily,Manhattan,East Village,40.72429,-73.98784,United States,US,True,flexible,Private room,2013,$561 ,$112 ,90,0.0,,,2.0,1.0,173,"Please, No shoes allowed. There's a mat for them, just inside the door.",
44380635,Beautiful Private Bedroom in Bronx Apartment,35573824727,verified,Figgins,Bronx,Fordham,40.85615,-73.90077,United States,US,True,flexible,Private room,2004,$743 ,$149 ,3,7.0,5/9/2019,0.79,2.0,1.0,126,"House Rules 1. Check-in is 4 pm local time. If the unit is ready earlier, we’ll let you know. Check-out is normally 11 am local time, but we’d be happy to extend it as long as we don’t have a cleaning scheduled. Just let us know.  2. All bookings require a security deposit of at least $300, which will be refunded within 7 days of your check-out. 3. For security measures we require all guests to provide proof of identification through ID verification on our own website. In order to check in we'll need a photo of your ID.  4. Our cancellation policy is as shown on our ad and defined by the site you are booking through.  5. Don’t let $300 go up in smoke. There's no smoking allowed in any Flatbook and a $300 fine for breaking this rule.  6. Unfortunately we don’t allow pets in any of our apartments. 7. Unless you’re staying in one of our specialty apartments, we don’t allow parties or excessive noise. 8. If we find the place very messy, we have to charge an extra $40 for every extra hour o",
