47620427,Manhattan: 80's upper east side - entire apartment,50726684386,unconfirmed,Diana,Manhattan,Upper East Side,40.772870000000005,-73.95291999999999,United States,US,True,moderate,Entire home/apt,2021,$930 ,$186 ,31,1,10/18/2016,0.03,5,1,338,"House quiet hours are from 10 pm to 8 am.  We ask guests to simply be respectful and mindful that there are others living downstairs.  We also ask guests to remember that although you will have your own private space, this is not a hotel or even a room for rent, it is a private home that we will be sharing.  As such, we ask you to treat the apartment and its' contents as any guest would in a private home and to keep it clean and leave it as you find it.  There are no overnight guests in our home other than those on the actual reservtion. If there is a last minute situation, please check with us first.  There are no pets or smoking anywhere on the premises inside or out, or any other open flames.",
47620979,Super-cute apartment in Harlem!,9850772784,unconfirmed,Cleo,Manhattan,Harlem,40.83038,-73.94530999999999,United States,US,False,flexible,Private room,2005,$469 ,$94 ,1,2,4/26/2016,0.05,2,1,386,"Quiet time (including TV sound turned low) at 9:30 PM, though guests, of course, can come and go before and after that. Just be respectful that this is also a house where we live and work. Also, no smoking and no pets - thanks.",
47621531,Central Park 2BR Luxury building~24H DM Newly Reno,22227177345,unconfirmed,Host,Manhattan,Midtown,40.766870000000004,-73.98273,United States,US,True,strict,Entire home/apt,2004,$995 ,$199 ,30,2,12/11/2016,0.06,2,39,189,Respect our home and our house is your house. Checkout is 11 am at the end of your stay. You are welcome to leave your bags for the day. Please let us know when you plan to arrive. Depending on circumstances we can be very flexible.,
47622084,Spacious & sunny room in Brooklyn!,13639013129,unconfirmed,Afnan,Brooklyn,Crown Heights,40.6718,-73.94266,United States,US,True,moderate,Private room,2018,$192 ,$38 ,2,2,3/23/2016,0.05,5,1,331,"Please do not let any of the animals outside! Quiet hours are from 10 pm - 6:30 am on weekdays, 11 pm - 8:30 am on weekends. Please be considerate and clean up after yourself in the kitchen and bathroom, as they are shared. We use the shower in the shared bathroom, so we appreciate it if you would refrain from lingering there in the mornings. No smoking allowed anywhere on the premises.",
47622636,Chill place near subway/park/river.,14062766202,verified,Mo,Manhattan,Upper West Side,40.7939,-73.97404,United States,US,True,flexible,Private room,2007,$203 ,$41 ,3,2,4/15/2016,0.05,1,1,74,"We hope you will be nice to the dogs, quiet in your comings and goings and respectful of our Eco, vegetarian ways. Please take off your shoes when you come in and clean up after yourself.",
47623188,RENOVATED/BEST LOCATION in MIDTOWN,49152485680,unconfirmed,Marta,Manhattan,Midtown,40.759209999999996,-73.97361,United States,US,True,moderate,Private room,2010,"$1,090 ",$218 ,3,167,6/15/2019,4.42,1,2,269,Please be respectful of my things! I have a lot of stuff that I have collected over the years. Absolutely NO smoking.  This is a really relaxing space and the neighbors are all really cool.  -Pets are allowed,
47623741,Large (clean) private bedroom in Crown Heights,87172787304,unconfirmed,Dominic,Brooklyn,Crown Heights,40.67634,-73.94133000000001,United States,US,False,flexible,Private room,2022,$270 ,$54 ,30,0,,,3,1,36,Please be mindful after 23:00 in the kitchen or bathroom.,
47624293,Sunny & Spacious 1br Lower East Side Apartment,8143571597,unconfirmed,Peter,Manhattan,Chinatown,40.716590000000004,-73.98949,United States,US,True,moderate,Entire home/apt,2018,$266 ,$53 ,3,92,7/6/2019,2.28,5,1,-5,,
47624845,Cute 1bd w/balcony E Williamsburg,12678235164,unconfirmed,Therese,Brooklyn,Williamsburg,40.71946,-73.94193,United States,US,True,flexible,Entire home/apt,2011,$776 ,$155 ,30,42,6/29/2018,1.06,4,1,267,,
47625397,Private Room - One of a kind chance in East Harlem,93315470613,verified,Ari,Manhattan,East Harlem,40.79712,-73.93469,United States,US,False,flexible,Private room,2022,$801 ,$160 ,6,14,6/3/2019,0.35,3,1,29,1) We live in a quiet neighborhood so no loud noise after 10:00 pm.  2) No outside guests after 10:00 pm. 3) No overnight guests not listed on the reservation.,
47625950,Large 1br in central Nolita / SoHo,15212886710,unconfirmed,Noah,Manhattan,Nolita,40.7219,-73.99669,United States,US,True,moderate,Entire home/apt,2017,$787 ,$157 ,5,5,10/17/2016,0.12,4,1,416,,
47626502,Cozy Loft in Flushing,92609698789,verified,Erjon,Queens,Flushing,40.75485,-73.82138,United States,US,True,moderate,Entire home/apt,2009,$815 ,$163 ,3,1,3/25/2016,0.02,1,1,368,No smoking please. Sorry but no pets. No drinking to excess. No drugs. No children or guests under 21. ,
47627054,Superb Steps away from Union Square,57543835281,verified,Joseph,Manhattan,Gramercy,40.7339,-73.98523,United States,US,True,strict,Private room,2004,$389 ,$78 ,1,0,,,3,1,330,"All outside doors including door to the backyard are to remain closed and locked at all times.   No smoking in any area including backyard and front porch. Quiet hours are from 10 pm to 8 am. 11:30 on weekend.  No parties or guests allowed in the property other than people who book the room.  No cooking. Cold foods, salads, sandwiches, microwaveable food only.  Clean after yourself.  Lost keys replacement $100 (to replace lock)",
47627607,Spacious duplex in townhouse.,8034049803,verified,Maria,Brooklyn,Crown Heights,40.675779999999996,-73.92730999999999,United States,US,True,moderate,Entire home/apt,2015,$640 ,$128 ,7,0,,,1,1,286,"Check-in and check-out times are flexible. In general, afternoon/evening check-ins and morning/early afternoon check-outs are preferred. Guests are expected to be respectful and independent.  Guests are welcome to use the kitchen, and are asked to clean up after themselves.",
47628159,Colorfull apart in NY.,23983992256,unconfirmed,Tida,Manhattan,East Harlem,40.78687,-73.94542,United States,US,True,flexible,Entire home/apt,2019,$358 ,$72 ,5,35,7/1/2019,1.27,2,2,204,,
47628711,"Cozy 1 Bedroom in Bay Ridge, NYC",61428959218,verified,Melissa,Brooklyn,Bay Ridge,40.62637,-74.02989000000001,United States,US,False,strict,Entire home/apt,2004,$140 ,$28 ,4,2,10/23/2017,0.09,1,1,329,"No smoking inside. Be tidy, we don't have a maid so treat our house like you'd want us to treat yours, simple really. Don't throw a ""rager"". Be respectful.",
47629264,"Comfy,  Convenient and a Balcony!",8347690801,verified,Hannah,Brooklyn,Crown Heights,40.675090000000004,-73.9572,United States,US,True,moderate,Entire home/apt,2016,$179 ,$36 ,2,0,,,2,1,79,,
47629816,Modern Condo in Heart of Harlem,15105758798,verified,Fma,Manhattan,East Harlem,40.79922,-73.94677,United States,US,False,moderate,Private room,2017,$843 ,$169 ,3,0,,,2,2,360,THIS IS A NON-SMOKING RESIDENCE. NO Children under the age of 16  Smoking is permitted on the outside front porch deck only. Quiet hours are from 11:00 p.m. - 7:00 a.m. No pets allowed. Be respectful of your neighbors.,
47630368,Prime Williamsburg 2 Balcony & Roof,10070627844,verified,Emily,Brooklyn,Williamsburg,40.70997,-73.9647,United States,US,False,flexible,Entire home/apt,2005,$396 ,$79 ,1,1,3/13/2016,0.02,5,1,424,"Shoes are removed at the door to keep the house clean; slippers will be provided.  Guests should be polite, courteous and respectful. Guests seeking to book 5 days or more must have a completed profile, at least three verifications and at least two reviews and/or references.  Exceptions to this policy may be granted individually as warranted.  Please write to inquire. There is no smoking allowed on the property. This is an environmentally friendly home and guests are encouraged to be sensitive to their use of natural resources.  For example, twenty-minute long showers are discouraged.",
47630920,Beautiful Apartment in Chelsea,1894433968,verified,Robin,Manhattan,Chelsea,40.741609999999994,-74.00161999999999,United States,US,False,moderate,Private room,2016,$852 ,$170 ,1,0,,,5,1,297,"Thanks for not smoking and leaving your pets at home! Thanks for keeping the house locked. Thanks for not throwing parties. And... all of the usual stuff that is just good common sense like using coasters and place mats and returning the apartment to the way it looked when you arrived. There is no parking in the driveway. At the end of your stay, please strip the beds and put the sheets in the pantry or on the bathroom floor. Towels can be put with the sheets. Trash and recycling pick up is on Tuesdays. If you are staying through a Tuesday, please put your garbage and recycling outside in the appropriate barrels Monday night or by 7:00 am on Tuesdays. THANKS!",
47631473,"Cheerful, large 3BR w/ yard! Perfect for families!",89619486715,unconfirmed,Robina,Brooklyn,Sunset Park,40.66052,-73.9939,United States,US,True,moderate,Entire home/apt,2015,$841 ,$168 ,4,1,8/12/2016,0.03,2,1,153,We hope you’ll enjoy our Boston home and that you will care for it as we do. We do not allow pets or smoking in the house.,
47632025,Charming Upper East Side priv. room + private bath,58115637817,verified,Gautam,Manhattan,Upper East Side,40.769729999999996,-73.9566,United States,US,False,flexible,Private room,2014,$288 ,$58 ,5,16,6/29/2019,0.4,2,2,165,"Please do not rent this house if you plan to party. This is a quiet house in a quiet neighborhood. Other than that, we are pretty laid back.",
47632577,In the Heart of Williamsburg,22642219984,unconfirmed,Ashley,Brooklyn,Williamsburg,40.72005,-73.95676999999999,United States,US,True,moderate,Private room,2010,$239 ,$48 ,1,1,3/30/2016,0.03,1,1,323,"Non Smoking, No illicit Drug Usage. Keep loud music to a minimum. Soiled shoes please keel outside. Thank you.",
47633130,1 Bedroom Apt East Village/USQ,66013420597,unconfirmed,Charles,Manhattan,East Village,40.72895,-73.98558,United States,US,False,moderate,Entire home/apt,2008,$236 ,$47 ,1,0,,,4,1,219,- Quiet hours from 10 p.m - 7 a.m. - No loud parties or events - No illegal substance or activity,
47633682,Room - Manhattan! Walking distance to Central Park,29452883229,unconfirmed,Val,Manhattan,Upper East Side,40.769909999999996,-73.95145,United States,US,True,strict,Private room,2004,$533 ,$107 ,1,38,6/8/2019,0.95,4,2,202,"You will be sharing a bathroom, so you must be considerate of time spent in the bathroom in the morning when getting ready. If you use the kitchen, please put the dirty cups, bowls, plates, and silverware in the dirty dishes tub, and hand wash all of the pots, pans, and cooking tools you use. Please clean up any mess you may have made. Remember to turn on the fan when using the stove or oven so the fire alarm does not go off from the steam! Please only smoke outside, away from the apartment building, and dispose of your cigarettes responsibly. Checkout: Checkout is at 11:00 am, please inquire if you would like to check out later or leave your bags with us for the day. If we are not awake/home when you leave, please leave the passes on the desk in your room, lock the front door behind you, and put your keys in the lock box behind the front stair case.",
47634234,Bright bedroom in Soho / roof access,41492761045,unconfirmed,Vinciane,Manhattan,SoHo,40.72705,-74.00314,United States,US,True,strict,Private room,2013,$235 ,$47 ,2,53,4/8/2019,1.42,3,2,325,"Please only smoke across the street, (smoke travels) there's a lovely green space and a bus shelter if raining Please, no bikes on the fence in front of the house. There's plenty of places to park the bikes. I have a wonderful dog, he's submissive with people, unfortunately aggressive with other dogs. I'm unable to welcome other dogs in the space.",
47634787,Manhattan Gem-Space & Convenience,92471134819,verified,Jennifer,Manhattan,Washington Heights,40.8348,-73.94067,United States,US,False,flexible,Entire home/apt,2012,"$1,034 ",$207 ,2,119,6/30/2019,2.95,2,1,37,"No candles. Close and lock windows when you leave the house. Please clean up after yourself in the bathroom and the kitchen. And have fun! If you want to have an event or party, we are open to that, but we should check in about that before you make plans.",
47635339,Hudson COLUMBIA PRESBYTERIAN MED CTR * Studio Apt*,88937082958,unconfirmed,Juliana,Manhattan,Washington Heights,40.84077,-73.93924,United States,US,True,flexible,Entire home/apt,2020,$621 ,$124 ,30,6,11/10/2018,0.17,1,34,38,You have a private room but sounds should be moderate for me and the neighbors  Quiet at 11pm   No Pets  No Parties  No Smoking,
47635891,Clean Room in Prime Hip LES,12978552379,verified,Zachary,Manhattan,Lower East Side,40.71713,-73.98906,United States,US,False,flexible,Private room,2005,$63 ,$13 ,1,14,10/1/2016,0.35,4,1,104,"Maximum of 2 guests staying in the studio.  No smoking anywhere in or outside the property.  No pets anywhere in or outside the property.  No parties anywhere in or outside the property.  No parking on our property or in the driveways.  No frying food.  No extreme temperature settings.   Any broken house rules, including evidence of cigarette butts, ashes, odors, stained linens, damaged furniture, or missing items will result in loss of deposit. All doors must be locked, and all lights should be turned off each time you leave. We kindly ask that you respect our property and our neighbors in this wonderful community.",
47636443,COLUMBIA PRESBYTERIAN MED CTR *1 Bedroom* Apt,77291390976,verified,Juliana,Manhattan,Washington Heights,40.84098,-73.94085,United States,US,False,moderate,Entire home/apt,2021,"$1,056 ",$211 ,30,7,12/1/2018,0.18,3,34,-6,"1.Check-ins Monday – Friday will preferably only happen between 6pm – 10:30pm because we work full-time. However, exceptions can be made. If you really need to check in at another time we are flexible and can try to coordinate accordingly.   2.We are only renting the bottom floor where the private room and bathroom is. The rest of the house is off limits for short stays. If you are staying for more than 1 week and would like to have access to cooking and other areas of the house please let us know. We are pretty easy going.  3.No smoking, No animals, No house parties.  4.The maximum number of guests allowed in this room is two. (Both have to be registered on the original reservation). Surprise additional guests are not allowed.  5.We are trustworthy, clean and respectful and expect our guests to be the same.  6.This is a calm, quiet neighborhood, so we ask that guests please adjust their volumes accordingly.  7.I ask that guests leave rooms the same way they found them, making sure to ",
47636996,Sofa bed for FEMALE only on the Lower East Side,33977252021,unconfirmed,Lynn,Manhattan,Chinatown,40.715559999999996,-73.99209,United States,US,True,moderate,Shared room,2017,$744 ,$149 ,1,88,6/29/2019,5.44,1,1,316,"We live on the 3rd floor of a 3-family house, so please minimize noise for our neighbors, especially at night and when entering or exiting.  Our bedroom and office are not for guest use.",
47637548,Cozy room with queen bed in 4b,19347016694,verified,Pedro,Brooklyn,Bedford-Stuyvesant,40.68692,-73.94242,United States,US,True,moderate,Private room,2020,$52 ,$10 ,3,10,11/10/2017,0.25,2,1,326,"Please clean after yourself, wipe spilled water after using the bathroom, do not smoke in the apartment and treat the place as you would treat your home! Please let us know about pets or service animals in advance.",
47638100,Midtown East Master Bedroom,1179390426,unconfirmed,Lauren,Manhattan,Midtown,40.74512,-73.98176,United States,US,False,strict,Private room,2017,$707 ,$141 ,1,0,,,3,1,8,No smoking  Not pets  No parties or events No candles,
47638653,Bright Midtown Apartment,6663498775,verified,Calvin,Manhattan,Hell's Kitchen,40.7653,-73.98825,United States,US,True,flexible,Private room,2012,"$1,174 ",$235 ,1,1,3/19/2016,0.02,2,2,1,"You will be sharing a bathroom, so you must be considerate of time spent in the bathroom in the morning when getting ready. If you use the kitchen, please put the dirty cups, bowls, plates, and silverware in the dirty dishes tub, and hand wash all of the pots, pans, and cooking tools you use. Please clean up any mess you may have made. Remember to turn on the fan when using the stove or oven so the fire alarm does not go off from the steam! Please only smoke outside, away from the apartment building, and dispose of your cigarettes responsibly. Checkout: Checkout is at 11:00 am, please inquire if you would like to check out later or leave your bags with us for the day. If we are not awake/home when you leave, please leave the passes on the desk in your room, lock the front door behind you, and put your keys in the lock box behind the front stair case.",
47639205,Beautiful with private terrace,94133208902,unconfirmed,Emilie,Brooklyn,Park Slope,40.677640000000004,-73.97835,United States,US,False,strict,Entire home/apt,2016,$889 ,$178 ,3,4,1/2/2018,0.1,2,1,367,"We do not allow any pets on the property to protect our guests and family from allergies.  Please do not park in our driveway. You may find on-street parking available on Spring Park Ave or Rockview St. There is no smoking on the property. Please feel free to take a walk around our lovely neighborhood if you need a smoke. Otherwise we have no real ""rules"" except common courtesy please. We always want our guests to feel as much at home as possible, so feel free to do so. Should you need something or have a question, just ask! We are always happy to help. Most of all, enjoy your visit here in our studio!",
47639757,"Large, sunny room - Lower East Side",91921466340,verified,Tamir,Manhattan,Lower East Side,40.71931,-73.98393,United States,US,False,strict,Private room,2007,$651 ,$130 ,5,1,5/16/2016,0.03,2,1,161,"No smoking in the house and no late noises, please!   ",
47640310,Modern Bushwick rm perf for 1 or 2!,89460925846,verified,Allison,Brooklyn,Bushwick,40.702729999999995,-73.91565,United States,US,True,flexible,Private room,2009,$857 ,$171 ,1,0,,,5,1,291,#NAME?,
47640862,Sunny 2BR Railroad Apt. in LIC,34688405839,verified,Sarah,Queens,Long Island City,40.74493,-73.9537,United States,US,False,moderate,Entire home/apt,2011,$628 ,$126 ,1,1,7/10/2016,0.03,1,1,68,No smoking or open flames permitted on the property. No drugs.  No pets. Notify host of extra people ($10 charge per night per extra person).,
47641414,Spacious Room w private bathroom,24584017580,verified,Liz,Brooklyn,Kensington,40.63974,-73.97439,United States,US,True,moderate,Private room,2008,$607 ,$121 ,14,2,4/30/2018,0.06,2,1,68,Please treat our house as we'd treat yours: with care and respect.,
47641966,Rustic charm in BKLYN // QUEEN Bed!,39181284309,verified,Chris And Zach,Brooklyn,East Flatbush,40.64885,-73.94681,United States,US,True,moderate,Private room,2009,$556 ,$111 ,1,206,7/7/2019,5.2,4,3,177,"Please be respectful to other members of this home., no parties or loud music is permitted. You can use a porch on the back of the house. No smoking or candles is allowed inside or outside the house,  Please strip the bed and put linen and towels into laundry basket.",
47642519,Great Studio nearby Times Square!,67656645059,verified,Jay,Manhattan,Hell's Kitchen,40.76035,-73.99051999999999,United States,US,False,strict,Entire home/apt,2007,$281 ,$56 ,1,20,7/4/2019,0.5,2,1,371,- Noise to be kept to minimum level as to not to disturb others in the apartment or building between 11pm and 6:30am. - No cooking or storage of meat in the apartment (we are vegetarians) - No candles permitted  - Use the compost for non-animal organic waste and recycle all recyclables,
47643071,Comfy NYC Studio 15 Min. To Midtown,31740224110,verified,Terrence,Manhattan,Harlem,40.810320000000004,-73.95415,United States,US,True,moderate,Entire home/apt,2006,$450 ,$90 ,2,198,6/19/2019,4.87,4,1,110,,
47643623,Brick House: Unique Garden Apartment! King Bed!,34608667229,unconfirmed,Aswad,Brooklyn,Bedford-Stuyvesant,40.681740000000005,-73.91365,United States,US,False,strict,Entire home/apt,2012,$859 ,$172 ,2,40,7/1/2019,0.99,3,3,319,"We want our guests to be comfortable and enjoy not just our house but our city.  To those ends we welcome inquiries about what to do and where to go.  Our guests should feel free to use the kitchen and living room and not feel confined to ""their room"". Store your food in the fridge, eat your meal on the terrace, read a book on the couch or hammock.  We request only your general consideration of living with others.  Our one hard and fast rule is: No smoking on the property. ",
47644176,King 7,64834220912,unconfirmed,John,Brooklyn,Fort Greene,40.69413,-73.9723,United States,US,True,flexible,Entire home/apt,2021,$329 ,$66 ,2,94,6/2/2019,2.85,3,2,341,,
47644728,Luxury Apt Steps from Central Park!,7894052840,unconfirmed,Rae,Manhattan,East Harlem,40.79504,-73.94584,United States,US,True,strict,Entire home/apt,2022,$448 ,$90 ,2,4,6/5/2016,0.1,2,1,206,"Be respectable, try to keep the place clean (no wearing shoes in the house!), and no wild parties, please! No smoking, please. I only ask that you treat my home as you would treat your own! When leaving the apartment, please always lock both locks on the door. Please shut off all the lights, air conditioner, TV, etc. before you leave. Please take your shoes off inside the apartment.",
47645280,Cozy Room Astoria,72369663684,unconfirmed,,Queens,Ditmars Steinway,40.77587,-73.91775,United States,US,True,strict,Private room,2021,$713 ,$143 ,1,5,1/1/2017,0.13,3,1,135,,
47645833,"Room in Chic, Cozy Chinatown Loft",69652015913,verified,Teddy,Manhattan,Chinatown,40.71351,-73.99691999999999,United States,US,False,moderate,Private room,2010,"$1,137 ",$227 ,5,37,4/6/2019,0.91,5,2,121,,
47646385,Comfy 1 bedroom Upper East Side Apartment (82/2nd),9900371177,unconfirmed,Darren,Manhattan,Upper East Side,40.77505,-73.95357,United States,US,False,strict,Entire home/apt,2003,"$1,053 ",$211 ,1,3,3/19/2018,0.1,1,1,5,"Since it's a vegetarian house, please don't bring meat or fish into the house! Smoking outside please.",
47646937,Upper West Side 1BD with terrace,21244946361,verified,Emily,Manhattan,Upper West Side,40.77872,-73.98025,United States,US,False,flexible,Entire home/apt,2022,$495 ,$99 ,1,8,7/1/2017,0.2,2,1,294,- No shoes in apartment - No parties - Enjoy yourself!,
47647489,❤️PRIVATE ROOM❤️ Female guest only,97158795923,verified,Renuca,Queens,Jamaica,40.67667,-73.79829000000001,United States,US,True,flexible,Private room,2004,"$1,127 ",$225 ,3,11,10/15/2017,0.33,5,1,149,,
47648042,EAST RIVER VIEW~HIRISE STUDIO,13862543117,verified,Ruchi,Manhattan,Midtown,40.754529999999995,-73.96473,United States,US,False,flexible,Entire home/apt,2011,"$1,048 ",$210 ,30,0,,,4,49,391,"No smoking, no pets.",
47648594,LUXURY MURRAY HILL STUDIOS/GYM/DECK,22971825479,unconfirmed,Ruchi,Manhattan,Murray Hill,40.7471,-73.97263000000001,United States,US,False,moderate,Entire home/apt,2007,$825 ,$165 ,30,0,,,5,49,118,Our home is well cared for and loved. We would love to invite people who respect personal spaces and enjoy an exotic looking home. Please note that our home is a non-smoking home.,
47649146,Private bedroom located in the heart of Chelsea,171389871,verified,Anna,Manhattan,Chelsea,40.74118,-74.00012,United States,US,False,flexible,Private room,2005,"$1,094 ",$219 ,1,48,6/16/2019,1.8,2,2,43,"No drugs, no smoking, no pets (our dog is enough pet for us). Make sure the front door is shut securely when you come and go, as our dog Lucy likes to sneak out and explore when we're not looking! No additional guests or visitors without prior permission. If you'd like to have guests over please ask us first.",
47649699,2 Bedroom 10 Minutes from JFK Airport 2nd Floor,78446450580,unconfirmed,Iwona,Queens,Jamaica,40.6756,-73.78244000000001,United States,US,False,moderate,Entire home/apt,2011,$413 ,$83 ,1,257,6/30/2019,7.38,2,4,242,#NAME?,
47650251,Cozy upper east side studio,11138176963,verified,Brooke,Manhattan,Upper East Side,40.76769,-73.95616,United States,US,False,moderate,Entire home/apt,2009,$423 ,$85 ,1,0,,,1,1,130,"No smoking, No animals—we already have enough! No house parties. The maximum number of guests allowed in this room is one. Additional guests are not allowed unless they're just stopping in for a brief visit—still, please do clear it with me first.  I am trustworthy, clean and respectful and I expect my guests to be the same.  This is a calm, quiet neighborhood, so we ask that guests please adjust their decibels accordingly.  I ask that guests leave rooms the same way  they found them, making sure to clean up after cooking, to take hair out of the drains, and to put trash in trashcans.  Please  make yourself at home and feel free to use all my kitchen stuff.  No pets allowed. No smoking. No storage permitted outside of rented room, outside of basket and pockets on shower curtain for toiletries in bathroom that I'll  point out to you.  Guests will please keep perishables in a college-size refrigerator dedicated to their use in the kitchen.",
47650803,1BR Walkup on Upper East Side,11991223241,verified,John,Manhattan,Upper East Side,40.77697,-73.95371999999999,United States,US,False,flexible,Entire home/apt,2007,$539 ,$108 ,1,0,,,3,1,258,"We expect guests to be clean, neat and respectful. Communication is very important. No smoking indoors and no pets.",
