44277907,Cozy Bedroom in the Heart of Downtown Manhattan,65864477732,unconfirmed,Kaitlin,Manhattan,Lower East Side,40.72275,-73.98918,United States,US,True,strict,Private room,2008,"$1,020 ",$204 ,4,0.0,,,5.0,1.0,0,"No pets and no smoking (including outside near the entrance, as it sometimes blows back into the building). Please remove your shoes when entering (we have sensitive floors :)). Thank you!",
44278459,"Sunny, Quiet Oasis w/ Elevator - Close to Subway!",90703587211,unconfirmed,Mike,Manhattan,Upper East Side,40.77328,-73.94981999999999,United States,US,False,strict,Private room,2020,$383 ,$77 ,3,7.0,5/27/2019,0.24,5.0,3.0,0,"No loud parties, no extra guests, no pets, no smoking. Please treat this space with respect, especially as we have put so much care and love into designing it!",
44279012,Park Slope - Bright Spacious Sunny Room - Flexible,21825761380,verified,Isroel,Brooklyn,Windsor Terrace,40.65815,-73.9817,United States,US,True,moderate,Private room,2022,$134 ,$27 ,7,0.0,,,4.0,1.0,0,,
44279564,Big bright cozy room to call home,43864224936,verified,Bianca,Brooklyn,Windsor Terrace,40.655590000000004,-73.97797,United States,US,True,strict,Private room,2011,$690 ,$138 ,30,5.0,6/30/2019,0.18,5.0,1.0,126,"• Check-in time is 2PM. NO SMOKING, DRUGS, PETS or SHOES in the house! I love my home and like to keep it clean. No food or drink on the couch to avoid spills. Please treat it with care and tidy up after yourselves. Thank you!",
44280116,!!!Co-Housing taken to the Next Level /Flatbush/2,27298966758,verified,Valentin,Brooklyn,East Flatbush,40.644709999999996,-73.9495,United States,US,True,flexible,Shared room,2017,$385 ,$77 ,30,1.0,8/10/2018,0.09,2.0,7.0,365,,
44280669,1BR Spacious Luxury Apartment in Williamsburg BK,41434727389,verified,Michael & Hanako,Brooklyn,Williamsburg,40.71778,-73.95503000000001,United States,US,False,strict,Entire home/apt,2015,"$1,185 ",$237 ,4,7.0,4/16/2018,0.24,4.0,1.0,0,"No pets and no smoking (including outside near the entrance, as it sometimes blows back into the building). Please remove your shoes when entering (we have sensitive floors :)). Thank you!",
44281221,Room w/ terrace in house w/ backyard Williamsburg!,7844970145,verified,Valentine,Brooklyn,Williamsburg,40.70833,-73.93916,United States,US,False,flexible,Private room,2015,"$1,139 ",$228 ,12,9.0,5/27/2019,0.37,5.0,1.0,11,- I've lived here over 14  years.  Love it!  But I met a girl and moved to the burbs. You will enjoy everything about location and amenities!,
44281773,Wonderful Apartment Upper West Side Midtown,61218516281,verified,Jonathan,Manhattan,Upper West Side,40.77016,-73.98125999999999,United States,US,True,moderate,Entire home/apt,2022,$78 ,$16 ,7,0.0,,,3.0,1.0,0,"-Leave the apartment as you found it.  -Quiet time starts at 9pm. -Wearing shoes is okay, unless its raining or snowing. -Please respect us and our neighbors by not having any additional guests.  -Smoking is strictly prohibited. -No pets. -No packages may be sent to the house without host approval.",
44282326,Amazing One Bedroom Apt,42248012172,verified,Jeffrey,Brooklyn,Bedford-Stuyvesant,40.6808,-73.93753000000001,United States,US,False,strict,Entire home/apt,2019,$467 ,$93 ,30,9.0,4/27/2019,0.34,1.0,3.0,319,,
44282878,The Gramercy East,80513323641,verified,Ritchy,Manhattan,Gramercy,40.73575,-73.98,United States,US,False,moderate,Entire home/apt,2019,"$1,031 ",$206 ,2,3.0,9/29/2018,0.12,4.0,1.0,3,"We are seeking responsible and respectful guests for our unique property. Please do not smoke in the apartment, and refrain from loud noise after 11pm. Accommodations can be made for other lengths of stay, as well as for pets. Feel free to reach out with questions or concerns and we will respond within 24hrs, usually sooner. Strict cancellation policies apply, please refer to Airbnb's terms.",
44283430,quintessential modern Brooklyn loft** ONLY TONIGHT,53441966675,verified,Jeremy,Brooklyn,DUMBO,40.702870000000004,-73.98518,United States,US,True,flexible,Private room,2017,$451 ,$90 ,7,0.0,,,4.0,1.0,0,,
44283982,Private One Bedroom/5 min. walk to train,87526895938,unconfirmed,Monica,Queens,Ditmars Steinway,40.77235,-73.91789,United States,US,False,strict,Private room,2015,$184 ,$37 ,5,3.0,9/4/2017,0.11,2.0,1.0,88,,
44284535,"Large, Sunny Studio in the heart of Chelsea.",82293692850,unconfirmed,Eunice,Manhattan,Chelsea,40.74089,-74.00001999999999,United States,US,True,moderate,Entire home/apt,2021,$695 ,$139 ,2,,1/1/2019,0.13,1.0,1.0,0,,
44285087,Cute Room Perfect Downtown Location,93086962250,verified,Paulien,Manhattan,Little Italy,40.72043,-73.99706,United States,US,False,moderate,Private room,2017,$287 ,$57 ,3,0.0,,,1.0,1.0,0,,
44285639,✪ Stay Together in Style ✪ 2BR / 3 Bed ✪ Best Area,4687806004,verified,Cami,Manhattan,Lower East Side,40.72293,-73.98918,United States,US,False,moderate,Entire home/apt,2016,$898 ,$180 ,4,72.0,6/23/2019,2.94,4.0,1.0,109,,
44286192,New studio in Murray Hill,4023405278,verified,Cynthia,Manhattan,Murray Hill,40.749759999999995,-73.97444,United States,US,False,flexible,Entire home/apt,2008,"$1,007 ",$201 ,2,0.0,,,5.0,1.0,0,,
44286744,"Sunny, Modern East Village 1BR w/ 24-hr doorman",51254595274,verified,Hilary,Manhattan,East Village,40.72979,-73.98917,United States,US,True,strict,Entire home/apt,2014,$862 ,$172 ,5,29.0,6/4/2019,0.98,5.0,1.0,0,"Thank you for your reservation. By placing your reservation online you indicated that you accepted the terms and conditions which have been printed below.  Please review your reservation summary as below - then print, sign and return the agreement to:  (EMAIL HIDDEN) or fax it to (PHONE NUMBER HIDDEN) or  mail it to: Spare Suite, Inc., 119 Braintree Street, Suite 510, Boston, MA 02134, USA Upon receipt, we will send you the welcome document with check in instructions and how to get your keys. ------------------------------------------------------------------------ ------------------------------------------------------------------------ Terms of the Agreement: BOOKING AND REFUND POLICY Once booked your reservation is guaranteed for the check in and check out times and dates specified. All reservations must be paid in advance, in full for the entire period of stay.  All reservations are final, and NON REFUNDABLE UNDER ANY CIRCUMSTANCES.  If you feel you may need to cancel once booked, yo",
44287296,"! ! ! Coliving: live, work, create",11894009433,verified,Valentin,Brooklyn,East Flatbush,40.651509999999995,-73.94957,United States,US,False,moderate,Shared room,2014,$88 ,$18 ,30,0.0,,,3.0,7.0,365,,
44287849,!!!Outpost Coliving . Flatbush. Cozy shared room,50346371989,verified,Valentin,Brooklyn,Flatbush,40.64476,-73.96473,United States,US,True,strict,Shared room,2022,"$1,100 ",$220 ,30,0.0,,,2.0,7.0,365,,
44288401,Outpost Coliving. Great shared apartment Flatbush,21817675741,verified,Valentin,Brooklyn,East Flatbush,40.64136,-73.94705,United States,US,False,strict,Shared room,2005,$907 ,$181 ,30,0.0,,,1.0,7.0,365,#NAME?,
44288953,Great Bed Stuy Room Near Williamsburg & Bushwick,96097558153,verified,Ryan,Brooklyn,Bedford-Stuyvesant,40.68785,-73.94261999999999,United States,US,False,strict,Private room,2016,$319 ,$64 ,7,2.0,3/7/2017,0.07,3.0,1.0,0,,
44289505,South Williamsburg bedroom with big bay windows,8189323470,verified,Alex,Brooklyn,Williamsburg,40.70942,-73.96330999999999,United States,US,False,strict,Private room,2009,$71 ,$14 ,3,4.0,5/20/2017,0.15,5.0,1.0,0,"- Please keep the house exactly like you found it. Please don't leave a mess. Please don't leave things dirty. - If you use the bathroom, clean or wipe things down (there will be a cloth to wipe off excess water, etc.) - If you use the kitchen, please clean dishes and wipe things down as well - No guest allowed - you can meet friends at other venues - Shoes off in the apartment - please leave by the door. If you would like please bring some slippers. - Please keep things quiet after 10pm - If you smoke, you must go outside! NO smoking inside! - If you cook, turn the fan on above the stove - If you watch TV, turn it off when you are done. - Please use your common sense, and if you are not sure, ask... - Remember, this is my house - so try to treat it with respect. - if the parking pass is not returned, you will be charged the full amount of the deposit",
44290058,Double Bedroom in a Sunny Bushwick Loft,2319585966,verified,Jordan,Brooklyn,Bushwick,40.692840000000004,-73.90695,United States,US,False,moderate,Private room,2012,$853 ,$171 ,3,6.0,6/19/2017,0.2,3.0,1.0,0,,
44290610,"Comfortable, eclectic and private apartment",89665303147,unconfirmed,Philip,Brooklyn,Clinton Hill,40.68976,-73.96533000000001,United States,US,True,moderate,Entire home/apt,2011,$557 ,$111 ,2,41.0,6/27/2019,1.51,5.0,1.0,343,Please leave the room as it was when you first came.,
44291162,Hudson River Aerie,68285846840,verified,Regina,Manhattan,Harlem,40.82545,-73.95295,United States,US,True,strict,Private room,2013,$970 ,$194 ,3,10.0,6/30/2019,0.71,1.0,1.0,8,"No smoking or drugs. We try to keep the house clean, so we take off our shoes when we come in. We all work or go to grad school, so we like to keep the house clean and quiet. Absolutely no smokers, even if you smoke outside. We'd rather not have anyone in the house who brings back in the smell of smoke.",
44291715,"Bright, Beautiful 2 BD, great location UES",92692269811,unconfirmed,V.Stephan,Manhattan,Upper East Side,40.784290000000006,-73.94878,United States,US,True,moderate,Entire home/apt,2015,$236 ,$47 ,5,48.0,7/1/2019,1.73,4.0,2.0,71,Can use kitchen and either bathroom. Roommates will be at the house as well but will not be using the living during your stay. No guests permitted without prior notice and agreement. No shoes in the house and please wash all dishes promptly after use.,
44292267,Small Private Room for Rent,82084412127,verified,Masud,Brooklyn,Cypress Hills,40.686679999999996,-73.87565,United States,US,False,strict,Private room,2005,$81 ,$16 ,28,5.0,11/20/2018,0.19,5.0,4.0,326,"Professionally and to respect the artwork. This is an apartment for mature travelers, not backpackers.",
44292819,Modern Studio in the Heart of Midtown NYC!,32618915119,unconfirmed,Anthony,Manhattan,Hell's Kitchen,40.75673,-73.99361999999999,United States,US,False,flexible,Entire home/apt,2009,$997 ,$199 ,2,0.0,,,1.0,1.0,0,"Guest should do there dishes and clean after themselves. No alcohol, No drugs, No party's and most important Don't Disturb other guests!",
44293372,5* Brand New Luxury Apartment with Backyard Oasis,96735140170,verified,Joel,Manhattan,Upper West Side,40.7843,-73.98262,United States,US,True,flexible,Entire home/apt,2009,$721 ,$144 ,4,20.0,7/1/2019,0.73,1.0,1.0,290,Treat the apt as you would your own. No parties or large gatherings.,
44293924,Brooklyn Gem,57178897176,unconfirmed,Sabrina,Brooklyn,Bedford-Stuyvesant,40.68841,-73.95082,United States,US,True,moderate,Entire home/apt,2003,$877 ,$175 ,2,54.0,6/2/2019,1.91,4.0,1.0,267,Please do not smoke and be respectful of other guests.,
44294476,Prime SOHO Luxury penthouse Loft,64867458965,verified,Joe,Manhattan,NoHo,40.72569,-73.99519000000001,United States,US,False,moderate,Entire home/apt,2012,"$1,138 ",$228 ,3,51.0,6/17/2019,1.76,1.0,1.0,336,,
44295028,"Light-filled Apartment in great area, close 2 all!",53079001297,unconfirmed,Dounia,Brooklyn,Flatbush,40.63192,-73.94734,United States,US,True,moderate,Entire home/apt,2015,$343 ,$69 ,1,12.0,6/19/2017,0.43,5.0,1.0,0,"Guest should do there dishes and clean after themselves. No alcohol, No drugs, No party's and most important Don't Disturb other guests!",
44295581,NYで人気の街ﾌﾞﾙｯｸﾘﾝﾊﾟｰｸｽﾛｰﾌﾟで､暮らしてみませんか｡,47191963074,verified,Fumiko,Brooklyn,South Slope,40.66411,-73.98267,United States,US,False,moderate,Private room,2021,$95 ,$19 ,7,2.0,10/23/2017,0.09,3.0,1.0,173,"Please expect to share the apartment with guests having various backgrounds. Be respectful and decent, also enjoy interacting with each other. Please dress descently in the house especially in and out of the shower.",
44296133,!!! Beautiful private room with backyard.,13312253590,verified,Valentin,Brooklyn,East Flatbush,40.6392,-73.94731999999999,United States,US,True,moderate,Private room,2014,$780 ,$156 ,30,1.0,7/30/2017,0.04,1.0,7.0,124,,
44296685,!!! Outpost Coliving . Shared twin room,285969719,unconfirmed,Valentin,Brooklyn,East Flatbush,40.650240000000004,-73.95051,United States,US,True,moderate,Shared room,2003,$864 ,$173 ,30,2.0,4/30/2018,0.09,4.0,7.0,365,"Please pick up after yourself (remove hair after taking a shower/shaving, etc.), and make sure things are left tidy after you used bathrooms. Keep toilet seat closed so cat can't get to water. Please avoid morning rush between 6am and 10 am and take shower at night (unless you shower is literally 2 min or less). Additional toilet/sink on the first floor. Always wipe off toothpaste from sink and faucet as a courtesy to others.  Immediately notify me if something was broken or out of order or you forgot to wash a plate. Don't leave any food in your room. Proper trash disposal: recycling is very important. Rinse containers before placing into collection; all food leftovers must go inside kitchen sink for disposal. Avoid bringing in plastic bags, but if you must occasionally, please place into recycling for bags under the sink. Please tidy up  your room after departure and take care of dirty dishes. Departure after check out time billed one hundred dollars Mailing address is NOT TO be shar",
44297238,"Snug, Cozy 1 bedroom Apartment",51925179892,unconfirmed,Dwane,Brooklyn,East New York,40.658770000000004,-73.89631,United States,US,True,strict,Entire home/apt,2008,$923 ,$185 ,1,68.0,6/8/2019,2.27,2.0,1.0,364,"Quiet and clean Responsible person No bad habits Just don't steal or break anything and we are good. I would also advise not to play extremely loud music after 9pm because my roommate gets mad.  Moderately loud should be ok. -Please do not drink the alcohol and don't eat the food in the bedroom, although you are welcome to use all of the appliances including the Keurig. This is our home when we are not traveling, respect it as your own. -Strictly no smoking or parties.",
44297790,Awesome apartment close to Express Train,79406992285,verified,Federica,Manhattan,Washington Heights,40.85046,-73.94270999999999,United States,US,True,moderate,Private room,2015,$979 ,$196 ,2,0.0,,,4.0,1.0,0,,
44298342,"LRG DESIGNER STUDIO/1-BED, MIDTOWN, DOORMAN, ELEV.",80083735829,unconfirmed,Daniel,Manhattan,Midtown,40.75562,-73.96539,United States,US,True,flexible,Entire home/apt,2019,$682 ,$136 ,3,8.0,5/14/2019,0.34,2.0,2.0,0,,
44298895,"Spacious, bright room in luxury building",25659858389,verified,Tim,Brooklyn,Williamsburg,40.70669,-73.94648000000001,United States,US,True,moderate,Private room,2019,$558 ,$112 ,1,16.0,5/3/2019,0.55,3.0,1.0,7,"House Rules 1. Check-in is 4 pm local time. If the unit is ready earlier, we’ll let you know. Check-out is normally 11 am local time, but we’d be happy to extend it as long as we don’t have a cleaning scheduled. Just let us know.  2. All bookings require a security deposit of at least $300, which will be refunded within 7 days of your check-out. 3. For security measures we require all guests to provide proof of identification through ID verification on our own website. In order to check in we'll need a photo of your ID.  4. Our cancellation policy is as shown on our ad and defined by the site you are booking through.  5. Don’t let $300 go up in smoke. There's no smoking allowed in any Flatbook and a $300 fine for breaking this rule.  6. Unfortunately we don’t allow pets in any of our apartments. 7. Unless you’re staying in one of our specialty apartments, we don’t allow parties or excessive noise. 8. If we find the place very messy, we have to charge an extra $40 for every extra hour o",
44299447,Modern 1 Bedroom Condo at Midtown 45,1076376715,verified,Nadine,Manhattan,Midtown,40.75305,-73.97358,United States,US,True,flexible,Private room,2020,$752 ,$150 ,2,0.0,,,5.0,3.0,0,Keep the apartment clean,
44299999,Hotel Room at Wyndham Midtown 45,9210773112,unconfirmed,Nadine,Manhattan,Midtown,40.75373,-73.97287,United States,US,True,strict,Private room,2007,$136 ,$27 ,2,0.0,,,5.0,3.0,268,,
44300551,Entire Apartment in Hells Kitchen!,63142889908,unconfirmed,Eric,Manhattan,Hell's Kitchen,40.76318,-73.99009000000001,United States,US,False,moderate,Entire home/apt,2015,$731 ,$146 ,30,7.0,5/25/2019,0.26,2.0,1.0,204,"House Rules 1. Check-in is 4 pm local time. If the unit is ready earlier, we’ll let you know. Check-out is normally 11 am local time, but we’d be happy to extend it as long as we don’t have a cleaning scheduled. Just let us know.  2. All bookings require a security deposit of at least $300, which will be refunded within 7 days of your check-out. 3. For security measures we require all guests to provide proof of identification through ID verification on our own website. In order to check in we'll need a photo of your ID.  4. Our cancellation policy is as shown on our ad and defined by the site you are booking through.  5. Don’t let $300 go up in smoke. There's no smoking allowed in any Flatbook and a $300 fine for breaking this rule.  6. Unfortunately we don’t allow pets in any of our apartments. 7. Unless you’re staying in one of our specialty apartments, we don’t allow parties or excessive noise. 8. If we find the place very messy, we have to charge an extra $40 for every extra hour o",
44301104,Manhattan &Time Square Less than 30min 1st floor.,21739380894,verified,Devika,Queens,Sunnyside,40.73661,-73.92514,United States,US,True,moderate,Private room,2021,$791 ,$158 ,5,47.0,7/1/2019,1.61,3.0,4.0,266,"No Smoking No Loud Parties No Pets Please be respectful of noises especially at night Check-in Time: 4PM Check-out Time: 10AM Please review the guest booklet in the living room of the condo, during your arrive for detailed policy information.",
44301656,2 bed spacious/Quiet Upper Ditmars Astoria Wifi.,88261378110,verified,Concetta,Queens,Ditmars Steinway,40.76814,-73.89573,United States,US,True,strict,Entire home/apt,2004,"$1,184 ",$237 ,11,27.0,4/27/2019,0.9,2.0,2.0,212,We except you to clean up after yourself and generally be respectful. Smoking should happen outside the house. Also please do not tap on the glass terrarium or play with the ball python. It is very timid and mostly wants to sleep.,
44302208,Large Bedroom Apartment with  a Private Bathroom,95967538596,verified,Paul,Manhattan,Upper East Side,40.77659,-73.95407,United States,US,True,strict,Private room,2013,$589 ,$118 ,3,18.0,12/15/2018,0.65,1.0,2.0,0,Please take off your shoes at the front door. Pick up your hair after your shower. The kitchen is not shared. You shall speak either English or Chinese.,
44302761,"Modern Living, Views, Summer in the City!",93375958515,unconfirmed,Jay,Manhattan,Upper East Side,40.765159999999995,-73.95868,United States,US,False,flexible,Entire home/apt,2009,$861 ,$172 ,2,7.0,5/7/2019,0.27,2.0,1.0,363,,
44303313,Stunning Terrace/garden Design 2 BR Apartment,8069781350,verified,Christophe,Manhattan,Harlem,40.80346,-73.94583,United States,US,True,flexible,Entire home/apt,2008,$981 ,$196 ,5,23.0,5/24/2019,0.84,3.0,1.0,3,,
44303865,Apartment in Great Part of Brooklyn,18895091034,unconfirmed,Samantha,Brooklyn,Gowanus,40.66948,-73.98976,United States,US,False,flexible,Private room,2017,$725 ,$145 ,4,1.0,2/28/2017,0.03,3.0,1.0,0,,
44304418,"Philosopher's Private Room, Clean, 1.5 Baths",4113925636,verified,Dwayne,Manhattan,Harlem,40.81609,-73.93663000000001,United States,US,False,strict,Private room,2018,"$1,171 ",$234 ,1,48.0,6/30/2019,1.68,4.0,1.0,365,,
44304970,Private Lrg bedroom in a convrtable 2 Bed Apt.,10827553663,verified,Clell,Brooklyn,Bay Ridge,40.63845,-74.02649,United States,US,True,moderate,Private room,2015,$83 ,$17 ,1,43.0,6/27/2019,1.64,4.0,1.0,55,"Thank you for your reservation. By placing your reservation online you indicated that you accepted the terms and conditions which have been printed below.  Please review your reservation summary as below - then print, sign and return the agreement to:  (EMAIL HIDDEN) or fax it to (PHONE NUMBER HIDDEN) or  mail it to: Spare Suite, Inc., 119 Braintree Street, Suite 510, Boston, MA 02134, USA Upon receipt, we will send you the welcome document with check in instructions and how to get your keys. Terms of the Agreement: BOOKING AND REFUND POLICY Once booked your reservation is guaranteed for the check in and check out times and dates specified. All reservations must be paid in advance, in full for the entire period of stay.  All reservations are final, and NON REFUNDABLE UNDER ANY CIRCUMSTANCES.  If you feel you may need to cancel once booked, you may consider trip insurance through AAA or other reputable provider like (URL HIDDEN) POLICY ON CHILDREN: This property is not ""KID FRIENDLY"" al",
44305522,"Cute Apartment for 2-4 people, IDEAL location NYC",60992226649,verified,Ryan,Queens,Sunnyside,40.74561,-73.91927,United States,US,False,flexible,Entire home/apt,2010,"$1,174 ",$235 ,3,2.0,2/20/2017,0.07,3.0,1.0,0,I am renting my apartment for the Marathon weekend and you will be a guest in my home. No smoking or pets please.,
44306074,3BR Home 25 Mins to Times Square + Manhattan,50210888618,verified,Nicholas,Queens,Maspeth,40.73147,-73.89486,United States,US,True,flexible,Entire home/apt,2010,$52 ,$10 ,1,60.0,6/17/2019,3.05,4.0,1.0,317,"When you arrive, my place will be clean, neat, organized & very cozy. All I ask is you leave it the same way upon departing.  Also check out time is 11am & check-in time is 4pm. For those arriving, you may check in early & leave your bags / luggage. I will just need to finish cleaning / setting the place up for you just so before handing the place to you. For those departing: 11am check-out time is strict although you may leave your bags / luggage in the apt if you are doing any last minute sight seeing / activities. Otherwise, enjoy the Allston / Boston area,  a great little neighborhood / city combination.",
44306627,MASSIVE ROOM IN HEART OF NYC!!! (CHELSEA/FLATIRON),96952898559,unconfirmed,Teri,Manhattan,Chelsea,40.74512,-73.99179000000001,United States,US,False,flexible,Private room,2013,$673 ,$135 ,1,8.0,5/18/2017,0.28,4.0,2.0,0,,
44307179,Gorgeous and sunny 1 br in Little Italy/Nolita,78859093021,verified,Dianna,Manhattan,Little Italy,40.71867,-73.99709,United States,US,False,flexible,Entire home/apt,2018,$767 ,$153 ,5,0.0,,,3.0,1.0,45,"100% no smoking in the condo itself or in the building. This is a non-smoking building. No pets, no parties of more than four, and no additional overnight guests unless as agreed. Please be respectful of our neighbors and keep the noise low at night.",
44307731,Light-filled Bowery 1BD Apartment,71416013903,verified,Julien,Manhattan,Chinatown,40.716809999999995,-73.99539,United States,US,True,flexible,Entire home/apt,2004,"$1,067 ",$213 ,5,8.0,6/14/2019,0.3,3.0,1.0,81,"When you arrive, my place will be clean, neat, organized & very cozy. All I ask is you leave it the same way upon departing.  Also check out time is 11am & check-in time is 4pm. For those arriving, you may check in early & leave your bags / luggage. I will just need to finish cleaning / setting the place up for you just so before handing the place to you. For those departing: 11am check-out time is strict although you may leave your bags / luggage in the apt if you are doing any last minute sight seeing / activities. Otherwise, enjoy the Allston / Boston area,  a great little neighborhood / city combination.",
44308284,Charming Studio In Historic Home,74685022323,unconfirmed,Tricia,Staten Island,Stapleton,40.6322,-74.07789,United States,US,False,flexible,Entire home/apt,2011,$79 ,$16 ,2,103.0,7/5/2019,3.52,5.0,1.0,73,,
44308836,Gorgeous Luxury 1 Brd Apt in Trendy West Village!,45224685179,unconfirmed,Casey,Manhattan,West Village,40.732490000000006,-74.00854,United States,US,True,moderate,Entire home/apt,2014,$814 ,$163 ,3,0.0,,,4.0,1.0,0,,
44309388,Cozy and Sunny 2 bedroom apartment,59474005375,verified,Thiago,Manhattan,Harlem,40.80495,-73.9556,United States,US,False,moderate,Entire home/apt,2018,"$1,143 ",$229 ,4,29.0,6/9/2019,0.99,3.0,2.0,0,You will see a piece of paper on my kitchen table about my house rules.  No parties please :),
44309941,Airy Inwood Apartment,43108241115,verified,Gabriel,Manhattan,Washington Heights,40.85622,-73.93146999999999,United States,US,True,flexible,Entire home/apt,2014,$396 ,$79 ,1,0.0,,,4.0,1.0,0,1) No Smoking in property!!!  2) Do not slam doors!!! Close lightly Please!!! 3) No Shoes in house (except slippers) 4) Quiet down AFTER 10PM.,
44310493,Historic Brownstone in Harlem,82307891017,verified,Santi,Manhattan,Harlem,40.804429999999996,-73.94546,United States,US,False,strict,Entire home/apt,2009,$751 ,$150 ,1,9.0,4/17/2017,0.31,2.0,1.0,0,,
44311045,"Guest Room in High Ceiling Duplex, Williamsburg! 2",61854864878,verified,Auset,Brooklyn,Williamsburg,40.70711,-73.95344,United States,US,True,moderate,Private room,2009,$319 ,$64 ,30,11.0,3/31/2019,0.38,1.0,3.0,249,,
44311597,"Beautiful 2 Bedroom Apartment Woodside, Queens, NY",78623164087,verified,Erfan,Queens,Woodside,40.746159999999996,-73.90392,United States,US,True,moderate,Entire home/apt,2020,$952 ,$190 ,2,93.0,6/20/2019,3.13,5.0,1.0,34,,
44312150,Charming Apartment,26963206206,unconfirmed,Tiffany,Brooklyn,Bushwick,40.70097,-73.9381,United States,US,True,strict,Entire home/apt,2019,"$1,188 ",$238 ,3,0.0,,,1.0,1.0,0,,
44312702,1 Bedroom in Beautiful/Spacious Bushwick Apt,32689333633,verified,Ryan,Brooklyn,Williamsburg,40.70513,-73.93063000000001,United States,US,False,strict,Private room,2015,$223 ,$45 ,1,0.0,,,4.0,1.0,0,,
