10675975,Room in 2BR in Morningside Heights,15584948875,unconfirmed,Brian,Manhattan,Upper West Side,40.80268,-73.96684,United States,US,False,strict,Private room,2007,$818 ,$164 ,1,2.0,7/23/2016,0.06,5,2,0,"Please Note: This unit was just gut-renovated in May 2015 and it comfortably accommodates 4 guests, but up to 5 guests are permitted if you so desire (two guests in each bedroom and 1 guest on the available air mattress). Please request an air mattress (if needed) when making a reservation. No smoking, no pets, no parties, and must be 25 years old to book.   For check-out, please ensure: -  All plates and cups are left in the sink or dishwasher -  All trash is left in the kitchen trash can or bagged and left next to the trash can (additional bags are under the sink) -  All windows are closed and locked -  If used, the air mattresses are deflated and put away (please leave used linens for the air mattresses on the floor) -  If furniture was moved during your stay, please return to its original location Please be mindful to our neighbors in the building; quiet hours after 10pm. Please be considerate of our next guests who will be staying after you, if something is broken or needs fixing,",
10676527,Beachside Antique Themed Room,86606209181,verified,Alex,Brooklyn,Brighton Beach,40.57577,-73.96115,United States,US,False,strict,Private room,2011,$167 ,$33 ,1,18.0,7/5/2019,2.78,2,2,343,,
10677080,Chelsea  Modern 1 BR. Apartment,10376598937,unconfirmed,Sayed,Manhattan,Midtown,40.74595,-73.98996,United States,US,False,flexible,Entire home/apt,2022,$590 ,$118 ,1,1.0,8/8/2016,0.03,1,1,0,,
10677632,Studio with own back yard and new kitchen,11073852430,verified,Joanna,Manhattan,Upper East Side,40.7731,-73.95169,United States,US,False,moderate,Entire home/apt,2014,$752 ,$150 ,4,20.0,4/28/2019,0.55,1,1,82,"1. Only the ORIGINAL OCCUPANTS at the time of booking are allowed to stay in the property overnight and secondly no additional guest will be brought in without prior authorization. 2. CHECK IN/OUT: The standard check in and out times are 4 p.m., 12 p.m., respectively. However we're flexible and can accommodate your needs as long as it doesn't impact another renter if you have special check-in or out times. There is a keypad lock and each renter will receive their own passcode so you can come and go as you please and not worry about keys or timing. 3. Excessive NOISE & DISTURBANCES, specifically on work nights (Sunday thru Thursday) are to be kept to a minimum after 10 pm. On other nights of the week we ask that noise is kept to a controlled, restrained and respectable level do to the nature of this being a shared space. 4. SMOKING is not permitted in any of the inside premises, this includes the guest room, condo unit and building. You may smoke outside in the street or on the outdoor ",
10678184,Iconic BK spot steps from mass transit.,53132088490,unconfirmed,Kyler,Brooklyn,Boerum Hill,40.68473,-73.97863000000001,United States,US,False,flexible,Shared room,2007,"$1,043 ",$209 ,1,0.0,,,5,2,0,"Clean, no house parties, no smoking, respectful of owner's home :)",
10678737,Home away from home. Contemporary!,65329306783,unconfirmed,Patrick,Queens,Jackson Heights,40.7532,-73.87731,United States,US,False,moderate,Entire home/apt,2006,$293 ,$59 ,3,12.0,6/17/2019,0.35,2,1,274,,
10679289,Studio apartment 10minute to JFK 20m to Manhattan,26951839153,unconfirmed,Eddie,Queens,Briarwood,40.71116,-73.81514,United States,US,False,strict,Entire home/apt,2010,$958 ,$192 ,2,57.0,5/17/2019,1.55,4,1,314,,
10679841,"Downtown Brooklyn, Luxury-One bed Apartment",33339941900,unconfirmed,Ken,Brooklyn,Downtown Brooklyn,40.69037,-73.98206,United States,US,True,moderate,Entire home/apt,2013,$937 ,$187 ,30,1.0,9/4/2017,0.04,1,87,365,,
10680394,Upper West Side,47624965410,unconfirmed,Abie,Manhattan,Upper West Side,40.78573,-73.97686,United States,US,True,moderate,Private room,2011,"$1,137 ",$227 ,1,0.0,,,3,1,0,"Please Note: This unit was just gut-renovated in May 2015 and it comfortably accommodates 2 couples. No smoking, no pets, no parties, and must be 25 years old to book.   For check-out, please ensure: -  All plates and cups are left in the sink or dishwasher -  All trash is left in the kitchen trash can or bagged and left next to the trash can (additional bags are under the sink) -  All windows are closed and locked -  If used, the air mattresses are deflated and put away (please leave used linens for the air mattresses on the floor) -  If furniture was moved during your stay, please return to its original location Please be mindful to our neighbors in the building; quiet hours after 10pm. Please be considerate of our next guests who will be staying after you, if something is broken or needs fixing, please let me know, as I have an arsenal of tools and enjoy fixing things.",
10680946,Beautiful Room in Modern Duplex,23451772525,verified,Jacqueline,Queens,Astoria,40.77153,-73.93191,United States,US,True,moderate,Private room,2005,$723 ,$145 ,2,0.0,,,3,1,0,#NAME?,
10681498,Cozy Room in the lovely neighborhood of Bed Stuy,82111157513,unconfirmed,Loreto,Brooklyn,Bedford-Stuyvesant,40.68155,-73.93639,United States,US,False,moderate,Private room,2004,$345 ,$69 ,3,6.0,12/10/2017,0.18,4,1,0,#NAME?,
10682050,Very private/cute/spacious room,88215698864,unconfirmed,Sarah,Queens,Maspeth,40.71609,-73.9025,United States,US,False,flexible,Private room,2004,$282 ,$56 ,20,0.0,,,5,1,0,"Please , no smoking,parties or noise that may disturb the neighbors.",
10682603,Large master bedroom one block from Prospect Park,2860742853,verified,Matt,Brooklyn,Prospect Heights,40.67575,-73.96546,United States,US,False,moderate,Private room,2009,$960 ,$192 ,1,5.0,9/6/2016,0.14,5,1,0,,
10683155,"Private Studio Apt+Bath, Luxury King, Kitchenette",73108402360,verified,Ryan,Brooklyn,Williamsburg,40.71474,-73.94461,United States,US,True,moderate,Entire home/apt,2014,$437 ,$87 ,4,34.0,6/18/2019,1.07,1,1,0,,
10683707,Amazing 1BD in Harlem,55392461198,unconfirmed,Frances,Manhattan,East Harlem,40.799209999999995,-73.94749,United States,US,False,strict,Entire home/apt,2003,$147 ,$29 ,6,7.0,7/1/2018,0.21,4,1,0,Please be respectful of the driveway and do not park in the driveway or anywhere on Barrett Ave ( as all spots are assigned to residents)  Parking on M street is fine!,
10684260,Cute and Cozy 1 BDR In West Harlem,88550836104,unconfirmed,Lisa,Manhattan,Harlem,40.82408,-73.95434,United States,US,True,strict,Entire home/apt,2011,$540 ,$108 ,3,0.0,,,3,1,0,No smoking inside. Please go in our backyard if you need to smoke. No pets.,
10684812,Cozy One Bedroom Near Fort Tryon Park,40191942490,verified,Kate,Manhattan,Inwood,40.860820000000004,-73.92585,United States,US,False,moderate,Entire home/apt,2017,$988 ,$198 ,2,2.0,8/15/2016,0.06,3,1,0,"There will be no pets, parties or smoking allowed on the premises.",
10685364,"Dramatic Duplex, Hosted, Huge>Slp.14, Subway 50 Yd",54836281143,verified,Itzchack,Brooklyn,Carroll Gardens,40.6788,-73.99559,United States,US,False,moderate,Entire home/apt,2006,$580 ,$116 ,4,5.0,5/30/2017,0.14,4,1,327,No pets. No smoking. Please :),
10685917,Beautiful & Bright One bedroom in Manhattan UES,29490231713,verified,Valerio,Manhattan,Upper East Side,40.77094,-73.95125999999999,United States,US,False,flexible,Entire home/apt,2020,"$1,096 ",$219 ,1,0.0,,,5,1,0,,
10686469,"Sunny, cozy room in Brooklyn.",77929835693,unconfirmed,Edgar,Brooklyn,Bedford-Stuyvesant,40.696509999999996,-73.96146999999999,United States,US,False,flexible,Private room,2015,$907 ,$181 ,1,60.0,7/2/2019,2.27,4,2,224,"It's our house. So we'd like no extra visitors unless you ask in advance. Weekdays we like it quiet after 10.  Smoke if you must, but on the back deck please.       Oh yeah, enjoy yourself. That's required.",
10687021,Comfy Queen Bed in Harlem,51318806581,unconfirmed,Christopher,Manhattan,Harlem,40.81893,-73.94118,United States,US,False,flexible,Private room,2009,$146 ,$29 ,1,0.0,,,4,1,0,I expect guest to be kind and do not party at the house. I am on the other hand would love to provide any advice and conversation what is possible in Boston and how to enjoy the time in South Boston. ,
10687573,Spacious NYC apt by CENTRAL PARK!,83638505684,unconfirmed,Shira,Manhattan,Upper West Side,40.794259999999994,-73.96414,United States,US,True,flexible,Entire home/apt,2007,"$1,125 ",$225 ,2,11.0,12/19/2017,0.3,3,1,212,,
10688126,Cozy room in 2BR apartment - Greenpoint,26089577990,unconfirmed,Jana,Brooklyn,Greenpoint,40.72325,-73.9432,United States,US,False,flexible,Private room,2004,$822 ,$164 ,4,1.0,8/2/2016,0.03,1,1,0,"- No smoking inside the house, we have a porch out back :), no pets",
10688678,Beautiful  Apartment in Quiet Neighborhood L Train,28915778475,unconfirmed,Sarah,Queens,Ridgewood,40.6997,-73.90243000000001,United States,US,True,flexible,Private room,2011,$701 ,$140 ,3,8.0,9/14/2018,0.22,2,1,81,* Please be considerate of our neighbors * Loud music and parties are not permitted * No smoking * No pets allowed,
10689230,"Bright Private Room on L/M in Bushwick, Queen-size",3314899223,verified,Alicia,Brooklyn,Bushwick,40.69956,-73.91888,United States,US,False,flexible,Private room,2016,$542 ,$108 ,2,62.0,7/1/2019,1.8,2,1,16,,
10689783,"Lovely S.Slope 3BR in 4BR 1300 sf dplx,deck&birds!",47026901877,unconfirmed,Vanessa,Brooklyn,South Slope,40.66537,-73.98784,United States,US,False,moderate,Private room,2015,"$1,180 ",$236 ,2,2.0,9/6/2016,0.06,2,3,0,,
10690335,Cozy room in UWS,77687326098,verified,Sara,Manhattan,Upper West Side,40.800779999999996,-73.9641,United States,US,True,moderate,Private room,2010,"$1,016 ",$203 ,4,11.0,5/22/2017,0.3,5,1,0,No smoking or pets in the home due to potential allergies of future guests.,
10690887,Private bedroom for the weekend,95762301379,verified,Ade,Brooklyn,East New York,40.66337,-73.89806,United States,US,True,flexible,Private room,2009,$245 ,$49 ,1,1.0,7/6/2016,0.03,1,1,0,,
10691440,Cool apartment in Williamsburg,89445617341,verified,Adam,Brooklyn,Williamsburg,40.71515,-73.93706,United States,US,True,moderate,Entire home/apt,2004,$735 ,$147 ,3,2.0,7/31/2016,0.06,3,1,0,The apartment is our home 365 days of the year - we rent it only select weekends when we are away so please respect the neighbors in our building and the belongings we love. If you smoke please do so on the street. There is no smoking allowed inside the apartment or on the decks due to fire safety. We cannot accommodate guests with pets.,
10691992,Blake's residents,6613037733,unconfirmed,Maxine,Queens,Queens Village,40.70975,-73.73347,United States,US,False,strict,Private room,2003,"$1,172 ",$234 ,1,5.0,9/3/2017,0.14,1,1,89,,
10692544,"Beautiful 1br, in heart of city",44873098647,unconfirmed,Armen,Manhattan,Kips Bay,40.740990000000004,-73.98139,United States,US,True,strict,Entire home/apt,2008,$517 ,$103 ,3,14.0,6/21/2019,0.39,5,1,327,"Please be respectful of my home and treat the space as if it were your own. No guests No Smoking Always turn off lights when leaving space Please clean up after yourself Always lock door when leaving and after arriving Please observe quiet hours between midnight and 7 am. Upon check-out, please leave sheets + towels on the floor of the bedroom and return key. Check in 3pm: flexible Check out 11am: strict",
10693096,Room on a quiet tree-lined block of Manhattan,72940402371,verified,Sarah,Manhattan,Harlem,40.82225,-73.94549,United States,US,False,flexible,Private room,2011,$494 ,$99 ,1,3.0,7/13/2016,0.08,5,1,0,"I expect guests to treat my home as if it were their own.  Be neat and clean, considerate, and  respectful of both my home and my neighbors. There is NO additional guests permitted! NO parties! There is NO smoking in the home, NO pets, NO drugs!!! NO food in the bedrooms!! Shoes are to be take off upon entry!!",
10693649,FORT GREENE- Private room in spacious apartment.,35619089535,unconfirmed,Fernando & Jess,Brooklyn,Fort Greene,40.69195,-73.97151,United States,US,False,strict,Private room,2006,$450 ,$90 ,7,0.0,,,5,1,0,"Make yourself at home, and of course, feel free to use anything in the house, but please be respectful of the space and make sure to put things back in their rightful locations. Please wash any pots/pans/dishes that you use.  No guests outside of those identified in your party. We also kindly ask that you keep loud noise to a minimum in the late evening and, needless to say, parties are not permitted.",
10694201,Beautiful book-filled room + garden in Bed Stuy,92265743180,unconfirmed,Josephine,Brooklyn,Bedford-Stuyvesant,40.68847,-73.95443,United States,US,True,moderate,Private room,2013,$773 ,$155 ,1,0.0,,,2,1,0,,
10694753,"Comfy, Peaceful and Private studio basement!",19025608132,verified,Pamela,Brooklyn,Williamsburg,40.7171,-73.9573,United States,US,False,strict,Entire home/apt,2016,$956 ,$191 ,10,0.0,,,5,1,0,,
10695306,Bright chic room in Clinton hill,84430196467,unconfirmed,Lisa,Brooklyn,Clinton Hill,40.683659999999996,-73.96563,United States,US,True,flexible,Private room,2018,$342 ,$68 ,7,10.0,12/10/2017,0.28,4,1,0,"1. Please let me know  ahead your arrival, checking out time and if you will need a parking spot, so I can plan accordingly. 2. Please keep in mind that the checking in is any time after 4 pm and checking out is by 11 am. Earlier check in and late check out must be arranged with me in advance.  3. I request the guest to be respectable and quiet specially after 10 pm. There's absolutely no parties,pets and smoking not allowed.  Please shut off all lights and electrical appliances including AC when you are not using the premises and be sure that the entry door is locked all the time.",
10695858,"Very Clean, Comfortable Room Available",84388218046,unconfirmed,Yakup,Brooklyn,Midwood,40.61295,-73.95366,United States,US,False,flexible,Private room,2006,$591 ,$118 ,1,10.0,4/28/2019,0.3,1,1,0,,
10696410,"Dottie's Place, Room #2...Just for You!",82712894505,unconfirmed,Traci,Queens,Rosedale,40.65218,-73.73498000000001,United States,US,False,flexible,Private room,2022,$599 ,$120 ,1,0.0,,,1,1,0,"WHEN BOOKING, PLEASE PROVIDE THE FOLLOWING IN YOUR MESSAGE to me:  - 1. Total number of guests (adults, children, babies)? Are there any elderly or children under 18? If so, what are their ages?  - 2. Arrival Date AND Time of Check In? (Check In between 2 pm and 9 pm with some leniency)  - 3. Departure Date (Check out before 12 pm/noon ideally)  - 4. Please tell me a little about yourselves and the purpose of your trip.  - 5. What Other Needs or Special Requests or Extra Options (please read below for additional options and possible related additional fees).  ------  PLEASE NOTE THE FOLLOWING BEFORE REQUESTING A BOOKING:  * I will reply as soon as possible to let you know if my apartment will be available for ALL your needs.  - 1. We are happy to host Friendly, Neat, Low-Maintainence Adults & Well-Behaved Children.  ---- All cookware and utensils in the kitchen are at your disposal. There will be water (brita) and basic condiments provided for you. We ask that you rinse whatever dishes",
10696963,"Large, cozy 'n sweet",76854530957,unconfirmed,Tavish,Brooklyn,Bushwick,40.693059999999996,-73.92106,United States,US,False,moderate,Private room,2016,$368 ,$74 ,4,1.0,10/5/2016,0.03,2,1,0,No pets. No smoking. Please :),
10697515,MODERN WILLIAMSBURG DUPLEX NEAR ALL THE ACTION,29369864861,unconfirmed,Robert,Brooklyn,Williamsburg,40.70875,-73.9467,United States,US,True,moderate,Entire home/apt,2013,$307 ,$61 ,4,10.0,3/5/2017,0.27,3,1,0,#NAME?,
10698067,Nicely furnished room in a spacious apartment,31398814814,unconfirmed,Dilini,Brooklyn,Prospect-Lefferts Gardens,40.65702,-73.96066,United States,US,False,flexible,Private room,2007,$399 ,$80 ,14,6.0,11/25/2017,0.17,2,1,0,This is my 2 family house and upstairs in the 2nd apartment I have other tenants who are great. ,
10698619,Brooklyn - Bushwick - NYC,72379963200,unconfirmed,Ming,Brooklyn,Bushwick,40.69677,-73.93027,United States,US,True,strict,Private room,2017,$790 ,$158 ,2,126.0,6/24/2019,3.51,2,4,80,"1. Only the ORIGINAL OCCUPANTS at the time of booking are allowed to stay in the property overnight and secondly no additional guest will be brought in without prior authorization. 2. Excessive NOISE & DISTURBANCES, specifically on work nights (Sunday thru Thursday) are to be kept to a minimum after 10pm. On other nights of the week we ask that noise is kept to a controlled, restrained and respectable level do to the nature of this being a shared space.  3. SMOKING is not permitted in any of the inside premisses, this includes the guest room, condo unit and building. You may smoke outside in the street or on the outdoor patio. 4. DAMAGES to the property and it's contents (within the bedroom and the condo itself) will be subject to reinstitution in accordance to airbnb rules and regulations and may lead to the immediate dismissal from the property. 5. WASHER & DRYER is available for use by the guest free of charge but under the condition that we (the host) are present at the time of use",
10699172,Gorgeous Astoria 1 Br,57104694034,unconfirmed,Jonathan,Queens,Long Island City,40.746159999999996,-73.94653000000001,United States,US,True,flexible,Private room,2016,$329 ,$66 ,1,0.0,,,3,1,0,"1. Only the ORIGINAL OCCUPANTS at the time of booking are allowed to stay in the property overnight and secondly no additional guest will be brought in without prior authorization. 2. Excessive NOISE & DISTURBANCES, specifically on work nights (Sunday thru Thursday) are to be kept to a minimum after 10pm. On other nights of the week we ask that noise is kept to a controlled, restrained and respectable level do to the nature of this being a shared space.  3. SMOKING is not permitted in any of the inside premisses, this includes the guest room, condo unit and building. You may smoke outside in the street or on the outdoor patio. 4. DAMAGES to the property and it's contents (within the bedroom and the condo itself) will be subject to reinstitution in accordance to airbnb rules and regulations and may lead to the immediate dismissal from the property. 5. WASHER & DRYER is available for use by the guest free of charge but under the condition that we (the host) are present at the time of use",
10699724,Spacious 1BR apartment in elevator building,69495294341,unconfirmed,Azoil,Brooklyn,East Flatbush,40.651920000000004,-73.95243,United States,US,False,moderate,Entire home/apt,2007,$726 ,$145 ,7,1.0,9/1/2016,0.03,1,1,0,,
10700276,Cozy 1BR in Murray Hill,64233591734,verified,Enrique,Manhattan,Kips Bay,40.74077,-73.98245,United States,US,True,flexible,Private room,2012,"$1,109 ",$222 ,1,1.0,7/25/2016,0.03,3,1,0,,
10700829,Private  furnished 1BR in a 4BR on Upper West Side,13622062709,verified,Samuel,Manhattan,Upper West Side,40.80057,-73.96679,United States,US,True,strict,Private room,2012,$519 ,$104 ,4,0.0,,,2,1,0,"There will be a contract exchange for this property which will include such things as keeping noise to respectful level, no more than six renters at a time, no pets, no smoking.  Must have a credit card to put on file in case of damages.  Must provide copy of license or passport. **All people are counted including infants toward the number in your group *** We will decline alterations that are made after you check in the unit.  We follow the cancelation policy. **** Lost keys will be charged a $200 fee *****No parties",
10701381,"Beautiful, Bright and Modern Space w/ a Fresh Feel",43274511704,unconfirmed,Kimberly,Brooklyn,Bushwick,40.68365,-73.91069,United States,US,False,moderate,Entire home/apt,2010,$531 ,$106 ,2,43.0,6/23/2019,1.2,1,1,80,,
10701933,The trendiest block in Bedford Stuyvesant Brooklyn,19352472444,verified,Byron,Brooklyn,Bedford-Stuyvesant,40.682829999999996,-73.94375,United States,US,True,strict,Private room,2007,$655 ,$131 ,1,0.0,,,5,1,0,"As this is our personal living space, we request that there be no smoking indoors and that you treat our belongings with respect. Pets are allowed, provided they are well behaved and low shedding :) We own a dog (who will not be on premises during your stay), who does shed, although we will have the place cleaned prior to your arrival. However, anyone with potential allergies should be aware.  If it would be possible, we would greatly appreciate if guests would provide water for our plants a couple of times during their stay. There are only 4 total and they are conveniently located right in the kitchen. Three are herb plants (basil, thyme and aloe) and you are welcome to use any while you are there!",
10702486,Private Room in Charming Bedstuy,30652103792,verified,Matt & Crutch,Brooklyn,Bedford-Stuyvesant,40.67803,-73.92663,United States,US,True,moderate,Private room,2010,"$1,032 ",$206 ,2,78.0,6/30/2019,2.2,3,3,82,No smoking.  No pets.,
10703038,Subway accessible apartment in Brooklyn!,92454754715,unconfirmed,Ashlee,Brooklyn,Kensington,40.642309999999995,-73.97974,United States,US,True,flexible,Private room,2020,$915 ,$183 ,5,,,,1,1,0,"1. Only the ORIGINAL OCCUPANTS at the time of booking are allowed to stay in the property overnight and secondly no additional guest will be brought in without prior authorization. 2. Excessive NOISE & DISTURBANCES, specifically on work nights (Sunday thru Thursday) are to be kept to a minimum after 10pm. On other nights of the week we ask that noise is kept to a controlled, restrained and respectable level do to the nature of this being a shared space.  3. SMOKING is not permitted in any of the inside premisses, this includes the guest room, condo unit and building. You may smoke outside in the street or on the outdoor patio. 4. DAMAGES to the property and it's contents (within the bedroom and the condo itself) will be subject to reinstitution in accordance to airbnb rules and regulations and may lead to the immediate dismissal from the property. 5. WASHER & DRYER is available for use by the guest free of charge but under the condition that we (the host) are present at the time of use",
10703590,"Quiet light-filled apt, subway near",44080516834,unconfirmed,Jason,Manhattan,Harlem,40.82822,-73.94864,United States,US,False,moderate,Entire home/apt,2020,"$1,119 ",$224 ,16,26.0,6/19/2019,0.76,3,1,31,"Please enjoy your stay while also respecting the apartment. Please no smoking, no guests except those on reservation, and no parties. Thank you and enjoy!",
10704142,Twin size bed 2 blocks away L&M train to Manhattan,6962570510,unconfirmed,Serdar,Queens,Ridgewood,40.70183,-73.91145999999999,United States,US,False,moderate,Private room,2021,$64 ,$13 ,7,16.0,6/25/2019,0.47,1,1,247,No pets. No smoking.,
10704695,Private room w/1Queen Bed (Lower level),91621483779,verified,Shirley,Queens,Flushing,40.74981,-73.82741999999999,United States,US,True,moderate,Private room,2019,$659 ,$132 ,7,19.0,6/21/2019,0.84,2,12,134,,
10705247,"West 86th Street, Charming UWS One Bd Serviced Apt",21921765328,verified,Ken,Manhattan,Upper West Side,40.786640000000006,-73.97275,United States,US,True,strict,Entire home/apt,2016,$845 ,$169 ,30,2.0,9/26/2018,0.06,1,87,45,,
10705799,Cozy Modern Private Bedroom Hell's Kitchen,45130687637,verified,Abby,Manhattan,Hell's Kitchen,40.76518,-73.98406,United States,US,True,strict,Private room,2020,$845 ,$169 ,3,1.0,1/13/2017,0.03,4,1,0,,
10706352,Bk'S Finest feels Cozy Room Near Trains&bus,60121233566,verified,Joyell,Brooklyn,Bushwick,40.69425,-73.92781,United States,US,True,flexible,Private room,2006,$321 ,$64 ,1,157.0,6/16/2019,4.52,3,7,61,"Make yourself at home, and of course, feel free to use anything in the house, but please be respectful of the space and make sure to put things back in their rightful locations. Please wash any pots/pans/dishes that you use.  Please, no smoking in the property whatsoever. Please, no guests outside of those identified in your party. We also kindly ask that you keep loud noise to a minimum in the late evening and, needless to say, parties are not permitted.",
10706904,Beautiful Cozy Garden Apt- Historic Clinton Hill,90510780360,unconfirmed,Maritza,Brooklyn,Clinton Hill,40.68421,-73.96631,United States,US,False,moderate,Entire home/apt,2005,$895 ,$179 ,30,11.0,6/21/2019,0.31,1,2,43,"My main rule is mutual respect. Please keep all personal items intact as this is my main residence. There's plenty of space for your comfort. If something breaks or doesn't work, please let me know. It may not be valuable, but I'd like to have it fixed for the next guest. Out of respect to the neighbors, no parties please. There are 3 other units in the condo building and they're all working professionals. Please take care of the hardwood floors and the hallway walls. Don't drag bags across the floors or scuff the hallways. Pets and smoking are not allowed. Must have a credit card to put on file in case of damages. Must provide copy of license or passport, as well as names of all guests. ",
10707456,Modern NYC Studio Apartment Near Central Park!,6318010842,verified,Kara,Manhattan,Midtown,40.76647,-73.98146,United States,US,True,flexible,Entire home/apt,2006,"$1,049 ",$210 ,30,0.0,,,3,121,189,Guest are to be respectful to the other tenants and keep noise levels down. No smoking in the building or the unit.,
10708009,"Private room in Astoria, NY",27868654601,unconfirmed,Liliana,Queens,Astoria,40.75528,-73.91628,United States,US,True,flexible,Private room,2010,$976 ,$195 ,2,41.0,6/2/2019,1.19,2,1,278,,
