53137351,Cozy apartment in Williamsburg,57996431138,verified,Brad,Brooklyn,Williamsburg,40.715140000000005,-73.9641,United States,US,False,moderate,Entire home/apt,2014,"$1,188 ",$238 ,2,54,6/30/2019,4.06,5,1,180,"Check-in is 2:00 pm, and checkout 11:00 am. You may bring bags in before check in time or leave it to pick up later. Let me know to arrange it. After reservation please send me your arrival and departure time for logistics Help yourself coffee or tea anytime NO shoes to the second floor  Keep the volume low before 8am and after 10pm Close the doors gently No shower after  11:30pm No laundry after  before 9am and after 8pm Keep the kitchen in a decent condition after your use Close the shower curtain well, no hair in the tub, no water around the sink on the sink there is a sponge you can use it to dry Turn off the light when you leave the room Trash out from the room  BLUE BOX recycling  Please respect this rules. Full refunded of security deposit in this case",
53137904,2 Bedroom furnished NY apt w/ private balcony,3621907723,unconfirmed,Justin,Manhattan,Harlem,40.8082,-73.94252,United States,US,False,strict,Entire home/apt,2005,$611 ,$122 ,7,1,9/30/2018,0.11,4,2,253,No smoking in the house. No pets.,
53138456,"Enjoy Cozy, Quiet, Safe & Convenient Living in NYC",56616435406,verified,Chi,Brooklyn,Bensonhurst,40.61266,-73.98676999999999,United States,US,False,flexible,Entire home/apt,2013,$69 ,$14 ,30,5,4/13/2019,0.36,3,1,320,"Check-in is 2:00 pm, and checkout 11:00 am. You may bring bags in before check in time or leave it to pick up later. Let me know to arrange it. After reservation please send me your arrival and departure time for logistics Help yourself coffee or tea anytime NO shoes to the second floor  Keep the volume low before 8am and after 10pm Close the doors gently No shower after  11:30pm No laundry after  before 9am and after 8pm Keep the kitchen in a decent condition after your use Close the shower curtain well, no hair in the tub, no water around the sink on the sink there is a sponge you can use it to dry Turn off the light when you leave the room Trash out from the room  BLUE BOX recycling  Please respect this rules. Full refunded of security deposit in this case   .",
53139008,Charming beautiful studio perfect location!!,54633970871,unconfirmed,Ofir,Manhattan,Upper West Side,40.78382,-73.98235,United States,US,True,moderate,Entire home/apt,2005,$932 ,$186 ,30,0,,,3,8,290,Please respect our home .,
53139561,Private Bedroom with En Suite Bath on Central Park,54732473611,unconfirmed,Keenan & Emily,Manhattan,Upper West Side,40.79591,-73.96204,United States,US,False,strict,Private room,2022,"$1,133 ",$227 ,2,9,6/12/2019,0.62,2,3,181,"- - NO PETS!  NO SMOKING ON PREMISES!  NO PARTY! No ""DRUGS""! - Keep the Place Clean at All Times! - Do Not Ask the ""Neighbors"" for anything.  Ask Me!-  - No Neighbors Interaction! - No ""Drugs"" Please!!! - No Noise! A printed house rule will be provided. Please be respectful to others when all rooms are booked.  10 AM Check-out and Check-in is between 12 PM (noon) - 3 PM.   Late check in after 8 pm is $50, lock out is $50. Respect yourself, Respect others, clean up after yourself.  No Smoking/drinking in apt.  Thank You! Location Rules: The ""Exact Address Location Is Not Stockton St.  It Is 2 Streets Away.  It Is Not Disclosed For Security Reasons"" And Is Given Out 24 Hours Prior to Check-in.  If This Is a Problem for You, Please STOP Here And Contact Other Hosts for Your Stay.   This Is a Part Of My House Rules.",
53140113,Modern LOFT  in Fort Greene,81670899779,verified,V And J,Brooklyn,Clinton Hill,40.69325,-73.96863,United States,US,True,strict,Entire home/apt,2021,$594 ,$119 ,3,3,10/29/2018,0.24,5,1,8,,
53140665,Central Park Apt w/ Patio + Washer/Dryer,63616475286,unconfirmed,Brittany,Manhattan,Upper West Side,40.79,-73.96851,United States,US,False,flexible,Entire home/apt,2010,$595 ,$119 ,2,5,11/25/2018,0.34,4,1,2,"- - NO PETS!  NO SMOKING ON PREMISES!  NO PARTY! No ""DRUGS""! - Keep the Place Clean at All Times! - Do Not Ask the ""Neighbors"" for anything.  Ask Me!-  - No Neighbors Interaction! - No ""Drugs"" Please!!! - No Noise! A printed house rule will be provided. Please be respectful to others when all rooms are booked.  10 AM Check-out and Check-in is between 12PM (noon) - 3 PM.   Late check in after 8 pm is $50, lock out is $50. Respect yourself, Respect others, clean up after yourself.  No Smoking/drinking in apt.  Thank You! Location Rules: The ""Exact Address Location Is Not Stockton St.  It Is 2 Streets Away.  It Is Not Disclosed For Security Reasons"" And Is Given Out 24 Hours Prior to Check-in.  If This Is a Problem for You, Please STOP Here And Contact Other Hosts for Your Stay.   This Is a Part Of My House Rules.",
53141218,Bedstuy Hideaway,88314519025,unconfirmed,Nandi,Brooklyn,Bedford-Stuyvesant,40.68785,-73.93948,United States,US,True,flexible,Private room,2013,$377 ,$75 ,30,27,9/28/2018,1.88,4,1,0,"We have a no shoes policy in the house, please leave your shoes in the entryway when you enter. We will be sharing the bathroom with you and typically use the bathroom from 7 to 7.30 AM. Please come talk to us so that we can assure no-one is waiting.",
53141770,Brooklyn Art Residence,33180781215,unconfirmed,Lara,Brooklyn,Bushwick,40.69932,-73.91190999999999,United States,US,True,strict,Entire home/apt,2017,$165 ,$33 ,3,7,5/5/2019,0.48,4,1,6,NO SMOKING ON PREMISES! NO PARTY! A printed house rule will be provided. Please be respectful to others when both rooms are booked.  Non-registered guest may not stay overnight.  11AM check-out (firm) and check-in time is between 3-9PM. No check-in later than 9PM.,
53142322,Corporate Studio Midtown East,53412331433,unconfirmed,Corporate Housing,Manhattan,Midtown,40.75393,-73.96611999999999,United States,US,False,moderate,Entire home/apt,2006,"$1,097 ",$219 ,30,5,5/14/2019,0.34,5,91,304,,
53142874,Stunning Elevator 2 Bedroom Midtown East,88135369296,unconfirmed,Corporate Housing,Manhattan,Midtown,40.75569,-73.96679,United States,US,True,strict,Entire home/apt,2009,$113 ,$23 ,30,1,6/29/2018,0.08,5,91,332,,
53143427,Brand New apt heart of Manhattan,83230317669,unconfirmed,Corporate Housing,Manhattan,Kips Bay,40.74471,-73.98026999999999,United States,US,True,moderate,Entire home/apt,2019,$848 ,$170 ,30,4,6/14/2019,0.32,2,91,346,"NO PETS!  NO SMOKING ON PREMISES!  NO PARTY! A printed house rule will be provided. Please be respectful to others when all rooms are booked. 10 AM Check-out and Check-in is between 12 PM (noon) - 3 PM.   Late check in after 8 pm is $50, lock out is $50. Respect yourself, Respect others, clean up after yourself.  No Smoking/drinking in apt.  Thank You Location Rules: The ""Exact Address Location Is Not Disclosed For Security Reasons"" And Is Given Out 24 Hours Prior to Check-in.  If This Is a Problem for You, Please STOP Here And Contact Other Hosts for Your Stay.   This Is a Part Of My House Rules.",
53143979,Brand New Executive Studio,73978343302,verified,Corporate Housing,Manhattan,Murray Hill,40.74651,-73.97868000000001,United States,US,False,moderate,Entire home/apt,2021,$248 ,$50 ,30,3,5/31/2019,0.5,3,91,342,"Check-in is 2:00 pm, and checkout 11:00 am (the bedrooms please, you leave your bags to pick up later or bring them early). After reservation please send me your arrival and departure time for logistics Help yourself morning coffee or tea with a toast  (website hidden) shoes to the second floor  2.Keep the volume low before 8am and after 10pm 3.Close the doors gently (website hidden) shower after  11pm (website hidden) Laundry after  before 9am and after 8pm 6.Keep the kitchen and  bathroom in decent condition after you 7.Close the shower curtain well (important) (website hidden) water around the sink (under the sink there is a sponge you can use it to dry) 9.Turn off the light when you leave the room 10.Trash out from the room  BLUE BOX recycling  11.Leave the key in the room THANK YOU PS: sorry, I need to be more strict about leaving the bathroom, kitchen neat, and lights. If you leave the lights on and the bathroom is water on the floor or around the sink, the security deposit will ",
53144531,Prime Upper east~2BR~ newly furnished,10367874805,verified,Izi,Manhattan,Upper East Side,40.77458,-73.94769000000001,United States,US,True,strict,Entire home/apt,2003,$307 ,$61 ,30,0,,,3,13,161,"NO PETS!  NO SMOKING ON PREMISES!  NO PARTY! No ""DRUGS""! A printed house rule will be provided. Please be respectful to others when all rooms are booked. 10 AM Check-out and Check-in is between 12 PM (noon) - 3 PM.   Late check in after 8 pm is $50, lock out is $50. Respect yourself, Respect others, clean up after yourself.  No Smoking/drinking in apt.  Thank You! Location Rules: The ""Exact Address Location Is Not Stockton St.  It Is 2 Streets Away.  It Is Not Disclosed For Security Reasons"" And Is Given Out 24 Hours Prior to Check-in.  If This Is a Problem for You, Please STOP Here And Contact Other Hosts for Your Stay.   This Is a Part Of My House Rules.",
53145084,Sweet Home Away From Home,54242772524,verified,Natasha,Brooklyn,Sheepshead Bay,40.5917,-73.95536,United States,US,False,strict,Private room,2020,"$1,101 ",$220 ,2,38,6/23/2019,2.57,5,2,306,The Golden Rule,
53145636,Charming Upper West Studio,85144168278,unconfirmed,Jared,Manhattan,Upper West Side,40.786120000000004,-73.97010999999999,United States,US,True,strict,Entire home/apt,2018,$290 ,$58 ,30,6,5/14/2019,0.56,4,1,15,Please no smokers or pets. ,
53146188,"HOTEL ROOM LIKE!!!   WITH AFFORDABLE RATE!!!   ""P""",90940648383,unconfirmed,Viviana,Queens,Woodhaven,40.68654,-73.86672,United States,US,False,flexible,Private room,2010,"$1,131 ",$226 ,3,29,6/22/2019,2.0,5,9,355,,
53146741,Wonderful 3 bed 1.5 baths 20 Mins to Times Square!,70377672610,unconfirmed,Sergio,Manhattan,Washington Heights,40.850809999999996,-73.9368,United States,US,True,moderate,Entire home/apt,2013,$438 ,$88 ,30,0,,,3,2,339,I'll guide you with everything upon check-in,
53147293,NYC with a view,80411675002,verified,Chris,Manhattan,Hell's Kitchen,40.76206,-73.99775,United States,US,True,moderate,Entire home/apt,2015,$154 ,$31 ,3,2,5/19/2019,0.14,4,1,0,"Please treat our house as you would treat your own (assuming that it is good).  Please clean up after yourself.  Kindly remove your shoes by the door, slippers are welcome (if they have not been treading the outdoors).  If you use the kitchen, please wipe down the stove and counter-tops and clean the dishes in the sink to prevent critters from visiting you at night.  Laundry is available free of charge just next to the kitchen, we have a washer and dryer.  Clean bedding will be provided for you when you check in, and cleaned after you check out.   We will not be responsible for personal accidents or sickness, we would ask you to clean up after yourself.  If you plan a lengthy stay, we can wash your sheets once a week.  If you'd like additional washing, please wash your sheets along with your other laundry.  A key will be provided to you for your bedroom should you want to lock anything up.",
53147845,"Private room at Roselle, in the Bronx",15325424469,verified,Massiel,Bronx,Westchester Square,40.84367,-73.84911,United States,US,False,flexible,Private room,2007,$427 ,$85 ,2,11,6/15/2019,1.11,2,2,158,"We have ample off-street parking but if you have a car let us know and we will be in touch with you about parking. Please be careful not to drive or walk in the driveway for 233 Savin Hill Avenue. Check in time is 2 PM, check out time is 10 AM.  Guests who arrive early can drop off their luggage after 10 AM. We are unable to accommodate arrivals earlier than 10 AM.  Guests who need to stay after the check out time are welcome to use the common area on the first floor for luggage storage. NO SMOKING in the house or anywhere on the property. No Pets.",
53148397,紐約哥大週邊優質短租,5050392350,unconfirmed,哲緯,Manhattan,Morningside Heights,40.8058,-73.9647,United States,US,True,strict,Entire home/apt,2017,$973 ,$195 ,10,0,,,4,1,0,"We have ample off-street parking but if you have a car let us know and we will be in touch with you about parking. Please be careful not to drive or walk in the driveway for 233 Savin Hill Avenue. Check in time is 2 PM, check out time is 10 AM.  Guests who arrive early can drop off their luggage after 10 AM. We are unable to accommodate arrivals earlier than 10 AM.  Guests who need to stay after the check out time are welcome to use the common area on the first floor for luggage storage. NO SMOKING in the house or anywhere on the property. No Pets.",
53148950,"Newly renovated 1 bedroom, steps to Prospect Park",56572978192,verified,Melissa,Brooklyn,Windsor Terrace,40.65871,-73.9789,United States,US,True,moderate,Entire home/apt,2021,$95 ,$19 ,3,15,12/21/2018,1.15,4,1,65,Our home is a smoke-free environment.  We expect everyone to act as responsible adults and respect our home.,
53149502,Sunny bedroom in a designer apartment,90977334503,unconfirmed,Swann,Queens,Sunnyside,40.7461,-73.91983,United States,US,False,flexible,Private room,2020,$338 ,$68 ,3,79,7/3/2019,5.44,5,1,84,"No smoking, please No pets",
53150054,Affordable Modern/Luxury 2 Bedroom Apt,19479030601,unconfirmed,Gesner,Brooklyn,Bedford-Stuyvesant,40.687709999999996,-73.92281,United States,US,True,flexible,Entire home/apt,2016,$510 ,$102 ,2,73,6/21/2019,4.95,2,1,219,This is a shared space so guests should be respectful of the space and other persons.,
53150607,Brooklyn Beautiful private room!!,2751993582,verified,Nami,Brooklyn,Crown Heights,40.67535,-73.94991999999999,United States,US,True,strict,Private room,2016,"$1,019 ",$204 ,2,1,12/31/2018,0.16,2,1,0,Clean up after your mess please.,
53151159,Sonder | Hanover Square | Cozy 1BR + Rooftop,20555669236,verified,Sonder,Manhattan,Financial District,40.70533,-74.00923,United States,US,True,moderate,Entire home/apt,2018,"$1,133 ",$227 ,29,1,8/15/2018,0.09,5,96,353,No Smoking and No Pets,
53151711,One Bedroom Apartment in Greenpoint,24938819308,unconfirmed,Lindsey,Brooklyn,Greenpoint,40.73556,-73.95725999999999,United States,US,True,flexible,Entire home/apt,2007,"$1,093 ",$219 ,2,5,5/12/2019,0.37,3,2,7,"NO SMOKING, please stop smoking a block away so as not to bring smoke-filled lungs into the house, I'm highly sensitive, and it makes me feel sick. Please clean after yourself on an on-going basis, especially in the common areas. We recycle paper, glass, metal in a separate bin, and throw food, plastic bags, and wrappers into the normal trash, can you participate? This 100 year old building has character in the details, but might appear less clean. The wood work was painted white before I moved in. I consistently use bleach between guests, but the grooves have ""greyed"" overtime, and I haven't repainted yet. I hope you won't be that picky ;-) My end-of-stay cleaning fee is to cover my time and expenses washing, drying, changing the sheets and sanitizing the room in between guests. I don't do any daily cleaning (of your room, the bathroom or the kitchen).  I only clean in-between guests or when needed - I noticed I am not a clean freak, I go after the obvious (bread crumbs and slime) - s",
53152264,Sonder | Hanover Square | Sun-Filled 1BR + Rooftop,96671386582,unconfirmed,Sonder,Manhattan,Financial District,40.70551,-74.00839,United States,US,True,strict,Entire home/apt,2009,$265 ,$53 ,29,0,,,3,96,1,I like my guests to enjoy my home as much as I do. So please feel to treat it like your home as long as you are respectful and clean up after yourself. No smoking or pets please.,
53152816,THE PONDEROSA PALACE,50271923994,unconfirmed,B,Manhattan,Hell's Kitchen,40.761520000000004,-73.98758000000001,United States,US,False,strict,Entire home/apt,2016,$556 ,$111 ,2,49,6/25/2019,3.7,2,1,283,,
53153368,New York City with the bird view,15867447953,unconfirmed,Luba,Manhattan,Upper East Side,40.78119,-73.95121,United States,US,True,moderate,Entire home/apt,2019,"$1,175 ",$235 ,4,0,,,3,1,83,"- No Pets! - No Party! - No Smoking! - Keep the Place Clean at All Times! - Do Not Ask the ""Neighbors"" for anything.  Ask Me!-  - No Neighbors Interaction! - No ""Drugs"" Please!!!No Noise!",
53153920,Private space in luxury apartment with river view,6644762284,unconfirmed,Marshall,Manhattan,Roosevelt Island,40.76811,-73.94483000000001,United States,US,True,moderate,Private room,2010,$126 ,$25 ,7,3,8/4/2018,0.23,2,1,0,#NAME?,
53154473,Urban Place,91653686018,verified,Miller,Brooklyn,East Flatbush,40.63532,-73.94924,United States,US,False,flexible,Private room,2018,"$1,021 ",$204 ,2,1,6/10/2018,0.08,5,5,0,"No smoking, no pets, no parties",
53155025,Private Modern Studio in heart of Flatbush,16520995587,unconfirmed,Ely,Brooklyn,Midwood,40.61673,-73.96491,United States,US,False,moderate,Entire home/apt,2015,$50 ,$10 ,2,23,5/27/2019,1.55,4,2,49,,
53155577,Sunny Room in heart of hippest Manhattan 'hood,78106611585,unconfirmed,George,Manhattan,Lower East Side,40.7213,-73.98862,United States,US,False,flexible,Private room,2008,"$1,010 ",$202 ,15,8,6/16/2019,0.68,4,3,260,• Check-in time is 3PM. Clean up after yourself. No smoking indoors. No parties.,
53156130,Paradise in New York City,16991306582,unconfirmed,Shama,Manhattan,Harlem,40.82156,-73.94966,United States,US,True,strict,Entire home/apt,2021,$522 ,$104 ,2,82,7/6/2019,5.68,3,2,266,"Please, no smoking inside the building or on the porches.  Due to sensitivities, we ask that you not use perfume, cologne, or aerosol products in the house. No parties. No illegal drug use.  We are an eco-friendly family and appreciate your help in recycling (bin in the kitchen) and turning off lights, fans, heating/AC, etc. when not in use.  Please lock all doors of the building behind you.  Common areas will be cleaned daily and your help in keeping them tidy is appreciated. (But please feel free to let us do your dishes!)",
53156682,Cozy Brooklyn Greenpoint Apt.15 min to Manhattan,80497600749,verified,Alfredo,Brooklyn,Greenpoint,40.72339,-73.94322,United States,US,False,strict,Entire home/apt,2014,$420 ,$84 ,1,52,7/6/2019,3.83,5,1,161,"Pet Friendly! Smoking outdoors only. In general, we just want you to relax, enjoy yourselves and take advantage of our close proximity to all things Boston. If you follow the simple rule of ""leave things how you found them"" all will be well - common sense stuff.",
53157234,Comfy Room with Private Insuite Bathroom,39089696517,unconfirmed,Diana,Brooklyn,Bedford-Stuyvesant,40.69616,-73.93438,United States,US,True,strict,Private room,2010,$757 ,$151 ,3,22,6/24/2019,1.54,2,7,96,"Respect our neighbors. Do not park in their driveway spots.    Take good care of our space.  No parties, please.  The neighborhood is safe but as a general precaution since we do live in a city, keep all windows and doors locked when you are outside of the house.",
53157787,"HOTEL ROOM LIKE!!  WITH AFFORDABLE RATE!!   ""R""",32205198717,verified,Viviana,Queens,Woodhaven,40.68765,-73.865,United States,US,True,moderate,Private room,2006,$805 ,$161 ,3,24,6/10/2019,1.64,4,9,343,"Respect yourself, respect others, clean up after yourself, no smoking in house, no partying.  late check in after 9p.m. and before 9 a.m is $50, lock out is $50 thank you ",
53158339,Amazing Brooklyn,17274416863,unconfirmed,Myrna,Brooklyn,Sheepshead Bay,40.60399,-73.94523000000001,United States,US,True,strict,Private room,2022,$142 ,$28 ,7,3,8/14/2018,0.24,3,2,29,"Please be respectful, this really is our home and sanctuary. Our goal is that for a time, it can be yours as well.",
53158891,Global Beat Apartment Hideaway in Manhattan,46438224131,unconfirmed,Sybilla Michelle,Manhattan,Chelsea,40.74732,-73.9999,United States,US,True,moderate,Entire home/apt,2012,$621 ,$124 ,2,0,,,3,3,0,"Pet Friendly! Smoking outdoors only. In general, we just want you to relax, enjoy yourselves and take advantage of our close proximity to all things Boston.  If you follow the simple rule of ""leave things how you found them"" all will be well - common sense stuff.",
53159443,Minimalism in the heart of a great neighborhood,50528071116,unconfirmed,Josh,Manhattan,Chinatown,40.7177,-73.99246,United States,US,True,strict,Private room,2011,$700 ,$140 ,3,1,4/21/2018,0.07,3,1,37,"NO PETS!  NO SMOKING ON PREMISES! NO PARTY! A printed house rule will be provided. Please be respectful to others when all rooms are booked. 10 AM Check-out and Check-in is between 12 PM (noon) - 3 PM.   Late check in after 8 pm is $50, lock out is $50. Respect yourself, Respect others, clean up after yourself.  No Smoking/drinking in apt.  Thank You! Location Rules: The ""Exact Address Location Is Not Disclosed For Security Reasons"" And Is Given Out 24 Hours Prior to Check-in.  If This Is a Problem for You, Please STOP Here And Contact Other Hosts for Your Stay.   This Is a Part Of My House Rules.",
53159996,"1 bedroom, blocks from Central Park and subways.",25911673936,verified,Corinne,Manhattan,Upper East Side,40.773590000000006,-73.95143,United States,US,False,moderate,Entire home/apt,2014,$677 ,$135 ,3,7,8/15/2018,0.5,4,1,0,,
53160548,"Luxury Tribeca 1BR w/ Gym, Doorman + Roof deck by Blueground",49545578211,verified,Blueground,Manhattan,Tribeca,40.71433,-74.01073000000001,United States,US,True,flexible,Entire home/apt,2018,$501 ,$100 ,30,0,,,3,232,316,"不抽烟,不带宠物,不能带其他人入屋",
53161100,TV-PHOTO-FILM-CINEMA-ART GALLERY-MUSIC STUDIO-LOFT,98187713121,unconfirmed,David & Javier,Brooklyn,Williamsburg,40.71824,-73.95175,United States,US,True,strict,Entire home/apt,2019,$215 ,$43 ,1,9,4/27/2019,0.66,4,1,88,"Our family will be present in the same house, though we expect you to have fun please be respectful of our family and house. We prefer non-smokers, but if you should smoke please refrain from smoking on the property. No pets allowed.",
53161653,prime upper west Cozy Studio deal,74459238709,unconfirmed,Ofir,Manhattan,Upper West Side,40.7826,-73.98228,United States,US,False,strict,Entire home/apt,2009,$403 ,$81 ,31,0,,,2,8,50,"This is a non-smoking residence.  There is light housekeeping (biweekly washing of linens, removal of kitchen trash) but guests are expected to clean up after themselves and keep the area tidy, including removing hair from bathtub and sink and washing dishes right away.  Remove shoes in the apartment. Slippers are OK. Turn off lights when exiting a room or hallway. Guests are not permitted without prior authorization. Overnight guests are not allowed.  Be courteous to others in the household.  Additional rules will be in the house manual, available upon arrival.",
53162205,Sonder | 21 Chelsea | Charming 1BR + Rooftop,33722370347,unconfirmed,Sonder,Manhattan,Chelsea,40.740809999999996,-73.99616,United States,US,False,strict,Entire home/apt,2006,"$1,017 ",$203 ,29,0,,,5,96,331,,
53162757,Sonder | The Biltmore | Quaint Studio + Rooftop,90572504614,unconfirmed,Sonder,Manhattan,Financial District,40.70561,-74.0086,United States,US,False,flexible,Entire home/apt,2020,$103 ,$21 ,29,4,5/23/2019,0.42,5,96,341,,
53163310,Sonder | 21 Chelsea | Elegant 1BR + Rooftop,60228825064,unconfirmed,Sonder,Manhattan,Chelsea,40.7409,-73.99596,United States,US,False,flexible,Entire home/apt,2008,"$1,114 ",$223 ,29,0,,,4,96,296,#NAME?,
53163862,Sonder | Hanover Square | Modern 1BR + Rooftop,95714573246,verified,Sonder,Manhattan,Financial District,40.70563,-74.0078,United States,US,False,flexible,Entire home/apt,2014,$934 ,$187 ,29,3,4/30/2019,0.26,3,96,328,"This is a non-smoking residence.  There is light housekeeping (biweekly washing of linens, removal of kitchen trash) but guests are expected to clean up after themselves and keep the area tidy, including removing hair from bathtub and sink and washing dishes right away.  Remove shoes in the apartment. Slippers are OK. Turn off lights when exiting a room or hallway. Guests are not permitted without prior authorization. Overnight guests are not allowed.  Be courteous to others in the household.  Additional rules will be in the house manual, available upon arrival.",
53164414,Bright Open 2BR In Charming Greenwich Village,92999259514,unconfirmed,Kevin,Manhattan,Greenwich Village,40.72851,-74.0,United States,US,False,moderate,Entire home/apt,2009,$740 ,$148 ,2,3,5/27/2018,0.2,3,2,0,"- We have a lovable and very social black lab puppy (8 months old). She is still learning her manners, so she may be overly friendly (jumping up, following you around, etc.). She is generally well behaved and crated during the weekdays, as well as sleeping hours.  - There are two porches for your enjoyment. The back porch has a space for relaxing and a propane fueled grill.",
53164966,Comfortable Studio Apt in Heart of East Village,46856592511,unconfirmed,Ben,Manhattan,East Village,40.72926,-73.98456,United States,US,False,flexible,Entire home/apt,2021,$858 ,$172 ,1,25,5/22/2019,1.74,2,1,363,I trust that you will be respectful to my home.  Please do not rearrange furniture.  ABSOLUTELY NO SMOKING INSIDE.   NO HOUSE PARTIES! You will be escorted off the property and asked to leave WITHOUT REFUND!  Take your shoes off and ENJOY BOSTON!   (suggestion: Recommend you go grocery shopping before you check in because the small nearby grocery store has a limited selection. The big grocery store is a 10 minute drive.),
