4912172,Historic West Village Charmer,50627275396,verified,Erin,Manhattan,West Village,40.73822,-74.00605999999999,United States,US,False,moderate,Entire home/apt,2019,$378 ,$76 ,2,11.0,7/18/2018,0.21,2,1,5,"Share our house as a guest, don't worry about cost of snacks or an occasional beer. No smoking. Please consult first if you will be traveling with small children. We try to keep the space clean and ask everyone to remove their shoes in the appartment and be respectful to everyone.",
4912725,Cozy 1BD near midtown Manhattan,5889666754,unconfirmed,Kat,Queens,Long Island City,40.7599,-73.9285,United States,US,False,moderate,Entire home/apt,2006,$194 ,$39 ,14,35.0,5/24/2019,0.69,4,1,218,,
4913277,Room in artist apartment/ close to Ferry,56577909235,unconfirmed,Jeff,Staten Island,Stapleton,40.6375,-74.07654000000001,United States,US,False,flexible,Private room,2004,$716 ,$143 ,1,0.0,,,3,2,226,"Guest should do there dishes and clean after themselves. No alcohol, No drugs, No party's and most important Don't Disturb other guests!",
4913829,Upper East Side Beautiful Studio,78110708104,verified,Cranford,Manhattan,Upper East Side,40.76996,-73.95875,United States,US,True,strict,Entire home/apt,2006,$691 ,$138 ,1,3.0,5/24/2015,0.06,1,1,421,"Please be respectul of other occupants of the apartment. This means: no smoking indoors, no parties, and cleaning up after yourself.",
4914382,Master bedroom in Williamsburg,36520832087,unconfirmed,Renan,Brooklyn,Williamsburg,40.71577,-73.94604,United States,US,False,moderate,Private room,2021,$342 ,$68 ,3,0.0,,,3,1,327,,
4914934,Designer's Red Hook Apartment,85785870190,unconfirmed,Carly,Brooklyn,Red Hook,40.674040000000005,-74.01021,United States,US,True,moderate,Entire home/apt,2010,$475 ,$95 ,5,51.0,5/15/2019,0.95,2,1,3,,
4915486,Comfy Room Family Home LGA Airport NO CLEANING FEE,71780969728,unconfirmed,Danielle,Queens,East Elmhurst,40.763740000000006,-73.87103,United States,US,False,strict,Private room,2014,$942 ,$188 ,1,430.0,7/3/2019,13.45,5,5,184,,
4916038,Large williamsburg apt. Sleeps 4.,85402072614,verified,Martha,Brooklyn,Williamsburg,40.70783,-73.94858,United States,US,False,strict,Entire home/apt,2020,$515 ,$103 ,2,3.0,12/30/2015,0.06,1,1,311,"Please try to make less noise when talking, moving suitcases in your room as the house has very little sound barrier. The stairs makes a lot of noise when people walk fast, please be considered. The guest must be a non-smoker and his/her clothes should not smell of smoke. No smoking inside/outside.  Use of cologne/perfume/other product with noticeable scent/ sprays are not allowed in or out of the house. Trash has to be separated from recycle. No trash may be put in any containers outside of the house. If you unable to separate the trash, at least, please be considered and don't mix recycles with food or personal product waist. Single use plastic bags should not be taking from the store: you will get your personal fordable reusable bag and may keep it. Please use other resources conservatively and be conscience about the impact on the environment. We all share this planet. Don't give this mailing address to anyone before confirming by email First offense address sharing $200, and every",
4916591,Stunning townhouse in Park Slope,66774729491,unconfirmed,Gosia,Brooklyn,Park Slope,40.67034,-73.97511999999999,United States,US,False,strict,Entire home/apt,2018,$972 ,$194 ,2,43.0,6/13/2019,0.82,5,2,201,1. guest should do the dishes by themselves. 2. late check out will be charged $30 from your deposit.,
4917143,Amazingly bright and cozy apartment,47575241710,unconfirmed,Julia,Manhattan,East Village,40.72695,-73.98675,United States,US,False,moderate,Entire home/apt,2016,$142 ,$28 ,10,7.0,1/4/2017,0.13,1,1,397,"House Rules 1. Check-in is 4 pm local time. If the unit is ready earlier, we’ll let you know. Check-out is normally 11 am local time, but we’d be happy to extend it as long as we don’t have a cleaning scheduled. Just let us know.  2. All bookings require a security deposit of at least $300, which will be refunded within 7 days of your check-out. 3. For security measures we require all guests to provide proof of identification through ID verification on our own website. In order to check in we'll need a photo of your ID.  4. Our cancellation policy is as shown on our ad and defined by the site you are booking through.  5. Don’t let $300 go up in smoke. There's no smoking allowed in any Flatbook and a $300 fine for breaking this rule.  6. Unfortunately we don’t allow pets in any of our apartments. 7. Unless you’re staying in one of our specialty apartments, we don’t allow parties or excessive noise. 8. If we find the place very messy, we have to charge an extra $40 for every extra hour o",
4917695,Quiet Bdrm w/Private Bath & TV in BIG apartment!,8612066545,verified,Buddy,Manhattan,Upper West Side,40.78648,-73.9692,United States,US,True,moderate,Private room,2014,$949 ,$190 ,2,78.0,6/2/2019,1.68,2,1,128,"House Rules 1. All bookings made at least a week before check in are fully refundable if cancelled within 24 hours of booking. After this, you will receive a 50% refund if you cancel at least 7 days before the start of your trip. 2. Check-in time is any time after 4 pm local time. If the unit is ready earlier, we’ll let you know. Check-out is normally 11 am local time, but we’d be happy to extend it as long as we don’t have a cleaning scheduled. Just let us know.  3. All bookings require a security deposit of at least $300. 4. For security measures we require all guests to provide proof of identification through ID verification on our own website. In order to check in, we'll need a photo of your ID.  5. Don’t let $300 go up in smoke. There's no smoking allowed in any Flatbook and a $300 fine for breaking this rule.  6. Unfortunately we don’t allow pets in most of our apartments. 7. Unless you’re staying in one of our specialty apartments, we don’t allow parties or excessive noise. 8. I",
4918248,"SpaciousRoom in the heart of New York,Times Square",35682340326,verified,Tiba,Manhattan,Hell's Kitchen,40.76332,-73.9884,United States,US,True,flexible,Private room,2006,$390 ,$78 ,1,38.0,6/21/2019,0.77,3,5,208,,
4918800,Cozy Private Room for one female,96307239083,verified,Christine,Manhattan,East Harlem,40.787440000000004,-73.95211,United States,US,True,strict,Private room,2011,$98 ,$20 ,7,167.0,5/22/2019,3.21,5,1,391,Please take off your shoes outside of house. Keep clean in the kitchen and bathroom. This room is only for one person. ,
4919352,BEAUTIFUL 2 BED/ BRICK WALLS/ 52ST,80920977894,verified,Mike,Manhattan,Midtown,40.75587,-73.96856,United States,US,True,flexible,Entire home/apt,2022,$731 ,$146 ,30,0.0,,,3,52,17,"Please expect to share the apartment with guests having various backgrounds. Be respectful and decent, also enjoy interacting with each other. Please dress descent in the house especially in and out of the shower.",
4919905,1bd in a sunny 2 bd Ft. Greene Apt,65282655666,verified,Carrie,Brooklyn,Fort Greene,40.69454,-73.97166,United States,US,True,strict,Private room,2016,"$1,056 ",$211 ,1,104.0,6/23/2019,2.16,4,1,300,"House Rules 1. Check-in is 4 pm local time. If the unit is ready earlier, we’ll let you know. Check-out is normally 11 am local time, but we’d be happy to extend it as long as we don’t have a cleaning scheduled. Just let us know.  2. All bookings require a security deposit of at least $300, which will be refunded within 7 days of your check-out. 3. For security measures we require all guests to provide proof of identification through ID verification on our own website. In order to check in we'll need a photo of your ID.  4. Our cancellation policy is as shown on our ad and defined by the site you are booking through.  5. Don’t let $300 go up in smoke. There's no smoking allowed in any Flatbook and a $300 fine for breaking this rule.  6. Unfortunately we don’t allow pets in any of our apartments. 7. Unless you’re staying in one of our specialty apartments, we don’t allow parties or excessive noise. 8. If we find the place very messy, we have to charge an extra $40 for every extra hour o",
4920457,Cozy one-bedroom in E Village,41270457041,verified,Nick,Manhattan,East Village,40.729820000000004,-73.98316,United States,US,True,flexible,Entire home/apt,2019,$329 ,$66 ,7,21.0,6/4/2019,0.4,4,1,387,"You are free to help yourself to the cereal, milk, granola, and juice on the top shelf.  We won't be home to make breakfast but you are welcome to enjoy the pre-made items.  Everything should be on the top shelf.",
4921009,"Large, comfy 1br in Williamsburg!",76248222248,unconfirmed,Alexis,Brooklyn,Williamsburg,40.7127,-73.94643,United States,US,False,moderate,Entire home/apt,2019,$455 ,$91 ,60,0.0,,,2,1,409,Shoes off when in the house. No smoking inside. Try to keep it quiet.,
4921561,Monthly Rental in Crown Heights,94811652522,unconfirmed,Forrest,Brooklyn,Crown Heights,40.66809,-73.93373000000001,United States,US,False,flexible,Private room,2020,$660 ,$132 ,28,20.0,4/6/2019,0.37,1,1,287,,
4922114,NOT AVAILABLE,27717628520,verified,Robert,Brooklyn,Prospect Heights,40.68163,-73.96709,United States,US,False,moderate,Private room,2018,$409 ,$82 ,2,3.0,5/17/2015,0.06,2,1,247,"Do not break anything, leave it the way you found it (or better), do not steal anything. Have fun, have guests and have a good time.",
4922666,"Sunny 1000 sqft, heart of Crown Hts",72502589934,verified,Genesis,Brooklyn,Crown Heights,40.67131,-73.94979000000001,United States,US,False,moderate,Entire home/apt,2006,$827 ,$165 ,5,8.0,5/20/2019,0.36,5,1,407,,
4923218,Roomy Studio at Prospect Park,27087046607,unconfirmed,Penelope,Brooklyn,Prospect-Lefferts Gardens,40.656209999999994,-73.95696,United States,US,True,moderate,Entire home/apt,2003,$131 ,$26 ,21,3.0,8/27/2017,0.07,3,1,329,,
4923771,Spacious Brooklyn Loft/private room,65999548642,verified,Theresa,Brooklyn,Bedford-Stuyvesant,40.68716,-73.91882,United States,US,False,flexible,Private room,2005,$636 ,$127 ,7,0.0,,,1,1,71,,
4924323,Spacious private room upper west side,49773035228,unconfirmed,Jinqiu,Manhattan,Upper West Side,40.79678,-73.96545,United States,US,False,flexible,Private room,2012,$921 ,$184 ,2,8.0,10/16/2016,0.22,5,1,259,#NAME?,
4924875,LUXURY*Doorman*Walk to Central Park,8560259648,unconfirmed,Emmanuel,Manhattan,Harlem,40.80657,-73.95532,United States,US,False,moderate,Entire home/apt,2004,$142 ,$28 ,2,,3/5/2015,0.09,1,1,282,,
4925428,True 1BR Apt in Greenwich Village,4870883787,unconfirmed,Maggie,Manhattan,Greenwich Village,40.73253,-73.99826,United States,US,True,flexible,Entire home/apt,2006,$630 ,$126 ,2,15.0,9/29/2016,0.29,5,1,290,"No smoking or drugs. We try to keep the house clean, so we take off our shoes when we come in. We all work or go to grad school, so we like to keep the house clean and quiet.",
4925980,Master Bedroom in Lefferts Garden,5714736260,unconfirmed,Gabriel,Brooklyn,Prospect-Lefferts Gardens,40.65887,-73.95105,United States,US,True,moderate,Private room,2011,$174 ,$35 ,1,0.0,,,1,2,34,"I love meeting guests, and expect you to be clean and respectful of our shared space.",
4926532,Harlem Style Spacious and Sunny,4766353892,unconfirmed,M. Elizabeth,Manhattan,Harlem,40.80516,-73.94299000000001,United States,US,True,moderate,Entire home/apt,2005,$455 ,$91 ,3,126.0,7/5/2019,3.91,1,2,288,#NAME?,
4927084,Modern and convenient,57884424235,unconfirmed,Nadia Dara,Manhattan,Upper East Side,40.77944,-73.95296,United States,US,True,flexible,Entire home/apt,2014,"$1,147 ",$229 ,3,2.0,8/25/2016,0.05,2,1,314,"We are a non-smoking apartment.  Thank you! Please inquire about pets and kids - we don't have any, but it's OK if you do as long as you know what you need to bring to accommodate! :)",
4927637,*Designer West Village Dream Home*,51129552161,unconfirmed,Christina,Manhattan,West Village,40.73451,-74.00746,United States,US,False,flexible,Entire home/apt,2010,$641 ,$128 ,3,12.0,10/23/2016,0.24,4,1,174,"House Rules 1. Check-in is 4 pm local time. If the unit is ready earlier, we’ll let you know. Check-out is normally 11 am local time, but we’d be happy to extend it as long as we don’t have a cleaning scheduled. Just let us know.  2. All bookings require a security deposit of at least $300, which will be refunded within 7 days of your check-out. 3. For security measures we require all guests to provide proof of identification through ID verification on our own website. In order to check in we'll need a photo of your ID.  4. Our cancellation policy is as shown on our ad and defined by the site you are booking through.  5. Don’t let $300 go up in smoke. There's no smoking allowed in any Flatbook and a $300 fine for breaking this rule.  6. Unfortunately we don’t allow pets in any of our apartments. 7. Unless you’re staying in one of our specialty apartments, we don’t allow parties or excessive noise. 8. If we find the place very messy, we have to charge an extra $40 for every extra hour o",
4928189,"GORGEOUS 2 BD PENTH., 500SF TERRACE",40669725519,verified,Dirk,Brooklyn,Williamsburg,40.71135,-73.96596,United States,US,True,strict,Entire home/apt,2005,$58 ,$12 ,2,5.0,1/1/2018,0.12,2,1,212,the female is better(最好是女性房客),
4928741,Luxury penthouse in FiDi,87467826774,unconfirmed,Lisa,Manhattan,Financial District,40.70663,-74.0117,United States,US,False,flexible,Private room,2018,"$1,034 ",$207 ,1,0.0,,,1,1,246,I prefer those person Who would rent my room over 15 days once(Price will be lower) No smoking inside Cleaning my room at least one time in 3 days No other inappropriate actions on bed Thank you so much,
4929294,Convenience & Chill,93814405334,verified,Rachel,Manhattan,Harlem,40.82383,-73.94639000000001,United States,US,False,flexible,Private room,2019,$278 ,$56 ,1,61.0,4/24/2019,1.16,2,1,365,"No cologne/perfumed aftershaves/any sprays/candles/anything burning Non-smoker, no smoking in and out of home No guests/visitors Please be considered to other and make less noise NO street shoes indoor Light use of microwave/toaster oven, not for cooking Pick up after yourself No eating in bed Shower is not to be used 5.45 am-10 am to prevent long wait for bathroom",
4929846,Perfect One Bedroom in Greenpoint,27965468340,verified,David,Brooklyn,Greenpoint,40.72981,-73.95268,United States,US,True,moderate,Entire home/apt,2003,$340 ,$68 ,6,21.0,8/15/2018,0.44,3,1,91,1) No Smoking in property!!!  2) Do not slam doors!!! Close lightly Please!!! 3) No Shoes in house (except slippers) 4) Quiet down AFTER 10PM.,
4930398,Huge 1 Bedroom in East Harlem,43767104330,unconfirmed,Lauren,Manhattan,East Harlem,40.79643,-73.93543000000001,United States,US,False,strict,Entire home/apt,2008,$62 ,$12 ,3,8.0,5/17/2017,0.15,5,1,368,"Quiet, clean, respectable, no smoking  Yes you can practice violin etc (*extra credit if you're a music student/musician, duh~)",
4930951,Cozy Chelsea Studio,14562698485,verified,Ellen,Manhattan,Chelsea,40.7417,-73.9978,United States,US,False,flexible,Entire home/apt,2010,$461 ,$92 ,3,31.0,12/5/2016,0.63,4,1,263,"No drugs/ No loud sex ( sound easily go through to my roomie's room next door ) / ID copy required for check in, and it need to match your credit card information/ Please try to be nice to my fellow roomies, they are all both from China, really organized and nice guys, we are all go to Boston University, we tried really hard to keep this house clean and in the order./ Lost keys charge: $10.01",
4931503,3BDR architect's garden home,14232558549,verified,Julien,Brooklyn,Park Slope,40.67365,-73.9814,United States,US,True,strict,Entire home/apt,2019,$526 ,$105 ,3,5.0,2/19/2019,0.12,2,1,425,This is a non-smoking unit.,
4932055,Best place for families & groups in Manhattan NYC!,25017905560,unconfirmed,Carlina,Manhattan,Harlem,40.827740000000006,-73.95181,United States,US,False,moderate,Private room,2017,$187 ,$37 ,1,28.0,12/8/2018,1.13,2,4,68,"Clean, tidy & respectful. However PLEASE make yourself at home!",
4932607,Convenient place to stay in Manhattan!,94448609676,verified,Carlina,Manhattan,Harlem,40.82801,-73.95167,United States,US,False,strict,Private room,2015,"$1,091 ",$218 ,1,205.0,6/21/2019,3.86,5,4,110,,
4933160,"Cozy, sunny private room",90608913558,unconfirmed,Sara,Brooklyn,Bedford-Stuyvesant,40.68074,-73.92513000000001,United States,US,False,moderate,Private room,2003,$781 ,$156 ,2,21.0,7/17/2016,0.43,1,1,422,No smoking,
4933712,LIC Super Sunny & Spacious 1BR Apt,95621100465,unconfirmed,Serene,Queens,Long Island City,40.744009999999996,-73.95094,United States,US,False,moderate,Entire home/apt,2021,$240 ,$48 ,30,3.0,6/30/2019,0.06,5,1,22,#NAME?,
4934264,1br in duplex of luxury building,94903092213,verified,Daniel,Brooklyn,Williamsburg,40.70792,-73.94601999999999,United States,US,True,strict,Private room,2004,$655 ,$131 ,6,0.0,,,1,1,14,"Please remember that this is a residential building. The building rules, apartment occupancy restrictions and the year-round tenants must be respected.  Parties, pets and smoking are not allowed under any circumstances and incur significant fees. ",
4934817,"COZY, AFFORDABLE, PVT. BEDSTUY ROOM",44315762530,unconfirmed,Tyler,Brooklyn,Bedford-Stuyvesant,40.68833,-73.94329,United States,US,False,flexible,Private room,2008,$691 ,$138 ,1,0.0,,,4,1,324,"Please remember that this is a residential building. The building rules, apartment occupancy restrictions and the year-round tenants must be respected.  Parties, pets and smoking are not allowed under any circumstances and incur significant fees.",
4935369,Perfect Times Square 1 bedroom,6295968790,unconfirmed,James,Manhattan,Hell's Kitchen,40.76064,-73.99112,United States,US,False,flexible,Entire home/apt,2020,$243 ,$49 ,30,119.0,6/11/2019,2.21,4,2,390,"It is very quiet neighborhood,  -No party is allowed in the apt. And  -please keep quiet at late time,after 10:00pm.  - Please take off shoes in the apt.  - Please turn off the central air when leave. You can leave the key and parking permit on table and lock the door. Thanks. Please feel free to let me know you have any question. Thanks.",
4935921,Amazing BR in Doorman Building!,20101430794,verified,Brian,Manhattan,Harlem,40.82415,-73.94113,United States,US,False,moderate,Private room,2011,$186 ,$37 ,2,0.0,,,3,1,6,,
4936474,Gorgeous Renovated One Bedroom ues,52156920291,unconfirmed,Maureen,Manhattan,Upper East Side,40.76761,-73.95391,United States,US,True,strict,Entire home/apt,2016,"$1,046 ",$209 ,6,5.0,6/13/2019,0.11,4,1,235,,
4937026,Huge 3BR on Prospect Park,18216170815,verified,Martin,Brooklyn,Windsor Terrace,40.65494,-73.97478000000001,United States,US,False,strict,Entire home/apt,2013,$264 ,$53 ,3,0.0,,,1,1,228,,
4937578,3 bedroom 2 1/2 bath duplex Park Slope,71802684119,unconfirmed,Mr. & Mrs. Kris,Brooklyn,Sunset Park,40.66298,-73.99011999999999,United States,US,True,flexible,Entire home/apt,2016,$820 ,$164 ,5,1.0,8/14/2018,0.09,2,1,10,Shoes off preferred.,
4938130,"Cozy Room in Bushwick, Brooklyn",2346791756,verified,Carmen,Brooklyn,Bushwick,40.692370000000004,-73.92097,United States,US,True,flexible,Private room,2013,$528 ,$106 ,2,1.0,9/21/2015,0.02,1,1,279,,
4938683,"Spacious, sunny, private loft bdrm!",23012597295,unconfirmed,Tejal,Brooklyn,Bushwick,40.70041,-73.93816,United States,US,True,flexible,Private room,2012,$936 ,$187 ,11,21.0,5/18/2019,0.4,2,1,209,"1. No damage to the house or furniture 2. No Smoking, No Pets, No Drugs 3. No more sleepover people then you booked 4. Keep quiet after 11:00 PM 5. Be respectful to neighbors 6. Keep the kitchen clean after used 7. Keep the bathroom clean after used 8. Return “Parking Permit"" before check out 9. Check-in: 3PM, Check-out: 11:00AM",
4939235,Bushwick Live/Work,71148853183,unconfirmed,Jennifer,Brooklyn,Bushwick,40.69092,-73.90443,United States,US,False,moderate,Private room,2013,"$1,146 ",$229 ,1,0.0,,,3,1,22,- Please clean tools after you use kitchen - Please keep quite after 11pm,
4939787,"Airy, Modern, Large Room W'burg two blocks subway",15611207392,verified,Arti,Brooklyn,Williamsburg,40.71508,-73.94586,United States,US,False,flexible,Private room,2011,$925 ,$185 ,4,38.0,6/12/2019,1.06,3,1,216,,
4940340,Large studio in Manhattan,46101636190,unconfirmed,Alberto,Manhattan,Upper East Side,40.775940000000006,-73.95584000000001,United States,US,False,flexible,Entire home/apt,2005,"$1,068 ",$214 ,3,3.0,2/16/2016,0.06,5,1,153,,
4940892,1.5 Bedroom - Artist's Retreat,23519496293,unconfirmed,Amy,Queens,Long Island City,40.76117,-73.9265,United States,US,False,strict,Entire home/apt,2018,"$1,033 ",$207 ,2,19.0,2/17/2018,0.41,5,1,68,,
4941444,FANTASTIC MANHATTAN LIVING 5 day Minimum,84944200691,verified,Patricio,Manhattan,Harlem,40.815020000000004,-73.9546,United States,US,True,moderate,Entire home/apt,2005,$101 ,$20 ,90,7.0,2/26/2018,0.28,4,1,379,,
4941997,Home 4 Medical Professionals-St John's Episcopal 2,76351840620,unconfirmed,Stat,Queens,Far Rockaway,40.59642,-73.75605999999999,United States,US,False,moderate,Private room,2008,$635 ,$127 ,6,5.0,12/2/2017,0.11,1,43,141,"1. No damage to the house or furniture 2. No Smoking, No Pets, No Drugs 3. No more sleepover people then you booked 4. Keep quiet after 11:00 PM 5. Be respectful to neighbors 6. Keep the kitchen clean after used 7. Keep the bathroom clean after used 8. Check-in: 3PM, Check-out: 11:00AM",
4942549,"Cozy Room in Clinton Hill, Bk",6747592775,verified,Vaida,Brooklyn,Bedford-Stuyvesant,40.68977,-73.95603,United States,US,True,strict,Private room,2009,$414 ,$83 ,1,1.0,8/31/2015,0.02,2,2,317,,
4943101,Comfortable & Spacious 1 BR apt,54751731970,unconfirmed,Marýa,Brooklyn,Crown Heights,40.67116,-73.94293,United States,US,True,strict,Entire home/apt,2022,$967 ,$193 ,7,11.0,11/11/2016,0.21,1,1,14,,
4943653,Bright room in townhouse with yard!,4130453026,unconfirmed,Julien,Brooklyn,Bedford-Stuyvesant,40.68006,-73.91113,United States,US,True,flexible,Private room,2018,"$1,114 ",$223 ,1,35.0,6/26/2019,0.69,3,2,178,"1. No damage to the house or furniture 2. No Smoking, No Pets, No Drugs 3. No more sleepover people then you booked 4. Keep quiet after 11:00 PM 5. Be respectful to neighbors 6. Keep the kitchen clean after used 7. Keep the bathroom clean after used 8. Check-in: 3PM, Check-out: 11:00AM",
4944206,Classic Harlem Brownstone - Manhattan,51866903225,unconfirmed,Glenda,Manhattan,Harlem,40.82306,-73.94688000000001,United States,US,False,strict,Private room,2012,$656 ,$131 ,1,209.0,6/13/2019,4.12,5,3,-10,,
4944758,Metro Retreat  - - Harlem,20006888686,unconfirmed,Glenda,Manhattan,Harlem,40.821529999999996,-73.94651,United States,US,False,moderate,Private room,2020,$652 ,$130 ,1,194.0,6/22/2019,3.81,5,3,288,This is a non smoking apartment. No l,
4945310,Quiet Room in 4BR UWS Brownstone,72626567708,verified,Greg,Manhattan,Upper West Side,40.80173,-73.96625,United States,US,True,moderate,Private room,2020,$238 ,$48 ,1,0.0,,,3,1,25,Keep in mind your neighbors are very close.  Excessive noise and unacceptable behavior will not be tolerated.,
4945863,Sunny 1BR in the East Village center,8934408460,unconfirmed,Vladimir,Manhattan,East Village,40.726690000000005,-73.98275,United States,US,True,moderate,Entire home/apt,2016,$471 ,$94 ,5,63.0,6/24/2019,1.24,4,1,201,"1. No damage to the house or furniture 2. No Smoking, No Pets, No Drugs 3. No more sleepover people then you booked 4. Keep quiet after 11:00 PM 5. Be respectful to neighbors 6. Keep the kitchen clean after used 7. Keep the bathroom clean after used 8. Check-in: 3PM, Check-out: 11:00AM",
4946415,Private room available in Dumbo Brooklyn,82272131954,verified,Kayla,Brooklyn,Fort Greene,40.69605,-73.98207,United States,US,False,strict,Private room,2015,$157 ,$31 ,1,3.0,7/15/2016,0.08,5,2,12,#NAME?,
4946967,"Cozy, Convenient, Clean & Colorful!",60920617071,verified,Robin Laverne,Brooklyn,Bushwick,40.68755,-73.91856,United States,US,False,moderate,Private room,2013,$322 ,$64 ,2,77.0,6/19/2019,1.56,2,3,16,,
4947520,Upper West Nest,24388487795,unconfirmed,Neda,Manhattan,Upper West Side,40.79148,-73.97828,United States,US,True,strict,Entire home/apt,2014,$837 ,$167 ,100,2.0,8/1/2018,0.04,3,1,161,"- Please be respectful of the household, if you need anything, just ask.  - No smoking in unit. - No loud noises after 10PM.",
4948072,private room,94208547480,unconfirmed,Catherine,Brooklyn,Sheepshead Bay,40.600590000000004,-73.95899,United States,US,False,strict,Private room,2021,$781 ,$156 ,1,3.0,10/14/2015,0.06,3,2,132,"1. No damage to the house or furniture 2. No Smoking, No Pets, No Drugs 3. No more sleepover people then you booked 4. Keep quiet after 11:00 PM 5. Be respectful to neighbors 6. Keep the kitchen clean after used 7. Keep the bathroom clean after used 8. Check-in: 3PM, Check-out: 11:00AM",
4948624,Large Size Room Next to Subway,37105698387,verified,Nikki,Brooklyn,Bedford-Stuyvesant,40.69467,-73.9501,United States,US,True,flexible,Private room,2014,$318 ,$64 ,5,20.0,10/23/2017,0.38,5,1,412,"- Washer/dryer coinup in apartment basement. - There is no set check-in time. I can accommodate you, and I may not even be on the premises. The last date offered in the calendar is the vacate date not the last night. - May be available on Sunday the 21st.",
4949176,Furnished studioB UES (30 days MIN),39784835334,unconfirmed,Elem,Manhattan,Upper East Side,40.77339,-73.95421,United States,US,False,flexible,Entire home/apt,2008,$94 ,$19 ,30,13.0,5/25/2019,0.26,2,15,349,,
