50163216,NEW & PRIVATE 2 bedroom apt in stately townhouse,26096842280,verified,Ken,Brooklyn,Gowanus,40.68255,-73.9899,United States,US,False,flexible,Entire home/apt,2022,"$1,189 ",$238 ,30,118.0,6/6/2019,3.53,4,1,265,"House Rules 1. All bookings made at least a week before check in are fully refundable if cancelled within 24 hours of booking. After this, you will receive a 50% refund if you cancel at least 7 days before the start of your trip. 2. Check-in time is any time after 4 pm local time. If the unit is ready earlier, we’ll let you know. Check-out is normally 11 am local time, but we’d be happy to extend it as long as we don’t have a cleaning scheduled. Just let us know.  3. All bookings require a security deposit of at least $300. 4. For security measures we require all guests to provide proof of identification through ID verification on our own website. In order to check in, we'll need a photo of your ID.  5. Don’t let $300 go up in smoke. There's no smoking allowed in any Flatbook and a $300 fine for breaking this rule.  6. Unfortunately we don’t allow pets in most of our apartments. 7. Unless you’re staying in one of our specialty apartments, we don’t allow parties or excessive noise. 8. I",
50163768,"Fab Studio with Gym, Doorman & Elevator Sleeps 4",13461533997,unconfirmed,Abc,Manhattan,West Village,40.73322,-74.00853000000001,United States,US,False,flexible,Entire home/apt,2006,$431 ,$86 ,30,12.0,1/6/2019,0.38,4,1,165,No Smoking  No Pets,
50164321,Clean Private Bedroom - Bushwick Brooklyn New York,52656801921,verified,Leslie,Brooklyn,Bedford-Stuyvesant,40.68303,-73.91238,United States,US,False,flexible,Private room,2014,$491 ,$98 ,1,2.0,10/9/2016,0.06,5,1,0,,
50164873,UNION SQUARE / Perfect Cozy Private Room!,75056610521,verified,Haru,Manhattan,Gramercy,40.73402,-73.9862,United States,US,True,strict,Private room,2011,$864 ,$173 ,1,88.0,6/20/2019,2.76,1,1,14,,
50165425,*ENJOY NYC*New Renovated Apartment(Private room),30722341797,verified,Sasha,Bronx,Woodlawn,40.882529999999996,-73.86950999999999,United States,US,False,flexible,Private room,2007,$164 ,$33 ,1,6.0,10/9/2018,0.19,2,1,87,"The building has a very strict no smoking policy, please do not smoke in the apartment.  Our neighbors are very conservative, please be respectful, and discreet. No grilling is allowed on the roof.",
50165977,Cozy Apt in NYC Brownstone,28213537042,verified,Joyce,Manhattan,Murray Hill,40.746990000000004,-73.97659,United States,US,False,strict,Entire home/apt,2020,$627 ,$125 ,3,62.0,7/1/2019,3.19,4,2,49,,
50166530,Private Retreat in Brooklyn,13020124165,verified,Tim & Rachel,Brooklyn,East Flatbush,40.65141,-73.92511999999999,United States,US,False,strict,Entire home/apt,2012,$933 ,$187 ,3,109.0,6/20/2019,3.29,3,1,232,,
50167082,Private room for 1 or 2 in Chelsea. Prime location,47777573945,verified,Lindsay,Manhattan,Chelsea,40.74853,-73.99593,United States,US,False,flexible,Private room,2006,"$1,138 ",$228 ,1,18.0,1/11/2017,0.55,5,1,0,,
50167634,Wyndham Midtown 45 New York City Studio,98685780705,verified,Vacation Generation,Manhattan,Midtown,40.7536,-73.97306,United States,US,True,flexible,Entire home/apt,2014,$116 ,$23 ,2,9.0,9/15/2017,0.34,1,1,0,,
50168187,Comfy room in quaint apartment above the Park,74128422835,unconfirmed,Katharine,Manhattan,East Harlem,40.79523,-73.94278,United States,US,False,flexible,Private room,2017,"$1,054 ",$211 ,120,0.0,,,4,1,173,,
50168739,Spacious Tribeca loft! Roofdeck & close to trains,45342427224,unconfirmed,Jamie,Manhattan,Civic Center,40.71625,-74.00401,United States,US,True,moderate,Entire home/apt,2004,$630 ,$126 ,2,0.0,,,5,1,0,,
50169291,Newly Renovated Studio Near Manhattan,41222120501,unconfirmed,Zia,Queens,Woodside,40.74767,-73.90720999999999,United States,US,False,moderate,Entire home/apt,2005,"$1,099 ",$220 ,2,9.0,6/3/2017,0.27,3,1,8,I expect you to keep the apartment picked up and left how it was when you arrived.,
50169844,Luxury Apartment in Williamsburg!,84612314407,unconfirmed,David,Brooklyn,Williamsburg,40.712579999999996,-73.95191,United States,US,True,strict,Entire home/apt,2020,$436 ,$87 ,5,5.0,6/14/2018,0.16,3,3,0,1. No house parties 2. Do not damage any of the furniture or appliances.  3. Do not take anything that has been provided for your comfort and enjoyment.  4. Enjoy yourself! And please reach out if you have any questions or concerns.,
50170396,1 bedroom in sunny Nolita apartment,38316674149,verified,Lauren,Manhattan,Nolita,40.7215,-73.99395,United States,US,True,flexible,Private room,2009,$771 ,$154 ,2,5.0,3/11/2017,0.16,2,1,0,"Please remember that this is a residential building. The building rules, apartment occupancy restrictions and the year-round tenants must be respected.  Parties, pets and smoking are not allowed under any circumstances and incur significant fees.",
50170948,Amazing Space...Awesome Location...Private Room,87956109325,unconfirmed,Mike,Brooklyn,Prospect Heights,40.67431,-73.9651,United States,US,True,moderate,Private room,2014,$799 ,$160 ,3,3.0,10/16/2018,0.09,4,1,0,,
50171500,1 Bedroom (Queen) Mins From JFK and Casino,23153676994,verified,Iwona,Queens,Jamaica,40.67518,-73.78045999999999,United States,US,False,strict,Private room,2014,$527 ,$105 ,1,45.0,6/28/2019,1.33,2,4,8,No smoking. Please be respectful of our neighbors.,
50172053,Colorful Artist Apartment in Park Slope Brooklyn,55377433596,verified,Caroline,Brooklyn,South Slope,40.666340000000005,-73.98185,United States,US,True,flexible,Entire home/apt,2007,$150 ,$30 ,1,32.0,5/27/2019,0.96,4,1,0,"7 nights minimum stay No pets at any time No smoking Please be mindful of the furniture and personal belongings, it was all furnished with designer pieces and hard to replace things.",
50172605,Historic Townhome for Shoots/Videos,42291675369,unconfirmed,Raymond,Manhattan,Harlem,40.80594,-73.9454,United States,US,False,moderate,Entire home/apt,2008,"$1,126 ",$225 ,1,2.0,10/22/2018,0.17,1,3,88,No smoking or pets allowed,
50173157,Beautiful Private Room near Columbia University,98652744954,verified,Gabriel,Manhattan,Morningside Heights,40.80751,-73.96619,United States,US,False,moderate,Private room,2016,$987 ,$197 ,2,5.0,9/15/2017,0.15,4,2,0,,
50173710,Bushwick Bedroom (Available Daily Again),40833811451,unconfirmed,Jasmine,Brooklyn,Bushwick,40.69804,-73.92815999999999,United States,US,False,moderate,Private room,2016,"$1,052 ",$210 ,1,45.0,5/31/2019,1.35,3,4,351,,
50174262,Gatsby Room,79354262836,verified,Maria,Manhattan,Lower East Side,40.72203,-73.98986,United States,US,True,strict,Private room,2009,$243 ,$49 ,1,2.0,8/6/2017,0.08,1,3,0,,
50174814,Cozy Island Bedroom near Ferry,56000870898,verified,Tony & Grace,Staten Island,St. George,40.64055,-74.0784,United States,US,True,strict,Private room,2018,$953 ,$191 ,1,60.0,6/16/2019,1.84,5,3,336,,
50175367,Gatsby Room 2,77519378806,unconfirmed,Maria,Manhattan,Lower East Side,40.72205,-73.9913,United States,US,True,strict,Private room,2018,"$1,095 ",$219 ,1,3.0,2/24/2018,0.17,1,3,0,No smoking or pets,
50175919,LUXURY SUTTON PLACE RESIDENCY~DOORMAN/GYM/ELEVATOR,60470335667,unconfirmed,Ruchi,Manhattan,Midtown,40.75936,-73.96293,United States,US,False,strict,Entire home/apt,2015,$61 ,$12 ,30,0.0,,,3,49,364,,
50176471,Gatsby Room 1,34607667961,verified,Maria,Manhattan,Lower East Side,40.723420000000004,-73.99108000000001,United States,US,True,moderate,Private room,2004,$833 ,$167 ,1,0.0,,,1,3,0,#NAME?,
50177023,Bright & spacious apartment in East Williamsburg,42050391245,verified,Anu,Brooklyn,Williamsburg,40.70912,-73.94513,United States,US,True,flexible,Entire home/apt,2018,$168 ,$34 ,2,22.0,7/7/2019,0.66,4,1,5,"House rules: Guests agree to the following terms and conditions 1.Guest(s) agree to NO PARTIES anywhere on the property. Legal action will be taken for parties that cause damages to the unit, property, reputation, or relationship with building staff or other residents.  2.Smoking of any kind is not permitted in the unit or on the premises.  3.Guests agree to abide by maximum occupancy of unit, and observe quiet hours between 9pm and 9am 4.Guests are responsible for action of ALL GUESTS occupying their unit at all times.  5.Guests agree to return all keys, remotes, and parking passes. Replacement fees may apply for unreturned items 6.Guests understand that onsite building staff (maintenance and concierge) are not affiliated with Jordan or AIRBNB. Please contact me directly for any needed items. 7.Guests understand that no pets are to be in the unit.  8.Guests agree to pay replacement cost for any unreturned items, and $125 per hour fee for unauthorized early checkin or late checkout.  14",
50177576,EPIC VIEWS ❤️ Wyndham Midtown 45 at NYC Studio ❤️,85152975677,verified,ResortShare5,Manhattan,Midtown,40.7531,-73.97321,United States,US,False,strict,Private room,2018,$737 ,$147 ,2,3.0,10/18/2018,0.09,3,13,324,No smoking and no parties.,
50178128,~**GORGEOUS DOWNTOWN LOFTS**~ MULTIPLE SPACES,85332200279,verified,Sam,Manhattan,Chinatown,40.71745,-73.99409,United States,US,True,moderate,Entire home/apt,2005,$406 ,$81 ,1,23.0,3/27/2019,0.69,5,5,364,"No smoking, no pets. Please keep the noise at a respectful level at all times - *particularly after 10pm (as other units in the building are owner-occupied). Please treat it as though it were your own home.",
50178680,Clean and Sunny room near Midtown Manhattan,10859758520,unconfirmed,Daljit,Queens,Astoria,40.75786,-73.92808000000001,United States,US,False,strict,Private room,2014,$890 ,$178 ,2,108.0,6/30/2019,3.2,5,3,20,No smoking. Not pets/animals. No parties or events. No entertaining beyond confirmed booked guests.,
50179233,Comfy Private Room w/ Big TV,2030327836,unconfirmed,Belkis,Bronx,Bronxdale,40.85585,-73.86486,United States,US,True,strict,Private room,2018,$338 ,$68 ,5,65.0,6/4/2019,1.94,1,2,328,,
50179785,Beautiful Bedroom by Prospect Park,71143817423,verified,Tracy,Brooklyn,Flatbush,40.65228,-73.96401999999999,United States,US,True,flexible,Private room,2009,$858 ,$172 ,3,1.0,10/13/2016,0.03,5,1,0,"Absolutely no smoking, no pets, parties or excessive noise in the apartment.  This is a quiet residential building, perfect for travelers wanting a quiet refuge at the end of a fun filled day in Greater Boston.",
50180337,Bright and modern 1 BR in Williamsburg w/balcony,67340297081,unconfirmed,Kevin,Brooklyn,Williamsburg,40.712379999999996,-73.96279,United States,US,False,strict,Entire home/apt,2013,$611 ,$122 ,3,1.0,10/9/2016,0.03,1,1,0,"House rules: Guests agree to the following terms and conditions 1.Guest(s) agree to NO PARTIES anywhere on the property. Legal action will be taken for parties that cause damages to the unit, property, reputation, or relationship with building staff or other residents.  2.Smoking of any kind is not permitted in the unit or on the premises.  3.Guests agree to abide by maximum occupancy of unit, and observe quiet hours between 9pm and 9am 4.Guests are responsible for action of ALL GUESTS occupying their unit at all times.  5.Guests agree to return all keys, remotes, and parking passes. Replacement fees may apply for unreturned items 6.Guests understand that onsite building staff (maintenance and concierge) are not affiliated with Jordan or AIRBNB. Please contact me directly for any needed items. 7.Guests understand that no pets are to be in the unit.  8.Guests agree to pay replacement cost for any unreturned items, and $125 per hour fee for unauthorized early checkin or late checkout.  14",
50180890,Naturally lit room in Artsy Bushwick,73256479444,verified,Auzi,Brooklyn,Bushwick,40.69108,-73.91530999999999,United States,US,True,moderate,Private room,2007,$537 ,$107 ,5,0.0,,,5,1,0,"Please remember that this is a residential building. The building rules, apartment occupancy restrictions and the year-round tenants must be respected.",
50181442,Enjoy NYC and feel like your home!,51466355920,verified,Diana,Manhattan,Washington Heights,40.856790000000004,-73.932,United States,US,False,strict,Private room,2013,$450 ,$90 ,2,60.0,6/23/2019,1.79,1,1,60,"No smoking, no parties, no pets.",
50181994,Beautiful Large Room,24265052513,verified,Airamis,Bronx,Bronxdale,40.85236,-73.86632,United States,US,True,strict,Private room,2021,$288 ,$58 ,1,114.0,10/9/2018,3.48,4,1,0,"Please remember that this is a residential building. The building rules, apartment occupancy restrictions and the year-round tenants must be respected.  Parties, pets and smoking are not allowed under any circumstances and incur significant fees.",
50182546,An artistic experience,45979585681,verified,Patricia,Brooklyn,Williamsburg,40.7155,-73.95631999999999,United States,US,True,flexible,Private room,2020,$913 ,$183 ,5,15.0,6/4/2019,0.46,2,2,288,No Smoking,
50183099,Large one bed room pied a terre in Park Slope,65753083401,unconfirmed,Jean Victor,Brooklyn,Park Slope,40.67293,-73.98609,United States,US,False,moderate,Entire home/apt,2004,$903 ,$181 ,30,7.0,10/28/2018,0.24,4,1,189,"House rules: Guests agree to the following terms and conditions 1.Guest(s) agree to NO PARTIES anywhere on the property. Legal action will be taken for parties that cause damages to the unit, property, reputation, or relationship with building staff or other residents.  2.Smoking of any kind is not permitted in the unit or on the premises.  3.Guests agree to abide by maximum occupancy of unit, and observe quiet hours between 9pm and 9am 4.Guests are responsible for action of ALL GUESTS occupying their unit at all times.  5.Guests agree to return all keys, remotes, and parking passes. Replacement fees may apply for unreturned items 6.Guests understand that onsite building staff (maintenance and concierge) are not affiliated with Jordan or AIRBNB. Please contact me directly for any needed items. 7.Guests understand that no pets are to be in the unit.  8.Guests agree to pay replacement cost for any unreturned items, and $125 per hour fee for unauthorized early checkin or late checkout.  14",
50183651,Fort Greene - Whole Apartment with washer & dryer,76795880894,unconfirmed,Lauren,Brooklyn,Fort Greene,40.68725,-73.97458,United States,US,False,flexible,Entire home/apt,2009,$936 ,$187 ,2,4.0,5/13/2017,0.12,4,1,0,No Smoking,
50184203,Spacious Room in IDEAL LES LOCATION,91601640316,verified,Daniel,Manhattan,Chinatown,40.7164,-73.99188000000001,United States,US,False,strict,Private room,2017,$322 ,$64 ,25,13.0,5/8/2019,0.48,4,5,38,,
50184756,Sunny  Space in Crown Heights,75004147942,verified,Andre,Brooklyn,Crown Heights,40.666309999999996,-73.94764,United States,US,True,flexible,Private room,2006,$430 ,$86 ,30,3.0,9/3/2018,0.15,1,8,189,ABSOLUTELY NO SMOKING.,
50185308,Cozy Space in Crown Heights,6842521294,unconfirmed,Andre,Brooklyn,Crown Heights,40.66596,-73.94936,United States,US,False,flexible,Private room,2006,$72 ,$14 ,1,13.0,12/6/2018,0.39,1,8,311,"House Rules 1. Check-in is 4 pm local time. If the unit is ready earlier, we’ll let you know. Check-out is normally 11 am local time, but we’d be happy to extend it as long as we don’t have a cleaning scheduled. Just let us know.  2. All bookings require a security deposit of at least $300, which will be refunded within 7 days of your check-out. 3. For security measures we require all guests to provide proof of identification through ID verification on our own website. In order to check in we'll need a photo of your ID.  4. Our cancellation policy is as shown on our ad and defined by the site you are booking through.  5. Don’t let $300 go up in smoke. There's no smoking allowed in any Flatbook and a $300 fine for breaking this rule.  6. Unfortunately we don’t allow pets in any of our apartments. 7. Unless you’re staying in one of our specialty apartments, we don’t allow parties or excessive noise. 8. If we find the place very messy, we have to charge an extra $40 for every extra hour o",
50185860,Nice apartment in Gramercy.,22419115580,verified,Juan Eduardo,Manhattan,Gramercy,40.737359999999995,-73.98025,United States,US,True,flexible,Entire home/apt,2003,$63 ,$13 ,5,8.0,2/25/2018,0.25,3,2,0,,
50186413,"2 Bedrooms, Luxury Doorman, Grand Central, Perfect",83455392313,unconfirmed,Gal,Manhattan,Midtown,40.75241,-73.97081,United States,US,True,flexible,Entire home/apt,2022,"$1,147 ",$229 ,30,0.0,,,3,12,226,No party No alcohol,
50186965,Best of Wall Street (Full Studio ALL yours),62532249108,unconfirmed,Yasir,Manhattan,Financial District,40.706509999999994,-74.00656,United States,US,False,flexible,Entire home/apt,2018,"$1,084 ",$217 ,2,1.0,10/10/2016,0.03,3,1,0,"Please remember that this is a residential building. The building rules, apartment occupancy restrictions and the year-round tenants must be respected.",
50187517,"Ideal vacationing spot for beach lovers, near JFK",79816038440,unconfirmed,Chadine,Queens,Arverne,40.589290000000005,-73.79441,United States,US,True,flexible,Private room,2006,$427 ,$85 ,3,3.0,6/21/2017,0.1,2,2,0,No smoking or partying.,
50188069,"Netflix and Rest, One quaint bedroom in Ft. Greene",73080659860,verified,Malik,Brooklyn,Fort Greene,40.68906,-73.97896999999999,United States,US,False,moderate,Private room,2018,$205 ,$41 ,1,82.0,6/9/2019,2.45,1,1,67,,
50188622,Cityscape Views at Lux 1 Bed/1 Bath in Lincoln Sq.,36879464632,verified,Henry,Manhattan,Upper West Side,40.78065,-73.98253000000001,United States,US,False,flexible,Entire home/apt,2008,$958 ,$192 ,30,17.0,4/16/2017,0.51,1,11,365,,
50189174,Artsy Duplex in Chelsea w/ Huge Terrace,98010902659,verified,Nauman,Manhattan,Chelsea,40.74738,-74.00134,United States,US,True,flexible,Entire home/apt,2019,$85 ,$17 ,3,3.0,5/20/2017,0.09,5,2,0,We provide this in the apartment. Residential neighborhood.  Quiet is important.  No smoking. No pets,
50189726,Spacious 1BR Apt / Hamilton Heights,3021391885,unconfirmed,Matt,Manhattan,Harlem,40.822179999999996,-73.94593,United States,US,False,flexible,Entire home/apt,2004,$222 ,$44 ,1,4.0,10/30/2016,0.12,1,1,0,"Maximum of 2 people over 21 years of age may stay in this studio. There is a one week minimum stay and there is little if any parking available. Sorry, no children and no pets. This place is best for people visiting Boston for conferences, research, or being near family. It is not a resort and there are strict condominium rules about quiet and privacy.",
50190279,Basement private room w/AC near LaGuardia Airport,65139820439,unconfirmed,Giovanni,Queens,East Elmhurst,40.75849,-73.87068000000001,United States,US,True,moderate,Private room,2016,$634 ,$127 ,1,218.0,7/7/2019,6.91,3,1,153,The apartment is non-smoking and pets are not allowed.,
50190831,Comfortable Chelsea Room,40361896655,unconfirmed,Rahul,Manhattan,Chelsea,40.746809999999996,-74.00005999999999,United States,US,False,strict,Private room,2012,"$1,086 ",$217 ,7,3.0,8/3/2018,0.21,5,2,0,,
50191383,TOWNHOUSE  (Backyard/Rooftop + Photoshoots/Events),1906608332,verified,Benjamin,Brooklyn,Bushwick,40.69003,-73.90890999999999,United States,US,True,flexible,Entire home/apt,2009,$470 ,$94 ,1,131.0,7/7/2019,4.11,4,1,321,,
50191936,Wyndham Studio Condo with Kitchen SPECIAL TODAY!,75714929307,verified,Wynpoints,Manhattan,Midtown,40.75175,-73.97218000000001,United States,US,False,moderate,Private room,2004,$475 ,$95 ,3,8.0,12/6/2016,0.24,5,12,365,,
50192488,Private Room in Williamsburg,44985565147,unconfirmed,Manuel,Brooklyn,Williamsburg,40.70683,-73.94582,United States,US,True,flexible,Private room,2021,"$1,134 ",$227 ,1,0.0,,,3,1,0,"We need to know your arrival time ALMOST 2 days before your arrival, as we need to plan arrivals and cleaning, so it's to guarantee you that you will find the flat clean and ready at your arrival. - Check out is 10:00am and if you will be late, we can charge a late check out fee (min $25) and any damage that your delay can cause to the incoming guest or to the cleaning service. - Smoking is not allowed as are loud noises after 10pm or before 9am. - Guests are not allowed to have extra guests. - A regular check out cleaning is included in the price but it doesn't mean that we will wash your dishes or pick up the garbage all around the house, so please use the trash bin and clean after using the kitchen, if not we will take pictures and charge you the extra cleaning. - There is no daily cleaning service during your stay or any change of linen/towels if you're staying more than 3 nights we can agree a change of towels (only), just ask us in advance. We're here to do the best for our guest",
50193040,Huge Room in Ideal LES location,19308753052,unconfirmed,Daniel,Manhattan,Chinatown,40.715920000000004,-73.99332,United States,US,False,flexible,Private room,2012,$473 ,$95 ,25,20.0,12/12/2018,0.9,4,5,365,,
50193592,Cosy Appartment in Upper East Side,87369826045,unconfirmed,Rémi,Manhattan,Upper East Side,40.76952,-73.94892,United States,US,False,strict,Entire home/apt,2014,"$1,052 ",$210 ,7,12.0,4/18/2019,0.39,4,1,32,"Please remember that this is a residential building. The building rules, apartment occupancy restrictions and the year-round tenants must be respected.  Parties and smoking are not allowed under any circumstances and incur significant fees. Parties and smoking are not allowed under any circumstances and incur significant fees. Pets may be considered with pre-approval and an additional pet fee.",
50194145,"Comfy & Vibrant Bedroomm of Bushwick, Jefferson L",56482350642,unconfirmed,Ritchie,Brooklyn,Bushwick,40.70588,-73.92302,United States,US,True,flexible,Private room,2016,$235 ,$47 ,1,7.0,1/22/2017,0.21,4,1,0,#NAME?,
50194697,"One Room in  Luxury Apartment, 5min to Midtown",52629933372,verified,Joanna,Queens,Long Island City,40.74569,-73.94684000000001,United States,US,False,strict,Private room,2022,$362 ,$72 ,4,10.0,5/29/2019,0.33,1,1,70,Please no smoking in any of the inside premises or on the roof deck; no loud music; no moving or rearranging furniture; and no guests beyond those indicated at booking (without clearing with owner first).,
50195249,PRIVATE BED ROOM 12 MINS FROM JFK,31911085148,verified,Pamela,Queens,St. Albans,40.70348,-73.76621,United States,US,True,flexible,Private room,2007,$416 ,$83 ,1,71.0,5/27/2019,2.12,2,3,365,"Please remember that this is a residential building. The building rules, apartment occupancy restrictions and the year-round tenants must be respected.",
50195802,"Huge Apt 5 miles to Manhattan, Parking available",77288609872,unconfirmed,Mag,Queens,Maspeth,40.726929999999996,-73.90319000000001,United States,US,True,flexible,Entire home/apt,2005,$230 ,$46 ,1,92.0,6/25/2019,2.75,5,1,316,"The apartment feels larger then listed, Nice high ceiling in the living room and an Island kitchen to enjoy breakfast.  The bedroom has a loft that fit a queen mattress, hardwood floors through out.  Bathroom has a bath tub",
50196354,"JFK 20 and LGA 30, Heat Private 2 Bedrooms",36328301064,unconfirmed,Farida,Queens,Kew Gardens Hills,40.73216,-73.81841,United States,US,False,moderate,Private room,2010,"$1,112 ",$222 ,1,0.0,,,1,1,241,,
50196906,YOUR HOME AWAY FROM HOME -- NYC WELCOMES YOU!,68099074586,verified,Clyde,Brooklyn,Flatbush,40.64747,-73.96171,United States,US,False,moderate,Private room,2017,"$1,027 ",$205 ,3,65.0,5/17/2019,1.95,5,2,335,"No smoking in the apartment, in the building or outside of the building.  We ask that you be quiet and respectful of our neighbors.",
50197459,Chic room by the park in Bushwick,94824529325,unconfirmed,Patrick,Brooklyn,Bushwick,40.70191,-73.92298000000001,United States,US,True,flexible,Private room,2009,$58 ,$12 ,1,11.0,4/19/2017,0.35,4,1,0,No smoking is a MUST. Fireplace is decorative only. No candles may be lit - I do have battery operated available.,
50198011,Private bedroom in artsy NYC apartment.,51890310867,unconfirmed,Eean,Bronx,Norwood,40.8722,-73.87607,United States,US,True,flexible,Private room,2019,$488 ,$98 ,3,22.0,6/2/2019,0.76,3,1,342,No smoking or parties allowed,
50198563,Fun time in Williamsburg stylish apartment!,10439279775,verified,Satomi,Brooklyn,Williamsburg,40.70879,-73.94937,United States,US,True,moderate,Private room,2011,"$1,044 ",$209 ,7,15.0,4/28/2019,0.45,4,1,292,"House Rules 1. Check-in is 4 pm local time. If the unit is ready earlier, we’ll let you know. Check-out is normally 11 am local time, but we’d be happy to extend it as long as we don’t have a cleaning scheduled. Just let us know.  2. All bookings require a security deposit of at least $300, which will be refunded within 7 days of your check-out. 3. For security measures we require all guests to provide proof of identification through ID verification on our own website. In order to check in we'll need a photo of your ID.  4. Our cancellation policy is as shown on our ad and defined by the site you are booking through.  5. Don’t let $300 go up in smoke. There's no smoking allowed in any Flatbook and a $300 fine for breaking this rule.  6. Unfortunately we don’t allow pets in any of our apartments. 7. Unless you’re staying in one of our specialty apartments, we don’t allow parties or excessive noise. 8. If we find the place very messy, we have to charge an extra $40 for every extra hour o",
50199115,BEAUTIFUL BEDROOM IN COZY APARTMENT,74970520176,verified,Jose,Queens,Woodside,40.74845,-73.89665,United States,US,True,moderate,Private room,2010,$752 ,$150 ,1,42.0,6/28/2019,1.26,3,1,364,"Shoes off at entry. Please NO SMOKERS or smoking on premises.  No loud music or loud voices on deck out of concern for neighbors.  Dispose of trash in receptacles rear of building.  Max 2 guests to share guest bedroom, SOFA IS NOT AN EXTRA BED.  Please NO VISITORS in unit beyond approved Air BND guests.  No use of fire place.  No cleaning fee, please clean dishes and dispose of smelly trash.  Thank you!!! :-)",
50199668,"Spacious room in a clean, quiet and cozy home.",50606006036,unconfirmed,Luis,Queens,Sunnyside,40.73922,-73.9265,United States,US,False,strict,Private room,2017,$829 ,$166 ,1,76.0,7/7/2019,2.28,4,1,76,,
