44110008,Parisian Apt in PRIME Carroll Gardens Brooklyn,57991286073,unconfirmed,Jane Jo,Brooklyn,Gowanus,40.680659999999996,-73.99096999999999,United States,US,False,moderate,Entire home/apt,2020,$97 ,$19 ,5,12,9/10/2017,0.41,1,1.0,0,"This is a non-smoking residence.  There is light housekeeping (biweekly changing of linens, removal of kitchen trash) but guests are expected to clean up after themselves and keep the area tidy, including removing hair from bathtub and sink and washing dishes right away.  Remove shoes in the apartment. Slippers are OK. Turn off lights when exiting a room or hallway. Guests are not permitted without prior authorization. Overnight guests are not allowed.  Be courteous to others in the household.  Additional rules will be in the house manual, available upon arrival. ",
44110560,MANHATTAN STUDIO SUITE SLEEPS 2 GUEST,34550552838,verified,Regina,Manhattan,Midtown,40.76501,-73.98076,United States,US,True,moderate,Private room,2019,$708 ,$142 ,2,0,,,3,1.0,365,,
44111113,❤ART of Chelsea | 1bd rm | Walk/bike everywhere!,11690716376,verified,Lee,Manhattan,Chelsea,40.74067,-74.00013,United States,US,False,flexible,Entire home/apt,2009,$973 ,$195 ,3,90,6/29/2019,3.09,4,2.0,186,"We have ample off-street parking but if you have a car let us know and we will be in touch with you about parking. Please be careful not to drive or walk in the driveway for 233 Savin Hill Avenue. Check in time is 2 PM, check out time is 10 AM.  Guests who arrive early can drop off their luggage after 10 AM. We are unable to accommodate arrivals earlier than 10 AM.  Guests who need to stay after the check out time are welcome to use the common area on the first floor for luggage storage. NO SMOKING in the house or anywhere on the property. No Pets.",
44111665,sunny private bedroom in Harlem,9017315287,unconfirmed,Lukasz,Manhattan,Harlem,40.82097,-73.95281999999999,United States,US,True,strict,Private room,2018,"$1,168 ",$234 ,3,2,2/18/2017,0.07,5,1.0,0,"No smoking or drinking in the apt. Lock out will be $50. late check in after 9 pm and before 9 a.m. is $50. Respect yourself, respect other, clean up after yourself. Thank you",
44112217,"Beautiful private room in East Village, NYC",28214005272,verified,Aaron,Manhattan,East Village,40.72558,-73.99025,United States,US,True,strict,Private room,2004,$899 ,$180 ,7,2,4/16/2017,0.07,2,1.0,0,,
44112769,"Huge Sunny Bedroom, 20 min to Times Square!",21464588624,verified,Michael,Queens,Sunnyside,40.74171,-73.9254,United States,US,True,moderate,Private room,2009,$992 ,$198 ,6,23,1/6/2019,0.76,5,1.0,0,"•No Smoking in any part of the property •Please do not leave any trash outside, please leave trash in bag inside the unit •Do not flush ANYTHING down toilet except toilet paper •Please maintain a reasonable volume •Please respect the property •No large parties •No more than 4 guests •Please ask before accessing bar •Do not purchase anything on cable •Please do not leave exterior doors open so that we can keep out insects and pests",
44113322,Stylish 1BR w/lounge or 2BR Vintage Artists Apt.,72706580208,unconfirmed,Donari,Brooklyn,Williamsburg,40.70725,-73.95271,United States,US,False,flexible,Entire home/apt,2020,$872 ,$174 ,7,43,6/10/2019,1.41,5,1.0,146,No smoking in the house or on the decks. Please do not leave cigarette butts on the property. Two-night minimum stay.,
44113874,Room close to Manhatan,76422414956,verified,Pablo,Queens,Woodside,40.74354,-73.90093,United States,US,True,flexible,Private room,2004,$78 ,$16 ,3,0,,,4,1.0,90,,
44114426,Astoria Ditmars Bedroom,66244961243,unconfirmed,Valentina,Queens,Ditmars Steinway,40.775490000000005,-73.90786,United States,US,False,strict,Private room,2013,"$1,073 ",$215 ,3,13,4/25/2019,1.13,4,1.0,36,"Prices $150.00 per night for 1 or 2 people. Late night noise is not allowed. Over night guests are not allowed. It is allowed if you may like to cook dinner and eat at home, with us or on your own. We go to bed between 11pm and 1 am. We rise at 10am.  House is very solid & quiet.",
44114979,1 Person Only 1 Bdrm LES HugeDeck,83981453275,verified,Raymond,Manhattan,Lower East Side,40.72198,-73.98785,United States,US,True,flexible,Private room,2014,$511 ,$102 ,2,77,1/28/2019,2.5,2,2.0,68,"CHECK IN: 2pm CHECK OUT: 10am SMOKING: Please no smoking inside.  Smoking allowed outside, please dispose of cigarettes in appropriate containers provided. NO PARTIES: (please inform hosts of additional guests or visitors during your stay, only the original occupants at the time of booking are allowed to stay in the property overnight and secondly no additional guest will be brought in without prior authorization). Keep the volume low before 8am and after 11pm NO PETS: We love our pets, but ask you leave your loved ones at home. Shoes should be left inside the entrance door. PLEASE tidy the room before you depart.  Return furnishings and others items to be as they were upon your arrival. Thank you!",
44115531,Astor Row Apartment in the Heart of Harlem <3,16627934675,verified,Jacqueline,Manhattan,Harlem,40.809309999999996,-73.9412,United States,US,False,strict,Private room,2004,$997 ,$199 ,1,81,6/30/2019,2.64,3,1.0,158,We except our guest to be respectful of our home and us. There is no smoking in the home but smoking outside is allowed and needs to be disposed of properly.,
44116083,East Williamsburg private 2 bedroom apt by L train,1321566113,unconfirmed,J,Brooklyn,Williamsburg,40.708940000000005,-73.94142,United States,US,False,flexible,Entire home/apt,2016,$895 ,$179 ,1,4,4/22/2019,0.17,3,3.0,0,"NO PETS!  NO SMOKING ON PREMISES! NO PARTY! A printed house rule will be provided. Please be respectful to others when all rooms are booked. 10 AM Check-out and Check-in is between 12 PM (noon) - 3 PM.   Late check in after 8 pm is $50, lock out is $50. Respect yourself, Respect others, clean up after yourself.  No Smoking/drinking in apt.  Thank You! Location Rules: The ""Exact Address Location Is Not Disclosed For Security Reasons"" And Is Given Out 24 Hours Prior to Check-in.  If This Is a Problem for You, Please STOP Here And Contact Other Hosts for Your Stay.   This Is a Part Of My House Rules.",
44116636,Huge Gorgeous room in a Park View Apartment!,13347642662,unconfirmed,Hadar,Brooklyn,Flatbush,40.65352,-73.96191,United States,US,False,flexible,Private room,2018,$659 ,$132 ,2,0,,,3,2.0,177,The Perfect home stay for clean and responsible person. Home is keep neat and clean at all times. Guest wipe up after themselves after using the kitchen. There is no smoking in home and no pets allowed in home. No overnight guest to keep the stay peaceful and quiet.,
44117188,Cozy S. Williamsburg Landing Pad,2299672223,verified,D M,Brooklyn,Williamsburg,40.70896,-73.95383000000001,United States,US,False,strict,Entire home/apt,2019,$953 ,$191 ,4,4,8/15/2018,0.15,4,2.0,0,"I would expect guess to be respectful,  no smoking in the house.  No loud music, and keeping the place clean as well.",
44117740,❤️❤️❤️ COZY Place by the Park for ONE ❤️❤️❤️,59615402164,verified,Lily,Queens,Middle Village,40.71991,-73.87439,United States,US,False,strict,Private room,2021,$919 ,$184 ,2,47,7/1/2019,1.99,5,3.0,90,"Please, no smoking inside the building or on the porches.  Due to sensitivities, we ask that you not use perfume, cologne, or aerosol products in the house. No parties. No illegal drug use.  We are an eco-friendly family and appreciate your help in recycling (bin in the kitchen) and turning off lights, fans, etc. when not in use.  Please lock all doors of the building behind you.",
44118292,Gr8 views in heart of Williamsburg,70610517294,unconfirmed,Jen,Brooklyn,Williamsburg,40.71734,-73.95952,United States,US,False,strict,Private room,2020,$451 ,$90 ,2,0,,,5,1.0,0,Respect our rules.  Please remove  shoes when inside the house.,
44118845,Cozy studio in historic Clinton Hill near trains,19186299032,verified,Ashley,Brooklyn,Clinton Hill,40.68513,-73.96789,United States,US,False,moderate,Entire home/apt,2019,$282 ,$56 ,3,0,,,1,1.0,0,"No smoking or drinking in the apt. Lock out will be $50. late check in after 9 pm and before 9 a.m. is $50. Respect yourself, respect other, clean up after yourself. Thank you",
44119397,Lovely Brooklyn Room near train stop,14133123375,verified,Anaïs,Brooklyn,Bedford-Stuyvesant,40.68156,-73.91424,United States,US,True,moderate,Private room,2003,"$1,022 ",$204 ,2,5,2/20/2017,0.17,3,1.0,0,No drugs please.,
44119949,"Enormous, Beautiful Apartment near Prospect Park",84838538651,unconfirmed,Eman,Brooklyn,Flatbush,40.6528,-73.95805,United States,US,False,moderate,Entire home/apt,2016,"$1,068 ",$214 ,1,0,,,5,1.0,0,Keep noise down and have consideration for other guest.  No smoking on premises.,
44120502,It is a two bedroom apartment,49189731295,unconfirmed,Ismael,Bronx,Concourse,40.8262,-73.92557,United States,US,False,moderate,Entire home/apt,2009,"$1,129 ",$226 ,4,84,7/3/2019,2.87,1,1.0,93,,
44121054,"Quiet Private room Queens Nyc,Midtown 30 mins",12334566748,verified,Rory,Queens,Maspeth,40.727,-73.88974,United States,US,True,moderate,Private room,2010,"$1,134 ",$227 ,3,1,1/18/2017,0.03,3,1.0,0,"Guests who use kitchen must wash their dishes (or put them in dishwasher) and wipe stove and counters after eating, in courtesy to other guests.   No smoking inside or behind the house; smoking is permitted only in smoking area in front of house.  To maintain quiet on floors with bedrooms, please use headphones to listen to music/videos or when making (SENSITIVE CONTENTS HIDDEN) calls in bedrooms, and keep hallways conversations quiet and short. ",
44121606,Private Bathroom and Cozy Bedroom in Brooklyn,55122288501,unconfirmed,Melissa,Brooklyn,East Flatbush,40.64638,-73.95065,United States,US,False,moderate,Private room,2014,$868 ,$174 ,1,30,6/4/2019,1.16,5,3.0,244,"NO PETS!  NO SMOKING ON PREMISES!  NO PARTY! A printed house rule will be provided. Please be respectful to others when all rooms are booked. 10 AM Check-out and Check-in is between 12 PM (noon) - 3 PM.   Late check in after 8 pm is $50, lock out is $50. Respect yourself, Respect others, clean up after yourself.  No Smoking/drinking in apt.  Thank You! Location Rules: The ""Exact Address Location Is Not Disclosed For Security Reasons"" And Is Given Out 24 Hours Prior to Check-in.  If This Is a Problem for You, Please STOP Here And Contact Other Hosts for Your Stay.   This Is a Part Of My House Rules.",
44122159,"Cozy Bedroom in Brooklyn, NY",49512005049,unconfirmed,Melissa,Brooklyn,East Flatbush,40.64863,-73.94948000000001,United States,US,False,moderate,Private room,2022,$668 ,$134 ,1,27,4/13/2019,1.09,2,3.0,342,,
44122711,Private Room in Cozy Harlem 2 Bedroom,64120193412,unconfirmed,Kyle,Manhattan,Harlem,40.82261,-73.95163000000001,United States,US,True,flexible,Private room,2020,"$1,036 ",$207 ,2,102,6/18/2019,3.33,3,1.0,99,,
44123263,Upper Manhattan - Female only,60897720009,verified,Lucy,Manhattan,Inwood,40.86688,-73.92402,United States,US,False,flexible,Private room,2014,$846 ,$169 ,6,6,8/12/2018,0.2,4,1.0,0,"* If you are booking a room, you must be the person staying in room. DO NOT book a room for somebody else!* *ALSO, please only book if you have a face photo in your profile!* This is a residential building, with professionals living throughout. Being respectful is a must! No loud music, No smoking and pets are NOT allowed in the building.  Also, only guests listed on the booking are allowed in this house. Strangers, friends and family members are not allowed inside the house. For your safety, and mine. :) Lost keys will result in a $50 fee to replace the locks in the house.",
44123815,Cozy studio Upper East/Manhattan,50774511033,unconfirmed,Mila,Manhattan,Upper East Side,40.76794,-73.95711999999999,United States,US,False,strict,Entire home/apt,2021,"$1,038 ",$208 ,8,15,6/14/2019,0.52,4,1.0,14,- No shoes on carpets and rugs - Eating and Drinking only in Kitchen - Quiet time from 11pm - 6am - No gatherings or parties,
44124368,Spacious Bedroom @ Convinience,97197429592,unconfirmed,Ash,Queens,Astoria,40.75888,-73.91747,United States,US,False,strict,Private room,2008,$670 ,$134 ,1,3,9/4/2018,0.2,1,1.0,179,"No smoking (indoors or outside on the property). No pets. No parties. Prefer quiet professional singles or couples in town for work and/or tourism. No children. Please note that this is Alex's home (he lives there), so please be respectful by keeping noise down and cleaning up after yourselves.",
44124920,Large Room in Manhattan,83601261604,verified,Ricardo,Manhattan,Harlem,40.81488,-73.94221,United States,US,False,flexible,Private room,2018,$56 ,$11 ,1,3,3/25/2017,0.1,5,1.0,0,,
44125472,NYC NEW YEARS EVE - LUXURY CRASH PAD!,17523425267,unconfirmed,Jo & Savannah,Brooklyn,Bedford-Stuyvesant,40.68186,-73.91188000000001,United States,US,True,flexible,Shared room,2011,$233 ,$47 ,4,114,10/11/2018,3.72,2,3.0,0,Check in is after 3 pm and check out is at 12 pm.  No parties or events.  No smoking.  No pets.  No unauthorized guests.  My home is not child proof.  Please leave your shoes at the entrance of the apartment.,
44126025,Spacious Master Bedroom 20 mins. from NYC,63221547131,unconfirmed,Kwana,Brooklyn,Bedford-Stuyvesant,40.6933,-73.9541,United States,US,True,flexible,Entire home/apt,2005,$537 ,$107 ,3,8,5/29/2017,0.27,4,1.0,0,,
44126577,Cozy one bedroom in Upper East Side Manhattan UES,54527354345,unconfirmed,Lu,Manhattan,Upper East Side,40.77628,-73.95322,United States,US,False,strict,Entire home/apt,2016,"$1,138 ",$228 ,1,0,,,5,1.0,0,"We ask that no alcohol or pork be brought into the home. Other than that, my home is your home. I simply ask that you please treat the home and its inhabitants with respect.",
44127129,The Rainbow Room on Prospect Park.,37867385262,unconfirmed,Victoria,Brooklyn,South Slope,40.66045,-73.98057,United States,US,True,flexible,Private room,2003,"$1,036 ",$207 ,2,25,8/26/2018,1.06,2,1.0,0,,
44127682,Light-filled South Slope Nest!,81901484360,verified,Rebecca,Brooklyn,Sunset Park,40.661559999999994,-73.99318000000001,United States,US,True,moderate,Entire home/apt,2006,$790 ,$158 ,2,48,6/21/2019,1.86,2,1.0,2,"I would like you to respect my house as though it was yours. You break it you buy it. No smoking cigarettes or drugs within the units. Smoking is allowed on the outside porch, however do not throw cigarette butts on the floor/grass please use the ash tray. If something goes wrong or unpleasant with your stay,  please call me immediately so we can rectify the situation.",
44128234,Tidy artists' apartment,95916570793,unconfirmed,Dustin,Brooklyn,Crown Heights,40.66404,-73.95141,United States,US,True,strict,Entire home/apt,2008,"$1,079 ",$216 ,4,3,8/23/2017,0.1,1,1.0,0,"No drunken, naked brawling.  Other than that, no rules. And no smoking. Or illegal drugs. Or pets. OK, so there were more rules. I only accept guests who have been verified through Airbnb.  And I'm a little suspect if you have a blank profile and no picture.  Remember, I'm inviting you into my home and I hope you're not a axe murderer. If this is your first experience with Airbnb, read all the Airbnb information on this website.  Airbnb is not a hostel, nor is it a hotel. I rarely accept guests if they have never used Airbnb before. Please keep the bedroom clean and organized.  You will have exclusive access to the bathroom on the second floor during your stay.   However, this also serves as the guest bathroom, so do your best to keep it tidy.  Don't leave your unmentionables hanging on the light fixtures. You will have access to the first floor (living room, dining room and kitchen) and the guest bedroom and bathroom on the second floor.  My bedroom and study on the second floor and t",
44128786,"Quiet South Slope house w/ piano, porch & garden.",17874262472,unconfirmed,Tracey,Brooklyn,Sunset Park,40.65917,-73.99136999999999,United States,US,False,moderate,Entire home/apt,2019,$755 ,$151 ,1,17,8/26/2018,0.56,3,1.0,0,Please do not smoke in the house.  Please no parties or loud events.,
44129338,Wonderful Cozy Private Room By Central Park,38451577599,verified,Simona & Jon,Manhattan,East Harlem,40.79732,-73.94873,United States,US,True,flexible,Private room,2017,$492 ,$98 ,2,0,,,3,1.0,0,"Check-in is 2:00 pm, and checkout 11:00 am (the bedrooms please, you leave your bags to pick up later or bring them early). After reservation please send me your arrival and departure time for logistics 1.No shoes to the second floor  2.Keep the volume low before 8am and after 10pm 3.Close the doors gently 4.No shower after  11:30pm 5.No Laundry after  before 9am and after 8pm 6.Keep the kitchen and  bathroom in decent condition after you 7.Close the shower curtain well (important) 8.No water around the sink (under the sink there is a sponge you can use it to dry) 9.Turn off the light when you leave the room 10.Trash out from the room  BLUE BOX recycling  11.Leave the key in the room THANK YOU",
44129891,Large 1 room with bed in the heart of manhathan,98562886667,unconfirmed,Adil,Manhattan,Murray Hill,40.74604,-73.97495,United States,US,False,strict,Private room,2013,$401 ,$80 ,7,0,,,5,1.0,0,#NAME?,
44130443,"Huge Fort Greene Loft, Prime!",34826611564,unconfirmed,Anthony,Brooklyn,Fort Greene,40.69269,-73.9737,United States,US,True,moderate,Entire home/apt,2012,$213 ,$43 ,2,8,6/30/2019,0.31,1,1.0,185,,
44130995,"BEST DEAL, PERFECT LOCATION in Downtown, Manhattan",31965664795,verified,Liang,Manhattan,Greenwich Village,40.73083,-73.9943,United States,US,False,moderate,Private room,2016,$287 ,$57 ,4,0,,,3,1.0,0,Keep your bedroom and apartment clean. Keep quiet when you share this apartment with other guests. No smoking inside the apartment. Your staying will be terminated if you smoke inside the building. No party after 9:30 p.m.,
44131548,Cosy  1 bed basement Apartment,25634630449,unconfirmed,Pearline,Brooklyn,East Flatbush,40.64342,-73.94037,United States,US,False,moderate,Entire home/apt,2010,$601 ,$120 ,1,82,6/9/2019,3.16,1,1.0,179,,
44132100,Bright room Williamsburg off Bedford,3624653106,verified,Danielle,Brooklyn,Williamsburg,40.716809999999995,-73.96296,United States,US,True,strict,Private room,2012,$907 ,$181 ,2,10,1/1/2019,0.34,5,1.0,0,"• Check-in time is 3PM. • Check-out time is 11:00AM. • No parties or events • Not suitable for pets • No smoking No smoking, no drugs, no parties and please, no visiting pets or unannounced visitors. Please lock up door when you go out, and during the heating season, turn down the heat. If you are new to Airbnb, the idea is that I’m not renting a room, but rather sharing my home. I live and work here, and enjoy meeting new people. It's like having old friends visit, not like a hotel. You are welcome to make yourself at home in the common living areas and to use the kitchen, but please leave everything as clean and put away as you have found it. As we will be sharing a bathroom, I appreciate your tidying up and keeping personal items in your room. The cat is not allowed outdoors – he can be sneaky so please don’t leave doors open and keep an eye out for her. You are welcome to the kitchen (and common areas), thank you for cleaning your dishes after using them.   I am environmentally fri",
44132652,Sunny Room in Clinton Hill Brooklyn,97622677584,verified,Brandon,Brooklyn,Clinton Hill,40.68118,-73.96126,United States,US,True,strict,Private room,2018,$72 ,$14 ,2,15,6/29/2018,0.5,1,1.0,0,"Drinking in moderation, smoking outdoors, no drugs. Please clean up after yourself.",
44133205,Cozy room in MASSIVE bushwick house,53969731078,unconfirmed,Jared,Brooklyn,Bushwick,40.688629999999996,-73.90874000000001,United States,US,True,strict,Private room,2020,"$1,178 ",$236 ,1,1,1/1/2017,0.03,5,1.0,66,,
44133757,Quiet room in apt Williamsburg 10 mins to City,7226064065,unconfirmed,Belinda,Brooklyn,Williamsburg,40.716609999999996,-73.9551,United States,US,False,flexible,Private room,2011,$639 ,$128 ,2,27,3/16/2019,1.02,2,2.0,0,"Please take your street shoes off when entering the house. This is a smoke free home. Please no smoking in and around the house. For all my male guests: Please sit on the toilet. No standing please! This is a shared facility. Therefore, please be considerate of the amount of water and electricity you use. Please keep the noise level low.",
44134309,JFK AIRPORT 3-BEDROOM LUXURY APT WITH FREE PARKING,56222707157,verified,Neena,Queens,Richmond Hill,40.6887,-73.82571999999999,United States,US,False,moderate,Entire home/apt,2003,$317 ,$63 ,1,69,7/7/2019,2.34,1,1.0,329,"NO PETS!  NO SMOKING ON PREMISES! NO PARTY! A printed house rule will be provided. Please be respectful to others when all rooms are booked. 10 AM Check-out and Check-in is between 12 PM (noon) - 3 PM.   Late check in after 8 pm is $50, lock out is $50. Respect yourself, Respect others, clean up after yourself.  No Smoking/drinking in apt.  Thank You! Location Rules: The ""Exact Address Location Is Not Disclosed For Security Reasons"" And Is Given Out 24 Hours Prior to Check-in.  If This Is a Problem for You, Please STOP Here And Contact Other Hosts for Your Stay.   This Is a Part Of My House Rules.",
44134861,1 Bedroom Escape in Brooklyn Heights,76450656669,unconfirmed,Michelle,Brooklyn,Brooklyn Heights,40.693000000000005,-73.99374,United States,US,True,strict,Entire home/apt,2012,$749 ,$150 ,4,0,,,2,1.0,0,"No smoking of any kind indoors; no smoking on deck or in back garden; smoking allowed in front garden, where chairs and a table are provided.  Guests using kitchen area are asked to keep it clean and put away food in refrigerator or cabinets or plastic containers.  Quiet hours after 11pm. ",
44135414,Futon to crash on New Year in NY,34615178524,verified,Atif,Queens,Hollis,40.71764,-73.76402,United States,US,False,moderate,Shared room,2020,$457 ,$91 ,1,0,,,5,2.0,365,"•No Smoking in any part of the property •Please do not leave any trash outside, please leave trash in bag inside the unit •Do not flush anything down toilet except toilet paper •Please maintain a reasonable volume •Please respect the property •No large parties •No more than 4 guests •Please ask before accessing bar •Do not purchase anything on cable •Please do not leave exterior doors open so that we can keep out insects and pests",
44135966,LARGE BEAUTIFUL QUIET ROOM IN 2 STORY TOWNHOUSE,61725213633,verified,Jonathan,Queens,Astoria,40.77267,-73.92871,United States,US,False,strict,Private room,2010,$603 ,$121 ,3,23,6/14/2019,0.76,4,2.0,244,"Unlike most other Airbnb listings, what we do here is long-term rentals by the year, or by the semester.  We try to keep the atmosphere conducive to studying and resting and a couple of house-rules are in place to this end.  1. Towels and linens (sheets, blankets, and pillows) are NOT provided. The bed is twin size. 2. No smoking on the premises.  3. No loud music or TV etc.  4. Only for one person (no couples, no visitors). We seldom have visitors, let alone overnight guests. We know this will be a major turn-off to many people, but we believe we can find a like-minded roommate who can have fun outside the house.  5. If you are not sure about your check-out date, you can reserve the minimum days and extend your stay at a discounted rate.  6. Check-in time has to be coordinated at least 48 hours ahead. On arrival, a short registration process with a picture ID is needed in exchange for keys and wifi access.  7. Inside the apartment, we take off our outside shoes. So if you bring your o",
44136518,#2 Ideal Williamsburg - L trian Lorimer Stop!,68493673165,verified,Ploy,Brooklyn,Williamsburg,40.71368,-73.9536,United States,US,True,strict,Private room,2013,$185 ,$37 ,4,43,5/17/2019,1.41,4,3.0,58,,
44137071,City Life Minus The City Price - Flatbush Brooklyn,42812351232,unconfirmed,Emani,Brooklyn,Flatbush,40.6485,-73.95439,United States,US,True,strict,Private room,2018,$919 ,$184 ,1,18,6/13/2019,0.79,4,1.0,154,No Parties No Loud Music No Smoking,
44137623,Historical Addisleigh Park NYC,8679348103,unconfirmed,Gerceida,Queens,St. Albans,40.694720000000004,-73.77109,United States,US,False,strict,Private room,2016,$994 ,$199 ,2,34,6/2/2019,1.16,5,1.0,59,,
44138175,"Harlem ""Hostel"" for Single Travelers",69823856115,unconfirmed,Sarah-Jane,Manhattan,Harlem,40.81516,-73.94829,United States,US,True,flexible,Shared room,2007,"$1,199 ",$240 ,2,36,6/30/2019,1.28,4,2.0,88,"- NO PETS!  NO SMOKING ON PREMISES! NO PARTY! A printed house rule will be provided. Please be respectful to others when all rooms are booked. 10 AM Check-out and Check-in is between 12 PM (noon) - 3 PM.   Late check in after 8 pm is $50, lock out is $50. Respect yourself, Respect others, clean up after yourself.  No Smoking/drinking in apt.  Thank You!  Location Rules: The ""Exact Address Location Is Not Disclosed For Security Reasons"" And Is Given Out 24 Hours Prior to Check-in.  If This Is a Problem for You, Please STOP Here And Contact Other Hosts for Your Stay.   This Is a Part Of My House Rules.",
