1783393,NYC - Heart of Greenwich Village,73451746761,verified,Peter,Manhattan,Greenwich Village,40.728120000000004,-74.00191,United States,US,False,strict,Entire home/apt,2008.0,$878 ,$176 ,4,51,5/2/2019,0.62,5,1,299,No smoking or pets allowed,
1783945,"Huge factory loft, prime location",95886878723,verified,Misty,Brooklyn,Williamsburg,40.716570000000004,-73.96264000000001,United States,US,True,flexible,Entire home/apt,2003.0,$789 ,$158 ,2,179,6/17/2019,2.2,5,1,355,,
1784497,bedroom in front of prospect park  w/2 queens beds,33980757836,verified,Jose,Brooklyn,Windsor Terrace,40.65193,-73.97301,United States,US,False,moderate,Private room,2018.0,$165 ,$33 ,2,206,6/15/2019,2.49,3,2,198,"Please remember that this is a residential building. The building rules, apartment occupancy restrictions and the year-round tenants must be respected.",
1785050,Charming Sunny W. Village Apt.,66029714116,verified,Sharon,Manhattan,West Village,40.73485,-74.00636999999999,United States,US,True,flexible,Entire home/apt,2010.0,$881 ,$176 ,5,4,7/8/2018,0.05,5,1,277,"No Smoking, No Pets",
1785602,"Beautiful, bright room w/priv bath",32776016048,verified,Daniel,Brooklyn,Bushwick,40.70074,-73.92333,United States,US,True,moderate,Private room,2008.0,$353 ,$71 ,14,2,6/23/2019,0.11,2,1,255,Please no smoking or pets in the loft! ,
1786154,Private bedroom in a 2-fam house for solo traveler,2100925850,unconfirmed,Tony,Queens,Sunnyside,40.73607,-73.92439,United States,US,False,strict,Private room,2004.0,$281 ,$56 ,3,1,6/4/2018,0.08,1,1,-8,,
1786707,"NOLITA, Home Sweet Home in NYC",16066819832,unconfirmed,Cortney,Manhattan,Nolita,40.72095,-73.99401,United States,US,False,strict,Entire home/apt,2009.0,$717 ,$143 ,4,2,4/3/2013,0.02,2,1,154,,
1787259,"1-BDRM, Good Light, Fire-Escape, AC",78842613549,unconfirmed,Jonny,Brooklyn,Crown Heights,40.676390000000005,-73.96003,United States,US,False,strict,Entire home/apt,2004.0,"$1,079 ",$216 ,5,3,1/11/2016,0.04,3,1,400,"-We simply ask you to feel like you are in your own home, and respect the condo and neighbors.   - A copy/scan of a photo ID or an AirBNB ID verification will be required to receive keys.  -No pets, no smoking and no party, no extra parties/guests in the Condo -that are not part of your reservation.   - Please note our check in time: 3:00 PM (or anytime later) and Check out time: 10:00 AM. If you absolutely must check-in during the morning, please message us first.  -Our condo is best for 2 people, but we can certainly accommodate a 3rd person without an extra-person fee!  Let us know first if you have 3 guests and we can bring a floor mattress.",
1787811,Apt Near Central Park & Columbia!,37533525854,verified,Jeffrey,Manhattan,Upper West Side,40.79913,-73.96056999999999,United States,US,False,strict,Private room,2018.0,$649 ,$130 ,2,19,9/23/2015,0.23,5,1,201,,
1788364,"Beautiful 4BR/4BA Home, Staten Island, NY City.",63542823809,verified,Marina,Staten Island,Tottenville,40.50868,-74.23986,United States,US,True,strict,Entire home/apt,2003.0,$752 ,$150 ,3,59,7/8/2019,0.82,2,1,278,"Thank you for your reservation. By placing your reservation online you indicated that you accepted the terms and conditions which have been printed below.  Please review your reservation summary as below - then print, sign and return the agreement to:  (EMAIL HIDDEN) or fax it to (PHONE NUMBER HIDDEN) or  mail it to: Spare Suite, Inc., 119 Braintree Street, Suite 510, Boston, MA 02134, USA Upon receipt, we will send you the welcome document with check in instructions and how to get your keys. ------------------------------------------------------------------------ ------------------------------------------------------------------------ Terms of the Agreement: BOOKING AND REFUND POLICY Once booked your reservation is guaranteed for the check in and check out times and dates specified. All reservations must be paid in advance, in full for the entire period of stay.  All reservations are final, and NON REFUNDABLE UNDER ANY CIRCUMSTANCES.  If you feel you may need to cancel once booked, yo",
1788916,East Village 1 Bedroom Apartment,87797573063,unconfirmed,Jack,Manhattan,East Village,40.723890000000004,-73.98934,United States,US,False,flexible,Entire home/apt,2017.0,$813 ,$163 ,6,1,1/5/2019,0.16,5,1,122,Please be respectful of our neighbors and no additional guests or parties. No Smoking. No Pets.,
1789468,Sweet Super Bowl Accomodations,22571751837,unconfirmed,Gina,Manhattan,West Village,40.73727,-74.00213000000001,United States,US,False,strict,Entire home/apt,2009.0,$502 ,$100 ,5,1,9/18/2012,0.01,2,1,297,"Unfortunately no pets are allowed in the building. Smoking is prohibited on the premises. Trash is put out only on the designated day in the back of the building. No parties with kegs, djs or live music.",
1790020,Homey Townhouse + PRIVATE Bathroom,7381654812,unconfirmed,Chris & Don,Brooklyn,Cobble Hill,40.686479999999996,-73.99257,United States,US,False,moderate,Private room,2010.0,$497 ,$99 ,3,254,6/23/2019,3.05,4,1,405,"Please Note: This unit was just renovated in November 2015 and it comfortably accommodates 4 guests, but up to 6 guests are permitted if you so desire (two guests in each bedroom and 2 guests on the available queen size air mattress). Please request an air mattress (if needed) when making a reservation. No smoking, no pets, no parties, and must be 25 to book.  For check-out, please ensure: -  All plates and cups are left in the sink or dishwasher -  All trash is left in the kitchen trash can or bagged and left next to the trash can (additional bags are under the sink) -  All windows are closed and locked -  If used, the air mattresses are deflated and put away (please leave used linens for the air mattresses on the floor) -  If furniture was moved during your stay, please return to its original location Please be mindful to our neighbors in the building, quiet hours after 9pm and no music or loud gatherings on the private patio. Please be considerate of our next guests who will be stay",
1790573,Cozy E. Harlem Brownstone PH,14337990816,unconfirmed,Diego,Manhattan,East Harlem,40.795120000000004,-73.93182,United States,US,False,flexible,Private room,2007.0,$639 ,$128 ,2,129,4/6/2019,1.56,4,2,211,No smoking No children under the age of 18 No animals No loud parties or people beyond those included in the reservation No late night check-ins,
1791125,INSANE NYC views! Live in the sky!,38109721873,verified,Dee,Manhattan,Hell's Kitchen,40.76206,-73.9998,United States,US,False,strict,Entire home/apt,2018.0,$984 ,$197 ,30,11,3/8/2013,0.13,2,2,278,,
1791677,Up Among the Trees 2,66917697646,unconfirmed,Mateo And Anna,Brooklyn,Bedford-Stuyvesant,40.69382,-73.95002,United States,US,True,flexible,Entire home/apt,2007.0,$742 ,$148 ,20,32,4/21/2019,0.68,1,1,386,"Please respect the space, and leave the apartment the way that you found it. Please do not host any parties, and be respectful of my neighbors. No pets allowed. No smoking allowed. No additional guests.",
1792230,Central Park Luxury ( BEST DEAL ;),60934234581,unconfirmed,Evan,Manhattan,Upper West Side,40.78455,-73.97352,United States,US,False,flexible,Entire home/apt,2008.0,"$1,152 ",$230 ,5,8,8/21/2016,0.12,1,3,333,,
1792782,Luxe Queen Size Bed*Cozy Elegance*Inwood Manhattan,86313803215,unconfirmed,Grace,Manhattan,Inwood,40.871140000000004,-73.91790999999999,United States,US,True,moderate,Private room,2015.0,$754 ,$151 ,2,261,7/3/2019,3.16,5,1,292,No smoking. No pets.,
1793334,Loft Room in Heart of Williamsburg,23733786041,verified,Ryan,Brooklyn,Williamsburg,40.718270000000004,-73.96259,United States,US,False,strict,Private room,2008.0,"$1,160 ",$232 ,2,3,9/23/2012,0.04,2,1,285,"There are many coasters and please use them for your drinks.  There is one shelf in the kitchen cabinet that has food stuff that are personal and it will be marked as such.  Please no pets, smoking or parties.  There is a stand alone fireplace but it is decorative only. Please be respectful and keep noise to a minimum is the mornings and evenings to avoid disturbing neighbors.",
1793887,Enjoy and discover New York Citi,51377828776,verified,Vadim,Staten Island,Tompkinsville,40.63358,-74.0833,United States,US,False,strict,Private room,2015.0,$247 ,$49 ,2,23,10/7/2018,0.33,2,2,345,treat the property and other tenants with respect,
1794439,3 Bedroom 2.5  Bath Multilevel Home,24853230225,unconfirmed,James,Manhattan,Harlem,40.82312,-73.94971,United States,US,True,strict,Entire home/apt,2021.0,$688 ,$138 ,5,108,6/3/2019,1.44,5,2,107,"Please remember that this is a residential building. The building rules, apartment occupancy restrictions and the year-round tenants must be respected.  Parties, pets and smoking are not allowed under any circumstances and incur significant fees.",
1794991,Luxury Doorman Building! w/Pvt Bath,92310100727,verified,Steven,Manhattan,Harlem,40.8224,-73.94358000000001,United States,US,True,strict,Private room,2010.0,"$1,070 ",$214 ,3,9,6/30/2019,0.11,1,1,134,"House rules: Guests agree to the following terms and conditions 1.Guest(s) agree to NO PARTIES anywhere on the property. Legal action will be taken for parties that cause damages to the unit, property, reputation, or relationship with building staff or other residents.  2.Smoking of any kind is not permitted in the unit or on the premises.  3.Guests agree to abide by maximum occupancy of unit, and observe quiet hours between 9pm and 9am 4.Guests are responsible for action of ALL GUESTS occupying their unit at all times.  5.Guests agree to return all keys, remotes, and parking passes. Replacement fees may apply for unreturned items 6.Guests understand that onsite building staff (maintenance and concierge) are not affiliated with Jordan or AIRBNB. Please contact me directly for any needed items. 7.Guests understand that no pets are to be in the unit.  8.Guests agree to pay replacement cost for any unreturned items, and $125 per hour fee for unauthorized early checkin or late checkout.  9",
1795543,"Hell's Kitchen, Midtown west!",2222026873,verified,Brian,Manhattan,Hell's Kitchen,40.76376,-73.99161,United States,US,True,strict,Private room,2012.0,$547 ,$109 ,2,248,6/24/2019,2.99,4,1,315,"No smoking. No pets. No drugs. No parties. Quiet hours after 9pm.  Tenants' belongings are not covered under our insurance. We recommend that you obtain renter's insurance as we are not responsible for your belongings. We care for this apartment as if it were our own home.  This is a family neighborhood and a quiet/respectful one.  This home was built prior to 1978 and according to MA Lead Law notification, we have to inform our renters that there is a possibility of lead paint.  Kindly do not eat the walls.  Check-in Time: 3:00 PM  Checkout Time: 11:00 AM  To ensure your safe deposit returned on time, please follow your checkout duties: - Wash and put away dishes OR start the dishwasher! - Double bag the trash and we will take it out! - We will strip the sheets and wash the towels! Thank you so much!",
1796096,☆☆New Discount☆☆ Beautiful Room / Next to Subway,21940973894,verified,Daniel,Queens,Astoria,40.75703,-73.91666,United States,US,False,flexible,Private room,2019.0,$606 ,$121 ,4,107,6/22/2019,1.29,1,2,306,"House Rules 1. Check-in is 4 pm local time. If the unit is ready earlier, we’ll let you know. Check-out is normally 11 am local time, but we’d be happy to extend it as long as we don’t have a cleaning scheduled. Just let us know.  2. All bookings require a security deposit of at least $300, which will be refunded within 7 days of your check-out. 3. For security measures we require all guests to provide proof of identification through ID verification on our own website. In order to check in we'll need a photo of your ID.  4. Our cancellation policy is as shown on our ad and defined by the site you are booking through.  5. Don’t let $300 go up in smoke. There's no smoking allowed in any Flatbook and a $300 fine for breaking this rule.  6. Unfortunately we don’t allow pets in any of our apartments. 7. Unless you’re staying in one of our specialty apartments, we don’t allow parties or excessive noise. 8. If we find the place very messy, we have to charge an extra $40 for every extra hour o",
1796648,Gorgeous Modern Manhattan Apt,1326373287,verified,Gal,Manhattan,Midtown,40.74648,-73.98459,United States,US,False,moderate,Private room,2011.0,$477 ,$95 ,3,41,9/25/2015,0.52,5,1,294,,
1797200,Amazing NY apartment in SoHo/Nolita,33270711474,unconfirmed,Mathilde,Manhattan,Nolita,40.72294,-73.99388,United States,US,False,strict,Entire home/apt,2007.0,$715 ,$143 ,4,43,6/2/2019,0.52,2,1,248,No Smoking,
1797753,Private rooms on a XLarge 3 br 2 baths,40279067491,unconfirmed,Andrea,Manhattan,Harlem,40.82732,-73.95111999999999,United States,US,False,flexible,Private room,2005.0,$443 ,$89 ,3,39,12/8/2016,0.47,1,1,348,The apartment is in a brownstone shared with five other tenants.  Guests are expected to be respectful of the property and treat it like their own.  Small Pets are allowed but need to be approved.  No parties or loud late night noise. 420 Friendly.,
1798305,Lofted Bed in a Funky Family Loft!!,50691622661,unconfirmed,Mary,Brooklyn,Bedford-Stuyvesant,40.6951,-73.95605,United States,US,True,moderate,Shared room,2019.0,$634 ,$127 ,4,31,6/1/2017,0.37,5,1,221,,
1798857,Room in Williamsburg Loft - Long Stays,79015312771,verified,Carmen,Brooklyn,Williamsburg,40.712559999999996,-73.96625999999999,United States,US,True,flexible,Private room,2022.0,$354 ,$71 ,6,6,5/13/2019,0.07,1,2,7,- Please keep volume to a minimum past 11pm - No smoking -No parties or unexpected guests,
1799410,Charming 1 bedroom Apt in Brooklyn,64762890195,unconfirmed,Ede,Brooklyn,Prospect Heights,40.6795,-73.9685,United States,US,True,flexible,Entire home/apt,2022.0,$941 ,$188 ,3,18,4/6/2019,0.26,5,1,55,"Please treat this apartment as you would your own home. Additionally, there are other tenants in the building, so please be respectful and keep the noise level low. While the apartment does have a fish, please no additional pets. This building is also a smoke free building",
1799962,Charming 1br in of NYC's best Neighborhood!,66899751732,verified,Jon,Manhattan,NoHo,40.7256,-73.99445,United States,US,True,strict,Entire home/apt,2021.0,$987 ,$197 ,20,29,4/30/2019,0.37,1,1,15,Quiet time after midnight. Please turn off the light/AC each time when you go out. :) No Staying overnight  in the living room/couch. Glasses/liquor in the living room cabinets are not available.  Please don't leave dirty dishes.  Please tidy the kitchen when you finished cooking and leave dishes in dry in the dishwasher. Feel free to use the dishwasher. Detergent is under the sink. Thank you!,
1800514,East Village Hideaway,53341424119,unconfirmed,Moira,Manhattan,East Village,40.73045,-73.98541,United States,US,False,flexible,Entire home/apt,2020.0,$920 ,$184 ,1,11,12/25/2013,0.13,2,1,125,Please be respectful of the space and building! No loud noises or extra guests beyond 10pm.,
1801066,"Cute, comfortable room in Gramercy",37688476876,verified,Jernee,Manhattan,Gramercy,40.736999999999995,-73.98199,United States,US,False,flexible,Private room,2022.0,"$1,007 ",$201 ,4,161,7/1/2019,1.92,5,1,45,,
1801619,Spacious Brooklyn Loft w/ River View,49185126940,verified,Karina,Brooklyn,Williamsburg,40.712270000000004,-73.96776,United States,US,False,flexible,Entire home/apt,2007.0,$351 ,$70 ,1,39,4/28/2019,0.47,3,1,133,"Please remember that this is a residential building. The building rules, apartment occupancy restrictions and the year-round tenants must be respected.",
1802171,Manhattan Sky Crib (1 year sublet),74292735288,verified,David,Manhattan,Chelsea,40.75164,-73.99425,United States,US,True,strict,Entire home/apt,2003.0,"$1,187 ",$237 ,365,0,,,1,1,399,"- Please treat this home as your own and respect the neighbors. No parties, smoking, or additional guests (other than the agreed upon).",
1802723,Studio With Old-World Character,44081645626,unconfirmed,Christina,Brooklyn,Crown Heights,40.671890000000005,-73.93499,United States,US,False,strict,Entire home/apt,2006.0,$92 ,$18 ,7,2,8/25/2015,0.03,5,1,287,No smoking. No parties. Please be considerate of your neighbors and consolidate all trash during your stay to the trash cans at the back entrance of the building. Thank you.,
1803276,"Spacious, rare, elegant, art-filled loft w sauna",57939546477,verified,Lisa,Manhattan,SoHo,40.72381,-73.99684,United States,US,False,flexible,Entire home/apt,2022.0,$492 ,$98 ,5,59,6/27/2019,0.77,1,1,233,NO Smoking.  No Pets.,
1803828,"Comfortable, clean & quiet in EV",17950404086,unconfirmed,Casper,Manhattan,Gramercy,40.73337,-73.984,United States,US,False,flexible,Private room,2009.0,$686 ,$137 ,1,323,6/20/2019,3.89,4,1,181,"NO smoking, no pets, all guests must be disclosed. ",
1804380,One Bedroom Apartment in an 1879 Brownstone,83817110639,verified,Edward,Brooklyn,Clinton Hill,40.683040000000005,-73.96348,United States,US,False,flexible,Entire home/apt,,"$1,134 ",$227 ,3,56,5/21/2019,0.96,4,1,418,,
1804933,ELEGANT MIDTOWN EAST STUDIO E.52 ST,2357957476,unconfirmed,Mike,Manhattan,Midtown,40.75743,-73.96939,United States,US,True,moderate,Entire home/apt,,$356 ,$71 ,30,3,12/31/2016,0.05,2,52,-8,"Inn Boston Reservations requests that noise levels remain moderate to low, and that all guests take into consideration those in the surrounding suites. Depending on the scale of the broken rules, guests may be contacted to request a lower noise level or asked to leave. In the event that the guests are required to vacate the unit, no refund will be provided.",
1805485,32nd St & Lexington Ave / Doorman Beautiful Studio,52793927225,unconfirmed,Mike,Manhattan,Kips Bay,40.7419,-73.9816,United States,US,True,flexible,Entire home/apt,,$536 ,$107 ,30,2,6/30/2018,0.04,3,52,143,"This is our home (our primary residence), we just ask that you treat it like your home and respect but enjoy our belongings. We also ask that you be respectful of our neighbors.  The apartment is well sound-proofed and quiet but please be mindful in the hallways.",
1806037,COLUMBUS CIRCLE~FULLY FURNISHED!!!,2184468990,verified,Mike,Manhattan,Hell's Kitchen,40.76758,-73.98722,United States,US,False,flexible,Entire home/apt,,$204 ,$41 ,30,2,8/15/2016,0.04,1,52,302,No Smoking.  No Pets.,
1806589,GRAMERCY PARK~FURNISHED E.20's ST P,83318082776,verified,Mike,Manhattan,Kips Bay,40.741890000000005,-73.97833,United States,US,True,strict,Entire home/apt,,$720 ,$144 ,30,3,8/15/2018,0.05,1,52,418,Please be respectful of other building residents - keeping evening noise to a minimum.,
1807142,COLUMBUS CIRCLE~100% FURNISHED W.58,9877335931,verified,Mike,Manhattan,Upper West Side,40.76934,-73.98464,United States,US,False,moderate,Entire home/apt,2011.0,$118 ,$24 ,30,1,11/1/2012,0.01,1,52,146,,
1807694,Charming 2 Bdrm UWS w/ private deck,97825567982,unconfirmed,Kate,Manhattan,Upper West Side,40.78363,-73.97797,United States,US,False,strict,Entire home/apt,2013.0,$777 ,$155 ,3,58,6/18/2019,0.7,1,1,-9,"Just enjoy your stay! And while no smoking is allowed in the building, the stoop has ample seating and is recessed away enough from the street to provide space for a private burn.  Towels will be provided for showering, and all utensils in the kitchen are at your disposal.  If you have specific questions about activities close by, please send me a message and I'll try to provide as best an answer as possible.",
1808246,BIG East Village 1bd all the extras,30540309517,verified,Noel,Manhattan,East Village,40.721709999999995,-73.98334,United States,US,True,strict,Entire home/apt,2004.0,$981 ,$196 ,3,10,10/24/2015,0.14,5,1,168,NO Smoking,
1808799,THE HEART OF ART IN THE HEART OF NY,42308127557,verified,Kathleen,Manhattan,Hell's Kitchen,40.768029999999996,-73.98767,United States,US,True,moderate,Entire home/apt,2016.0,$746 ,$149 ,2,83,5/23/2019,1.01,2,1,253,"No smoking Pets may be allowed (inquire for further information) This is not a rental unit, it is our home that we live in with our daughter on a full-time basis.  Please take care of it!",
1809351,Be in NYC's best: Lower East Side!,98637300403,verified,Connie,Manhattan,Chinatown,40.71695,-73.99031,United States,US,False,strict,Entire home/apt,2005.0,$393 ,$79 ,4,12,6/3/2019,0.14,4,1,282,"Please remember that this is a residential building. The building rules, apartment occupancy restrictions and the year-round tenants must be respected.",
1809903,Lovely 2-room Studio in Crown Hghts,63596560436,verified,Nick,Brooklyn,Crown Heights,40.675740000000005,-73.95434,United States,US,True,moderate,Entire home/apt,2005.0,$929 ,$186 ,3,1,8/25/2012,0.01,2,1,235,"We prefer to limit the apartment to 4 people. It's our home, and we take good care of it -- so we hope you will, too.  No smoking, no pets, no parties. All dinner ware/cooking supplied should be left in the dishwasher and all trash should be left in the trash can (additional bags are in the drawer above the trash if you need them).",
1810456,Chic Luxe 1BR 1.5BA 900sf -Midtown,56546042414,verified,Alana,Manhattan,Midtown,40.75663,-73.96681,United States,US,True,moderate,Entire home/apt,2011.0,$653 ,$131 ,7,10,7/6/2019,3.53,1,1,-1,,
1811008,"QUIET, SPACIOUS, COMFORTABLE, & GREAT LOCATION",24448520039,unconfirmed,Manon,Brooklyn,Kensington,40.64573,-73.98013,United States,US,False,flexible,Private room,2021.0,$234 ,$47 ,1,48,2/28/2019,0.59,4,1,104,"No smoking! If I smell smoke or if there is other evidence of smoking, you will forfeit your entire security deposit.   The fireplace is (URL HIDDEN) do not use it as it will cause significant damage. If you do, you will forfeit your entire security deposit. I would consider VERY well behaved pets. A pet would lead to $75 being added to the cleaning fee. You are responsible for any damage caused by your pet. If a pet stays here without pre-approval, you will forfeit your entire deposit. Check in and check out time can be flexible depending upon the dates you are looking for and whether anyone else is staying. Unless we arrange otherwise, check in and check out is at noon. The cleaning fee covers two hours. If additional cleaning is required, you will be charged $50/hour, deducted from your deposit. Out of respect for my neighbors, I must insist upon no parties being held at my place. If my neighbor complains about a party happening, or if there is a big mess left at the place, you will",
1811560,Charming West Village Pad,43932062558,verified,Horatio,Manhattan,West Village,40.74004,-74.00426,United States,US,False,moderate,Entire home/apt,2020.0,$868 ,$174 ,16,5,7/3/2019,0.06,2,1,217,No pets. No smoking please.,
1812112,"2BR gem in Cobble Hill, Brooklyn",96020161223,unconfirmed,Charlotte,Brooklyn,Columbia St,40.688629999999996,-74.00180999999999,United States,US,True,strict,Entire home/apt,2011.0,$703 ,$141 ,3,15,7/9/2018,0.18,3,1,224,This is a quiet condo association building from 10 p.m. to 6 a.m.  Please be quiet in the stairwell and remove shoes during the hours of 10 p.m. and 6 a.m.,
1812665,Prime location near Central Park !!,72421170786,verified,Olga,Manhattan,Upper East Side,40.7779,-73.95246,United States,US,False,strict,Private room,2021.0,$302 ,$60 ,1,347,7/4/2019,4.24,3,2,300,,
1813217,"Bright, Quiet 2 BR in Awesome Area!",63626401553,verified,Mariko,Manhattan,Upper West Side,40.781940000000006,-73.98248000000001,United States,US,True,strict,Entire home/apt,2014.0,$400 ,$80 ,1,108,7/5/2019,1.31,1,2,330,,
1813769,Secret Garden,72173145761,unconfirmed,Claire,Brooklyn,Bedford-Stuyvesant,40.6883,-73.95375,United States,US,True,flexible,Entire home/apt,2020.0,"$1,173 ",$235 ,3,163,6/19/2019,1.96,4,2,174,NO Smoking.,
1814322,HEART OF NYC! Sunny furn 1 br wifi,81642477008,verified,Dawn,Manhattan,Gramercy,40.733540000000005,-73.98593000000001,United States,US,True,flexible,Entire home/apt,2010.0,$235 ,$47 ,3,182,6/23/2019,2.3,1,1,364,"No smoking in the apartment, in the common hallway or outside the building. Respectful of our neighbors - no loud music.",
1814874,A nice quiet room in Manhattan,77324860130,unconfirmed,Jay,Manhattan,East Harlem,40.8014,-73.94360999999999,United States,US,True,strict,Private room,2012.0,"$1,160 ",$232 ,1,37,6/2/2019,0.45,5,1,423,,
1815426,Cozy room on a tree lined street,40870484288,verified,Erika,Queens,Ridgewood,40.699220000000004,-73.90026999999999,United States,US,False,strict,Private room,2004.0,"$1,047 ",$209 ,1,30,6/22/2019,0.4,1,1,142,No pets. No smoking. Please :),
1815979,1 bedroom in a super cute 2 bed,88752714734,verified,Ruth,Brooklyn,Williamsburg,40.70653,-73.94421,United States,US,False,strict,Private room,2003.0,$107 ,$21 ,60,3,5/15/2015,0.04,3,1,273,,
1816531,GREAT Studio apartment in Midtown W,36945426983,verified,Ben,Manhattan,Hell's Kitchen,40.76287,-73.9957,United States,US,True,moderate,Entire home/apt,2005.0,$847 ,$169 ,3,46,1/4/2018,0.56,4,1,51,"Please remember that this is a residential building. The building rules, apartment occupancy restrictions and the year-round tenants must be respected.  Parties, pets and smoking are not allowed under any circumstances and incur significant fees.",
1817083,"Peaceful with Windows, Brooklyn Apt",45196634481,verified,Sean - Hygge Stay,Brooklyn,Williamsburg,40.702490000000004,-73.9488,United States,US,False,strict,Entire home/apt,2007.0,$766 ,$153 ,2,211,7/4/2019,2.57,3,1,364,"No guests unless specified, no parties, no loud disturbances, tranquil relaxation!",
1817635,Great Apt Steps from Central Park,16025767582,verified,Lynne,Manhattan,Upper West Side,40.78754,-73.96989,United States,US,True,moderate,Private room,2016.0,$619 ,$124 ,1,93,5/21/2019,1.12,1,1,377,No Pets allowed No smoking,
1818188,1 bedroom apt in heart of Chelsea,30419333134,verified,Nika,Manhattan,Chelsea,40.741,-73.99956999999999,United States,US,False,moderate,Entire home/apt,2009.0,$336 ,$67 ,2,10,5/7/2016,0.13,1,1,341,No Smoking  No Pets,
