45351578,"Nice space in Norwood, NYC",51635115867,verified,Cherly,Bronx,Norwood,40.87315,-73.87925,United States,US,True,strict,Private room,2007,$772 ,$154 ,1,0.0,,,4,1,0,"Limitation of Liability Waiver: Owner makes no warranties to guest of any kind, whether express or implied, including any implied warranty of merchantability, fitness for a particular purpose or non-infringement. Owner does not warrant, and neither shall be liable, to guest or any third party for any unavailability or inoperability of the booking vendor's services, telecommunications systems or the internet, technical malfunction, computer error, corruption or loss of information, or other injury, damage or disruption of any kind to person or property arising from events beyond the reasonable control of owner. In no event shall owner be liable to guest for any indirect, incidental, consequential, special or exemplary damages, including, but not limited to, loss of profits, loss of savings or loss of business opportunity, even if such damages are foreseeable and whether or not such party has been advised of the possibility thereof. Owner's maximum aggregate liability hereunder shall not",
45352131,"Room in sunny, relaxing apartment in Ft. George",66790298730,unconfirmed,Mara,Manhattan,Washington Heights,40.85618,-73.93085,United States,US,True,strict,Private room,2013,$425 ,$85 ,2,7.0,7/23/2017,0.27,3,1,0,"Please respect my home. There are other long term tenants who reside in the building. THERE WILL BE NO PARTIES ALLOWED AT THIS PROPERTY. If guests host a party, they will be asked to leave immediately upon the first report of a disturbance and the security deposit forfeited.",
45352683,Furnished room available until June 4th,10878837558,verified,Anton,Brooklyn,Sheepshead Bay,40.60924,-73.95555999999999,United States,US,False,strict,Private room,2008,"$1,101 ",$220 ,1,0.0,,,3,1,0,,
45353235,"Charming 1 Bedroom Apartment in Bushwick, Brooklyn",61648282982,unconfirmed,Carol,Brooklyn,Bushwick,40.703359999999996,-73.92657,United States,US,False,flexible,Entire home/apt,2020,$98 ,$20 ,1,29.0,5/7/2019,1.12,2,1,0,"Limitation of Liability Waiver: Owner makes no warranties to guest of any kind, whether express or implied, including any implied warranty of merchantability, fitness for a particular purpose or non-infringement. Owner does not warrant, and neither shall be liable, to guest or any third party for any unavailability or inoperability of the booking vendor's services, telecommunications systems or the internet, technical malfunction, computer error, corruption or loss of information, or other injury, damage or disruption of any kind to person or property arising from events beyond the reasonable control of owner. In no event shall owner be liable to guest for any indirect, incidental, consequential, special or exemplary damages, including, but not limited to, loss of profits, loss of savings or loss of business opportunity, even if such damages are foreseeable and whether or not such party has been advised of the possibility thereof. Owner's maximum aggregate liability hereunder shall not",
45353788,Jupiter House,84916564766,unconfirmed,Ashley,Brooklyn,Red Hook,40.67785,-74.00735,United States,US,False,moderate,Entire home/apt,2010,$94 ,$19 ,30,14.0,12/17/2018,0.55,4,1,0,Keep clean; quiet; no parties or excessive drinking,
45354340,Bright and Tranquil Apartment,16303151997,verified,Devan,Brooklyn,Boerum Hill,40.68602,-73.98311,United States,US,True,flexible,Entire home/apt,2019,$719 ,$144 ,2,4.0,11/12/2018,0.37,1,1,311,ABSOLUTELY NO SMOKING PLEASE. OWNER IS ALLERGIC AND SMOKE ALARM IS VERY SENSITIVE.   FIRE DEPARTMENT WILL BE NOTIFIED IF ALARM IS TRIGGERED.  (this also includes cooking at high heat),
45354892,Garden Apartment of Eden,24131684796,unconfirmed,Robert,Brooklyn,Bedford-Stuyvesant,40.68692,-73.94699,United States,US,True,moderate,Entire home/apt,2018,"$1,073 ",$215 ,2,7.0,6/14/2019,2.08,2,1,68,"During your stay please abide by the following guidelines: -No smoking anywhere in the unit -No pets -No parties/extra guests than those originally notified -Food in refrigerator is open, however, anything in the freezer I ask you do not touch *Please keep in mind this is my home, I live here when it is not open to guests therefore many personal belongings will be throughout the home. Be respectful of those things.",
45355444,Lexington Av. Zen Garden Apartment,94561982692,unconfirmed,Ori & Juanjo,Brooklyn,Bedford-Stuyvesant,40.689240000000005,-73.92818,United States,US,False,strict,Entire home/apt,2021,"$1,062 ",$212 ,5,86.0,7/7/2019,3.34,5,1,191,Please note I require a two night minimum Please note the houseboat is limited to 6 occupants including children at any time. No Smoking All occupants must be 25 or accompanied by a parent/ guardian Children under 12 must war a life vest on the docks.  We do not supply child size life vests.   All guests must be considerate of other boat occupants and obey the quiet times of the marina.,
45355997,Minutes from JFK airport and famous mall,71225963066,verified,Hannah,Queens,Rosedale,40.652190000000004,-73.73729,United States,US,True,moderate,Private room,2007,$711 ,$142 ,2,61.0,3/25/2019,2.36,3,2,65,"Only keep all like you see it, Clean Kitchen and Bathroom. No parties or Events",
45356549,Super Spacious and Sunny Top-Floor 1BR in Brooklyn,40422742173,unconfirmed,Ben,Brooklyn,Prospect-Lefferts Gardens,40.66325,-73.94978,United States,US,True,strict,Entire home/apt,2017,$66 ,$13 ,7,0.0,,,5,1,0,"We just ask that you are clean. If you are here for multiple nights we always have fresh towels and extra toiletries, just ask.",
45357101,"Private, cute, and cozy studio close to the subway",17579535276,verified,Jose,Queens,Ozone Park,40.67555,-73.85653,United States,US,True,flexible,Private room,2020,"$1,125 ",$225 ,2,21.0,6/1/2019,0.81,3,2,0,"At La Casita we expect our guests to be respectful of our space and the other people staying here. If you need anything or have any concerns, please communicate them with myself or my roommate Monica.  We love to host people from all over the world and look forward to sharing our space with you.",
45357654,Artists studio,74440075184,verified,Irina,Brooklyn,Kensington,40.63491,-73.96795999999999,United States,US,False,strict,Entire home/apt,2005,$193 ,$39 ,5,7.0,6/14/2019,0.8,5,1,140,Please try to be quite and keep house clean. Thank you very much!,
45358206,Brooklyn Garden Apartment,35799698122,unconfirmed,Julio,Brooklyn,Clinton Hill,40.68307,-73.96595,United States,US,False,moderate,Entire home/apt,2012,"$1,160 ",$232 ,5,11.0,5/28/2019,1.22,5,2,0,"Our Herbivorian House manual with detailed rules and helpful information is present in each apartment.  The apartment must be left as clean as it was found, (especially the kitchen and bathroom) cleaning supplies are present in the apartment. (we are responsible for washing sheets and towels)  If you would rather not clean up after yourself please include an extra $100.00 for the cleaning Help. No loud or late night noises or parties. No additional guests No smoking. No red meat or strong smelling meats shall be cooked (the smell disturbs our primarily vegetarian guests) Pleasant behavior to all other building residents. Any questions assistance needed?.. please contact us, we are happy to help.",
45358758,Brownstone in Clinton Hill Brooklyn,8827263044,verified,Julio,Brooklyn,Clinton Hill,40.68499,-73.96524000000001,United States,US,True,moderate,Entire home/apt,2010,$563 ,$113 ,3,2.0,9/28/2018,0.19,2,2,44,,
45359311,Huge room with private bathroom in East Harlem!,70094607187,unconfirmed,Simon,Manhattan,East Harlem,40.79376,-73.94679000000001,United States,US,True,moderate,Private room,2005,"$1,153 ",$231 ,1,19.0,6/21/2019,0.73,4,4,115,- Guests are expected to keep the house clean and maintain noise level relatively low after 10PM,
45359863,Comfy Private Bedroom,30217397640,unconfirmed,Shahana,Brooklyn,Crown Heights,40.67064,-73.9178,United States,US,False,flexible,Private room,2020,$709 ,$142 ,1,41.0,6/14/2019,1.57,2,10,218,"No unexpected house guests please, and no smoking in the house!",
45360415,Cozy Studio Apartment in Harlem/ Manhattan area,59370803825,unconfirmed,Kim,Manhattan,Harlem,40.80722,-73.95614,United States,US,True,moderate,Entire home/apt,2015,$215 ,$43 ,1,2.0,5/23/2017,0.08,2,1,0,Pets may be allowed for short stays - please check with the hosts. Small/medium sized well-behaved dogs and cats are likely fine. Please clean/put away anything you use from the kitchen. **Check-in time is 2pm and check out time is by 11am. However we can likely make arrangements to leave your bags if you are arriving earlier or not leaving Boston until later in the day.,
45360967,Private Studio-like room on the Upper West Side.,91176924662,unconfirmed,Leisa,Manhattan,Upper West Side,40.80066,-73.96813,United States,US,True,moderate,Private room,2005,$495 ,$99 ,1,0.0,,,3,1,173,#NAME?,
45361520,Large bright artistic apartment,56672741052,verified,Ruthie,Brooklyn,Bushwick,40.702490000000004,-73.93025,United States,US,False,moderate,Entire home/apt,2022,$677 ,$135 ,2,5.0,7/16/2018,0.19,2,1,0,"No unexpected night guests, please No smoke inside the house No drugs . No loud music after 10pm extra quiet  Keep your room and common area clean,No food and drink on the room Clean behind yourself in the bathroom, kitchen and rooms    All visitors of houseguest must leave by a decent hour  No violence No pets Check out please leave key on the kitchen table and close doors by manual lock",
45362072,"One Bedroom-One Bathroom in Greenpoint, Brooklyn.",80581332395,unconfirmed,Matt,Brooklyn,Greenpoint,40.72186,-73.94588,United States,US,True,flexible,Entire home/apt,2018,$726 ,$145 ,2,8.0,12/30/2017,0.31,1,1,0,"Guests are expected to keep the apartmemt clean and in good condition. Noise level should be kept at a reasonable level past 9:30 pm, as this a quiet neighborhood. Smoking in not allowed in the apartment but guests can smoke on the poarch. Small dogs and cats are allowed, but bigger pets will require prior approval.",
45362624,Moore St. Bushwick Loft,53730233142,unconfirmed,Halliday,Brooklyn,Williamsburg,40.70398,-73.93298,United States,US,False,moderate,Entire home/apt,2011,"$1,055 ",$211 ,2,39.0,12/27/2018,1.5,4,1,0,"No pets and absolutely no smoking.  We expect guests to leave the place as they saw it when they first arrived and be clean, respectful, and responsible.",
45363177,RIVER VIEWS- EAST 52ND LUXURY 1 BR APARTMENT,14890216895,verified,Ruchi,Manhattan,Midtown,40.75403,-73.96343,United States,US,True,strict,Entire home/apt,2017,$973 ,$195 ,30,0.0,,,5,49,364,"Guests are responsible to clean up after themselves in common areas including dishes (dishwasher), and countertops. No candles or open flames in the condominium.",
45363729,Private bedroom in large sunny 3 BR/2BA,55074959415,unconfirmed,Jennifer,Brooklyn,Crown Heights,40.67305,-73.94788,United States,US,False,moderate,Private room,2007,$692 ,$138 ,1,3.0,11/11/2018,0.34,3,2,179,"Quiet hours are from midnight to 6 a.m.  We ask for guests to check in by 11 p.m. at the latest, however, we are flexible if there are transportation delays.",
45364281,Beautiful studio in midtown Manhattan,77161827630,verified,Stanley,Manhattan,Murray Hill,40.74863,-73.9767,United States,US,True,strict,Entire home/apt,2008,$629 ,$126 ,30,0.0,,,3,50,365,,
45364834,Nicely Appointed Studio with Alcove for Bed,63701650198,verified,Ashley,Manhattan,East Harlem,40.80324,-73.9352,United States,US,False,flexible,Entire home/apt,2009,$975 ,$195 ,2,8.0,5/29/2019,0.34,3,1,11,"We will try to always treat you with loving kindness and respect, and we expect the same from our guests. We expect our guest to abstain from smoking and drinking  in the room (or house in general).",
45365386,"Huge Brooklyn Brownstone Living, Close to it all.",93285687114,verified,Kimberly,Brooklyn,Bedford-Stuyvesant,40.69023,-73.95428000000001,United States,US,False,flexible,Private room,2014,$603 ,$121 ,4,1.0,1/6/2018,0.05,2,4,28,#NAME?,
45365938,Room with Unbeatable Manhattan Skyline View,95338297826,unconfirmed,Kaila,Brooklyn,Greenpoint,40.72463,-73.95227,United States,US,False,strict,Private room,2014,$88 ,$18 ,5,3.0,6/12/2018,0.13,2,1,0,,
45366490,"Park, Subway & All Conveniences",30280131968,verified,Meredith,Brooklyn,Greenpoint,40.72357,-73.95057,United States,US,True,strict,Entire home/apt,2011,$754 ,$151 ,2,2.0,8/22/2018,0.09,2,1,34,"(website hidden) intentional damage is done to the boat or its contents.  (website hidden) charges are incurred due to contraband, pets or collection of rents or services rendered during the stay. 3.All debris, rubbish and discards are placed in the properly bagged, and soiled dishes are placed cleaned. 4.All keys are left on the kitchen table and unit is left locked. (website hidden) linens are lost or damaged. (website hidden) Early check-in or late check-out, unless approved in advance. 5.PAYMENT - An advance payment equal to 50% of the total is required when the reservation is confirmed. The balance is due one month before your arrival date. Please make payments in the form of credit card (Mastercard or Visa). We do not accept payments in the form of traveler's checks, bank money orders, cashiers checks or personal checks. 6.CANCELLATIONS - A sixty (60) day advance notice is required for cancellation. Cancellations that are made more than sixty (60) days prior to the arrival date w",
45367043,Private room with private bathroom,28917127918,verified,Salah,Brooklyn,Williamsburg,40.71627,-73.93956999999999,United States,US,True,flexible,Private room,2019,$881 ,$176 ,7,1.0,3/24/2019,0.28,1,1,365,No smoking and no pets allowed.,
45367595,The Regal Crash Suite,36473026357,unconfirmed,King,Manhattan,Harlem,40.81372,-73.95612,United States,US,True,moderate,Entire home/apt,2017,$577 ,$115 ,1,51.0,5/22/2019,1.96,3,1,67,"The only thing we ask is that you respect our home and don't cause any damage to our personal belongings. If something breaks, please let us know is all we ask -- we don't like surprises! And, of course, be nice to our dog - that goes without saying :)",
45368147,Large King size bed private entrance 5 mins to NYC,41163299557,verified,Rossana,Queens,Astoria,40.75777,-73.91577,United States,US,False,flexible,Private room,2005,$376 ,$75 ,5,17.0,6/3/2018,0.65,5,2,208,,
45368700,Private Room 2 Blocks From Central Park / UWS,17857798068,unconfirmed,Omer,Manhattan,Upper West Side,40.799479999999996,-73.96314,United States,US,False,flexible,Private room,2016,"$1,044 ",$209 ,1,5.0,6/23/2017,0.2,2,1,0,I am very laid back but I do expect you to respect my things and my space. No smoking inside the house!!!!,
45369252,Beautiful Brooklyn Apartment! Newly Renovated!,44948869758,unconfirmed,Carla,Brooklyn,Prospect Heights,40.6806,-73.97164000000001,United States,US,False,flexible,Entire home/apt,2013,$969 ,$194 ,2,140.0,6/27/2019,5.61,2,1,94,No loud noises No parties,
45369804,Nice and fully furnished room in Staten Island,51096506875,unconfirmed,Ely,Staten Island,Port Richmond,40.63748,-74.13495999999999,United States,US,True,strict,Private room,2013,"$1,044 ",$209 ,1,63.0,5/27/2019,2.42,5,1,343,,
45370357,Cute studio in perfect location near Union Square,97625360412,verified,Amy,Manhattan,East Village,40.73193,-73.98861,United States,US,False,flexible,Entire home/apt,2017,$500 ,$100 ,3,0.0,,,5,1,0,"1.CHECK-IN TIME IS AFTER 3 P.M. EST AND CHECK-OUT IS 11 A.M. EST. 2.This is a NON SMOKING boat. 3.We will not rent to vacationing students or singles under 25 years of age  unless accompanied by an adult guardian or parent. 4.DAMAGE WAIVER- A damage waiver of $39 is required. The waiver offers up to $1500 of insurance against accidental damage. You will not be held responsible for damage incurred provided the following provisions are met: (website hidden) intentional damage is done to the boat or its contents.  (website hidden) charges are incurred due to contraband, pets or collection of rents or services rendered during the stay. 3.All debris, rubbish and discards are placed in the properly bagged, and soiled dishes are placed cleaned. 4.All keys are left on the kitchen table and unit is left locked. (website hidden) linens are lost or damaged. (website hidden) Early check-in or late check-out, unless approved in advance. 5.PAYMENT - An advance payment equal to 50% of the total is re",
45370909,Luxury 1 Bed Apt- Central Park View,29189312162,unconfirmed,Lu,Manhattan,Upper West Side,40.7932,-73.96385,United States,US,False,moderate,Entire home/apt,2010,$213 ,$43 ,3,1.0,9/22/2017,0.05,2,1,0,Be respectful. Please make sure the door is locked behind you when you leave. No shoes in the house. Slippers provided upon request. No drugs. No excessive alcohol use. No unauthorized guests.,
45371461,Sunlit Room w/ private bath @ Upper West Manhattan,82218945920,verified,Shuting,Manhattan,Upper West Side,40.80225,-73.96633,United States,US,True,flexible,Private room,2003,$922 ,$184 ,3,4.0,9/4/2017,0.15,1,1,16,,
45372013,Genie's Lamp Garden Apartment,42014334078,unconfirmed,Tracy,Brooklyn,South Slope,40.66615,-73.98554,United States,US,True,moderate,Entire home/apt,2016,$117 ,$23 ,2,88.0,2/23/2019,3.53,4,1,0,,
45372566,Large studio-Luxury Building Times Square,72426917748,verified,Ava,Manhattan,Hell's Kitchen,40.75997,-73.99923000000001,United States,US,True,moderate,Entire home/apt,2017,$816 ,$163 ,1,18.0,9/7/2018,0.72,2,1,0,"We suggest you use email or texting contact us if need, do not call us. We will not accept calling from AirBnB guests. We will back to you ASAP.",
45373118,Cozy East Village Room,82962721626,unconfirmed,Maureen,Manhattan,East Village,40.72681,-73.98963,United States,US,True,flexible,Shared room,2014,$711 ,$142 ,1,0.0,,,3,1,0,,
45373670,Luxe Penthouse with Terrace/Upper West Side,57906740441,unconfirmed,Terry,Manhattan,Upper West Side,40.80005,-73.9701,United States,US,False,moderate,Entire home/apt,2017,$967 ,$193 ,3,3.0,6/22/2019,0.27,1,1,0,"Don't do anything you wouldn't want done at your place. Our home is your home when you stay here. Smoking is not allowed indoors, but we have a balcony you can smoke on.",
45374223,Cozy Room in Newly Redone Place 35 min to Times Sq,46536149475,verified,Daniel,Manhattan,Inwood,40.86854,-73.9182,United States,US,False,strict,Private room,2009,"$1,171 ",$234 ,1,2.0,1/25/2018,0.11,5,2,0,,
45374775,Nicer than average - on best block in Wash.Heights,85102134489,verified,Allison,Manhattan,Washington Heights,40.85391,-73.93649,United States,US,True,flexible,Private room,2013,$742 ,$148 ,3,18.0,6/23/2019,1.78,4,1,298,- Guests are expected to keep the house in good conditions and maintain noise level relatively low after 10PM,
45375327,Two bedroom apartment for rent in Brooklyn,17052394984,unconfirmed,Cheryl,Brooklyn,Prospect-Lefferts Gardens,40.65704,-73.9603,United States,US,False,strict,Entire home/apt,2012,$533 ,$107 ,4,2.0,6/21/2019,0.08,1,1,0,,
45375880,Spacious and Sunny Private Bedroom in Dumbo,37392721026,unconfirmed,Allie,Brooklyn,Vinegar Hill,40.70257,-73.98053,United States,US,True,moderate,Private room,2003,"$1,102 ",$220 ,1,53.0,6/1/2019,2.33,2,3,21,"No smoking, parties, or additional guests. No pets without prior approval. Please clean up after yourself in the shared spaces, as this is my home.",
45376432,HUGE Studio up to 4 people 15 min to Manhattan.,37707192179,verified,David,Queens,Forest Hills,40.73526,-73.85065,United States,US,False,strict,Entire home/apt,2016,$595 ,$119 ,3,6.0,5/18/2018,0.27,1,6,0,"No drugs ,No smoking No loud music after 10pm  Keep your room and common area clean  Clean behind yourself in the bathroom, kitchen and rooms  Please no food on the room   All visitors of houseguest must leave by a decent hour  No violence No pets Check out please leave key on the kitchen table and closed doors with manual lock",
45376984,Furnished Studio in Midtown Manhattan,98154760739,unconfirmed,Stanley,Manhattan,Murray Hill,40.74819,-73.976,United States,US,True,flexible,Entire home/apt,2021,$195 ,$39 ,30,3.0,10/30/2018,0.14,4,50,180,,
45377536,"Clean, Spacious Room on Upper West Side",2276309849,unconfirmed,Sean,Manhattan,Morningside Heights,40.803709999999995,-73.96324,United States,US,True,moderate,Private room,2014,$206 ,$41 ,3,16.0,11/27/2018,0.7,2,1,0,,
45378089,"Spacious, sunny bedroom in Williamsburg/Greenpoint",95714596062,verified,Anada,Brooklyn,Greenpoint,40.72247,-73.95108,United States,US,True,strict,Private room,2004,$911 ,$182 ,1,1.0,6/2/2017,0.04,5,1,0,"No loud music after 10pm. Absolutely no smoking or pets. If there is other evidence of smoking or pets in the property, you will forfeit your entire security deposit. Check in and check out time can be flexible depending upon the dates you are looking for and whether anyone else is staying. Unless we arrange otherwise, check in is after 4pm and check out is before noon. The cleaning fee covers two hours. If additional cleaning is required, you will be charged $50/hour, deducted from your deposit. No parties. If a neighbor complains about a party happening or loud music after 10pm, or if there is a big mess left at the place, you will forfeit your entire deposit. Your internet usage will be logged and monitored if you access a blacklisted site or ip range. Please don't abuse the connection speed by downloading illegal content while a guest. You agree to follow all of the rules of the building, which will be provided. Any issues with not following the building rules and you forfeit your ",
45378641,Beautiful Williamsburg Loft,29743336671,verified,Rose & Brian,Brooklyn,Williamsburg,40.71813,-73.94502,United States,US,False,flexible,Entire home/apt,2020,$726 ,$145 ,2,9.0,5/20/2018,0.36,5,1,0,#NAME?,
45379193,LARGE 3 BEDROOMS UP  9 People 15 MIN TO MANHATTAN,40705127297,unconfirmed,David,Queens,Forest Hills,40.73437,-73.85226999999999,United States,US,False,flexible,Entire home/apt,2020,$475 ,$95 ,3,2.0,3/31/2019,0.09,5,6,188,"No candles, no smoking, no food in room, no private kitchen use.",
45379746,"4 twin bunkbeds, 5 minutes to JFK",2662207209,unconfirmed,John And Colleen,Queens,Springfield Gardens,40.66413,-73.76651,United States,US,False,moderate,Private room,2014,$559 ,$112 ,1,15.0,2/5/2019,0.62,5,4,84,,
45380298,Clean Cozy & Comfy Apartment In NYC!,70057715035,verified,Ben,Manhattan,Gramercy,40.73742,-73.98219,United States,US,True,strict,Entire home/apt,2012,$154 ,$31 ,2,58.0,6/9/2019,2.65,5,3,323,"I kindly ask that you not smoke in the apartment, the public areas outside the main entry doors. Pets are not allowed.",
45380850,FURNISHED * ONE BED * DOORMAN * LUXURY * GYM *,65131530551,verified,Natie,Manhattan,Theater District,40.76044,-73.98321,United States,US,True,moderate,Entire home/apt,2019,$459 ,$92 ,10,0.0,,,3,1,64,"No smoking, no parties, no pets. Four night minimum stay.  I need to have information about who will be staying at the house before a booking will be accepted.",
45381403,East Williamsburg/Bushwick Loft,66649793275,unconfirmed,Paul,Brooklyn,Williamsburg,40.70492,-73.93341,United States,US,False,moderate,Private room,2021,$694 ,$139 ,1,25.0,12/30/2018,0.96,5,2,364,#NAME?,
45381955,Luminous studio in Union Square,74714265293,unconfirmed,Margot,Manhattan,East Village,40.733340000000005,-73.98904,United States,US,False,moderate,Entire home/apt,2020,"$1,111 ",$222 ,7,35.0,6/23/2019,1.4,4,1,7,"Hosted check in time is 4-8 p.m. Early and late check-ins are possible upon request in advance and subject to availability.  Check out time is 11 a.m.  Regretfully, for health and safety reasons, smoking is not permitted on the property. Regretfully, the space is not appropriate for young children, so we can't accommodate them. 48 hours cancellation notice or full charge. Regretfully, we cannot accommodate guest pets  Discounted rates for weekly and monthly stays.",
45382507,Williamsburg Family townhouse,55255460390,unconfirmed,John,Brooklyn,Williamsburg,40.71335,-73.94115,United States,US,False,moderate,Entire home/apt,2013,$454 ,$91 ,5,0.0,,,4,1,0,,
45383059,Modern Bright Bedroom 30 seconds to Subway!,58544118106,unconfirmed,Lana,Queens,Long Island City,40.75607,-73.93021999999999,United States,US,True,flexible,Private room,2017,$84 ,$17 ,2,91.0,6/23/2019,3.54,3,2,21,Maximum number of Guests accepted is 4. No house parties or other social gatherings allowed while staying at our place.,
45383612,STUDIO ON WEST 56TH COLUMBUS CIRCLE~DOORMAN,75493028872,verified,Ruchi,Manhattan,Hell's Kitchen,40.76617,-73.98445,United States,US,False,strict,Entire home/apt,2015,$401 ,$80 ,30,0.0,,,3,49,364,"1. NO parties, no loud gatherings, no loud noises. 2.Please respect our neighbors by keeping noise levels low (we share an interior wall), parking only in the designated space and not overlaping spaces, and staying off their part of the property - their front patio, back deck outside the kitchen, and their section of the basement.   3. No guests not included in the booking are allowed in the house. The maximum number of people allowed at the property is 7 with special arrangement. The fourth bedroom should only be used for parties of 7 or guests who have paid an additional fee.  4. No smoking inside.  5. Antiques require an extra level of care. Use a coaster please! 6. If parking carefully read over all rules, and make sure to follow directions or you will be towed.  7. Read over your Welcome Guide prior to your stay.  We expect people to be very responsible with our house. We want people to have fun and that is why we have tried to provide the best, and we hope people take notice and ",
