10811289,Huge Private Room in Williamsburg/Buschwick!!,22590765431,verified,Cristina,Brooklyn,Williamsburg,40.70875,-73.94270999999999,United States,US,False,flexible,Private room,2019,$487 ,$97 ,2,2,8/1/2016,0.06,1,1,0,"Orderly house and we want to keep it this way Bathrooms don't have high traffic as we agree to take shower before bed and not in the morning Everyone picks up after themselves No disturbance of any kind greatly appreciated:) but ASK ME (not other guests) questions any time you need/want to know something or unsure about how to do things, etc. Emails is the best way to communicate. When talking on the phone, please do it in your room with door closed Please walk calm, don't run the stairs, as it reduce the noise Close all doors gently please Non-smoker only Guests will be liable for any damages they caused: inspect the room upon arrival and sign the report Only food items can be placed into the kitchen sink compost disposal No smoking anywhere in/out of the house No perfume/cologne, scented laundry detergent allowed Doing laundry in a sink/bath not allowed Guests/visitors are not permitted Rescued/injured animals can be brought in for further assistance",
10811841,"Cozy 1 Bedroom in Crown Heights, right by subway!",43765973826,unconfirmed,Chana,Brooklyn,Crown Heights,40.66873,-73.9329,United States,US,False,moderate,Entire home/apt,2014,$473 ,$95 ,1,0,,,5,1,0,,
10812393,Brooklyn at its Best!,29891995913,verified,Ainslie And John,Brooklyn,Prospect-Lefferts Gardens,40.659659999999995,-73.95600999999999,United States,US,True,flexible,Private room,2007,$376 ,$75 ,2,160,7/2/2019,4.44,3,2,136,No guests/visitors Storage not provided Limited number of things allowed:one-two suitcases The house is quiet and we want to keep it this way.  Please pick up after yourself and please keep toilet bowl and shower clean Toilet must be closed when not in use It is requested to take shower and do shaving before bed and keep morning bathroom time to the minimum: others are waiting  Additional toilet/sink is on the first floor.  No disturbance: please walk slowly on the stairs Keep phone conversation inside your room without using computer speakers,
10812946,Spectacular Views! Gorgeous 25th flr Columbus Cl,62776930638,unconfirmed,Marissa,Manhattan,Midtown,40.76618,-73.98279000000001,United States,US,True,strict,Entire home/apt,2003,$659 ,$132 ,1,0,,,4,1,0,"Please expect to share the apartment with guests having various backgrounds. Be respectful and decent, also enjoy interacting with each other. Please dress descent in the house especially in and out of the shower.",
10813498,Your own Midtown Manhattan Apt & private Garden,45043369998,unconfirmed,Chantelle,Manhattan,Murray Hill,40.747440000000005,-73.97299,United States,US,True,flexible,Entire home/apt,2016,"$1,135 ",$227 ,1,56,6/9/2019,1.58,1,2,217,No pets. No smoking.,
10814050,Charming Brooklyn apartment in historic brownstone,95968985634,verified,Heather,Brooklyn,Clinton Hill,40.69048,-73.96576999999999,United States,US,True,flexible,Entire home/apt,2019,$873 ,$175 ,2,9,3/9/2019,0.25,1,1,0,"There will be a small lockbox at the building entrance (on your left side if you are facing the door). The code for this lockbox will be send to you after you have confirmed your reservation. Inside the lockbox you will find 2 keys, one that works for both of the building doors ,and another for the apartment's door).  NO smoking. *We are not responsible for any accidents, injuries, or illness that occurs while on the premises; or for the loss of guests' personal belongings or valuables. By accepting this reservation, it is agreed that all guests are expressly assuming the risk of any harm to themselves arising from their use of the premises or to others whom they invite to use the premises.",
10814602,Bright Astoria Apt Near Manhattan,54834457682,unconfirmed,Lili,Queens,Ditmars Steinway,40.771209999999996,-73.9171,United States,US,True,flexible,Entire home/apt,2005,$79 ,$16 ,2,9,10/7/2017,0.26,3,1,0,,
10815155,1 Bedroom Apartment in Brooklyn fully renovated,90685975354,verified,Martin,Brooklyn,Bushwick,40.68374,-73.90988,United States,US,True,flexible,Entire home/apt,2014,$565 ,$113 ,4,85,6/19/2019,2.41,5,2,107,,
10815707,"# CENTRAL PARK - 3 stops away (32""TV room)",17283437853,verified,G. Matthew,Manhattan,Harlem,40.81922,-73.95276,United States,US,False,flexible,Private room,2020,"$1,153 ",$231 ,2,121,6/30/2019,3.44,3,3,65,,
10816259,Sunny Suite in Bed Stuy with AC!,53874086529,verified,Hadass,Brooklyn,Bedford-Stuyvesant,40.689679999999996,-73.94548,United States,US,True,moderate,Private room,2006,$978 ,$196 ,2,104,6/24/2019,2.88,5,3,97,,
10816812,Affordable room near of LGA airport in Queens.,74516292001,unconfirmed,Lucilu,Queens,Woodside,40.74071,-73.89186,United States,US,True,strict,Private room,2006,"$1,080 ",$216 ,1,251,6/23/2019,9.3,3,2,31,,
10817364,Private studio in the heart of Park Slope,46828790444,unconfirmed,Jasna,Brooklyn,Park Slope,40.67819,-73.98084,United States,US,True,strict,Entire home/apt,2013,$63 ,$13 ,3,10,11/15/2017,0.28,3,1,0,"Nothing unusual, I expect that you clean after yourself (bathroom, kitchen...).  The building is calm, so no loud music or parties is allowed. Check-in time on week days will be limited to non-business hours (after 6pm).  Check-out time is whenever you want, unless I've other guest that are arriving.",
10817916,Modern Apt in Prime Brooklyn That Has it All,1593765591,verified,Igor,Brooklyn,Park Slope,40.67132,-73.98709000000001,United States,US,False,moderate,Entire home/apt,2005,$676 ,$135 ,1,0,,,1,1,0,1) No Smoking in property!!!  2) Do not slam doors!!! Close lightly Please!!! 3) No Shoes in house (except slippers) 4) Quiet down AFTER 10PM.,
10818469,Spacious Room with Character in BK,333013198,verified,Talor,Brooklyn,Crown Heights,40.67285,-73.95734,United States,US,True,strict,Private room,2020,"$1,032 ",$206 ,1,3,10/15/2017,0.09,3,1,0,"House Rules 1. All bookings made at least a week before check in are fully refundable if cancelled within 24 hours of booking. After this, you will receive a 50% refund if you cancel at least 7 days before the start of your trip. 2. Check-in time is any time after 4 pm local time. If the unit is ready earlier, we’ll let you know. Check-out is normally 11 am local time, but we’d be happy to extend it as long as we don’t have a cleaning scheduled. Just let us know.  3. All bookings require a security deposit of at least $300. 4. For security measures we require all guests to provide proof of identification through ID verification on our own website. In order to check in, we'll need a photo of your ID.  5. Don’t let $300 go up in smoke. There's no smoking allowed in any Flatbook and a $300 fine for breaking this rule.  6. Unfortunately we don’t allow pets in most of our apartments. 7. Unless you’re staying in one of our specialty apartments, we don’t allow parties or excessive noise. 8. I",
10819021,Spacious Manhattan apartment with amazing view,43273282475,verified,Fredrik,Manhattan,Midtown,40.74569,-73.98592,United States,US,True,flexible,Entire home/apt,2013,$466 ,$93 ,3,2,1/2/2017,0.07,4,1,0,"The (URL HIDDEN) use of tobacco/smoking/substances of abuse (including alcohol) on the property...quiet during night (you can go in and out as you like, just of course be quiet when we might be sleeping, as we try to be if coming home late when you might be in bed)...tell us a bit about yourself if you like and pls ask us about anything we might be able to tell you about locally/perhaps assist with...contact us when you're here with any questions!  We particularly dislike jokes having to do with avocados.  :   )  Do sign our map of where you're from. Some more room/house use points: ->  If you need it before we actually meet and show you, the bathroom is upstairs; feel free to get water for your use from bathroom faucet (it's fine to drink here, and in most of the US.  Bottled water is rarely different than usual US tap water, with the bottling craze a big drain on resources, to be actively eschewed for the sake of our Mother Earth...). ->  If you need to borrow a towel, there should b",
10819573,GORGEOUS REMODELED 1-BEDROOM PRIME LOCATION,31544902000,unconfirmed,Alessandro,Manhattan,Upper West Side,40.79657,-73.9624,United States,US,True,strict,Private room,2011,$221 ,$44 ,3,68,4/22/2019,1.87,5,1,0,"• No smoking, pets, or unannounced guests. • Respect the check-out time of 11:00 AM. If you have special requests, discuss with us ahead of time! • Clean the kitchen/wash dishes after use. • Keep a reasonable volume after 11:00 PM & before 8 AM",
10820125,"Great quiet room,great location",15556611059,unconfirmed,Mary,Queens,Sunnyside,40.743790000000004,-73.91277,United States,US,False,moderate,Private room,2011,$574 ,$115 ,1,1,9/11/2016,0.03,2,1,173,"Please try to be mindful/aware of your actions and their effect on others No disturbance is greatly appreciated:) When talking on the phone, please do so only in your room with door closed:) unless it's an emergency Please walk, don't run the stairs (the slower you walk the less noise there is) Close all doors gently please No smoking anywhere in or out of the house If you tell me you stayed with friends who smoked as a reason for the smell, it will not matter No perfume/cologne, scented laundry detergent allowed (suitable product provided, just ask if needed) Guests/visitors not permitted",
10820678,Big 4 bedroom house with garden by the Park in PLG,66764226096,verified,Audrey,Brooklyn,Prospect-Lefferts Gardens,40.65627,-73.95468000000001,United States,US,True,strict,Entire home/apt,2014,$944 ,$189 ,2,10,5/30/2017,0.29,4,1,0,1) No Smoking in property!!!  2) Do not slam doors!!! Close lightly Please!!! 3) No Shoes in house (except slippers) 4) Quiet down AFTER 10PM.,
10821230,Updated East Side 2 Bedroom,52358378248,verified,Corporate Housing,Manhattan,Kips Bay,40.74096,-73.98055,United States,US,True,moderate,Entire home/apt,2013,$358 ,$72 ,30,4,9/14/2018,0.12,1,91,364,,
10821782,Tribeca Luxury 2000sf Loft,24471418481,verified,Alex,Manhattan,Tribeca,40.71559,-74.00737,United States,US,False,strict,Entire home/apt,2016,$316 ,$63 ,1,1,7/17/2016,0.03,3,1,0,,
10822335,Time SQ  Midtown West Central Park 3Beds Sleep6,38630589402,verified,Joel,Manhattan,Hell's Kitchen,40.76463,-73.98855,United States,US,False,strict,Entire home/apt,2014,$795 ,$159 ,2,125,6/11/2019,3.44,2,1,146,"You will meet a clean apartment, please leave it clean  No Smoking please. Sorry, but NO PETS",
10822887,Newly Renovated Clinton Hill Duplex,24101021515,verified,Maya,Brooklyn,Clinton Hill,40.68265,-73.96631,United States,US,True,flexible,Entire home/apt,2009,$526 ,$105 ,5,80,6/22/2019,2.21,1,1,92,,
10823439,Extremely spacious duplex with garden,58038885333,verified,Elaine,Brooklyn,Sunset Park,40.66053,-73.98929,United States,US,False,flexible,Entire home/apt,2020,"$1,194 ",$239 ,5,8,11/26/2017,0.23,2,1,0,,
10823992,Cosy Studio with a backyard in Forest Hills,91136643295,verified,Swati,Queens,Forest Hills,40.72143,-73.85521999999999,United States,US,False,moderate,Entire home/apt,2013,$708 ,$142 ,1,143,6/28/2019,3.96,4,1,282,"House Rules 1. Check-in is 4 pm local time. If the unit is ready earlier, we’ll let you know. Check-out is normally 11 am local time, but we’d be happy to extend it as long as we don’t have a cleaning scheduled. Just let us know.  2. All bookings require a security deposit of at least $300, which will be refunded within 7 days of your check-out. 3. For security measures we require all guests to provide proof of identification through ID verification on our own website. In order to check in we'll need a photo of your ID.  4. Our cancellation policy is as shown on our ad and defined by the site you are booking through.  5. Don’t let $300 go up in smoke. There's no smoking allowed in any Flatbook and a $300 fine for breaking this rule.  6. Unfortunately we don’t allow pets in any of our apartments. 7. Unless you’re staying in one of our specialty apartments, we don’t allow parties or excessive noise. 8. If we find the place very messy, we have to charge an extra $40 for every extra hour o",
10824544,Large Upper East Side Alcove Studio,46942417170,verified,Nicole,Manhattan,Upper East Side,40.76749,-73.96392,United States,US,False,moderate,Entire home/apt,2009,$265 ,$53 ,3,1,7/23/2016,0.03,1,1,0,"House Rules 1. All bookings made at least a week before check in are fully refundable if cancelled within 24 hours of booking. After this, you will receive a 50% refund if you cancel at least 7 days before the start of your trip. 2. Check-in time is any time after 4 pm local time. If the unit is ready earlier, we’ll let you know. Check-out is normally 11 am local time, but we’d be happy to extend it as long as we don’t have a cleaning scheduled. Just let us know.  3. All bookings require a security deposit of at least $300. 4. For security measures we require all guests to provide proof of identification through ID verification on our own website. In order to check in, we'll need a photo of your ID.  5. Don’t let $300 go up in smoke. There's no smoking allowed in any Flatbook and a $300 fine for breaking this rule.  6. Unfortunately we don’t allow pets in most of our apartments. 7. Unless you’re staying in one of our specialty apartments, we don’t allow parties or excessive noise. 8. I",
10825096,Cozy room w/private entrance in East Williamsburg,67296245198,unconfirmed,Kaitlin,Brooklyn,Williamsburg,40.70883,-73.93873,United States,US,True,strict,Private room,2003,$233 ,$47 ,1,14,4/12/2017,0.4,2,1,0,Please don't use the washer and dryer after 10pm or before 8am!,
10825648,Greenpoint Artist Loft,21530246136,unconfirmed,Ashley,Brooklyn,Greenpoint,40.72675,-73.94219,United States,US,False,moderate,Private room,2009,$66 ,$13 ,7,2,12/6/2016,0.06,1,1,0,,
10826201,Luxury Apt With Sunset View,72570581633,verified,Donna,Manhattan,Chelsea,40.7464,-73.9909,United States,US,False,strict,Entire home/apt,2010,$153 ,$31 ,7,0,,,2,1,0,Please be respectful of other guests No Pets and No Smoking No loud music or noise after 10 PM,
10826753,Private apartment 45 min away from the city,22943919895,verified,Peter,Queens,Ozone Park,40.68345,-73.83378,United States,US,True,moderate,Entire home/apt,2008,$805 ,$161 ,1,11,8/23/2016,0.31,5,1,0,- Additional charge for extra guests - No Smoking! - No pets,
10827305,Cozy Upper West Side Studio,96420355461,verified,Agata,Manhattan,Upper West Side,40.793009999999995,-73.97544,United States,US,False,moderate,Entire home/apt,2019,$778 ,$156 ,2,28,5/20/2019,0.79,4,2,336,,
10827858,1 large bedroom with private bathroom,21525000326,verified,Marwan,Brooklyn,Bushwick,40.693870000000004,-73.91341,United States,US,True,moderate,Private room,2015,$841 ,$168 ,5,0,,,5,1,0,"- Non-smoker - No cologne/perfumed spray use - Please take shower before bed to avoid morning rush - Take off street shoes and place on rack, - Please bring slippers or ask me for a pair - Recycling and reusable shopping bag use (provided) - Limit things to bring in: 1-2 suitcases OK - Mailing address not to be shared with anyone; you will be charged $200 if you do",
10828410,Heart of Willimsburg- 1 block from bedford L stop,16837051755,verified,Ariana,Brooklyn,Williamsburg,40.71675,-73.95725,United States,US,True,flexible,Private room,2010,$969 ,$194 ,4,0,,,2,1,0,,
10828962,Eclectic & Cozy Private Room in Prospect Hts!!!,17684786517,unconfirmed,Sherice,Brooklyn,Crown Heights,40.68035,-73.96239,United States,US,True,flexible,Private room,2017,$519 ,$104 ,2,1,7/24/2016,0.03,1,1,0,We like quirt. So please dont hold party at night.,
10829515,2 BDRM/1.5 Bath Prospect Heights Brooklyn/Sleeps 6,51080456395,unconfirmed,Gary,Brooklyn,Prospect Heights,40.679590000000005,-73.96486,United States,US,False,flexible,Entire home/apt,2012,$840 ,$168 ,3,0,,,2,1,0,,
10830067,2 Bedroom Duplex with large backyard,43003223615,verified,William,Brooklyn,Williamsburg,40.7121,-73.93705,United States,US,False,flexible,Entire home/apt,2014,$362 ,$72 ,4,1,8/7/2016,0.03,2,1,0,"Please, No shoes allowed. There's a mat for them, just inside the door.",
10830619,The Griffin B & B- 2 bedroom suite in Ditmas Park,67325637819,unconfirmed,Jeannine,Brooklyn,Flatbush,40.63273,-73.96385,United States,US,False,moderate,Entire home/apt,2005,$688 ,$138 ,2,10,7/1/2019,0.91,5,1,167,"House Rules 1. Check-in is 4 pm local time. If the unit is ready earlier, we’ll let you know. Check-out is normally 11 am local time, but we’d be happy to extend it as long as we don’t have a cleaning scheduled. Just let us know.  2. All bookings require a security deposit of at least $300, which will be refunded within 7 days of your check-out. 3. For security measures we require all guests to provide proof of identification through ID verification on our own website. In order to check in we'll need a photo of your ID.  4. Our cancellation policy is as shown on our ad and defined by the site you are booking through.  5. Don’t let $300 go up in smoke. There's no smoking allowed in any Flatbook and a $300 fine for breaking this rule.  6. Unfortunately we don’t allow pets in any of our apartments. 7. Unless you’re staying in one of our specialty apartments, we don’t allow parties or excessive noise. 8. If we find the place very messy, we have to charge an extra $40 for every extra hour o",
10831171,Apartment in Ridgewood/Bushwick Neighborhood,13266329962,unconfirmed,Jon,Queens,Ridgewood,40.69968,-73.90697,United States,US,True,strict,Private room,2011,$152 ,$30 ,2,0,,,5,1,0,"House Rules 1. Check-in is 4 pm local time. If the unit is ready earlier, we’ll let you know. Check-out is normally 11 am local time, but we’d be happy to extend it as long as we don’t have a cleaning scheduled. Just let us know.  2. All bookings require a security deposit of at least $300, which will be refunded within 7 days of your check-out. 3. For security measures we require all guests to provide proof of identification through ID verification on our own website. In order to check in we'll need a photo of your ID.  4. Our cancellation policy is as shown on our ad and defined by the site you are booking through.  5. Don’t let $300 go up in smoke. There's no smoking allowed in any Flatbook and a $300 fine for breaking this rule.  6. Unfortunately we don’t allow pets in any of our apartments. 7. Unless you’re staying in one of our specialty apartments, we don’t allow parties or excessive noise. 8. If we find the place very messy, we have to charge an extra $40 for every extra hour o",
10831724,Luxury 1bdr in East Village,45015011385,verified,Johnny,Manhattan,East Village,40.72268,-73.98215,United States,US,True,moderate,Entire home/apt,2021,$386 ,$77 ,4,2,6/27/2018,0.08,5,1,16,ALCOHOL IS STRICTLY NOT ALLOWED INSIDE THE HOUSE !,
10832276,"Huge, Quiet Room, Near Columbia & Express Subways!",37955614173,unconfirmed,James & Shaun,Manhattan,Harlem,40.81557,-73.95295,United States,US,True,strict,Private room,2022,$410 ,$82 ,1,147,7/7/2019,4.24,1,2,165,No smoking inside the house and make sure to think about the house as your own,
10832828,East Flatbush- Sunny 1 bedroom apt,23462511510,verified,Jay,Brooklyn,Flatlands,40.62297,-73.93849,United States,US,False,flexible,Private room,2013,$973 ,$195 ,1,7,5/12/2018,0.2,5,1,311,,
10833381,Room Available in Heart of Fort Greene,55645592422,verified,Nick,Brooklyn,Fort Greene,40.6875,-73.97605,United States,US,False,flexible,Private room,2011,$133 ,$27 ,1,0,,,5,1,0,,
10833933,Luxurious 1 Bedroom Best Location,96483044635,unconfirmed,Corporate Housing,Manhattan,Kips Bay,40.74201,-73.97957,United States,US,True,strict,Entire home/apt,2022,$395 ,$79 ,30,7,4/9/2019,0.29,4,91,342,"Non smoker only Guest may not bring car to the area Perfumes, sprays, candles, not allowed Cat in the house Mailing address may not be given to anyone without written permission If we get correspondence on your name, you will be charged $200  Separate recycle from trash (I can help, just ask) Black bag for recycling is in your room, put all in one bag Guests are not allowed The house is quiet as others are studying Please pick up after yourself as a courtesy to others Please don't leave your clothes or towel in the bathroom Any shampoo without name can be used (they are inside the shower) Please take shower at night or afternoon to avoid morning traffic. Use reusable bag (provided)  Please don't take disposable plastic bags from stores Food left over must be placed inside kitchen sink for automatic disposal",
10834485,Comfy Accommodations in Queens NY (JFK - 8 Mins),9469719438,verified,Nickesha,Queens,St. Albans,40.68482,-73.76929,United States,US,True,flexible,Private room,2003,$210 ,$42 ,5,28,6/15/2019,0.81,3,5,365,Please do not smoke. Be respectful of other guests.,
10835038,"Best Location - Modern 1 BR, very quiet",18889763080,unconfirmed,Corporate Housing,Manhattan,Upper East Side,40.77148,-73.96110999999999,United States,US,True,moderate,Entire home/apt,2017,$454 ,$91 ,30,7,6/30/2019,0.21,2,91,157,,
10835590,Stylish 1 bed just a block from Prospect Park,43758401092,verified,Gabriel,Brooklyn,Prospect-Lefferts Gardens,40.662040000000005,-73.96051999999999,United States,US,False,flexible,Entire home/apt,2006,$737 ,$147 ,5,4,8/14/2016,0.11,1,2,0,"House Rules 1. Check-in is 4 pm local time. If the unit is ready earlier, we’ll let you know. Check-out is normally 11 am local time, but we’d be happy to extend it as long as we don’t have a cleaning scheduled. Just let us know.  2. All bookings require a security deposit of at least $300, which will be refunded within 7 days of your check-out. 3. For security measures we require all guests to provide proof of identification through ID verification on our own website. In order to check in we'll need a photo of your ID.  4. Our cancellation policy is as shown on our ad and defined by the site you are booking through.  5. Don’t let $300 go up in smoke. There's no smoking allowed in any Flatbook and a $300 fine for breaking this rule.  6. Unfortunately we don’t allow pets in any of our apartments. 7. Unless you’re staying in one of our specialty apartments, we don’t allow parties or excessive noise. 8. If we find the place very messy, we have to charge an extra $40 for every extra hour o",
10836142,Quiet and Sunny bedroom @Williamsburg bedford,35530061442,unconfirmed,Nicolas,Brooklyn,Williamsburg,40.715759999999996,-73.95586,United States,US,False,moderate,Private room,2020,$412 ,$82 ,2,3,8/31/2016,0.08,1,1,0,,
10836694,A Lovely One Bedroom Apartment!,12454696324,unconfirmed,Aurora,Bronx,Norwood,40.86853,-73.88301,United States,US,True,flexible,Entire home/apt,2012,$882 ,$176 ,10,7,1/7/2019,0.2,5,1,327,"- No smoking anywhere on premises, inside or outside. - No pets. - Please take off shoes in the apartment. - Please leave the house in the condition you found it in. - Please be respectful to neighbors. - Turn off A/C when away.",
10837247,Queen of Elevated Castle,86460916031,unconfirmed,Jason,Manhattan,Hell's Kitchen,40.764920000000004,-73.99128,United States,US,True,moderate,Private room,2018,$202 ,$40 ,1,119,5/22/2019,3.29,5,2,316,,
10837799,Fort Greene Studio with gardened backyard,14569000972,verified,Anthony,Brooklyn,Fort Greene,40.696259999999995,-73.97276,United States,US,True,flexible,Entire home/apt,2007,"$1,047 ",$209 ,3,5,9/5/2016,0.14,3,1,0,,
10838351,Cozy One Bedroom Apartment in Lovely Clinton Hill,27470195501,unconfirmed,Johnny,Brooklyn,Bedford-Stuyvesant,40.69297,-73.95952,United States,US,False,moderate,Entire home/apt,2003,$636 ,$127 ,7,9,8/26/2018,0.4,1,1,14,"Please treat my place as your own. Turn off the lights, AC, fan, etc when you leave the apartment, and wash any kitchenware and dishes that you've used. Put used towels on the floor, so that I now they've been used.",
10838904,Gorgeous 2 Bedroom apartment,9282883966,verified,Iveta,Queens,Forest Hills,40.72064,-73.83746,United States,US,False,strict,Entire home/apt,2020,$500 ,$100 ,365,0,,,3,1,364,,
10839456,Cozy Bedroom,54619312818,unconfirmed,Tory,Manhattan,Harlem,40.82323,-73.9467,United States,US,True,moderate,Private room,2011,"$1,177 ",$235 ,2,9,9/9/2016,0.25,4,1,0,,
10840008,Two story Park Slope home with deck and garden,44211843445,verified,Deena,Brooklyn,Park Slope,40.67922,-73.98156999999999,United States,US,True,strict,Entire home/apt,2020,$94 ,$19 ,1,0,,,3,1,0,"House Rules 1. All bookings made at least a week before check in are fully refundable if cancelled within 24 hours of booking. After this, you will receive a 50% refund if you cancel at least 7 days before the start of your trip. 2. Check-in time is any time after 4 pm local time. If the unit is ready earlier, we’ll let you know. Check-out is normally 11 am local time, but we’d be happy to extend it as long as we don’t have a cleaning scheduled. Just let us know.  3. All bookings require a security deposit of at least $300. 4. For security measures we require all guests to provide proof of identification through ID verification on our own website. In order to check in, we'll need a photo of your ID.  5. Don’t let $300 go up in smoke. There's no smoking allowed in any Flatbook and a $300 fine for breaking this rule.  6. Unfortunately we don’t allow pets in most of our apartments. 7. Unless you’re staying in one of our specialty apartments, we don’t allow parties or excessive noise. 8. I",
