10708561,Charming 1BR in Williamsburg - perfectly located,22859651981,unconfirmed,Rachad,Brooklyn,Williamsburg,40.72128,-73.95782,United States,US,False,strict,Entire home/apt,2007,$168 ,$34 ,3,0.0,,,4,1,0,"Please be courteous of our neighbors! We love them all and hope you do to! Sorry but we absolutely cannot have loud parties or excessive drinking in the house. On requesting a reservation of the apartment please extend to us a description of your visit, with whom you will be traveling, and your arrival time. Also, please make certain your picture is uploaded on to your profile. We give preference for those who have verifications. On confirmation of your booking, we will email to you the address, entry instructions, and other pertinent instructions. Airbnb will collect the entire amount at the time of your reservation confirmation including the security deposit. Our cancellation policy is strict and any cancellation outside of 30 days in advance will allow for no refund. There will be a contract exchange for this property which will include keeping noise to respectful level, general house rules, etc. These rules must be signed in order for us to accommodate you. Guests must have a credi",
10709113,Private Room in Hamilton Heights,68622362176,unconfirmed,Emma,Manhattan,Harlem,40.82421,-73.95425999999999,United States,US,False,moderate,Private room,2004,"$1,067 ",$213 ,7,1.0,8/2/2016,0.03,2,1,0,,
10709665,Beautiful two bedroom apartment in Astoria queens!,28928526053,unconfirmed,Cristy,Queens,Ditmars Steinway,40.77407,-73.90037,United States,US,False,strict,Entire home/apt,2019,$389 ,$78 ,2,11.0,5/19/2019,0.52,3,1,363,"No smoking inside the apartment. Please respect the space, and quiet hours 10pm-6am. Love pets, but we cannot allow them in the building. I do ask that you do not leave lights and/or AC unit on all day or while you are not at the apartment to save some electricity. If you use the kitchen, please tidy up after yourself by wiping down counters, putting dishes in the dishwasher, and cleaning any messes with supplies underneath the kitchen sink.",
10710218,room,96659601480,verified,Amira,Manhattan,Upper West Side,40.80079,-73.96619,United States,US,False,strict,Private room,2009,$885 ,$177 ,4,2.0,7/28/2016,0.05,1,1,53,Shoes off inside the room. No pets no friends sleep over no party please.,
10710770,Park Slope Cluehouse,44169581215,unconfirmed,Caroline,Brooklyn,Park Slope,40.669579999999996,-73.98623,United States,US,True,moderate,Entire home/apt,2020,"$1,039 ",$208 ,1,2.0,9/5/2017,0.06,5,1,88,"No pets and no smoking (including outside near the entrance, as it sometimes blows back into the building). Please remove your shoes when entering (we have sensitive floors :)). Thank you!",
10711322,"Empty 3 bedroom apartment in Bushwick, Brooklyn",23462496520,verified,Christina,Brooklyn,Bushwick,40.69477,-73.92376,United States,US,False,moderate,Entire home/apt,2014,$459 ,$92 ,5,8.0,2/28/2019,0.22,5,2,0,"1. Only the ORIGINAL OCCUPANTS at the time of booking are allowed to stay in the property overnight and secondly no additional guest will be brought in without prior authorization. 2. CHECK IN/OUT: I typically follow the standard check in and out times (4 pm, 12 pm, respectively) however we're flexible and can accommodate your needs as long as it doesn't impact another renter if you have special check-in or out times. There is a keypad lock and each renter will receive their own passcode so you can come and go as you please and not worry about keys or timing. 3. Excessive NOISE & DISTURBANCES, specifically on work nights (Sunday thru Thursday) are to be kept to a minimum after 10 pm. On other nights of the week we ask that noise is kept to a controlled, restrained and respectable level do to the nature of this being a shared space. 4. SMOKING is not permitted in any of the inside premises, this includes the guest room, condo unit and building. You may smoke outside in the street or on ",
10711875,Cozy 1 BR Apt in Brownstone Brooklyn,97561553918,unconfirmed,Ben,Brooklyn,Cobble Hill,40.68789,-73.99426,United States,US,False,strict,Entire home/apt,2016,$332 ,$66 ,5,8.0,6/29/2018,0.22,3,1,0,No pets. No smoking.,
10712427,Private Studio Apartment in Heart of Brooklyn!!,4481710288,verified,Judy,Brooklyn,Midwood,40.62465,-73.964,United States,US,True,strict,Entire home/apt,2017,$613 ,$123 ,5,57.0,6/25/2019,1.57,4,3,93,"No smoking inside the apartment, please leave shoes at the door, turn lights off when not in use. No parties.",
10712979,California King of Elevated Castle,94358133660,verified,Jason,Manhattan,Hell's Kitchen,40.76404,-73.9926,United States,US,True,flexible,Private room,2004,$951 ,$190 ,2,120.0,6/8/2019,3.3,5,2,308,,
10713532,Cozy room in Upper West Side luxury apartment,46493488565,verified,Evan,Manhattan,Upper West Side,40.79942,-73.96378,United States,US,False,moderate,Private room,2020,"$1,098 ",$220 ,1,0.0,,,2,1,0,"1. Only the ORIGINAL OCCUPANTS at the time of booking are allowed to stay in the property overnight and secondly no additional guest will be brought in without prior authorization. 2. CHECK IN/OUT: We typically follow the standard check in and out times (4 p.m., 11 p.m. respectively) however we're flexible and can accommodate your needs as long as it doesn't impact another renter if you have special check-in or out times. There is a keypad lock and each renter will receive their own passcode so you can come and go as you please and not worry about keys or timing. 3. Excessive NOISE & DISTURBANCES, specifically on work nights (Sunday thru Thursday) are to be kept to a minimum after 10 pm. On other nights of the week we ask that noise is kept to a controlled, restrained and respectable level do to the nature of this being a shared space. 4. SMOKING is not permitted in any of the inside premises, this includes the guest room, condo unit and building. You may smoke outside in the street or",
10714084,Oct in Brooklyn One Bedroom Apartment,91297527046,unconfirmed,Offer,Brooklyn,Bedford-Stuyvesant,40.69509,-73.9367,United States,US,False,moderate,Entire home/apt,2005,$199 ,$40 ,10,2.0,11/3/2016,0.06,3,1,0,,
10714636,"Cozy bedroom, convenient, Woodside, 7 train",34312829626,unconfirmed,Martha,Queens,Sunnyside,40.74582,-73.91233000000001,United States,US,False,flexible,Private room,2009,$369 ,$74 ,1,78.0,6/26/2019,2.21,5,1,218,No hosting of events,
10715188,Beautiful 2 bedroom apartment in West Harlem NYC,76557196804,verified,Mel,Manhattan,Harlem,40.82295,-73.95066,United States,US,False,strict,Entire home/apt,2008,$103 ,$21 ,5,0.0,,,2,1,0,,
10715741,Maria and Yiannis East Village studio,78613386048,unconfirmed,Ioannis,Manhattan,East Village,40.72712,-73.98705,United States,US,False,moderate,Entire home/apt,2005,$813 ,$163 ,3,18.0,6/10/2019,0.5,2,1,20,,
10716293,"Spotless, Classy, Quiet Morningside Hts. Apartment",57656355917,unconfirmed,MG & Larry,Manhattan,Morningside Heights,40.81171,-73.96351999999999,United States,US,False,moderate,Entire home/apt,2019,$789 ,$158 ,5,22.0,6/28/2019,0.61,3,1,5,,
10716845,Modern Uptown NYC Getaway,66069020693,verified,Kesina,Manhattan,Harlem,40.82636,-73.93867,United States,US,True,moderate,Entire home/apt,2014,$496 ,$99 ,2,3.0,11/27/2016,0.09,2,2,0,"Check In/ Check Out: We are flexible regarding to check in time, but please notice us ahead of time to make sure your check in goes smoothly.  We would like to be home to greet you, but often times we are away at work.  If so, we will leave you the keys for self check in.  Please refer check out time as 11AM and kindly inquire if you require a different check out time. Shoes Off: Please kindly take your shoes off at the entrance. Dog: Rosco will bark when you approach the house, but he is very friendly and he is just doing his job guarding the house.  Please kindly do not leave any food out or leave them in your room and close the door while staying, since Rosco has excellent nose and skill to get to food/garbage.  Smoking: There is strictly no smoking in or outside of the house.  Bring Home guests: Please inform us ahead of time if you would like to bring friends to the house.  Kitchen Use: Please keep kitchen use to prepare snacks or coffee/tea.  Please only use the stove when we are",
10717398,Sunny room in modern building located in Bedstuy,25557311778,verified,David,Brooklyn,Bedford-Stuyvesant,40.69181,-73.94312,United States,US,False,strict,Private room,2022,$430 ,$86 ,5,3.0,10/17/2016,0.08,2,1,0,"We are flexible & accommodating, but just expect guests to be respectful to us and our neighbors  - particularly during late hours.",
10717950,Private elevator contemporary minimalist Brooklyn,28997818001,verified,Summer,Brooklyn,Prospect-Lefferts Gardens,40.65761,-73.94646,United States,US,True,strict,Entire home/apt,2008,$561 ,$112 ,1,4.0,1/1/2017,0.11,1,2,0,"Respect and treat the property as there own. No smoking inside and sorry, as much as we love them, no pets. A guest information sheet will be provided upon check in which includes emergency contact information. Guests assume all liability and hold host harmless for any and all liability from accidents, property damage and other calamities that may arise during guests' stay.",
10718502,Spacious room in historic part of Manhattan,85210479446,unconfirmed,Helen,Manhattan,Harlem,40.829840000000004,-73.94226,United States,US,False,moderate,Private room,2011,$205 ,$41 ,2,57.0,7/4/2019,1.57,5,1,287,Must be clean and respectful. if you come back late must be quiet if roommates are sleeping. Have fun! ages ~20-35 only!,
10719055,Stunning Brooklyn Townhouse,56954674804,verified,Andrew,Brooklyn,Park Slope,40.67198,-73.98278,United States,US,True,moderate,Entire home/apt,2011,$304 ,$61 ,5,1.0,7/13/2016,0.03,5,1,0,"Please respect our space and our neighbors by not smoking or being loud. No parties. Please leave the apartment as you found it. Unfortunately, pets are not allowed!",
10719607,The Parachute Loft Bedrm 2,34988456934,unconfirmed,Anna,Brooklyn,Coney Island,40.57476,-74.00101,United States,US,False,flexible,Private room,2015,$88 ,$18 ,1,41.0,6/16/2019,1.33,1,2,158,,
10720159,Large Bedroom Brooklyn,96348789029,unconfirmed,Chaima,Brooklyn,Bedford-Stuyvesant,40.68014,-73.94513,United States,US,False,flexible,Private room,2012,$468 ,$94 ,1,1.0,8/30/2016,0.03,5,1,0,No pets. No smoking.,
10720711,LEGO Garden 1BR Apt +Patio near JFK & LGA Airports,85670783869,verified,Kazumi,Queens,Briarwood,40.71409,-73.82382,United States,US,True,strict,Private room,2021,$232 ,$46 ,4,72.0,6/30/2019,2.11,5,1,282,"Shoes off in the house, no smoking.",
10721264,"Private Bedroom in Upper Manhattan/ Harlem, NYC!",17614331729,verified,Jeanine,Manhattan,Harlem,40.80742,-73.95214,United States,US,False,strict,Private room,2014,$171 ,$34 ,4,1.0,9/18/2018,0.1,1,3,0,,
10721816,New Upper East Side Studio,23408198892,verified,Emilie,Manhattan,Upper East Side,40.77758,-73.94641999999999,United States,US,True,moderate,Entire home/apt,2012,$143 ,$29 ,4,5.0,12/22/2016,0.15,1,1,0,,
10722368,Charming WV 1BR on Historic Street,91012345820,verified,Fawn,Manhattan,West Village,40.73511,-74.0037,United States,US,False,flexible,Entire home/apt,2018,$542 ,$108 ,3,29.0,6/17/2019,0.84,3,1,349,,
10722921,Convienent Entire Upper Manhattan Apartment,53320883776,verified,Terry,Manhattan,Washington Heights,40.83484,-73.94009,United States,US,True,moderate,Entire home/apt,2014,$184 ,$37 ,4,3.0,10/3/2018,0.09,1,1,0,,
10723473,Top location 1BR 5mins to Manhattan,84086591720,verified,Dimitar,Queens,Long Island City,40.744659999999996,-73.95274,United States,US,True,strict,Entire home/apt,2020,$126 ,$25 ,7,0.0,,,4,1,0,,
10724025,1 Bedroom in williamsburg,36076200633,unconfirmed,Geoffray,Brooklyn,Williamsburg,40.70912,-73.94107,United States,US,True,flexible,Entire home/apt,2022,$864 ,$173 ,7,0.0,,,1,1,0,"Feel free to wear house slippers to keep the place feeling fresh and cozy. No frying fish (or preparing other foods with strong odors). Absolutely No Smoking inside the house (OK on the back porch, only).",
10724578,Apartment near Central Park,5313087393,verified,Oleg,Manhattan,Harlem,40.80227,-73.95571,United States,US,False,flexible,Entire home/apt,2018,$862 ,$172 ,3,34.0,4/8/2019,0.96,5,1,0,No pets and no smoking. Please remove your shoes when entering. We have very sensitive floors and would like to keep them looking new ;),
10725130,44 floor apt in luxury building near Central Park,61080460560,unconfirmed,Ella,Manhattan,Theater District,40.76324,-73.98459,United States,US,False,strict,Entire home/apt,2009,$486 ,$97 ,10,1.0,8/4/2016,0.03,4,1,0,,
10725682,Spacious and Comfy one large bedroom in Upper East,48949672257,verified,Deepti,Manhattan,Upper East Side,40.76927,-73.949,United States,US,True,strict,Entire home/apt,2011,$198 ,$40 ,7,25.0,6/29/2019,0.92,1,1,0,"No pets and no smoking (including outside near the entrance, as it sometimes blows back into the building). Please remove your shoes when entering (we have sensitive floors :)). Thank you!",
10726234,Harlem Vibrant Garden Apartment,52098531212,verified,Frédérique,Manhattan,Harlem,40.81106,-73.94467,United States,US,True,flexible,Entire home/apt,2006,$601 ,$120 ,3,48.0,6/19/2019,1.4,3,1,53,,
10726787,Bright Room In Spacious Bright Apartment,61215738991,unconfirmed,Michael,Manhattan,Harlem,40.82508,-73.93884,United States,US,False,moderate,Private room,2017,$484 ,$97 ,1,14.0,10/14/2016,0.38,1,1,0,,
10727339,"Cute 1 br, steps to train, BUSHWICK",82946117181,verified,Jennie,Brooklyn,Bushwick,40.69997,-73.92083000000001,United States,US,False,moderate,Entire home/apt,2008,"$1,084 ",$217 ,2,30.0,10/3/2018,0.84,5,1,291,,
10727891,Spacious 2br Fort Greene apartment with yard!,6047917422,unconfirmed,Nellie,Brooklyn,Fort Greene,40.69153,-73.97078,United States,US,False,moderate,Entire home/apt,2018,$844 ,$169 ,7,2.0,8/22/2016,0.06,5,1,0,"No pets and no smoking (including outside near the entrance, as it sometimes blows back into the building). Please remove your shoes when entering (we have sensitive floors :)). Thank you!",
10728444,"Gorgeous, spacious and naturally lit 3BR!",58825267565,unconfirmed,Hadar,Manhattan,Morningside Heights,40.80595,-73.95812,United States,US,True,flexible,Entire home/apt,2010,$270 ,$54 ,4,0.0,,,2,1,0,"No loud parties, no extra guests, no pets, no smoking. Please treat this space with respect, especially as we have put so much care and love into designing it!",
10728996,Spacious One Bedroom Steps From Prospect Park,62782834998,verified,Amy,Brooklyn,Windsor Terrace,40.650240000000004,-73.9737,United States,US,True,flexible,Entire home/apt,2015,$851 ,$170 ,2,1.0,9/22/2016,0.03,2,1,0,,
10729548,Private room in the WV 3rd floor,33537909654,verified,Art,Manhattan,West Village,40.73557,-74.00448,United States,US,False,strict,Private room,2015,$244 ,$49 ,2,58.0,7/2/2019,1.62,3,1,190,"• Check-in time is 2PM. NO SMOKING, DRUGS, PETS or SHOES in the house! I love my home and like to keep it clean. No food or drink on the couch to avoid spills. Please treat it with care and tidy up after yourselves. Thank you!",
10730101,Cute Studio in the heart of East Village,28730100026,verified,Shivani,Manhattan,East Village,40.72783,-73.98904,United States,US,True,flexible,Entire home/apt,2004,$960 ,$192 ,3,5.0,4/16/2017,0.14,5,1,0,,
10730653,Newly Furnished West Village Studio,87078398022,verified,Raanan,Manhattan,West Village,40.732009999999995,-74.0032,United States,US,False,moderate,Entire home/apt,2005,"$1,008 ",$202 ,30,0.0,,,2,9,15,"No pets and no smoking (including outside near the entrance, as it sometimes blows back into the building). Please remove your shoes when entering (we have sensitive floors :)). Thank you!",
10731205,Beautiful Room/20 min downtown NYC,12801242657,verified,Rob,Manhattan,Inwood,40.868359999999996,-73.92827,United States,US,True,strict,Private room,2015,$116 ,$23 ,4,38.0,6/9/2019,1.04,5,1,149,- I've lived here over 14  years.  Love it!  But I met a girl and moved to the burbs. You will enjoy everything about location and amenities!,
10731757,Renovated East Village 1BR,87904919358,verified,Raanan,Manhattan,East Village,40.729,-73.98098,United States,US,True,flexible,Entire home/apt,2011,$607 ,$121 ,30,6.0,2/8/2019,0.24,1,9,150,"-Leave the apartment as you found it.  -Quiet time starts at 9pm. -Wearing shoes is okay, unless its raining or snowing. -Please respect us and our neighbors by not having any additional guests.  -Smoking is strictly prohibited. -No pets. -No packages may be sent to the house without host approval.",
10732310,Quaint Garden Apartment/ Historic Hamilton Heights,49692857832,verified,Jimmy,Manhattan,Harlem,40.828520000000005,-73.94583,United States,US,True,moderate,Entire home/apt,2014,$528 ,$106 ,7,9.0,4/28/2019,0.25,3,1,27,,
10732862,Large Two Story Loft in the Heart of West Village,45207580947,verified,Yasir,Manhattan,West Village,40.73103,-74.00905999999999,United States,US,True,flexible,Entire home/apt,2004,"$1,127 ",$225 ,3,1.0,7/18/2016,0.03,4,1,0,"We are seeking responsible and respectful guests for our unique property. Please do not smoke in the apartment, and refrain from loud noise after 11pm. Accommodations can be made for other lengths of stay, as well as for pets. Feel free to reach out with questions or concerns and we will respond within 24hrs, usually sooner. Strict cancellation policies apply, please refer to Airbnb's terms.",
10733414,Near Manhattan & ForestHStadium studio w/ pvt bath,81914256013,verified,Julia,Queens,Forest Hills,40.71249,-73.84942,United States,US,False,flexible,Private room,2021,$146 ,$29 ,1,31.0,9/24/2018,0.9,5,2,1,,
10733967,Cozy Room In the Heart of Astoria,17832049401,verified,Adrian,Queens,Astoria,40.76249,-73.91176,United States,US,False,strict,Private room,2009,$863 ,$173 ,2,56.0,10/1/2017,1.57,2,1,0,,
10734519,Spacious Bushwick Room w/ Private Entrance & Bath,28775747590,unconfirmed,Angelika,Brooklyn,Bushwick,40.69715,-73.93166,United States,US,False,strict,Entire home/apt,2015,$483 ,$97 ,2,117.0,6/23/2019,3.22,2,1,51,,
10735071,Large Bedroom for $750 Monthly,57496537188,verified,Nataly,Brooklyn,Bedford-Stuyvesant,40.68057,-73.94508,United States,US,True,moderate,Private room,2005,$252 ,$50 ,1,0.0,,,3,1,365,,
10735624,Private Entrance Basement Studio,57381395319,unconfirmed,Samantha,Brooklyn,Williamsburg,40.71992,-73.96069,United States,US,False,strict,Entire home/apt,2011,$431 ,$86 ,1,0.0,,,3,1,0,,
10736176,Sunny and cozy Stuy Heights 1BR,49678225682,verified,Christina,Brooklyn,Bedford-Stuyvesant,40.68278,-73.93427,United States,US,False,flexible,Entire home/apt,2011,$833 ,$167 ,2,2.0,9/25/2016,0.06,4,1,0,,
10736728,Spacious 1 BD in Williamsburg next to L train,52187801053,unconfirmed,Jesse,Brooklyn,Williamsburg,40.712559999999996,-73.94505,United States,US,False,moderate,Entire home/apt,2014,$454 ,$91 ,1,3.0,9/18/2016,0.09,3,1,0,"Thank you for your reservation. By placing your reservation online you indicated that you accepted the terms and conditions which have been printed below.  Please review your reservation summary as below - then print, sign and return the agreement to:  (EMAIL HIDDEN) or fax it to (PHONE NUMBER HIDDEN) or  mail it to: Spare Suite, Inc., 119 Braintree Street, Suite 510, Boston, MA 02134, USA Upon receipt, we will send you the welcome document with check in instructions and how to get your keys. ------------------------------------------------------------------------ ------------------------------------------------------------------------ Terms of the Agreement: BOOKING AND REFUND POLICY Once booked your reservation is guaranteed for the check in and check out times and dates specified. All reservations must be paid in advance, in full for the entire period of stay.  All reservations are final, and NON REFUNDABLE UNDER ANY CIRCUMSTANCES.  If you feel you may need to cancel once booked, yo",
10737280,1 bedroom for rent in quiet apartment (2bedrooms),20167350710,unconfirmed,Clementine,Manhattan,East Village,40.72976,-73.98801999999999,United States,US,False,flexible,Private room,2020,"$1,167 ",$233 ,6,0.0,,,1,1,0,,
10737833,Completely Renovated Prewar Apartment in HOT Area,10905884561,unconfirmed,Lindsay,Queens,Astoria,40.75816,-73.91945,United States,US,False,moderate,Entire home/apt,2010,$406 ,$81 ,5,0.0,,,1,1,0,,
10738385,"Live, Love, Stay in the Bronx!",84146132005,verified,Vernise,Bronx,Allerton,40.860659999999996,-73.85414,United States,US,True,flexible,Private room,2012,"$1,195 ",$239 ,1,8.0,11/12/2018,0.23,1,1,280,#NAME?,
10738937,Spacious Artist's Loft/Apartment,34914363110,verified,Stephanie,Manhattan,Financial District,40.71069,-74.00751,United States,US,False,flexible,Entire home/apt,2005,$215 ,$43 ,3,6.0,10/14/2016,0.16,2,1,0,,
10739490,Comfy Room in Amazing East Village Apt,23322451299,verified,Casey,Manhattan,East Village,40.72309,-73.98428,United States,US,False,strict,Private room,2010,"$1,086 ",$217 ,1,2.0,11/6/2016,0.05,5,2,188,"- Please keep the house exactly like you found it. Please don't leave a mess. Please don't leave things dirty. - If you use the bathroom, clean or wipe things down (there will be a cloth to wipe off excess water, etc.) - If you use the kitchen, please clean dishes and wipe things down as well - No guest allowed - you can meet friends at other venues - Shoes off in the apartment - please leave by the door. If you would like please bring some slippers. - Please keep things quiet after 10pm - If you smoke, you must go outside! NO smoking inside! - If you cook, turn the fan on above the stove - If you watch TV, turn it off when you are done. - Please use your common sense, and if you are not sure, ask... - Remember, this is my house - so try to treat it with respect. - if the parking pass is not returned, you will be charged the full amount of the deposit",
10740042,Spacious & Quiet Bedroom w/ Private Bathroom,89308701627,verified,Ryan,Brooklyn,Greenpoint,40.7317,-73.95473,United States,US,True,strict,Private room,2018,$703 ,$141 ,2,8.0,11/16/2016,0.23,1,1,0,,
10740594,Your home away from home...,498588102,verified,Donald,Bronx,Wakefield,40.8947,-73.85601,United States,US,True,moderate,Private room,2016,$765 ,$153 ,3,63.0,9/21/2018,1.78,1,1,0,Please leave the room as it was when you first came.,
10741147,Vintage Artist Loft-Studio on Upper West Side,37660138666,verified,Waybridge,Manhattan,Upper West Side,40.780229999999996,-73.97884,United States,US,False,moderate,Entire home/apt,2016,$690 ,$138 ,5,28.0,7/1/2019,0.8,3,1,24,"No smoking or drugs. We try to keep the house clean, so we take off our shoes when we come in. We all work or go to grad school, so we like to keep the house clean and quiet. Absolutely no smokers, even if you smoke outside. We'd rather not have anyone in the house who brings back in the smell of smoke.",
10741699,Convenient Gem in Midtown East,4198122541,unconfirmed,Arthur,Manhattan,Midtown,40.7542,-73.96862,United States,US,True,flexible,Private room,2007,$347 ,$69 ,12,0.0,,,4,1,70,Can use kitchen and either bathroom. Roommates will be at the house as well but will not be using the living during your stay. No guests permitted without prior notice and agreement. No shoes in the house and please wash all dishes promptly after use.,
10742251,Summer Weekend in the City,90265701456,verified,Julie,Manhattan,Midtown,40.75248,-73.97332,United States,US,True,moderate,Private room,2021,$572 ,$114 ,2,0.0,,,1,1,0,"Professionally and to respect the artwork. This is an apartment for mature travelers, not backpackers.",
10742803,Sanctuary steps from the heart of downtown,51132526107,unconfirmed,B,Manhattan,East Village,40.72394,-73.98872,United States,US,True,strict,Entire home/apt,2009,$536 ,$107 ,2,3.0,12/9/2017,0.08,3,1,0,"Guest should do there dishes and clean after themselves. No alcohol, No drugs, No party's and most important Don't Disturb other guests!",
10743356,Light filled private bedroom in Bed Stuy's best.,12373734513,unconfirmed,Scott,Brooklyn,Bedford-Stuyvesant,40.686370000000004,-73.94476999999999,United States,US,False,strict,Private room,2010,$126 ,$25 ,2,6.0,12/14/2016,0.17,4,1,0,Treat the apt as you would your own. No parties or large gatherings.,
10743908,Light-Filled Williamsburg Loft,28136293349,verified,Benjamin,Brooklyn,Williamsburg,40.71725,-73.95541,United States,US,True,strict,Private room,2020,"$1,079 ",$216 ,4,3.0,12/11/2016,0.09,4,1,0,Please do not smoke and be respectful of other guests.,
10744460,"Comfort First, in Williamsburg",35784600784,unconfirmed,Irma,Brooklyn,Williamsburg,40.7099,-73.95779,United States,US,True,moderate,Entire home/apt,2017,$522 ,$104 ,2,14.0,12/15/2016,0.39,1,1,0,,
10745013,FEMALE ONLY,63053165090,verified,Luqian,Brooklyn,Sunset Park,40.64025,-74.01735,United States,US,True,flexible,Private room,2009,$995 ,$199 ,4,2.0,8/10/2016,0.06,5,1,0,"Guest should do there dishes and clean after themselves. No alcohol, No drugs, No party's and most important Don't Disturb other guests!",
10745565,Penthouse in Midtown Manhattan,85477103208,verified,Carol,Manhattan,Midtown,40.76518,-73.98210999999999,United States,US,False,strict,Private room,2015,$925 ,$185 ,3,0.0,,,3,1,0,"Please expect to share the apartment with guests having various backgrounds. Be respectful and decent, also enjoy interacting with each other. Please dress descently in the house especially in and out of the shower.",
10746117,Huge Room in Doorman Building,3582437008,verified,Joshua,Manhattan,Upper West Side,40.79564,-73.97173000000001,United States,US,True,flexible,Private room,2015,$783 ,$157 ,50,3.0,1/1/2019,0.09,3,1,201,,
