16358590,30+Day Stay: Designer Home with Skylight & Rooftop,92189307965,verified,Ali,Queens,Flushing,40.75759,-73.80815,United States,US,True,flexible,Entire home/apt,2017,"$1,181 ",$236 ,5,50,6/7/2019,2.63,4,7,178.0,,
16359142,Private Bedroom with Private Entrance in Brooklyn.,92098988393,unconfirmed,Nelima,Brooklyn,Bushwick,40.70247,-73.91793,United States,US,False,flexible,Private room,2022,$852 ,$170 ,4,16,6/30/2019,0.83,2,1,,"In order to provide a  healthy, comfortable and safe environment the following rules must be respected and adhered to throughout your entire stay. Most of what follows is common sense or common courtesy. The rules serve to protect you as a guest by helping ensure the environment you find here is the one that we intended to create. Please keep in mind:  You will be sharing common areas with other guests or residents, and thus the cleanliness of the common areas is far more dependent upon all guests cleaning up after themselves, than it is upon my once a week cleaning. Most guests do very well in keeping common areas clean! House rules: Please do not drag luggage up the front stairs. Please leave things as they are in your room: do not remove pictures from walls, don't move furniture around, and do not remove mattress protector from the mattress. Also, it should not be necessary to say, but since some guests have done this, I must add: please do not take any of my personal possessions ou",
16359694,Modern Room in the heart of Manhattan(just female),8677145411,unconfirmed,Sandra,Manhattan,Theater District,40.760690000000004,-73.9863,United States,US,False,moderate,Private room,2012,$514 ,$103 ,3,46,6/20/2019,2.49,3,3,,Respectful attitude would be asked. Respect would be returned!,
16360247,"Great Home & Host, next to #1 train",70169405876,unconfirmed,Dee,Manhattan,Harlem,40.82347,-73.95228,United States,US,False,strict,Private room,2016,"$1,052 ",$210 ,14,13,5/19/2019,0.69,3,4,,,
16360799,First Class Suite in Central Manhattan,24256854973,unconfirmed,Sarah,Manhattan,Midtown,40.76398,-73.98034,United States,US,True,moderate,Private room,2017,$253 ,$51 ,1,0,,,4,1,,"In order to provide a  healthy, comfortable and safe environment, the following are the rules of my house. It is your responsibility to not only read these rules once, but to be aware of and follow all of them throughout your stay at my home. Most of what follows is common sense or common courtesy. The rules serve to protect you as a guest by helping ensure that the environment you find here is the one that I intended to create. Please keep in mind:  You will be sharing common areas with other guests or residents, and thus the cleanliness of the common areas is far more dependent upon all guests cleaning up after themselves, than it is upon my once a week cleaning. Most guests do very well in keeping common areas clean! House rules: Please do not drag luggage up the front stairs. Please leave things as they are in your room: do not remove pictures from walls, don't move furniture around, and do not remove mattress protector from the mattress. Also, it should not be necessary to say, bu",
16361351,The garden apartment,210699738,verified,Samuel,Brooklyn,East New York,40.662040000000005,-73.88946,United States,US,True,moderate,Entire home/apt,2015,$686 ,$137 ,2,54,6/25/2019,2.84,2,2,,No Smoking  No unregistered guest No pets  When it rain or snow please remove shoes at the door,
16361904,Luxury room at Hudson Yards,9353591758,unconfirmed,Jamal,Manhattan,Hell's Kitchen,40.75605,-73.99797,United States,US,True,strict,Private room,2022,$649 ,$130 ,1,0,,,2,1,,"Enjoy our home and please leave it clean & tidy like you found it :) Thank you for not smoking. Sorry, no pets even though we love them. We have nice respectful neighbors so no loud music or parties.  Hanging out & music are fine just keep others in mind :) Thank you!",
16362456,Комната. Место в комнате,96136932607,unconfirmed,Ivan,Brooklyn,Sheepshead Bay,40.58612,-73.95014,United States,US,True,strict,Private room,2021,$626 ,$125 ,30,0,,,5,3,,"No Smoking, no pets, no parties and anyone coming to visit would need to be known beforehand. Along with any issue of the other amenities of the house other than the room you will be renting.",
16363008,ELEGANT BROOKLYN GARDEN STUDIO,53469968265,unconfirmed,Marlene,Brooklyn,East Flatbush,40.63794,-73.93125,United States,US,True,moderate,Entire home/apt,2016,$405 ,$81 ,2,46,7/2/2019,2.34,3,1,,"House Rules This is a Non-Smoking, pet free home; and  our guests must use the outdoors if they wish to smoke.  Additionally, I love my home and my neighbors are great, so I also ask our guests to be respectful of both and treat my home as well as their own.  Enjoy your stay while here in Boston -  a great city!!",
16363561,1 Bedroom close to Prospect Park and Manhattan,64323050901,unconfirmed,Victor,Brooklyn,Flatbush,40.64124,-73.9688,United States,US,True,moderate,Entire home/apt,2003,$449 ,$90 ,1,45,6/16/2019,2.31,5,1,,,
16364113,Huge private bedroom one block from the train! :),33635206512,verified,G,Brooklyn,Bedford-Stuyvesant,40.695679999999996,-73.93831,United States,US,True,strict,Private room,2006,$669 ,$134 ,1,0,,,5,2,,,
16364665,"Spacious, luxury aparment in heart of NYC!",70635278016,verified,Maxwell,Manhattan,East Village,40.72428,-73.97957,United States,US,False,flexible,Entire home/apt,2021,$732 ,$146 ,4,1,12/26/2017,0.05,4,1,,#NAME?,
16365217,"Loft For Events, Meetings & Content Creation",67934658456,verified,Jack,Manhattan,Midtown,40.7513,-73.98333000000001,United States,US,False,strict,Entire home/apt,2017,$605 ,$121 ,1,20,6/14/2019,1.09,2,1,,"Available Upon Arrival - Looking for nice, neat, non smoking, responsible, and independent person(s).",
16365770,Cool and Cozy East Village Studio - Best Location,39643125726,verified,Emma,Manhattan,East Village,40.72456,-73.98764,United States,US,False,strict,Entire home/apt,2016,$756 ,$151 ,5,3,1/2/2018,0.16,3,1,,Available Upon Arrival,
16366322,Private Cozy Studio Suite,71223109359,unconfirmed,Janice,Bronx,Pelham Gardens,40.86264,-73.84854,United States,US,True,strict,Entire home/apt,2022,"$1,099 ",$220 ,2,61,6/25/2019,3.22,4,1,,Have fun and be respectful of  others Pets are allowed after discussion as long as they are well trained and picked up after.,
16366874,East Village - Spacious & Colorful,41257716402,verified,Kevin,Manhattan,East Village,40.72929,-73.98625,United States,US,True,strict,Entire home/apt,2016,$262 ,$52 ,2,7,12/30/2018,0.36,3,1,,"No smoking, no pets. Use of kitchen is limited to breakfast with a continental breakfast provided and use of coffee maker, toaster and hot water.. We cannot allow cooking.  You may store drinks and snacks in the refrigerator.",
16367427,Large 3BR/2BA Designers Apt in the Gallery Area,76823580833,unconfirmed,Umar,Manhattan,Chinatown,40.715720000000005,-73.99114,United States,US,True,flexible,Entire home/apt,2003,$324 ,$65 ,2,80,7/6/2019,4.01,2,1,,"No smoking or drug use.  No parties.  No guests other than those specified in your booking. No moving of furniture without asking Turn lights off when not in use No food in rooms, food can be stored in kitchen area Front door stays unlocked until 9pm, after ring doorbell or call host ((PHONE NUMBER HIDDEN) or (PHONE NUMBER HIDDEN)) Kitchen is not for use Check-out time no later than 11am Host's food is off limits only what is serve and put out for breakfast!",
16367979,New Brooklyn apartment with a view,27823993667,verified,Rasmus,Brooklyn,Bedford-Stuyvesant,40.69001,-73.95136,United States,US,True,moderate,Private room,2006,$941 ,$188 ,3,2,4/18/2019,0.11,4,3,,"No smoking or drug use.  No parties.  No guests other than those specified in your booking. No moving of furniture without asking Turn lights off when not in use No food in rooms, food can be stored in kitchen area Front door stays unlocked until 9pm, after ring doorbell or call host ((PHONE NUMBER HIDDEN) or (PHONE NUMBER HIDDEN)) Kitchen not for use Check-out time no later than 11am Host's food is off limits only what is serve and put out for breakfast!",
16368531,Cozy room for 1-4 guests in the heart of NYC,21149159119,verified,Josephine,Manhattan,Hell's Kitchen,40.761509999999994,-73.98816,United States,US,True,strict,Private room,2004,$79 ,$16 ,4,1,12/12/2017,0.05,4,1,,"No smoking or drug use.  No parties.  No drinking of alcohol in room""p No guests other than those specified in your booking. No moving of furniture without asking Turn lights off when not in use No food in rooms, food can be stored in kitchen area Kitchen not in use Check-out time no later than 11am Host's food is off limits only what is serve and put out for breakfast!",
16369084,Light bedroom with Manhatten skyline view,26812515093,unconfirmed,Rasmus,Brooklyn,Bedford-Stuyvesant,40.69102,-73.95132,United States,US,True,flexible,Private room,2007,$921 ,$184 ,3,3,9/30/2018,0.16,4,3,,,
16369636,East Village · Pied Á Terre · NYC,30361307217,verified,Tim And Reuben,Manhattan,East Village,40.722559999999994,-73.97925,United States,US,False,moderate,Entire home/apt,2012,$61 ,$12 ,30,11,6/28/2018,0.61,2,1,,,
16370188,"Private Room in Sunny, Spacious 3 Bdrm Apartment",60467671200,verified,Helen,Brooklyn,Crown Heights,40.67517,-73.9564,United States,US,False,flexible,Private room,2005,"$1,166 ",$233 ,3,4,9/30/2018,0.22,4,1,302.0,,
16370740,Cute and convenient WB apartment,58974174030,unconfirmed,Thomas,Brooklyn,Williamsburg,40.70966,-73.95666999999999,United States,US,False,moderate,Private room,2014,$310 ,$62 ,2,41,10/29/2018,2.11,2,2,0.0,,
16371293,Large One Bedroom  in Inwood.,68999694333,unconfirmed,Katelynn,Manhattan,Inwood,40.867940000000004,-73.91629,United States,US,False,moderate,Entire home/apt,2015,$764 ,$153 ,1,4,10/7/2018,0.2,3,1,3.0,,
16371845,Stunning East Village 1 b/r w.elevator & laundry,47793115226,verified,Emma,Manhattan,East Village,40.729409999999994,-73.97916,United States,US,True,strict,Entire home/apt,2010,"$1,023 ",$205 ,28,2,5/1/2019,0.65,2,1,78.0,Please no smoking or drugs. No parties.,
16372397,Live/Work East Williamsburg Loft,80686517549,verified,Bryan,Brooklyn,Williamsburg,40.70592,-73.93513,United States,US,True,strict,Entire home/apt,2019,$855 ,$171 ,2,7,2/3/2019,0.37,5,1,0.0,Please be respectful and courteous of other house guests.   Please keep all common areas clean after each use i.e. kitchen and bathroom. No smoking  No pets No parties No back yard access,
16372950,Cozy Affordable room in Brooklyn,98337306255,unconfirmed,Diego,Brooklyn,Bedford-Stuyvesant,40.6786,-73.9255,United States,US,True,flexible,Private room,2017,$791 ,$158 ,1,13,6/30/2019,0.65,5,1,184.0,Absolutely NO smoking NOR use of drugs.  And NO shoes in the house! You will be requested to take off your shoes at the entrance.   Please Bring a positive attitude and fun spirit!,
16373502,Private Master BedRoom with Private bath in NYC,48614134705,verified,Hamza,Manhattan,Hell's Kitchen,40.76617,-73.9883,United States,US,False,moderate,Private room,2006,$110 ,$22 ,1,3,11/26/2017,0.15,2,1,0.0,,
16374054,Spacious 2 bedroom in beautiful Clinton Hill,28686651720,unconfirmed,Yarden,Brooklyn,Clinton Hill,40.688590000000005,-73.96035,United States,US,True,flexible,Entire home/apt,2017,$589 ,$118 ,3,2,5/11/2018,0.13,4,1,0.0,"We don't allow smoking, drug use, excessive parties, or loud music out of respect for our neighbors.  Please treat our home like your own! ",
16374607,Big Sunny Room in Bedstuy/Clinton Hill Brownstone,47732234594,unconfirmed,Julia,Brooklyn,Bedford-Stuyvesant,40.69065,-73.95469,United States,US,True,flexible,Private room,2007,$80 ,$16 ,1,5,3/8/2018,0.25,3,1,0.0,#NAME?,
16375159,Cosy and Bright Apartment in Downtown Brooklyn,35594152816,unconfirmed,Evie,Brooklyn,Bedford-Stuyvesant,40.691790000000005,-73.95915,United States,US,True,flexible,Entire home/apt,2017,$835 ,$167 ,1,0,,,2,1,0.0,"Quiet hours are 10 PM to 6 AM.  No smoking, even outside.  No pets.  We already have one.",
16375711,Large & bright apartment in the West Village,42844751569,unconfirmed,Elliot,Manhattan,West Village,40.73522,-73.99983,United States,US,True,strict,Entire home/apt,2004,$787 ,$157 ,2,19,9/6/2018,1.03,2,1,0.0,,
16376263,Cozy Private Room in Upper Manhattan,41326341833,verified,Stephanie,Manhattan,East Harlem,40.79741,-73.93493000000001,United States,US,False,flexible,Private room,2006,$932 ,$186 ,1,3,9/19/2018,0.22,5,2,179.0,"No smoking or drug use.  No parties.  No guests other than those specified in your booking. No moving of furniture without asking Turn lights off when not in use No food in rooms, food can be stored in kitchen area Front door stays unlocked until 9pm, after ring doorbell or call host (phone number hidden) or (phone number hidden)) Kitchen not for use Check-out time no later than 11am Host's food is off limits only what is serve and put out for breakfast!",
16376816,Newly Renovated Brooklyn Apartment,33342493071,unconfirmed,Victoria,Brooklyn,Crown Heights,40.67372,-73.91648,United States,US,False,flexible,Entire home/apt,2004,$114 ,$23 ,2,12,12/28/2018,0.61,2,1,0.0,"Please be respectful, Thank you !",
16377368,Spacious & Airy Loft Apartment in Williamsburg,69060321063,unconfirmed,Hilary,Brooklyn,Williamsburg,40.715759999999996,-73.94088,United States,US,True,flexible,Entire home/apt,2014,$915 ,$183 ,2,0,,,4,1,35.0,"Please be respectful, Thank you !",
16377920,Quiet top floor studio,44660085983,verified,Evan,Manhattan,Upper East Side,40.76951,-73.96191999999999,United States,US,False,moderate,Entire home/apt,2010,$243 ,$49 ,2,14,5/28/2018,0.71,2,1,0.0,,
16378473,LA COURONNE - Sophisticated Spacious 3 BDRM 2 BTHS,67012593492,verified,Daphne & Jonathan,Brooklyn,Crown Heights,40.66505,-73.93875,United States,US,False,flexible,Entire home/apt,2017,$330 ,$66 ,2,78,6/11/2019,4.06,4,1,325.0,,
16379025,Enjoy Harlem,49975025336,unconfirmed,Adrianne,Manhattan,Harlem,40.81029,-73.94344,United States,US,False,strict,Entire home/apt,2013,"$1,160 ",$232 ,3,1,12/14/2017,0.05,4,1,0.0,,
16379577,阳光之家,16362492062,unconfirmed,Michelle,Queens,Flushing,40.75997,-73.81286999999999,United States,US,True,moderate,Private room,2020,$690 ,$138 ,4,14,6/14/2019,0.72,4,2,171.0,No Smoking No Pets,
16380130,Modern 1 BR Hell's Kitchen condo with courtyard,38567847132,unconfirmed,Alexander,Manhattan,Hell's Kitchen,40.761720000000004,-73.99428,United States,US,False,moderate,Entire home/apt,2019,$838 ,$168 ,3,3,12/1/2018,0.16,5,1,0.0,,
16380682,"Sunny,  spacious 2 bdrm in Park Slope w/ parking",76330525082,unconfirmed,Bert,Brooklyn,Park Slope,40.6789,-73.97909,United States,US,True,strict,Entire home/apt,2006,$706 ,$141 ,4,2,7/5/2019,0.11,4,1,0.0,,
16381234,Bright + Cozy room in Chinatown FOODIE Paradise!,87945709694,verified,Darra,Manhattan,Lower East Side,40.71235,-73.99070999999999,United States,US,False,flexible,Private room,2018,$657 ,$131 ,21,0,,,4,1,332.0,"respecfull, consideret.and loving",
16381786,THE HUGH SUITES 3mins to JFK,27693161424,unconfirmed,Hugh,Queens,Springfield Gardens,40.66578,-73.77301,United States,US,False,moderate,Entire home/apt,2011,$116 ,$23 ,1,214,6/23/2019,10.86,3,1,307.0,,
16382339,*AWESOME PLACE*2 MIN SUBWAY!,31738080319,verified,JoaoLinda,Brooklyn,Bushwick,40.68235,-73.90381,United States,US,False,strict,Private room,2018,$445 ,$89 ,2,58,6/30/2019,3.04,5,1,349.0,,
16382891,Central Park apt 7/10-7/18 nyc summer July,23755345956,unconfirmed,Rachel,Manhattan,Upper West Side,40.79401,-73.9639,United States,US,True,strict,Entire home/apt,2010,$426 ,$85 ,7,1,7/17/2018,0.08,5,1,0.0,,
16383443,Quiet and cozy in Queens and close JFK Airport,74834202122,verified,Rudy,Queens,Howard Beach,40.66802,-73.84803000000001,United States,US,False,flexible,Private room,2018,$950 ,$190 ,2,0,,,4,1,363.0,I would appreciate quest to show respect to the house,
16383996,SUNNY BROOKLYN VIBES,13384186339,unconfirmed,Dániel,Brooklyn,Williamsburg,40.70358,-73.93698,United States,US,False,moderate,Entire home/apt,2019,$823 ,$165 ,4,2,2/13/2018,0.11,4,1,0.0,"- - NO PETS!  NO SMOKING ON PREMISES!  NO PARTY! No ""DRUGS""! - Keep the Place Clean at All Times! - Do Not Ask the ""Neighbors"" for anything.  Ask Me!-  - No Neighbors Interaction! - No ""Drugs"" Please!!! - No Noise! A printed house rule will be provided. Please be respectful to others when all rooms are booked.  10 AM Check-out and Check-in is between 12 PM (noon) - 3 PM.   Late check in after 8 pm is $50, lock out is $50. Respect yourself, Respect others, clean up after yourself.  No Smoking/drinking in apt.  Thank You! Location Rules: The ""Exact Address Location Is Not Stockton St.  It Is 2 Streets Away.  It Is Not Disclosed For Security Reasons"" And Is Given Out 24 Hours Prior to Check-in.  If This Is a Problem for You, Please STOP Here And Contact Other Hosts for Your Stay.   This Is a Part Of My House Rules.",
16384548,Quiet & Bright 1 Bedroom in Downtown Flushing,42102163521,unconfirmed,Alan,Queens,Flushing,40.758990000000004,-73.82245,United States,US,False,flexible,Entire home/apt,2008,$917 ,$183 ,30,3,6/30/2019,0.3,3,15,281.0,"Nothing out of the ordinary...the basic considerations...being reasonably neat and tidy.   Please leave shoes in the entranceway.   NO SMOKING in apartment or deck. Kitchen is available for breakfast only;   I stock the breakfast essentials...coffee, tea, milk, cream, juice, cereal, bread, jelly, and often other items as well.  You may use the fridge for beverages and light snacks all day, but no cooking, frying baking of any meal, and no dinner in the house.   You may store items in the fridge. I'm insensitive to noise, so there is no need to tip-toe.  Plus we are 2 floors apart, you likely won't be hearing me either. I do request that guest be tidy and clean, i.e. dishes not left overnight, etc.  I do have a housekeeper a couple of times a month to handle the big stuff.",
16385100,Boutique Gowanus Queen Studio,73689671003,verified,Melissa,Brooklyn,Gowanus,40.6786,-73.98380999999999,United States,US,True,flexible,Private room,2009,$192 ,$38 ,1,82,7/7/2019,4.16,3,17,355.0,"For non-smokers only, quiet, respectful, persons.",
16385653,Large Sunnyside Apartment 20 min to Times Square,8079261222,verified,Michael,Queens,Sunnyside,40.74523,-73.91676,United States,US,False,strict,Entire home/apt,2017,$789 ,$158 ,14,5,5/2/2019,0.26,4,1,0.0,,
16386205,Gowanus Inn Boutique Queen,13990432172,unconfirmed,Melissa,Brooklyn,Gowanus,40.677209999999995,-73.98444,United States,US,False,moderate,Private room,2012,$65 ,$13 ,1,7,6/30/2019,0.36,4,17,364.0,The Perfect home stay for clean and responsible person. Home is keep neat and clean at all times. Guest wipe up after themselves after using the kitchen. There is no smoking in home and no pets allowed in home. No overnight guest to keep the stay peaceful and quiet.,
16386757,Christmas in the City w/ local vibe,77013817187,verified,Kathryn,Manhattan,Hell's Kitchen,40.766329999999996,-73.9875,United States,US,False,moderate,Entire home/apt,2016,$133 ,$27 ,4,0,,,3,1,0.0,"No drinking, no smoking, no parties, no pets, no drugs, no girlfriends or boyfriends moving in. Looking for a quiet, studious, clean person who is looking for a comfortable and affordable place to stay during the school year.  House is open to both sexes. No children please.",
16387309,Gowanus Boutique Queen Studio,36599638373,verified,Melissa,Brooklyn,Gowanus,40.678509999999996,-73.98439,United States,US,True,moderate,Private room,2013,$564 ,$113 ,1,9,6/30/2019,0.46,3,17,364.0,,
16387862,The Great Room on the Upper East Side,54878024535,verified,Sylvia,Manhattan,Upper East Side,40.7627,-73.96225,United States,US,False,flexible,Private room,2012,$908 ,$182 ,3,1,1/1/2018,0.05,3,2,0.0,"Check-in is 2:00 pm, and checkout 11:00 am. You may bring bags in before check in time or leave it to pick up later. Let me know to arrange it. After reservation please send me your arrival and departure time for logistics Help yourself coffee or tea anytime NO shoes to the second floor  Keep the volume low before 8am and after 10pm Close the doors gently No shower after  11:30pm No laundry after  before 9am and after 8pm Keep the kitchen in a decent condition after your use Close the shower curtain well, no hair in the tub, no water around the sink on the sink there is a sponge you can use it to dry Turn off the light when you leave the room Trash out from the room  BLUE BOX recycling  Please respect this rules. Full refunded of security deposit in this case",
16388414,Beautiful apartment in Chinatown / Lower East Side,72757626487,unconfirmed,Jade,Manhattan,Chinatown,40.71508,-73.99275,United States,US,True,moderate,Entire home/apt,2012,"$1,138 ",$228 ,4,5,4/29/2019,0.26,4,1,0.0,"- I like to keep a quiet house. Please keep all noise low, especially in the morning and late at night. - Please take your shoes off before entering the apartment. - Always bolt the apartment door when entering or exiting. - If I am away when you check out, please put the keys in the lockbox and remember to set the code to 0000. - I don't charge for cleaning or extra people. Kindly return the favor by keeping the place clean. - No smoking indoors. - You may make use of food and beverages only if they are explicitly shared. If you have any questions, please ask.",
16388966,Bright Room In 2 Bedroom Flat With Outdoor Patio,86374115431,verified,Charles,Brooklyn,Williamsburg,40.711729999999996,-73.96164,United States,US,True,strict,Private room,2020,$569 ,$114 ,1,1,12/30/2017,0.05,4,1,0.0,I except guest to be respectful of my home and follow my house rules.,
16389519,Beautiful Brooklyn studio,34349514889,verified,Iquane,Brooklyn,Bedford-Stuyvesant,40.68437,-73.93132,United States,US,False,strict,Entire home/apt,2014,$408 ,$82 ,1,65,6/17/2019,3.78,2,3,92.0,,
16390071,Studio in Greenwich Village,30545869732,verified,Ariel,Manhattan,Greenwich Village,40.73103,-74.00140999999999,United States,US,False,flexible,Entire home/apt,2011,$462 ,$92 ,27,4,5/6/2019,0.24,4,1,153.0,No smoking No Loud Music No Bad Word,
16390623,"Beautiful, Lovely W. Village Room for Females!",80759576278,verified,Andrea,Manhattan,West Village,40.73158,-74.00151,United States,US,False,flexible,Private room,2021,$811 ,$162 ,2,92,6/24/2019,4.65,4,2,60.0,,
16391176,Spacious Manhattan Studio - Greenwich Village,34014156709,unconfirmed,Kaleisha,Manhattan,Greenwich Village,40.73213,-73.99323000000001,United States,US,True,flexible,Entire home/apt,2021,$178 ,$36 ,3,2,11/26/2017,0.1,3,1,0.0,"NO PETS.  NO SMOKING.  NO PARTIES.  No recreational drugs.  No open flames.  No excess noise after 10:00 pm.  Avoid disturbing neighbors.   NO PETS.  If a pet is found on the premise, a pet surcharge of $300 will be applied. You will be asked to leave immediately and will forfeit your security deposit if an animal is on the property without permission of owner. NO SMOKING PLEASE.  A $500 cleaning fee will be deducted from your deposit if smoking occurs in the unit. This is a NO PARTY house. Parties, loud get-togethers, or gatherings are not allowed because of neighbor issues, and possible damage to property. If a party, loud gathering, or loud disturbance does occur, or if neighbors or other guests call for a loud disturbance, you will forfeit your security deposit and will be evicted immediately. Please Note:  Guests must provide their own toiletries/cleaning supplies/paper products.  We will have a starter kit of toiletries and cleaning supplies at the house, but you will need to rep",
16391728,Cozy Manhattan private room @Excellent location,56110567221,verified,Chuhan,Manhattan,Upper West Side,40.802040000000005,-73.96611999999999,United States,US,False,moderate,Private room,2006,$75 ,$15 ,10,2,5/26/2018,0.11,4,1,0.0,Please be respectful of the neighbors after 9 pm. Treat the home as you would your own.,
16392280,Lovely room in West Harlem,77105102771,unconfirmed,Yoleni,Manhattan,Harlem,40.81855,-73.94447,United States,US,True,flexible,Private room,2022,$619 ,$124 ,1,5,4/11/2018,0.25,5,1,0.0,"Check-in is 2:00 pm, and checkout 11:00 am. You may bring bags in before check in time or leave it to pick up later. Let me know to arrange it. After reservation please send me your arrival and departure time for logistics Help yourself coffee or tea anytime NO shoes to the second floor  Keep the volume low before 8am and after 10pm Close the doors gently No shower after  11:30pm No laundry after  before 9am and after 8pm Keep the kitchen in a decent condition after your use Close the shower curtain well, no hair in the tub, no water around the sink on the sink there is a sponge you can use it to dry Turn off the light when you leave the room Trash out from the room  BLUE BOX recycling  Please respect this rules. Full refunded of security despoit in this case",
16392832,Elmhurst Braodway Apartment,42711012227,unconfirmed,馨惠,Queens,Elmhurst,40.73688,-73.87644,United States,US,False,strict,Private room,2004,$608 ,$122 ,15,0,,,2,1,0.0,There are no towels included,
16393385,Cozy Minimalist Small Room in a Great Apartment,61345722684,verified,Marion,Brooklyn,Bedford-Stuyvesant,40.68588,-73.95551,United States,US,False,strict,Private room,2013,$102 ,$20 ,1,24,5/24/2018,1.21,2,1,0.0,"Check-in is 2:00 pm, and checkout 11:00 am. You may bring bags in before check in time or leave it to pick up later. Let me know to arrange it. After reservation please send me your arrival and departure time for logistics Help yourself coffee or tea anytime NO shoes to the second floor  Keep the volume low before 8am and after 10pm Close the doors gently No shower after  11:30pm No laundry after  before 9am and after 8pm Keep the kitchen in a decent condition after your use Close the shower curtain well, no hair in the tub, no water around the sink on the sink there is a sponge you can use it to dry Turn off the light when you leave the room Trash out from the room  BLUE BOX recycling  Please respect this rules. Full refunded of security deposit in this case",
