1705519,Brooklyn Summer Sublet-Ditmas Park,22480035110,unconfirmed,Kristin,Brooklyn,Flatbush,40.64882,-73.9605,United States,US,False,strict,Entire home/apt,2013.0,$191 ,$38 ,3,0,,,3,1,52,No Smoking  No Pets,
1706071,Chic One-Bedroom Apt,11486990075,unconfirmed,Shontae,Brooklyn,Clinton Hill,40.69073,-73.96762,United States,US,True,flexible,Entire home/apt,2009.0,$669 ,$134 ,3,28,6/1/2019,0.4,3,1,191,"House Rules 1. Check-in is 4 pm local time. If the unit is ready earlier, we’ll let you know. Check-out is normally 11 am local time, but we’d be happy to extend it as long as we don’t have a cleaning scheduled. Just let us know.  2. All bookings require a security deposit of at least $300, which will be refunded within 7 days of your check-out. 3. For security measures we require all guests to provide proof of identification through ID verification on our own website. In order to check in we'll need a photo of your ID.  4. Our cancellation policy is as shown on our ad and defined by the site you are booking through.  5. Don’t let $300 go up in smoke. There's no smoking allowed in any Flatbook and a $300 fine for breaking this rule.  6. Unfortunately we don’t allow pets in any of our apartments. 7. Unless you’re staying in one of our specialty apartments, we don’t allow parties or excessive noise. 8. If we find the place very messy, we have to charge an extra $40 for every extra hour o",
1706623,Cozy Room in GREENPOINT Apt. YeY,15413806777,verified,Yonatan,Brooklyn,Greenpoint,40.72515,-73.95153,United States,US,False,strict,Private room,2016.0,$615 ,$123 ,1,0,,,5,1,312,No Smoking  No Pets,
1707175,1 BR with garden--East Village,8428876321,unconfirmed,James,Manhattan,East Village,40.725640000000006,-73.98252,United States,US,True,moderate,Entire home/apt,2015.0,$709 ,$142 ,2,5,5/25/2015,0.09,4,1,214,No Smoking  No Pets,
1707728,Cozy Upper East Side 1 Bedroom,25805791988,verified,Brian,Manhattan,Upper East Side,40.78024,-73.94813,United States,US,True,moderate,Entire home/apt,2012.0,"$1,127 ",$225 ,4,16,2/12/2019,0.2,1,1,260,No Smoking  No Pets,
1708280,Sun Fill Room in a Spacious Apt,91601832733,unconfirmed,Huxley,Brooklyn,Windsor Terrace,40.6599,-73.98279000000001,United States,US,False,moderate,Private room,2022.0,$98 ,$20 ,20,6,9/30/2018,0.32,5,1,339,"Please Note: This unit was just renovated last year and it comfortably accommodates 6 guests, but up to 7 guests are permitted if you so desire (two guests in each bedroom and 1 or 2 guests on the available queen size air mattress). Please request an air mattress (if needed) when making a reservation. No smoking, no pets, no parties, and must be 25 years old to book.   For check-out, please ensure: -  All plates and cups are left in the sink or dishwasher -  All trash is left in the kitchen trash can or bagged and left next to the trash can (additional bags are under the sink) -  All windows are closed and locked -  If used, the air mattresses are deflated and put away (please leave used linens for the air mattresses on the floor) -  If furniture was moved during your stay, please return to its original location Please be mindful to our neighbors in the building; quiet hours after 10pm. Please be considerate of our next guests who will be staying after you, if something is broken or ne",
1708832,"Lrg1Bdrm, Terrace w/ Cent.Park View",58554662129,unconfirmed,Kathleen,Manhattan,Upper West Side,40.7964,-73.9675,United States,US,False,strict,Entire home/apt,2010.0,$922 ,$184 ,3,25,6/10/2019,0.3,2,1,24,"House Rules 1. All bookings made at least a week before check in are fully refundable if cancelled within 24 hours of booking. After this, you will receive a 50% refund if you cancel at least 7 days before the start of your trip. 2. Check-in time is any time after 4 pm local time. If the unit is ready earlier, we’ll let you know. Check-out is normally 11 am local time, but we’d be happy to extend it as long as we don’t have a cleaning scheduled. Just let us know.  3. All bookings require a security deposit of at least $300. 4. For security measures we require all guests to provide proof of identification through ID verification on our own website. In order to check in, we'll need a photo of your ID.  5. Don’t let $300 go up in smoke. There's no smoking allowed in any Flatbook and a $300 fine for breaking this rule.  6. Unfortunately we don’t allow pets in most of our apartments. 7. Unless you’re staying in one of our specialty apartments, we don’t allow parties or excessive noise. 8. I",
1709385,Gorgeous Chelsea loft in the heart of Manhattan,28228281019,verified,Henrik,Manhattan,Chelsea,40.74664,-73.99441,United States,US,False,moderate,Entire home/apt,2013.0,$66 ,$13 ,3,15,8/10/2017,0.31,3,1,112,No Smoking  No Pets,
1709937,Historic sundrenched apt of the Lower East Side,50055075585,unconfirmed,Greg,Manhattan,Lower East Side,40.71788,-73.98975,United States,US,False,flexible,Entire home/apt,2022.0,$781 ,$156 ,1,45,6/8/2019,0.62,1,1,276,,
1710489,Brooklyn Amazing 2bedrm Luxury Apt,47887544959,unconfirmed,Maurice,Brooklyn,Crown Heights,40.673559999999995,-73.9425,United States,US,False,strict,Entire home/apt,2006.0,$622 ,$124 ,1,215,6/16/2019,2.55,1,3,379,,
1711042,Beautiful 2-BDRM Brownstone Apartment,19448601326,verified,Historic Harlem,Manhattan,Harlem,40.81757,-73.94709,United States,US,True,flexible,Entire home/apt,2016.0,$948 ,$190 ,3,33,6/22/2019,0.51,4,2,240,"The building has a very strict no smoking policy, please do not smoke in the apartment.  Our neighbors are very conservative, please be respectful, and discreet. No grilling is allowed on the roof.",
1711594,One Bdrm in Trendy Prospect Hts,67255036905,verified,Jennie,Brooklyn,Prospect Heights,40.68052,-73.97254000000001,United States,US,True,moderate,Entire home/apt,2011.0,$437 ,$87 ,2,46,1/2/2017,0.54,2,1,223,,
1712146,Feels like home with park view,86390062689,unconfirmed,Yah,Manhattan,Inwood,40.86821,-73.92251999999999,United States,US,True,moderate,Entire home/apt,2016.0,$986 ,$197 ,10,25,6/1/2019,0.3,5,1,207,,
1712698,"Bedroom, kitchen and private garden",80596244297,unconfirmed,Steve,Brooklyn,Park Slope,40.679809999999996,-73.97967,United States,US,False,strict,Private room,2012.0,$612 ,$122 ,2,23,10/8/2018,0.27,2,1,353,,
1713251,"View of skyline w roof deck, perfect for families!",28754324272,unconfirmed,Maayan,Brooklyn,Gowanus,40.68251,-73.98486,United States,US,False,strict,Entire home/apt,2016.0,$972 ,$194 ,2,57,7/2/2019,0.67,5,1,356,,
1713803,Spacious Room/Hip East Village Apt!,8061287875,unconfirmed,Evan,Manhattan,East Village,40.72718,-73.9812,United States,US,True,strict,Private room,2017.0,$206 ,$41 ,6,80,5/26/2019,1.01,2,1,104,,
1714355,Full apartment close to G & L train,51035411496,unconfirmed,Lindsey,Brooklyn,Greenpoint,40.72363,-73.9457,United States,US,False,strict,Entire home/apt,2021.0,$248 ,$50 ,11,22,5/10/2019,0.26,1,1,17,,
1714908,Huge & sunny 1BR apt in Greenpoint,92204550919,verified,Jessica,Brooklyn,Greenpoint,40.72697,-73.93921,United States,US,False,strict,Entire home/apt,2006.0,$769 ,$154 ,5,40,4/22/2016,0.54,5,1,139,I expect you to keep the apartment picked up and left how it was when you arrived.,
1715460,Gorgeous Unique Garden-Terrace-Apt.,1420174998,verified,Vana,Manhattan,East Village,40.72274,-73.97934000000001,United States,US,False,strict,Entire home/apt,2009.0,$145 ,$29 ,3,85,6/23/2019,1.02,2,1,330,1. No house parties 2. Do not damage any of the furniture or appliances.  3. Do not take anything that has been provided for your comfort and enjoyment.  4. Enjoy yourself! And please reach out if you have any questions or concerns.,
1716012,Charming old school 1BR in C. Gardens Brooklyn,45720403324,unconfirmed,Annie,Brooklyn,Carroll Gardens,40.68343,-73.99189,United States,US,False,flexible,Entire home/apt,2004.0,$724 ,$145 ,4,1,7/11/2012,0.01,4,1,147,"Please remember that this is a residential building. The building rules, apartment occupancy restrictions and the year-round tenants must be respected.  Parties, pets and smoking are not allowed under any circumstances and incur significant fees.",
1716565,Designer Studio in the HEART of WV!,84493156391,unconfirmed,Laura,Manhattan,West Village,40.73514,-73.99954,United States,US,False,strict,Entire home/apt,2003.0,"$1,018 ",$204 ,14,29,12/5/2016,0.36,5,1,143,,
1717117,Studio Apartment Greenwich Village,51477720020,unconfirmed,Aaron,Manhattan,Greenwich Village,40.734809999999996,-73.99845,United States,US,False,strict,Entire home/apt,2012.0,$110 ,$22 ,5,1,9/5/2012,0.01,3,1,256,No smoking. Please be respectful of our neighbors.,
1717669,Lovely Manhattan Apartment,52030537773,unconfirmed,Mathilde,Manhattan,Upper West Side,40.80053,-73.96651,United States,US,False,strict,Entire home/apt,2016.0,"$1,154 ",$231 ,30,23,2/15/2017,0.27,5,1,38,"2 nights minimum stay No pets at any time No smoking Please be mindful of the furniture and personal belongings, it was all furnished with designer pieces and hard to replace things.",
1718221,CLEAN PRIVATE ROOM IN CHELSEA NYC,33884267433,verified,David,Manhattan,Chelsea,40.739709999999995,-74.00220999999999,United States,US,False,strict,Private room,2017.0,$580 ,$116 ,2,42,5/31/2019,0.5,4,1,400,No smoking or pets allowed,
1718774,GREAT DEAL IN TIMES SQ./HK,44042463627,unconfirmed,Matt,Manhattan,Hell's Kitchen,40.757670000000005,-73.99034,United States,US,False,flexible,Entire home/apt,2003.0,$954 ,$191 ,1,195,6/25/2019,2.83,4,1,307,,
1719326,Artist space for creative nomads.,68694359906,verified,Kalae,Manhattan,Upper West Side,40.80165,-73.96287,United States,US,True,moderate,Shared room,2009.0,$695 ,$139 ,2,158,5/5/2019,1.91,2,3,282,,
1719878,Bright friendly room in Brooklyn,84272826817,unconfirmed,Heather,Brooklyn,Bedford-Stuyvesant,40.683279999999996,-73.9379,United States,US,True,flexible,Private room,2003.0,$498 ,$100 ,2,1,12/28/2016,0.03,5,1,104,,
1720431,"GREAT EAST VILLAGE LOCATION, ELEVATOR & ROOFTOP!!!",76241368706,verified,Marianna,Manhattan,East Village,40.728190000000005,-73.97933,United States,US,False,strict,Private room,2007.0,$80 ,$16 ,1,115,6/7/2019,1.4,5,1,64,,
1720983,Entire 1 Bedroom Apartment Flat Historic Bedstuy,89183688285,unconfirmed,Sajjad,Brooklyn,Bedford-Stuyvesant,40.68411,-73.93875,United States,US,False,strict,Entire home/apt,2010.0,$419 ,$84 ,4,42,5/28/2019,0.49,3,1,220,No smoking or pets,
1721535,Beautiful Garden Duplex in Brooklyn,21050450534,verified,Erin,Brooklyn,Bedford-Stuyvesant,40.68269,-73.94004,United States,US,False,flexible,Entire home/apt,2015.0,$128 ,$26 ,5,3,8/17/2015,0.04,2,1,231,,
1722088,"Bright, Airy Loft Apt in Bushwick",81876045111,unconfirmed,Jason,Brooklyn,Bushwick,40.70779,-73.92129,United States,US,False,strict,Entire home/apt,2007.0,$164 ,$33 ,90,32,6/10/2019,0.4,1,1,108,#NAME?,
1722640,800sqft apartment with huge terrace,82992796482,unconfirmed,Alessandra,Brooklyn,Bushwick,40.702020000000005,-73.92402,United States,US,False,strict,Entire home/apt,2011.0,"$1,179 ",$236 ,370,6,4/15/2018,0.09,5,1,166,"House rules: Guests agree to the following terms and conditions 1.Guest(s) agree to NO PARTIES anywhere on the property. Legal action will be taken for parties that cause damages to the unit, property, reputation, or relationship with building staff or other residents.  2.Smoking of any kind is not permitted in the unit or on the premises.  3.Guests agree to abide by maximum occupancy of unit, and observe quiet hours between 9pm and 9am 4.Guests are responsible for action of ALL GUESTS occupying their unit at all times.  5.Guests agree to return all keys, remotes, and parking passes. Replacement fees may apply for unreturned items 6.Guests understand that onsite building staff (maintenance and concierge) are not affiliated with Jordan or AIRBNB. Please contact me directly for any needed items. 7.Guests understand that no pets are to be in the unit.  8.Guests agree to pay replacement cost for any unreturned items, and $125 per hour fee for unauthorized early checkin or late checkout.  9",
1723192,☆ 2BR East Village ☆ Sleeps 5 | BEST LOCATION ☆,37021688783,unconfirmed,Seith,Manhattan,East Village,40.72603,-73.98751,United States,US,False,flexible,Entire home/apt,2010.0,$642 ,$128 ,2,214,7/6/2019,2.53,2,3,272,No smoking and no parties.,
1723744,Duplex Loft in Fort Greene,6353674671,verified,Christopher,Brooklyn,Fort Greene,40.68522,-73.97771,United States,US,True,flexible,Entire home/apt,2021.0,$951 ,$190 ,2,11,5/6/2019,0.13,2,1,341,"No smoking, no pets. Please keep the noise at a respectful level at all times - *particularly after 10pm (as other units in the building are owner-occupied). Please treat it as though it were your own home.",
1724297,Fabulous Urban Retreat 2bdr,93810715477,unconfirmed,Noemie,Brooklyn,Crown Heights,40.67391,-73.94039000000001,United States,US,False,strict,Entire home/apt,2006.0,$75 ,$15 ,2,221,6/23/2019,2.6,1,1,159,No smoking. Not pets/animals. No parties or events. No entertaining beyond confirmed booked guests.,
1724849,large spacious room,11004650546,unconfirmed,Ana,Brooklyn,Crown Heights,40.67436,-73.94807,United States,US,False,flexible,Private room,,"$1,131 ",$226 ,1,123,6/2/2019,1.47,4,3,109,,
1725401,"Sunny Private Bedroom by Express Train, Colleges!",67052618426,unconfirmed,Ny,Manhattan,Harlem,40.81199,-73.95116,United States,US,False,moderate,Private room,,$853 ,$171 ,1,132,6/16/2019,1.56,2,2,95,"Absolutely no smoking, no pets, parties or excessive noise in the apartment.  This is a quiet residential building, perfect for travelers wanting a quiet refuge at the end of a fun filled day in Greater Boston.",
1725954,Luminous Modern Apt Share for Young Professionals,88477974218,verified,Ollie,Brooklyn,Bedford-Stuyvesant,40.68586,-73.9501,United States,US,True,moderate,Private room,,$697 ,$139 ,30,41,2/23/2019,0.65,3,8,32,"House rules: Guests agree to the following terms and conditions 1.Guest(s) agree to NO PARTIES anywhere on the property. Legal action will be taken for parties that cause damages to the unit, property, reputation, or relationship with building staff or other residents.  2.Smoking of any kind is not permitted in the unit or on the premises.  3.Guests agree to abide by maximum occupancy of unit, and observe quiet hours between 9pm and 9am 4.Guests are responsible for action of ALL GUESTS occupying their unit at all times.  5.Guests agree to return all keys, remotes, and parking passes. Replacement fees may apply for unreturned items 6.Guests understand that onsite building staff (maintenance and concierge) are not affiliated with Jordan or AIRBNB. Please contact me directly for any needed items. 7.Guests understand that no pets are to be in the unit.  8.Guests agree to pay replacement cost for any unreturned items, and $125 per hour fee for unauthorized early checkin or late checkout.  9",
1726506,Spacious Stylish  2 Bedroom Suite,34797647758,verified,Nkosi,Brooklyn,East Flatbush,40.65204,-73.94938,United States,US,True,strict,Entire home/apt,,$652 ,$130 ,4,104,6/6/2019,1.32,1,1,378,"Please remember that this is a residential building. The building rules, apartment occupancy restrictions and the year-round tenants must be respected.",
1727058,Central Park West/ 80s One bedroom!,78082523722,verified,Brian,Manhattan,Upper West Side,40.782920000000004,-73.97438000000001,United States,US,False,moderate,Entire home/apt,,"$1,048 ",$210 ,30,18,5/27/2019,0.22,1,5,166,"No smoking, no parties, no pets.",
1727611,Your own floor (private) in prime Williamsburg!!,48104333569,verified,Katherine,Brooklyn,Williamsburg,40.716029999999996,-73.95665,United States,US,False,flexible,Private room,,$240 ,$48 ,2,143,6/30/2019,4.14,2,1,167,"Please remember that this is a residential building. The building rules, apartment occupancy restrictions and the year-round tenants must be respected.  Parties, pets and smoking are not allowed under any circumstances and incur significant fees.",
1728163,Bright and Spacious Manhattan,59496840095,verified,Sheri,Manhattan,Harlem,40.824459999999995,-73.95274,United States,US,True,flexible,Private room,,$988 ,$198 ,28,4,10/3/2016,0.05,4,1,297,No Smoking,
1728715,TIMES SQ - FABULOUS 1BR/ BEST VIEW!,64869333381,unconfirmed,Goran,Manhattan,Hell's Kitchen,40.7641,-73.98803000000001,United States,US,True,flexible,Entire home/apt,,$198 ,$40 ,3,25,4/15/2014,0.3,3,1,217,"House rules: Guests agree to the following terms and conditions 1.Guest(s) agree to NO PARTIES anywhere on the property. Legal action will be taken for parties that cause damages to the unit, property, reputation, or relationship with building staff or other residents.  2.Smoking of any kind is not permitted in the unit or on the premises.  3.Guests agree to abide by maximum occupancy of unit, and observe quiet hours between 9pm and 9am 4.Guests are responsible for action of ALL GUESTS occupying their unit at all times.  5.Guests agree to return all keys, remotes, and parking passes. Replacement fees may apply for unreturned items 6.Guests understand that onsite building staff (maintenance and concierge) are not affiliated with Jordan or AIRBNB. Please contact me directly for any needed items. 7.Guests understand that no pets are to be in the unit.  8.Guests agree to pay replacement cost for any unreturned items, and $125 per hour fee for unauthorized early checkin or late checkout.  9",
1729267,"Beautiful, Quiet, Spacious 1BR - UWS by parks",67512331814,verified,Alexandra,Manhattan,Upper West Side,40.79785,-73.97202,United States,US,False,flexible,Entire home/apt,2008.0,$597 ,$119 ,4,4,8/22/2017,0.05,2,1,203,No Smoking,
1729820,Stylish 1BR Apartment Quick to Midtown and LGA!,97753703599,verified,Dustin,Queens,Ditmars Steinway,40.76961,-73.90451,United States,US,False,flexible,Entire home/apt,2018.0,$805 ,$161 ,45,198,6/15/2019,2.33,5,1,159,,
1730372,Romantic Creative Retreat: Feel the Glow,57515059420,verified,Ina,Manhattan,East Village,40.730470000000004,-73.98229,United States,US,True,flexible,Entire home/apt,2021.0,$338 ,$68 ,5,6,9/14/2012,0.07,1,1,26,ABSOLUTELY NO SMOKING.,
1730924,Modern Private 2 BR Near DT Manhattan – 3 stops,1356709648,verified,Stephon & Luke,Brooklyn,Crown Heights,40.6772,-73.9506,United States,US,False,strict,Private room,2016.0,$130 ,$26 ,7,10,5/21/2019,0.48,4,1,268,"House Rules 1. Check-in is 4 pm local time. If the unit is ready earlier, we’ll let you know. Check-out is normally 11 am local time, but we’d be happy to extend it as long as we don’t have a cleaning scheduled. Just let us know.  2. All bookings require a security deposit of at least $300, which will be refunded within 7 days of your check-out. 3. For security measures we require all guests to provide proof of identification through ID verification on our own website. In order to check in we'll need a photo of your ID.  4. Our cancellation policy is as shown on our ad and defined by the site you are booking through.  5. Don’t let $300 go up in smoke. There's no smoking allowed in any Flatbook and a $300 fine for breaking this rule.  6. Unfortunately we don’t allow pets in any of our apartments. 7. Unless you’re staying in one of our specialty apartments, we don’t allow parties or excessive noise. 8. If we find the place very messy, we have to charge an extra $40 for every extra hour o",
1731477,*Lovely Bedroom! Big Sunny Apt*Manhattan*,31465464584,unconfirmed,Edel,Manhattan,Chinatown,40.71328,-73.99315,United States,US,True,moderate,Private room,2014.0,"$1,033 ",$207 ,19,30,4/8/2019,0.36,5,1,250,,
1732029,Beautiful Park Slope 2 bedroom,94146807102,verified,Gideon,Brooklyn,Park Slope,40.667320000000004,-73.98233,United States,US,False,moderate,Entire home/apt,2018.0,$521 ,$104 ,2,4,9/21/2015,0.08,5,1,313,No party No alcohol,
1732581,Sweet n' Spectacular PARK SLOPE!,15319571742,unconfirmed,Mark And Stoph,Brooklyn,South Slope,40.66488,-73.98079,United States,US,False,strict,Private room,2009.0,$818 ,$164 ,2,201,7/1/2019,2.42,3,1,203,"Please remember that this is a residential building. The building rules, apartment occupancy restrictions and the year-round tenants must be respected.",
1733134,Upper East Side 1 LG BR Avail in my Cute 2BR Apt,15652600139,verified,Melanie,Manhattan,East Harlem,40.78837,-73.94628,United States,US,True,strict,Private room,2014.0,$376 ,$75 ,2,51,6/30/2019,0.61,2,1,39,No smoking or partying.,
1733686,Beautiful Fresh Studio for Sublet,992978391,verified,Dana,Brooklyn,Clinton Hill,40.682320000000004,-73.96500999999999,United States,US,True,moderate,Entire home/apt,2012.0,$293 ,$59 ,30,63,5/26/2019,0.75,4,1,259,,
1734238,Pvblic Bath Artist Loft,73519228961,unconfirmed,Bekah,Brooklyn,Greenpoint,40.73252,-73.95496,United States,US,False,strict,Private room,2009.0,"$1,014 ",$203 ,2,28,8/5/2018,0.59,1,1,345,,
1734790,Escape to our Great Beach Getaway,75372451003,unconfirmed,Jeanmarie,Queens,Arverne,40.59783,-73.80158,United States,US,True,flexible,Entire home/apt,2007.0,$165 ,$33 ,1,55,6/1/2017,0.66,2,1,23,We provide this in the apartment. Residential neighborhood.  Quiet is important.  No smoking. No pets,
1735343,Privet Room in Greenpoint +Backyard *location,20722195725,unconfirmed,Raziel,Brooklyn,Greenpoint,40.72437,-73.94847,United States,US,True,strict,Private room,2006.0,$808 ,$162 ,5,1,11/13/2018,0.13,2,1,370,"Maximum of 2 people over 21 years of age may stay in this studio. There is a one week minimum stay and there is little if any parking available. Sorry, no children and no pets. This place is best for people visiting Boston for conferences, research, or being near family. It is not a resort and there are strict condominium rules about quiet and privacy.",
1735895,Comfy New York City Launching Pad!!,81698413195,verified,Tim,Queens,Astoria,40.77115,-73.92275,United States,US,False,flexible,Private room,2014.0,$839 ,$168 ,40,23,7/1/2016,0.27,4,1,409,The apartment is non-smoking and pets are not allowed.,
1736447,Lovely Condo Carroll Gardens/Gowanus,40892674758,verified,Ibie,Brooklyn,Carroll Gardens,40.67859,-73.99444,United States,US,True,flexible,Entire home/apt,2015.0,$586 ,$117 ,4,61,3/9/2019,0.72,5,1,154,,
1737000,Charming Loft in the East Village,90809471137,verified,Nitin,Manhattan,East Village,40.723040000000005,-73.97923,United States,US,True,moderate,Entire home/apt,2020.0,$398 ,$80 ,60,5,6/20/2013,0.06,5,1,359,,
1737552,"PRIVATE ROOM in HELL'S KITCHEN, NYC",71407053486,unconfirmed,Gio/Joey,Manhattan,Hell's Kitchen,40.77032,-73.99493000000001,United States,US,False,strict,Private room,2018.0,$227 ,$45 ,2,67,6/25/2019,0.8,5,1,162,,
1738104,SOHO/VILLAGE CHARMING STUDIO,64578787226,verified,Anna,Manhattan,Greenwich Village,40.72692,-73.99948,United States,US,False,flexible,Entire home/apt,2013.0,$384 ,$77 ,30,110,4/2/2019,1.3,4,1,-6,"We need to know your arrival time ALMOST 2 days before your arrival, as we need to plan arrivals and cleaning, so it's to guarantee you that you will find the flat clean and ready at your arrival. - Check out is 10:00am and if you will be late, we can charge a late check out fee (min $25) and any damage that your delay can cause to the incoming guest or to the cleaning service. - Smoking is not allowed as are loud noises after 10pm or before 9am. - Guests are not allowed to have extra guests. - A regular check out cleaning is included in the price but it doesn't mean that we will wash your dishes or pick up the garbage all around the house, so please use the trash bin and clean after using the kitchen, if not we will take pictures and charge you the extra cleaning. - There is no daily cleaning service during your stay or any change of linen/towels if you're staying more than 3 nights we can agree a change of towels (only), just ask us in advance. We're here to do the best for our guest",
1738657,Beautiful Modern Apt in Brooklyn,87217453770,unconfirmed,Kanan & Tobias,Brooklyn,Crown Heights,40.6806,-73.96316999999999,United States,US,True,strict,Entire home/apt,2009.0,$949 ,$190 ,2,160,6/18/2019,1.95,4,1,206,,
1739209,Comfortable 1 Bedroom in Greenpoint,13690940675,verified,Alex,Brooklyn,Greenpoint,40.729490000000006,-73.95493,United States,US,False,moderate,Entire home/apt,2018.0,$137 ,$27 ,3,102,6/25/2019,1.23,1,2,196,"Please remember that this is a residential building. The building rules, apartment occupancy restrictions and the year-round tenants must be respected.  Parties and smoking are not allowed under any circumstances and incur significant fees. Parties and smoking are not allowed under any circumstances and incur significant fees. Pets may be considered with pre-approval and an additional pet fee.",
1739761,LARGE BEDROOM +PRIVATE BATHROOM,19507108978,verified,Helene,Brooklyn,Crown Heights,40.67649,-73.9435,United States,US,False,strict,Private room,2016.0,$801 ,$160 ,2,5,5/8/2017,0.08,1,4,22,#NAME?,
1740313,Huge Bdrm in New Wilibrg 3 Bed Loft,43203263414,unconfirmed,Tim,Brooklyn,Williamsburg,40.71099,-73.95217,United States,US,True,flexible,Private room,2007.0,$678 ,$136 ,5,1,3/31/2015,0.02,4,1,231,Please no smoking in any of the inside premises or on the roof deck; no loud music; no moving or rearranging furniture; and no guests beyond those indicated at booking (without clearing with owner first).,
1740866,Warm&Cozy Studio West Village,21723867338,unconfirmed,Josefina,Manhattan,West Village,40.73041,-74.00326,United States,US,True,strict,Entire home/apt,2021.0,$439 ,$88 ,7,34,6/30/2019,0.41,1,1,206,"Please remember that this is a residential building. The building rules, apartment occupancy restrictions and the year-round tenants must be respected.",
1741418,Luxury Pad NYC - Williamsburg Loft,91819937803,unconfirmed,John,Brooklyn,Williamsburg,40.7197,-73.95741,United States,US,False,strict,Entire home/apt,2005.0,$974 ,$195 ,30,6,10/31/2015,0.07,1,1,71,"The apartment feels larger then listed, Nice high ceiling in the living room and an Island kitchen to enjoy breakfast.  The bedroom has a loft that fit a queen mattress, hardwood floors through out.  Bathroom has a bath tub",
