45317888,Cozy Studio in the Heart of the East Village,89910007979,verified,Adam,Manhattan,East Village,40.72415,-73.98411,United States,US,False,flexible,Entire home/apt,2011,$100 ,$20 ,1,13.0,1/1/2018,0.5,5,1,0,You are more then welcome to explore the area the rules are just to enter quietly if you come back very late keys will be issue but returned at end of each stay.,
45318440,A quite full-size bed living room at upper west,78092549940,unconfirmed,John (Tianqi),Manhattan,Upper West Side,40.8012,-73.96693,United States,US,False,flexible,Shared room,2013,$925 ,$185 ,2,0.0,,,5,1,0,"9 nights minimum stay, no smoking or pets.",
45318993,Modest Room in a Quiet Brooklyn Home,64669822551,verified,Hermann,Brooklyn,East Flatbush,40.6327,-73.93921999999999,United States,US,False,flexible,Private room,2018,"$1,120 ",$224 ,1,5.0,5/13/2018,0.19,1,1,342,#NAME?,
45319545,Large bright friendly bedroom apartment,57474439935,unconfirmed,Avrora,Brooklyn,Bensonhurst,40.60795,-73.98955,United States,US,True,flexible,Private room,2019,$174 ,$35 ,1,5.0,9/29/2017,0.19,1,1,364,Check-in is at 4pm or after. Checkout is at 1030am unless otherwise specified. Please be respectful and honest because we share the same space. We reserve the right to charge for parking upon arrival and to reject your reservation request if we do not feel comfortable with your request. Thank you!,
45320097,"""Chill"" Private 1BR Close to A,C,B,D,2,3",41543507378,unconfirmed,Howard,Manhattan,Harlem,40.818000000000005,-73.94134,United States,US,True,moderate,Private room,2006,$853 ,$171 ,2,51.0,7/5/2019,2.26,1,1,170,Check in: 3pm; Check out: 12pm unless otherwise allowed. No pets please. No parties. NO smoking in or around the property. You can use anything that is inside the apartment so long as you don't break it or bring it outside the apartment. Feel free to read any book.,
45320650,Private sun-filled 1-bedroom apt with own backyard,85125586000,unconfirmed,Marc,Brooklyn,Bushwick,40.69207,-73.92331,United States,US,False,moderate,Entire home/apt,2007,$569 ,$114 ,3,17.0,5/25/2019,0.66,3,2,0,"1.CHECK-IN TIME IS AFTER 3 P.M. EST AND CHECK-OUT IS 11 A.M. EST. 2.This is a NON SMOKING boat. 3.We will not rent to vacationing students or singles under 25 years of age  unless accompanied by an adult guardian or parent. 4.DAMAGE WAIVER- A damage waiver of $39 is required. The waiver offers up to $1500 of insurance against accidental damage. You will not be held responsible for damage incurred provided the following provisions are met: (website hidden) intentional damage is done to the boat or its contents.  (website hidden) charges are incurred due to contraband, pets or collection of rents or services rendered during the stay. 3.All debris, rubbish and discards are placed in the properly bagged, and soiled dishes are placed cleaned. 4.All keys are left on the kitchen table and unit is left locked. (website hidden) linens are lost or damaged. (website hidden) Early check-in or late check-out, unless approved in advance. 5.PAYMENT - An advance payment equal to 50% of the total is re",
45321202,Sunny Brooklyn Studio: 25 min to central Manhattan,72369826605,verified,Cara,Brooklyn,Bedford-Stuyvesant,40.69171,-73.95374,United States,US,False,strict,Entire home/apt,2019,$199 ,$40 ,4,6.0,8/18/2018,0.24,2,1,0,"Keep the apartment  a little clean., the hit 70 , no more and that , the Ac if you are not in the room turn off , please , no party's .if you smoke please only in the balcony , no inside no in the hallway.",
45321754,Spacious 2bed private rm close St.BarnabasHospital,82802689332,verified,Emma,Bronx,Tremont,40.84594,-73.89358,United States,US,False,strict,Private room,2012,$256 ,$51 ,2,49.0,5/26/2019,1.95,5,2,324,,
45322306,Private Spacious Bedroom in Upper Manhattan,77385324946,verified,Aj,Manhattan,Harlem,40.8213,-73.95130999999999,United States,US,False,strict,Private room,2004,$84 ,$17 ,7,0.0,,,2,1,0,,
45322859,PRIME LOCATION/SUNLIT ROOM,56103142025,unconfirmed,Andrea,Manhattan,Little Italy,40.71886,-73.99746,United States,US,False,moderate,Private room,2013,$405 ,$81 ,1,166.0,6/21/2019,6.37,2,2,71,,
45323411,Spacious and sunny room in Williamsburg,74215932332,verified,Cecilia,Brooklyn,Williamsburg,40.7107,-73.94295,United States,US,True,strict,Private room,2008,$68 ,$14 ,7,1.0,12/24/2017,0.05,3,1,0,,
45323963,Luxury Apt in Williamsburg + Huge private terrace,42304284929,unconfirmed,Alex,Brooklyn,Williamsburg,40.70943,-73.95064,United States,US,False,moderate,Entire home/apt,2004,$422 ,$84 ,3,3.0,8/26/2018,0.28,2,1,364,"As I can't keep up the cleaning duty 24/7, please clean after yourself as you enter.  Read carefully the instructions and the cancelation. I have works and I won't promise to be at the house 24/24,but I will try my best if you need help.  Living and kitchen are prohibited while these are my working place.  Must notify me if you're having guests.  If you need anything, I'm glad to help in my power. Just ask!",
45324516,Beautiful NYC bedroom and neighborhood!,11205401377,unconfirmed,Marianel,Manhattan,Washington Heights,40.85115,-73.93703000000001,United States,US,True,moderate,Private room,2011,$382 ,$76 ,4,4.0,4/22/2019,0.15,3,1,0,"I expect guests to be respectful, clean, and caring of the space and it's belongings.  No smoking in the house. No pets please. (I love them, but the space isn't conducive for them). By booking this space you are accepting responsibility for all damages caused by you and/or your guest(s) to this house and/or it's contents. Please remove shoes at the front foyer.  I ask that guests do not use any of the food in the refrigerator or cabinets. You are welcome to purchase your own food to store and to cook with if you'd like. Please only use kitchen appliances that you are familiar with using so they are operated correctly and safely. There are paper bags beside the kitchen trash can and these are for recycling of glass, plastic, paper and cardboard.",
45325068,MODERN 3 BEDROOM APT IN THE HEART OF BROOKLYN,56086497230,verified,Nazila,Brooklyn,Downtown Brooklyn,40.70001,-73.98969,United States,US,False,flexible,Entire home/apt,2004,$850 ,$170 ,2,94.0,6/23/2019,3.67,4,1,166,"- No smoking or drugs inside the apartment or building - No parties are allow - Keep the noise level down between the hours of 10pm & 8am - Keep luggage off of bedding, please use the luggage rack instead. - Dishwasher off limits - Pets are prohibited -  Extra guests throughout duration of stay is not allowed unless approve prior to booking - Lastly, please do not bother the neighbors such as ringing their doorbells or asking for directions. Instead, reach out to us if you have any questions or concerns. Please respect our neighbors privacy and be discreet about our place being AirBnB rental during your stay. Thanks for booking with us and keeping the AirBnB experience alive and well!",
45325620,Amazing loft with a great view,10929081709,verified,John,Brooklyn,Bedford-Stuyvesant,40.69347,-73.955,United States,US,True,flexible,Entire home/apt,2022,$969 ,$194 ,20,0.0,,,4,2,0,No loud parties. No smoking. Please),
45326173,Quiet private room in Manhattan Lower east side,58035676024,unconfirmed,Zhi And Gloria,Manhattan,Lower East Side,40.720079999999996,-73.98268,United States,US,True,strict,Private room,2015,$92 ,$18 ,3,28.0,11/11/2017,1.07,2,1,0,,
45326725,1BR in the Heart of Williamsburg,43322721472,unconfirmed,Monica,Brooklyn,Williamsburg,40.71869,-73.95358,United States,US,False,strict,Entire home/apt,2006,"$1,004 ",$201 ,2,2.0,7/23/2017,0.08,3,1,0,,
45327277,Unfurnished 2 bedrooms for rent at the end of May!,11269105192,unconfirmed,Adé,Brooklyn,Crown Heights,40.67371,-73.94537,United States,US,False,strict,Private room,2019,$481 ,$96 ,5,0.0,,,4,1,0,#NAME?,
45327829,Crown Heights Haven,8592742551,verified,Ā.,Brooklyn,Crown Heights,40.6746,-73.94549,United States,US,False,strict,Private room,2020,$685 ,$137 ,2,19.0,7/6/2018,0.73,1,1,0,"Our Herbivorian House manual with detailed rules and helpful information is present in each apartment.  The Apartment must be left as clean as it was found, (especially the kitchen and bathroom) cleaning supplies are present in the apartment. (we are responsible for washing sheets and towels) No loud or late night noises or parties. No additional guests No smoking. No red meat or strong smelling meats shall be cooked (the smell disturbs our primarily vegetarian guests) Pleasant behavior to all other building residents. Any questions assistance needed please contact us we are happy to help. There is now only 2 hours of public street parking available (residential zone, just changed April 2016) In a triangle directly infrount of our building (we will check on non residential parking availability, and are looking for alternative parking, but call us first is bring a car) Both sides of the streets are ok for 2 hours except on street cleaning days (on one side 1st and third Tuesday, on the ",
45328382,Clean and large bedroom in a private house,2348700893,verified,Christoni,Bronx,Williamsbridge,40.873090000000005,-73.86326,United States,US,False,strict,Private room,2014,$474 ,$95 ,1,5.0,6/3/2017,0.19,4,1,0,No smoking please!,
45328934,"Great, light filled room with ensuite private bath",49194897343,verified,Kung,Brooklyn,Williamsburg,40.7097,-73.94001,United States,US,False,strict,Private room,2011,$785 ,$157 ,2,3.0,10/15/2017,0.14,4,2,0,"We suggest you use email or texting contact us if need, do not call us. We will not accept calling from AirBnB guests. We will back to you ASAP.",
45329486,Large Private Suite in Classic Brooklyn Brownstone,69158868541,unconfirmed,Linda,Brooklyn,Brooklyn Heights,40.69364,-73.99467,United States,US,True,moderate,Entire home/apt,2020,$100 ,$20 ,2,80.0,6/28/2019,3.14,4,1,271,Please treat this house as if it is your own.  - No smoking - No drug use - Shoes can be left in the hall. - Help yourself to anything in the refrigerator. - LOCK THE DOORS when you leave. Front door to condo locks on it's own.,
45330039,"East 12th st, Lux Studio in Greenwich Village**",13460634248,verified,Ken,Manhattan,East Village,40.733340000000005,-73.9897,United States,US,False,flexible,Entire home/apt,2013,"$1,071 ",$214 ,30,1.0,5/6/2018,0.07,4,87,307,"Please, No smoking and no pets. We do require a Security deposit. Absolutely no parties, if a small gathering will take place, please notify us so that we can let the other units in the building know.  Please be aware that the apartment is in a building with other tenants, including children, be mindful of their privacy and the noise level.",
45330591,Times Square studio,50881717139,unconfirmed,Azi,Manhattan,Hell's Kitchen,40.75725,-73.9959,United States,US,False,flexible,Entire home/apt,2007,"$1,065 ",$213 ,2,36.0,6/20/2019,1.4,2,1,2,,
45331143,Great 2 bedroom suite in Bed Stuy,84011114863,unconfirmed,Jacqueline,Brooklyn,Bedford-Stuyvesant,40.68416,-73.9551,United States,US,False,flexible,Entire home/apt,2022,$351 ,$70 ,3,59.0,7/6/2019,2.42,1,2,88,,
45331696,Private Budget Room For Awesome Guests. #1,55159205807,verified,Ude,Brooklyn,Canarsie,40.64005,-73.90916,United States,US,True,moderate,Private room,2004,$477 ,$95 ,1,29.0,2/2/2018,1.13,2,2,35,,
45332248,BEAUTIFUL 1 BEDROOM IN W 48 STREET,45051165947,verified,Jeniffer,Manhattan,Hell's Kitchen,40.76515,-73.99423,United States,US,True,moderate,Entire home/apt,2016,"$1,074 ",$215 ,30,0.0,,,4,31,337,NO SMOKING!  NO PARTIES!,
45332800,Sunny 2-bedroom in classic Brooklyn brownstone,20381279949,unconfirmed,Rachel,Brooklyn,Fort Greene,40.6862,-73.96973,United States,US,False,flexible,Entire home/apt,2011,$969 ,$194 ,3,3.0,8/11/2017,0.12,1,1,0,,
45333352,"West Soho Apartment, One Bedroom",14035569397,verified,John,Manhattan,SoHo,40.72667,-74.00179,United States,US,False,strict,Entire home/apt,2018,$311 ,$62 ,2,2.0,6/4/2017,0.08,3,1,0,Treat my home as if it is your own home. NO smoking at all in the building. No more than 6 people allowed . Please take your shoes off when enter the apartment,
45333905,Beautiful Brooklyn Vacation Rental,77937624801,unconfirmed,Rachel,Brooklyn,Crown Heights,40.67324,-73.92501999999999,United States,US,False,flexible,Entire home/apt,2015,$901 ,$180 ,20,49.0,5/29/2019,1.94,2,3,204,"1. NO SHOES IN THE HOUSE. Please, leave them behind the door 2. Please make sure that all the doors are     locked behind you when you leave 3. NO SMOKING, ABSOLUTELY NO DRUGS,     NO excessive alcohol consumption 4. Please, keep the noise level to the minimum       from 10pm to 8am  5. No parties. Please no unauthorized guests. Only checked in guests are allowed on the property 6. Be respectful to our neighbors  7. If you have any questions about anything     please ask freely, I am always happy to help     and make your stay pleasant. ENJOY!",
45334457,"Beautiful, Spacious, Luxury Fort Greene Apartment",46950366967,unconfirmed,New,Brooklyn,Fort Greene,40.693690000000004,-73.98074,United States,US,True,moderate,Entire home/apt,2010,$189 ,$38 ,2,7.0,8/20/2018,0.29,1,1,0,,
45335009,"Beautiful, rustic 1BD in HEART of Willlamsburg!",38274064068,verified,Daryen,Brooklyn,Williamsburg,40.71232,-73.96067,United States,US,False,flexible,Entire home/apt,2013,"$1,145 ",$229 ,4,6.0,4/14/2018,0.24,4,1,1,- Pets under 30pounds only.  - There is a grill in the back yard for guest use,
45335562,Charming 2brs w/ private garden in Carroll Gardens,17638770679,verified,Kremer,Brooklyn,Gowanus,40.67862,-73.9923,United States,US,False,moderate,Entire home/apt,2010,$236 ,$47 ,30,2.0,11/1/2018,0.19,5,2,342,,
45336114,Lower Manhattan room - best part of town,12394603812,unconfirmed,George,Manhattan,Lower East Side,40.7218,-73.98723000000001,United States,US,False,moderate,Private room,2015,$977 ,$195 ,30,8.0,8/1/2018,0.31,2,3,237,"No unexpected house guests please, and no smoking in the house!",
45336666,Modern high ceiling loft,18535680624,verified,Paul,Brooklyn,Bedford-Stuyvesant,40.69121,-73.95265,United States,US,False,flexible,Entire home/apt,2008,"$1,100 ",$220 ,7,0.0,,,5,1,0,"No smoking. If using the kitchen, guests must wash and put everything away. Please leave the apartment exactly as you found it.",
45337219,Private Bedroom in Manhattan,82286584452,verified,Mariama,Manhattan,Roosevelt Island,40.76364,-73.94881,United States,US,True,strict,Private room,2014,$576 ,$115 ,1,48.0,6/20/2019,1.86,2,1,342,,
45337771,"Big room in Queens, close to all...皇后区大房, 近超市､地铁",32122539983,unconfirmed,Jiqiong,Queens,Rego Park,40.72446,-73.85636,United States,US,False,strict,Private room,2017,"$1,118 ",$224 ,3,46.0,6/10/2019,1.77,2,1,48,"Our Herbivorian House manual with detailed rules and helpful information is present in each apartment.  The apartment must be left as clean as it was found, (especially the kitchen and bathroom) cleaning supplies are present in the apartment. (we are responsible for washing sheets and towels)  If you would rather not clean up after yourself please include an extra $100.00 for the cleaning Help. No loud or late night noises or parties. No additional guests No smoking. No red meat or strong smelling meats shall be cooked (the smell disturbs our primarily vegetarian guests) Pleasant behavior to all other building residents. Any questions assistance needed?.. please contact us, we are happy to help.",
45338323,One bedroom in two bedroom,5904226629,verified,Arthur,Manhattan,Harlem,40.80393,-73.95674,United States,US,False,flexible,Private room,2012,$752 ,$150 ,7,0.0,,,2,3,0,,
45338875,Townhouse Garden Apartment - Park Block,20227237688,verified,"Jeanne - Aka, 'Rindy'",Brooklyn,Park Slope,40.666340000000005,-73.97806,United States,US,False,moderate,Entire home/apt,2011,$300 ,$60 ,4,41.0,1/2/2019,1.63,4,1,170,#NAME?,
45339428,Midtown Convenience and Modern Comfort,35966591237,verified,Jenny,Manhattan,Midtown,40.7523,-73.97287,United States,US,True,strict,Private room,2012,$729 ,$146 ,4,1.0,7/30/2017,0.04,5,1,0,"I love having you here; you'll feel comfortable and at home.  You will have a key to  the house, so feel free to come and go as you choose.  Enjoy your stay in Boston!",
45339980,AMAZING HOUSE 3 Bedrooms 3 Bathrooms.,39989859983,verified,Ms. George,Queens,Glendale,40.69252,-73.89533,United States,US,True,strict,Entire home/apt,2020,$528 ,$106 ,3,22.0,6/23/2019,0.93,4,1,292,No smoking allowed inside the house. My roomates and I ask if you use any dishes in the kitchen to clean up after yourself. Respect the house and the room you're in.,
45340532,Spacious NYC Apartment with a View,9528440514,unconfirmed,Claire,Brooklyn,Sunset Park,40.65003,-74.00657,United States,US,True,strict,Entire home/apt,2013,$984 ,$197 ,3,2.0,7/5/2017,0.08,3,1,0,No smoking in the apartment.,
45341085,Grdn 2BD Sleeps 7 Pvt. Bath Near train⭐Mins to NYC,32012354072,verified,Monica,Brooklyn,Bushwick,40.69453,-73.93053,United States,US,False,flexible,Private room,2007,$949 ,$190 ,3,0.0,,,1,1,93,,
45341637,Bronx Wakefield Large Furnished Room,60657088358,unconfirmed,Ms. H,Bronx,Wakefield,40.88702,-73.86575,United States,US,True,strict,Private room,2013,$799 ,$160 ,1,39.0,7/1/2019,1.57,5,1,360,"This is a non smoking house in a quiet neighborhood, so please no loud music or party's allowed. If not in need of any light, fan or AC please shut it off.""Conserve Energy "" Please treat my home like it is your own home.",
45342189,Unique Brooklyn Studio,30608194700,verified,Trilla,Brooklyn,Crown Heights,40.675740000000005,-73.94722,United States,US,False,flexible,Entire home/apt,2019,"$1,018 ",$204 ,31,70.0,6/22/2019,2.79,3,1,263,"When you have ""settled"", Charlotte will show you what you need to know to make your stay perfect (door locks, porch lights, etc). Having an entire apartment (actually the larger part of the house) comes with a few small responsibilities that would not come with  a hotel room.  The house is professionally cleaned between guests. However we request that our guests leave the dishes, glassware and cooking utensils clean for the next guests. It is not acceptable to put dirty dishes back into the cabinets. I am very generous when I review guests. I don't believe any have gotten less than five stars. We have never had a guest we could not honestly recommend to another host! Please do not put baby wipes, diapers, paper towels, feminine products, etc. into the toilet. We are on a city sewer system over which the city planted trees. It is very costly to keep things flowing. Unknowingly, guests have caused two drainage blocks in 2 months. ""The DRain KIng"" came yesterday with a industrial size sna",
45342742,Home home sweet home,65402622957,verified,Leah,Queens,Woodside,40.74204,-73.90639,United States,US,False,moderate,Private room,2008,$447 ,$89 ,2,3.0,5/28/2017,0.12,3,1,0,"We suggest you use email or texting contact us if need, do not call us. We will not accept calling from AirBnB guests. We will back to you ASAP. ",
45343294,"Prime Astoria Apartment, Beautiful and Convenient",5211401396,verified,Burcu,Queens,Astoria,40.75865,-73.91736999999999,United States,US,True,strict,Private room,2022,"$1,141 ",$228 ,2,2.0,9/12/2017,0.08,4,1,87,,
45343846,Charming Room in Sunlit 3BD Apt,29727771654,verified,Nneka,Brooklyn,Crown Heights,40.67615,-73.94752,United States,US,False,moderate,Private room,2013,$256 ,$51 ,3,1.0,5/21/2017,0.04,4,1,0,#NAME?,
45344398,FINANCIAL NEAR WORLD TRADE CENTER,97041866268,verified,Anny,Manhattan,Financial District,40.70817,-74.00675,United States,US,True,flexible,Private room,2013,$618 ,$124 ,1,5.0,10/6/2017,0.19,5,1,0,"HOUSE RULES  You will be staying in an apartment in our family home. We ask that you conduct yourself respectfully.  **Your booking acknowledges your reading and agreement with our house rules** *There will be no access to the cellar or usage of the backyard.    *We ask there be no drugs or parties.   *No smoking is allowed.  *No pets allowed.   *We ask that only the guests that have rented be allowed in the building or apartment no additional overnight guests or visitors are allowed. *Please do not leave any food on the table outside or on the back deck. *Laundry services are not provided.  (There are local laundromats in the area and we have provided some names in our handbook). *No candles are allowed. *Because we have hardwood floors, we ask if you have rolling suitcases that you will use care and try not to roll them around on the floors.  There are plenty of rugs to place them on. *Please Do Not give out any of the entry key codes to anyone (Your code will only be valid for your ",
45344951,Spacious Bushwick Studio,93409290358,unconfirmed,Noah,Brooklyn,Bushwick,40.70373,-73.92848000000001,United States,US,True,strict,Entire home/apt,2006,$350 ,$70 ,3,3.0,11/25/2018,0.12,5,1,0,"Hi! So here are just some rules to make our experience more joyful and peaceful. We love to make our guest feel at home, however it's important to be mindful  of these few things while staying in our home: feel free to use our kitchen, but remember to clean up after yourself, we do not provide toiletries nor do we provide towels, you may not bring unannounced guests or have anyone stay over that is not part of our initial agreement, we work throughout the week and it's important that we be mindful and respectful of this, no parties, loud music, or drugs in our home. And please please clean up after yourself when you use our bathroom. Smoking allowed in the room.",
45345503,Huge Williamsburg Loft (true loft!),27324373430,unconfirmed,Danni,Brooklyn,Williamsburg,40.71432,-73.95629,United States,US,False,moderate,Entire home/apt,2005,$82 ,$16 ,2,2.0,6/12/2017,0.08,2,1,0,"We expect that you treat our home as you would yours.  If you smoke, you can do so on the back porch. There is absolutely no smoking in the apartment.",
45346055,Private Bedroom in Trendy Williamsburg Loft,88727678265,unconfirmed,Sam,Brooklyn,Williamsburg,40.71725,-73.9544,United States,US,False,flexible,Private room,2008,$149 ,$30 ,5,111.0,6/22/2019,4.26,3,4,10,,
45346608,Cosy bedroom in prime Williamsburg,1450502892,unconfirmed,Jonathan,Brooklyn,Williamsburg,40.71365,-73.94821999999999,United States,US,False,flexible,Private room,2005,$291 ,$58 ,4,9.0,12/21/2018,0.36,5,2,36,,
45347160,Studio in Upper East Side,6310393204,unconfirmed,Marlène,Manhattan,Upper East Side,40.779579999999996,-73.95025,United States,US,True,flexible,Entire home/apt,2004,$402 ,$80 ,15,5.0,8/25/2018,0.2,4,1,1,"1. Please turn off lights when not in use. 2. Please use trash cans in bedroom and bathroom to dispose of waste. The blue recycling bin in the hallway can be used for clean hard plastics, glass bottles and jars, paper, cans and tins. 3. No pets are permitted on guest visits. 4. No fires (candles, incense, etc) are permitted in the apartment. 5. No smoking or drug use is permitted in the apartment. 6. No unapproved visitors are permitted in the apartment; please let Sara know in advance if you expect anyone besides the booked guest(s) to be at the apartment during your visit. 7. Please be respectful of our neighbors in the building by avoiding loud music or noise, especially late at night and early in the morning. 8. If furniture or amenities are broken or missing after a guest check-out, or if extensive cleaning is required, reimbursement may be requested through Airbnb. 9. If you have problem, requests, issues, or concerns during your visit, please contact Sara directly. I will be gla",
45347712,Bright  and cozy room 20 min away from Manhattan,84164920737,unconfirmed,Suri,Brooklyn,Sunset Park,40.6589,-74.00018,United States,US,False,flexible,Private room,2007,"$1,110 ",$222 ,2,6.0,3/23/2019,0.27,2,3,365,"As I can't keep up the cleaning duty 24/7, please clean after yourself as you enter.  Read carefully the instructions and the cancelation. I have works and I won't promise to be at the house 24/24,but I will try my best if you need help.  Living and kitchen are prohibited while these are my working place.  Must notify me if you're having guests.  If you need anything, I'm glad to help in my power. Just ask!",
45348265,Upper WestSide Manhattan Comfort 3,18883014083,verified,Felipe,Manhattan,Upper West Side,40.78293,-73.97636,United States,US,True,strict,Private room,2015,$410 ,$82 ,30,8.0,4/26/2019,0.42,2,3,204,"No unexpected house guests please, and no smoking in the house!",
45348817,The Omaric,86157352591,unconfirmed,Desmond,Manhattan,Harlem,40.82425,-73.9552,United States,US,True,moderate,Entire home/apt,2007,$373 ,$75 ,2,49.0,7/2/2019,1.92,3,1,14,"No smoking, please no shoes in the house. No partires  allowed.  Hardwood floors just got done. All lights,  and AC must be turned off when no one is home there are trash barrels right on the back door outside where you can place your trash bags once is full . Please treat my home like it is your own home.",
45349369,Large Private Bedroom in Cool Williamsburg Apt.,11931739621,unconfirmed,Ben,Brooklyn,Williamsburg,40.71219,-73.96085,United States,US,True,moderate,Private room,2021,$451 ,$90 ,5,16.0,6/22/2019,0.62,2,2,10,"- This is mine & my roommate's full time home.  Please be respectful and peaceful.  Also, an elderly dog lives here & as much as I try to keep a very clean place, it is not immaculate or hair-free.  Life happens here.  :)",
45349921,Large Industrial Loft In Bushwick,9663438406,unconfirmed,Javerick,Brooklyn,Williamsburg,40.70608,-73.9313,United States,US,True,moderate,Entire home/apt,2006,$333 ,$67 ,3,2.0,7/22/2017,0.08,1,2,324,,
45350474,1BR in lovely Williamsburg apartment,47634283824,unconfirmed,Daniël,Brooklyn,Williamsburg,40.70884,-73.95425,United States,US,True,flexible,Private room,2007,$140 ,$28 ,20,2.0,6/19/2017,0.08,3,1,0,,
45351026,"Easy, Comfortable and Convenient!",23385750236,unconfirmed,Kathleen,Manhattan,Washington Heights,40.83543,-73.94372,United States,US,False,strict,Private room,2006,$907 ,$181 ,2,14.0,9/1/2018,0.54,1,1,0,,
