50125660,2BdrmPRESIDENTIAL Luxury CONDO In the Heart of NYC,51835624360,verified,Wynpoints,Manhattan,Midtown,40.7521,-73.972,United States,US,False,strict,Private room,2013,$230 ,$46 ,4,3.0,1/13/2017,0.09,3,12,365,Please respect the residents by keeping noise down and absolutely no smoking.  There is no bag storage at the building.  Please do not ask the concierges.  Thank you.,
50126212,1Bdrm DELUXE Fully Renovated CONDO Wyndham Midtown,56028884996,unconfirmed,Wynpoints,Manhattan,Midtown,40.75331,-73.9733,United States,US,True,moderate,Private room,2014,"$1,133 ",$227 ,3,8.0,1/1/2017,0.24,1,12,365,"No smokers, please.  ",
50126764,Rooming has never been better.,94016489463,verified,Laura,Brooklyn,Bedford-Stuyvesant,40.68203,-73.92676,United States,US,True,strict,Private room,2008,$676 ,$135 ,3,18.0,3/14/2019,0.54,1,2,311,Please be respectful of our belongings and leave things as your found them.,
50127316,"Big Quiet, Clean and Respectful APARTMENT.",27563905021,verified,Rosa,Manhattan,Washington Heights,40.85842,-73.92928,United States,US,False,strict,Private room,2018,$740 ,$148 ,1,7.0,3/19/2017,0.21,3,1,0,,
50127869,STUDIO Condo in luxurious Wyndham Midtown 45 NYC,64506747728,unconfirmed,Wynpoints,Manhattan,Midtown,40.75294,-73.9719,United States,US,True,flexible,Private room,2013,$543 ,$109 ,3,3.0,12/11/2016,0.09,1,12,365,No Smoking No Pets,
50128421,Studio King Wyndham Midtown 45 Hotel,79834045868,verified,Wynpoints,Manhattan,Midtown,40.75351,-73.97196,United States,US,True,strict,Private room,2015,$348 ,$70 ,3,12.0,12/18/2016,0.36,2,12,365,No smoking in condo or hallways of building.  No parties.  Well-behaved pets OK.  Quiet and respectful of our neighbors.,
50128973,Le Petit Palace De Brooklyn - Clean Comfy 4 BR Apt,67203656475,unconfirmed,Chantal,Brooklyn,East Flatbush,40.64383,-73.94901999999999,United States,US,True,moderate,Entire home/apt,2007,"$1,105 ",$221 ,3,71.0,7/1/2019,2.23,4,1,162,No Smoking No Pets,
50129526,HugeTropical Bedrm near Ferry,11093621590,unconfirmed,Tony & Grace,Staten Island,St. George,40.640570000000004,-74.0786,United States,US,False,moderate,Private room,2004,$67 ,$13 ,1,20.0,7/1/2019,0.63,5,3,337,"Please be respectful of our neighbors and keep voices, music, etc at a reasonable volume.  Please be tidy and take good care of our home. No shoes on the area rug, be neat with food and drink.",
50130078,Spacious Studio Apartment with Full Size Kitchen,32594017762,verified,Charles,Manhattan,Hell's Kitchen,40.76615,-73.98408,United States,US,False,strict,Private room,2008,$747 ,$149 ,15,0.0,,,2,1,0,We want you to treat our home as your own.  We have a few house rules- -Extra visitors and overnight guests are not allowed. - No pets -No smoking -Cooking facilities are not available -Minimum 2 night stay,
50130630,Whimsical & Cute Private Room in 2 Bdrm Apt,91214991026,verified,Christen,Brooklyn,Williamsburg,40.71622,-73.94273000000001,United States,US,True,flexible,Private room,2004,"$1,071 ",$214 ,14,54.0,5/6/2019,1.61,2,2,86,,
50131183,For all classical lover's,43918800174,verified,Glory,Brooklyn,Sheepshead Bay,40.60803,-73.96211,United States,US,False,strict,Private room,2015,$214 ,$43 ,3,15.0,3/31/2019,0.45,5,2,211,You can use our home as you would like us to use yours. We invite you to use our kitchen as you please. We would love to come home to our apartment in the manner we will leave it for you: clean and ready to use.,
50131735,Downtown Dream on the Park,24056118757,unconfirmed,Julia,Manhattan,Chinatown,40.71348,-73.99135,United States,US,True,moderate,Entire home/apt,2019,$938 ,$188 ,20,38.0,7/5/2019,1.13,3,1,29,#NAME?,
50132287,Artist apt w/ Private room in Bed Stuy,63063017897,verified,Ben,Brooklyn,Bedford-Stuyvesant,40.696529999999996,-73.94994,United States,US,False,moderate,Private room,2017,"$1,161 ",$232 ,2,5.0,10/22/2017,0.15,4,1,0,We live in a quiet neighborhood with respectful neighbors and we ask that you show them the same respect.  No unreasonable noise after 11pm - no smoking - no parties.,
50132839,1Bdrm Deluxe WYNDHAM MIDTOWN 45*Great Location NYC,65270971117,unconfirmed,Wynpoints,Manhattan,Midtown,40.75388,-73.97308000000001,United States,US,False,flexible,Private room,2015,$477 ,$95 ,3,2.0,11/5/2016,0.06,4,12,365,No smoking or parties. Please be courteous of my cordial neighbors.,
50133392,Hotel Style KG/QN Room WYNDHAM MIDTOWN 45,31665560887,verified,Wynpoints,Manhattan,Midtown,40.753440000000005,-73.97207,United States,US,False,strict,Private room,2005,$575 ,$115 ,3,7.0,12/9/2016,0.21,3,12,365,No Smoking No Pets,
50133944,Cozy bright studio flat - Soho/Village,38065168561,verified,Karen,Manhattan,SoHo,40.7263,-74.00344,United States,US,False,flexible,Entire home/apt,2008,$837 ,$167 ,2,136.0,7/6/2019,4.09,2,2,30,,
50134496,2 Double Bed WYNDHAM MIDTOWN 45 *NYC*,45725870779,unconfirmed,Wynpoints,Manhattan,Midtown,40.75359,-73.97295,United States,US,False,strict,Private room,2021,$192 ,$38 ,2,13.0,10/8/2017,0.39,3,12,365,"House Rules 1. Check-in is 4 pm local time. If the unit is ready earlier, we’ll let you know. Check-out is normally 11 am local time, but we’d be happy to extend it as long as we don’t have a cleaning scheduled. Just let us know.  2. All bookings require a security deposit of at least $300, which will be refunded within 7 days of your check-out. 3. For security measures we require all guests to provide proof of identification through ID verification on our own website. In order to check in we'll need a photo of your ID.  4. Our cancellation policy is as shown on our ad and defined by the site you are booking through.  5. Don’t let $300 go up in smoke. There's no smoking allowed in any Flatbook and a $300 fine for breaking this rule.  6. Unfortunately we don’t allow pets in any of our apartments. 7. Unless you’re staying in one of our specialty apartments, we don’t allow parties or excessive noise. 8. If we find the place very messy, we have to charge an extra $40 for every extra hour o",
50135049,2Bdrm PRESIDENTIAL CONDO Wyndham Midtown 45 Hotel,31620982741,verified,Wynpoints,Manhattan,Midtown,40.75375,-73.97295,United States,US,True,strict,Private room,2004,$212 ,$42 ,4,3.0,12/28/2016,0.09,4,12,365,#NAME?,
50135601,Spacious one bedroom in Union Sq/Greenwich Village,94597371256,unconfirmed,Andrew,Manhattan,Greenwich Village,40.73506,-73.99203,United States,US,False,moderate,Entire home/apt,2017,"$1,100 ",$220 ,2,5.0,1/1/2017,0.15,3,1,0,"Be kind, courteous, just as how you would want to be treated. No overnight guests or loud noises at night as it is a building full of young professionals.",
50136153,Cozy Clean Room in Manhattan's Upper West Side,53790211236,unconfirmed,Angela,Manhattan,Upper West Side,40.795120000000004,-73.9733,United States,US,True,flexible,Private room,2016,$849 ,$170 ,2,45.0,5/24/2019,1.36,4,1,83,"For instant book, only 4 or less guests. Otherwise send me a message, and we can chat about it. Smoking allowed on balcony or roof deck.",
50136706,Charming pre-war near Central Park,52181089030,verified,Maimouna,Manhattan,Harlem,40.79992,-73.95501999999999,United States,US,False,moderate,Entire home/apt,2017,$838 ,$168 ,30,14.0,5/31/2019,0.76,5,1,50,,
50137258,Full size bed with drawer space!,43298110173,unconfirmed,Alyssa Faye,Manhattan,Harlem,40.820879999999995,-73.93879,United States,US,True,flexible,Private room,2018,$526 ,$105 ,1,0.0,,,1,1,0,"No pets, no smoking, no more than 6 guests. We welcome families traveling for pleasure.  No corporate customers. 2 nights minimum.",
50137810,"Private! entire studio, private bath, own entrance",54377075953,verified,Walter,Brooklyn,Bushwick,40.69555,-73.93069,United States,US,False,moderate,Entire home/apt,2006,$886 ,$177 ,1,81.0,7/3/2019,2.42,4,4,193,"No smoking in apartment, in building or within 50 feet of entrance.  No pets.  Quiet and respectful of our neighbors.",
50138362,Minimalistic 1 bedroom in the heart of Manhattan,45794791190,verified,D&N,Manhattan,Two Bridges,40.712309999999995,-73.99257,United States,US,True,flexible,Entire home/apt,2016,$737 ,$147 ,3,137.0,6/20/2019,4.07,5,1,154,"Ideally a person that is respectful of my home , non smokers and no parties",
50138915,new sunshine room in chinatown train F is around,15217294414,verified,Na,Manhattan,Chinatown,40.7135,-73.99121,United States,US,True,flexible,Private room,2016,$51 ,$10 ,1,318.0,6/19/2019,9.39,4,1,51,,
50139467,Cozy 4 Bedroom's Times Square Apartment!,51312659401,verified,Patrick,Manhattan,Theater District,40.76093,-73.98326999999999,United States,US,True,moderate,Private room,2017,$718 ,$144 ,3,0.0,,,2,1,179,"No smoking. Please do not use the fireplace. The porch is a lot fo fun, but make sure to keep Volume down after 11pm as neighbors can hear everything.",
50140019,Versatile private room in Harlem/Hamilton Heights!,14652633876,unconfirmed,Edward,Manhattan,Harlem,40.82377,-73.94981,United States,US,True,flexible,Private room,2013,$398 ,$80 ,4,42.0,6/18/2019,1.34,5,1,10,No Smoking.,
50140572,Spacious 2 Bedroom NYC Apt with River Views!,88500743310,verified,Kara,Manhattan,Hell's Kitchen,40.76027,-73.99826,United States,US,True,strict,Entire home/apt,2020,$406 ,$81 ,30,0.0,,,5,121,365,,
50141124,Bluebird Hell's Kitchen Studio Apartment + Spa!!!,87593455959,verified,Bluebird,Manhattan,Hell's Kitchen,40.762209999999996,-73.99795,United States,US,False,strict,Entire home/apt,2003,$694 ,$139 ,30,0.0,,,1,18,365,NO Smoking. Pets allow -- Breed Restrictions Apply.,
50141676,Bluebird Hell's Kitchen 1-BR + Full Service Spa!,38234651573,unconfirmed,Bluebird,Manhattan,Hell's Kitchen,40.76115,-73.99823,United States,US,False,moderate,Entire home/apt,2014,$740 ,$148 ,30,0.0,,,2,18,146,No Smoking,
50142229,Bluebird Lavish 1-BR Apt 1 Mile from Times Square!,36981148303,unconfirmed,Bluebird,Manhattan,Hell's Kitchen,40.7619,-73.99819000000001,United States,US,True,strict,Entire home/apt,2008,"$1,178 ",$236 ,30,0.0,,,4,18,365,,
50142781,Bluebird Hells Kitchen 2-BR Apt + Full Service Spa,41078109043,verified,Bluebird,Manhattan,Hell's Kitchen,40.76075,-73.99893,United States,US,False,strict,Entire home/apt,2017,"$1,136 ",$227 ,30,0.0,,,2,18,365,,
50143333,Bluebird Lavish 2-BR Apt Within Mile of Times Sq.,98059124807,verified,Bluebird,Manhattan,Hell's Kitchen,40.7602,-73.998,United States,US,True,strict,Entire home/apt,2020,$884 ,$177 ,30,0.0,,,2,18,185,"No smoking, pets or permitted",
50143885,Bedroom w/ Gorgeous Tree Lined and River View,45037353214,unconfirmed,Andrea,Manhattan,Washington Heights,40.8337,-73.9458,United States,US,True,flexible,Private room,2014,$467 ,$93 ,10,5.0,5/12/2019,0.16,3,1,44,,
50144438,2 Bedroom in the heart of Williamsburg,31262661438,verified,Nina,Brooklyn,Williamsburg,40.71958,-73.96123,United States,US,True,strict,Entire home/apt,2004,$304 ,$61 ,2,19.0,6/30/2019,0.58,4,1,179,,
50144990,Bluebird Deluxe 1-BR Apartment Near Central Park!,50938662861,unconfirmed,Bluebird,Manhattan,Midtown,40.76574,-73.98188,United States,US,False,strict,Entire home/apt,2003,$598 ,$120 ,30,0.0,,,5,18,316,,
50145542,#Bluebird Elegant 1-BR Apartment Near Times Square,43564280145,unconfirmed,Bluebird,Manhattan,Midtown,40.7671,-73.98148,United States,US,False,moderate,Entire home/apt,2003,$872 ,$174 ,30,0.0,,,1,18,364,,
50146095,Bluebird Deluxe 2-BR Apartment Near Central Park!,833356248,unconfirmed,Bluebird,Manhattan,Hell's Kitchen,40.767140000000005,-73.9834,United States,US,True,moderate,Entire home/apt,2014,$153 ,$31 ,30,0.0,,,2,18,333,,
50146647,#BBS 2-BR Apartment Near Times Square *Specials*,13746792531,verified,Bluebird,Manhattan,Midtown,40.76487,-73.98238,United States,US,False,strict,Entire home/apt,2012,$683 ,$137 ,30,0.0,,,5,18,364,No Smoking.  No Pets.,
50147199,Luxury One Bedroom,97279506809,unconfirmed,Olivier,Manhattan,Upper West Side,40.77727,-73.98453,United States,US,False,moderate,Entire home/apt,2018,"$1,008 ",$202 ,30,9.0,2/9/2019,0.28,2,2,139,"1. Please keep a quiet environment 2. I want friendly guests. Please be friendly to each other or other tenants and help me to manage situations easily.  3. No smoking in the room; smoking should be outside of the building 4. No pets 5. Fire pre-cauction by using kitchen; If cooking food, leaving kitchen with interruption should be less than one minute. There was a tenant in 6 weeks, cooking food and leaving kitchen for more than 30 minutes and forgot to turn off switch 3 times. One year it will have 25 times forgoting to turn off fire switch. Two tenants will be 50 times in one year. It will cause fire. This behavior is not acceptable. To cook food without a person in the kitchen is not acceptable. 6. Becareful of clots in the pipe for bathroom and kitchen. Don't remove the bathroom filter when taking shower. Flush the toilet by holding the switch for 4-5 seconds for full flush. You may flush the toilet first; when there is no clots, you can use. Please don't dump food in the kitchen ",
50147752,"LES ‘GEM’ - 1BR APARTMENT, GREAT LOCATION, STOCKED",73568098779,unconfirmed,Stewart,Manhattan,Lower East Side,40.72195,-73.98698,United States,US,True,flexible,Entire home/apt,2019,$138 ,$28 ,2,15.0,5/20/2019,0.48,2,1,17,No Smoking.  No Pets.,
50148304,Nice private room in hip and trendy Brooklyn,48841273192,verified,Carla,Brooklyn,Bushwick,40.68687,-73.91564,United States,US,True,flexible,Private room,2022,$782 ,$156 ,2,21.0,7/15/2018,0.63,3,1,185,NO Smoking.  Pets permitted with fee.,
50148856,Peaceful Private Room in Brooklyn,57873090022,unconfirmed,Stephany,Brooklyn,Bushwick,40.6883,-73.90596,United States,US,True,moderate,Private room,2020,"$1,130 ",$226 ,2,104.0,6/9/2019,3.09,1,4,174,No smoking and no pets.,
50149408,Room for rent,98059093466,unconfirmed,Mario,Manhattan,East Harlem,40.79655,-73.93848,United States,US,False,moderate,Private room,2015,$485 ,$97 ,3,54.0,7/7/2019,1.61,4,2,271,NO Smoking. Pets allowed with non-refundable pet fee.,
50149961,Wonderful Room in South Harlem near Central Park,70103357204,verified,Heroni,Manhattan,Harlem,40.8014,-73.95793,United States,US,True,strict,Private room,2003,"$1,049 ",$210 ,2,12.0,5/28/2017,0.36,3,1,0,No Smoking,
50150513,Lovely&Morden bedroom near everything you want!,60425366588,verified,Yukee,Manhattan,Upper West Side,40.80039,-73.96724,United States,US,False,flexible,Private room,2011,$605 ,$121 ,1,56.0,4/19/2019,1.83,2,6,326,No Smoking,
50151065,Charming 1 Bedroom Garden Apt,30420252509,unconfirmed,Aitan,Brooklyn,Prospect Heights,40.67688,-73.96735,United States,US,False,strict,Entire home/apt,2013,$743 ,$149 ,3,109.0,6/23/2019,3.25,1,1,269,,
50151618,Sun-lit room w/in steps of best of Williamsburg,46573308292,verified,Nathan,Brooklyn,Williamsburg,40.71145,-73.95886999999999,United States,US,False,flexible,Private room,2018,$475 ,$95 ,3,9.0,10/27/2017,0.27,3,1,0,,
50152170,Spacious quiet second floor brownstone apartment,14753330559,verified,Nicola,Brooklyn,Carroll Gardens,40.680479999999996,-73.99322,United States,US,False,flexible,Entire home/apt,2007,$555 ,$111 ,4,8.0,9/8/2018,0.24,1,1,0,,
50152722,Gorgeous 2 Bedroom apartment /Upper East side,11985767903,unconfirmed,Cristina,Manhattan,Upper East Side,40.77341,-73.95025,United States,US,False,moderate,Entire home/apt,2009,$960 ,$192 ,1,16.0,6/23/2019,0.51,1,1,110,,
50153275,"East Brodway in Lower East Side, quiete and cute!",20902439210,unconfirmed,Paolo,Manhattan,Chinatown,40.71333,-73.9916,United States,US,True,flexible,Private room,2017,"$1,002 ",$200 ,30,1.0,12/16/2016,0.03,1,1,359,"Thank you for your reservation. By placing your reservation online you indicated that you accepted the terms and conditions which have been printed below.  Please review your reservation summary as below - then print, sign and return the agreement to:  (EMAIL HIDDEN) or fax it to (PHONE NUMBER HIDDEN) or  mail it to: Spare Suite, Inc., 119 Braintree Street, Suite 510, Boston, MA 02134, USA Upon receipt, we will send you the welcome document with check in instructions and how to get your keys. ------------------------------------------------------------------------ ------------------------------------------------------------------------ Terms of the Agreement: BOOKING AND REFUND POLICY Once booked your reservation is guaranteed for the check in and check out times and dates specified. All reservations must be paid in advance, in full for the entire period of stay.  All reservations are final, and NON REFUNDABLE UNDER ANY CIRCUMSTANCES.  If you feel you may need to cancel once booked, yo",
50153827,Luxurious Guestroom w/Private Bathroom & Entrance,53358475688,verified,Christine,Brooklyn,Prospect-Lefferts Gardens,40.65985,-73.95725,United States,US,False,flexible,Private room,2019,$248 ,$50 ,2,27.0,5/9/2019,0.88,2,1,136,"Sorry, no smoking and no pets.",
50154379,Bright Loft Room in a Charming Brooklyn Apartment,35184490682,unconfirmed,Aracelis,Brooklyn,Williamsburg,40.713809999999995,-73.93903,United States,US,True,strict,Private room,2004,$799 ,$160 ,1,31.0,6/30/2019,0.93,2,3,279,"No smoking, pets, overnight guests or loud noise.",
50154931,"Huge Private Bedroom, Patio, + 20min to Midtown",92165138443,verified,Brian & Jonathan,Manhattan,Harlem,40.83014,-73.94655999999999,United States,US,False,strict,Private room,2009,$791 ,$158 ,3,49.0,6/3/2019,1.51,2,2,203,• Check-in time is 3PM.,
50155484,Luxury bedroom - Nomad Chelsea area,94650939577,unconfirmed,Andy,Manhattan,Chelsea,40.743809999999996,-73.9923,United States,US,False,flexible,Entire home/apt,2012,$525 ,$105 ,30,2.0,10/22/2016,0.06,4,1,0,,
50156036,Huge 1BR Luxury Apartment in Williamsburg,50554188809,unconfirmed,Peter,Brooklyn,Williamsburg,40.71113,-73.95296,United States,US,True,flexible,Entire home/apt,2006,$504 ,$101 ,2,6.0,1/1/2017,0.18,3,1,0,"Please be respectful of everything in our apartment. This is our primary residence, so please treat our home like it were your own! Thank you!",
50156588,Spacious & Bright Midtown 1 Bedroom -Elevator Bldg,37694846937,verified,Matthew,Manhattan,Midtown,40.75723,-73.96313,United States,US,False,moderate,Entire home/apt,2006,$334 ,$67 ,2,10.0,8/29/2018,0.31,1,1,0,,
50157141,Private room with private bathroom,45784489672,verified,Amanda,Brooklyn,Greenpoint,40.723420000000004,-73.94838,United States,US,False,moderate,Private room,2021,$388 ,$78 ,2,38.0,6/23/2019,1.13,5,1,89,,
50157693,"Newly Renovated, Bright 1 BR in Central Manhattan",58200878372,verified,Rebecca,Manhattan,Kips Bay,40.74089,-73.98094,United States,US,True,moderate,Entire home/apt,2005,$80 ,$16 ,3,20.0,9/17/2018,0.61,2,1,0,"-No smoking -No local guests -If you use the kitchen, please clean up after yourself. -I will leave maps/guides for your reference, but please do not remove anything from my home. -If you have any questions, please call or text me (phone number hidden). -Most importantly, enjoy yourself!",
50158245,Cozy Brooklyn Room,87893565099,unconfirmed,Johari,Brooklyn,Bedford-Stuyvesant,40.68137,-73.91359,United States,US,False,strict,Private room,2008,"$1,098 ",$220 ,30,5.0,10/14/2018,0.15,2,4,0,"House Rules 1. Check-in is 4 pm local time. If the unit is ready earlier, we’ll let you know. Check-out is normally 11 am local time, but we’d be happy to extend it as long as we don’t have a cleaning scheduled. Just let us know.  2. All bookings require a security deposit of at least $300, which will be refunded within 7 days of your check-out. 3. For security measures we require all guests to provide proof of identification through ID verification on our own website. In order to check in we'll need a photo of your ID.  4. Our cancellation policy is as shown on our ad and defined by the site you are booking through.  5. Don’t let $300 go up in smoke. There's no smoking allowed in any Flatbook and a $300 fine for breaking this rule.  6. Unfortunately we don’t allow pets in any of our apartments. 7. Unless you’re staying in one of our specialty apartments, we don’t allow parties or excessive noise. 8. If we find the place very messy, we have to charge an extra $40 for every extra hour o",
50158798,Amazing & Clean NYC Private Room by #1 Train,70991898384,unconfirmed,Jovanni & Natasha,Bronx,North Riverdale,40.90175,-73.89761,United States,US,True,strict,Private room,2006,$919 ,$184 ,2,9.0,4/30/2017,0.29,4,2,0,"Please Note: This unit was just renovated last year and it comfortably accommodates 4 guests, but up to 5 guests are permitted if you so desire (two guests in each bedroom and 1 guest on the available twin size air mattress). Please request an air mattress (if needed) when making a reservation. No smoking, no pets, no parties, and must be 25 years old to book.   For check-out, please ensure: -  All plates and cups are left in the sink or dishwasher -  All trash is left in the kitchen trash can or bagged and left next to the trash can (additional bags are under the sink) -  All windows are closed and locked -  If used, the air mattresses are deflated and put away (please leave used linens for the air mattresses on the floor) -  If furniture was moved during your stay, please return to its original location Please be mindful to our neighbors in the building; quiet hours after 10pm. Please be considerate of our next guests who will be staying after you, if something is broken or needs fix",
50159350,Luxury 2BR Penthouse in the hearth of Soho (Nyc),54556540174,unconfirmed,Gaia&Pietro,Manhattan,SoHo,40.72575,-74.00128000000001,United States,US,True,flexible,Entire home/apt,2005,"$1,029 ",$206 ,3,32.0,6/24/2019,1.04,5,1,262,No smoking. No parties. Respectful of property :),
50159902,Private Room with a patio in Park Slope Brooklyn,83027456901,verified,Phines,Brooklyn,Sunset Park,40.66198,-73.98964000000001,United States,US,True,flexible,Private room,2015,$822 ,$164 ,2,0.0,,,5,1,0,No Smoking  No Pets,
50160454,Sunny Studio in Midtown Manhattan,66178916156,unconfirmed,Christiane,Manhattan,Kips Bay,40.745329999999996,-73.9772,United States,US,False,moderate,Entire home/apt,2004,$183 ,$37 ,2,5.0,5/28/2018,0.19,2,1,0,"House Rules 1. Check-in is 4 pm local time. If the unit is ready earlier, we’ll let you know. Check-out is normally 11 am local time, but we’d be happy to extend it as long as we don’t have a cleaning scheduled. Just let us know.  2. All bookings require a security deposit of at least $300, which will be refunded within 7 days of your check-out. 3. For security measures we require all guests to provide proof of identification through ID verification on our own website. In order to check in we'll need a photo of your ID.  4. Our cancellation policy is as shown on our ad and defined by the site you are booking through.  5. Don’t let $300 go up in smoke. There's no smoking allowed in any Flatbook and a $300 fine for breaking this rule.  6. Unfortunately we don’t allow pets in any of our apartments. 7. Unless you’re staying in one of our specialty apartments, we don’t allow parties or excessive noise. 8. If we find the place very messy, we have to charge an extra $40 for every extra hour o",
50161007,THE PRIVACY DEN ~ 5 MINUTES TO JFK,79093334151,verified,Miss Dy,Queens,Springfield Gardens,40.66735,-73.76647,United States,US,True,strict,Entire home/apt,2010,"$1,071 ",$214 ,1,434.0,6/19/2019,12.84,3,1,102,No Smoking  No Pets,
50161559,The Manhattan Club in the heart of midtown!!!!,25154200697,verified,Endless Resort Options,Manhattan,Midtown,40.76382,-73.98007,United States,US,True,strict,Entire home/apt,2007,$723 ,$145 ,4,0.0,,,1,1,124,No Smoking  No Pets,
50162111,Borough Park/Kensington 3 room Apartment,61203998661,verified,Chaim,Brooklyn,Borough Park,40.63561,-73.97961,United States,US,False,strict,Entire home/apt,2007,$911 ,$182 ,7,1.0,4/18/2017,0.04,4,1,0,No Smoking  No Pets,
50162664,Private room in charming Brooklyn Apartment,49829168643,verified,Fely,Brooklyn,Crown Heights,40.67642,-73.961,United States,US,True,strict,Private room,2017,$734 ,$147 ,2,3.0,11/28/2016,0.09,1,2,0,"Please Note: This unit was just renovated last year and it comfortably accommodates 6 guests, but up to 7 guests are permitted if you so desire (two guests in each bedroom and 1 or 2 guests on the available queen size air mattress). Please request an air mattress (if needed) when making a reservation. No smoking, no pets, no parties, and must be 25 years old to book.   For check-out, please ensure: -  All plates and cups are left in the sink or dishwasher -  All trash is left in the kitchen trash can or bagged and left next to the trash can (additional bags are under the sink) -  All windows are closed and locked -  If used, the air mattresses are deflated and put away (please leave used linens for the air mattresses on the floor) -  If furniture was moved during your stay, please return to its original location Please be mindful to our neighbors in the building; quiet hours after 10pm. Please be considerate of our next guests who will be staying after you, if something is broken or ne",
