44313254,"Huge Comfy Studio with Private Bath, Near Metro",63858980681,unconfirmed,Felix,Bronx,Kingsbridge,40.87924,-73.89791,United States,US,True,moderate,Entire home/apt,2012,$324 ,$65 ,3,114.0,6/16/2019,4.0,1.0,4.0,63,"- Non-smoker only - Cologne/perfumed sprays not allowed - Cat in the house - Do not share mailing address with anyone, and if you do it, you will pay $200 - Please take off street shoes and place them on the rack - Slippers can be provided but please bring your own if you can - Recycle all trash, we will help you to understand it - Food may not be left in your room - No eating in bed - No disturbance: please walk slowly when using stairs and very softly close all doors",
44313807,Large Studio one block from Times Square,72101835894,verified,Vaki,Manhattan,Theater District,40.75951,-73.98796,United States,US,True,flexible,Private room,2020,$163 ,$33 ,1,9.0,12/16/2018,0.31,3.0,1.0,9,#NAME?,
44314359,Newly renovated modern Apt in heart of Astoria NY,67331428940,unconfirmed,Charlie,Queens,Astoria,40.76773,-73.91701,United States,US,True,moderate,Entire home/apt,2022,$465 ,$93 ,4,12.0,6/24/2019,0.47,1.0,1.0,42,No smoking and no party allowed. We don't want the neighbor to complain.,
44314911,Sunny room in a shared appartement in Bushwick,35547932056,unconfirmed,Do,Brooklyn,Bushwick,40.70657,-73.92181,United States,US,True,strict,Private room,2021,$974 ,$195 ,5,1.0,8/27/2017,0.04,3.0,1.0,0,,
44315464,"Sunny, Beautiful, Comforting Greenpoint Apartment",26440279712,verified,Danielle,Brooklyn,Greenpoint,40.7244,-73.93913,United States,US,True,moderate,Private room,2017,$806 ,$161 ,5,6.0,10/24/2018,0.28,4.0,1.0,87,"No smoking inside the house.  No loud parties or disturbing the peace or public nuisance allowed. This is a strictly residential rental NOT commercial.  If holding parties you must first seek owner's permission before inviting anyone other than immediate family.   This is a peaceful family neighborhood and I like to keep it that way.  Clean after yourself, clean the stove and oven and all the appliances.  Leave everything exactly in the condition it is in when you first arrived.  Treat this house as if it is your own with the proper respect and courtesy.  No pets allowed.  Check in is 4PM, Check out 10AM.  On Check out date please leave all the dirty sheets, towels, linens by the washer for the maid.  Please leave the outside trash container for the garbage truck on the night before it arrives.",
44316016,Peaceful room in hip BK area 15 min to Manhattan,44622142679,verified,Cleo,Brooklyn,Bedford-Stuyvesant,40.68869,-73.9231,United States,US,False,moderate,Private room,2017,$300 ,$60 ,1,10.0,6/27/2019,0.35,1.0,1.0,173,"Non-smoker, no smoking in/out of home No cologne/perfume/sprays. Scent-free house Microwave for light use (not cooking) Respect quiet environment No visitors at any time, one room per person Remove outdoor shoes by the entrance inside, slippers available if you need Ask permission before giving this address to anyone Mailing address may only be used only for personal post (family, friends) No bank, no school, no memberships of any kind, no subscriptions If you break this rule, first charge is $200, and after that,  Each commercial letter that arrives after you depart will be charged $5 life time",
44316568,Perfectly Central Upper West Side location,55371388599,unconfirmed,Eitan,Manhattan,Upper West Side,40.79241,-73.97261999999999,United States,US,True,flexible,Private room,2020,$788 ,$158 ,1,39.0,7/26/2018,1.39,3.0,1.0,0,,
44317120,Cosy LES/Chinatown private room,83246252019,unconfirmed,Amy,Manhattan,Lower East Side,40.71974,-73.99263,United States,US,True,strict,Private room,2012,"$1,185 ",$237 ,7,0.0,,,4.0,1.0,0,,
44317673,"1 Bedroom in nice, clean LES apartment",97715378713,verified,Gaurav,Manhattan,Lower East Side,40.71873,-73.99073,United States,US,True,flexible,Private room,2018,"$1,105 ",$221 ,1,3.0,9/27/2017,0.13,3.0,1.0,0,1) No Smoking in property!!!  2) Do not slam doors!!! Close lightly Please!!! 3) No Shoes in house (except slippers) 4) Quiet down AFTER 10PM.,
44318225,Large 2 bdrm loft with outdoor space + trains,86232074274,verified,Claire,Brooklyn,Boerum Hill,40.685829999999996,-73.98267,United States,US,True,moderate,Entire home/apt,2016,$988 ,$198 ,2,23.0,6/23/2019,0.78,5.0,1.0,3,,
44318777,The ❤️ of SoHo: Adorable 2 br // event space,38384199959,unconfirmed,Milly,Manhattan,SoHo,40.7255,-74.00258000000001,United States,US,True,moderate,Entire home/apt,2004,$905 ,$181 ,1,61.0,7/1/2019,2.04,2.0,1.0,173,,
44319330,Bright and Spacious East Village Loft,9296166321,unconfirmed,J,Manhattan,East Village,40.72977,-73.98841,United States,US,True,moderate,Entire home/apt,2020,$988 ,$198 ,3,85.0,6/24/2019,2.87,5.0,1.0,208,#NAME?,
44319882,Private East Village Bedroom &Roof Deck(manhattan),9613362305,unconfirmed,Joe,Manhattan,East Village,40.72951,-73.98239000000001,United States,US,True,flexible,Private room,2013,$922 ,$184 ,1,200.0,6/22/2019,6.79,3.0,3.0,272,,
44320434,Friendly and well located place to get away,29494582436,unconfirmed,Tristan,Brooklyn,Park Slope,40.6675,-73.97694,United States,US,False,strict,Entire home/apt,2022,$806 ,$161 ,1,5.0,4/10/2018,0.18,5.0,2.0,0,,
44320987,Beautiful Garden Apartment in Bed Stuy Brownstone,47961271992,unconfirmed,Cat,Brooklyn,Bedford-Stuyvesant,40.684979999999996,-73.92613,United States,US,True,flexible,Entire home/apt,2013,$405 ,$81 ,10,26.0,6/14/2019,0.97,1.0,1.0,12,,
44321539,Bedstuy Brownstone,50359430447,verified,Eric,Brooklyn,Bedford-Stuyvesant,40.681,-73.94707,United States,US,True,flexible,Entire home/apt,2010,$311 ,$62 ,3,5.0,6/23/2019,0.5,1.0,1.0,66,,
44322091,one-bedroom available in Murray Hill NYC,82858166490,unconfirmed,Dmitriy,Manhattan,Kips Bay,40.73948,-73.97643000000001,United States,US,True,strict,Private room,2017,$132 ,$26 ,1,0.0,,,5.0,1.0,0,,
44322643,Cozy Room near Columbia University,64843680759,unconfirmed,Tiara,Manhattan,Morningside Heights,40.80766,-73.96594,United States,US,True,flexible,Private room,2016,"$1,099 ",$220 ,30,7.0,7/10/2018,0.27,2.0,2.0,246,,
44323196,"Cozy 1br apartment, 25 min away from Manhattan",81659633547,verified,Raquel,Queens,Ditmars Steinway,40.77707,-73.91887,United States,US,False,moderate,Entire home/apt,2009,"$1,098 ",$220 ,5,14.0,1/5/2019,0.49,5.0,1.0,1,,
44323748,Clean! Quiet! Near train and park!,38340085937,unconfirmed,Kathryn,Brooklyn,Windsor Terrace,40.65998,-73.97811,United States,US,False,strict,Private room,2015,$170 ,$34 ,3,0.0,,,1.0,1.0,0,"Check in 3pm Check out 12pm (Flexible upon requests.) No smoking, No drug, No party in the house. I don't guarantee parking lot. Sorry",
44324300,West Village - 1 Bedroom,50777055002,verified,Laura,Manhattan,West Village,40.734590000000004,-74.00143,United States,US,False,strict,Entire home/apt,2013,$703 ,$141 ,2,1.0,2/20/2017,0.03,3.0,1.0,0,,
44324853,Glamorous Queen  room in the centre of EVERYTHING!,69418233296,verified,Bianca,Manhattan,Chinatown,40.71427,-73.99261,United States,US,False,strict,Private room,2018,$458 ,$92 ,1,49.0,6/30/2019,1.86,5.0,3.0,111,Please do not smoke and be respectful of other guests.,
44325405,Cozy Private Room,39356370272,unconfirmed,Nicauris,Manhattan,Washington Heights,40.84194,-73.94203,United States,US,True,moderate,Private room,2017,$83 ,$17 ,30,16.0,1/6/2019,0.59,5.0,3.0,237,,
44325957,Charming 5 Bedroom House in Forest Hills NY,93896572656,verified,Maayan,Queens,Forest Hills,40.71848,-73.85025,United States,US,False,flexible,Entire home/apt,2008,$304 ,$61 ,2,9.0,12/29/2018,0.37,4.0,2.0,4,,
44326510,Charming Park Slope Apt (fits up to 6 ppl)!,68201127085,unconfirmed,Julia,Brooklyn,Windsor Terrace,40.66063,-73.98348,United States,US,True,moderate,Entire home/apt,2004,$765 ,$153 ,3,0.0,,,3.0,1.0,0,"Please treat my place as your own. Turn off the lights, AC, fan, etc when you leave the apartment, and wash any kitchenware and dishes that you've used. Put used towels on the floor, so that I now they've been used.",
44327062,Studio with amazing view,57626131298,unconfirmed,Carolann,Manhattan,Financial District,40.70588,-74.0159,United States,US,False,moderate,Entire home/apt,2010,$201 ,$40 ,300,0.0,,,2.0,1.0,0,,
44327614,Private apartment in new Brooklyn building!,75125473377,verified,Steven & Melissa,Brooklyn,Bedford-Stuyvesant,40.68438,-73.95299,United States,US,True,flexible,Entire home/apt,2019,$132 ,$26 ,2,33.0,5/22/2019,1.21,4.0,1.0,80,"- Non-smoker - No perfume/cologne use - Microwave for light use, not cooking - Very light and fast food prep - Mailing address not to be shared with anyone but family and friends - Take is seriously: If  any of yours not personal mail comes to this mail box, you will be charged $200 and $5 for each letter after that indefinitely - Guest agrees not to write reviews for areas not on amenities list",
44328166,UES(mini loft)Clean flex room (Female Only),23029035331,verified,Eun M,Manhattan,Upper East Side,40.777590000000004,-73.95321,United States,US,True,strict,Private room,2022,$940 ,$188 ,1,133.0,6/19/2019,4.52,2.0,1.0,43,No smoking. Please respect our neighbors.,
44328719,Luxury Loft in Williamsburg,41946712416,verified,Aaron,Brooklyn,Williamsburg,40.71218,-73.96048,United States,US,False,moderate,Entire home/apt,2020,"$1,020 ",$204 ,3,8.0,8/26/2018,0.3,3.0,1.0,0,#NAME?,
44329271,"Great 1 BR- Q train, Museum Mile and Central Park!",30692674312,verified,Christina,Manhattan,Upper East Side,40.768679999999996,-73.95744,United States,US,True,moderate,Entire home/apt,2014,$448 ,$90 ,5,22.0,7/2/2019,1.27,3.0,1.0,7,,
44329823,Cozy yellow room,48035730258,verified,Hali,Queens,Astoria,40.76964,-73.91559000000001,United States,US,True,flexible,Private room,2018,$699 ,$140 ,1,14.0,3/13/2018,0.5,5.0,1.0,0,Let's talk to get to know each other !,
44330376,Private room in a 3BR in Park Slope,29422584603,verified,David,Brooklyn,Park Slope,40.68203,-73.97834,United States,US,True,strict,Private room,2009,$868 ,$174 ,4,0.0,,,4.0,1.0,0,Female first please. Please keep the space quiet and clean.,
44330928,QUIET SUNNY PRIVATE ROOM M&L TRAIN,87461311537,verified,Simon,Brooklyn,Bushwick,40.700790000000005,-73.91847,United States,US,True,moderate,Private room,2021,$523 ,$105 ,1,9.0,10/4/2017,0.35,2.0,1.0,0,"Non-smokers, no smoking in or out of home No perfume/cologne use, no other sprays  Deodorant/antiperspirant is OK but not sprays  Recycling, reusable shopping bags No mailing address sharing: first offense $200, and $5 per letter after that LIFE TIME Please don't use ""single use disposable"" plastic bags Mailing address MAY NOT be shared with anyone accept delivery. Reusable foldeable shopping bag (provided, and you may take it with you) Plates, cup, utensils are only in space between refrigerator and sink Please don't keep dirty dishes in your room, but if you must, tide them in plastic bag (green kind, find in bathroom basket) Please keep your room at least reasonably tidy Host may enter the room to collect the trash or fix things if needed All your things are safe in your room Take off street shoes when indoor Washed slippers provided if you don't have your own  Please be respectful, considered, and aware what is left behind you when you are in common areas, and how it will impact th",
44331480,Cozy bedroom in Bushwick Brooklyn!,68991428004,verified,Rebecca,Brooklyn,Bushwick,40.6978,-73.91677,United States,US,False,moderate,Private room,2005,$107 ,$21 ,3,34.0,10/20/2017,1.16,2.0,1.0,0,"This is an old house which was built in the 1900s, and may not be sparkingly clean and modern, but we appreciate it if you can clean after yourself, and put things back to where they belong. Garbage day is on Friday, you can simply put your trash into the dumpster and we'll take care of the rest. Please be respectful to other tenants on the second floor. Thank you.",
44332033,Bay Ridge Apt,57940953167,unconfirmed,Luis,Brooklyn,Bay Ridge,40.62158,-74.02394,United States,US,False,moderate,Entire home/apt,2021,$892 ,$178 ,2,35.0,6/19/2019,1.17,3.0,1.0,325,,
44332585,Entire 3rd Floor of Brooklyn brownstone,64626200064,unconfirmed,Autumn,Brooklyn,South Slope,40.66398,-73.99041,United States,US,False,moderate,Entire home/apt,2013,$846 ,$169 ,3,4.0,11/25/2018,0.14,2.0,1.0,0,1) No Smoking in property!!!  2) Do not slam doors!!! Close lightly Please!!! 3) No Shoes in house (except slippers) 4) Quiet down AFTER 10PM.,
44333137,Budget Friendly Place WIFi AC Parking Comfy Bed,23793677710,verified,Andrew,Brooklyn,Greenpoint,40.72155,-73.94414,United States,US,False,strict,Private room,2009,"$1,058 ",$212 ,2,155.0,6/30/2019,5.2,5.0,2.0,60,House rules will be provided upon booking.,
44333689,High End Hand Crafted Manhattan Two Bedroom Beauty,73239183411,unconfirmed,Tyreik,Manhattan,Harlem,40.82793,-73.94349,United States,US,True,strict,Private room,2018,$530 ,$106 ,5,8.0,11/3/2018,0.29,2.0,1.0,0,Respectful of the apartment,
44334242,*New 4 bedrooms 2 Bath Home 15 mins to manhattan!,85784480550,unconfirmed,Joling,Brooklyn,Bushwick,40.69735,-73.9327,United States,US,False,flexible,Entire home/apt,2005,"$1,027 ",$205 ,3,84.0,6/23/2019,2.95,5.0,1.0,237,"Please treat it like your own place and leave it the way you found it! Please clean up prior to leaving.  No smoking indoors, no late night parties.",
44334794,Ladies Only: Spacious Shared Apt,96425496174,unconfirmed,Angela,Manhattan,Kips Bay,40.74261,-73.98102,United States,US,True,flexible,Shared room,2015,"$1,024 ",$205 ,1,11.0,3/17/2019,0.39,3.0,2.0,304,#NAME?,
44335346,"Newly renovated, large room. Right by trains!",29794737205,verified,Delphina,Brooklyn,Crown Heights,40.669259999999994,-73.93211,United States,US,True,moderate,Private room,2003,$958 ,$192 ,1,13.0,5/1/2017,0.44,4.0,2.0,0,"-Our one golden rule is: Please treat our space with respect (i.e. Clean up after yourself, be sure to lock the door when you leave, etc.)  -Absolutely NO SMOKING!!!! -We are fun-loving people, so we dont mind you having some friends over, but the above rule applies twofold in that scenario. -You're welcome to use dishes, appliances, etc in the kitchen, but we ask that you buy your own food/drinks rather than use ours. -No pets allowed (not our rule, our landlord's) -Upon checkout, please turn A/C units and lights off before leaving. -Feel free to ask us about the area-- we know it well and love to recommend!",
44335899,Large *COZY* Private Bedroom near Yankee Stadium,32329899255,unconfirmed,Melissa,Bronx,Concourse Village,40.82692,-73.92183,United States,US,True,moderate,Private room,2008,$424 ,$85 ,5,46.0,6/2/2019,1.55,4.0,1.0,174,"Please note that we are a no smoking environment, and pets are only accepted in certain room types that have direct access to the outside. Please call ahead to make arrangements.",
44336451,Cute studio close to Penn Station and Times Square,82418709361,unconfirmed,Estrellita,Manhattan,Chelsea,40.75166,-73.99506,United States,US,True,strict,Entire home/apt,2017,"$1,114 ",$223 ,19,0.0,,,1.0,1.0,0,"Please note that we are a no smoking environment, and pets are only accepted in certain room types that have direct access to the outside. Please call ahead to make arrangements. ",
44337003,"Queen size bed, private bathroom, great location",86046734821,verified,Axel,Brooklyn,Flatbush,40.64918,-73.96656999999999,United States,US,False,moderate,Private room,2009,$350 ,$70 ,2,25.0,6/24/2019,0.95,4.0,2.0,68,"1.  No loud music. 2. No parties. 3. No removal of items from the apartment unless expressly allowed by the host. 4.  Security deposit shall be claimed in the event of the following:   a. Damaged or soiled sheets, to the extent that they require replacement     b. Theft of items kept on and about the premises.    c. Unreturned keys.    d. Damage to the apartment or any part or item within and without the premises.    e. The presence of pets in the apartment, due to intent or negligence on the part of the guest and their party.    d. The presence of illicit or illegal substances, or illicit or illegal activities, on or about the premises",
44337556,Room in the Heart of Williamsburg,96916312450,unconfirmed,Steven,Brooklyn,Williamsburg,40.7176,-73.95359,United States,US,False,moderate,Private room,2018,$207 ,$41 ,2,7.0,10/23/2017,0.24,3.0,1.0,0,,
44338108,Cozy with a private bathroom bklyn,44973091062,unconfirmed,Chadanut,Brooklyn,Kensington,40.64237,-73.98048,United States,US,True,moderate,Private room,2020,$504 ,$101 ,1,41.0,5/27/2019,1.41,1.0,11.0,22,,
44338660,The Cozy Cole room at Harlem Townhouse,92814564562,verified,René,Manhattan,Harlem,40.80934,-73.95071999999999,United States,US,True,flexible,Private room,2019,$88 ,$18 ,2,66.0,1/27/2019,2.24,4.0,4.0,6,"Please note that we are a no smoking environment, and pets are only accepted in certain room types that have direct access to the outside. Please call ahead to make arrangements. ",
44339212,Cute little room in a 3BR apt with shared bath.,36561358644,unconfirmed,Mireille,Brooklyn,Crown Heights,40.67138,-73.93679,United States,US,True,flexible,Private room,2009,$475 ,$95 ,1,21.0,6/25/2019,0.78,1.0,1.0,89,,
44339765,Beautiful 1br in Manhattan!,48841839102,verified,Kevin,Manhattan,Harlem,40.821670000000005,-73.94988000000001,United States,US,False,flexible,Entire home/apt,2003,$599 ,$120 ,6,5.0,7/23/2018,0.17,1.0,1.0,0,"- Please keep the house exactly like you found it. Please don't leave a mess. Please don't leave things dirty. - If you use the bathroom, clean or wipe things down (there will be a cloth to wipe off excess water, etc.) - If you use the kitchen, please clean dishes and wipe things down as well - No guest allowed - you can meet friends at other venues - Shoes off in the apartment - please leave by the door. If you would like please bring some slippers. - Please keep things quiet after 10pm - If you smoke, you must go outside! NO smoking inside! - If you cook, turn the fan on above the stove - If you watch TV, turn it off when you are done. - Please use your common sense, and if you are not sure, ask... - Remember, this is my house - so try to treat it with respect. - if the parking pass is not returned, you will be charged the full amount of the deposit",
44340317,Private Room Near Columbus Circle.,72743964403,verified,Matthew,Manhattan,Hell's Kitchen,40.76617,-73.98398,United States,US,True,strict,Private room,2013,$55 ,$11 ,3,2.0,10/7/2017,0.07,5.0,1.0,83,"Please treat my place as your own. Turn off the lights, AC, fan, etc when you leave the apartment, and wash any kitchenware and dishes that you've used. Put used towels on the floor, so that I now they've been used.",
44340869,Large private room w huge loft in Williamsburg,52291820536,unconfirmed,Lauren,Brooklyn,Williamsburg,40.71976,-73.96051999999999,United States,US,False,moderate,Private room,2007,$670 ,$134 ,2,3.0,5/19/2017,0.11,3.0,1.0,0,- Please be respectful and polite to neighbors. There are downstairs tenants so please don't be noisy after 11pm. - Please turn off any lights and adjust down the thermostat to 55 before you depart or please turn off the AC window units/fans - Return keys to lockbox at end of stay. (There is a fee of $50 for each set of lost keys) - No animals - No smoking in the house (there is a backyard area) - Check in is at 4:00 pm (message for special requests) - Check out is at 12 noon,
44341422,Private Room In Clean Quiet Apt,12588147632,verified,Anthony,Manhattan,Harlem,40.8236,-73.93755,United States,US,False,moderate,Private room,2016,"$1,075 ",$215 ,2,70.0,8/1/2018,2.38,2.0,2.0,0,,
44341974,Classic Room in Vintage Loft,65988142503,verified,Ari,Brooklyn,Williamsburg,40.71586,-73.95395,United States,US,False,moderate,Private room,2006,$435 ,$87 ,2,9.0,4/4/2019,0.31,3.0,3.0,0,"House Rules 1. Check-in is 4 pm local time. If the unit is ready earlier, we’ll let you know. Check-out is normally 11 am local time, but we’d be happy to extend it as long as we don’t have a cleaning scheduled. Just let us know.  2. All bookings require a security deposit of at least $300, which will be refunded within 7 days of your check-out. 3. For security measures we require all guests to provide proof of identification through ID verification on our own website. In order to check in we'll need a photo of your ID.  4. Our cancellation policy is as shown on our ad and defined by the site you are booking through.  5. Don’t let $300 go up in smoke. There's no smoking allowed in any Flatbook and a $300 fine for breaking this rule.  6. Unfortunately we don’t allow pets in any of our apartments. 7. Unless you’re staying in one of our specialty apartments, we don’t allow parties or excessive noise. 8. If we find the place very messy, we have to charge an extra $40 for every extra hour o",
44342526,Artist Loft Bedroom,76757596868,unconfirmed,Gera & Werc,Brooklyn,Bushwick,40.70322,-73.92025,United States,US,False,flexible,Private room,2016,$756 ,$151 ,5,18.0,5/15/2019,0.77,3.0,1.0,66,,
44343079,"East Village, Cozy Room w/ Private Entrance & Bath",64759586737,unconfirmed,RoseAnne,Manhattan,Stuyvesant Town,40.73126,-73.98149000000001,United States,US,False,strict,Private room,2019,$601 ,$120 ,2,1.0,2/23/2017,0.03,1.0,1.0,0,"Please expect to share the apartment with guests having various backgrounds. Be respectful and decent, also enjoy interacting with each other. Please dress descent in the house especially in and out of the shower.",
44343631,Staten island home not far from ferry to manhattan,85124213615,unconfirmed,Gloria,Staten Island,Randall Manor,40.63552,-74.12125,United States,US,True,strict,Private room,2005,$137 ,$27 ,3,0.0,,,2.0,1.0,362,,
44344183,Large Bright Home on 2 floors perfect for families,29462589966,unconfirmed,May,Brooklyn,Bedford-Stuyvesant,40.693090000000005,-73.94986999999999,United States,US,False,flexible,Entire home/apt,2008,$737 ,$147 ,5,13.0,5/1/2019,0.48,4.0,1.0,0,,
44344735,*THE ROOM IS PRIVATE. HUNGRY FOR A KITCHEN ?*,18755162802,unconfirmed,Carlos,Queens,Elmhurst,40.74552,-73.88285,United States,US,False,flexible,Private room,2003,$107 ,$21 ,6,69.0,7/4/2019,2.44,4.0,5.0,253,,
44345288,"basic room, prime location, 30 day minimum",98439517558,unconfirmed,David,Manhattan,Upper West Side,40.78068,-73.9767,United States,US,True,flexible,Private room,2008,$257 ,$51 ,30,5.0,5/1/2019,0.18,1.0,10.0,341,,
44345840,Bright sunny manhattan getaway,39550357322,unconfirmed,Joshua,Manhattan,Washington Heights,40.83498,-73.94214000000001,United States,US,False,moderate,Private room,2009,$652 ,$130 ,2,0.0,,,4.0,1.0,0,,
44346392,Cute Room in Lower East Side!,78087026662,unconfirmed,Angie,Manhattan,Lower East Side,40.7128,-73.98909,United States,US,False,flexible,Private room,2008,$206 ,$41 ,1,121.0,6/23/2019,4.11,3.0,3.0,127,#NAME?,
44346945,Charming Bedroom in hip Lower East Side!,64209408800,unconfirmed,Angie,Manhattan,Lower East Side,40.71203,-73.99008,United States,US,False,strict,Private room,2009,$718 ,$144 ,1,125.0,6/26/2019,4.31,5.0,3.0,119,,
44347497,Cozy Manhattan Studio,95892962871,verified,Shain,Manhattan,Midtown,40.75784,-73.96088,United States,US,False,moderate,Entire home/apt,2009,$655 ,$131 ,14,8.0,1/5/2019,0.28,2.0,1.0,310,1) No Smoking in property!!!  2) Do not slam doors!!! Close lightly Please!!! 3) No Shoes in house (except slippers) 4) Quiet down AFTER 10PM.,
44348049,Gramercy / East Village Studio,70981307942,verified,Julia,Manhattan,Gramercy,40.73328,-73.98241,United States,US,False,flexible,Entire home/apt,2013,"$1,025 ",$205 ,8,33.0,7/1/2019,1.21,4.0,1.0,8,"We are looking for quiet and respectful guests given that we have neighbors with young children. As a result, I would ask to please keep noise levels in the house at a minimum between 9pm and 8am (you can still cook and watch TV, etc. just don't go around moving furniture :)",
44348602,"Charming, Light drenched Upper East Side studio",65500883492,unconfirmed,Jensine,Manhattan,Upper East Side,40.77565,-73.94919,United States,US,False,strict,Entire home/apt,2006,"$1,104 ",$221 ,2,4.0,6/2/2019,0.14,5.0,1.0,3,Please do not smoke. Be respectful of the other guests.,
44349154,Strawberry Fields Forever!,2527531772,verified,Katy,Manhattan,Upper West Side,40.77786,-73.98066,United States,US,False,strict,Entire home/apt,2014,"$1,129 ",$226 ,1,41.0,6/30/2019,1.39,3.0,1.0,8,,
44349706,1st Floor in New (2flr) Williamsburg Apartment,78286418466,verified,Jenn,Brooklyn,Williamsburg,40.7138,-73.96043,United States,US,False,moderate,Private room,2006,"$1,143 ",$229 ,13,14.0,5/5/2019,0.56,3.0,1.0,145,,
44350258,Big Room with Queen Bed&Comfy Couch,45104461414,verified,Liam,Queens,Elmhurst,40.741,-73.88019,United States,US,True,strict,Private room,2013,$142 ,$28 ,2,43.0,7/1/2019,1.5,4.0,1.0,90,,
44350811,Entire beautiful apartment-Astoria,62472055078,unconfirmed,Dioni,Queens,Ditmars Steinway,40.77319,-73.91686999999999,United States,US,True,moderate,Entire home/apt,2021,$678 ,$136 ,3,2.0,7/16/2018,0.07,1.0,2.0,200,"I respectfull ask that you treat my home as you would a friend's home.  My house rules are just common sense and courtesy. 1.  No loud music. 2. No parties. 3. No removal of items from the apartment unless expressly allowed by the host. 5.  Apartment door must be kept locked at all times.  4.  Security deposit shall be claimed in full in the event of any of the following:   a. Damaged or soiled sheets, to the extent that they require replacement.    b. Theft of items kept on and about the premises.    c. Unreturned keys.    d. Damage to the apartment or any part or item within and without the premises.    e. The presence of pets in the apartment, due to intent or negligence on the part of the guest and their party.    d. The presence of illicit or illegal substances, or illicit or illegal activities, on or about the premises     f.  Failure to vacate the premises by the agreed check-out time",
44351363,"Large 1-bedroom, great neighborhood 20min/Midtown",66259801756,verified,Paul,Queens,Sunnyside,40.74511,-73.91816,United States,US,False,strict,Entire home/apt,2004,$713 ,$143 ,50,2.0,8/19/2018,0.09,4.0,1.0,8,,
