3856175,Factory Converted Studio Loft in GP,23971176219,verified,Vida,Brooklyn,Greenpoint,40.72533,-73.94204,United States,US,False,strict,Entire home/apt,2006,$777 ,$155 ,30,6,4/1/2019,0.12,5.0,52,310,Check-in is at 4pm or after. Checkout is at 1030am unless otherwise specified. Please be respectful and honest because we share the same space. We reserve the right to charge for parking upon arrival and to reject your reservation request if we do not feel comfortable with your request. Thank you!,
3856727,"Quaint, Quiet 1BD",3966370701,verified,Mohini,Brooklyn,Williamsburg,40.71795,-73.95804,United States,US,True,flexible,Private room,2007,$723 ,$145 ,1,1,6/17/2015,0.02,5.0,1,72,Check in: 3pm; Check out: 12pm unless otherwise allowed. No pets please. No parties. NO smoking in or around the property. You can use anything that is inside the apartment so long as you don't break it or bring it outside the apartment. Feel free to read any book.,
3857279,Sunny Bedroom in Bushwick Luxury Building,81176098751,verified,Carly,Brooklyn,Bushwick,40.69865,-73.92971999999999,United States,US,False,strict,Private room,2022,"$1,114 ",$223 ,5,12,12/5/2018,0.26,5.0,1,381,"1.CHECK-IN TIME IS AFTER 3 P.M. EST AND CHECK-OUT IS 11 A.M. EST. 2.This is a NON SMOKING boat. 3.We will not rent to vacationing students or singles under 25 years of age  unless accompanied by an adult guardian or parent. 4.DAMAGE WAIVER- A damage waiver of $39 is required. The waiver offers up to $1500 of insurance against accidental damage. You will not be held responsible for damage incurred provided the following provisions are met: (website hidden) intentional damage is done to the boat or its contents.  (website hidden) charges are incurred due to contraband, pets or collection of rents or services rendered during the stay. 3.All debris, rubbish and discards are placed in the properly bagged, and soiled dishes are placed cleaned. 4.All keys are left on the kitchen table and unit is left locked. (website hidden) linens are lost or damaged. (website hidden) Early check-in or late check-out, unless approved in advance. 5.PAYMENT - An advance payment equal to 50% of the total is re",
3857832,Williamsburg Brooklyn quiet abode,55589364810,verified,Elliot,Brooklyn,Williamsburg,40.71985,-73.94422,United States,US,False,strict,Entire home/apt,2011,$532 ,$106 ,2,1,3/13/2016,0.02,2.0,1,193,"Keep the apartment  a little clean., the hit 70 , no more and that , the Ac if you are not in the room turn off , please , no party's .if you smoke please only in the balcony , no inside no in the hallway.",
3858384,Beautiful Room in Sunny Brooklyn Apartment,55068256837,unconfirmed,Juliana,Brooklyn,Bedford-Stuyvesant,40.68732,-73.94058000000001,United States,US,True,moderate,Private room,2007,$492 ,$98 ,2,41,1/4/2019,1.09,2.0,2,254,,
3858936,Sanctuary Quiet Room in Apartment,42006557748,verified,Jaime,Brooklyn,Bushwick,40.70033,-73.91197,United States,US,False,flexible,Private room,2021,$870 ,$174 ,5,0,,,4.0,2,249,,
3859489,Sanctuary Close To Manhattan,44723540348,unconfirmed,Jaime,Brooklyn,Bushwick,40.7001,-73.91204,United States,US,False,moderate,Private room,2010,"$1,066 ",$213 ,5,2,6/1/2016,0.03,1.0,2,373,,
3860041,True Industrial Loft in Brooklyn,47110962007,verified,Chaim,Brooklyn,Navy Yard,40.698170000000005,-73.9654,United States,US,False,flexible,Entire home/apt,2011,"$1,072 ",$214 ,1,7,7/11/2016,0.12,5.0,1,7,,
3860593,1 BR Beautiful Central Williamsburg,96485442119,verified,John,Brooklyn,Williamsburg,40.72037,-73.9596,United States,US,True,strict,Entire home/apt,2005,$850 ,$170 ,30,21,9/13/2016,0.38,4.0,1,68,"As I can't keep up the cleaning duty 24/7, please clean after yourself as you enter.  Read carefully the instructions and the cancelation. I have works and I won't promise to be at the house 24/24,but I will try my best if you need help.  Living and kitchen are prohibited while these are my working place.  Must notify me if you're having guests.  If you need anything, I'm glad to help in my power. Just ask!",
3861145,"Large apartment, 2BR, Midtown NYC! 3D",1317881413,unconfirmed,Nina,Manhattan,Midtown,40.750679999999996,-73.98177,United States,US,False,flexible,Entire home/apt,2008,"$1,045 ",$209 ,30,9,12/16/2018,0.17,4.0,14,144,"I expect guests to be respectful, clean, and caring of the space and it's belongings.  No smoking in the house. No pets please. (I love them, but the space isn't conducive for them). By booking this space you are accepting responsibility for all damages caused by you and/or your guest(s) to this house and/or it's contents. Please remove shoes at the front foyer.  I ask that guests do not use any of the food in the refrigerator or cabinets. You are welcome to purchase your own food to store and to cook with if you'd like. Please only use kitchen appliances that you are familiar with using so they are operated correctly and safely. There are paper bags beside the kitchen trash can and these are for recycling of glass, plastic, paper and cardboard.",
3861698,Beautiful Private Bedroom in Soho,39538518495,verified,Sophie,Manhattan,Nolita,40.72339,-73.99476999999999,United States,US,True,moderate,Private room,2022,$403 ,$81 ,5,0,,,4.0,1,367,"- No smoking or drugs inside the apartment or building - No parties are allow - Keep the noise level down between the hours of 10pm & 8am - Keep luggage off of bedding, please use the luggage rack instead. - Dishwasher off limits - Pets are prohibited -  Extra guests throughout duration of stay is not allowed unless approve prior to booking - Lastly, please do not bother the neighbors such as ringing their doorbells or asking for directions. Instead, reach out to us if you have any questions or concerns. Please respect our neighbors privacy and be discreet about our place being AirBnB rental during your stay. Thanks for booking with us and keeping the AirBnB experience alive and well!",
3862250,Rest your head-West Side Manhattan,65329774640,verified,Samuel,Manhattan,Hell's Kitchen,40.76215,-73.99036,United States,US,False,moderate,Private room,2009,$988 ,$198 ,3,133,6/26/2019,2.25,3.0,1,53,No loud parties. No smoking. Please),
3862802,Large Bedroom in Brooklyn for June and July.,85062871968,unconfirmed,Mark,Brooklyn,Flatbush,40.65136,-73.95974,United States,US,True,moderate,Private room,2009,$184 ,$37 ,5,0,,,1.0,1,206,,
3863355,NYC: an Upper-Eastside room of your own!,16939281475,verified,Jime,Manhattan,Upper East Side,40.77693,-73.95631999999999,United States,US,False,flexible,Private room,2019,"$1,022 ",$204 ,3,56,6/29/2019,0.94,4.0,5,125,,
3863907,2br in Manhattan NY,62827964721,verified,Nataly,Manhattan,Harlem,40.81217,-73.95303,United States,US,True,flexible,Entire home/apt,2016,$636 ,$127 ,1,3,1/2/2016,0.05,4.0,1,215,#NAME?,
3864459,Large Light-Filled Brownstone 1-BR,98383286674,unconfirmed,Gemma,Brooklyn,Bedford-Stuyvesant,40.68237,-73.94811,United States,US,False,moderate,Entire home/apt,2012,"$1,080 ",$216 ,8,17,3/12/2019,0.42,3.0,1,159,"Our Herbivorian House manual with detailed rules and helpful information is present in each apartment.  The Apartment must be left as clean as it was found, (especially the kitchen and bathroom) cleaning supplies are present in the apartment. (we are responsible for washing sheets and towels) No loud or late night noises or parties. No additional guests No smoking. No red meat or strong smelling meats shall be cooked (the smell disturbs our primarily vegetarian guests) Pleasant behavior to all other building residents. Any questions assistance needed please contact us we are happy to help. There is now only 2 hours of public street parking available (residential zone, just changed April 2016) In a triangle directly infrount of our building (we will check on non residential parking availability, and are looking for alternative parking, but call us first is bring a car) Both sides of the streets are ok for 2 hours except on street cleaning days (on one side 1st and third Tuesday, on the ",
3865012,Missy's Place,19557682517,verified,Melissa,Brooklyn,Bedford-Stuyvesant,40.68667,-73.93897,United States,US,False,moderate,Entire home/apt,2006,$495 ,$99 ,5,105,6/27/2019,1.77,1.0,1,-3,No smoking please!,
3865564,Have your NYC experience with us!,664252200,unconfirmed,Jime,Manhattan,Upper East Side,40.77707,-73.95652,United States,US,True,flexible,Private room,2016,$621 ,$124 ,3,55,6/1/2019,1.03,1.0,5,106,"We suggest you use email or texting contact us if need, do not call us. We will not accept calling from AirBnB guests. We will back to you ASAP.",
3866116,Beautiful apartment by Columbus Circle,9694036233,verified,Andrew,Manhattan,Chelsea,40.74944,-73.99631,United States,US,True,flexible,Entire home/apt,2010,$632 ,$126 ,3,10,1/2/2019,0.17,5.0,1,248,Please treat this house as if it is your own.  - No smoking - No drug use - Shoes can be left in the hall. - Help yourself to anything in the refrigerator. - LOCK THE DOORS when you leave. Front door to condo locks on it's own.,
3866668,*WARM*Beautiful*Room*ST. GEORGE steps to ferry!,89959119482,verified,Meghan,Staten Island,St. George,40.644079999999995,-74.07834,United States,US,False,moderate,Private room,2003,$775 ,$155 ,3,93,5/6/2019,2.1,3.0,1,13,"Please, No smoking and no pets. We do require a Security deposit. Absolutely no parties, if a small gathering will take place, please notify us so that we can let the other units in the building know.  Please be aware that the apartment is in a building with other tenants, including children, be mindful of their privacy and the noise level.",
3867221,Clean+Comfy+Cozy Room in NYC Home,33603793966,unconfirmed,Nayoung,Queens,Woodside,40.74626,-73.9009,United States,US,False,flexible,Private room,2007,$422 ,$84 ,5,3,8/7/2015,0.05,3.0,1,290,,
3867773,Stunning 2BR Apartment in Top Location,89470472385,verified,Debbie,Brooklyn,Park Slope,40.67256,-73.97211999999999,United States,US,False,flexible,Entire home/apt,2013,"$1,081 ",$216 ,5,10,1/3/2018,0.17,1.0,1,119,,
3868325,Private Rm in heart of Williamsburg,19639959135,verified,Tessa,Brooklyn,Williamsburg,40.718579999999996,-73.95711,United States,US,False,strict,Private room,2008,$493 ,$99 ,1,9,6/7/2016,0.19,5.0,1,87,,
3868878,Sunny Bedroom in El Barrio,64236744953,verified,Liz And Melissa,Manhattan,East Harlem,40.79416,-73.93984,United States,US,False,strict,Private room,2014,$252 ,$50 ,7,47,5/23/2019,0.8,2.0,2,11,NO SMOKING!  NO PARTIES!,
3869430,Williamsburg Apt. w/ private patio,41915745556,unconfirmed,Sofia,Brooklyn,Williamsburg,40.716229999999996,-73.96415,United States,US,True,moderate,Private room,2010,$913 ,$183 ,1,78,7/1/2019,1.31,3.0,1,383,,
3869982,SPACIOUS LIVINGROOM IN BROOKLYN,46191994305,unconfirmed,Joshua,Brooklyn,Windsor Terrace,40.65084,-73.97334000000001,United States,US,False,flexible,Private room,2010,$419 ,$84 ,10,0,,,4.0,1,235,Treat my home as if it is your own home. NO smoking at all in the building. No more than 6 people allowed . Please take your shoes off when enter the apartment,
3870535,GREAT ONE BED! ELEVATOR/LAUNDRY,40873484054,unconfirmed,Mike,Manhattan,Upper East Side,40.77175,-73.95742,United States,US,True,moderate,Entire home/apt,2011,$767 ,$153 ,30,10,11/10/2018,0.22,1.0,52,186,"1. NO SHOES IN THE HOUSE. Please, leave them behind the door 2. Please make sure that all the doors are     locked behind you when you leave 3. NO SMOKING, ABSOLUTELY NO DRUGS,     NO excessive alcohol consumption 4. Please, keep the noise level to the minimum       from 10pm to 8am  5. No parties. Please no unauthorized guests. Only checked in guests are allowed on the property 6. Be respectful to our neighbors  7. If you have any questions about anything     please ask freely, I am always happy to help     and make your stay pleasant. ENJOY!",
3871087,A Fantastic Master Bedroom Suite in a 3BD apt,40106585069,verified,Ed,Brooklyn,Bedford-Stuyvesant,40.694109999999995,-73.93987,United States,US,True,strict,Private room,2003,$982 ,$196 ,2,1,1/1/2018,0.05,2.0,1,327,,
3871639,New & Modern 2 BR Brownstone Apt.,14958332878,verified,Elito,Brooklyn,Bedford-Stuyvesant,40.68772,-73.95484,United States,US,False,strict,Entire home/apt,2013,$993 ,$199 ,3,72,6/17/2019,1.31,3.0,1,181,- Pets under 30pounds only.  - There is a grill in the back yard for guest use,
3872191,New Bright & Modern Apartment within a Brownstone,87672550447,verified,Elliot,Manhattan,Murray Hill,40.74735,-73.97671,United States,US,True,flexible,Entire home/apt,2015,$948 ,$190 ,3,8,1/2/2018,0.17,2.0,1,131,,
3872744,last minute TRIBECA CONDO AVAILABLE,19925845581,unconfirmed,Jupira,Manhattan,Tribeca,40.717259999999996,-74.01134,United States,US,False,moderate,Entire home/apt,2020,$71 ,$14 ,7,16,9/19/2017,0.34,5.0,1,404,"No unexpected house guests please, and no smoking in the house!",
3873296,"Manhattan Sun Drenched 
Near Gramercy",37782993975,unconfirmed,Lola,Manhattan,Gramercy,40.73601,-73.98205,United States,US,True,flexible,Private room,2013,"$1,085 ",$217 ,2,177,6/22/2019,2.98,1.0,1,93,"No smoking. If using the kitchen, guests must wash and put everything away. Please leave the apartment exactly as you found it.",
3873848,Central Park West & Columbia U: Comfy Private Room,68453877856,verified,Ms. Yvonne,Manhattan,Morningside Heights,40.80645,-73.95804,United States,US,True,flexible,Private room,2016,$227 ,$45 ,5,25,1/2/2019,0.44,5.0,1,90,,
3874401,★ Convenience & Comfort Awaits!  ♥️ Your Stay! ★,57142820517,unconfirmed,O.D.,Brooklyn,Crown Heights,40.67472,-73.93,United States,US,False,moderate,Entire home/apt,2011,$819 ,$164 ,1,82,6/16/2019,1.39,5.0,1,246,"Our Herbivorian House manual with detailed rules and helpful information is present in each apartment.  The apartment must be left as clean as it was found, (especially the kitchen and bathroom) cleaning supplies are present in the apartment. (we are responsible for washing sheets and towels)  If you would rather not clean up after yourself please include an extra $100.00 for the cleaning Help. No loud or late night noises or parties. No additional guests No smoking. No red meat or strong smelling meats shall be cooked (the smell disturbs our primarily vegetarian guests) Pleasant behavior to all other building residents. Any questions assistance needed?.. please contact us, we are happy to help.",
3874953,Spacious Studio in West Village!,61969011776,unconfirmed,Nancy,Manhattan,West Village,40.73243,-74.00052,United States,US,True,strict,Entire home/apt,2005,$272 ,$54 ,1,68,6/25/2019,1.15,4.0,1,10,,
3875505,Charming studio for rent in Astoria,90544034547,unconfirmed,Sylvia,Queens,Astoria,40.75508,-73.91673,United States,US,True,flexible,Entire home/apt,2010,$365 ,$73 ,2,141,7/2/2019,2.43,5.0,1,164,#NAME?,
3876058,Hey Beautiful Brooklyn Brownstone!,73628098099,verified,Donna,Brooklyn,Prospect Heights,40.67609,-73.96459,United States,US,False,moderate,Entire home/apt,2019,"$1,157 ",$231 ,3,39,4/21/2019,0.71,1.0,1,304,"I love having you here; you'll feel comfortable and at home.  You will have a key to  the house, so feel free to come and go as you choose.  Enjoy your stay in Boston!",
3876610,Large Room in Penthouse Apartment,69620353696,unconfirmed,Anthony,Manhattan,Kips Bay,40.742129999999996,-73.9801,United States,US,False,strict,Private room,2021,$676 ,$135 ,30,54,12/16/2018,0.91,1.0,26,105,No smoking allowed inside the house. My roomates and I ask if you use any dishes in the kitchen to clean up after yourself. Respect the house and the room you're in.,
3877162,Bushwick Room w/ Private Entrance & Bathroom!,45360462434,unconfirmed,Julie,Brooklyn,Bushwick,40.70322,-73.92913,United States,US,True,strict,Private room,2020,"$1,200 ",$240 ,1,16,6/15/2019,0.32,1.0,5,30,No smoking in the apartment.,
3877714,Perfect mid summer apart available,48226705600,unconfirmed,Pierre,Manhattan,Harlem,40.80581,-73.95374,United States,US,False,flexible,Entire home/apt,2006,$779 ,$156 ,24,2,8/31/2018,0.04,5.0,1,274,,
3878267,"Beautiful 1BR with Yard, Williamsburg",41815086928,verified,Michael,Brooklyn,Williamsburg,40.7151,-73.95421999999999,United States,US,True,flexible,Entire home/apt,2003,$783 ,$157 ,4,46,6/18/2019,0.89,1.0,1,237,"This is a non smoking house in a quiet neighborhood, so please no loud music or party's allowed. If not in need of any light, fan or AC please shut it off.""Conserve Energy "" Please treat my home like it is your own home.",
3878819,Sunny Private Room Facing Beautiful Prospect Park,81575755559,verified,Neysa,Brooklyn,Flatbush,40.65441,-73.96257,United States,US,False,strict,Private room,2016,"$1,018 ",$204 ,10,9,5/16/2018,0.26,1.0,1,150,"When you have ""settled"", Charlotte will show you what you need to know to make your stay perfect (door locks, porch lights, etc). Having an entire apartment (actually the larger part of the house) comes with a few small responsibilities that would not come with  a hotel room.  The house is professionally cleaned between guests. However we request that our guests leave the dishes, glassware and cooking utensils clean for the next guests. It is not acceptable to put dirty dishes back into the cabinets. I am very generous when I review guests. I don't believe any have gotten less than five stars. We have never had a guest we could not honestly recommend to another host! Please do not put baby wipes, diapers, paper towels, feminine products, etc. into the toilet. We are on a city sewer system over which the city planted trees. It is very costly to keep things flowing. Unknowingly, guests have caused two drainage blocks in 2 months. ""The DRain KIng"" came yesterday with a industrial size sna",
3879371,Feel at home in Manhattan at charming NY apartment,71731773545,verified,Tony,Manhattan,Kips Bay,40.739670000000004,-73.98040999999999,United States,US,True,moderate,Entire home/apt,2007,$955 ,$191 ,13,3,5/15/2016,0.05,5.0,1,112,"We suggest you use email or texting contact us if need, do not call us. We will not accept calling from AirBnB guests. We will back to you ASAP. ",
3879924,THEATRE DISTRICT - LARGE ROOM,18943817074,verified,Josh,Manhattan,Hell's Kitchen,40.76559,-73.99221,United States,US,False,strict,Private room,2016,$669 ,$134 ,2,79,6/24/2019,1.33,1.0,1,91,,
3880476,Romantic 1 bedroom Part2 Harlem USA,50551592525,unconfirmed,Tae,Manhattan,East Harlem,40.80592,-73.93653,United States,US,False,flexible,Entire home/apt,2019,$70 ,$14 ,3,72,4/29/2019,1.23,5.0,2,103,#NAME?,
3881028,Mid-Century Modern Garden Paradise,42591623279,verified,Carmia And Joe,Brooklyn,Bushwick,40.6825,-73.90818,United States,US,True,moderate,Entire home/apt,2004,$203 ,$41 ,2,234,6/23/2019,3.9,5.0,1,29,"HOUSE RULES  You will be staying in an apartment in our family home. We ask that you conduct yourself respectfully.  **Your booking acknowledges your reading and agreement with our house rules** *There will be no access to the cellar or usage of the backyard.    *We ask there be no drugs or parties.   *No smoking is allowed.  *No pets allowed.   *We ask that only the guests that have rented be allowed in the building or apartment no additional overnight guests or visitors are allowed. *Please do not leave any food on the table outside or on the back deck. *Laundry services are not provided.  (There are local laundromats in the area and we have provided some names in our handbook). *No candles are allowed. *Because we have hardwood floors, we ask if you have rolling suitcases that you will use care and try not to roll them around on the floors.  There are plenty of rugs to place them on. *Please Do Not give out any of the entry key codes to anyone (Your code will only be valid for your ",
3881581,Lovely private room in Manhattan,47991482878,unconfirmed,Trish,Manhattan,Morningside Heights,40.81065,-73.96311999999999,United States,US,True,strict,Private room,2010,$161 ,$32 ,2,52,6/5/2019,0.91,4.0,2,201,"Hi! So here are just some rules to make our experience more joyful and peaceful. We love to make our guest feel at home, however it's important to be mindful  of these few things while staying in our home: feel free to use our kitchen, but remember to clean up after yourself, we do not provide toiletries nor do we provide towels, you may not bring unannounced guests or have anyone stay over that is not part of our initial agreement, we work throughout the week and it's important that we be mindful and respectful of this, no parties, loud music, or drugs in our home. And please please clean up after yourself when you use our bathroom. Smoking allowed in the room.",
3882133,2BR Apt with huge outdoor space,94071849214,verified,Carolina,Brooklyn,Bedford-Stuyvesant,40.688179999999996,-73.959,United States,US,False,flexible,Entire home/apt,2018,$130 ,$26 ,7,5,9/10/2016,0.09,3.0,1,22,"We expect that you treat our home as you would yours.  If you smoke, you can do so on the back porch. There is absolutely no smoking in the apartment.",
3882685,"2 bedroom Duplex condo
+ yard 7 min to Manhattan",38156206182,verified,Ehsan,Queens,Astoria,40.76403,-73.92161999999999,United States,US,False,strict,Entire home/apt,2015,"$1,078 ",$216 ,3,116,6/13/2019,1.96,3.0,2,26,,
3883237,Great Sunny Spacious Room,73129101370,unconfirmed,Melody,Bronx,Mount Hope,40.846109999999996,-73.91036,United States,US,True,moderate,Private room,2020,"$1,033 ",$207 ,3,59,4/5/2019,1.0,1.0,1,405,,
3883790,Spacious Stylish Sunny Retreat,38222575959,verified,Andrew,Manhattan,Midtown,40.75911,-73.96299,United States,US,True,moderate,Private room,2004,$609 ,$122 ,1,0,,,4.0,1,291,"1. Please turn off lights when not in use. 2. Please use trash cans in bedroom and bathroom to dispose of waste. The blue recycling bin in the hallway can be used for clean hard plastics, glass bottles and jars, paper, cans and tins. 3. No pets are permitted on guest visits. 4. No fires (candles, incense, etc) are permitted in the apartment. 5. No smoking or drug use is permitted in the apartment. 6. No unapproved visitors are permitted in the apartment; please let Sara know in advance if you expect anyone besides the booked guest(s) to be at the apartment during your visit. 7. Please be respectful of our neighbors in the building by avoiding loud music or noise, especially late at night and early in the morning. 8. If furniture or amenities are broken or missing after a guest check-out, or if extensive cleaning is required, reimbursement may be requested through Airbnb. 9. If you have problem, requests, issues, or concerns during your visit, please contact Sara directly. I will be gla",
3884342,Amazing Upper East Side Location,2144176113,unconfirmed,Yevgeny,Manhattan,Upper East Side,40.77632,-73.95458,United States,US,False,strict,Private room,2012,$596 ,$119 ,1,389,7/1/2019,6.51,3.0,2,374,"As I can't keep up the cleaning duty 24/7, please clean after yourself as you enter.  Read carefully the instructions and the cancelation. I have works and I won't promise to be at the house 24/24,but I will try my best if you need help.  Living and kitchen are prohibited while these are my working place.  Must notify me if you're having guests.  If you need anything, I'm glad to help in my power. Just ask!",
3884894,Private Room in Great NYC Nbrhood,26513113913,unconfirmed,Edward,Manhattan,Lower East Side,40.72144,-73.99356,United States,US,False,moderate,Private room,2018,"$1,014 ",$203 ,1,64,6/23/2019,1.12,2.0,2,74,"No unexpected house guests please, and no smoking in the house!",
3885447,Modern Studio at The Manhattan Club,88501760823,verified,Schatzie,Manhattan,Midtown,40.76514,-73.98058,United States,US,True,moderate,Private room,2018,"$1,060 ",$212 ,1,9,8/25/2018,0.2,4.0,1,169,"No smoking, please no shoes in the house. No partires  allowed.  Hardwood floors just got done. All lights,  and AC must be turned off when no one is home there are trash barrels right on the back door outside where you can place your trash bags once is full . Please treat my home like it is your own home.",
3885999,BED-STUY SOUTHERN COMFORT,3961276187,unconfirmed,Ella,Brooklyn,Bedford-Stuyvesant,40.6872,-73.93805,United States,US,False,flexible,Entire home/apt,2014,$837 ,$167 ,3,173,7/6/2019,2.97,2.0,1,201,"- This is mine & my roommate's full time home.  Please be respectful and peaceful.  Also, an elderly dog lives here & as much as I try to keep a very clean place, it is not immaculate or hair-free.  Life happens here.  :)",
3886551,Peaceful Studio in Prospect Heights,29877377033,unconfirmed,Liz,Brooklyn,Prospect Heights,40.67262,-73.96542,United States,US,False,strict,Entire home/apt,2004,$735 ,$147 ,2,21,5/19/2019,0.51,4.0,1,140,,
3887104,Private Room in Flatiron,77850662892,unconfirmed,Julian,Manhattan,Midtown,40.74596,-73.98678000000001,United States,US,True,strict,Private room,2010,$302 ,$60 ,3,10,9/19/2017,0.38,1.0,1,207,,
3887656,"Bright, cozy den in 4 bedrm duplex.",97630951566,verified,Paris,Brooklyn,Bedford-Stuyvesant,40.68826,-73.9385,United States,US,False,strict,Private room,2009,"$1,102 ",$220 ,1,8,6/5/2019,0.16,3.0,4,92,,
