4883453,Restored 1910 Brooklyn Loft Suite,19415854256,verified,Lisa,Brooklyn,Bushwick,40.683859999999996,-73.90935999999999,United States,US,False,flexible,Entire home/apt,2008,$439 ,$88 ,4,119.0,6/20/2019,2.23,5,1,176,"House Rules 1. All bookings made at least a week before check in are fully refundable if cancelled within 24 hours of booking. After this, you will receive a 50% refund if you cancel at least 7 days before the start of your trip. 2. Check-in time is any time after 4 pm local time. If the unit is ready earlier, we’ll let you know. Check-out is normally 11 am local time, but we’d be happy to extend it as long as we don’t have a cleaning scheduled. Just let us know.  3. All bookings require a security deposit of at least $300. 4. For security measures we require all guests to provide proof of identification through ID verification on our own website. In order to check in, we'll need a photo of your ID.  5. Don’t let $300 go up in smoke. There's no smoking allowed in any Flatbook and a $300 fine for breaking this rule.  6. Unfortunately we don’t allow pets in most of our apartments. 7. Unless you’re staying in one of our specialty apartments, we don’t allow parties or excessive noise. 8. I",
4884005,Sunny Room in Historic Williamsburg Loft,79796039405,verified,Karron,Brooklyn,Williamsburg,40.709070000000004,-73.96396,United States,US,False,moderate,Private room,2018,$920 ,$184 ,1,33.0,6/26/2019,2.75,4,1,193,"The (URL HIDDEN) use of tobacco/smoking/substances of abuse (including alcohol) on the property...quiet during night (you can go in and out as you like, just of course be quiet when we might be sleeping, as we try to be if coming home late when you might be in bed)...tell us a bit about yourself if you like and pls ask us about anything we might be able to tell you about locally/perhaps assist with...contact us when you're here with any questions!  We particularly dislike jokes having to do with avocados.  :   )  Do sign our map of where you're from. Some more room/house use points: ->  If you need it before we actually meet and show you, the bathroom is upstairs; feel free to get water for your use from bathroom faucet (it's fine to drink here, and in most of the US.  Bottled water is rarely different than usual US tap water, with the bottling craze a big drain on resources, to be actively eschewed for the sake of our Mother Earth...). ->  If you need to borrow a towel, there should b",
4884557,Beautiful Manhattan 1br apartment close to subway!,83762612170,verified,Michael,Manhattan,Upper East Side,40.76173,-73.96183,United States,US,True,flexible,Entire home/apt,2019,$573 ,$115 ,3,85.0,6/28/2019,1.59,4,1,53,"• No smoking, pets, or unannounced guests. • Respect the check-out time of 11:00 AM. If you have special requests, discuss with us ahead of time! • Clean the kitchen/wash dishes after use. • Keep a reasonable volume after 11:00 PM & before 8 AM",
4885110,*SPLENDID* Fantastic 2 BR Apt near many Hospitals,19895991257,verified,Juliana,Manhattan,Upper East Side,40.7606,-73.96028000000001,United States,US,False,moderate,Entire home/apt,2009,$321 ,$64 ,30,17.0,2/2/2019,0.32,1,34,225,"Please try to be mindful/aware of your actions and their effect on others No disturbance is greatly appreciated:) When talking on the phone, please do so only in your room with door closed:) unless it's an emergency Please walk, don't run the stairs (the slower you walk the less noise there is) Close all doors gently please No smoking anywhere in or out of the house If you tell me you stayed with friends who smoked as a reason for the smell, it will not matter No perfume/cologne, scented laundry detergent allowed (suitable product provided, just ask if needed) Guests/visitors not permitted",
4885662,Large & Sunny Bedroom - super close to subway,31082109438,verified,Helena S,Brooklyn,Bedford-Stuyvesant,40.68951,-73.95524,United States,US,True,moderate,Private room,2022,$579 ,$116 ,2,14.0,5/26/2018,0.27,3,2,250,1) No Smoking in property!!!  2) Do not slam doors!!! Close lightly Please!!! 3) No Shoes in house (except slippers) 4) Quiet down AFTER 10PM.,
4886214,"Railroad Apt in Greenpoint, BKLYN",50972867753,verified,Ira,Brooklyn,Greenpoint,40.724740000000004,-73.94733000000001,United States,US,False,moderate,Entire home/apt,2020,$167 ,$33 ,1,0.0,,,1,1,153,,
4886767,1 BR Apartment in UES - 5' walk to CentralPark,88772892599,unconfirmed,Brian,Manhattan,East Harlem,40.79213,-73.94974,United States,US,False,flexible,Entire home/apt,2021,$607 ,$121 ,3,27.0,5/24/2019,0.5,2,1,411,,
4887319,It's always sunny in Williamsburg!,96529182534,unconfirmed,Lauren & Chelsea,Brooklyn,Williamsburg,40.71301,-73.95374,United States,US,True,moderate,Private room,2018,"$1,003 ",$201 ,1,175.0,6/16/2019,3.27,5,4,57,"You will meet a clean apartment, please leave it clean  No Smoking please. Sorry, but NO PETS",
4887871,1BR with backyard in Williamsburg!,95423531061,unconfirmed,Laura,Brooklyn,Williamsburg,40.716770000000004,-73.95773,United States,US,True,moderate,Private room,2020,$341 ,$68 ,1,0.0,,,1,1,323,,
4888423,Large Room in Greenwich Village,15935584281,unconfirmed,William,Manhattan,West Village,40.73345,-74.00301999999999,United States,US,False,strict,Private room,2015,$522 ,$104 ,1,1.0,4/21/2016,0.03,1,1,124,,
4888976,Private Bedroom in Upper Manhattan,18504421496,verified,Javier,Manhattan,Washington Heights,40.83554,-73.93849,United States,US,True,moderate,Private room,2007,"$1,140 ",$228 ,1,307.0,6/29/2019,5.66,1,1,10,"House Rules 1. Check-in is 4 pm local time. If the unit is ready earlier, we’ll let you know. Check-out is normally 11 am local time, but we’d be happy to extend it as long as we don’t have a cleaning scheduled. Just let us know.  2. All bookings require a security deposit of at least $300, which will be refunded within 7 days of your check-out. 3. For security measures we require all guests to provide proof of identification through ID verification on our own website. In order to check in we'll need a photo of your ID.  4. Our cancellation policy is as shown on our ad and defined by the site you are booking through.  5. Don’t let $300 go up in smoke. There's no smoking allowed in any Flatbook and a $300 fine for breaking this rule.  6. Unfortunately we don’t allow pets in any of our apartments. 7. Unless you’re staying in one of our specialty apartments, we don’t allow parties or excessive noise. 8. If we find the place very messy, we have to charge an extra $40 for every extra hour o",
4889528,near Columbia Hospital,68116423252,verified,Jorge,Manhattan,Washington Heights,40.8447,-73.93369,United States,US,False,moderate,Private room,2018,$620 ,$124 ,4,80.0,6/16/2019,1.57,5,1,65,"House Rules 1. All bookings made at least a week before check in are fully refundable if cancelled within 24 hours of booking. After this, you will receive a 50% refund if you cancel at least 7 days before the start of your trip. 2. Check-in time is any time after 4 pm local time. If the unit is ready earlier, we’ll let you know. Check-out is normally 11 am local time, but we’d be happy to extend it as long as we don’t have a cleaning scheduled. Just let us know.  3. All bookings require a security deposit of at least $300. 4. For security measures we require all guests to provide proof of identification through ID verification on our own website. In order to check in, we'll need a photo of your ID.  5. Don’t let $300 go up in smoke. There's no smoking allowed in any Flatbook and a $300 fine for breaking this rule.  6. Unfortunately we don’t allow pets in most of our apartments. 7. Unless you’re staying in one of our specialty apartments, we don’t allow parties or excessive noise. 8. I",
4890080,Sunny room in Bushwick; Minutes from subway!,74184848704,unconfirmed,Fiorella,Brooklyn,Bushwick,40.70171,-73.91344000000001,United States,US,False,strict,Private room,2016,"$1,059 ",$212 ,1,155.0,6/20/2019,3.39,4,2,359,Please don't use the washer and dryer after 10pm or before 8am!,
4890633,"Spaceful 1 BR apartment, sleeps 3",90493853019,unconfirmed,Marta,Manhattan,Upper West Side,40.79463,-73.97061,United States,US,False,flexible,Entire home/apt,2017,$899 ,$180 ,4,72.0,6/24/2019,1.35,3,1,398,,
4891185,"Sunny, comfy room in quiet Park Slope apmt",73519376347,unconfirmed,Andrew,Brooklyn,South Slope,40.66135,-73.98725999999999,United States,US,True,moderate,Private room,2020,$600 ,$120 ,1,3.0,10/5/2015,0.06,4,1,257,Please be respectful of other guests No Pets and No Smoking No loud music or noise after 10 PM,
4891737,2 Bedroom in Bed Stuy,32812233257,verified,Win,Brooklyn,Bedford-Stuyvesant,40.68574,-73.95758000000001,United States,US,False,flexible,Entire home/apt,2013,"$1,184 ",$237 ,1,0.0,,,4,1,236,- Additional charge for extra guests - No Smoking! - No pets,
4892290,Lovely Big Bedroom in Clinton Hill,94491238188,verified,Kylie,Brooklyn,Bedford-Stuyvesant,40.69494,-73.95506999999999,United States,US,True,flexible,Private room,2012,$919 ,$184 ,1,0.0,,,5,1,404,,
4892842,Reduced$ EastVillage Entire 1BD APT,8623794492,unconfirmed,Gregory,Manhattan,East Village,40.730959999999996,-73.98376,United States,US,True,strict,Entire home/apt,2019,$672 ,$134 ,1,62.0,6/30/2019,1.15,5,1,233,"- Non-smoker - No cologne/perfumed spray use - Please take shower before bed to avoid morning rush - Take off street shoes and place on rack, - Please bring slippers or ask me for a pair - Recycling and reusable shopping bag use (provided) - Limit things to bring in: 1-2 suitcases OK - Mailing address not to be shared with anyone; you will be charged $200 if you do",
4893394,Private Bedroom in BK Brownstone,95911503093,verified,Nina,Brooklyn,Bedford-Stuyvesant,40.69604,-73.94504,United States,US,False,flexible,Private room,2007,"$1,123 ",$225 ,7,13.0,5/16/2019,0.33,3,3,176,,
4893946,Humble 1BR in Bushwick,82127502569,unconfirmed,Nico,Brooklyn,Bushwick,40.69709,-73.91003,United States,US,False,strict,Private room,2022,"$1,107 ",$221 ,1,0.0,,,1,1,251,We like quirt. So please dont hold party at night.,
4894499,"Cute, Cozy in Prime Williamsburg",35518649918,verified,Liz,Brooklyn,Williamsburg,40.713429999999995,-73.94842,United States,US,True,strict,Entire home/apt,2017,$376 ,$75 ,5,0.0,,,1,1,301,,
4895051,Million Dollar Listing :Times Square,36000369603,unconfirmed,Scott,Manhattan,Hell's Kitchen,40.75977,-73.98980999999999,United States,US,False,strict,Entire home/apt,2005,"$1,112 ",$222 ,3,26.0,6/29/2019,0.51,1,1,11,"Please, No shoes allowed. There's a mat for them, just inside the door.",
4895603,Study in 1885 Gothic Brownstone.,8782802421,unconfirmed,Rod,Manhattan,Harlem,40.80858,-73.95132,United States,US,True,flexible,Private room,2004,$261 ,$52 ,10,25.0,6/8/2019,0.51,2,1,192,"House Rules 1. Check-in is 4 pm local time. If the unit is ready earlier, we’ll let you know. Check-out is normally 11 am local time, but we’d be happy to extend it as long as we don’t have a cleaning scheduled. Just let us know.  2. All bookings require a security deposit of at least $300, which will be refunded within 7 days of your check-out. 3. For security measures we require all guests to provide proof of identification through ID verification on our own website. In order to check in we'll need a photo of your ID.  4. Our cancellation policy is as shown on our ad and defined by the site you are booking through.  5. Don’t let $300 go up in smoke. There's no smoking allowed in any Flatbook and a $300 fine for breaking this rule.  6. Unfortunately we don’t allow pets in any of our apartments. 7. Unless you’re staying in one of our specialty apartments, we don’t allow parties or excessive noise. 8. If we find the place very messy, we have to charge an extra $40 for every extra hour o",
4896156,Modern 1br downtown Manhattan,70500458524,verified,Andrew,Manhattan,Financial District,40.71182,-74.00497,United States,US,False,moderate,Entire home/apt,2016,$457 ,$91 ,3,7.0,5/25/2016,0.13,3,1,365,"House Rules 1. Check-in is 4 pm local time. If the unit is ready earlier, we’ll let you know. Check-out is normally 11 am local time, but we’d be happy to extend it as long as we don’t have a cleaning scheduled. Just let us know.  2. All bookings require a security deposit of at least $300, which will be refunded within 7 days of your check-out. 3. For security measures we require all guests to provide proof of identification through ID verification on our own website. In order to check in we'll need a photo of your ID.  4. Our cancellation policy is as shown on our ad and defined by the site you are booking through.  5. Don’t let $300 go up in smoke. There's no smoking allowed in any Flatbook and a $300 fine for breaking this rule.  6. Unfortunately we don’t allow pets in any of our apartments. 7. Unless you’re staying in one of our specialty apartments, we don’t allow parties or excessive noise. 8. If we find the place very messy, we have to charge an extra $40 for every extra hour o",
4896708,Cozy private bedroom in duplex,65054384455,unconfirmed,Jon,Brooklyn,Bushwick,40.70126,-73.93731,United States,US,False,moderate,Private room,2013,$974 ,$195 ,1,0.0,,,1,1,181,ALCOHOL IS STRICTLY NOT ALLOWED INSIDE THE HOUSE !,
4897260,Sunny NYC APT - 15min from Midtown,22154567076,unconfirmed,Pao,Queens,Sunnyside,40.745129999999996,-73.91685,United States,US,True,flexible,Entire home/apt,2004,$468 ,$94 ,30,10.0,5/23/2019,0.28,5,3,169,No smoking inside the house and make sure to think about the house as your own,
4897813,BR in heart of trendy williamsburg,53308871207,unconfirmed,Laura,Brooklyn,Williamsburg,40.71223,-73.95681,United States,US,False,moderate,Private room,2003,"$1,112 ",$222 ,7,1.0,8/31/2016,0.03,4,1,238,,
4898365,Cozy New York Studio,96355862689,unconfirmed,Dim,Manhattan,Upper East Side,40.77407,-73.95238,United States,US,False,flexible,Entire home/apt,2016,$717 ,$143 ,3,211.0,6/22/2019,3.95,3,1,215,,
4898917,Charming Bright Upper East Space,50135145092,verified,Katie,Manhattan,Upper East Side,40.77636,-73.95099,United States,US,False,moderate,Entire home/apt,2017,"$1,015 ",$203 ,1,0.0,,,1,2,230,"Non smoker only Guest may not bring car to the area Perfumes, sprays, candles, not allowed Cat in the house Mailing address may not be given to anyone without written permission If we get correspondence on your name, you will be charged $200  Separate recycle from trash (I can help, just ask) Black bag for recycling is in your room, put all in one bag Guests are not allowed The house is quiet as others are studying Please pick up after yourself as a courtesy to others Please don't leave your clothes or towel in the bathroom Any shampoo without name can be used (they are inside the shower) Please take shower at night or afternoon to avoid morning traffic. Use reusable bag (provided)  Please don't take disposable plastic bags from stores Food left over must be placed inside kitchen sink for automatic disposal",
4899469,Lovely Victorian Brooklyn 6BR Home,63195570843,verified,Orli,Brooklyn,Flatbush,40.63854,-73.95814,United States,US,True,strict,Entire home/apt,2010,$768 ,$154 ,4,3.0,7/3/2015,0.06,3,1,93,Please do not smoke. Be respectful of other guests.,
4900022,Clean & Cozy Private Room,64393754350,verified,Stephanie & Linda,Brooklyn,Kensington,40.63953,-73.97214,United States,US,True,flexible,Private room,2011,$664 ,$133 ,2,39.0,6/24/2019,0.77,5,1,80,,
4900574,Charming Townhouse Near RSD Park!  2 Bedroom Apt,36496737502,verified,Juliana,Manhattan,Upper West Side,40.78305,-73.98398,United States,US,True,moderate,Entire home/apt,2018,$316 ,$63 ,30,16.0,6/15/2019,0.31,5,34,311,"House Rules 1. Check-in is 4 pm local time. If the unit is ready earlier, we’ll let you know. Check-out is normally 11 am local time, but we’d be happy to extend it as long as we don’t have a cleaning scheduled. Just let us know.  2. All bookings require a security deposit of at least $300, which will be refunded within 7 days of your check-out. 3. For security measures we require all guests to provide proof of identification through ID verification on our own website. In order to check in we'll need a photo of your ID.  4. Our cancellation policy is as shown on our ad and defined by the site you are booking through.  5. Don’t let $300 go up in smoke. There's no smoking allowed in any Flatbook and a $300 fine for breaking this rule.  6. Unfortunately we don’t allow pets in any of our apartments. 7. Unless you’re staying in one of our specialty apartments, we don’t allow parties or excessive noise. 8. If we find the place very messy, we have to charge an extra $40 for every extra hour o",
4901126,15 mins to Times Square + Sleeps 4,8878266295,unconfirmed,Mahesh,Manhattan,Harlem,40.82846,-73.94393000000001,United States,US,True,strict,Entire home/apt,2015,"$1,181 ",$236 ,4,29.0,11/5/2018,0.55,1,1,233,,
4901679,Large Room In Beautiful Brownstone,34242759048,verified,Patricia,Brooklyn,Clinton Hill,40.69105,-73.96789,United States,US,False,moderate,Private room,2007,$646 ,$129 ,60,0.0,,,3,2,138,"- No smoking anywhere on premises, inside or outside. - No pets. - Please take off shoes in the apartment. - Please leave the house in the condition you found it in. - Please be respectful to neighbors. - Turn off A/C when away.",
4902231,Great 2 bedroom on The Upper East Side,26296276624,unconfirmed,Vered,Manhattan,Upper East Side,40.77421,-73.95361,United States,US,True,moderate,Entire home/apt,2014,$388 ,$78 ,4,0.0,,,2,1,309,,
4902783,Clean & Warm East Village Escape!,51292566014,verified,Nancy,Manhattan,East Village,40.7295,-73.98398,United States,US,True,flexible,Entire home/apt,2005,"$1,084 ",$217 ,5,1.0,2/6/2015,0.02,2,1,289,,
4903336,Beautiful Studio in the Upper East (30 DAYS MIN),13927353675,unconfirmed,Elem,Manhattan,Upper East Side,40.78151,-73.94775,United States,US,False,strict,Entire home/apt,2012,$360 ,$72 ,30,12.0,4/27/2019,0.29,5,15,189,"Please treat my place as your own. Turn off the lights, AC, fan, etc when you leave the apartment, and wash any kitchenware and dishes that you've used. Put used towels on the floor, so that I now they've been used.",
4903888,Comfy Bedroom quite neighborhood,47608625085,verified,Claude,Queens,Forest Hills,40.71158,-73.85273000000001,United States,US,True,moderate,Private room,2016,$989 ,$198 ,1,12.0,1/3/2019,0.35,5,1,170,,
4904440,flexible 1BD LIVE/ WORK space BK,29096391325,unconfirmed,Matthew,Brooklyn,Bedford-Stuyvesant,40.6926,-73.94719,United States,US,True,flexible,Entire home/apt,2022,"$1,015 ",$203 ,5,4.0,6/6/2015,0.08,1,1,180,,
4904992,Room w/artwork & huge window on historic block!,53910700257,unconfirmed,Neal,Manhattan,Harlem,40.809540000000005,-73.94227,United States,US,False,flexible,Private room,2005,$513 ,$103 ,7,18.0,3/3/2019,0.66,2,1,79,"House Rules 1. All bookings made at least a week before check in are fully refundable if cancelled within 24 hours of booking. After this, you will receive a 50% refund if you cancel at least 7 days before the start of your trip. 2. Check-in time is any time after 4 pm local time. If the unit is ready earlier, we’ll let you know. Check-out is normally 11 am local time, but we’d be happy to extend it as long as we don’t have a cleaning scheduled. Just let us know.  3. All bookings require a security deposit of at least $300. 4. For security measures we require all guests to provide proof of identification through ID verification on our own website. In order to check in, we'll need a photo of your ID.  5. Don’t let $300 go up in smoke. There's no smoking allowed in any Flatbook and a $300 fine for breaking this rule.  6. Unfortunately we don’t allow pets in most of our apartments. 7. Unless you’re staying in one of our specialty apartments, we don’t allow parties or excessive noise. 8. I",
4905545,Cozy room in a quite neighborhood,10752713718,verified,Inez,Queens,Bay Terrace,40.78598,-73.77915,United States,US,False,flexible,Private room,2006,"$1,095 ",$219 ,3,4.0,5/4/2018,0.08,5,2,150,"No smoking inside the house.  No loud parties or disturbing the peace or public nuisance allowed. This is a strictly residential rental NOT commercial.  If holding parties you must first seek owner's permission before inviting anyone other than immediate family.   This is a peaceful family neighborhood and I like to keep it that way.  Clean after yourself, clean the stove and oven and all the appliances.  Leave everything exactly in the condition it is in when you first arrived.  Treat this house as if it is your own with the proper respect and courtesy.  No pets allowed.  Check in is 4PM, Check out 10AM.  On Check out date please leave all the dirty sheets, towels, linens by the washer for the maid.  Please leave the outside trash container for the garbage truck on the night before it arrives.",
4906097,Fun Space in the Heart of Williamsburg,71721537824,unconfirmed,Jamie,Brooklyn,Williamsburg,40.71102,-73.95626999999999,United States,US,False,moderate,Private room,2013,"$1,142 ",$228 ,1,1.0,8/26/2018,0.09,4,1,331,"Ali's House Rules When you stay in an Airbnb, you're staying in someone's home. Here are some guidelines Joe asks all guests to follow.  Quiet down AFTER 10PM specially in week days",
4906649,Quiet private retreat high above Brooklyn.,42982356643,unconfirmed,Adam,Brooklyn,Williamsburg,40.71759,-73.94388000000001,United States,US,False,strict,Private room,2003,$489 ,$98 ,2,19.0,6/29/2019,0.61,5,1,84,,
4907202,Quaint Sunny Cobble Hill Brownstone,74956280191,unconfirmed,Jen,Brooklyn,Cobble Hill,40.68854,-73.99533000000001,United States,US,True,flexible,Entire home/apt,2008,"$1,170 ",$234 ,4,16.0,11/21/2016,0.3,2,1,420,No pets and No smoking. Guests need to be respectful and considerate of others.,
4907754,Huge Sunny Private Room in Bushwick,27902691837,verified,Alec,Brooklyn,Bushwick,40.702059999999996,-73.91342,United States,US,False,flexible,Private room,2004,$343 ,$69 ,7,1.0,2/16/2016,0.02,1,1,164,,
4908306,Top Floor Williamsburg Beauty,60011562920,verified,William,Brooklyn,Williamsburg,40.711240000000004,-73.95716999999999,United States,US,False,strict,Entire home/apt,2013,$549 ,$110 ,1,63.0,11/14/2017,1.27,3,1,222,"Please do not smoke, and be respectful of others in the house.",
4908859,Alcove Studio 1 blk from Times Sq,42011785151,verified,Naveen,Manhattan,Hell's Kitchen,40.75928,-73.99036,United States,US,False,flexible,Entire home/apt,2004,$463 ,$93 ,1,0.0,,,4,1,146,"House Rules 1. Check-in is 4 pm local time. If the unit is ready earlier, we’ll let you know. Check-out is normally 11 am local time, but we’d be happy to extend it as long as we don’t have a cleaning scheduled. Just let us know.  2. All bookings require a security deposit of at least $300, which will be refunded within 7 days of your check-out. 3. For security measures we require all guests to provide proof of identification through ID verification on our own website. In order to check in we'll need a photo of your ID.  4. Our cancellation policy is as shown on our ad and defined by the site you are booking through.  5. Don’t let $300 go up in smoke. There's no smoking allowed in any Flatbook and a $300 fine for breaking this rule.  6. Unfortunately we don’t allow pets in any of our apartments. 7. Unless you’re staying in one of our specialty apartments, we don’t allow parties or excessive noise. 8. If we find the place very messy, we have to charge an extra $40 for every extra hour o",
4909411,Modern Studio Apt in Williamsburg,89966353373,unconfirmed,Shamim,Brooklyn,Williamsburg,40.71768,-73.95355,United States,US,False,moderate,Entire home/apt,2015,$549 ,$110 ,7,1.0,4/29/2018,0.07,5,1,214,No pets.  No smoking inside.,
4909963,Lovely room in Prospect Heights,83532714607,unconfirmed,Daniel,Brooklyn,Prospect Heights,40.67467,-73.96557,United States,US,True,flexible,Private room,2010,$540 ,$108 ,1,0.0,,,5,1,423,No pets. No smoking. Guests need to be respectful and gentle.,
4910515,"Close to subway, Manhattan, & shops with kitchen",37494353060,unconfirmed,William,Queens,Elmhurst,40.74038,-73.87599,United States,US,True,strict,Entire home/apt,2019,$314 ,$63 ,5,31.0,5/27/2019,0.64,5,2,276,"We are a relaxed household, but expect guests to use common sense and to respect our home.  Smoking is not permitted in any part of the property, including common living spaces, the porch, bedroom and bedroom window. Anyone found to have smoked will be asked to leave immediately. When using the kitchen, guests agree to: - Wash up all dishes, cutlery, pots and pans after use - Clean work surfaces and table - Return all utensils to their origin place - Put all rubbish in the trash Shower & Toilet: - Please leave the shower and toilet in a clean, hygienic and fresh state.  Bedroom: - Please refrain from playing music prior to 9am and after 8pm. Bikes: - There are two bikes available to use at your own risk. Guests outside of AirBnB are not permitted to stay in the apartment.",
4911068,Best Location in Midtown Manhattan,54100101241,unconfirmed,Gore,Manhattan,Hell's Kitchen,40.76645,-73.98539,United States,US,True,strict,Entire home/apt,2004,$175 ,$35 ,4,15.0,6/29/2019,0.41,5,1,306,"Guest should do there dishes and clean after themselves. No alcohol, No drugs, No party's and most important Don't Disturb other guests!",
4911620,I LOVE BROOKLYN PRIVATE 1-BR APT,48687378126,verified,Nowme And Ra,Brooklyn,Flatbush,40.64801,-73.95623,United States,US,False,moderate,Entire home/apt,2009,$210 ,$42 ,4,51.0,6/22/2019,0.97,2,2,357,"Please treat my place as your own. Turn off the lights, AC, fan, etc when you leave the apartment, and wash any kitchenware and dishes that you've used. Put used towels on the floor, so that I now they've been used.",
