44138728,Chambre idéale couple ou amis - Proche Manhattan,24059295179,unconfirmed,Constanza,Brooklyn,Williamsburg,40.70825,-73.94932,United States,US,True,strict,Private room,2008,$728 ,$146 ,2,5,6/6/2017,0.18,2,1.0,0,"NO PETS.  NO SMOKING.  NO PARTIES.  No recreational drugs.  No open flames.  No excess noise after 10:00 pm.  Avoid disturbing neighbors.   NO PETS.  If a pet is found on the premise, a pet surcharge of $300 will be applied. You will be asked to leave immediately and will forfeit your security deposit if an animal is on the property without permission of owner. NO SMOKING PLEASE.  A $500 cleaning fee will be deducted from your deposit if smoking occurs in the unit. This is a NO PARTY house. Parties, loud get-togethers, or gatherings are not allowed because of neighbor issues, and possible damage to property. If a party, loud gathering, or loud disturbance does occur, or if neighbors or other guests call for a loud disturbance, you will forfeit your security deposit and will be evicted immediately. Please Note:  During your stay we ask that you leave the house tidy and in good order.  Guests must provide their own toiletries/cleaning supplies/paper products.  We will have a starter kit ",
44139280,"2BR ""Café Brooklyn"" w/private Courtyard in BedStuy",16158831971,verified,Chad,Brooklyn,Bedford-Stuyvesant,40.68488,-73.92706,United States,US,True,strict,Entire home/apt,2009,$151 ,$30 ,1,39,6/23/2019,2.87,2,1.0,75,"Guests who use kitchen must wash their dishes (or put them in dishwasher) and wipe stove and counters after eating, in courtesy to other guests. No smoking inside or behind the house; smoking is permitted only in smoking area in front of house. To maintain quiet on floors with bedrooms, please use headphones to listen to music/videos or when making (website hidden) calls in bedrooms, and keep hallways conversations quiet and short.  ",
44139832,BEAUTIFUL Master Bedroom - 20 mins to Manhattan!,28182587229,verified,Peter,Brooklyn,Prospect Heights,40.67328,-73.96415,United States,US,True,moderate,Private room,2018,$501 ,$100 ,1,0,,,5,1.0,0,"Respect yourself, respect others, clean up after yourself. No smoking or drinking in the apt. Late check in after 9 p.m. and before 10 A.m. is $50, lock out is $50. Thank you",
44140384,Beautiful 2 bedroom apt in Brownstone Brooklyn,52389208095,unconfirmed,Vanessa,Brooklyn,Clinton Hill,40.68855,-73.96476,United States,US,False,flexible,Entire home/apt,2013,$311 ,$62 ,4,0,,,3,1.0,156,"NO PETS!  NO SMOKING ON PREMISES!  NO PARTY! No ""DRUGS""! - Keep the Place Clean at All Times! - Do Not Ask the ""Neighbors"" for anything.  Ask Me!-  - No Neighbors Interaction! - No ""Drugs"" Please!!! - No Noise! A printed house rule will be provided. Please be respectful to others when all rooms are booked. 10 AM Check-out and Check-in is between 12 PM (noon) - 3 PM.   Late check in after 8 pm is $50, lock out is $50. Respect yourself, Respect others, clean up after yourself.  No Smoking/drinking in apt.  Thank You! Location Rules: The ""Exact Address Location Is Not Stockton St.  It Is 2 Streets Away.  It Is Not Disclosed For Security Reasons"" And Is Given Out 24 Hours Prior to Check-in.  If This Is a Problem for You, Please STOP Here And Contact Other Hosts for Your Stay.   This Is a Part Of My House Rules.",
44140937,Modern and bright duplex in central Cobble Hill,10844799539,unconfirmed,Daniel,Brooklyn,Cobble Hill,40.6858,-73.99977,United States,US,True,flexible,Entire home/apt,2005,$923 ,$185 ,30,2,11/4/2017,0.09,3,1.0,156,"•Parties or Gatherings are not permitted. •Please be courteous to the neighbors and keep noise levels low, especially between the hours of 10pm-10am. •Absolutely no smoking in the apartment. Smoking only on the back porch •Overnight guests are not permitted unless included on the initial reservation. •Please help us conserve energy by turning off lights, small appliances, lamps, etc. when not being used.  •Please store recyclables separately. •Pets are not permitted at any time. •If you need flexibility around the specified check in or check out times, let us know in advance. •Owner is NOT responsible for any accidents, injuries or illness that occurs while on the premises or its facilities.",
44141489,Quiet  Clean Private Bedroom  Brooklyn,995787993,unconfirmed,Cristina,Brooklyn,Bensonhurst,40.61336,-73.9857,United States,US,False,strict,Private room,2019,$262 ,$52 ,3,11,6/8/2019,0.38,4,2.0,79,,
44142041,Room 202,27909317687,unconfirmed,T,Manhattan,Harlem,40.81847,-73.93956999999999,United States,US,False,strict,Private room,2005,$490 ,$98 ,1,105,7/5/2019,3.68,1,1.0,25,,
44142594,White space with 0min to bus stop,52420380311,verified,Nancy,Brooklyn,Clinton Hill,40.69482,-73.96419,United States,US,True,strict,Shared room,2004,$328 ,$66 ,1,197,6/22/2019,6.54,2,2.0,19,,
44143146,Williamsburg Penthouse w/ Private Roof,53668270875,verified,Jamil,Brooklyn,Williamsburg,40.707240000000006,-73.94379,United States,US,True,strict,Entire home/apt,2003,$474 ,$95 ,2,36,5/27/2019,1.19,1,1.0,0,,
44143698,Huge quiet modern oasis,16735206908,verified,Tal,Brooklyn,Prospect Heights,40.67915,-73.96913,United States,US,True,moderate,Entire home/apt,2010,"$1,165 ",$233 ,2,2,2/15/2018,0.11,2,1.0,0,#NAME?,
44144251,Taaffe Loft,60273279194,verified,Michael,Brooklyn,Bedford-Stuyvesant,40.69121,-73.95877,United States,US,True,flexible,Private room,2017,$560 ,$112 ,1,0,,,1,1.0,0,"just act like my friend in building and don't be mean to Jack, he's ugly I know but sweet and small.",
44144803,Pretty modern 3-B APT near Everything you want!,46066714220,unconfirmed,Yukee,Manhattan,Upper West Side,40.80007,-73.96524000000001,United States,US,True,strict,Entire home/apt,2003,$193 ,$39 ,1,4,10/24/2018,0.26,5,6.0,337,"House Rules  Please treat my home as if it were your own. Be respectful of me, my guests, and anyone you may encounter in the building.  No smoking (indoors or on the balcony). Please clean up after yourself, especially in the bathroom. Upon leaving, please put your trash in the chute and strip the linens of the bed. If you have any questions, please ask me. No parties or loud noises in the unit after 10 pm but the club lounge is 24 hours and you are welcome to relax and socialize on the 20th (URL HIDDEN) long as your respectful and not overly loud.   PLEASE ALSO BE MINDFUL OF NEIGHBORS.",
44145355,"Sunny Modern Apartment with Terrace, Near Subway",42164727983,verified,Sasha,Bronx,Mount Hope,40.85188,-73.90321,United States,US,True,moderate,Entire home/apt,2004,$245 ,$49 ,90,5,11/3/2018,0.2,1,7.0,94,,
44145907,Manhattan - Upper East Side - Entire Home,1827051337,unconfirmed,Yoko,Manhattan,Upper East Side,40.77102,-73.94671,United States,US,False,moderate,Entire home/apt,2022,$444 ,$89 ,1,1,1/16/2017,0.03,3,2.0,0,Smoking is strictly prohibited. Your pets are welcome but please mind them. NO PARTIES ALLOWED.  EXCESSIVE NOISE IS STRICTLY PROHIBITED.,
44146460,"Sleeps6+PRIV.TERRACE+laundry,Trains+BAM&Barclays",18550791794,verified,Tee,Brooklyn,Fort Greene,40.6869,-73.97454,United States,US,True,moderate,Entire home/apt,2010,$361 ,$72 ,3,11,6/30/2019,0.37,2,1.0,22,"Check-in is after 3PM Some general information about the apartment. Please try to keep it relatively quite, especially at night. Strict no parties or entertainment policy. No additional guests are allowed outside of reservation. No smoking inside the apartment or hallway. No pets allowed in the apartment. Unfortunately no young children as the house is not equipped for children under 10.   When making a booking - please have a verified email address and phone number on your airbnb account. Respect and treat the apartment as your own and how you would expect others to treat yours. Please communicate with us as soon as possible, should something go wrong during your stay, so we can try to fix it as soon as possible. Once you've confirmed the booking, please respect the apartment and don't hesitate to make it your own. We want you to feel like you are at home, so to sum it all up.. don't do things you wouldn't do at your own place We look forward to welcoming you and have a great time in ",
44147012,"Studio loft, Cosy and charming with rooftop view",54172747950,verified,Sammy & Chris,Brooklyn,Bushwick,40.69964,-73.93729,United States,US,True,flexible,Entire home/apt,2003,"$1,062 ",$212 ,2,103,7/7/2019,3.57,1,1.0,185,"Please do not smoke or do drugs in our home, and please do not have parties.  There is no glass allowed on the roof (which is on the 9th floor).",
44147564,Lavish studio in Downtown Manhattan,69119347790,verified,Danny,Manhattan,Financial District,40.70493,-74.01035999999999,United States,US,False,moderate,Entire home/apt,2022,$486 ,$97 ,2,123,7/2/2019,4.05,3,1.0,235,,
44148117,"Queen Room w/ Memory Foam, In-room TV and Rooftop",55625799168,verified,Christine,Manhattan,East Village,40.7229,-73.98476,United States,US,True,strict,Private room,2004,$314 ,$63 ,1,6,5/27/2019,0.2,4,1.0,9,"Please remember that this is a residential building.  All building rules, hotel occupancy restrictions, and year-round tenants must be respected.",
44148669,Spacious One Bedroom in Heart of West Village,37974927948,unconfirmed,Mike,Manhattan,West Village,40.73233,-74.00329,United States,US,True,strict,Entire home/apt,2003,"$1,108 ",$222 ,5,5,6/14/2019,0.17,1,1.0,13,,
44149221,Great for La Guardia airport guests.,53957980015,unconfirmed,Aleida,Queens,East Elmhurst,40.762240000000006,-73.8766,United States,US,True,strict,Private room,2021,$205 ,$41 ,1,128,7/3/2019,4.36,4,2.0,145,,
44149774,Sophisticated Retreat in Spacious Manhattan Apt,40543658700,verified,Elka,Manhattan,Washington Heights,40.8568,-73.93162,United States,US,False,moderate,Private room,2015,$835 ,$167 ,1,87,6/12/2019,2.97,1,1.0,83,,
44150326,Luxury High-Floor Oversized Studio w/ Park View,21206270619,verified,Micah,Manhattan,Harlem,40.803709999999995,-73.94377,United States,US,False,moderate,Entire home/apt,2007,"$1,050 ",$210 ,3,0,,,1,1.0,0,#NAME?,
44150878,"Luxury bedroom in a Cozy, Relaxed NYC Atmosphere!",49665430760,verified,Saphira,Manhattan,Upper West Side,40.80288,-73.96396,United States,US,True,moderate,Private room,2009,$72 ,$14 ,5,11,5/23/2019,0.76,5,2.0,134,#NAME?,
44151430,Rustic Modern Brooklyn Apartment,91564742414,verified,Tom,Brooklyn,Bedford-Stuyvesant,40.6915,-73.92881,United States,US,True,strict,Entire home/apt,2018,$294 ,$59 ,30,77,4/27/2019,2.53,3,2.0,0,#NAME?,
44151983,Cozy Private room in the heart of Jamaica New york,22753191701,unconfirmed,Stella,Queens,Jamaica,40.71107,-73.78429,United States,US,True,strict,Private room,2004,$399 ,$80 ,1,10,6/30/2019,0.54,3,1.0,175,,
44152535,Park Slope. The best community in Brookyn NY.,68847635411,verified,Ruth,Brooklyn,South Slope,40.66812,-73.98595,United States,US,False,flexible,Private room,2016,$398 ,$80 ,3,3,4/8/2019,0.4,1,1.0,5,,
44153087,Affordable cozy room rental in Flushing,41357255901,unconfirmed,Jackie,Queens,Flushing,40.7383,-73.80866999999999,United States,US,False,flexible,Private room,2019,$835 ,$167 ,1,9,5/18/2019,0.72,1,5.0,365,"No parties, smoking or pets. Feel free to enjoy the location and space, just be respectful, thank you! (My doorman will know if you are bringing people up to the apartment.)",
44153640,Huge Bedroom in Historic Harlem!,8754599302,verified,Michael,Manhattan,Harlem,40.81378,-73.95152,United States,US,False,moderate,Private room,2003,$757 ,$151 ,3,0,,,4,1.0,0,,
44154192,"Largest room, warehouse loft, prime Williamsburg",35925660814,unconfirmed,Octavio,Brooklyn,Williamsburg,40.71947,-73.96255,United States,US,True,flexible,Private room,2020,$65 ,$13 ,10,3,8/17/2018,0.1,3,1.0,0,#NAME?,
44154744,Artstuy,32404291813,unconfirmed,Jessie,Brooklyn,Bedford-Stuyvesant,40.68554,-73.94478000000001,United States,US,True,strict,Private room,2018,$966 ,$193 ,1,13,4/21/2019,0.45,1,2.0,268,NO Smoking Pets Allowed with Fee,
44155297,Landmarked 1899 Brownstone with private garden,62296976118,unconfirmed,Brad,Brooklyn,Bedford-Stuyvesant,40.68392,-73.93123,United States,US,True,moderate,Entire home/apt,2021,$505 ,$101 ,4,14,9/5/2017,0.5,4,1.0,0,"Please remember that this is a residential building. The building rules, apartment occupancy restrictions and the year-round tenants must be respected.  Parties, pets and smoking are not allowed under any circumstances and incur significant fees.",
44155849,"Cozy 1Br Apartment, Entire Place.",73123049052,unconfirmed,Joseph,Queens,Sunnyside,40.74201,-73.92096,United States,US,True,flexible,Entire home/apt,2022,$96 ,$19 ,2,91,6/16/2019,3.08,2,1.0,65,"Please remember that this is a residential building. The building rules, apartment occupancy restrictions and the year-round tenants must be respected.  Parties and smoking are not allowed under any circumstances and incur significant fees. Pets may be considered with pre-approval and an additional pet fee.",
44156401,Upscale King Bedroom Great Neighborhood in NYC,57895025730,verified,Shelley,Queens,Forest Hills,40.72645,-73.84079,United States,US,False,flexible,Private room,2021,$397 ,$79 ,1,34,6/23/2019,1.38,4,2.0,87,Professional building with professional behavior expectations!,
44156953,"Sunny, Clean, Nice bedroom available in Bushwick",70890608563,unconfirmed,Jonathan,Brooklyn,Bushwick,40.70677,-73.92043000000001,United States,US,True,strict,Private room,2012,$421 ,$84 ,3,91,6/23/2019,3.5,1,1.0,294,"We expect guests to treat our home as if it were their own. Be neat and clean, considerate, and respectful of both our home and our neighbors. There is NO smoking in the home, NO pets, NO drugs!!!",
44157506,COZY Bedroom in the heart of the Lower East Side!,20266854751,verified,Isaac,Manhattan,Civic Center,40.71391,-74.00489,United States,US,True,moderate,Private room,2008,$195 ,$39 ,1,11,11/5/2017,0.45,3,1.0,0,#NAME?,
44158058,Newly Renovated Bedroom in Bushwick/Ridgewood,92533088900,verified,Venice,Queens,Ridgewood,40.70538,-73.91322,United States,US,False,moderate,Private room,2019,$708 ,$142 ,1,0,,,4,1.0,0,,
44158610,Brooklyn Refuge-Private Bedroom w/ Sitting Room,28688982965,verified,Hildegaard,Brooklyn,South Slope,40.66489,-73.9805,United States,US,False,flexible,Private room,2008,$762 ,$152 ,2,35,6/23/2019,1.16,2,1.0,88,,
44159163,Trendy Artist Loft in Bushwick/East W'Burg,96833104703,verified,Jason,Brooklyn,Williamsburg,40.70267,-73.9364,United States,US,False,flexible,Entire home/apt,2022,$508 ,$102 ,4,68,6/3/2019,2.26,4,1.0,16,,
44159715,Vacation in Astoria,56030199822,unconfirmed,Nelli,Queens,Astoria,40.7566,-73.91974,United States,US,False,moderate,Private room,2007,$722 ,$144 ,1,0,,,4,1.0,0,,
44160267,Large Apartment near Central Park up to 4 people!,55445800947,verified,Justyna,Manhattan,East Harlem,40.79465,-73.94021,United States,US,False,flexible,Entire home/apt,2014,$264 ,$53 ,5,33,7/1/2019,1.18,5,1.0,35,,
44160820,Brooklyn Brownstone - Chic Garden Apartment,8291035598,unconfirmed,Oscar,Brooklyn,Bedford-Stuyvesant,40.67864,-73.9444,United States,US,False,strict,Entire home/apt,2010,$243 ,$49 ,2,122,6/16/2019,4.06,3,1.0,70,"Our check in time is 3pm. If you would like to check in earlier please let us know ahead of time.   We are happy to accomidate if possible, but do understand that we need some time to make sure your room is ready on your arrival.  Clean up after yourself & turn lights off on our roof deck.  It is a common space in the building.    There is No Smoking in the apartment or on the roof deck.  Please no guests without checking with us. We have some nosy neighbors so if they ask where you are staying please let them know with friends or family.  Some of our neighbors are not happy with us using AirBNB.   Thank you for helping us out!",
44161372,LUXURY Flatiron Highrise 1 BR/1 BA,72340844985,verified,Tommy,Manhattan,Midtown,40.74473,-73.99005,United States,US,True,strict,Entire home/apt,2005,$529 ,$106 ,2,0,,,5,1.0,0,,
44161924,Peaceful Bedroom with private balcony in LES,25879491833,verified,Nikki,Manhattan,Lower East Side,40.71875,-73.98349,United States,US,False,moderate,Private room,2014,"$1,020 ",$204 ,2,2,3/21/2018,0.12,5,1.0,0,,
44162476,The Paris Room. Énorme! Private ROOF access!,96155846260,unconfirmed,Tucker,Brooklyn,Bushwick,40.69102,-73.90526,United States,US,False,moderate,Private room,2016,$399 ,$80 ,2,38,6/22/2019,2.0,4,1.0,9,,
44163029,Modern Loft Style Apt in trendy Brooklyn,46524395096,verified,Salvatore,Brooklyn,Greenpoint,40.73693,-73.95506999999999,United States,US,False,strict,Entire home/apt,2011,$567 ,$113 ,3,28,5/5/2019,0.93,1,1.0,11,,
44163581,"Geek-Chic Full Apt in Sugar Hill, Manhattan!",36656543758,verified,James,Manhattan,Harlem,40.83088,-73.945,United States,US,True,strict,Entire home/apt,2019,$650 ,$130 ,47,5,10/12/2018,0.18,1,1.0,188,,
44164133,"Sunny Fun Bushwick BR w/Yard, ~175ft to Subway!",63721244180,unconfirmed,Amos,Brooklyn,Bushwick,40.70476,-73.92195,United States,US,False,flexible,Private room,2020,$326 ,$65 ,1,69,6/23/2019,2.35,4,3.0,87,,
44164686,Private Room in 2BR in Hip East Williamsburg,16781852750,verified,Kerry,Brooklyn,Williamsburg,40.70762,-73.94221,United States,US,True,strict,Private room,2007,$633 ,$127 ,3,2,1/17/2017,0.07,4,1.0,0,,
44165238,"Cozy Studio Apartment in Queens, NY",76041185839,unconfirmed,Roseann,Queens,Springfield Gardens,40.68132,-73.75403,United States,US,True,flexible,Private room,2020,"$1,057 ",$211 ,1,220,6/28/2019,7.23,1,1.0,319,,
44165790,"Cozy Space-Sunny Studio- Flatbush, Brooklyn",65813378423,unconfirmed,Cindy,Brooklyn,Flatlands,40.62562,-73.94255,United States,US,True,moderate,Entire home/apt,2004,$450 ,$90 ,3,4,4/16/2018,0.18,3,1.0,0,"Shoes off in the house, please! Turn A/C off when not home, and hand-wash the knives. Thanks :).",
44166343,"Huge room, sunlight, plants, books",32585163084,unconfirmed,Ian,Brooklyn,Williamsburg,40.70436,-73.94123,United States,US,True,strict,Private room,2013,$625 ,$125 ,2,14,6/29/2019,0.58,3,1.0,3,,
44166895,"Full floor, Newly renovated, Brooklyn brownstone",95254083219,verified,Todd & Ashta,Brooklyn,Bedford-Stuyvesant,40.685190000000006,-73.94176,United States,US,False,strict,Entire home/apt,2009,"$1,143 ",$229 ,2,111,6/24/2019,3.67,1,1.0,255,Parties and smoking are not allowed under any circumstances and incur significant fees. Pets may be considered with pre-approval and an additional pet fee.,
44167447,Spacious and Modern 2 Bedroom Apartment,32001106357,unconfirmed,Erika,Brooklyn,Bushwick,40.68994,-73.91556,United States,US,True,moderate,Entire home/apt,2016,$268 ,$54 ,2,113,6/22/2019,3.86,5,1.0,261,"In the building you are my guest, know my name and our unit at all times or they will throw you out.  they don't care if you are from airbnb or the king of England, you don't know who you are here with they toss you.  Don't make a problem for the doorman under any circumstances (being drunk and locked out, call me not him).  He can't get you in.   There are some high rollers in the building, act like you have been there before :) There are some nice common areas, just act like the upstanding business professional you are.",
44167999,Lovely BedStuy apartment w/ young professionals.,91380381372,verified,Vero,Brooklyn,Bedford-Stuyvesant,40.6849,-73.9289,United States,US,False,moderate,Private room,2015,$552 ,$110 ,1,0,,,5,1.0,0,,
44168552,"""Desirable Deal on The Park""",43746962733,verified,J,Manhattan,Harlem,40.797979999999995,-73.95052,United States,US,True,flexible,Private room,2019,"$1,016 ",$203 ,1,139,6/24/2019,4.59,1,2.0,0,"House Rules  Please treat my home as if it were your own. Be respectful of me, my guests, and anyone you may encounter in the building. Please do NOT mention airbnb and that you are renting the unit.  No smoking (indoors or on the balcony). Please clean up after yourself, especially in the bathroom. Upon leaving, please put your trash in the chute and strip the linens of the bed. If you have any questions, please ask me. No parties or loud noises in the unit after 10 pm but the club lounge is 24 hours and you are welcome to relax and socialize on the 20th (URL HIDDEN) long as your respectful and not overly loud.   PLEASE ALSO BE MINDFUL OF NEIGHBORS.",
44169104,"☼ Sunny, Charming Brooklyn Apt - Next to Train ☼",5989442517,unconfirmed,Milan,Brooklyn,Crown Heights,40.6714,-73.95546999999999,United States,US,True,flexible,Private room,2018,$840 ,$168 ,2,75,6/25/2019,2.56,3,1.0,275,,
44169656,Entire 1-bed home in midtown west,37378021515,unconfirmed,Laura,Manhattan,Hell's Kitchen,40.76585,-73.98507,United States,US,True,moderate,Entire home/apt,2018,$224 ,$45 ,3,15,7/27/2017,0.57,2,2.0,0,,
44170209,"""Oasis on The Park""",12729415569,unconfirmed,J,Manhattan,East Harlem,40.79656,-73.94818000000001,United States,US,True,flexible,Private room,2006,"$1,068 ",$214 ,1,148,6/23/2019,4.96,3,2.0,46,Smoking is strictly prohibited. Your pets are welcome but please mind them. NO PARTIES ALLOWED.  EXCESSIVE NOISE IS STRICTLY PROHIBITED,
44170761,"Cozy Studio Apt, 1 train stop from Manhattan",9436871876,unconfirmed,Carla,Brooklyn,Downtown Brooklyn,40.69467,-73.98339,United States,US,True,strict,Entire home/apt,2003,"$1,167 ",$233 ,7,0,,,2,1.0,0,Strictly no smoking on property. Your pets are welcome but please mind them. NO PARTIES ALLOWED.  EXCESSIVE NOISE IS STRICTLY PROHIBITED,
44171313,"SPACIOUS, trendy  Flatiron Apt-Traveler's Delight!",43588590924,verified,Matt,Manhattan,Kips Bay,40.73945,-73.98273,United States,US,True,strict,Entire home/apt,2018,$362 ,$72 ,2,2,12/16/2018,0.08,5,1.0,0,,
44171866,Private room with private entrance in Greenpoint!,28819106705,unconfirmed,Marie,Brooklyn,Greenpoint,40.738240000000005,-73.9537,United States,US,False,strict,Private room,2013,$119 ,$24 ,2,6,5/18/2019,0.27,2,1.0,364,"Please treat my home as if it were your own. Be respectful of me, my cleaning lady,and anyone you may encounter in the building. No smoking (indoors or on the balcony). Please clean up after yourself, especially in the bathroom. Upon leaving, please put your trash in the chute and strip the linens off the bed. If you have any questions, please ask me.",
44172418,Huge 2 Bed Apt with Private Bathrooms in UES!,62312654330,unconfirmed,Michael,Manhattan,Upper East Side,40.77486,-73.95296,United States,US,False,flexible,Entire home/apt,2011,$946 ,$189 ,30,6,5/18/2018,0.23,1,1.0,89,,
44172970,Cozy Shared Apartment!,21410334276,verified,Brandon,Manhattan,Harlem,40.81367,-73.93809,United States,US,True,strict,Private room,2013,$213 ,$43 ,1,41,5/27/2019,1.61,3,1.0,334,"Thank you for your reservation. By placing your reservation online you indicated that you accepted the terms and conditions which have been printed below.  Please review your reservation summary as below - then print, sign and return the agreement to:  (EMAIL HIDDEN) or fax it to (PHONE NUMBER HIDDEN) or  mail it to: Spare Suite, Inc., 119 Braintree Street, Suite 510, Boston, MA 02134, USA Upon receipt, we will send you the welcome document with check in instructions and how to get your keys. ------------------------------------------------------------------------ ------------------------------------------------------------------------ Terms of the Agreement: BOOKING AND REFUND POLICY Once booked your reservation is guaranteed for the check in and check out times and dates specified. All reservations must be paid in advance, in full for the entire period of stay.  All reservations are final, and NON REFUNDABLE UNDER ANY CIRCUMSTANCES.  If you feel you may need to cancel once booked, yo",
44173522,3A. Private Rm in Guesthouse Manhattan,25733590847,verified,Bobi,Manhattan,East Harlem,40.80715,-73.93834,United States,US,False,moderate,Private room,2006,$656 ,$131 ,1,98,4/15/2019,3.25,1,10.0,350,"Please no smoking in the house.  As we are working professionals we are hoping you can share this space while you visit and we'd love to chat with you, but no parties please.",
44174075,Room in Greenpoint,3195010893,unconfirmed,Maren,Brooklyn,Greenpoint,40.73362,-73.95983000000001,United States,US,False,flexible,Private room,2010,$641 ,$128 ,2,0,,,3,1.0,0,,
44174627,Private basement bedroom with queen bed,52032140080,unconfirmed,Natalia & Gustavo,Brooklyn,East Flatbush,40.64798,-73.94492,United States,US,False,flexible,Private room,2021,$481 ,$96 ,7,7,5/18/2019,0.23,4,2.0,348,- Check out by 10am,
44175179,Friendly place for most suitable for Bangladeshis,17482142612,unconfirmed,Manzoor,Queens,Richmond Hill,40.70162,-73.82349,United States,US,False,flexible,Private room,2010,$200 ,$40 ,1,0,,,2,1.0,0,"Please remember that this is a residential building. The building rules, apartment occupancy restrictions and the year-round tenants must be respected.  Parties, pets and smoking are not allowed under any circumstances and incur significant fees.",
44175732,Beautiful Apt in Brooklyn w/ Private roof,4353775573,verified,Monica,Brooklyn,Bedford-Stuyvesant,40.68693,-73.94579,United States,US,True,moderate,Entire home/apt,2008,$130 ,$26 ,3,0,,,1,1.0,0,Please pick up/drop packet with front desk concierge. ABSOLUTELY NO SMOKING!!,
44176284,Private Bedroom w/ En Suite in Shared Apartment,8097952180,unconfirmed,Justin,Brooklyn,Park Slope,40.67937,-73.98125999999999,United States,US,False,strict,Private room,2016,"$1,037 ",$207 ,7,0,,,3,1.0,0,"Please remember that this is a residential building. The building rules, apartment occupancy restrictions and the year-round tenants must be respected.  Parties and smoking are not allowed under any circumstances and incur significant fees. Pets may be considered with pre-approval and an additional pet fee.",
44176836,Beige Room in Rego Park,86044823402,verified,Iso,Queens,Rego Park,40.72755,-73.86199,United States,US,True,moderate,Private room,2008,$601 ,$120 ,1,131,6/6/2019,4.33,5,1.0,294,#NAME?,
