4850315,East Village Studio,72395423899,unconfirmed,David,Manhattan,East Village,40.72954,-73.98337,United States,US,False,flexible,Entire home/apt,2012,$431 ,$86 ,1,8.0,5/30/2016,0.18,1,1,120,"-Our one golden rule is: Please treat our space with respect (i.e. Clean up after yourself, be sure to lock the door when you leave, etc.)  -Absolutely NO SMOKING!!!! -We are fun-loving people, so we dont mind you having some friends over, but the above rule applies twofold in that scenario. -You're welcome to use dishes, appliances, etc in the kitchen, but we ask that you buy your own food/drinks rather than use ours. -No pets allowed (not our rule, our landlord's) -Upon checkout, please turn A/C units and lights off before leaving. -Feel free to ask us about the area-- we know it well and love to recommend!",
4850867,"Private room in Brooklyn, Calico Cat in the house!",92178018919,verified,Sayaka,Brooklyn,Bushwick,40.70213,-73.91471999999999,United States,US,True,strict,Private room,2019,$373 ,$75 ,1,43.0,11/19/2018,0.82,4,1,23,"Please note that we are a no smoking environment, and pets are only accepted in certain room types that have direct access to the outside. Please call ahead to make arrangements.",
4851419,Rare Find - Oversized 1BR in Williamsburg center,10023222255,unconfirmed,Nicole,Brooklyn,Williamsburg,40.70971,-73.96561,United States,US,True,moderate,Entire home/apt,2003,$471 ,$94 ,14,20.0,6/20/2019,0.43,5,1,368,"Please note that we are a no smoking environment, and pets are only accepted in certain room types that have direct access to the outside. Please call ahead to make arrangements. ",
4851972,"Awesome, Sunny Loft - Two Floors!",92490864625,unconfirmed,Andrew,Brooklyn,Greenpoint,40.72514,-73.95392,United States,US,True,moderate,Entire home/apt,2008,$937 ,$187 ,4,0.0,,,2,1,55,"1.  No loud music. 2. No parties. 3. No removal of items from the apartment unless expressly allowed by the host. 4.  Security deposit shall be claimed in the event of the following:   a. Damaged or soiled sheets, to the extent that they require replacement     b. Theft of items kept on and about the premises.    c. Unreturned keys.    d. Damage to the apartment or any part or item within and without the premises.    e. The presence of pets in the apartment, due to intent or negligence on the part of the guest and their party.    d. The presence of illicit or illegal substances, or illicit or illegal activities, on or about the premises",
4852524,Perfect apt in UES,81927460345,verified,Yas,Manhattan,Upper East Side,40.775690000000004,-73.95721,United States,US,True,moderate,Entire home/apt,2008,$867 ,$173 ,1,9.0,5/13/2019,0.24,5,2,6,,
4853076,汤母小屋,11378472895,verified,Dong Ming,Queens,Flushing,40.76435,-73.83211,United States,US,False,flexible,Private room,2013,$359 ,$72 ,1,3.0,5/19/2019,0.06,3,2,358,,
4853629,"Enjoy Central Park,",2997573748,verified,Yas,Manhattan,Upper East Side,40.77595,-73.95573,United States,US,False,flexible,Private room,2005,$316 ,$63 ,3,28.0,5/22/2019,0.55,5,2,306,"Please note that we are a no smoking environment, and pets are only accepted in certain room types that have direct access to the outside. Please call ahead to make arrangements. ",
4854181,The Red House,78492176369,verified,Megan,Brooklyn,Flatbush,40.6404,-73.9612,United States,US,True,flexible,Private room,2003,$910 ,$182 ,1,24.0,5/31/2017,0.52,1,1,55,,
4854733,A hop to La Guardia Airport in quiet College Point,93067148907,verified,Tommy,Queens,College Point,40.78631,-73.83923,United States,US,False,strict,Private room,2004,$646 ,$129 ,5,5.0,3/28/2019,0.47,2,1,113,"- Please keep the house exactly like you found it. Please don't leave a mess. Please don't leave things dirty. - If you use the bathroom, clean or wipe things down (there will be a cloth to wipe off excess water, etc.) - If you use the kitchen, please clean dishes and wipe things down as well - No guest allowed - you can meet friends at other venues - Shoes off in the apartment - please leave by the door. If you would like please bring some slippers. - Please keep things quiet after 10pm - If you smoke, you must go outside! NO smoking inside! - If you cook, turn the fan on above the stove - If you watch TV, turn it off when you are done. - Please use your common sense, and if you are not sure, ask... - Remember, this is my house - so try to treat it with respect. - if the parking pass is not returned, you will be charged the full amount of the deposit",
4855285,Spacious Private Room,52425144268,unconfirmed,Shula,Brooklyn,Midwood,40.6216,-73.95315,United States,US,True,flexible,Private room,2014,$566 ,$113 ,10,27.0,7/5/2019,0.5,1,1,292,"Please treat my place as your own. Turn off the lights, AC, fan, etc when you leave the apartment, and wash any kitchenware and dishes that you've used. Put used towels on the floor, so that I now they've been used.",
4855838,LUXURY MID-CENTURY MODERN LOFT SOHO,62771988339,verified,Fiona,Manhattan,SoHo,40.72177,-74.00356,United States,US,True,flexible,Entire home/apt,2007,"$1,068 ",$214 ,14,1.0,8/19/2017,0.04,2,1,50,- Please be respectful and polite to neighbors. There are downstairs tenants so please don't be noisy after 11pm. - Please turn off any lights and adjust down the thermostat to 55 before you depart or please turn off the AC window units/fans - Return keys to lockbox at end of stay. (There is a fee of $50 for each set of lost keys) - No animals - No smoking in the house (there is a backyard area) - Check in is at 4:00 pm (message for special requests) - Check out is at 12 noon,
4856390,Charming Private Bedroom in 2 Bedroom Apartment,16315967288,unconfirmed,Wesley William,Brooklyn,Williamsburg,40.708529999999996,-73.95368,United States,US,False,strict,Private room,2004,$321 ,$64 ,3,15.0,6/14/2019,0.57,1,1,20,,
4856942,PRIVATE SUNNY ROOM IN BUSHWICK!,65722340104,unconfirmed,Viva,Queens,Ridgewood,40.707390000000004,-73.91498,United States,US,False,moderate,Private room,2014,$159 ,$32 ,3,5.0,10/7/2015,0.09,2,1,142,"House Rules 1. Check-in is 4 pm local time. If the unit is ready earlier, we’ll let you know. Check-out is normally 11 am local time, but we’d be happy to extend it as long as we don’t have a cleaning scheduled. Just let us know.  2. All bookings require a security deposit of at least $300, which will be refunded within 7 days of your check-out. 3. For security measures we require all guests to provide proof of identification through ID verification on our own website. In order to check in we'll need a photo of your ID.  4. Our cancellation policy is as shown on our ad and defined by the site you are booking through.  5. Don’t let $300 go up in smoke. There's no smoking allowed in any Flatbook and a $300 fine for breaking this rule.  6. Unfortunately we don’t allow pets in any of our apartments. 7. Unless you’re staying in one of our specialty apartments, we don’t allow parties or excessive noise. 8. If we find the place very messy, we have to charge an extra $40 for every extra hour o",
4857495,Upper East Side Gem!,74798473161,verified,Daniel,Manhattan,Upper East Side,40.775459999999995,-73.95165,United States,US,True,flexible,Entire home/apt,2015,$284 ,$57 ,3,75.0,4/27/2019,1.44,3,1,218,,
4858047,Quaint One Bed Apartment on UES,6946558167,unconfirmed,Tom,Manhattan,Upper East Side,40.77537,-73.95029,United States,US,False,flexible,Entire home/apt,2009,$462 ,$92 ,4,147.0,6/23/2019,2.76,1,1,15,"Please expect to share the apartment with guests having various backgrounds. Be respectful and decent, also enjoy interacting with each other. Please dress descent in the house especially in and out of the shower.",
4858599,Harlem Studio w/ view!!,60555362587,verified,Jeremy,Manhattan,Harlem,40.81419,-73.95033000000001,United States,US,False,moderate,Entire home/apt,2017,"$1,044 ",$209 ,2,25.0,6/9/2019,0.52,1,1,166,,
4859152,Best location & Amazing view / Apt in Tribeca,7754854309,verified,Sol,Manhattan,Tribeca,40.71732,-74.00981,United States,US,False,strict,Entire home/apt,2022,"$1,197 ",$239 ,3,13.0,5/16/2019,0.36,1,1,201,,
4859704,"Sunny, modern 1BR in Crown Heights",44517771529,unconfirmed,David,Brooklyn,Crown Heights,40.67279,-73.96033,United States,US,False,moderate,Entire home/apt,2020,$201 ,$40 ,7,56.0,6/14/2019,1.05,5,1,-10,,
4860256,Cozy Studio Close to Everything,81037937758,unconfirmed,David,Brooklyn,Crown Heights,40.67777,-73.95130999999999,United States,US,True,moderate,Entire home/apt,2007,$777 ,$155 ,6,13.0,1/4/2019,0.26,5,1,313,,
4860808,Gramercy Park View Pied A Terre,59103383226,unconfirmed,Amie,Manhattan,Gramercy,40.73661,-73.98706,United States,US,True,strict,Entire home/apt,2017,$706 ,$141 ,7,0.0,,,1,1,226,,
4861361,Large 1 Bedroom in Brooklyn,65109701895,verified,Margaret,Brooklyn,Crown Heights,40.67477,-73.94960999999999,United States,US,False,flexible,Entire home/apt,2018,"$1,018 ",$204 ,1,0.0,,,4,1,305,#NAME?,
4861913,"Cozy Apt, Terrace in Williamsburg",17858805126,unconfirmed,Mateo,Brooklyn,Williamsburg,40.71505,-73.93936,United States,US,False,strict,Entire home/apt,2003,$159 ,$32 ,7,10.0,6/20/2016,0.22,2,1,102,,
4862465,BRAND NEW condo in Flushing!,4980101193,verified,Jia,Queens,Flushing,40.75784,-73.83181,United States,US,True,moderate,Entire home/apt,2019,"$1,088 ",$218 ,2,94.0,7/1/2019,3.4,1,3,133,1) No Smoking in property!!!  2) Do not slam doors!!! Close lightly Please!!! 3) No Shoes in house (except slippers) 4) Quiet down AFTER 10PM.,
4863018,Private BR in amazing neighborhood,72964168652,verified,Nicole,Brooklyn,Carroll Gardens,40.68138,-73.9926,United States,US,True,strict,Private room,2013,$971 ,$194 ,1,8.0,7/7/2019,0.16,2,1,51,"We are looking for quiet and respectful guests given that we have neighbors with young children. As a result, I would ask to please keep noise levels in the house at a minimum between 9pm and 8am (you can still cook and watch TV, etc. just don't go around moving furniture :)",
4863570,Easily accessible cozy room! R202,38302666119,unconfirmed,Sophie,Queens,Elmhurst,40.74602,-73.87338000000001,United States,US,False,strict,Private room,2018,$899 ,$180 ,1,95.0,7/2/2019,2.37,3,8,58,Please do not smoke. Be respectful of the other guests.,
4864122,Full Prospect Heights Brownstone!,31574122960,verified,Alex,Brooklyn,Prospect Heights,40.676759999999994,-73.96683,United States,US,False,strict,Entire home/apt,2018,$535 ,$107 ,1,2.0,1/3/2016,0.05,3,1,133,,
4864675,Modern Prime Williamsburg 1BR w/ Terrace & Views,82718928152,verified,Jay,Brooklyn,Williamsburg,40.7169,-73.95087,United States,US,False,strict,Entire home/apt,2013,"$1,164 ",$233 ,2,59.0,5/25/2019,1.2,3,1,-1,,
4865227,Charming Studio Apartment,70679803693,verified,Jordana,Manhattan,Upper West Side,40.7921,-73.97918,United States,US,True,moderate,Entire home/apt,2009,$495 ,$99 ,21,45.0,5/27/2019,0.86,2,2,242,,
4865779,Spacious and welcoming 1 bedroom apt,60998782763,verified,Kyala,Brooklyn,East Flatbush,40.653079999999996,-73.95109000000001,United States,US,True,strict,Entire home/apt,2010,$874 ,$175 ,2,67.0,6/14/2019,1.27,5,1,289,"I respectfull ask that you treat my home as you would a friend's home.  My house rules are just common sense and courtesy. 1.  No loud music. 2. No parties. 3. No removal of items from the apartment unless expressly allowed by the host. 5.  Apartment door must be kept locked at all times.  4.  Security deposit shall be claimed in full in the event of any of the following:   a. Damaged or soiled sheets, to the extent that they require replacement.    b. Theft of items kept on and about the premises.    c. Unreturned keys.    d. Damage to the apartment or any part or item within and without the premises.    e. The presence of pets in the apartment, due to intent or negligence on the part of the guest and their party.    d. The presence of illicit or illegal substances, or illicit or illegal activities, on or about the premises     f.  Failure to vacate the premises by the agreed check-out time",
4866331,Sun drenched art filled apartment,48518248236,unconfirmed,Mie,Manhattan,Financial District,40.710679999999996,-74.00713,United States,US,False,moderate,Entire home/apt,2003,$464 ,$93 ,5,0.0,,,1,1,40,,
4866884,"Spacious 2 Bedroom, 2 Bath, 5th Avenue Entire Apt",87283806924,verified,Andy And TJ,Manhattan,East Harlem,40.796409999999995,-73.94847,United States,US,True,strict,Entire home/apt,2005,$332 ,$66 ,30,6.0,2/14/2019,0.12,4,1,262,"House Rules 1. Check-in is 4 pm local time. If the unit is ready earlier, we’ll let you know. Check-out is normally 11 am local time, but we’d be happy to extend it as long as we don’t have a cleaning scheduled. Just let us know.  2. All bookings require a security deposit of at least $300, which will be refunded within 7 days of your check-out. 3. For security measures we require all guests to provide proof of identification through ID verification on our own website. In order to check in we'll need a photo of your ID.  4. Our cancellation policy is as shown on our ad and defined by the site you are booking through.  5. Don’t let $300 go up in smoke. There's no smoking allowed in any Flatbook and a $300 fine for breaking this rule.  6. Unfortunately we don’t allow pets in any of our apartments. 7. Unless you’re staying in one of our specialty apartments, we don’t allow parties or excessive noise. 8. If we find the place very messy, we have to charge an extra $40 for every extra hour o",
4867436,Boho Williamsburg Room W/ Private Entrance,13424473209,verified,Katherine,Brooklyn,Williamsburg,40.71735,-73.94465,United States,US,False,flexible,Private room,2005,$86 ,$17 ,2,49.0,6/15/2019,0.9,5,1,75,- No smoking inside the apartment - Checkout time is 11:00 am (a later time can be accommodated if it is available - but please ask ahead of time) - No Loud Music or Loitering outside the entrance after 10:00pm,
4867988,Private Room w/ Bath and Balcony,71526735312,verified,Adam,Brooklyn,Prospect Heights,40.67824,-73.96514,United States,US,False,moderate,Private room,2022,$232 ,$46 ,1,0.0,,,1,1,70,We except you to clean up after yourself and generally be respectful. Smoking should happen outside the house. Also please do not tap on the glass terrarium or play with the ball python. It is very timid and mostly wants to sleep.,
4868541,PRIME LOCATION - Beautiful 3BR Artist Oasis w/Deck,36941057466,verified,Bethany,Brooklyn,Williamsburg,40.71281,-73.95796,United States,US,False,flexible,Entire home/apt,2004,$133 ,$27 ,3,87.0,7/5/2019,1.63,4,3,304,Clean and no party,
4869093,Spacious Room in Apt with Backyard,81106600217,verified,Kanhar,Brooklyn,Bedford-Stuyvesant,40.6955,-73.94385,United States,US,True,moderate,Private room,2021,$943 ,$189 ,2,0.0,,,3,1,145,,
4869645,Beautiful Bushwick - 3BR Apartment,78178630543,verified,S.,Brooklyn,Bushwick,40.68594,-73.90653,United States,US,False,moderate,Entire home/apt,2008,$269 ,$54 ,3,198.0,6/9/2019,3.7,1,2,194,,
4870198,GORGEOUS 1BR IN MIDTOWN 1/15-1/19,35598993702,verified,Patrick,Manhattan,Hell's Kitchen,40.76263,-73.9887,United States,US,True,moderate,Entire home/apt,2012,$940 ,$188 ,1,0.0,,,5,1,405,Please remove the shoes in the house.,
4870750,*GALAXY* Spectacular 2 Bedroom - Spacious & Light!,73782189554,unconfirmed,Juliana,Manhattan,Upper West Side,40.78147,-73.98315,United States,US,False,moderate,Entire home/apt,2008,"$1,196 ",$239 ,30,13.0,6/15/2019,0.25,3,34,256,,
4871302,CHARMING TOWNHOUSE NEAR RSD PARK - STUDIO APT,37277536902,verified,Juliana,Manhattan,Upper West Side,40.78215,-73.98349,United States,US,True,moderate,Entire home/apt,2007,$939 ,$188 ,30,15.0,4/19/2019,0.31,1,34,277,"House Rules 1. Check-in is 4 pm local time. If the unit is ready earlier, we’ll let you know. Check-out is normally 11 am local time, but we’d be happy to extend it as long as we don’t have a cleaning scheduled. Just let us know.  2. All bookings require a security deposit of at least $300, which will be refunded within 7 days of your check-out. 3. For security measures we require all guests to provide proof of identification through ID verification on our own website. In order to check in we'll need a photo of your ID.  4. Our cancellation policy is as shown on our ad and defined by the site you are booking through.  5. Don’t let $300 go up in smoke. There's no smoking allowed in any Flatbook and a $300 fine for breaking this rule.  6. Unfortunately we don’t allow pets in any of our apartments. 7. Unless you’re staying in one of our specialty apartments, we don’t allow parties or excessive noise. 8. If we find the place very messy, we have to charge an extra $40 for every extra hour o",
4871854,LARGE ROOM IN A GREAT NEIGHBORHOOD,23573322757,verified,Jorge,Queens,Ditmars Steinway,40.77645,-73.90566,United States,US,True,moderate,Private room,2004,$749 ,$150 ,3,95.0,5/20/2019,1.75,4,1,233,We except you to clean up after yourself and generally be respectful. Smoking should happen outside the house.,
4872407,Relaxing Brooklyn Oasis - Prime Location,26720835736,verified,Jacqueline,Brooklyn,Crown Heights,40.67615,-73.95776,United States,US,False,flexible,Private room,2018,$799 ,$160 ,14,43.0,6/22/2019,0.8,5,1,278,,
4872959,East River view,2483761846,unconfirmed,Pia,Manhattan,Roosevelt Island,40.76193,-73.94941999999999,United States,US,False,strict,Private room,2004,$65 ,$13 ,3,43.0,5/28/2019,0.81,2,1,395,"House Rules 1. Check-in is 4 pm local time. If the unit is ready earlier, we’ll let you know. Check-out is normally 11 am local time, but we’d be happy to extend it as long as we don’t have a cleaning scheduled. Just let us know.  2. All bookings require a security deposit of at least $300, which will be refunded within 7 days of your check-out. 3. For security measures we require all guests to provide proof of identification through ID verification on our own website. In order to check in we'll need a photo of your ID.  4. Our cancellation policy is as shown on our ad and defined by the site you are booking through.  5. Don’t let $300 go up in smoke. There's no smoking allowed in any Flatbook and a $300 fine for breaking this rule.  6. Unfortunately we don’t allow pets in any of our apartments. 7. Unless you’re staying in one of our specialty apartments, we don’t allow parties or excessive noise. 8. If we find the place very messy, we have to charge an extra $40 for every extra hour o",
4873511,Stay in Harlem 1 - 3 months!,96558107263,unconfirmed,Michelle,Manhattan,Harlem,40.80535,-73.95407,United States,US,True,moderate,Private room,2014,$597 ,$119 ,30,1.0,5/3/2019,0.45,5,2,34,Please be respectful to the other roommate and clean after yourselves. We love this place and we want guests to have the same experience you have when they arrive.,
4874064,Beautiful Fort Greene Studio,95329418416,unconfirmed,Tarun,Brooklyn,Fort Greene,40.68752,-73.9795,United States,US,True,moderate,Entire home/apt,2009,$845 ,$169 ,31,1.0,1/21/2015,0.02,2,1,94,1) No Smoking in property!!!  2) Do not slam doors!!! Close lightly Please!!! 3) No Shoes in house (except slippers) 4) Quiet down AFTER 10PM.,
4874616,Spacious Room in Bushwick Brooklyn,1435163561,verified,Vincent,Brooklyn,Williamsburg,40.70898,-73.93285999999999,United States,US,False,moderate,Private room,2014,$57 ,$11 ,25,0.0,,,5,1,263,,
4875168,LUX Blg-Prime Area! Lg PRIVATE RM & BATH w/VIEWS!,43195325834,unconfirmed,Sonia,Manhattan,Hell's Kitchen,40.761590000000005,-73.99824,United States,US,True,flexible,Private room,2017,$424 ,$85 ,2,22.0,3/20/2019,0.64,1,2,45,- No excess noise after 11pm. - No recreational drugs. - No open flames.,
4875721,"Spacious Room at Broome St, LES",36390138800,unconfirmed,Dor,Manhattan,Chinatown,40.71723,-73.99164,United States,US,False,moderate,Private room,2013,$765 ,$153 ,4,36.0,6/4/2019,0.71,2,3,116,,
4876273,Furnished room in DUMBO/Fort Greene,79211219290,unconfirmed,Joyce,Brooklyn,Downtown Brooklyn,40.6978,-73.98396,United States,US,False,flexible,Private room,2010,$796 ,$159 ,1,0.0,,,2,1,62,"Orderly house and we want to keep it this way Bathrooms don't have high traffic as we agree to take shower before bed and not in the morning Everyone picks up after themselves No disturbance of any kind greatly appreciated:) but ASK ME (not other guests) questions any time you need/want to know something or unsure about how to do things, etc. Emails is the best way to communicate. When talking on the phone, please do it in your room with door closed Please walk calm, don't run the stairs, as it reduce the noise Close all doors gently please Non-smoker only Guests will be liable for any damages they caused: inspect the room upon arrival and sign the report Only food items can be placed into the kitchen sink compost disposal No smoking anywhere in/out of the house No perfume/cologne, scented laundry detergent allowed Doing laundry in a sink/bath not allowed Guests/visitors are not permitted Rescued/injured animals can be brought in for further assistance",
4876825,Charming 1BR near Union Square,68157134295,verified,Sal,Manhattan,Gramercy,40.73272,-73.9852,United States,US,False,flexible,Entire home/apt,2017,$491 ,$98 ,3,21.0,6/2/2019,0.4,5,1,378,,
4877377,Historic Upper West Side Townhouse,34957691274,unconfirmed,David,Manhattan,Upper West Side,40.796929999999996,-73.96348,United States,US,False,moderate,Entire home/apt,2015,"$1,029 ",$206 ,4,22.0,6/20/2019,0.42,1,1,257,No guests/visitors Storage not provided Limited number of things allowed:one-two suitcases The house is quiet and we want to keep it this way.  Please pick up after yourself and please keep toilet bowl and shower clean Toilet must be closed when not in use It is requested to take shower and do shaving before bed and keep morning bathroom time to the minimum: others are waiting  Additional toilet/sink is on the first floor.  No disturbance: please walk slowly on the stairs Keep phone conversation inside your room without using computer speakers,
4877930,Modern/Spacious 4BR +Tent Perfect for LARGE groups,96225323442,unconfirmed,Buddy,Bronx,Allerton,40.870540000000005,-73.84680999999999,United States,US,False,moderate,Entire home/apt,2013,$172 ,$34 ,2,45.0,7/2/2019,0.84,4,4,167,"Please expect to share the apartment with guests having various backgrounds. Be respectful and decent, also enjoy interacting with each other. Please dress descent in the house especially in and out of the shower.",
4878482,Cozy Room available in UES Apt,75470367858,unconfirmed,Ella,Manhattan,Upper East Side,40.772090000000006,-73.95083000000001,United States,US,False,moderate,Private room,2015,"$1,146 ",$229 ,1,0.0,,,5,1,344,No pets. No smoking.,
4879034,Big 2-story home in Brooklyn Hts.,51094444908,unconfirmed,Nick,Brooklyn,Brooklyn Heights,40.69119,-73.99438,United States,US,False,flexible,Entire home/apt,2015,$274 ,$55 ,2,8.0,10/24/2016,0.22,1,1,123,"There will be a small lockbox at the building entrance (on your left side if you are facing the door). The code for this lockbox will be send to you after you have confirmed your reservation. Inside the lockbox you will find 2 keys, one that works for both of the building doors ,and another for the apartment's door).  NO smoking. *We are not responsible for any accidents, injuries, or illness that occurs while on the premises; or for the loss of guests' personal belongings or valuables. By accepting this reservation, it is agreed that all guests are expressly assuming the risk of any harm to themselves arising from their use of the premises or to others whom they invite to use the premises.",
4879587,"Cozy Space in Harlem, Manhattan",37097763600,unconfirmed,Laksen & Nikki,Manhattan,Harlem,40.815490000000004,-73.95278,United States,US,True,moderate,Shared room,2012,"$1,077 ",$215 ,1,29.0,6/12/2019,0.62,3,1,77,,
4880139,Great Gramercy Share Apt,86344383982,unconfirmed,Courtney,Manhattan,Gramercy,40.73718,-73.98373000000001,United States,US,True,flexible,Private room,2011,$666 ,$133 ,5,0.0,,,5,1,376,,
4880691,NYC New Years Penthouse suite,68184548374,verified,Howard,Manhattan,Midtown,40.7655,-73.98018,United States,US,True,strict,Private room,2019,"$1,081 ",$216 ,3,1.0,11/11/2015,0.02,4,3,161,,
4881244,Wake Up In The City That Never Sleeps,53725366589,unconfirmed,Jane,Manhattan,East Village,40.73273,-73.98969,United States,US,True,strict,Private room,2018,$728 ,$146 ,1,14.0,5/26/2019,0.28,5,2,263,,
4881796,East Village Ageloff Towers,68414570966,verified,Darrin,Manhattan,East Village,40.725359999999995,-73.9856,United States,US,False,strict,Entire home/apt,2010,"$1,119 ",$224 ,1,0.0,,,5,1,295,,
4882348,"Simple, sweet in NOLITA-NYC",4198630975,unconfirmed,Alexa,Manhattan,Chinatown,40.71848,-73.99549,United States,US,False,moderate,Private room,2022,$245 ,$49 ,3,153.0,6/25/2019,2.9,2,1,249,"Nothing unusual, I expect that you clean after yourself (bathroom, kitchen...).  The building is calm, so no loud music or parties is allowed. Check-in time on week days will be limited to non-business hours (after 6pm).  Check-out time is whenever you want, unless I've other guest that are arriving.",
4882900,Great Prospect / Crown Heights 1BR,42193483281,unconfirmed,Will,Brooklyn,Crown Heights,40.67586,-73.9621,United States,US,True,moderate,Entire home/apt,2021,$556 ,$111 ,5,22.0,10/28/2015,0.42,4,1,232,1) No Smoking in property!!!  2) Do not slam doors!!! Close lightly Please!!! 3) No Shoes in house (except slippers) 4) Quiet down AFTER 10PM.,
