56075035,Sunny 2 bd + Private rooftop on best GP street,76486094980,unconfirmed,Megan & Matt,Brooklyn,Greenpoint,40.72831,-73.95634,United States,US,True,moderate,Entire home/apt,2009,$293 ,$59 ,3,2.0,3/23/2018,0.11,3.0,1.0,0,"Feedback is welcome--please let us know how we can improve your experience! Check in is 4-8 p.m. Early and late check-ins are possible, but must be requested in advance and are subject to availability.  Check out time is 11 a.m. Late check-out is possible upon request in advance subject to availability. Regretfully, the suite is not appropriate for children and we cannot accommodate them. Regretfully, for health and safety reasons, there is no smoking on the property. Regretfully, we cannot accommodate guest pets  14 days' cancellation notice or full charge for stay.  If you check out before the end of your reserved stay, the full amount of your stay will be charged.",
56075587,Private Room in Luxury Building,27314141395,unconfirmed,Myko,Manhattan,Financial District,40.704879999999996,-74.00744,United States,US,True,strict,Private room,2019,$258 ,$52 ,5,45.0,5/24/2019,1.4,4.0,2.0,272,"NO smoking, no parties, no large dogs. I expect that the house will be the way I left it for you :) (small dogs ok) ",
56076140,Luxury Building - Private Room,57722715501,unconfirmed,Myko,Manhattan,Financial District,40.70602,-74.00891,United States,US,True,flexible,Private room,2008,$569 ,$114 ,4,61.0,5/29/2019,1.9,3.0,2.0,246,"All guests must agree to the following:   1. The hallway going up to the penthouse is narrow. Take care not to make marks or scratches from suitcases on the walls. 2. No smoking anywhere on the premises or around the building.  3. The guest must keep the room clean. Please dispose of the garbage can bag upon checkout and leave the used towels and sheets in the white hamper at the foot of the bed.  4. Guests may use the washer and dryer in the basement, but clothes must be immediately removed from machines when done. Make sure to clean the lint tray on the dryer to avoid a risk of fire.  5. No additional guests are allowed to stay past 11:00 PM or sleep over. The room is designed for a single-person use only.  6. When using the bathroom, male guests are asked to sit or keep seats down and to clean the seat after each use. Guests must tidy the shower when done.  7. Guests may NOT place hot pans or cooking items on the marble counters without a trivet. There are two silicone trivets and a",
56076692,Beautiful Bedroom: Spacious & Sunny!,34551781061,verified,Yoseph & Malky,Brooklyn,Kensington,40.63725,-73.97345,United States,US,False,flexible,Private room,2016,$862 ,$172 ,1,74.0,6/30/2019,2.28,3.0,1.0,156,"Information for Your Stay at 46 Monument Avenue Charlestown, MA 02129 First, welcome and thank you for choosing my home for your stay in Boston. Please let me know if I can be of assistance in making your visit enjoyable and comfortable. Please be advised that there is absolutely no smoking in the house! Thank you for your cooperation.  If you are smoker and been caught smoking in the house you will be asked to leave and no refund.  Please do not smoke in front of the house or around the house. Arrival and Departure ·	Kindly remember to check out before 10:00 A.M. and check in after 4:00 P.M. ·	Most likely, I will say good-bye to you when you leave however should our schedules not match, please shut and lock all windows and doors when leaving nd make sure all lights are off. ·	After going out the black door, leave the keys in the mail slot. Internet and Cable 	For internet access, you will get this number when you arrive. Public Transportation and Getting Around ·	To use the subway (un",
56077244,2 family home. Top floor with private entrance way,62560309799,verified,Lydia,Brooklyn,East Flatbush,40.6418,-73.93947,United States,US,False,strict,Entire home/apt,2014,$221 ,$44 ,2,56.0,7/7/2019,1.82,4.0,1.0,85,"No pets and no smoking, please. No group parties and we kindly ask that you limit the number of people on the roof deck to a maximum of 4. Please be respectful of our neighbors below us and next to us and try to limit any noise after 10PM. Trash should be left in the unit, tied up and next to the barrel in the kitchen. The front door to the building can be tricky, so please double check and pull it shut so that it locks completely.",
56077797,One-Bedroom Brooklyn Brownstone,21312545636,verified,Mariam,Brooklyn,Bedford-Stuyvesant,40.68887,-73.92903000000001,United States,US,False,flexible,Entire home/apt,2012,"$1,027 ",$205 ,4,20.0,6/27/2019,1.81,3.0,1.0,14,,
56078349,Views !  - Unique penthouse in UWS,46419746205,verified,Michele,Manhattan,Upper West Side,40.80131,-73.97114,United States,US,True,strict,Entire home/apt,2016,"$1,143 ",$229 ,21,5.0,6/24/2019,0.19,3.0,1.0,0,"- cleaning, quiet, friendly, no drug, no smoking,",
56078901,Your home while you explore NYC! Near Central Park,70495905226,unconfirmed,Agnes,Manhattan,East Harlem,40.78918,-73.94651999999999,United States,US,True,strict,Entire home/apt,2019,$584 ,$117 ,7,17.0,9/17/2018,0.54,5.0,1.0,11,,
56079454,Perfect location: Central to everything!,86241407532,verified,Hyggens,Brooklyn,Bedford-Stuyvesant,40.68338,-73.95075,United States,US,True,moderate,Entire home/apt,2021,$638 ,$128 ,5,11.0,6/14/2019,0.44,4.0,1.0,298,,
56080006,Colorful Artist Loft w. your own Ocean Oasis,56096607131,unconfirmed,Claire,Brooklyn,Williamsburg,40.706340000000004,-73.95338000000001,United States,US,False,flexible,Private room,2019,$119 ,$24 ,5,17.0,4/30/2018,0.53,4.0,1.0,0,"- We live in a rowhouse that contains three units.  Please be respectful to our neighbors and keep the noise down - Past 11pm, please very quiet if you're still on the deck to respect our neighbors",
56080558,"2 Bedrooms apt,Modern New Renovated",18057951631,unconfirmed,Frank W,Brooklyn,Bay Ridge,40.63447,-74.02455,United States,US,True,flexible,Entire home/apt,2016,$865 ,$173 ,1,213.0,7/1/2019,6.55,2.0,1.0,314,,
56081110,Two-bedroom in the heart of Chelsea,85144219310,unconfirmed,Nissim,Manhattan,Chelsea,40.73975,-73.99848,United States,US,False,moderate,Entire home/apt,2005,$145 ,$29 ,3,2.0,11/27/2016,0.06,5.0,1.0,0,,
56081663,"SOMMwhere in NYC/ a unique, conscious artists loft",13104283673,unconfirmed,Fatima,Manhattan,Lower East Side,40.722970000000004,-73.98946,United States,US,True,strict,Private room,2009,"$1,145 ",$229 ,1,40.0,6/10/2019,1.27,2.0,2.0,62,"All guests must observe the following house rules: The hallways are narrow. Take care not to make marks or scratches from suitcases on the walls. Towels for the Rainbow Room are gray and can be found in the small night white nightstand next to the desk. Towels for the Marble Room are white and can be found in the closet. Beach, hand, and face towels are in the hallway mirrored dresser. Each bathroom has a hairdryer. No smoking anywhere on the premises or around the building.  The guest must keep the room clean. Please dispose of the garbage can bag upon checkout and leave the used towels and sheets in the hamper. Food is not allowed in rooms. Do not leave any food items or personal belongings in the  Guests may NOT place hot pans or cooking items on the marble counters without a trivet. Hot items may damage the counters and will be deducted from the security deposit.  Please ensure when you leave the property to place all dirty towels in the hampers provided in your closet. When using ",
56082215,Cozy Bedroom in a great location.,14496813554,verified,Linnette,Manhattan,East Harlem,40.78857,-73.94951999999999,United States,US,True,strict,Private room,2011,"$1,080 ",$216 ,3,20.0,6/10/2018,0.66,4.0,1.0,188,"Enjoy our home and your visit to this wonderful city! We ask that you respect our home and neighbors as you would your own.   Please no smoking in the house, no pets, no large social gatherings.",
56082767,Enjoy the city life without the noise,61041413141,unconfirmed,Tony,Queens,Queens Village,40.728159999999995,-73.73874,United States,US,False,strict,Entire home/apt,2014,$592 ,$118 ,30,0.0,,,1.0,2.0,180,,
56083320,Doorman 2 Windows City View Studio GYM W&D 5199,43987088922,verified,Jeremy & Laura,Manhattan,Theater District,40.76258,-73.98575,United States,US,False,strict,Entire home/apt,2016,"$1,151 ",$230 ,30,1.0,1/2/2017,0.03,4.0,96.0,309,"Relaxed environment, but keeping it clean is a priority. Smoking and alcohol are not allowed in the room. Smoking is not allowed anywhere in the building. No loud music or noise is allowed after 10pm.",
56083872,"Huge space across from park, easy to Manhattan",54266538123,verified,Megan,Brooklyn,Prospect-Lefferts Gardens,40.657759999999996,-73.96174,United States,US,False,strict,Private room,2016,$345 ,$69 ,20,3.0,4/30/2019,0.39,4.0,1.0,35,"No smoking or pets, please.",
56084424,Cozy. Clean. And affordable,1910288931,verified,Tony,Queens,Queens Village,40.72828,-73.73541999999999,United States,US,True,flexible,Private room,2014,"$1,086 ",$217 ,30,0.0,,,4.0,2.0,90,#NAME?,
56084977,MASTER BR/ SUITE ( PRIVATE BATHROOM ),67147686727,unconfirmed,Simone,Manhattan,East Harlem,40.7898,-73.94213,United States,US,True,strict,Private room,2018,$706 ,$141 ,5,59.0,7/2/2019,2.03,3.0,1.0,110,"This is our primary residence, so please treat it like you would your own house!",
56085529,Bright and Charming Private Room in Williamburg!,32648903471,unconfirmed,Naveen,Brooklyn,Williamsburg,40.71365,-73.96231999999999,United States,US,True,flexible,Private room,2022,$546 ,$109 ,3,,10/10/2018,0.38,1.0,1.0,188,"- cleaning, quiet, friendly, no drug, no smoking,",
56086081,Ponerse las Pilas - VIVO NYC!!!,21620412726,unconfirmed,The Wrights,Brooklyn,Bedford-Stuyvesant,40.68955,-73.95116999999999,United States,US,False,strict,Private room,2008,$102 ,$20 ,2,195.0,6/21/2019,6.01,4.0,3.0,40,"No smoking anywhere on the property is allowed including hallway, back porch, and driveway. Please take your shoes once you enter the apartment.",
56086633,"Sunny huge room, 15m away from Manhattan",38949268879,unconfirmed,Suri,Brooklyn,Sunset Park,40.658879999999996,-74.00044,United States,US,False,moderate,Private room,2009,$884 ,$177 ,1,2.0,6/25/2019,0.1,4.0,3.0,281,,
56087186,The Perfect Pied-à-Terre for You!!!,36474100248,verified,The Wrights,Brooklyn,Bedford-Stuyvesant,40.68908,-73.95545,United States,US,True,flexible,Private room,2018,$467 ,$93 ,2,171.0,6/20/2019,5.26,5.0,3.0,57,,
56087738,Spacious studio in Upper East Side,90094518276,unconfirmed,Priscilla,Manhattan,Upper East Side,40.77043,-73.95557,United States,US,False,flexible,Entire home/apt,2015,"$1,095 ",$219 ,3,2.0,6/9/2019,0.08,4.0,1.0,0,,
56088290,Wyndham Midtown Condo with Full Kitchen SPECIAL!,40347155176,verified,Wynpoints,Manhattan,Midtown,40.75365,-73.97151,United States,US,False,moderate,Private room,2019,$464 ,$93 ,3,8.0,2/13/2017,0.25,5.0,12.0,365,"*** It is a residential building with very nice and quiet atmosphere and we'll appreciate our guests considering it *** Pets are allowed - an extra cleaning fee may apply - please consult with us prior to booking. *** Smoking is absolutely prohibited in the apartment, the building public areas and outside-near the main entry doors - however lots of open gardens right near...",
56088843,King Sized Serenity,59119675250,unconfirmed,Kat,Brooklyn,Bushwick,40.700179999999996,-73.93858,United States,US,True,flexible,Private room,2018,$517 ,$103 ,3,1.0,11/15/2016,0.03,2.0,1.0,0,"All guests must observe the following house rules: The hallways are narrow. Take care not to make marks or scratches from suitcases on the walls. Towels for the Rainbow Room are gray and can be found in the small night white nightstand next to the desk. Towels for the Marble Room are white and can be found in the closet. Beach, hand, and face towels are in the hallway mirrored dresser. Each bathroom has a hairdryer. No smoking anywhere on the premises or around the building.  The guest must keep the room clean. Please dispose of the garbage can bag upon checkout and leave the used towels and sheets in the hamper. Food is not allowed in rooms. Do not leave any food items or personal belongings in the  Guests may NOT place hot pans or cooking items on the marble counters without a trivet. Hot items may damage the counters and will be deducted from the security deposit.  Please ensure when you leave the property to place all dirty towels in the hampers provided in your closet. When using ",
56089395,Serenity Near Time Square,34119044026,verified,Roshelle,Manhattan,Hell's Kitchen,40.75764,-73.98963,United States,US,True,strict,Private room,2013,$174 ,$35 ,2,0.0,,,5.0,1.0,0,"There is no smoking allowed anywhere on the property including back stairs or front driveway. Please take your shoes off once you enter the apartment. Also, disconnect toaster, coffee maker, and tea kettle after use. Thank you.",
56089947,Cozy Room Amazingly Located in Williamsburg !,33073602608,unconfirmed,Sophia And Shannon,Brooklyn,Williamsburg,40.70835,-73.955,United States,US,True,flexible,Private room,2005,$448 ,$90 ,3,4.0,7/30/2017,0.13,4.0,1.0,0,No smoking. No Pets. Please be mindful of noise levels while enjoying the outdoor space. No parties.,
56090500,"Beautiful Room close to JFK, La Guardia, LIR",70925995615,unconfirmed,Alphanso,Queens,Rosedale,40.67126,-73.72981999999999,United States,US,True,flexible,Private room,2012,$352 ,$70 ,2,4.0,10/22/2017,0.13,4.0,2.0,349,Please be respectful of the space and the other tenants in the building.  Please treat the space as it were your own.,
56091052,"Convenient to JFK, La Guardia Airport and Dining",76956854279,unconfirmed,Alphanso,Queens,Rosedale,40.671040000000005,-73.73006,United States,US,True,strict,Private room,2018,$98 ,$20 ,2,12.0,9/1/2018,0.37,1.0,2.0,355,"- First off, Thanks for choosing my home!  No pets, Sorry.  The house is not childproof space. There is NO smoking IN the home. (You can outside but please remove cigarette butts). If smoking is detected inside there will be a $250 charge for odor removal services.  Stairs leading to the apartment are NOT handicap accessible! Condo cannot accommodate any parties and so the house is available for the guests that have booked the house only. Please let me know if you would like guests. But, again, it is not available and cannot accommodate parties or events. Thank you for your understanding.",
56091604,Bright and Beautiful 1br Apartment in Little Italy,16260103778,unconfirmed,Seyhan,Manhattan,Little Italy,40.71819,-73.99786,United States,US,True,flexible,Entire home/apt,2006,$637 ,$127 ,6,6.0,5/27/2019,0.2,4.0,1.0,268,"No smoking, no parties or very loud music - we are in a quaint neighborhood near the Bunker Hill Monument.",
56092156,❤️ Beautiful/Spacious/Convenient BK Apartment!,12963207187,unconfirmed,Brett,Brooklyn,Bushwick,40.69688,-73.93396,United States,US,True,moderate,Private room,2016,"$1,126 ",$225 ,2,96.0,6/30/2019,2.93,2.0,1.0,36,No smoking. No pets.,
56092709,Cozy and spacious 1 BR near Columbia University,62279063978,verified,Victoria,Manhattan,Harlem,40.81736,-73.95294,United States,US,True,moderate,Private room,2009,$389 ,$78 ,3,49.0,5/24/2019,1.5,1.0,1.0,46,This is a quiet residential neighborhood. No partying or loudness please. No smoking in or around the premises. Please avoid wearing shoes in the carpeted parts of the house. Thank you!,
56093261,Quiet Private Bedroom with Full Size Bed in LES,25525566501,verified,Severine,Manhattan,Lower East Side,40.7209,-73.98428,United States,US,False,flexible,Private room,2016,$634 ,$127 ,2,16.0,12/10/2017,0.5,4.0,1.0,66,This is a quiet neighborhood where everyone lives in close proximity.  It is not an area for partying or loudness.  Please enjoy the outside patio but remember that there are neighbors close by. There should not be any smoking on or around the premises.,
56093813,2 TwinXL Beds Walk-To TIME SQUARE #ForReal,44283126189,verified,Nathan,Manhattan,Hell's Kitchen,40.76028,-73.98846,United States,US,False,moderate,Private room,2013,"$1,088 ",$218 ,1,140.0,6/17/2019,4.29,2.0,2.0,152,,
56094366,★Hip ★Subway 1 min ★Backyard  ★3Beds ★Huge ★Duplex,45403536169,verified,Anna,Brooklyn,Bedford-Stuyvesant,40.68915,-73.95245,United States,US,False,moderate,Entire home/apt,2012,$517 ,$103 ,5,77.0,6/20/2019,2.44,5.0,1.0,112,Owners live in the building so please be respectful - no parties.  No smoking is permitted in the building.,
56094918,Stylish Williamsburg One Bedroom Apartment,7525041060,unconfirmed,Liz,Brooklyn,Williamsburg,40.71585,-73.95325,United States,US,True,moderate,Entire home/apt,2006,$750 ,$150 ,30,8.0,4/16/2019,0.3,3.0,1.0,0,,
56095470,"Entire home in East Village, 2BD, Family friendly",57332673758,verified,Roman,Manhattan,East Village,40.72503,-73.97851,United States,US,False,flexible,Entire home/apt,2007,$921 ,$184 ,10,4.0,5/14/2019,0.53,4.0,1.0,16,Please treat my home as you would your own.,
56096023,"Classic Brklyn brick house w 2 bedrooms, sleeps 6.",251717017,unconfirmed,Tim,Brooklyn,Sunset Park,40.66451,-73.99342,United States,US,False,strict,Entire home/apt,2009,$731 ,$146 ,2,6.0,4/19/2019,0.2,4.0,1.0,18,,
56096575,A beautiful comfy & spacious room.,49834601118,unconfirmed,Francisca,Bronx,Longwood,40.82006,-73.90332,United States,US,False,strict,Private room,2006,$544 ,$109 ,2,77.0,7/7/2019,2.37,3.0,2.0,365,,
56097127,2 bedroom  apartment in front of prospect park,91119868920,verified,Jose,Brooklyn,Windsor Terrace,40.65237,-73.97365,United States,US,True,strict,Entire home/apt,2014,$242 ,$48 ,7,1.0,12/31/2017,0.05,1.0,2.0,210,,
56097679,Chic Bedford Studio,201784414,verified,Sophia,Brooklyn,Bedford-Stuyvesant,40.68561,-73.95430999999999,United States,US,True,flexible,Entire home/apt,2004,$535 ,$107 ,30,13.0,5/31/2019,0.41,5.0,1.0,220,"I have 2 very friendly pet rabbits. Those with allergies to rabbits (and often cats) are not recommended to stay here. No recreational drug use allowed. No smoking in or around the unit, or it's entry/exit ways, including the deck.  Check-out / check-in will be discussed once accepted as a guest. Guest will have their own alarm code.",
56098232,Glamorous upper west side Private room,716247377,unconfirmed,Moustafa,Manhattan,Upper West Side,40.795159999999996,-73.96813,United States,US,False,moderate,Private room,2013,$429 ,$86 ,1,117.0,6/9/2019,3.61,1.0,1.0,365,,
56098784,Cozy Top Floor Apartment in Lovely Astoria,95715087740,unconfirmed,Jane + Abe,Queens,Ditmars Steinway,40.77176,-73.90885,United States,US,False,moderate,Private room,2018,$505 ,$101 ,3,0.0,,,1.0,1.0,0,#NAME?,
56099336,"Super spacious LES apt, close to subway/good eats!",23043934350,verified,Kasey,Manhattan,Lower East Side,40.71206,-73.98824,United States,US,False,moderate,Private room,2010,$985 ,$197 ,5,0.0,,,2.0,1.0,0,"No smoking! If I smell smoke or if there is other evidence of smoking, you will forfeit your entire security deposit. Check in and check out time can be flexible depending upon the dates you are looking for and whether anyone else is staying. Unless we arrange otherwise, check in and check out is at noon. The cleaning fee covers two hours. If additional cleaning is required, you will be charged $50/hour, deducted from your deposit. Out of respect for my neighbors, I must insist upon no parties being held at my place. If my neighbor complains about a party happening, or if there is a big mess left at the place, you will forfeit your entire deposit. You agree to follow all of the rules of the building, including no smoking in the unit or on the balcony. Any issues with not following the building rules and you forfeit your entire deposit.",
56099889,3 bed duplex HUGE private deck/ PRIME Williamsburg,38337989504,unconfirmed,Teddie,Brooklyn,Williamsburg,40.71889,-73.95786,United States,US,True,strict,Entire home/apt,2022,$932 ,$186 ,5,15.0,5/19/2019,0.49,5.0,1.0,60,,
56100441,Luxurious Williamsburg Loft with Private Patio,30283883892,unconfirmed,Alvaro,Brooklyn,Williamsburg,40.718090000000004,-73.95283,United States,US,False,moderate,Entire home/apt,2008,$950 ,$190 ,5,1.0,11/13/2016,0.03,5.0,1.0,0,Just ask you to respect everything in apartment.  No parties please. Thank you,
56100993,Large unit in Prospect Park area townhouse,51900853368,verified,Kim & Rupert,Brooklyn,Prospect-Lefferts Gardens,40.659890000000004,-73.95385999999999,United States,US,True,flexible,Entire home/apt,2005,"$1,074 ",$215 ,2,96.0,5/29/2019,2.98,5.0,1.0,0,"There is no smoking allowed anywhere on the property including back stairs or front driveway. Please take your shoes off once you enter the apartment. Also, disconnect toaster, coffee maker, and tea kettle after use. Thank you.",
56101546,Beautiful & spacious apartment on Upper East Side,94303341083,verified,Alexandra,Manhattan,Upper East Side,40.76395,-73.96195999999999,United States,US,False,strict,Entire home/apt,2015,$322 ,$64 ,1,3.0,3/25/2018,0.1,1.0,1.0,0,#NAME?,
56102098,Doorman 2 Bed GYM DECK 5212,56067777282,unconfirmed,Jeremy & Laura,Manhattan,Murray Hill,40.74437,-73.97295,United States,US,True,strict,Entire home/apt,2012,$349 ,$70 ,30,4.0,1/14/2019,0.13,1.0,96.0,331,"All guests must observe the following house rules: The hallways are narrow. Take care not to make marks or scratches from suitcases on the walls. Towels for the Rainbow Room are gray and can be found in the small night white nightstand next to the desk. Towels for the Marble Room are white and can be found in the closet. Beach, hand, and face towels are in the hallway mirrored dresser. Each bathroom has a hairdryer. No smoking anywhere on the premises or around the building.  The guest must keep the room clean. Please dispose of the garbage can bag upon checkout and leave the used towels and sheets in the hamper. Food is not allowed in rooms. Do not leave any food items or personal belongings in the  Guests may NOT place hot pans or cooking items on the marble counters without a trivet. Hot items may damage the counters and will be deducted from the security deposit.  Please ensure when you leave the property to place all dirty towels in the hampers provided in your closet. When using ",
56102650,"Sixth Ave Chelsea, Studio Serviced Apartment",30885159616,verified,Ken,Manhattan,Chelsea,40.74565,-73.99183000000001,United States,US,True,strict,Entire home/apt,2022,$70 ,$14 ,30,1.0,12/8/2017,0.05,2.0,87.0,365,"- Very Important: please let us know your estimated arrival / departure times so that we can plan accordingly. Check out by default is before 12 pm and check in after 2 pm, unless we agree on different times. We will offer flexible check in / out times when possible but we need time between guests for a thorough cleaning.  - We always provide fresh bath towels - The beds will be made with fresh linens - The place will be clean (please leave your shoes near the door) - Feel free to use the fridge, microwave, toaster oven, dishwasher and stove - We are happy to provide directions / activities - It is a relaxed / informal setting, come as you are!",
56103202,"Cozy Bushwick room w/  balcony, Longterm avail.!",79781581363,unconfirmed,Coco,Brooklyn,Bushwick,40.69945,-73.92255,United States,US,True,moderate,Private room,2004,$534 ,$107 ,16,38.0,6/1/2019,1.21,4.0,1.0,192,,
56103755,Luxury Four-Bedroom/Six Bed Apt - Prime Chelsea,44557216324,verified,Jay,Manhattan,Chelsea,40.74407,-73.99365999999999,United States,US,False,flexible,Entire home/apt,2012,$482 ,$96 ,4,69.0,6/18/2019,2.13,1.0,1.0,280,"No candles, no smoking, no food in room, no private kitchen use.",
56104307,Stunning 1-Bedroom NYC Apartment on the River!,94442650453,unconfirmed,Kara,Manhattan,Hell's Kitchen,40.7617,-73.99762,United States,US,False,flexible,Entire home/apt,2020,$68 ,$14 ,30,2.0,9/17/2017,0.08,2.0,121.0,365,"Feedback is welcome--please let us know how we can improve your experience! Check in is 4-9 p.m. Early and late check-ins are possible upon request in advance, subject to availability. Check out time is 11 a.m. Late check-out is possible upon request in advance subject to availability. Regretfully, the suite is not appropriate for young children and we cannot accommodate them. Regretfully, for health and safety reasons, we cannot permit smoking on the property. Regretfully, we cannot accommodate pets ! week's cancellation notice or full charge. Discounted rates for weekly and longer stays.",
56104859,Large sunny room Williamsburg ten mins to City,83806763485,verified,Belinda,Brooklyn,Williamsburg,40.71512,-73.95655,United States,US,False,flexible,Private room,2017,$372 ,$74 ,2,29.0,10/30/2018,0.9,4.0,2.0,34,- $100 pet fee,
56105412,"SOHO,TRIBECA,LOFT,4500sqft.",90666286977,verified,Phenix,Manhattan,Tribeca,40.71634,-74.00505,United States,US,False,flexible,Entire home/apt,2006,$880 ,$176 ,2,4.0,9/15/2017,0.12,2.0,1.0,365,,
56105964,Big Sunny Room in Huge DUMBO Loft,44526062419,unconfirmed,Craig,Brooklyn,DUMBO,40.704159999999995,-73.98539,United States,US,False,moderate,Private room,2015,$472 ,$94 ,2,146.0,6/30/2019,4.52,1.0,1.0,62,#NAME?,
56106516,Duplex Penthouse between Union Sq and East Village,63514784119,unconfirmed,Nuno,Manhattan,East Village,40.73296,-73.98884,United States,US,True,moderate,Entire home/apt,2011,$889 ,$178 ,2,0.0,,,2.0,1.0,0,This is great place to enjoy Boston.  This property is not for large groups or gatherings. No pets,
56107069,"Bright, Cozy &  Quiet ""TreeFort""-type ONE bedroom",61165801516,unconfirmed,Matthew,Brooklyn,Williamsburg,40.71738,-73.94527,United States,US,False,strict,Entire home/apt,2011,$883 ,$177 ,4,11.0,1/4/2019,0.36,5.0,1.0,0,-No smoking -No guests except those registered in advance.  -House is not child friendly. No guests under 18 years old.  Only 2 guests can be accommodated.   -No pets!  -Quiet in common stairway /entranceway used by 3 tenants is required common courtesy. -Please remove shoes in the unit to minimize noise below. ,
